SupplierID,SupplierName,SupplierEmail,SupplierPhone,SupplierDescription
696,Gabtune,tburnhamsjb@sciencedaily.com,+1 704 630 0556,id pretium iaculis diam erat fermentum justo nec condimentum neque sapien placerat ante nulla justo aliquam quis
697,Edgewire,pwydjc@ustream.tv,+63 275 407 6153,interdum venenatis turpis enim blandit mi in porttitor pede justo eu massa donec
698,Quamba,jhamertonjd@joomla.org,+352 696 434 4911,porta volutpat quam pede lobortis ligula sit amet eleifend pede libero quis orci
699,Cogidoo,sneilanje@time.com,+62 172 842 2092,ipsum dolor sit amet consectetuer adipiscing elit proin risus praesent lectus vestibulum
700,Skyba,mjoaojf@cbsnews.com,+33 741 900 0045,dapibus duis at velit eu est congue elementum in hac habitasse platea dictumst morbi vestibulum velit id
701,Riffpath,ephilottjg@salon.com,+86 251 614 7865,hac habitasse platea dictumst etiam faucibus cursus urna ut tellus nulla ut erat id mauris vulputate elementum nullam
702,Jayo,charmstonjh@liveinternet.ru,+48 224 406 3979,mi integer ac neque duis bibendum morbi non quam nec dui luctus rutrum nulla tellus in sagittis dui
703,Tagopia,jgilmanji@usatoday.com,+57 443 461 6969,ac diam cras pellentesque volutpat dui maecenas tristique est et tempus semper est quam pharetra magna ac consequat metus sapien
704,Jabbersphere,prenzullojj@edublogs.org,+1 569 832 6104,mi in porttitor pede justo eu massa donec dapibus duis at velit eu
705,Devcast,jrowesbyjk@bluehost.com,+84 251 811 0053,vel augue vestibulum rutrum rutrum neque aenean auctor gravida sem praesent id massa id nisl venenatis lacinia aenean
706,Mydeo,mfearyjl@quantcast.com,+54 801 695 9651,aliquet ultrices erat tortor sollicitudin mi sit amet lobortis sapien sapien non
707,Avaveo,anorthoverjm@tumblr.com,+351 493 419 1372,sed vel enim sit amet nunc viverra dapibus nulla suscipit ligula in
708,Oyonder,rcastellonejn@behance.net,+212 644 850 3029,cum sociis natoque penatibus et magnis dis parturient montes nascetur ridiculus mus etiam vel augue vestibulum rutrum rutrum
709,Voonyx,aheveyjo@bing.com,+60 695 529 1665,in felis donec semper sapien a libero nam dui proin leo odio porttitor
710,Teklist,dbreckinjp@icio.us,+86 746 683 3521,condimentum id luctus nec molestie sed justo pellentesque viverra pede ac diam cras pellentesque volutpat dui maecenas tristique est
711,Edgeclub,rdanielssonjq@gravatar.com,+7 293 993 4068,faucibus orci luctus et ultrices posuere cubilia curae donec pharetra magna vestibulum
712,Browsedrive,nwrightamjr@nps.gov,+62 629 124 8421,nullam molestie nibh in lectus pellentesque at nulla suspendisse potenti
713,Gabtype,nmckimmiejs@studiopress.com,+420 767 911 0723,tempus vel pede morbi porttitor lorem id ligula suspendisse ornare consequat lectus in est risus auctor sed tristique in tempus
714,Voonder,pricoaldjt@princeton.edu,+351 836 435 1805,felis ut at dolor quis odio consequat varius integer ac leo pellentesque ultrices mattis odio donec vitae
715,Demizz,ftomblesonju@wp.com,+46 419 484 8246,tincidunt eu felis fusce posuere felis sed lacus morbi sem mauris laoreet ut rhoncus aliquet pulvinar sed
716,Oyope,nodgersjv@huffingtonpost.com,+880 754 842 1516,diam erat fermentum justo nec condimentum neque sapien placerat ante nulla justo aliquam quis turpis eget elit sodales scelerisque mauris
717,Zoomcast,jdonatijw@archive.org,+46 462 496 5925,ligula pellentesque ultrices phasellus id sapien in sapien iaculis congue vivamus metus arcu adipiscing molestie hendrerit at vulputate vitae nisl
718,Demimbu,hjoaojx@feedburner.com,+62 810 739 0389,molestie nibh in lectus pellentesque at nulla suspendisse potenti cras in purus eu magna vulputate
719,Jetwire,aivattsjy@themeforest.net,+95 732 188 6869,lobortis sapien sapien non mi integer ac neque duis bibendum morbi
720,Cogibox,nmcwhinniejz@apache.org,+86 300 476 4983,adipiscing lorem vitae mattis nibh ligula nec sem duis aliquam convallis
721,Livefish,lmargueritek0@phpbb.com,+1 147 726 0549,vel augue vestibulum ante ipsum primis in faucibus orci luctus et
722,Yamia,kgoblek1@elegantthemes.com,+33 857 586 5752,dictumst maecenas ut massa quis augue luctus tincidunt nulla mollis molestie lorem quisque ut erat curabitur gravida nisi
723,Livepath,lwetherellk2@wisc.edu,+55 725 685 8934,convallis nulla neque libero convallis eget eleifend luctus ultricies eu nibh quisque id justo sit amet sapien dignissim
724,Gabspot,cmcgrayk3@flickr.com,+7 582 994 8482,ultrices enim lorem ipsum dolor sit amet consectetuer adipiscing elit proin interdum mauris non ligula pellentesque
725,Roomm,tgaffneyk4@weebly.com,+46 358 570 6015,sed tincidunt eu felis fusce posuere felis sed lacus morbi sem mauris laoreet ut rhoncus aliquet pulvinar sed nisl
726,Ailane,rdunkleek5@123-reg.co.uk,+375 130 586 7785,nisi venenatis tristique fusce congue diam id ornare imperdiet sapien urna
727,Trilia,tsedgebeerk6@desdev.cn,+244 397 250 2443,ut volutpat sapien arcu sed augue aliquam erat volutpat in
728,Wikibox,kjannequink7@technorati.com,+967 903 217 5867,eleifend quam a odio in hac habitasse platea dictumst maecenas
729,Jabberbean,reeftingk8@comcast.net,+234 257 681 7326,sed interdum venenatis turpis enim blandit mi in porttitor pede
730,LiveZ,bewerk9@google.co.jp,+595 734 148 8444,quis libero nullam sit amet turpis elementum ligula vehicula consequat morbi a ipsum integer a nibh in quis justo maecenas
731,Youspan,rguntherka@reverbnation.com,+49 268 581 6258,at lorem integer tincidunt ante vel ipsum praesent blandit lacinia erat vestibulum sed magna at nunc
732,Mynte,lstephenskb@skype.com,+46 707 859 6546,est phasellus sit amet erat nulla tempus vivamus in felis eu sapien cursus vestibulum proin eu mi nulla ac enim
733,Ntag,jwadmankc@washington.edu,+351 238 439 9125,ac tellus semper interdum mauris ullamcorper purus sit amet nulla
734,Minyx,pwrightsonkd@usatoday.com,+7 784 894 0032,congue vivamus metus arcu adipiscing molestie hendrerit at vulputate vitae nisl aenean
735,Eazzy,rtriggelke@yahoo.com,+33 706 979 7237,justo etiam pretium iaculis justo in hac habitasse platea dictumst etiam faucibus cursus urna
736,Plajo,arichiekf@twitpic.com,+7 670 563 2040,nascetur ridiculus mus etiam vel augue vestibulum rutrum rutrum neque aenean auctor gravida sem praesent id massa id nisl
737,Tagcat,hsidneykg@dagondesign.com,+48 402 600 8946,dapibus augue vel accumsan tellus nisi eu orci mauris lacinia sapien quis libero nullam sit
738,Leexo,jjeannardkh@jalbum.net,+63 126 769 8770,morbi non lectus aliquam sit amet diam in magna bibendum
739,Mydeo,jhayeki@goo.gl,+7 731 405 6362,at feugiat non pretium quis lectus suspendisse potenti in eleifend
740,Youfeed,sglaviaskj@1688.com,+62 160 202 7424,etiam vel augue vestibulum rutrum rutrum neque aenean auctor gravida sem praesent id massa id nisl venenatis
741,Linkbuzz,vhillyattkk@imdb.com,+57 308 544 9164,vulputate vitae nisl aenean lectus pellentesque eget nunc donec quis orci eget orci vehicula condimentum curabitur in libero
742,Pixonyx,tanderbruggekl@elegantthemes.com,+351 114 115 2731,id ornare imperdiet sapien urna pretium nisl ut volutpat sapien arcu sed augue
743,Demivee,yscoggankm@histats.com,+62 853 383 6834,primis in faucibus orci luctus et ultrices posuere cubilia curae duis
744,Lajo,tmackettkn@soundcloud.com,+86 480 398 8102,amet eleifend pede libero quis orci nullam molestie nibh in lectus pellentesque at nulla suspendisse potenti cras
745,Fliptune,cjurnko@fotki.com,+55 823 585 3331,lacinia nisi venenatis tristique fusce congue diam id ornare imperdiet sapien urna pretium nisl ut volutpat sapien arcu sed
746,Bubblemix,mchallisskp@ox.ac.uk,+55 935 319 8252,justo lacinia eget tincidunt eget tempus vel pede morbi porttitor lorem id ligula suspendisse
747,Quaxo,jscullionkq@tripadvisor.com,+972 333 427 2640,quis augue luctus tincidunt nulla mollis molestie lorem quisque ut erat curabitur gravida nisi at nibh
748,Trudoo,mcaffkr@oakley.com,+86 938 220 3206,dictumst morbi vestibulum velit id pretium iaculis diam erat fermentum justo nec condimentum neque sapien placerat ante nulla justo
749,Gabvine,ttomaschkeks@sohu.com,+380 439 987 0075,odio curabitur convallis duis consequat dui nec nisi volutpat eleifend donec ut dolor morbi vel lectus in quam
750,Rhyzio,aplumsteadkt@about.com,+507 312 158 3324,morbi vestibulum velit id pretium iaculis diam erat fermentum justo nec condimentum neque sapien placerat ante nulla justo aliquam quis
751,Bubblebox,scapnerhurstku@cocolog-nifty.com,+86 596 101 2273,in hac habitasse platea dictumst etiam faucibus cursus urna ut tellus nulla ut
752,Aimbu,edenchkv@hhs.gov,+62 236 464 9489,sit amet turpis elementum ligula vehicula consequat morbi a ipsum integer a nibh in quis justo maecenas rhoncus
753,Geba,bissettkw@google.ru,+63 508 698 5061,interdum mauris non ligula pellentesque ultrices phasellus id sapien in sapien iaculis congue vivamus metus
754,Linktype,jfaradaykx@census.gov,+48 566 992 7419,sit amet consectetuer adipiscing elit proin risus praesent lectus vestibulum quam sapien varius ut blandit non interdum in ante
755,Blogspan,kromaoky@businessweek.com,+62 947 561 4777,rhoncus aliquam lacus morbi quis tortor id nulla ultrices aliquet maecenas leo odio condimentum id luctus nec molestie sed
756,Thoughtbridge,bbestmankz@jimdo.com,+387 180 106 6554,amet erat nulla tempus vivamus in felis eu sapien cursus
757,Fanoodle,cruzickal0@elegantthemes.com,+86 129 611 2925,nullam porttitor lacus at turpis donec posuere metus vitae ipsum aliquam non mauris morbi non lectus aliquam sit amet
758,Quimm,mmcneilleyl1@360.cn,+33 123 423 4801,platea dictumst aliquam augue quam sollicitudin vitae consectetuer eget rutrum at
759,Eabox,jmccurleyl2@indiegogo.com,+372 919 533 8757,etiam justo etiam pretium iaculis justo in hac habitasse platea dictumst etiam faucibus cursus urna ut
760,Gigaclub,pheishaml3@vk.com,+850 786 300 0955,a nibh in quis justo maecenas rhoncus aliquam lacus morbi quis tortor id nulla ultrices aliquet
761,Vinte,lcrickettl4@usgs.gov,+57 937 236 5411,id ornare imperdiet sapien urna pretium nisl ut volutpat sapien arcu sed augue aliquam
762,Skynoodle,dbellerbyl5@alibaba.com,+212 941 314 3674,volutpat eleifend donec ut dolor morbi vel lectus in quam fringilla rhoncus mauris enim leo rhoncus
763,Feedmix,rladburyl6@ted.com,+48 122 873 2439,condimentum neque sapien placerat ante nulla justo aliquam quis turpis eget elit sodales scelerisque mauris sit amet
764,Pixonyx,vsydel7@vistaprint.com,+86 938 581 2296,in magna bibendum imperdiet nullam orci pede venenatis non sodales sed tincidunt eu felis fusce posuere felis sed lacus morbi
765,Topicware,avandenhofl8@google.co.uk,+55 428 142 8518,montes nascetur ridiculus mus etiam vel augue vestibulum rutrum rutrum neque aenean auctor gravida sem
766,Voolith,hcluckiel9@over-blog.com,+380 335 961 5673,cum sociis natoque penatibus et magnis dis parturient montes nascetur ridiculus mus vivamus
767,Gigazoom,dwixeyla@whitehouse.gov,+86 439 480 2534,sit amet cursus id turpis integer aliquet massa id lobortis convallis tortor risus
768,Yabox,sblundanlb@dagondesign.com,+55 380 317 5604,nisi at nibh in hac habitasse platea dictumst aliquam augue quam sollicitudin vitae consectetuer eget rutrum at lorem
769,Twimm,baronowitzlc@unblog.fr,+86 884 992 4122,lacinia eget tincidunt eget tempus vel pede morbi porttitor lorem id ligula
770,Yakitri,sgeerlingld@youku.com,+46 513 514 2837,mauris enim leo rhoncus sed vestibulum sit amet cursus id turpis integer aliquet massa id
771,Yodoo,bwatchornle@last.fm,+358 398 258 0687,ac nulla sed vel enim sit amet nunc viverra dapibus nulla suscipit ligula in lacus curabitur
772,Dazzlesphere,lantognettilf@wikia.com,+54 709 603 2837,mi sit amet lobortis sapien sapien non mi integer ac neque duis bibendum morbi
773,Rhynyx,mwhitcherlg@youtube.com,+595 815 151 5085,tellus nisi eu orci mauris lacinia sapien quis libero nullam sit amet
774,Oodoo,sblakemanlh@lulu.com,+86 756 591 4793,maecenas tincidunt lacus at velit vivamus vel nulla eget eros elementum pellentesque
775,Eabox,pblakeneyli@webnode.com,+1  885 4268,semper rutrum nulla nunc purus phasellus in felis donec semper
776,Demivee,vpotteridgelj@businessinsider.com,+55 218 870 5855,in leo maecenas pulvinar lobortis est phasellus sit amet erat nulla tempus vivamus in felis eu sapien cursus vestibulum
777,Skajo,asolonlk@nba.com,+58 420 734 8990,ut nunc vestibulum ante ipsum primis in faucibus orci luctus et ultrices posuere cubilia curae mauris
778,Eamia,fstrickettll@jimdo.com,+267 352 604 9878,et magnis dis parturient montes nascetur ridiculus mus etiam vel augue vestibulum rutrum rutrum
779,Midel,mcolleerlm@jimdo.com,+48 851 310 8992,viverra diam vitae quam suspendisse potenti nullam porttitor lacus at turpis donec posuere metus vitae ipsum
780,Gabspot,dclampettln@seesaa.net,+62 279 178 2943,donec posuere metus vitae ipsum aliquam non mauris morbi non lectus
781,Fivespan,jhaquinlo@sohu.com,+63 501 798 0932,ultrices libero non mattis pulvinar nulla pede ullamcorper augue a suscipit nulla elit ac nulla sed vel enim
782,Voonte,dpyerlp@google.ca,+1 840 451 1002,luctus tincidunt nulla mollis molestie lorem quisque ut erat curabitur gravida nisi at nibh in
783,Linktype,tspatarilq@deliciousdays.com,+381 558 502 1264,nam congue risus semper porta volutpat quam pede lobortis ligula sit
784,Thoughtbeat,abellsonlr@ucoz.com,+86 804 917 8991,amet consectetuer adipiscing elit proin risus praesent lectus vestibulum quam sapien varius ut blandit non interdum in ante
785,Flashspan,ccordesls@apple.com,+974 739 962 7907,odio cras mi pede malesuada in imperdiet et commodo vulputate justo in blandit ultrices enim lorem
786,Wikizz,mquestierlt@salon.com,+81 204 580 9335,quis orci nullam molestie nibh in lectus pellentesque at nulla suspendisse potenti cras in purus eu magna
787,Voonix,mchastagnierlu@seesaa.net,+48 670 486 9850,varius ut blandit non interdum in ante vestibulum ante ipsum primis in faucibus orci luctus et ultrices posuere cubilia curae
788,Twitterlist,fsawleylv@oaic.gov.au,+62 560 726 5574,neque sapien placerat ante nulla justo aliquam quis turpis eget elit sodales scelerisque mauris
789,Abata,abloxholmlw@skype.com,+62 840 958 4237,platea dictumst etiam faucibus cursus urna ut tellus nulla ut erat id mauris vulputate elementum nullam varius nulla facilisi
790,Yakitri,jgraingelx@mediafire.com,+63 710 745 5396,leo odio condimentum id luctus nec molestie sed justo pellentesque viverra pede ac
791,Meemm,olosebiely@vk.com,+27 746 810 1778,aliquam lacus morbi quis tortor id nulla ultrices aliquet maecenas leo odio
792,Photospace,sracherlz@tripod.com,+33 443 755 9557,lacinia aenean sit amet justo morbi ut odio cras mi pede malesuada
793,Browsetype,mmalinm0@google.es,+33 944 336 4058,orci luctus et ultrices posuere cubilia curae duis faucibus accumsan odio curabitur convallis
794,Demivee,rliffm1@squarespace.com,+62 977 347 1367,nam congue risus semper porta volutpat quam pede lobortis ligula
795,Thoughtblab,aspickettm2@bloomberg.com,+62 681 252 6043,blandit mi in porttitor pede justo eu massa donec dapibus duis at velit
796,Innotype,ckarlikm3@un.org,+48 653 805 8235,dictumst aliquam augue quam sollicitudin vitae consectetuer eget rutrum at lorem integer tincidunt ante vel ipsum praesent
797,Photospace,sforsdykem4@fastcompany.com,+60 101 570 8432,odio porttitor id consequat in consequat ut nulla sed accumsan felis ut at
798,Skibox,drowterm5@imageshack.us,+375 483 372 8906,turpis donec posuere metus vitae ipsum aliquam non mauris morbi non lectus aliquam sit amet diam in
799,Meeveo,rtevelovm6@state.gov,+86 878 291 5834,blandit nam nulla integer pede justo lacinia eget tincidunt eget tempus vel pede morbi porttitor lorem id
800,Eare,abridem7@facebook.com,+234 346 773 6330,lorem vitae mattis nibh ligula nec sem duis aliquam convallis nunc proin at turpis a pede posuere nonummy integer non
801,Dabvine,mfatharlym8@1688.com,+46 571 914 6427,rhoncus aliquet pulvinar sed nisl nunc rhoncus dui vel sem sed sagittis nam congue risus
802,DabZ,mrichfordm9@about.com,+977 774 457 4606,nibh in lectus pellentesque at nulla suspendisse potenti cras in purus
803,Cogidoo,lhainsma@de.vu,+351 781 986 0404,morbi odio odio elementum eu interdum eu tincidunt in leo maecenas pulvinar lobortis
804,Voomm,rvittemb@shop-pro.jp,+7 114 484 0241,nec dui luctus rutrum nulla tellus in sagittis dui vel nisl duis
805,Jayo,bnokemc@irs.gov,+57 271 768 6010,curae duis faucibus accumsan odio curabitur convallis duis consequat dui nec nisi volutpat eleifend donec ut
806,Gigaclub,dreedemd@whitehouse.gov,+33 348 456 4659,vulputate luctus cum sociis natoque penatibus et magnis dis parturient montes nascetur ridiculus mus vivamus vestibulum sagittis
807,Fadeo,lsheasbyme@jalbum.net,+977 183 156 3794,convallis nunc proin at turpis a pede posuere nonummy integer non
808,Dazzlesphere,dbiernatmf@skyrock.com,+63 381 338 2255,consequat lectus in est risus auctor sed tristique in tempus sit amet sem fusce
809,Skibox,fbrearmg@4shared.com,+56 660 402 2562,cum sociis natoque penatibus et magnis dis parturient montes nascetur ridiculus mus vivamus vestibulum
810,Photofeed,schaineymh@amazon.de,+7 671 955 6143,dictumst etiam faucibus cursus urna ut tellus nulla ut erat
811,Vitz,emooremi@ucsd.edu,+86 359 203 7294,lectus pellentesque at nulla suspendisse potenti cras in purus eu magna vulputate luctus cum
812,Skajo,jsuttabymj@yandex.ru,+56 779 898 5514,dis parturient montes nascetur ridiculus mus etiam vel augue vestibulum rutrum rutrum neque aenean auctor
813,Jayo,bryalmk@sciencedaily.com,+62 588 594 4921,augue vestibulum rutrum rutrum neque aenean auctor gravida sem praesent
814,Aivee,jskedml@huffingtonpost.com,+62 253 832 1405,sed vel enim sit amet nunc viverra dapibus nulla suscipit
815,Blogpad,tedgleymm@hostgator.com,+850 249 567 9876,congue risus semper porta volutpat quam pede lobortis ligula sit amet eleifend pede libero quis orci nullam molestie nibh
816,Kamba,abodmanmn@typepad.com,+63 920 175 5488,justo etiam pretium iaculis justo in hac habitasse platea dictumst etiam faucibus cursus urna ut tellus nulla ut erat
817,Pixope,sbalfemo@bigcartel.com,+86 785 938 3147,nibh fusce lacus purus aliquet at feugiat non pretium quis lectus suspendisse potenti in eleifend quam a odio in hac
818,Quimba,csmithersmp@barnesandnoble.com,+66 275 681 2303,faucibus orci luctus et ultrices posuere cubilia curae duis faucibus accumsan odio curabitur
819,Trudoo,ebastardmq@1und1.de,+1 812 260 9102,natoque penatibus et magnis dis parturient montes nascetur ridiculus mus vivamus vestibulum sagittis sapien cum sociis natoque
820,Aivee,akennefickmr@com.com,+62 771 535 7728,in lectus pellentesque at nulla suspendisse potenti cras in purus eu magna vulputate luctus cum sociis natoque
821,Zoozzy,wmalenfantms@themeforest.net,+7 629 736 1854,duis mattis egestas metus aenean fermentum donec ut mauris eget
822,Fliptune,gjohantgesmt@imgur.com,+63 407 154 8102,enim in tempor turpis nec euismod scelerisque quam turpis adipiscing lorem vitae mattis nibh ligula nec sem duis aliquam convallis
823,Topiczoom,twilliamsmu@webmd.com,+81 784 955 4450,nullam porttitor lacus at turpis donec posuere metus vitae ipsum aliquam non mauris morbi non lectus aliquam sit
824,Voonte,rmussenmv@cnbc.com,+63 350 429 4069,posuere cubilia curae duis faucibus accumsan odio curabitur convallis duis consequat dui nec nisi
825,Yadel,qgummorymw@newyorker.com,+86 939 954 1927,donec semper sapien a libero nam dui proin leo odio porttitor id consequat in consequat ut nulla sed
826,Zoomcast,krenzullomx@pen.io,+86 457 225 9810,quis lectus suspendisse potenti in eleifend quam a odio in
827,Demizz,kdufermy@auda.org.au,+595 917 517 2224,mauris eget massa tempor convallis nulla neque libero convallis eget eleifend luctus ultricies eu nibh
828,Trudoo,callingtonmz@yale.edu,+86 957 602 3673,non mi integer ac neque duis bibendum morbi non quam nec dui luctus
829,Quamba,rgerrensn0@wired.com,+504 749 408 3048,eu felis fusce posuere felis sed lacus morbi sem mauris laoreet
830,Lazzy,mvaunn1@eventbrite.com,+62 336 587 6035,mi pede malesuada in imperdiet et commodo vulputate justo in blandit ultrices
831,Topiclounge,awallicen2@un.org,+1 653 423 4806,sapien arcu sed augue aliquam erat volutpat in congue etiam justo etiam pretium iaculis justo in hac
832,Aivee,apiochn3@disqus.com,+595 780 648 3748,nullam porttitor lacus at turpis donec posuere metus vitae ipsum aliquam non mauris morbi non lectus aliquam sit amet
833,Rhyzio,gworwoodn4@google.pl,+51 723 593 2575,consequat lectus in est risus auctor sed tristique in tempus sit amet sem fusce
834,Youfeed,gpretoriusn5@clickbank.net,+244 298 303 8476,et magnis dis parturient montes nascetur ridiculus mus vivamus vestibulum
835,Oozz,llilesn6@thetimes.co.uk,+33 683 951 0131,lorem ipsum dolor sit amet consectetuer adipiscing elit proin risus praesent lectus vestibulum quam sapien varius ut blandit
836,Meevee,ylockeryn7@twitpic.com,+66 954 761 0057,est congue elementum in hac habitasse platea dictumst morbi vestibulum velit
837,Fanoodle,smanzn8@oakley.com,+86 415 402 2931,ante vestibulum ante ipsum primis in faucibus orci luctus et ultrices posuere cubilia curae duis faucibus accumsan
838,Kare,pboullinn9@ibm.com,+62 358 978 7531,in hac habitasse platea dictumst aliquam augue quam sollicitudin vitae consectetuer eget rutrum at lorem integer
839,Jetpulse,trickardna@oracle.com,+86 424 771 2078,sit amet sapien dignissim vestibulum vestibulum ante ipsum primis in faucibus orci luctus et ultrices posuere cubilia curae nulla
840,Bubblebox,hgratrixnb@kickstarter.com,+53 308 166 8114,cras mi pede malesuada in imperdiet et commodo vulputate justo in blandit ultrices enim lorem
841,Fiveclub,apeartnc@imdb.com,+47 956 105 7052,dapibus augue vel accumsan tellus nisi eu orci mauris lacinia
842,Feedfire,okilgannonnd@webeden.co.uk,+46 591 916 3283,ante nulla justo aliquam quis turpis eget elit sodales scelerisque mauris sit amet eros suspendisse accumsan tortor quis turpis
843,Tazzy,avenartne@redcross.org,+81 340 431 8824,rutrum at lorem integer tincidunt ante vel ipsum praesent blandit lacinia
844,Twitterwire,eduddennf@paginegialle.it,+63 216 533 8097,mauris laoreet ut rhoncus aliquet pulvinar sed nisl nunc rhoncus dui vel sem sed sagittis
845,Wikibox,hfitzhenryng@slideshare.net,+30 418 136 3170,urna ut tellus nulla ut erat id mauris vulputate elementum nullam varius nulla facilisi cras non velit nec nisi
846,Realcube,fsegebrechtnh@edublogs.org,+7 805 464 2007,in hac habitasse platea dictumst maecenas ut massa quis augue luctus tincidunt nulla
847,Kwideo,fcastilleni@intel.com,+385 861 509 8445,nunc purus phasellus in felis donec semper sapien a libero nam dui proin leo odio porttitor id consequat in consequat
848,Wordpedia,cgossagenj@homestead.com,+53 292 308 9939,interdum mauris ullamcorper purus sit amet nulla quisque arcu libero rutrum ac lobortis vel dapibus at diam
849,Devshare,lfryattnk@sogou.com,+234 412 860 9692,sit amet eros suspendisse accumsan tortor quis turpis sed ante vivamus tortor duis mattis egestas metus aenean
850,Topdrive,rhudlestonnl@networkadvertising.org,+1 163 930 3478,augue vestibulum rutrum rutrum neque aenean auctor gravida sem praesent id massa id nisl
851,Centidel,marlettnm@china.com.cn,+55 996 384 1025,posuere cubilia curae duis faucibus accumsan odio curabitur convallis duis consequat dui nec nisi volutpat eleifend donec ut
852,Browsetype,eyearnenn@prweb.com,+63 597 626 4785,morbi porttitor lorem id ligula suspendisse ornare consequat lectus in est risus auctor sed
853,Photobug,amcreynoldno@theguardian.com,+55 710 809 7554,sapien cursus vestibulum proin eu mi nulla ac enim in tempor turpis nec euismod scelerisque quam turpis adipiscing lorem vitae
854,Vinder,esuttellnp@wordpress.com,+963 683 153 7029,ultrices libero non mattis pulvinar nulla pede ullamcorper augue a suscipit nulla elit ac nulla sed vel enim sit amet
855,Kamba,elambdennq@icio.us,+86 762 956 3011,aliquet pulvinar sed nisl nunc rhoncus dui vel sem sed sagittis
856,Zoomlounge,jgrigoroninr@mashable.com,+86 300 372 9030,aliquam erat volutpat in congue etiam justo etiam pretium iaculis justo in hac
857,Devpoint,aoshesnanns@utexas.edu,+375 549 925 5573,quam fringilla rhoncus mauris enim leo rhoncus sed vestibulum sit amet cursus id turpis integer aliquet massa id lobortis convallis
858,Fivechat,clenourynt@nationalgeographic.com,+86 790 262 9037,turpis nec euismod scelerisque quam turpis adipiscing lorem vitae mattis nibh
859,Podcat,myounienu@umich.edu,+55 763 922 6932,rutrum rutrum neque aenean auctor gravida sem praesent id massa id nisl
860,Mudo,aelstonenv@newsvine.com,+7 405 163 2562,primis in faucibus orci luctus et ultrices posuere cubilia curae duis
861,Thoughtmix,dismirnioglounw@cafepress.com,+63 263 259 1850,justo in blandit ultrices enim lorem ipsum dolor sit amet consectetuer adipiscing elit proin interdum mauris non ligula pellentesque
862,Skalith,pmallindernx@opensource.org,+86 479 515 7347,rhoncus sed vestibulum sit amet cursus id turpis integer aliquet massa
863,Oyonder,ccastilljony@stanford.edu,+1 801 671 3462,elit proin risus praesent lectus vestibulum quam sapien varius ut blandit
864,Jabberbean,kspringlenz@slate.com,+420 562 620 5524,tincidunt eu felis fusce posuere felis sed lacus morbi sem mauris laoreet ut
865,Ntags,fklosero0@macromedia.com,+57 888 706 0503,turpis integer aliquet massa id lobortis convallis tortor risus dapibus augue vel accumsan tellus
866,Riffwire,gcrusho1@edublogs.org,+7 810 866 6724,scelerisque mauris sit amet eros suspendisse accumsan tortor quis turpis sed ante vivamus tortor
867,Kaymbo,jwestburyo2@gnu.org,+7 257 413 7764,nec sem duis aliquam convallis nunc proin at turpis a
868,Zoozzy,oduigano3@gnu.org,+62 870 747 7751,nulla facilisi cras non velit nec nisi vulputate nonummy maecenas tincidunt lacus at velit vivamus
869,Kimia,hokeyo4@unblog.fr,+63 341 812 1932,mauris morbi non lectus aliquam sit amet diam in magna bibendum imperdiet nullam orci pede
870,Pixoboo,rludeo5@51.la,+62 447 496 1325,morbi porttitor lorem id ligula suspendisse ornare consequat lectus in est risus auctor
