SupplierID,SupplierName,SupplierEmail,SupplierPhone,SupplierDescription
350,Photolist,aflay9p@techcrunch.com,+7 595 891 6073,in hac habitasse platea dictumst morbi vestibulum velit id pretium iaculis diam erat fermentum
351,JumpXS,cpavinese9q@homestead.com,+1 319 728 1787,sapien cursus vestibulum proin eu mi nulla ac enim in tempor turpis nec euismod
352,Mybuzz,ajorio9r@oakley.com,+86 956 984 4070,suspendisse ornare consequat lectus in est risus auctor sed tristique in tempus
353,Oozz,chessentaler9s@bizjournals.com,+420 952 397 1760,justo nec condimentum neque sapien placerat ante nulla justo aliquam quis turpis eget elit sodales
354,Leexo,cyouel9t@domainmarket.com,+62 520 898 2151,ante ipsum primis in faucibus orci luctus et ultrices posuere cubilia curae donec pharetra magna vestibulum aliquet ultrices
355,Oodoo,wcunio9u@1und1.de,+62 460 727 9282,pretium iaculis diam erat fermentum justo nec condimentum neque sapien placerat ante nulla justo aliquam quis
356,Realfire,icromett9v@t-online.de,+84 425 486 1227,in faucibus orci luctus et ultrices posuere cubilia curae donec pharetra magna vestibulum aliquet ultrices erat tortor sollicitudin
357,Wordtune,tcastilla9w@lulu.com,+93 965 784 2719,magnis dis parturient montes nascetur ridiculus mus vivamus vestibulum sagittis sapien cum sociis natoque
358,Eimbee,myakovliv9x@bandcamp.com,+380 133 823 3724,massa quis augue luctus tincidunt nulla mollis molestie lorem quisque ut erat curabitur gravida nisi at nibh
359,Eidel,zcritchard9y@cpanel.net,+976 863 789 3074,vitae nisi nam ultrices libero non mattis pulvinar nulla pede ullamcorper
360,Jaxspan,sdelia9z@vistaprint.com,+992 246 762 7772,cursus urna ut tellus nulla ut erat id mauris vulputate elementum nullam varius nulla facilisi cras
361,Meembee,amullera0@walmart.com,+62 823 993 5833,viverra diam vitae quam suspendisse potenti nullam porttitor lacus at turpis donec posuere metus vitae ipsum aliquam
362,Skiba,cgaylorda1@nbcnews.com,+359 347 493 9661,nisl duis ac nibh fusce lacus purus aliquet at feugiat non pretium quis lectus suspendisse potenti in eleifend quam a
363,Cogibox,mchidwicka2@com.com,+86 822 271 2368,a feugiat et eros vestibulum ac est lacinia nisi venenatis tristique fusce congue diam id ornare imperdiet sapien
364,Bluezoom,femora3@wired.com,+62 135 118 3809,vitae consectetuer eget rutrum at lorem integer tincidunt ante vel ipsum praesent blandit lacinia erat vestibulum sed magna at
365,Zoozzy,jglasmana4@dyndns.org,+86 983 396 2784,et commodo vulputate justo in blandit ultrices enim lorem ipsum dolor sit amet consectetuer adipiscing elit proin interdum mauris non
366,Mynte,broskellya5@youtube.com,+976 482 662 2231,at velit eu est congue elementum in hac habitasse platea dictumst morbi vestibulum velit
367,Yabox,douthwaitea6@globo.com,+86 553 111 1409,libero non mattis pulvinar nulla pede ullamcorper augue a suscipit nulla elit ac nulla sed vel enim
368,Pixoboo,abattershalla7@pcworld.com,+7 918 895 1094,imperdiet et commodo vulputate justo in blandit ultrices enim lorem ipsum dolor sit amet consectetuer adipiscing
369,Mudo,gcullingwortha8@phpbb.com,+86 414 170 2012,interdum mauris ullamcorper purus sit amet nulla quisque arcu libero rutrum ac lobortis
370,Quimba,nsalvagea9@skype.com,+7 647 383 2832,ipsum integer a nibh in quis justo maecenas rhoncus aliquam lacus morbi
371,Oyoba,roleahyaa@myspace.com,+62 354 367 0170,id pretium iaculis diam erat fermentum justo nec condimentum neque sapien placerat ante nulla justo aliquam quis turpis
372,Abata,fvlachab@nhs.uk,+420 447 679 5891,maecenas tristique est et tempus semper est quam pharetra magna ac consequat metus sapien ut nunc vestibulum ante ipsum
373,Feedbug,sgotcliffac@example.com,+55 303 709 6935,nisl aenean lectus pellentesque eget nunc donec quis orci eget orci vehicula condimentum curabitur in libero ut massa volutpat convallis
374,Zoonder,acrombiead@microsoft.com,+7 109 801 4985,fusce lacus purus aliquet at feugiat non pretium quis lectus suspendisse potenti in eleifend quam a odio in hac habitasse
375,Oyoyo,mffoulkesae@sciencedirect.com,+62 172 814 2525,lorem vitae mattis nibh ligula nec sem duis aliquam convallis nunc proin at turpis a pede posuere nonummy integer non
376,Kazio,afossaf@ebay.co.uk,+48 978 538 0590,pharetra magna vestibulum aliquet ultrices erat tortor sollicitudin mi sit amet lobortis sapien sapien non
377,Wikizz,jivesonag@myspace.com,+261 812 443 0510,donec vitae nisi nam ultrices libero non mattis pulvinar nulla pede ullamcorper augue a suscipit nulla elit
378,Zooveo,nsanchesah@ted.com,+675 979 822 3233,platea dictumst aliquam augue quam sollicitudin vitae consectetuer eget rutrum at lorem integer tincidunt ante vel ipsum
379,Ainyx,chymersai@e-recht24.de,+66 633 289 6126,nulla nunc purus phasellus in felis donec semper sapien a libero nam dui
380,Jayo,shattrickaj@w3.org,+968 479 954 5318,nulla integer pede justo lacinia eget tincidunt eget tempus vel pede morbi porttitor lorem id ligula suspendisse ornare consequat lectus
381,Thoughtstorm,teingerfieldak@liveinternet.ru,+351 544 799 8976,ipsum primis in faucibus orci luctus et ultrices posuere cubilia curae
382,Dazzlesphere,vcannanal@t-online.de,+1 729 812 1957,donec posuere metus vitae ipsum aliquam non mauris morbi non lectus aliquam sit
383,Innotype,bgobeauxam@google.pl,+351 607 837 1926,nulla elit ac nulla sed vel enim sit amet nunc viverra dapibus nulla suscipit ligula in lacus curabitur
384,Quatz,jdellowan@comcast.net,+62 529 723 4931,mi nulla ac enim in tempor turpis nec euismod scelerisque quam turpis adipiscing lorem vitae mattis nibh ligula nec sem
385,Eidel,gwoodyeareao@tripadvisor.com,+86 925 117 4410,vehicula consequat morbi a ipsum integer a nibh in quis justo maecenas rhoncus
386,Edgeify,mumbertap@statcounter.com,+86 316 230 3779,nonummy integer non velit donec diam neque vestibulum eget vulputate ut ultrices vel augue vestibulum ante ipsum primis in
387,Reallinks,pmarryattaq@infoseek.co.jp,+351 583 834 6002,curae nulla dapibus dolor vel est donec odio justo sollicitudin ut suscipit a feugiat et eros vestibulum ac est
388,Mynte,jstephensar@issuu.com,+977 194 143 9049,praesent lectus vestibulum quam sapien varius ut blandit non interdum in ante vestibulum ante ipsum primis in
389,Feedmix,emcphelimas@ed.gov,+962 712 189 0276,sed accumsan felis ut at dolor quis odio consequat varius integer ac
390,Fliptune,aseabornat@ezinearticles.com,+62 594 547 9447,nisi volutpat eleifend donec ut dolor morbi vel lectus in quam fringilla
391,Skinix,hsalmonsau@howstuffworks.com,+267 631 692 8191,sit amet sapien dignissim vestibulum vestibulum ante ipsum primis in faucibus orci luctus et
392,Quaxo,llambertciorwynav@wix.com,+86 907 370 1826,mus vivamus vestibulum sagittis sapien cum sociis natoque penatibus et magnis dis parturient montes nascetur
393,Tagopia,fcollinwoodaw@blinklist.com,+86 557 204 9434,morbi non lectus aliquam sit amet diam in magna bibendum imperdiet nullam
394,Feednation,bdarrelax@youtu.be,+63 607 136 8506,nisi volutpat eleifend donec ut dolor morbi vel lectus in quam
395,Yakidoo,bsiemianowiczay@freewebs.com,+92 163 545 8403,pede ac diam cras pellentesque volutpat dui maecenas tristique est
396,Leenti,okulvearaz@deviantart.com,+212 302 591 9337,orci luctus et ultrices posuere cubilia curae mauris viverra diam vitae quam suspendisse potenti nullam porttitor lacus at
397,Meezzy,mrankcomb0@jigsy.com,+62 625 736 3906,duis aliquam convallis nunc proin at turpis a pede posuere nonummy
398,Quinu,ajosifovicb1@reuters.com,+355 141 549 2414,dolor sit amet consectetuer adipiscing elit proin interdum mauris non ligula pellentesque ultrices phasellus id
399,Kwideo,agarnulb2@goo.gl,+92 371 140 2894,imperdiet et commodo vulputate justo in blandit ultrices enim lorem ipsum dolor sit amet consectetuer adipiscing elit
400,Jabbersphere,dridgersb3@flickr.com,+48 231 192 2791,mi sit amet lobortis sapien sapien non mi integer ac neque duis bibendum morbi non quam nec dui luctus rutrum
401,Wordtune,fbainsb4@yandex.ru,+86 127 840 4805,diam in magna bibendum imperdiet nullam orci pede venenatis non sodales sed tincidunt eu felis fusce
402,Yoveo,htreacherb5@prlog.org,+86 480 592 6614,ante vel ipsum praesent blandit lacinia erat vestibulum sed magna at nunc commodo placerat
403,Plajo,qmacredmondb6@umn.edu,+994 980 765 2747,in porttitor pede justo eu massa donec dapibus duis at velit eu est congue elementum in hac habitasse
404,Buzzbean,aoloughlinb7@jiathis.com,+86 760 148 3989,varius integer ac leo pellentesque ultrices mattis odio donec vitae nisi nam ultrices libero non
405,Dabshots,cimpsonb8@sbwire.com,+267 461 109 1133,justo maecenas rhoncus aliquam lacus morbi quis tortor id nulla ultrices aliquet
406,Skivee,lfoulghamb9@toplist.cz,+86 490 518 2868,non mattis pulvinar nulla pede ullamcorper augue a suscipit nulla elit ac nulla sed vel enim sit
407,Blogtag,bajeanba@yahoo.co.jp,+62 302 769 0262,rutrum nulla nunc purus phasellus in felis donec semper sapien a libero nam dui
408,Einti,ffischerbb@360.cn,+86 555 875 3799,at nunc commodo placerat praesent blandit nam nulla integer pede justo lacinia eget tincidunt eget tempus vel pede
409,Eimbee,mclewesbc@theatlantic.com,+33 456 779 7800,proin at turpis a pede posuere nonummy integer non velit
410,Abata,sdimmockbd@stumbleupon.com,+256 216 631 3919,risus auctor sed tristique in tempus sit amet sem fusce consequat nulla nisl nunc nisl duis bibendum felis sed interdum
411,Latz,apeakbe@amazon.co.jp,+86 338 419 7695,odio consequat varius integer ac leo pellentesque ultrices mattis odio donec vitae
412,Twitterbeat,rallpressbf@google.com.hk,+1 940 208 9999,sagittis dui vel nisl duis ac nibh fusce lacus purus aliquet at feugiat non pretium quis lectus suspendisse potenti in
413,Shufflester,dvinebg@google.de,+63 353 184 3898,cubilia curae mauris viverra diam vitae quam suspendisse potenti nullam porttitor lacus at
414,Dabvine,msimmsbh@eepurl.com,+92 447 677 2696,tellus semper interdum mauris ullamcorper purus sit amet nulla quisque arcu libero rutrum ac lobortis vel dapibus at diam
415,Flipbug,msnedkerbi@google.com.hk,+33 658 290 3244,at turpis donec posuere metus vitae ipsum aliquam non mauris
416,Devpulse,gsaulbj@msu.edu,+1 201 399 1287,maecenas ut massa quis augue luctus tincidunt nulla mollis molestie lorem quisque ut erat curabitur gravida nisi at nibh in
417,Abatz,tjunebk@ezinearticles.com,+86 221 753 5397,nunc nisl duis bibendum felis sed interdum venenatis turpis enim blandit mi in porttitor pede justo eu massa
418,Tagopia,againfortbl@netscape.com,+351 440 177 0585,libero non mattis pulvinar nulla pede ullamcorper augue a suscipit nulla elit ac nulla sed
419,Voolith,aalywinbm@alexa.com,+57 329 606 1699,pretium iaculis justo in hac habitasse platea dictumst etiam faucibus cursus
420,Topiclounge,mcrosbybn@fastcompany.com,+66 256 724 2641,erat tortor sollicitudin mi sit amet lobortis sapien sapien non mi integer ac
421,Dynabox,sboyfieldbo@topsy.com,+86 547 363 2794,turpis enim blandit mi in porttitor pede justo eu massa donec dapibus duis at velit eu est congue elementum in
422,Skyndu,blenniebp@ft.com,+52 859 447 6728,lacus at velit vivamus vel nulla eget eros elementum pellentesque quisque porta volutpat erat quisque erat eros
423,Gabcube,lanwellbq@rakuten.co.jp,+81 605 929 7454,lacus morbi quis tortor id nulla ultrices aliquet maecenas leo odio condimentum id luctus nec
424,Ozu,gmincinibr@cyberchimps.com,+33 606 927 3949,placerat ante nulla justo aliquam quis turpis eget elit sodales scelerisque mauris sit amet eros suspendisse accumsan
425,Jaloo,askeelesbs@pagesperso-orange.fr,+7 890 377 4320,vel nisl duis ac nibh fusce lacus purus aliquet at feugiat non pretium quis lectus
426,Twinte,apindellbt@scientificamerican.com,+48 988 917 1103,arcu sed augue aliquam erat volutpat in congue etiam justo
427,Einti,hclougherbu@loc.gov,+46 506 844 7522,in sagittis dui vel nisl duis ac nibh fusce lacus purus aliquet at
428,Skyndu,sconstantinebv@alexa.com,+84 723 182 0288,eu interdum eu tincidunt in leo maecenas pulvinar lobortis est phasellus sit
429,Quinu,lpfefferbw@myspace.com,+420 110 864 4654,suscipit a feugiat et eros vestibulum ac est lacinia nisi venenatis tristique fusce congue diam id ornare imperdiet
430,Dynabox,voxherdbx@netvibes.com,+86 403 440 7280,urna ut tellus nulla ut erat id mauris vulputate elementum nullam varius nulla
431,Tavu,ctabbernorby@phpbb.com,+252 552 952 4770,lorem ipsum dolor sit amet consectetuer adipiscing elit proin risus praesent lectus vestibulum quam sapien varius
432,Brainsphere,ucrookallbz@last.fm,+33 219 176 4659,volutpat convallis morbi odio odio elementum eu interdum eu tincidunt
433,Yozio,vlemmensc0@nhs.uk,+54 373 696 8936,eleifend pede libero quis orci nullam molestie nibh in lectus pellentesque at
434,Shuffletag,eraisherc1@joomla.org,+7 689 483 6721,donec posuere metus vitae ipsum aliquam non mauris morbi non lectus aliquam sit amet diam in magna
435,Lazzy,lfrogleyc2@canalblog.com,+1 859 755 8157,volutpat quam pede lobortis ligula sit amet eleifend pede libero quis orci nullam molestie nibh in lectus
436,Ooba,vcoughlinc3@tripadvisor.com,+381 709 815 2569,dui vel sem sed sagittis nam congue risus semper porta volutpat quam pede lobortis ligula
437,Babbleset,rbocockc4@unicef.org,+385 108 353 8037,orci mauris lacinia sapien quis libero nullam sit amet turpis elementum ligula vehicula consequat morbi a ipsum
438,Avaveo,dgerardc5@samsung.com,+62 456 250 8908,in hac habitasse platea dictumst aliquam augue quam sollicitudin vitae consectetuer eget
439,Oloo,mjaggerc6@kickstarter.com,+66 496 944 0769,imperdiet sapien urna pretium nisl ut volutpat sapien arcu sed augue aliquam erat volutpat in congue etiam justo etiam pretium
440,Brainsphere,hwhicherc7@netlog.com,+351 772 985 9614,magna vestibulum aliquet ultrices erat tortor sollicitudin mi sit amet lobortis sapien sapien non mi integer
441,Oyoba,lstanistreetc8@google.co.jp,+86 680 335 4939,est lacinia nisi venenatis tristique fusce congue diam id ornare imperdiet sapien urna
442,Yacero,ksouthcombc9@businessinsider.com,+86 932 257 1157,mattis nibh ligula nec sem duis aliquam convallis nunc proin
443,Jaloo,bcloggca@ask.com,+377 759 673 5768,ultrices enim lorem ipsum dolor sit amet consectetuer adipiscing elit proin interdum mauris non ligula pellentesque
444,Wikivu,tbomfieldcb@hc360.com,+55 468 637 7192,nulla justo aliquam quis turpis eget elit sodales scelerisque mauris sit amet eros suspendisse accumsan tortor
445,Yotz,ltaborrecc@usatoday.com,+380 755 477 5266,consectetuer adipiscing elit proin risus praesent lectus vestibulum quam sapien varius ut blandit non interdum in
446,Fivespan,ogidleycd@ftc.gov,+62 206 380 8671,libero quis orci nullam molestie nibh in lectus pellentesque at nulla suspendisse potenti cras in purus eu magna
447,Chatterbridge,amcchruiterce@marriott.com,+62 956 717 8304,aliquet maecenas leo odio condimentum id luctus nec molestie sed justo pellentesque viverra
448,Kare,ntouhigcf@gnu.org,+33 939 710 3331,lacus at turpis donec posuere metus vitae ipsum aliquam non
449,Flashspan,gcastellancg@wikipedia.org,+64 511 978 3530,erat quisque erat eros viverra eget congue eget semper rutrum nulla nunc purus phasellus
450,Tagtune,tgraserch@list-manage.com,+7 847 102 0717,parturient montes nascetur ridiculus mus vivamus vestibulum sagittis sapien cum sociis natoque
451,Chatterpoint,kdublinci@gizmodo.com,+53 749 726 5918,vestibulum sagittis sapien cum sociis natoque penatibus et magnis dis parturient montes nascetur ridiculus mus etiam vel
452,Gabtype,bsertincj@shutterfly.com,+374 755 614 9733,pretium iaculis justo in hac habitasse platea dictumst etiam faucibus cursus urna ut tellus nulla ut erat id mauris
453,Fivespan,lhickissonck@pbs.org,+86 731 264 8073,convallis nunc proin at turpis a pede posuere nonummy integer non velit donec diam neque vestibulum eget vulputate
454,Wikizz,ivonsalzbergcl@tripadvisor.com,+351 183 353 3020,libero convallis eget eleifend luctus ultricies eu nibh quisque id justo sit amet sapien
455,Babbleblab,jsamplecm@blog.com,+7 456 388 8672,integer aliquet massa id lobortis convallis tortor risus dapibus augue vel accumsan
456,Thoughtbeat,rpedlowcn@rediff.com,+86 315 725 3906,maecenas tristique est et tempus semper est quam pharetra magna ac consequat metus sapien ut nunc vestibulum ante ipsum
457,Kimia,czarfatico@yahoo.co.jp,+86 971 110 8663,aenean fermentum donec ut mauris eget massa tempor convallis nulla
458,Kare,cvickermancp@discovery.com,+351 958 727 9388,est phasellus sit amet erat nulla tempus vivamus in felis eu sapien cursus vestibulum proin
459,Mydo,tbenoitoncq@surveymonkey.com,+351 452 216 4755,leo odio condimentum id luctus nec molestie sed justo pellentesque
460,Youfeed,sboobiercr@archive.org,+971 909 331 8871,sollicitudin vitae consectetuer eget rutrum at lorem integer tincidunt ante vel
461,Skynoodle,gcoltancs@delicious.com,+86 360 832 3848,sed sagittis nam congue risus semper porta volutpat quam pede lobortis ligula sit amet eleifend pede libero
462,Brainverse,sfoanct@usnews.com,+36 227 879 8875,consequat morbi a ipsum integer a nibh in quis justo maecenas rhoncus
463,Jaloo,aweatheycu@ucoz.com,+86 207 686 9407,sapien placerat ante nulla justo aliquam quis turpis eget elit sodales scelerisque mauris sit amet eros suspendisse accumsan tortor quis
464,Blogtags,pshilburnecv@wired.com,+86 414 742 9890,pellentesque volutpat dui maecenas tristique est et tempus semper est quam pharetra magna ac
465,Yacero,mrimingtoncw@salon.com,+62 507 782 7199,suspendisse ornare consequat lectus in est risus auctor sed tristique in tempus sit amet sem fusce consequat
466,Youfeed,jslanecx@engadget.com,+351 998 222 9307,vivamus vel nulla eget eros elementum pellentesque quisque porta volutpat
467,Mynte,fcarluccicy@oakley.com,+962 280 868 0002,libero ut massa volutpat convallis morbi odio odio elementum eu interdum eu tincidunt in leo maecenas pulvinar lobortis
468,Avamm,ribbittcz@surveymonkey.com,+62 156 878 7916,curae donec pharetra magna vestibulum aliquet ultrices erat tortor sollicitudin mi sit amet lobortis
469,Fliptune,pcregind0@prnewswire.com,+62 157 508 0565,proin eu mi nulla ac enim in tempor turpis nec euismod scelerisque quam turpis adipiscing lorem vitae
470,Edgeify,byesinovd1@plala.or.jp,+27 866 634 1681,tortor quis turpis sed ante vivamus tortor duis mattis egestas metus aenean fermentum donec
471,Linkbridge,dsongistd2@discovery.com,+48 744 352 9283,vel lectus in quam fringilla rhoncus mauris enim leo rhoncus sed vestibulum
472,Voonix,gpeytond3@comsenz.com,+7 818 156 5567,augue quam sollicitudin vitae consectetuer eget rutrum at lorem integer tincidunt ante vel ipsum
473,Browsezoom,rborgarsd4@moonfruit.com,+86 690 649 0453,tortor id nulla ultrices aliquet maecenas leo odio condimentum id luctus nec molestie sed justo
474,Tazzy,codgaardd5@ucoz.ru,+226 595 863 6213,amet cursus id turpis integer aliquet massa id lobortis convallis tortor risus dapibus augue vel accumsan tellus nisi
475,Trudeo,mcottrilld6@github.io,+222 160 866 5143,est et tempus semper est quam pharetra magna ac consequat metus sapien ut nunc vestibulum ante ipsum primis in faucibus
476,Skyble,rrimingtond7@census.gov,+62 920 116 1162,ullamcorper augue a suscipit nulla elit ac nulla sed vel enim
477,Blogspan,rdalleyd8@census.gov,+241 764 736 2821,feugiat et eros vestibulum ac est lacinia nisi venenatis tristique fusce congue diam id ornare imperdiet sapien urna pretium
478,Wikizz,brounsefulld9@squarespace.com,+51 460 793 5150,augue a suscipit nulla elit ac nulla sed vel enim sit amet nunc viverra dapibus
479,Blogpad,kmccarronda@cyberchimps.com,+86 459 481 2285,erat id mauris vulputate elementum nullam varius nulla facilisi cras non velit nec nisi vulputate nonummy maecenas tincidunt lacus at
480,Linkbridge,jpowleslanddb@bloomberg.com,+1 695 645 7645,curae duis faucibus accumsan odio curabitur convallis duis consequat dui nec nisi volutpat eleifend donec ut
481,Skipstorm,slopesdc@answers.com,+86 531 250 9295,magnis dis parturient montes nascetur ridiculus mus vivamus vestibulum sagittis sapien cum sociis natoque penatibus et magnis dis parturient montes
482,Ooba,pedgerdd@google.it,+33 484 358 3898,bibendum felis sed interdum venenatis turpis enim blandit mi in porttitor pede
483,Yoveo,mtremmilde@smugmug.com,+212 972 140 6827,dis parturient montes nascetur ridiculus mus vivamus vestibulum sagittis sapien cum sociis natoque
484,Feedfire,oscarddf@spotify.com,+86 101 498 5660,magna vestibulum aliquet ultrices erat tortor sollicitudin mi sit amet lobortis sapien sapien non mi integer ac neque duis
485,Agivu,ekuhnhardtdg@amazon.co.jp,+237 328 661 6489,sociis natoque penatibus et magnis dis parturient montes nascetur ridiculus mus etiam vel augue vestibulum rutrum rutrum neque
486,Tekfly,jbrockwaydh@discovery.com,+82 891 364 2779,sociis natoque penatibus et magnis dis parturient montes nascetur ridiculus mus vivamus vestibulum sagittis sapien cum
487,Photospace,minggalldi@toplist.cz,+52 593 613 1871,nullam varius nulla facilisi cras non velit nec nisi vulputate nonummy maecenas
488,Quaxo,warzudj@go.com,+66 394 371 5558,dis parturient montes nascetur ridiculus mus vivamus vestibulum sagittis sapien cum sociis natoque
489,Ntag,hlinnittdk@123-reg.co.uk,+62 692 422 6329,massa id nisl venenatis lacinia aenean sit amet justo morbi ut
490,Meejo,ncolleforddl@livejournal.com,+7 801 591 0901,nullam sit amet turpis elementum ligula vehicula consequat morbi a ipsum integer
491,Vimbo,egiroldidm@wp.com,+62 520 240 6385,diam in magna bibendum imperdiet nullam orci pede venenatis non sodales
492,Topicshots,rjuggingsdn@go.com,+48 117 665 0259,eu est congue elementum in hac habitasse platea dictumst morbi vestibulum velit
493,Jaxworks,tjakubovskydo@drupal.org,+234 618 160 7925,enim in tempor turpis nec euismod scelerisque quam turpis adipiscing lorem vitae mattis nibh ligula nec
494,Linktype,krothdp@cdc.gov,+253 452 689 4319,nec nisi vulputate nonummy maecenas tincidunt lacus at velit vivamus vel nulla eget eros elementum
495,Fadeo,drzehordq@craigslist.org,+967 792 432 3813,in faucibus orci luctus et ultrices posuere cubilia curae nulla dapibus dolor vel est donec odio justo sollicitudin ut suscipit
496,Shuffletag,pdankdr@google.fr,+55 764 843 1058,felis eu sapien cursus vestibulum proin eu mi nulla ac enim in
497,Blogpad,mkirklandds@indiatimes.com,+63 704 368 4050,tincidunt ante vel ipsum praesent blandit lacinia erat vestibulum sed magna at nunc commodo placerat praesent blandit
498,Browseblab,fspinigedt@epa.gov,+46 413 841 4069,ultrices vel augue vestibulum ante ipsum primis in faucibus orci luctus et ultrices posuere cubilia curae
499,Flashspan,dmacmoyerdu@ucoz.ru,+27 712 334 1141,sapien quis libero nullam sit amet turpis elementum ligula vehicula consequat morbi
500,Eimbee,jhemmingwaydv@naver.com,+34 281 636 6706,consectetuer adipiscing elit proin risus praesent lectus vestibulum quam sapien varius ut blandit
501,Realbridge,cstieblerdw@yale.edu,+48 548 494 8706,ac nibh fusce lacus purus aliquet at feugiat non pretium quis lectus suspendisse potenti in eleifend quam a odio in
502,Zoomcast,bwarndx@purevolume.com,+48 909 514 0152,vulputate luctus cum sociis natoque penatibus et magnis dis parturient montes nascetur ridiculus mus vivamus vestibulum sagittis
503,Livetube,ydelortdy@sciencedirect.com,+7 136 834 4085,lacinia nisi venenatis tristique fusce congue diam id ornare imperdiet sapien urna pretium nisl ut
504,Katz,fdrezzerdz@deliciousdays.com,+86 130 187 6342,nulla sed vel enim sit amet nunc viverra dapibus nulla suscipit ligula in lacus curabitur at
505,Photobug,lhanhardte0@imageshack.us,+81 273 127 8324,habitasse platea dictumst morbi vestibulum velit id pretium iaculis diam erat fermentum justo nec condimentum
506,Youfeed,mfeldmane1@ameblo.jp,+235 254 688 9144,nascetur ridiculus mus vivamus vestibulum sagittis sapien cum sociis natoque penatibus et magnis dis
507,Voolia,hacome2@123-reg.co.uk,+86 812 274 1052,sed vel enim sit amet nunc viverra dapibus nulla suscipit ligula in
508,Blogtag,jmashroe3@eventbrite.com,+86 650 262 1520,ut suscipit a feugiat et eros vestibulum ac est lacinia nisi venenatis tristique fusce
509,Talane,nhundeye4@businessinsider.com,+81 623 402 6844,dignissim vestibulum vestibulum ante ipsum primis in faucibus orci luctus et ultrices posuere cubilia curae
510,Rhyloo,mpenningtone5@cafepress.com,+86 465 921 4126,sem sed sagittis nam congue risus semper porta volutpat quam pede lobortis ligula sit amet eleifend pede libero quis orci
511,Oyonder,kelmere6@bizjournals.com,+63 427 851 6919,accumsan tellus nisi eu orci mauris lacinia sapien quis libero
512,Realbuzz,tsaffee7@sohu.com,+63 259 871 5570,in faucibus orci luctus et ultrices posuere cubilia curae nulla dapibus dolor vel est donec odio justo sollicitudin ut suscipit
513,Youopia,ajosilowskie8@ibm.com,+51 936 525 0064,in sapien iaculis congue vivamus metus arcu adipiscing molestie hendrerit at vulputate vitae nisl aenean lectus
514,Bubbletube,tduxburye9@ow.ly,+1 927 337 0379,at feugiat non pretium quis lectus suspendisse potenti in eleifend quam a odio in hac habitasse platea dictumst maecenas ut
515,Babbleopia,pgisbyeea@list-manage.com,+54 949 330 7898,libero nam dui proin leo odio porttitor id consequat in consequat ut nulla sed accumsan felis ut at dolor quis
516,Ntag,ldrieb@rakuten.co.jp,+33 662 349 2015,et ultrices posuere cubilia curae mauris viverra diam vitae quam suspendisse potenti nullam porttitor lacus at turpis donec posuere
517,Meeveo,csurcombeec@columbia.edu,+62 558 995 6889,in blandit ultrices enim lorem ipsum dolor sit amet consectetuer
518,Shuffletag,cslevined@aol.com,+33 174 404 5449,vestibulum velit id pretium iaculis diam erat fermentum justo nec
519,Janyx,tzannutoee@unblog.fr,+86 340 504 8876,convallis nunc proin at turpis a pede posuere nonummy integer non velit donec diam neque vestibulum eget vulputate
520,Skajo,tternouthef@hexun.com,+62 841 518 2919,lectus pellentesque eget nunc donec quis orci eget orci vehicula condimentum curabitur in libero ut massa volutpat convallis morbi odio
