SupplierID,SupplierName,SupplierEmail,SupplierPhone,SupplierDescription
173,Twimm,cgligoraci4s@miitbeian.gov.cn,+212 721 742 3002,nisl duis ac nibh fusce lacus purus aliquet at feugiat non pretium quis
174,Tazz,sashtonhurst4t@slashdot.org,+33 145 591 6846,ultrices vel augue vestibulum ante ipsum primis in faucibus orci luctus et ultrices posuere
175,Thoughtsphere,acoutts4u@comcast.net,+86 645 674 6782,id ligula suspendisse ornare consequat lectus in est risus auctor sed tristique in tempus sit
176,Mita,fglaserman4v@sina.com.cn,+62 462 609 2789,lacus purus aliquet at feugiat non pretium quis lectus suspendisse potenti in eleifend quam a odio in hac
177,Feedbug,gskipping4w@ebay.co.uk,+267 828 953 7986,cras non velit nec nisi vulputate nonummy maecenas tincidunt lacus
178,Babblestorm,colney4x@ox.ac.uk,+30 654 670 7914,id consequat in consequat ut nulla sed accumsan felis ut at dolor quis odio consequat varius integer ac leo
179,Yabox,mgarth4y@nbcnews.com,+420 828 298 1994,libero nam dui proin leo odio porttitor id consequat in consequat ut nulla sed accumsan
180,Zooxo,kquiddington4z@hc360.com,+62 987 318 4698,eu orci mauris lacinia sapien quis libero nullam sit amet turpis elementum ligula vehicula consequat morbi a ipsum integer a
181,Yadel,epabst50@digg.com,+7 229 515 1002,in lectus pellentesque at nulla suspendisse potenti cras in purus eu magna vulputate luctus
182,Roombo,ngisbourn51@naver.com,+223 153 971 4242,neque sapien placerat ante nulla justo aliquam quis turpis eget
183,Gigabox,cbolstridge52@hubpages.com,+33 481 864 2287,vestibulum ante ipsum primis in faucibus orci luctus et ultrices posuere cubilia curae mauris viverra diam vitae quam
184,Meevee,jpears53@de.vu,+53 785 865 8510,bibendum morbi non quam nec dui luctus rutrum nulla tellus
185,Livetube,achristaeas54@eventbrite.com,+94 451 372 8696,rutrum neque aenean auctor gravida sem praesent id massa id nisl
186,Zoombeat,zdongate55@chronoengine.com,+7 535 600 7406,nascetur ridiculus mus etiam vel augue vestibulum rutrum rutrum neque aenean auctor gravida sem praesent id massa id nisl
187,Kazio,dpaszek56@epa.gov,+598 747 966 6832,rutrum nulla nunc purus phasellus in felis donec semper sapien a libero nam dui proin leo odio
188,Divavu,wearp57@abc.net.au,+47 273 759 9443,mi sit amet lobortis sapien sapien non mi integer ac neque duis
189,Zoonoodle,dnesbitt58@live.com,+58 929 319 0398,egestas metus aenean fermentum donec ut mauris eget massa tempor convallis nulla neque libero convallis eget eleifend luctus ultricies
190,Skipfire,amilby59@etsy.com,+55 350 911 9470,pulvinar lobortis est phasellus sit amet erat nulla tempus vivamus in
191,Devpoint,amanketell5a@opensource.org,+39 665 404 7964,convallis duis consequat dui nec nisi volutpat eleifend donec ut dolor morbi vel lectus in quam fringilla rhoncus mauris
192,Shufflester,rmacgilpatrick5b@tripod.com,+420 383 660 4124,pharetra magna vestibulum aliquet ultrices erat tortor sollicitudin mi sit amet lobortis sapien sapien
193,Jaxnation,wturtle5c@ucoz.ru,+55 735 552 1594,at feugiat non pretium quis lectus suspendisse potenti in eleifend quam a odio in hac habitasse platea
194,Lazz,fgollin5d@umn.edu,+54 769 322 7540,justo lacinia eget tincidunt eget tempus vel pede morbi porttitor lorem id ligula suspendisse ornare consequat lectus in
195,Jabbersphere,kstennett5e@cmu.edu,+86 810 940 5867,eu felis fusce posuere felis sed lacus morbi sem mauris laoreet ut rhoncus aliquet pulvinar sed nisl nunc rhoncus
196,Browsedrive,kantonsson5f@house.gov,+46 356 462 7682,penatibus et magnis dis parturient montes nascetur ridiculus mus etiam vel augue vestibulum rutrum rutrum neque aenean
197,Livefish,spoyntz5g@unc.edu,+62 826 670 9091,nibh in hac habitasse platea dictumst aliquam augue quam sollicitudin vitae consectetuer eget rutrum
198,Linkbridge,anetti5h@arizona.edu,+62 278 511 7071,pellentesque at nulla suspendisse potenti cras in purus eu magna vulputate luctus cum sociis natoque penatibus
199,Camimbo,eorange5i@nature.com,+62 356 495 5064,amet nunc viverra dapibus nulla suscipit ligula in lacus curabitur at ipsum ac tellus semper interdum
200,Oyope,aelphick5j@intel.com,+505 506 835 5050,vitae ipsum aliquam non mauris morbi non lectus aliquam sit amet diam in magna bibendum imperdiet nullam orci pede venenatis
201,Trunyx,ncridland5k@mac.com,+86 410 475 1962,convallis duis consequat dui nec nisi volutpat eleifend donec ut dolor
202,Aibox,dwinterton5l@usda.gov,+63 670 406 0470,sem mauris laoreet ut rhoncus aliquet pulvinar sed nisl nunc rhoncus dui vel sem
203,Linkbridge,meckh5m@t.co,+86 728 620 4331,sit amet sapien dignissim vestibulum vestibulum ante ipsum primis in faucibus orci luctus et ultrices
204,Eidel,gdashkovich5n@zdnet.com,+420 240 203 0808,sed sagittis nam congue risus semper porta volutpat quam pede
205,Voomm,sdrews5o@latimes.com,+86 825 138 0891,placerat ante nulla justo aliquam quis turpis eget elit sodales scelerisque mauris sit amet eros suspendisse
206,Browsecat,bugoletti5p@mozilla.org,+55 217 804 3011,ut erat curabitur gravida nisi at nibh in hac habitasse platea
207,Kwimbee,dbasler5q@artisteer.com,+62 754 868 6332,faucibus accumsan odio curabitur convallis duis consequat dui nec nisi volutpat eleifend donec
208,Jaxnation,nreynault5r@chicagotribune.com,+351 652 639 3448,tortor quis turpis sed ante vivamus tortor duis mattis egestas metus aenean fermentum donec ut mauris eget massa tempor
209,Vitz,bdelisle5s@linkedin.com,+976 148 327 0864,maecenas tristique est et tempus semper est quam pharetra magna
210,Voomm,llavrick5t@msn.com,+359 300 475 7870,nulla elit ac nulla sed vel enim sit amet nunc viverra dapibus nulla suscipit ligula in
211,Yozio,acomellini5u@google.com.hk,+86 855 653 4299,maecenas pulvinar lobortis est phasellus sit amet erat nulla tempus vivamus in felis eu sapien cursus
212,Fatz,asimms5v@feedburner.com,+62 378 724 2196,augue a suscipit nulla elit ac nulla sed vel enim sit amet nunc viverra dapibus nulla suscipit ligula in lacus
213,Gigabox,dregus5w@hostgator.com,+351 386 678 0139,metus sapien ut nunc vestibulum ante ipsum primis in faucibus orci luctus et
214,Feedfish,jclingoe5x@phoca.cz,+977 919 358 3683,pretium iaculis diam erat fermentum justo nec condimentum neque sapien placerat ante nulla
215,Topdrive,cgenike5y@friendfeed.com,+47 272 482 4161,justo pellentesque viverra pede ac diam cras pellentesque volutpat dui maecenas
216,Eayo,mgreves5z@columbia.edu,+60 290 237 4642,libero convallis eget eleifend luctus ultricies eu nibh quisque id justo
217,Skipstorm,glangan60@yelp.com,+7 159 430 4139,turpis donec posuere metus vitae ipsum aliquam non mauris morbi non
218,Babblestorm,ndabourne61@hugedomains.com,+86 308 512 7347,lacus at velit vivamus vel nulla eget eros elementum pellentesque quisque porta volutpat
219,Skivee,hchampkins62@ycombinator.com,+86 562 911 4839,enim leo rhoncus sed vestibulum sit amet cursus id turpis integer aliquet massa id lobortis
220,Zoomzone,ntoyne63@booking.com,+86 366 866 9066,accumsan felis ut at dolor quis odio consequat varius integer ac leo pellentesque ultrices mattis odio
221,Vimbo,bdeldello64@census.gov,+48 809 660 6237,a nibh in quis justo maecenas rhoncus aliquam lacus morbi
222,Thoughtblab,msemple65@networksolutions.com,+504 737 195 9008,amet cursus id turpis integer aliquet massa id lobortis convallis tortor risus dapibus augue vel accumsan tellus nisi
223,Quinu,mhaydon66@simplemachines.org,+63 498 809 4056,neque aenean auctor gravida sem praesent id massa id nisl venenatis lacinia aenean sit amet
224,Gigazoom,nwalbrook67@unesco.org,+44 169 528 9270,ut massa quis augue luctus tincidunt nulla mollis molestie lorem quisque ut erat curabitur gravida nisi at
225,Leexo,gmacken68@soup.io,+55 929 944 8597,parturient montes nascetur ridiculus mus etiam vel augue vestibulum rutrum rutrum neque aenean auctor gravida sem
226,Kazio,mmartello69@networksolutions.com,+62 876 719 5067,metus sapien ut nunc vestibulum ante ipsum primis in faucibus orci luctus et ultrices posuere cubilia curae mauris viverra
227,Jetpulse,ncharlson6a@shareasale.com,+1 804 689 7259,aliquet at feugiat non pretium quis lectus suspendisse potenti in eleifend quam a odio in hac habitasse platea dictumst
228,Avamm,gmayler6b@sfgate.com,+95 550 122 5281,magna bibendum imperdiet nullam orci pede venenatis non sodales sed tincidunt eu
229,Dabshots,adeane6c@cmu.edu,+86 919 517 2873,pede ullamcorper augue a suscipit nulla elit ac nulla sed vel enim sit amet nunc viverra dapibus nulla
230,Edgeblab,gnorthgraves6d@loc.gov,+86 835 922 6360,ipsum dolor sit amet consectetuer adipiscing elit proin risus praesent
231,Chatterbridge,scairns6e@altervista.org,+57 845 874 0455,dolor morbi vel lectus in quam fringilla rhoncus mauris enim leo rhoncus sed vestibulum sit amet cursus
232,Oozz,hgrombridge6f@cnbc.com,+81 655 498 6439,suscipit ligula in lacus curabitur at ipsum ac tellus semper interdum mauris ullamcorper
233,Oloo,dcrawley6g@cyberchimps.com,+62 750 259 6239,donec ut dolor morbi vel lectus in quam fringilla rhoncus mauris enim leo rhoncus sed vestibulum sit amet
234,Trilith,oghilks6h@dropbox.com,+256 688 584 6430,praesent lectus vestibulum quam sapien varius ut blandit non interdum in ante
235,Avaveo,bseathwright6i@umn.edu,+1 307 517 7290,habitasse platea dictumst morbi vestibulum velit id pretium iaculis diam erat fermentum justo nec condimentum neque sapien placerat
236,Katz,mbourges6j@sogou.com,+48 348 884 1591,sapien dignissim vestibulum vestibulum ante ipsum primis in faucibus orci luctus et ultrices posuere cubilia curae
237,Tagpad,lreggio6k@elegantthemes.com,+7 166 482 5955,a nibh in quis justo maecenas rhoncus aliquam lacus morbi quis
238,Kanoodle,cbielby6l@telegraph.co.uk,+63 452 690 8108,est congue elementum in hac habitasse platea dictumst morbi vestibulum velit id pretium iaculis diam erat fermentum justo
239,Jaxworks,ctomashov6m@phoca.cz,+46 310 379 9418,posuere cubilia curae donec pharetra magna vestibulum aliquet ultrices erat tortor sollicitudin mi sit amet
240,Realcube,ngutridge6n@posterous.com,+86 310 518 3086,proin leo odio porttitor id consequat in consequat ut nulla sed accumsan felis ut at
241,Lazzy,espink6o@imgur.com,+93 399 486 7941,ligula in lacus curabitur at ipsum ac tellus semper interdum mauris ullamcorper
242,Jaxworks,cgoldson6p@mtv.com,+55 244 645 6357,donec ut dolor morbi vel lectus in quam fringilla rhoncus mauris enim
243,Oyoyo,hmccoy6q@bloglovin.com,+351 326 788 3472,dolor morbi vel lectus in quam fringilla rhoncus mauris enim leo rhoncus
244,Jabbersphere,khegden6r@tiny.cc,+420 141 918 9471,morbi vel lectus in quam fringilla rhoncus mauris enim leo rhoncus sed vestibulum sit amet cursus id turpis integer aliquet
245,Blogspan,cwinchurst6s@people.com.cn,+33 556 815 3214,augue quam sollicitudin vitae consectetuer eget rutrum at lorem integer tincidunt ante vel ipsum praesent blandit lacinia erat
246,Wordify,bdominici6t@stanford.edu,+1 312 523 8401,sit amet erat nulla tempus vivamus in felis eu sapien cursus vestibulum proin eu mi nulla ac enim
247,Zoomdog,ariccard6u@parallels.com,+420 655 980 4215,ipsum praesent blandit lacinia erat vestibulum sed magna at nunc
248,Avaveo,ruwins6v@amazon.de,+389 170 821 1379,nibh quisque id justo sit amet sapien dignissim vestibulum vestibulum
249,Gabcube,tmeers6w@psu.edu,+970 993 141 8663,aenean auctor gravida sem praesent id massa id nisl venenatis lacinia aenean sit amet justo morbi ut
250,Reallinks,ebelcham6x@vkontakte.ru,+420 732 865 7909,posuere metus vitae ipsum aliquam non mauris morbi non lectus
251,Gabcube,sgibbett6y@europa.eu,+86 183 450 3113,tristique fusce congue diam id ornare imperdiet sapien urna pretium
252,Jayo,mhearse6z@psu.edu,+373 766 932 8123,integer pede justo lacinia eget tincidunt eget tempus vel pede morbi porttitor
253,Npath,akillick70@bbb.org,+1 412 988 3611,vitae quam suspendisse potenti nullam porttitor lacus at turpis donec posuere metus vitae ipsum aliquam
254,Devcast,rfiorentino71@amazonaws.com,+34 333 515 4242,cubilia curae duis faucibus accumsan odio curabitur convallis duis consequat dui nec
255,Thoughtblab,mconeau72@nature.com,+62 436 966 1563,elit proin risus praesent lectus vestibulum quam sapien varius ut blandit non interdum in ante vestibulum ante ipsum
256,Fiveclub,obase73@wiley.com,+55 717 339 4098,ante nulla justo aliquam quis turpis eget elit sodales scelerisque mauris sit amet eros suspendisse
257,Zoovu,pbrownsmith74@engadget.com,+62 692 314 8185,proin leo odio porttitor id consequat in consequat ut nulla sed accumsan
258,Aimbu,tredhole75@qq.com,+86 671 610 8151,felis fusce posuere felis sed lacus morbi sem mauris laoreet ut rhoncus
259,Zazio,ahowling76@whitehouse.gov,+20 216 782 2993,eget nunc donec quis orci eget orci vehicula condimentum curabitur in
260,Edgepulse,ntarren77@dailymail.co.uk,+55 163 469 9625,orci pede venenatis non sodales sed tincidunt eu felis fusce posuere felis sed
261,Fivespan,aseddon78@hexun.com,+48 539 176 2846,tristique fusce congue diam id ornare imperdiet sapien urna pretium nisl ut volutpat sapien
262,Pixonyx,hroskeilly79@independent.co.uk,+63 366 105 9601,donec diam neque vestibulum eget vulputate ut ultrices vel augue vestibulum ante ipsum primis in faucibus
263,Centidel,escollick7a@shareasale.com,+55 713 721 3999,lacus morbi quis tortor id nulla ultrices aliquet maecenas leo
264,Yakidoo,cbedin7b@freewebs.com,+66 522 567 8356,duis bibendum morbi non quam nec dui luctus rutrum nulla tellus in sagittis dui
265,Topdrive,srickersey7c@tuttocitta.it,+7 106 577 3935,hac habitasse platea dictumst morbi vestibulum velit id pretium iaculis diam erat fermentum
266,Dabfeed,stomaszek7d@linkedin.com,+46 310 809 9262,nisl venenatis lacinia aenean sit amet justo morbi ut odio
267,Twinte,nkondratenko7e@sphinn.com,+420 402 944 5969,augue vestibulum rutrum rutrum neque aenean auctor gravida sem praesent id
268,Oyonder,fmcclurg7f@lulu.com,+595 110 472 9621,quis turpis eget elit sodales scelerisque mauris sit amet eros suspendisse accumsan tortor quis turpis sed
269,Yotz,gflasby7g@microsoft.com,+46 463 609 3109,penatibus et magnis dis parturient montes nascetur ridiculus mus etiam vel augue vestibulum rutrum rutrum neque
270,BlogXS,hwardhaw7h@time.com,+48 778 490 4639,pellentesque quisque porta volutpat erat quisque erat eros viverra eget congue eget semper rutrum nulla nunc purus phasellus in felis
271,Jabbersphere,swontner7i@ucsd.edu,+971 659 931 8621,justo morbi ut odio cras mi pede malesuada in imperdiet et commodo vulputate justo in blandit ultrices enim
272,Vimbo,bacedo7j@washingtonpost.com,+505 757 140 8272,blandit non interdum in ante vestibulum ante ipsum primis in faucibus orci luctus et ultrices posuere cubilia curae duis
273,Trudoo,snudd7k@usatoday.com,+685 619 280 2146,in libero ut massa volutpat convallis morbi odio odio elementum eu interdum eu tincidunt in leo maecenas pulvinar lobortis est
274,BlogXS,dgunning7l@google.pl,+86 476 408 8581,blandit lacinia erat vestibulum sed magna at nunc commodo placerat praesent blandit nam nulla
275,Youspan,jtry7m@list-manage.com,+7 580 247 6350,quam nec dui luctus rutrum nulla tellus in sagittis dui vel nisl duis ac nibh fusce lacus purus aliquet
276,Twitterbridge,bprofit7n@google.com.au,+504 863 719 6769,faucibus orci luctus et ultrices posuere cubilia curae duis faucibus accumsan odio curabitur convallis
277,Tambee,kpagram7o@photobucket.com,+63 113 141 2327,sapien non mi integer ac neque duis bibendum morbi non quam nec
278,Zoomdog,ggeorgeon7p@tripod.com,+52 810 564 7416,ullamcorper augue a suscipit nulla elit ac nulla sed vel enim sit amet nunc viverra
279,Pixope,lnicol7q@sciencedaily.com,+62 608 836 4117,nibh ligula nec sem duis aliquam convallis nunc proin at turpis a
280,Katz,ospoors7r@wikimedia.org,+46 969 216 0074,duis consequat dui nec nisi volutpat eleifend donec ut dolor morbi vel lectus in quam fringilla
281,Skipstorm,bcolcutt7s@squarespace.com,+970 356 925 0427,faucibus orci luctus et ultrices posuere cubilia curae nulla dapibus dolor
282,Aimbo,rwhylie7t@boston.com,+86 286 254 4238,morbi vel lectus in quam fringilla rhoncus mauris enim leo
283,Wikido,klabrom7u@cdbaby.com,+48 281 427 3033,magna ac consequat metus sapien ut nunc vestibulum ante ipsum primis in faucibus
284,Yakijo,tgeldert7v@trellian.com,+58 317 599 9121,sapien cum sociis natoque penatibus et magnis dis parturient montes nascetur ridiculus mus etiam vel augue vestibulum rutrum
285,Skimia,ktarbet7w@slideshare.net,+55 926 683 6176,dui nec nisi volutpat eleifend donec ut dolor morbi vel lectus in quam fringilla
286,Meevee,mgraffin7x@merriam-webster.com,+229 492 852 0057,mauris ullamcorper purus sit amet nulla quisque arcu libero rutrum
287,Bubblebox,rmoynham7y@woothemes.com,+86 609 599 4118,aliquam augue quam sollicitudin vitae consectetuer eget rutrum at lorem integer tincidunt ante vel
288,Flipstorm,mitzcak7z@businessinsider.com,+351 827 483 4472,ut volutpat sapien arcu sed augue aliquam erat volutpat in congue etiam
289,Katz,crushworth80@fotki.com,+62 453 528 8986,integer ac leo pellentesque ultrices mattis odio donec vitae nisi nam ultrices libero non mattis pulvinar nulla pede
290,Camido,pmothersdale81@theatlantic.com,+1 816 353 8032,duis at velit eu est congue elementum in hac habitasse platea dictumst morbi vestibulum velit id pretium iaculis diam
291,Voonder,rbeesey82@usgs.gov,+86 905 480 7440,rhoncus sed vestibulum sit amet cursus id turpis integer aliquet massa id lobortis convallis tortor
292,Oyondu,agruczka83@wisc.edu,+81 746 246 4779,morbi porttitor lorem id ligula suspendisse ornare consequat lectus in est risus auctor
293,Tekfly,jbayless84@ustream.tv,+86 487 538 9294,elementum nullam varius nulla facilisi cras non velit nec nisi vulputate nonummy maecenas tincidunt lacus at velit vivamus
294,Shuffletag,ehenlon85@alibaba.com,+62 626 913 8559,diam neque vestibulum eget vulputate ut ultrices vel augue vestibulum ante ipsum primis in faucibus orci
295,Tanoodle,smcilherran86@blog.com,+351 662 276 2819,sed ante vivamus tortor duis mattis egestas metus aenean fermentum donec ut mauris eget massa tempor
296,Roombo,fbycraft87@cyberchimps.com,+46 111 352 3940,tincidunt in leo maecenas pulvinar lobortis est phasellus sit amet erat nulla
297,Meedoo,mscampion88@jalbum.net,+595 412 275 5456,volutpat dui maecenas tristique est et tempus semper est quam pharetra magna ac consequat metus sapien
298,Fivebridge,knorcop89@hugedomains.com,+687 309 988 1924,vel ipsum praesent blandit lacinia erat vestibulum sed magna at nunc commodo placerat praesent blandit nam nulla integer pede
299,Muxo,baldine8a@addthis.com,+86 326 386 4295,in tempor turpis nec euismod scelerisque quam turpis adipiscing lorem vitae mattis nibh ligula nec sem
300,Skivee,lmillhouse8b@sciencedaily.com,+86 617 375 5253,aenean auctor gravida sem praesent id massa id nisl venenatis lacinia aenean sit amet justo morbi ut odio cras
301,Skippad,ashelly8c@kickstarter.com,+62 424 722 3730,fusce consequat nulla nisl nunc nisl duis bibendum felis sed interdum venenatis turpis
302,Dabvine,bsimms8d@booking.com,+62 735 221 2749,vestibulum sed magna at nunc commodo placerat praesent blandit nam nulla integer pede
303,Skimia,nblundon8e@patch.com,+7 642 714 5087,quam a odio in hac habitasse platea dictumst maecenas ut massa quis augue luctus tincidunt nulla mollis molestie
304,Gabtype,rnockalls8f@163.com,+62 417 154 4843,ante ipsum primis in faucibus orci luctus et ultrices posuere cubilia curae mauris viverra diam vitae quam suspendisse
305,Wordtune,erudland8g@senate.gov,+62 556 575 1594,ante ipsum primis in faucibus orci luctus et ultrices posuere cubilia curae duis faucibus accumsan odio curabitur
306,Skiptube,bmattiussi8h@jigsy.com,+98 865 213 4002,tincidunt lacus at velit vivamus vel nulla eget eros elementum pellentesque quisque porta volutpat erat
307,Skipfire,gburkhill8i@reuters.com,+51 901 721 9416,nec molestie sed justo pellentesque viverra pede ac diam cras pellentesque volutpat dui maecenas
308,Youbridge,lscurrell8j@google.es,+86 956 324 8762,phasellus id sapien in sapien iaculis congue vivamus metus arcu adipiscing molestie hendrerit at vulputate vitae nisl
309,Tekfly,aruffles8k@privacy.gov.au,+420 334 859 8015,odio donec vitae nisi nam ultrices libero non mattis pulvinar nulla pede
310,Brainsphere,fbooij8l@ehow.com,+33 374 850 2857,dui vel nisl duis ac nibh fusce lacus purus aliquet at feugiat non pretium quis
311,Meembee,npostin8m@gmpg.org,+62 734 735 7208,metus vitae ipsum aliquam non mauris morbi non lectus aliquam sit amet diam in magna bibendum imperdiet
312,Quinu,lthorneley8n@creativecommons.org,+62 263 971 5113,vel lectus in quam fringilla rhoncus mauris enim leo rhoncus sed vestibulum
313,Quatz,sbryden8o@shinystat.com,+33 593 919 9386,adipiscing lorem vitae mattis nibh ligula nec sem duis aliquam convallis nunc proin at turpis a
314,Photolist,cmacdunleavy8p@businessweek.com,+86 456 489 4288,ac leo pellentesque ultrices mattis odio donec vitae nisi nam ultrices libero non mattis pulvinar nulla
315,Kanoodle,dmansuer8q@ow.ly,+86 315 309 6530,nulla sed accumsan felis ut at dolor quis odio consequat varius integer ac leo pellentesque ultrices
316,Zoomzone,mguillotin8r@cargocollective.com,+63 632 962 7059,est lacinia nisi venenatis tristique fusce congue diam id ornare imperdiet sapien urna pretium nisl ut
317,Skinder,hbenedek8s@wix.com,+33 930 813 4106,platea dictumst aliquam augue quam sollicitudin vitae consectetuer eget rutrum at
318,Quinu,apim8t@istockphoto.com,+63 759 728 9725,sit amet nunc viverra dapibus nulla suscipit ligula in lacus curabitur at ipsum ac tellus semper interdum mauris ullamcorper purus
319,Fivespan,mstaig8u@google.pl,+63 280 640 2130,ultrices libero non mattis pulvinar nulla pede ullamcorper augue a suscipit
320,Thoughtmix,jnano8v@typepad.com,+86 262 269 1809,lacus morbi sem mauris laoreet ut rhoncus aliquet pulvinar sed nisl nunc rhoncus dui vel sem sed sagittis nam congue
321,Bubblebox,mmacura8w@fema.gov,+62 448 185 0195,congue elementum in hac habitasse platea dictumst morbi vestibulum velit id pretium iaculis diam erat
322,Topiczoom,reves8x@xrea.com,+7 676 133 7642,nibh in quis justo maecenas rhoncus aliquam lacus morbi quis tortor
323,Twitterbeat,lgilliatt8y@seesaa.net,+86 161 851 2135,in lacus curabitur at ipsum ac tellus semper interdum mauris ullamcorper purus sit
324,Yamia,babdon8z@state.gov,+86 891 746 2972,mattis nibh ligula nec sem duis aliquam convallis nunc proin at turpis a pede posuere nonummy integer non
325,Kamba,mtamburo90@economist.com,+62 497 912 3009,amet consectetuer adipiscing elit proin risus praesent lectus vestibulum quam
326,Tagpad,nwildt91@tmall.com,+86 459 152 8185,suspendisse ornare consequat lectus in est risus auctor sed tristique in tempus sit amet sem fusce
327,Janyx,esarll92@nih.gov,+86 109 217 6102,ut massa volutpat convallis morbi odio odio elementum eu interdum
328,Tazz,enucciotti93@cpanel.net,+93 780 782 6897,est congue elementum in hac habitasse platea dictumst morbi vestibulum
329,Kanoodle,merangy94@marriott.com,+62 424 206 0301,sapien iaculis congue vivamus metus arcu adipiscing molestie hendrerit at vulputate vitae nisl aenean lectus pellentesque
330,Dabshots,gvardie95@constantcontact.com,+351 715 531 8737,lacinia sapien quis libero nullam sit amet turpis elementum ligula vehicula consequat morbi a
331,Photobug,pczyz96@wunderground.com,+420 336 312 9244,primis in faucibus orci luctus et ultrices posuere cubilia curae
332,Tagpad,ghearle97@cafepress.com,+86 308 222 7116,vestibulum eget vulputate ut ultrices vel augue vestibulum ante ipsum primis
333,Thoughtmix,jilymanov98@salon.com,+380 776 842 0816,adipiscing elit proin interdum mauris non ligula pellentesque ultrices phasellus
334,Gigashots,strollope99@craigslist.org,+62 706 263 4278,ullamcorper augue a suscipit nulla elit ac nulla sed vel
335,Bubbletube,cdunderdale9a@sourceforge.net,+86 357 285 7213,dui luctus rutrum nulla tellus in sagittis dui vel nisl duis ac
336,Thoughtstorm,clidgley9b@who.int,+62 258 643 6721,leo maecenas pulvinar lobortis est phasellus sit amet erat nulla tempus vivamus in felis eu sapien cursus vestibulum
337,Yabox,vmantha9c@walmart.com,+375 139 789 8507,aenean auctor gravida sem praesent id massa id nisl venenatis lacinia aenean sit amet justo morbi ut
338,Yotz,cslimmon9d@spotify.com,+86 821 242 0542,ipsum primis in faucibus orci luctus et ultrices posuere cubilia curae
339,Quinu,padriaan9e@friendfeed.com,+86 731 401 2878,enim leo rhoncus sed vestibulum sit amet cursus id turpis integer aliquet massa id lobortis convallis
340,Gabtype,dghelarducci9f@google.com.br,+351 942 660 0921,mauris eget massa tempor convallis nulla neque libero convallis eget eleifend luctus ultricies
341,Plajo,ablakebrough9g@hp.com,+56 623 891 6226,nullam varius nulla facilisi cras non velit nec nisi vulputate nonummy maecenas tincidunt lacus at velit vivamus vel nulla eget
342,Edgepulse,tmorsley9h@yandex.ru,+86 963 891 7542,sit amet consectetuer adipiscing elit proin interdum mauris non ligula pellentesque ultrices phasellus id
343,Shufflester,bgrinham9i@bloglovin.com,+355 403 960 7228,curabitur in libero ut massa volutpat convallis morbi odio odio elementum eu interdum eu tincidunt in
344,Yakijo,sbakesef9j@cpanel.net,+84 581 146 1181,sagittis nam congue risus semper porta volutpat quam pede lobortis ligula sit amet
345,Mynte,pjakoub9k@people.com.cn,+351 920 617 7053,justo aliquam quis turpis eget elit sodales scelerisque mauris sit amet eros suspendisse accumsan tortor quis turpis sed ante vivamus
346,Devpoint,aspeechly9l@bbb.org,+62 742 194 1237,viverra eget congue eget semper rutrum nulla nunc purus phasellus in felis
347,Wordtune,estarmer9m@acquirethisname.com,+62 559 104 7419,sed ante vivamus tortor duis mattis egestas metus aenean fermentum
348,Eimbee,ldodwell9n@msn.com,+420 200 332 2120,ultrices phasellus id sapien in sapien iaculis congue vivamus metus arcu adipiscing molestie hendrerit
349,Gigazoom,kerley9o@usatoday.com,+1 244 438 4711,ante ipsum primis in faucibus orci luctus et ultrices posuere
