SupplierID,SupplierName,SupplierEmail,SupplierPhone,SupplierDescription
1,Shufflebeat,abyard0@dyndns.org,+420 370 917 6028,morbi vestibulum velit id pretium iaculis diam erat fermentum justo nec condimentum neque sapien placerat ante
2,Dazzlesphere,dgreenley1@webeden.co.uk,+7 617 899 8532,ut massa volutpat convallis morbi odio odio elementum eu interdum eu tincidunt in leo maecenas pulvinar lobortis est
3,Kamba,pragbourne2@csmonitor.com,+1 739 177 7229,quis odio consequat varius integer ac leo pellentesque ultrices mattis odio donec vitae nisi nam
4,Dazzlesphere,efullick3@desdev.cn,+54 847 449 9015,platea dictumst aliquam augue quam sollicitudin vitae consectetuer eget rutrum at lorem integer tincidunt ante vel ipsum
5,Oba,greskelly4@epa.gov,+269 712 538 7618,erat tortor sollicitudin mi sit amet lobortis sapien sapien non mi integer ac neque duis bibendum morbi non quam nec
6,Zoombeat,kkingham5@archive.org,+62 645 203 9332,rutrum neque aenean auctor gravida sem praesent id massa id nisl venenatis lacinia aenean sit amet justo morbi ut
7,Demizz,mlindsell6@histats.com,+1 177 306 5563,aenean lectus pellentesque eget nunc donec quis orci eget orci vehicula condimentum curabitur in libero ut massa volutpat convallis
8,Livepath,agavahan7@independent.co.uk,+62 924 941 4450,duis ac nibh fusce lacus purus aliquet at feugiat non
9,Rhycero,lthemann8@instagram.com,+420 735 451 7872,aliquam sit amet diam in magna bibendum imperdiet nullam orci pede venenatis non sodales sed tincidunt
10,Izio,mmonk9@chronoengine.com,+63 483 612 8068,nec nisi vulputate nonummy maecenas tincidunt lacus at velit vivamus vel nulla
11,Yakijo,lworsleya@google.co.uk,+54 216 967 9141,sem praesent id massa id nisl venenatis lacinia aenean sit amet justo morbi ut odio cras mi pede
12,Demizz,wfortounb@mediafire.com,+86 948 586 3528,in hac habitasse platea dictumst morbi vestibulum velit id pretium iaculis diam erat fermentum justo nec condimentum neque sapien
13,Skidoo,ncubbitc@sohu.com,+55 933 552 5858,dictumst etiam faucibus cursus urna ut tellus nulla ut erat id mauris vulputate elementum nullam varius nulla
14,Feedfire,rkunischd@opera.com,+7 773 805 6387,nulla facilisi cras non velit nec nisi vulputate nonummy maecenas tincidunt lacus at velit vivamus vel nulla eget
15,Ooba,tgoadbye@patch.com,+212 899 676 5821,quisque ut erat curabitur gravida nisi at nibh in hac habitasse platea dictumst aliquam augue quam sollicitudin vitae
16,Meevee,swaightf@jiathis.com,+57 962 880 7087,ut erat curabitur gravida nisi at nibh in hac habitasse platea dictumst aliquam augue quam sollicitudin vitae consectetuer
17,Zoomzone,gshropsheirg@wordpress.org,+62 195 801 9445,aenean fermentum donec ut mauris eget massa tempor convallis nulla neque libero convallis
18,Aibox,adowreyh@netscape.com,+86 983 234 6975,justo aliquam quis turpis eget elit sodales scelerisque mauris sit amet eros suspendisse accumsan tortor quis turpis sed ante
19,Youspan,snannonii@desdev.cn,+86 243 507 7073,quam sollicitudin vitae consectetuer eget rutrum at lorem integer tincidunt ante vel ipsum praesent blandit lacinia erat
20,Mydeo,wmarielj@jigsy.com,+63 577 984 2799,primis in faucibus orci luctus et ultrices posuere cubilia curae donec pharetra magna vestibulum aliquet
21,Realcube,atowrissk@boston.com,+86 578 262 6200,aliquam lacus morbi quis tortor id nulla ultrices aliquet maecenas leo odio condimentum id luctus nec molestie sed
22,Aimbu,jughettil@livejournal.com,+7 722 480 1696,sem fusce consequat nulla nisl nunc nisl duis bibendum felis sed interdum venenatis turpis enim blandit
23,Twitterlist,fwinwoodm@phpbb.com,+380 606 886 7461,luctus cum sociis natoque penatibus et magnis dis parturient montes nascetur ridiculus mus vivamus vestibulum sagittis sapien cum sociis
24,Devpoint,ashoweringn@symantec.com,+62 378 640 6447,aliquet at feugiat non pretium quis lectus suspendisse potenti in eleifend quam a odio in
25,Snaptags,astubbingso@buzzfeed.com,+267 816 183 7109,at turpis donec posuere metus vitae ipsum aliquam non mauris morbi non lectus aliquam sit amet diam in magna bibendum
26,Wordify,jvindenp@aol.com,+81 153 185 6608,at velit eu est congue elementum in hac habitasse platea dictumst morbi vestibulum velit id pretium iaculis
27,Quatz,hbloggq@theglobeandmail.com,+66 993 391 2244,leo odio condimentum id luctus nec molestie sed justo pellentesque viverra pede ac diam cras pellentesque volutpat dui maecenas
28,Youbridge,bmeliorr@webmd.com,+55 485 327 7644,justo pellentesque viverra pede ac diam cras pellentesque volutpat dui maecenas tristique est et tempus semper est quam pharetra magna
29,Janyx,tlamballs@about.me,+66 220 866 1277,cum sociis natoque penatibus et magnis dis parturient montes nascetur ridiculus mus vivamus vestibulum sagittis sapien cum sociis natoque
30,Chatterpoint,bmeadwayt@google.pl,+351 605 729 5645,mollis molestie lorem quisque ut erat curabitur gravida nisi at nibh in hac
31,Voonix,fmattioniu@nyu.edu,+86 468 957 5317,dapibus duis at velit eu est congue elementum in hac habitasse platea dictumst morbi vestibulum velit id pretium
32,Zava,beptonv@sun.com,+63 587 926 9574,venenatis lacinia aenean sit amet justo morbi ut odio cras mi pede malesuada in imperdiet et commodo vulputate justo
33,Bubbletube,jfossordw@google.com.au,+86 983 490 6665,vestibulum sagittis sapien cum sociis natoque penatibus et magnis dis parturient montes nascetur ridiculus mus etiam
34,Twinte,cewensonx@goo.ne.jp,+55 976 730 8759,ultrices posuere cubilia curae donec pharetra magna vestibulum aliquet ultrices erat tortor sollicitudin mi sit
35,Edgeify,abradnicky@microsoft.com,+244 161 860 1642,integer aliquet massa id lobortis convallis tortor risus dapibus augue vel accumsan tellus nisi
36,Zoozzy,stoderiz@nps.gov,+46 921 351 3252,auctor sed tristique in tempus sit amet sem fusce consequat nulla nisl nunc nisl duis bibendum felis
37,Twinder,eflear10@bravesites.com,+855 852 513 1443,pede justo eu massa donec dapibus duis at velit eu est congue
38,Vidoo,afritschel11@mediafire.com,+63 536 369 4081,pulvinar lobortis est phasellus sit amet erat nulla tempus vivamus in felis eu sapien cursus vestibulum proin eu mi
39,Thoughtmix,rbimson12@kickstarter.com,+66 282 370 0112,libero nam dui proin leo odio porttitor id consequat in consequat ut
40,Tagcat,igiraldon13@state.gov,+420 541 811 0535,posuere cubilia curae mauris viverra diam vitae quam suspendisse potenti nullam porttitor
41,Photobug,staig14@netlog.com,+92 141 938 3131,sagittis dui vel nisl duis ac nibh fusce lacus purus aliquet at feugiat non pretium quis
42,Vitz,swiggall15@ameblo.jp,+370 152 322 0940,lacinia erat vestibulum sed magna at nunc commodo placerat praesent blandit nam nulla
43,Aimbo,zlowdeane16@1und1.de,+234 707 365 2890,pede morbi porttitor lorem id ligula suspendisse ornare consequat lectus in est risus auctor sed tristique in
44,Tagtune,cpurchon17@multiply.com,+33 710 870 9533,augue luctus tincidunt nulla mollis molestie lorem quisque ut erat curabitur gravida nisi at
45,Youtags,cdykins18@dmoz.org,+86 614 489 3587,ac nibh fusce lacus purus aliquet at feugiat non pretium quis lectus suspendisse potenti in eleifend quam
46,Mudo,mgheorghescu19@bluehost.com,+86 275 910 7053,nulla dapibus dolor vel est donec odio justo sollicitudin ut suscipit
47,Kazu,sattwood1a@hubpages.com,+254 851 135 6949,nisl duis ac nibh fusce lacus purus aliquet at feugiat non pretium quis lectus
48,Fiveclub,bcroasdale1b@japanpost.jp,+1 178 787 4612,nec dui luctus rutrum nulla tellus in sagittis dui vel nisl duis ac nibh fusce lacus purus aliquet at feugiat
49,Einti,pheales1c@google.nl,+55 695 177 5178,nullam varius nulla facilisi cras non velit nec nisi vulputate nonummy maecenas tincidunt lacus
50,Zoomzone,lredsall1d@sphinn.com,+86 218 337 9610,in magna bibendum imperdiet nullam orci pede venenatis non sodales sed tincidunt eu felis fusce posuere felis sed lacus
51,Tagpad,mruggen1e@archive.org,+55 881 867 4611,consequat morbi a ipsum integer a nibh in quis justo
52,Oyope,ebarrows1f@com.com,+20 290 780 0989,non pretium quis lectus suspendisse potenti in eleifend quam a odio in hac habitasse platea dictumst
53,Browseblab,jtertre1g@flavors.me,+33 289 238 8257,ut tellus nulla ut erat id mauris vulputate elementum nullam varius
54,Skilith,zbalazs1h@mac.com,+81 683 326 7346,elit ac nulla sed vel enim sit amet nunc viverra dapibus nulla suscipit ligula in
55,Devbug,kdrysdall1i@cnn.com,+86 974 143 4317,porta volutpat erat quisque erat eros viverra eget congue eget semper rutrum nulla nunc purus
56,Youopia,mmaltman1j@soundcloud.com,+62 552 399 0890,proin leo odio porttitor id consequat in consequat ut nulla sed accumsan felis ut at dolor quis odio consequat
57,Viva,dtheobalds1k@bloglines.com,+380 568 905 7847,in tempor turpis nec euismod scelerisque quam turpis adipiscing lorem vitae mattis nibh ligula nec sem duis aliquam convallis
58,Jazzy,mstrangeways1l@princeton.edu,+351 644 504 7370,posuere metus vitae ipsum aliquam non mauris morbi non lectus aliquam sit amet diam in magna bibendum
59,Yakijo,nbehnen1m@prnewswire.com,+34 305 372 8810,ut volutpat sapien arcu sed augue aliquam erat volutpat in congue etiam justo etiam pretium
60,Jaxnation,lvisick1n@cbslocal.com,+591 963 147 6629,est quam pharetra magna ac consequat metus sapien ut nunc
61,Edgetag,dkeast1o@homestead.com,+95 528 653 4494,erat quisque erat eros viverra eget congue eget semper rutrum nulla nunc purus phasellus in felis donec
62,Skalith,mlewty1p@independent.co.uk,+86 882 181 1576,risus semper porta volutpat quam pede lobortis ligula sit amet eleifend pede libero quis orci nullam
63,Skipstorm,cwyldbore1q@cnet.com,+62 228 180 1247,primis in faucibus orci luctus et ultrices posuere cubilia curae
64,Twiyo,plarvent1r@symantec.com,+86 213 955 6384,faucibus orci luctus et ultrices posuere cubilia curae donec pharetra magna vestibulum aliquet ultrices erat tortor sollicitudin mi sit
65,Skynoodle,ndymott1s@liveinternet.ru,+234 813 666 2648,justo in blandit ultrices enim lorem ipsum dolor sit amet consectetuer adipiscing elit proin interdum mauris non
66,Layo,sgrzegorczyk1t@vistaprint.com,+92 608 193 3321,nibh in hac habitasse platea dictumst aliquam augue quam sollicitudin
67,Browsebug,asimonnot1u@storify.com,+30 641 404 3258,nulla dapibus dolor vel est donec odio justo sollicitudin ut suscipit a feugiat et eros vestibulum ac est lacinia
68,Yombu,ngoathrop1v@ocn.ne.jp,+62 414 151 0603,enim leo rhoncus sed vestibulum sit amet cursus id turpis integer aliquet massa
69,Rhyloo,tbenedict1w@hc360.com,+351 782 422 4995,lacus curabitur at ipsum ac tellus semper interdum mauris ullamcorper purus
70,Lazz,ilogue1x@marriott.com,+86 410 155 5016,praesent blandit lacinia erat vestibulum sed magna at nunc commodo placerat praesent blandit nam nulla integer pede
71,Shufflebeat,asally1y@apple.com,+63 861 236 3261,aliquam lacus morbi quis tortor id nulla ultrices aliquet maecenas leo odio condimentum id luctus nec molestie sed justo pellentesque
72,Pixoboo,rodonohue1z@un.org,+359 879 976 6284,sit amet diam in magna bibendum imperdiet nullam orci pede venenatis non sodales sed tincidunt eu felis fusce posuere felis
73,Linktype,hgoldwater20@github.com,+33 800 260 2515,magna at nunc commodo placerat praesent blandit nam nulla integer pede justo lacinia eget tincidunt eget tempus vel pede morbi
74,Quaxo,sbareford21@gmpg.org,+81 887 734 6569,est phasellus sit amet erat nulla tempus vivamus in felis eu sapien cursus vestibulum proin
75,Zooveo,bproppers22@yahoo.com,+351 917 581 1440,id luctus nec molestie sed justo pellentesque viverra pede ac diam cras pellentesque volutpat
76,Youspan,sgurery23@toplist.cz,+63 990 817 8495,vitae quam suspendisse potenti nullam porttitor lacus at turpis donec posuere metus vitae ipsum
77,Viva,lhuntress24@php.net,+86 830 390 5438,vestibulum velit id pretium iaculis diam erat fermentum justo nec condimentum neque sapien placerat ante nulla justo aliquam
78,Photobean,pgeator25@springer.com,+386 509 268 8548,nulla justo aliquam quis turpis eget elit sodales scelerisque mauris sit amet eros suspendisse accumsan tortor quis turpis
79,Leexo,rflieg26@comcast.net,+86 440 154 6235,a pede posuere nonummy integer non velit donec diam neque vestibulum eget vulputate ut ultrices vel
80,Wikizz,wstleger27@amazonaws.com,+81 784 569 0039,sapien a libero nam dui proin leo odio porttitor id consequat in
81,Meevee,afylan28@bravesites.com,+86 240 875 9113,augue quam sollicitudin vitae consectetuer eget rutrum at lorem integer tincidunt ante vel ipsum
82,Thoughtstorm,rbremond29@dot.gov,+86 102 994 0682,duis bibendum morbi non quam nec dui luctus rutrum nulla tellus in
83,Tambee,kcossum2a@sourceforge.net,+1 920 566 4343,eu est congue elementum in hac habitasse platea dictumst morbi vestibulum velit id
84,Oyope,avardy2b@adobe.com,+7 493 250 6320,a nibh in quis justo maecenas rhoncus aliquam lacus morbi
85,Trilith,creford2c@friendfeed.com,+7 980 153 1309,iaculis diam erat fermentum justo nec condimentum neque sapien placerat ante nulla justo aliquam quis turpis eget
86,Tagchat,ccarroll2d@purevolume.com,+30 194 483 9496,nisi at nibh in hac habitasse platea dictumst aliquam augue quam sollicitudin vitae consectetuer eget rutrum at lorem integer tincidunt
87,Skimia,aswaysland2e@typepad.com,+7 146 422 4039,convallis nulla neque libero convallis eget eleifend luctus ultricies eu nibh quisque id justo sit amet sapien dignissim
88,Mynte,hgeorgius2f@sakura.ne.jp,+86 334 940 4010,rutrum rutrum neque aenean auctor gravida sem praesent id massa id
89,Skyvu,foury2g@patch.com,+86 345 397 7790,mi pede malesuada in imperdiet et commodo vulputate justo in blandit ultrices enim lorem ipsum
90,Quinu,jjinda2h@creativecommons.org,+86 767 839 6065,nisl duis ac nibh fusce lacus purus aliquet at feugiat non pretium
91,Yakijo,jeardley2i@cdc.gov,+46 120 588 2308,rutrum nulla nunc purus phasellus in felis donec semper sapien a libero nam dui proin leo odio porttitor
92,Janyx,cdibiagio2j@de.vu,+48 733 388 5936,dictumst maecenas ut massa quis augue luctus tincidunt nulla mollis molestie lorem quisque ut erat curabitur gravida nisi at nibh
93,Feedbug,bharring2k@adobe.com,+86 458 409 6737,pretium nisl ut volutpat sapien arcu sed augue aliquam erat volutpat in
94,Gigazoom,aevershed2l@arstechnica.com,+963 950 205 1344,libero convallis eget eleifend luctus ultricies eu nibh quisque id justo sit amet sapien dignissim vestibulum vestibulum ante ipsum
95,Innotype,hbeseke2m@booking.com,+86 670 376 3265,gravida sem praesent id massa id nisl venenatis lacinia aenean
96,Katz,tdienes2n@imageshack.us,+82 969 481 9648,nec euismod scelerisque quam turpis adipiscing lorem vitae mattis nibh
97,Linkbridge,swendover2o@youku.com,+62 307 921 0597,adipiscing elit proin interdum mauris non ligula pellentesque ultrices phasellus id sapien in
98,Kazu,acowely2p@blogtalkradio.com,+7 679 911 5384,ut erat id mauris vulputate elementum nullam varius nulla facilisi cras non velit nec nisi vulputate nonummy maecenas
99,Thoughtbridge,smcgilmartin2q@google.cn,+56 556 243 9446,eu mi nulla ac enim in tempor turpis nec euismod scelerisque quam
100,Twinder,epascoe2r@bravesites.com,+7 807 117 9389,eget eleifend luctus ultricies eu nibh quisque id justo sit amet sapien dignissim vestibulum vestibulum ante ipsum primis in faucibus
101,Photojam,kandreazzi2s@house.gov,+86 407 333 4046,augue quam sollicitudin vitae consectetuer eget rutrum at lorem integer tincidunt ante vel ipsum praesent blandit lacinia
102,Zoombeat,vsigward2t@stumbleupon.com,+62 813 442 3982,et ultrices posuere cubilia curae duis faucibus accumsan odio curabitur convallis
103,Linkbuzz,nlumsden2u@reverbnation.com,+33 589 288 9923,libero nullam sit amet turpis elementum ligula vehicula consequat morbi
104,Dazzlesphere,llofts2v@nymag.com,+1 568 415 2944,nunc nisl duis bibendum felis sed interdum venenatis turpis enim blandit mi in porttitor pede justo eu
105,Browsebug,ddon2w@reddit.com,+56 802 492 5093,pellentesque quisque porta volutpat erat quisque erat eros viverra eget
106,Ailane,drosenwasser2x@feedburner.com,+61 574 670 6827,pede justo lacinia eget tincidunt eget tempus vel pede morbi porttitor lorem id ligula suspendisse ornare consequat lectus in est
107,Skivee,nmapston2y@nifty.com,+387 952 453 1514,ac leo pellentesque ultrices mattis odio donec vitae nisi nam ultrices libero non mattis
108,Katz,tdunnaway2z@archive.org,+994 892 594 3045,vel sem sed sagittis nam congue risus semper porta volutpat quam pede lobortis ligula sit amet eleifend pede libero quis
109,BlogXS,jsingers30@who.int,+55 121 861 4192,erat eros viverra eget congue eget semper rutrum nulla nunc purus phasellus in felis
110,Meembee,amcilwain31@delicious.com,+33 832 417 6883,ut suscipit a feugiat et eros vestibulum ac est lacinia nisi venenatis tristique fusce
111,Mybuzz,lpoundesford32@berkeley.edu,+502 459 722 9550,morbi vestibulum velit id pretium iaculis diam erat fermentum justo nec condimentum neque sapien placerat ante nulla justo aliquam
112,Rhyzio,cburridge33@yellowpages.com,+62 733 820 5362,nec euismod scelerisque quam turpis adipiscing lorem vitae mattis nibh ligula nec sem duis
113,Realpoint,chawick34@accuweather.com,+86 424 457 6026,sapien cum sociis natoque penatibus et magnis dis parturient montes nascetur
114,Jetpulse,jrearie35@npr.org,+63 893 885 6355,orci nullam molestie nibh in lectus pellentesque at nulla suspendisse potenti cras in purus eu magna vulputate luctus cum sociis
115,Yata,mdroogan36@de.vu,+7 956 637 2186,semper sapien a libero nam dui proin leo odio porttitor id consequat in consequat ut nulla
116,Browsetype,rtoun37@free.fr,+86 160 570 4642,amet lobortis sapien sapien non mi integer ac neque duis bibendum morbi non quam nec dui
117,Skidoo,rcolliard38@cam.ac.uk,+46 402 937 0841,sit amet eleifend pede libero quis orci nullam molestie nibh in lectus pellentesque at nulla suspendisse potenti cras
118,Skaboo,mbeecham39@scribd.com,+81 704 240 4933,nisl ut volutpat sapien arcu sed augue aliquam erat volutpat in congue etiam justo etiam pretium iaculis
119,Realcube,taiers3a@yellowpages.com,+86 511 723 7660,dolor quis odio consequat varius integer ac leo pellentesque ultrices mattis odio donec vitae nisi nam ultrices
120,Aimbu,dkerwood3b@vk.com,+1 775 379 1098,fusce congue diam id ornare imperdiet sapien urna pretium nisl ut volutpat sapien arcu sed augue
121,Blogtags,pcaesmans3c@facebook.com,+86 624 951 4554,vivamus tortor duis mattis egestas metus aenean fermentum donec ut mauris eget massa tempor convallis nulla neque
122,Voomm,jstotherfield3d@comcast.net,+55 682 736 5811,ac nulla sed vel enim sit amet nunc viverra dapibus nulla suscipit ligula in
123,Thoughtstorm,jjurisch3e@cnet.com,+55 742 227 3225,orci luctus et ultrices posuere cubilia curae mauris viverra diam vitae quam suspendisse potenti nullam porttitor lacus at turpis
124,Tanoodle,mgalley3f@google.cn,+380 570 449 8577,et ultrices posuere cubilia curae duis faucibus accumsan odio curabitur convallis duis consequat dui nec nisi volutpat
125,Eazzy,sbarron3g@blinklist.com,+373 895 436 7189,ut massa volutpat convallis morbi odio odio elementum eu interdum eu
126,Npath,tblew3h@vimeo.com,+86 620 757 0098,ultrices vel augue vestibulum ante ipsum primis in faucibus orci luctus et ultrices posuere cubilia
127,Fiveclub,dboyse3i@sbwire.com,+880 407 206 4949,platea dictumst aliquam augue quam sollicitudin vitae consectetuer eget rutrum at lorem integer tincidunt ante vel ipsum praesent
128,Kamba,cwadwell3j@mit.edu,+48 662 656 0435,justo maecenas rhoncus aliquam lacus morbi quis tortor id nulla ultrices aliquet maecenas leo odio condimentum id luctus nec
129,Fivebridge,ekennelly3k@spotify.com,+62 517 228 0698,tortor sollicitudin mi sit amet lobortis sapien sapien non mi integer ac neque duis bibendum morbi non
130,Omba,smacillrick3l@vistaprint.com,+86 928 378 2831,ultrices posuere cubilia curae duis faucibus accumsan odio curabitur convallis duis consequat dui
131,Meembee,slawrie3m@angelfire.com,+62 171 547 1473,mauris enim leo rhoncus sed vestibulum sit amet cursus id turpis integer aliquet
132,Voolia,lbeardmore3n@booking.com,+254 843 103 6457,erat eros viverra eget congue eget semper rutrum nulla nunc purus phasellus in felis donec
133,Cogilith,egreves3o@apache.org,+380 598 479 7741,lobortis est phasellus sit amet erat nulla tempus vivamus in felis eu sapien cursus vestibulum proin
134,Meeveo,fblackster3p@vk.com,+7 686 473 9801,nec nisi volutpat eleifend donec ut dolor morbi vel lectus in quam fringilla rhoncus mauris enim leo rhoncus sed
135,Topicstorm,brantoul3q@theatlantic.com,+7 773 349 0979,primis in faucibus orci luctus et ultrices posuere cubilia curae
136,Pixope,afitzsymonds3r@cbsnews.com,+86 303 210 5713,libero convallis eget eleifend luctus ultricies eu nibh quisque id justo sit amet sapien dignissim vestibulum vestibulum
137,Zoovu,pdigby3s@gravatar.com,+380 289 145 8047,nunc viverra dapibus nulla suscipit ligula in lacus curabitur at ipsum ac tellus semper interdum mauris ullamcorper purus
138,Tazzy,dwillatt3t@sohu.com,+380 491 146 1457,suscipit ligula in lacus curabitur at ipsum ac tellus semper interdum
139,Skidoo,scron3u@google.pl,+46 683 384 3847,ullamcorper purus sit amet nulla quisque arcu libero rutrum ac
140,Zoonder,lganiclef3v@unblog.fr,+62 472 528 5010,maecenas pulvinar lobortis est phasellus sit amet erat nulla tempus
141,Flashspan,mhember3w@g.co,+46 322 256 0893,orci vehicula condimentum curabitur in libero ut massa volutpat convallis morbi odio odio elementum eu interdum eu tincidunt in
142,Brightdog,mshaul3x@about.me,+81 750 696 9959,ante ipsum primis in faucibus orci luctus et ultrices posuere cubilia curae mauris viverra diam vitae quam suspendisse potenti
143,Eare,tguillond3y@edublogs.org,+57 696 473 2731,morbi vel lectus in quam fringilla rhoncus mauris enim leo rhoncus sed vestibulum sit amet cursus
144,Feedbug,idebney3z@columbia.edu,+33 313 734 8589,sit amet erat nulla tempus vivamus in felis eu sapien cursus vestibulum proin eu mi nulla ac enim
145,Rhybox,ckubecka40@dedecms.com,+86 307 913 8088,luctus rutrum nulla tellus in sagittis dui vel nisl duis ac nibh fusce lacus purus aliquet at feugiat non
146,Babbleset,abesson41@miibeian.gov.cn,+62 169 416 2447,cras mi pede malesuada in imperdiet et commodo vulputate justo in
147,Tagfeed,lekins42@tripod.com,+81 387 188 5234,in tempus sit amet sem fusce consequat nulla nisl nunc nisl duis bibendum felis sed interdum venenatis turpis enim
148,Dabshots,ccrebott43@washington.edu,+86 156 992 9067,elementum eu interdum eu tincidunt in leo maecenas pulvinar lobortis est phasellus sit
149,Teklist,icollip44@qq.com,+1 697 377 2152,eget tincidunt eget tempus vel pede morbi porttitor lorem id
150,Youfeed,lzouch45@mapquest.com,+27 158 792 9754,in porttitor pede justo eu massa donec dapibus duis at
151,Flashset,abrobeck46@google.fr,+54 141 919 8821,non sodales sed tincidunt eu felis fusce posuere felis sed lacus morbi sem mauris laoreet ut rhoncus aliquet pulvinar sed
152,Meejo,nshreenan47@house.gov,+86 747 896 3838,nam dui proin leo odio porttitor id consequat in consequat ut nulla sed accumsan felis ut at dolor quis
153,Photojam,mtrevaskus48@cmu.edu,+62 251 525 0171,consequat lectus in est risus auctor sed tristique in tempus sit amet sem fusce consequat nulla nisl nunc nisl
154,Innotype,jbradborne49@nationalgeographic.com,+33 329 185 9179,mus vivamus vestibulum sagittis sapien cum sociis natoque penatibus et magnis dis parturient montes nascetur ridiculus mus
155,Zoombox,mstuart4a@elpais.com,+86 874 276 5330,id pretium iaculis diam erat fermentum justo nec condimentum neque sapien placerat ante nulla
156,Kwinu,klorenzin4b@berkeley.edu,+86 428 864 5820,lorem integer tincidunt ante vel ipsum praesent blandit lacinia erat vestibulum sed magna at nunc commodo placerat praesent blandit
157,Flipopia,asandland4c@army.mil,+1 512 976 2243,justo eu massa donec dapibus duis at velit eu est congue
158,Oyoloo,bblowing4d@liveinternet.ru,+1 770 685 6526,at turpis donec posuere metus vitae ipsum aliquam non mauris morbi non lectus aliquam sit amet diam in magna bibendum
159,Thoughtmix,cbloan4e@telegraph.co.uk,+62 610 518 6978,ac enim in tempor turpis nec euismod scelerisque quam turpis adipiscing lorem vitae mattis nibh
160,Nlounge,spalphramand4f@macromedia.com,+86 727 878 6390,in est risus auctor sed tristique in tempus sit amet sem
161,Oyoloo,eshinner4g@jigsy.com,+62 451 422 8846,integer non velit donec diam neque vestibulum eget vulputate ut ultrices vel augue vestibulum
162,Voonte,nipsly4h@chronoengine.com,+66 387 119 2728,dapibus augue vel accumsan tellus nisi eu orci mauris lacinia sapien quis libero nullam sit amet turpis elementum ligula vehicula
163,Quaxo,rharmes4i@cisco.com,+57 784 862 2406,consectetuer adipiscing elit proin interdum mauris non ligula pellentesque ultrices phasellus id sapien in
164,Meembee,tnice4j@github.com,+264 396 860 0882,sit amet turpis elementum ligula vehicula consequat morbi a ipsum integer a nibh in quis justo maecenas rhoncus
165,Topiclounge,kmerrgan4k@ucsd.edu,+84 710 679 4529,velit donec diam neque vestibulum eget vulputate ut ultrices vel augue vestibulum ante ipsum primis
166,Zooveo,esidebottom4l@techcrunch.com,+255 806 911 1568,natoque penatibus et magnis dis parturient montes nascetur ridiculus mus etiam vel augue vestibulum
167,Yata,gjaquest4m@posterous.com,+63 736 919 8170,eget nunc donec quis orci eget orci vehicula condimentum curabitur in libero ut massa volutpat
168,Tavu,jtrippick4n@gnu.org,+63 429 324 0952,venenatis lacinia aenean sit amet justo morbi ut odio cras mi pede
169,Dabshots,shasley4o@google.co.jp,+33 263 386 9185,proin eu mi nulla ac enim in tempor turpis nec euismod scelerisque quam
170,Omba,kleyborne4p@blogspot.com,+48 241 626 4565,magna at nunc commodo placerat praesent blandit nam nulla integer pede justo lacinia eget
171,Zoomcast,jbeton4q@purevolume.com,+381 178 205 9101,at nibh in hac habitasse platea dictumst aliquam augue quam sollicitudin
172,Kare,rmacgille4r@blogs.com,+62 921 804 5470,at feugiat non pretium quis lectus suspendisse potenti in eleifend quam a
