SupplierID,SupplierName,SupplierEmail,SupplierPhone,SupplierDescription
23060,Quire,ismallridgeco@usa.gov,+48 208 674 1560,vel augue vestibulum ante ipsum primis in faucibus orci luctus et ultrices
23047,Kanoodle,nproudlockcp@google.de,+7 694 259 3912,eget massa tempor convallis nulla neque libero convallis eget eleifend luctus ultricies eu nibh quisque id justo sit amet sapien dignissim vestibulum vestibulum ante ipsum primis in faucibus orci luctus et ultrices posuere cubilia
23068,Rhynoodle,gofeeneycq@tumblr.com,+7 234 122 1844,nunc rhoncus dui vel sem sed sagittis nam congue risus semper porta volutpat quam pede lobortis ligula sit amet
23689,Blogtag,ogeindrecr@huffingtonpost.com,+86 540 948 1620,quis libero nullam sit amet turpis elementum ligula vehicula consequat morbi a ipsum integer a nibh in quis justo maecenas rhoncus aliquam lacus morbi quis tortor id nulla ultrices aliquet maecenas leo odio condimentum id luctus nec molestie sed justo pellentesque viverra pede ac diam cras pellentesque volutpat dui maecenas
23834,Tagtune,sblakemorecs@cisco.com,+54 458 549 3570,mi sit amet lobortis sapien sapien non mi integer ac neque duis bibendum morbi non quam nec dui luctus rutrum nulla tellus in sagittis dui vel nisl duis ac nibh fusce lacus purus aliquet at feugiat non pretium
23130,InnoZ,kprynct@unc.edu,+86 296 783 0982,justo morbi ut odio cras mi pede malesuada in imperdiet
23408,Babbleset,ckiernancu@homestead.com,+855 127 231 4072,cubilia curae nulla dapibus dolor vel est donec odio justo sollicitudin ut suscipit a feugiat et eros vestibulum ac
23653,Flipstorm,dmackindercv@soundcloud.com,+86 884 996 6719,mauris sit amet eros suspendisse accumsan tortor quis turpis sed ante vivamus tortor duis mattis egestas metus aenean fermentum donec ut mauris eget massa tempor convallis nulla neque libero convallis eget eleifend luctus ultricies eu nibh quisque id justo sit
23668,Edgeclub,slinnercw@mac.com,+86 865 668 3806,varius ut blandit non interdum in ante vestibulum ante ipsum
23226,Zazio,pingredacx@deviantart.com,+63 580 397 1821,lacinia erat vestibulum sed magna at nunc commodo placerat praesent blandit nam nulla integer pede justo lacinia eget tincidunt eget tempus vel pede morbi porttitor lorem id ligula suspendisse ornare consequat lectus in est risus auctor sed tristique in tempus sit amet sem fusce consequat
23802,Zoombeat,vrubinovcy@desdev.cn,+86 923 398 3009,vestibulum sit amet cursus id turpis integer aliquet massa id lobortis convallis tortor risus dapibus augue vel accumsan tellus nisi eu orci mauris lacinia sapien quis libero nullam sit amet turpis elementum ligula vehicula consequat morbi a ipsum integer a nibh in quis justo maecenas rhoncus aliquam lacus morbi quis
23768,Devshare,wowtramcz@paginegialle.it,+86 537 322 8258,porttitor id consequat in consequat ut nulla sed accumsan felis ut at dolor quis odio consequat varius integer ac leo
23928,Photobug,alammengad0@earthlink.net,+62 914 654 9589,ligula vehicula consequat morbi a ipsum integer
23998,Flashspan,sbillingtond1@instagram.com,+86 262 212 0257,erat vestibulum sed magna at nunc commodo placerat praesent blandit nam nulla integer pede justo lacinia eget tincidunt eget tempus vel pede
23013,Livetube,aolooneyd2@barnesandnoble.com,+20 360 272 3411,nulla mollis molestie lorem quisque ut
23284,Innojam,jkamienskid3@devhub.com,+62 713 450 7755,luctus rutrum nulla tellus in sagittis dui vel nisl duis ac nibh fusce lacus purus aliquet at feugiat non pretium quis lectus suspendisse potenti in eleifend quam a odio in
23766,Pixoboo,kcrierd4@mediafire.com,+48 416 435 4036,habitasse platea dictumst morbi vestibulum velit id pretium iaculis diam erat fermentum justo nec condimentum neque sapien placerat ante nulla justo aliquam quis turpis eget elit sodales scelerisque mauris sit amet eros suspendisse accumsan tortor
23995,Brightbean,fjoshd5@home.pl,+62 440 868 1011,integer ac neque duis bibendum morbi non quam nec dui luctus rutrum nulla tellus in sagittis dui vel nisl duis ac nibh fusce lacus purus aliquet at feugiat non pretium quis lectus suspendisse potenti in eleifend quam a
23149,Devify,alowled6@answers.com,+375 325 499 7627,pede justo eu massa donec dapibus duis at velit eu est congue elementum in hac habitasse platea dictumst morbi vestibulum velit id pretium iaculis diam erat fermentum justo nec condimentum neque sapien placerat ante nulla justo aliquam quis turpis eget elit sodales scelerisque mauris
23828,Youbridge,njallind7@army.mil,+86 435 608 3135,lacinia aenean sit amet justo morbi ut odio cras mi pede malesuada in imperdiet et commodo vulputate justo in blandit ultrices enim lorem ipsum dolor sit amet consectetuer adipiscing elit proin interdum mauris non ligula pellentesque ultrices phasellus id sapien in sapien iaculis congue
23286,Katz,bboostd8@npr.org,+62 885 876 2179,ultrices aliquet maecenas leo odio condimentum id luctus nec molestie sed justo pellentesque viverra pede ac diam cras pellentesque volutpat dui maecenas tristique est et tempus semper est quam pharetra magna ac consequat metus sapien ut nunc vestibulum ante ipsum
23853,Quimm,rbrosiusd9@google.com.br,+86 148 812 0930,quis libero nullam sit amet turpis elementum ligula vehicula consequat morbi a ipsum integer a nibh in quis justo maecenas rhoncus aliquam lacus morbi quis tortor id nulla ultrices aliquet maecenas leo odio condimentum id luctus nec molestie sed justo pellentesque
23091,Fadeo,rbaldreyda@xinhuanet.com,+51 100 389 6605,justo sollicitudin ut suscipit a feugiat et eros vestibulum ac est lacinia nisi venenatis tristique fusce congue diam id ornare imperdiet sapien urna pretium nisl ut volutpat sapien arcu sed augue aliquam erat volutpat
23484,Tazzy,ghalheaddb@instagram.com,+64 482 591 8938,curae mauris viverra diam vitae quam suspendisse potenti nullam porttitor lacus at turpis donec posuere metus vitae ipsum aliquam non mauris morbi non lectus aliquam sit amet diam in magna bibendum imperdiet nullam orci pede venenatis non sodales sed tincidunt eu felis fusce
23774,Kwideo,elukeschdc@sina.com.cn,+86 992 608 3006,nisi eu orci mauris lacinia sapien quis libero nullam
23251,Divanoodle,rbelfragedd@yolasite.com,+62 112 463 1051,rutrum nulla nunc purus phasellus in felis donec semper sapien a libero nam dui proin leo odio porttitor id consequat in consequat ut nulla sed accumsan felis ut at dolor quis odio consequat
23095,Youfeed,dartheyde@amazon.co.uk,+86 733 707 7132,turpis nec euismod scelerisque quam turpis adipiscing lorem vitae mattis nibh ligula nec sem
23512,Meedoo,tboamedf@miibeian.gov.cn,+54 836 242 3785,nulla eget eros elementum pellentesque quisque porta volutpat erat quisque erat eros viverra eget congue eget semper rutrum nulla nunc purus phasellus in felis donec semper sapien a libero nam dui
23577,Devify,hgiacobazzidg@ebay.co.uk,+358 581 611 4579,consequat ut nulla sed accumsan felis ut at dolor quis odio consequat varius integer ac leo pellentesque ultrices mattis odio donec vitae nisi nam ultrices
23392,Devpulse,asymmsdh@wikimedia.org,+7 174 817 2214,donec ut mauris eget massa tempor convallis nulla neque libero convallis eget eleifend luctus ultricies eu nibh quisque id justo sit amet sapien dignissim vestibulum vestibulum ante ipsum primis
23681,Cogibox,mcoopdi@gravatar.com,+48 847 464 3839,interdum mauris non ligula pellentesque ultrices phasellus id sapien in sapien iaculis congue vivamus metus arcu adipiscing molestie hendrerit at vulputate vitae nisl aenean lectus pellentesque eget nunc
23443,Meevee,mrobichondj@stanford.edu,+380 325 217 4527,orci nullam molestie nibh in lectus pellentesque at nulla suspendisse potenti cras in purus eu magna vulputate luctus cum sociis natoque penatibus et magnis dis parturient montes nascetur ridiculus mus vivamus vestibulum sagittis
23714,Zava,eizacenkodk@nps.gov,+51 636 169 7425,quam nec dui luctus rutrum nulla tellus in sagittis dui vel nisl duis ac nibh fusce lacus purus aliquet at feugiat non pretium quis lectus suspendisse potenti in eleifend quam a odio in hac habitasse platea dictumst maecenas ut
23295,Eayo,dantoniodl@amazon.co.jp,+86 101 610 8930,morbi vestibulum velit id pretium iaculis
23398,Aibox,bnorthoverdm@moonfruit.com,+81 949 604 6578,convallis morbi odio odio elementum eu interdum eu tincidunt in leo maecenas pulvinar lobortis est
23740,Browseblab,srobinsondn@hibu.com,+351 261 479 3709,curae mauris viverra diam vitae quam suspendisse potenti nullam porttitor lacus at turpis donec posuere metus vitae ipsum aliquam non mauris morbi non lectus aliquam sit amet diam in magna bibendum imperdiet nullam orci pede venenatis non sodales sed tincidunt eu felis fusce posuere
23005,Yata,lbalentynedo@canalblog.com,+385 335 522 5926,mauris lacinia sapien quis libero nullam sit amet turpis elementum ligula vehicula consequat morbi a ipsum integer a nibh in quis justo maecenas rhoncus aliquam lacus morbi quis tortor id nulla ultrices aliquet maecenas leo odio condimentum id
23782,Tagtune,rmccaddendp@pcworld.com,+380 367 596 7594,nam congue risus semper porta volutpat quam pede lobortis ligula sit amet eleifend pede libero quis orci nullam molestie nibh in lectus pellentesque at nulla suspendisse potenti cras in purus eu magna vulputate
23459,Dabjam,lmcgivenadq@netlog.com,+62 843 497 8775,viverra dapibus nulla suscipit ligula in lacus curabitur at ipsum ac tellus semper interdum mauris ullamcorper purus sit amet nulla quisque arcu libero rutrum ac lobortis vel dapibus at diam nam tristique tortor eu pede
23277,Devcast,cseifdr@blogger.com,+86 730 969 1745,etiam justo etiam pretium iaculis justo in hac habitasse platea dictumst etiam faucibus cursus urna ut tellus nulla ut erat id mauris vulputate elementum nullam varius nulla facilisi cras non velit
23149,Brightbean,groderickds@tmall.com,+84 977 310 5088,ante vivamus tortor duis mattis egestas metus aenean fermentum donec ut mauris eget massa tempor convallis nulla neque libero convallis eget eleifend luctus ultricies eu nibh quisque id justo sit amet sapien dignissim vestibulum vestibulum ante ipsum primis in faucibus orci luctus et ultrices posuere cubilia curae nulla
23157,Demivee,dholahdt@de.vu,+46 700 817 4600,felis fusce posuere felis sed lacus morbi sem mauris laoreet ut rhoncus aliquet pulvinar sed nisl nunc rhoncus dui vel sem sed sagittis nam
23081,Rhynoodle,raphaledu@usgs.gov,+51 934 757 9762,tortor risus dapibus augue vel accumsan tellus nisi eu orci mauris lacinia sapien quis libero nullam
23737,Zoombeat,ksidnalldv@google.es,+48 541 181 0823,nibh in hac habitasse platea dictumst aliquam augue quam sollicitudin vitae
23015,Feedbug,csachnodw@cbc.ca,+86 162 206 9918,luctus et ultrices posuere cubilia curae duis faucibus accumsan odio curabitur convallis duis consequat dui nec nisi volutpat eleifend donec ut dolor morbi vel lectus in quam fringilla rhoncus mauris enim leo rhoncus sed vestibulum sit amet cursus id turpis integer aliquet massa id lobortis convallis tortor risus
23408,Abata,mbrassingtondx@sourceforge.net,+86 526 196 7605,faucibus accumsan odio curabitur convallis duis consequat dui nec nisi volutpat eleifend donec ut dolor morbi vel lectus in quam fringilla rhoncus mauris enim leo rhoncus sed vestibulum sit amet cursus id turpis integer aliquet massa id lobortis convallis tortor risus dapibus
23307,Buzzster,gmuzzalldy@google.cn,+372 436 989 4994,pede malesuada in imperdiet et commodo vulputate justo in blandit ultrices
23435,Zava,edillowdz@google.fr,+358 560 163 9557,libero nam dui proin leo
23678,Eayo,kolyete0@rambler.ru,+63 875 445 6819,nunc rhoncus dui vel sem sed sagittis nam congue risus semper porta volutpat quam pede lobortis ligula sit amet eleifend pede libero quis orci nullam molestie nibh in lectus pellentesque at nulla suspendisse potenti cras
23358,Edgeblab,dhaberte1@seattletimes.com,+62 819 973 9080,faucibus orci luctus et ultrices posuere cubilia curae donec pharetra magna vestibulum aliquet ultrices erat tortor sollicitudin mi sit amet lobortis sapien sapien
23113,Blogspan,ebenzae2@istockphoto.com,+86 309 441 0358,felis donec semper sapien a libero nam dui proin leo odio porttitor id consequat in consequat ut nulla sed accumsan felis
23438,Bubbletube,bsansume3@dagondesign.com,+7 282 716 0606,ante ipsum primis in faucibus orci luctus et ultrices
23374,Layo,imcgookine4@google.com.br,+86 570 916 0937,quam sapien varius ut blandit non interdum in ante vestibulum ante ipsum primis in faucibus orci luctus et ultrices posuere cubilia curae duis faucibus accumsan odio curabitur
23216,Jaxnation,lellingsworthe5@kickstarter.com,+86 306 924 5525,dictumst morbi vestibulum velit id pretium iaculis diam erat fermentum justo nec condimentum neque sapien placerat ante nulla justo aliquam quis turpis eget elit sodales scelerisque mauris sit amet eros
23895,Flipbug,sabrahamssone6@yelp.com,+7 411 162 4841,odio porttitor id consequat in consequat ut nulla sed accumsan felis ut at dolor quis odio consequat varius integer ac leo pellentesque ultrices mattis odio donec vitae nisi nam ultrices libero non mattis pulvinar nulla pede ullamcorper augue a suscipit
23939,Plambee,sdeortegae7@nbcnews.com,+62 631 510 6585,phasellus in felis donec semper sapien a libero nam dui proin leo odio porttitor id consequat in consequat ut nulla sed accumsan felis ut at dolor quis odio consequat varius integer ac leo pellentesque ultrices mattis odio donec vitae
23655,Skimia,wferraresie8@cdc.gov,+86 109 634 8600,nibh fusce lacus purus aliquet at feugiat non pretium quis lectus suspendisse potenti in eleifend quam a odio in hac habitasse platea dictumst
23741,Blogtag,whodcrofte9@smugmug.com,+66 135 479 2546,justo lacinia eget tincidunt eget tempus vel pede morbi porttitor lorem id ligula suspendisse ornare consequat lectus in est risus auctor sed tristique in tempus sit amet sem fusce consequat nulla nisl nunc nisl duis bibendum felis sed interdum venenatis turpis enim blandit mi in porttitor pede justo eu massa
23635,Myworks,tkilduffea@sina.com.cn,+7 776 164 9644,maecenas pulvinar lobortis est phasellus sit amet erat nulla tempus vivamus in felis eu sapien cursus vestibulum proin
23439,Wikibox,qwillsoneb@netvibes.com,+63 348 364 4711,morbi vel lectus in quam fringilla rhoncus mauris enim leo rhoncus sed vestibulum sit amet cursus id turpis integer aliquet massa id lobortis convallis tortor risus dapibus augue vel accumsan tellus nisi eu orci mauris lacinia sapien quis libero nullam
23600,Plambee,kbarfootec@xinhuanet.com,+46 257 479 8195,aenean auctor gravida sem praesent id massa id nisl venenatis lacinia aenean sit amet justo morbi ut odio cras mi
23327,Voonder,kcarswelled@histats.com,+57 845 629 9586,volutpat eleifend donec ut dolor morbi vel lectus in quam fringilla rhoncus mauris enim leo rhoncus sed vestibulum sit amet cursus id turpis integer aliquet massa id lobortis convallis tortor risus dapibus augue vel accumsan tellus nisi eu orci mauris lacinia
23426,Gigazoom,vmcdonoghee@seattletimes.com,+7 572 929 8813,vel accumsan tellus nisi eu orci mauris lacinia sapien quis libero nullam sit amet turpis elementum ligula vehicula consequat morbi a ipsum integer a nibh in quis justo maecenas rhoncus aliquam lacus morbi quis tortor id nulla ultrices aliquet maecenas leo odio
23170,Devbug,todonnellyef@elpais.com,+62 795 290 9402,ante ipsum primis in faucibus orci luctus et ultrices posuere cubilia curae donec
23877,Yoveo,jbegwelleg@live.com,+86 737 571 0066,libero rutrum ac lobortis vel dapibus at diam nam tristique tortor
23728,Gigashots,sluciaeh@huffingtonpost.com,+86 996 913 9613,amet erat nulla tempus vivamus
23694,Babbleopia,blosemannei@bbc.co.uk,+1 654 822 1476,justo aliquam quis turpis eget elit sodales scelerisque mauris sit amet eros suspendisse accumsan tortor quis turpis sed ante vivamus tortor duis mattis egestas metus aenean fermentum donec ut mauris eget massa tempor convallis nulla neque libero convallis eget eleifend luctus ultricies eu nibh quisque id
23451,Browsecat,dpraundlej@craigslist.org,+33 859 100 7892,duis aliquam convallis nunc proin at turpis a pede posuere nonummy integer non velit donec diam neque
23005,Plambee,sdubarryek@360.cn,+686 358 719 8736,vestibulum ante ipsum primis in faucibus orci luctus et ultrices posuere cubilia curae duis faucibus accumsan odio curabitur convallis duis consequat dui nec nisi volutpat eleifend donec ut dolor morbi
23543,Agimba,bbarrittel@yelp.com,+86 861 776 5531,posuere cubilia curae mauris viverra diam vitae quam suspendisse potenti nullam porttitor lacus at turpis donec posuere metus vitae ipsum aliquam non mauris morbi non lectus aliquam sit
23611,Livetube,asmartmanem@illinois.edu,+82 361 554 5384,metus sapien ut nunc vestibulum ante ipsum primis in faucibus orci luctus et ultrices posuere cubilia curae mauris viverra diam vitae quam suspendisse potenti nullam
23193,Edgetag,rnorthallen@upenn.edu,+54 976 136 6375,quis lectus suspendisse potenti in eleifend quam a odio in hac habitasse platea dictumst maecenas ut massa quis augue luctus tincidunt nulla mollis molestie lorem quisque ut erat curabitur gravida nisi at nibh in hac habitasse platea dictumst aliquam augue quam
23159,Avaveo,taddiseo@unc.edu,+86 609 565 9086,quis orci nullam molestie nibh in lectus pellentesque at nulla suspendisse potenti cras in purus eu magna vulputate luctus cum sociis natoque penatibus et magnis dis parturient montes nascetur ridiculus mus vivamus vestibulum sagittis sapien cum sociis natoque penatibus et magnis
23841,Shufflester,cflucksep@ifeng.com,+351 921 507 7687,quam fringilla rhoncus mauris enim leo rhoncus sed vestibulum sit amet cursus id turpis integer aliquet massa id lobortis convallis tortor risus dapibus augue vel accumsan tellus nisi eu orci mauris lacinia
23812,Kimia,apopplewelleq@go.com,+234 343 783 5561,etiam vel augue vestibulum rutrum
23010,Jaxnation,aglassopper@ifeng.com,+86 868 245 9741,vulputate elementum nullam varius nulla facilisi cras non velit nec nisi vulputate nonummy maecenas tincidunt lacus at velit vivamus vel nulla eget eros elementum pellentesque quisque porta volutpat erat quisque erat eros viverra eget congue eget semper rutrum nulla nunc purus phasellus in
23745,Demizz,dmarmiones@netvibes.com,+353 593 305 9055,sapien cum sociis natoque penatibus et magnis dis parturient montes nascetur ridiculus mus etiam vel augue vestibulum rutrum rutrum neque aenean auctor gravida sem praesent id massa id nisl venenatis lacinia aenean sit amet justo morbi ut odio cras mi pede malesuada in imperdiet
23218,Katz,jquinceyet@epa.gov,+86 256 585 1765,pede posuere nonummy integer non velit donec diam neque vestibulum eget vulputate ut ultrices vel augue vestibulum ante ipsum
23057,Wordify,telstubeu@yellowbook.com,+46 399 881 0237,vestibulum quam sapien varius ut blandit non interdum in ante vestibulum ante ipsum primis in faucibus orci luctus et ultrices posuere cubilia curae duis faucibus accumsan odio curabitur convallis duis consequat dui nec nisi volutpat
23276,Skalith,bsizeev@dailymotion.com,+63 842 768 6661,aliquam convallis nunc proin at
23788,Brightbean,cyushmanovew@nsw.gov.au,+1 201 763 2937,aliquet pulvinar sed nisl nunc rhoncus dui vel sem sed sagittis nam congue risus semper porta volutpat quam pede lobortis ligula sit amet eleifend pede libero quis
23056,Feedbug,csimenonex@webs.com,+972 451 210 1235,luctus tincidunt nulla mollis molestie lorem quisque ut erat curabitur gravida nisi at nibh in hac habitasse platea dictumst aliquam augue quam sollicitudin vitae consectetuer eget rutrum at
23229,Zoonder,gpulsterey@discuz.net,+62 266 830 5110,quis odio consequat varius integer ac leo pellentesque ultrices mattis odio donec vitae nisi nam ultrices libero non mattis pulvinar nulla pede ullamcorper augue a suscipit nulla
23076,Twimbo,bwollersez@house.gov,+33 159 245 9897,rutrum neque aenean auctor gravida sem praesent id massa id nisl venenatis lacinia aenean sit amet justo morbi ut odio cras mi pede malesuada
23154,Agimba,ecadyf0@yale.edu,+382 116 606 2033,sed justo pellentesque viverra pede ac diam cras pellentesque volutpat dui maecenas tristique est et
23848,Topdrive,dmcdonoughf1@ed.gov,+52 570 387 9852,pretium quis lectus suspendisse potenti in eleifend quam a odio in hac habitasse platea dictumst maecenas ut massa quis augue luctus tincidunt nulla mollis molestie lorem quisque ut erat
23630,Ainyx,rnorthcliffef2@goodreads.com,+86 307 508 1599,tempor turpis nec euismod scelerisque quam turpis adipiscing lorem vitae
23943,Quamba,frobersf3@geocities.com,+62 213 948 2861,fusce lacus purus aliquet at feugiat non pretium quis lectus suspendisse potenti in eleifend quam a odio in hac habitasse platea dictumst maecenas ut massa quis augue luctus tincidunt nulla mollis molestie lorem quisque ut erat curabitur gravida nisi at nibh in hac
23427,Realpoint,lstollenf4@dmoz.org,+86 623 674 0210,ipsum integer a nibh in quis justo maecenas rhoncus aliquam lacus morbi quis tortor id nulla ultrices aliquet maecenas leo
23242,Fadeo,aneaversonf5@barnesandnoble.com,+7 951 986 8353,vulputate ut ultrices vel augue vestibulum ante ipsum primis in faucibus orci luctus et ultrices posuere cubilia curae donec pharetra magna vestibulum aliquet ultrices erat tortor sollicitudin mi sit amet lobortis sapien sapien non mi integer ac neque duis bibendum morbi non
23038,Skyvu,lbuzinf6@rediff.com,+7 957 671 0384,platea dictumst aliquam augue quam
23135,Camido,bkernerf7@nih.gov,+86 516 836 7098,ultrices erat tortor sollicitudin mi sit amet lobortis sapien sapien non mi integer ac neque duis bibendum morbi non quam
23249,Rhybox,iladef8@squidoo.com,+62 176 909 5845,sapien sapien non mi integer ac neque duis bibendum morbi non quam nec dui luctus rutrum
23886,Pixope,ksimmonitef9@reuters.com,+48 947 704 9481,sapien sapien non mi integer ac neque duis bibendum morbi non quam nec dui luctus rutrum nulla tellus in sagittis dui vel nisl duis ac nibh fusce lacus purus aliquet at feugiat non pretium quis lectus suspendisse potenti in eleifend quam a odio in hac habitasse platea dictumst maecenas ut
23364,Mynte,jmanifieldfa@paginegialle.it,+86 616 984 2690,est donec odio justo sollicitudin ut suscipit a feugiat et eros vestibulum ac est lacinia nisi venenatis tristique fusce congue
23288,Kare,ojaeggifb@photobucket.com,+86 651 173 0249,libero convallis eget eleifend luctus ultricies eu nibh quisque id justo sit amet sapien dignissim vestibulum vestibulum ante ipsum primis in
23623,Zoomlounge,rstrattenfc@seesaa.net,+55 995 792 7899,pellentesque eget nunc donec quis
23584,Skinder,dstarrsfd@gravatar.com,+48 797 927 7740,laoreet ut rhoncus aliquet pulvinar sed nisl nunc rhoncus dui vel sem
23459,Eabox,dthornfe@usa.gov,+51 974 854 1930,donec semper sapien a libero nam dui
23577,Innotype,rgilliganff@360.cn,+351 171 834 8681,eu massa donec dapibus duis at velit eu est congue elementum in hac habitasse platea dictumst morbi vestibulum velit id pretium iaculis diam erat fermentum justo nec condimentum neque sapien placerat ante nulla justo aliquam quis turpis eget elit sodales scelerisque mauris sit
23877,Gigabox,acharrettfg@unc.edu,+963 863 833 2132,sem mauris laoreet ut rhoncus aliquet pulvinar sed nisl
23112,Dabvine,dlordonfh@homestead.com,+55 616 711 4623,ultricies eu nibh quisque id justo sit amet sapien dignissim vestibulum vestibulum ante ipsum primis in faucibus
23647,Nlounge,vshovlinfi@merriam-webster.com,+1 911 897 1783,in sagittis dui vel nisl duis ac nibh fusce lacus purus aliquet at feugiat non pretium quis lectus suspendisse potenti in eleifend quam a odio in hac habitasse platea dictumst maecenas ut massa quis augue luctus tincidunt nulla mollis molestie lorem quisque ut erat curabitur gravida nisi at nibh
23921,Ooba,gclappertonfj@stumbleupon.com,+380 959 182 1561,odio consequat varius integer ac leo pellentesque ultrices mattis odio donec vitae nisi nam ultrices libero non mattis pulvinar nulla pede ullamcorper augue a suscipit nulla elit ac nulla sed vel enim sit amet nunc viverra dapibus nulla suscipit ligula in lacus curabitur at ipsum ac tellus semper interdum mauris
23895,Chatterbridge,gmckitterickfk@sitemeter.com,+86 900 991 7761,suspendisse potenti nullam porttitor lacus at turpis donec posuere metus vitae
23414,Viva,ndurrancefl@bluehost.com,+375 166 725 0155,ipsum integer a nibh in quis justo maecenas rhoncus aliquam lacus morbi quis tortor id nulla ultrices aliquet maecenas leo odio condimentum id luctus nec molestie sed justo pellentesque viverra pede ac diam cras pellentesque volutpat dui maecenas tristique est et tempus semper est quam pharetra magna ac consequat metus
23348,Flipopia,rmatiewefm@walmart.com,+234 724 843 8495,nec dui luctus rutrum nulla tellus in
23144,Riffpath,tdomanfn@ning.com,+963 560 101 7011,dui maecenas tristique est et tempus semper est quam pharetra magna ac consequat metus sapien ut nunc vestibulum ante ipsum primis in faucibus orci luctus et ultrices posuere cubilia curae mauris viverra diam vitae quam suspendisse potenti nullam porttitor lacus at turpis donec posuere metus vitae ipsum aliquam non
23863,Demimbu,tcawthryfo@arizona.edu,+98 255 380 7326,dolor sit amet consectetuer adipiscing elit proin risus praesent lectus vestibulum quam sapien varius ut blandit non interdum in ante vestibulum ante ipsum primis in faucibus orci luctus et ultrices posuere cubilia curae duis faucibus accumsan odio curabitur convallis duis consequat dui nec nisi volutpat eleifend donec ut dolor morbi
23469,Skinder,rparisfp@netscape.com,+81 810 515 3495,erat quisque erat eros viverra eget congue eget semper rutrum nulla nunc purus phasellus in felis donec semper sapien a libero nam dui proin leo odio porttitor id consequat in consequat ut nulla sed accumsan felis ut at dolor quis odio consequat varius integer ac leo pellentesque ultrices mattis odio
