SupplierID,SupplierName,SupplierEmail,SupplierPhone,SupplierDescription
23250,Wikibox,fpeters6b@cbc.ca,+967 169 458 0055,tortor risus dapibus augue vel accumsan tellus nisi eu orci mauris lacinia sapien quis libero nullam sit amet turpis elementum ligula vehicula consequat morbi a ipsum integer a nibh in quis
23798,Rhynyx,ascholz6c@merriam-webster.com,+33 820 657 5548,adipiscing lorem vitae mattis nibh ligula nec sem duis aliquam convallis nunc proin at turpis a pede posuere nonummy integer non velit donec diam neque vestibulum eget vulputate ut ultrices vel augue vestibulum ante ipsum primis in faucibus orci luctus et ultrices posuere cubilia curae donec pharetra magna vestibulum
23811,Buzzbean,jandrioni6d@sakura.ne.jp,+7 719 919 9897,erat eros viverra eget congue eget semper rutrum
23932,Browseblab,rbaggelley6e@economist.com,+86 914 746 2740,congue elementum in hac habitasse platea dictumst morbi vestibulum velit id pretium iaculis diam erat fermentum justo nec condimentum neque sapien placerat ante nulla justo aliquam quis turpis
23352,Thoughtstorm,echaize6f@moonfruit.com,+387 998 426 5093,a feugiat et eros vestibulum ac est lacinia nisi venenatis tristique fusce congue diam id ornare imperdiet sapien urna pretium nisl ut volutpat sapien arcu sed augue aliquam erat volutpat in congue etiam justo etiam pretium iaculis justo in
23147,Demizz,aratt6g@wiley.com,+86 196 666 3879,aliquet massa id lobortis convallis tortor risus dapibus augue vel accumsan tellus nisi eu orci
23757,Quinu,jkerr6h@ehow.com,+62 487 499 5002,tortor risus dapibus augue vel accumsan tellus nisi eu orci mauris lacinia sapien quis libero nullam sit amet turpis elementum ligula vehicula consequat morbi a
23017,Zoomzone,astuckes6i@goo.ne.jp,+95 740 877 7923,pellentesque ultrices mattis odio donec vitae nisi nam ultrices libero non mattis pulvinar nulla pede ullamcorper augue a
23852,Vitz,bwyatt6j@sourceforge.net,+55 872 449 6437,accumsan odio curabitur convallis duis consequat dui nec nisi volutpat eleifend donec ut dolor morbi vel lectus in
23818,Quire,odowding6k@shareasale.com,+7 544 962 4562,commodo vulputate justo in blandit ultrices enim lorem ipsum dolor sit amet consectetuer adipiscing elit proin interdum mauris non ligula pellentesque ultrices phasellus id sapien in sapien iaculis congue vivamus metus arcu adipiscing molestie hendrerit at vulputate vitae nisl aenean lectus pellentesque eget nunc donec quis
23676,Dabjam,bcolliss6l@pen.io,+7 851 472 5871,fermentum donec ut mauris eget massa tempor convallis nulla neque libero convallis eget eleifend luctus ultricies eu nibh quisque id justo sit amet sapien dignissim vestibulum vestibulum ante ipsum primis in
23719,Quinu,teasthope6m@ehow.com,+46 722 513 1778,faucibus orci luctus et ultrices posuere cubilia curae donec pharetra magna vestibulum aliquet
23237,Eayo,hdargue6n@alexa.com,+351 196 640 5216,sapien ut nunc vestibulum ante ipsum primis in faucibus orci luctus
23268,Oloo,mmumberson6o@chicagotribune.com,+993 464 940 1034,montes nascetur ridiculus mus etiam vel augue vestibulum rutrum rutrum neque aenean auctor gravida sem praesent id massa id nisl venenatis lacinia aenean sit amet justo morbi ut odio cras mi pede malesuada in imperdiet et commodo vulputate justo in blandit ultrices
23358,Kare,tpoundford6p@unesco.org,+595 970 490 7252,id mauris vulputate elementum nullam varius nulla facilisi cras non velit nec nisi vulputate nonummy maecenas tincidunt lacus at velit vivamus vel nulla eget eros elementum pellentesque quisque porta volutpat erat quisque erat eros viverra eget congue eget semper rutrum nulla nunc purus phasellus
23589,Zoomzone,dscarth6q@reference.com,+86 512 547 6957,porttitor lacus at turpis donec posuere metus vitae ipsum aliquam non mauris morbi non lectus aliquam sit amet diam in magna
23401,Podcat,nhierro6r@illinois.edu,+63 978 776 1486,facilisi cras non velit nec nisi vulputate nonummy maecenas tincidunt
23589,Flipstorm,hbloxsum6s@sciencedaily.com,+86 170 114 8512,hac habitasse platea dictumst aliquam augue quam sollicitudin vitae consectetuer eget rutrum at lorem integer tincidunt ante vel ipsum praesent
23295,Minyx,mchuney6t@rambler.ru,+86 868 352 2050,nulla neque libero convallis eget eleifend luctus ultricies eu nibh quisque id justo sit amet sapien dignissim vestibulum vestibulum ante ipsum primis in faucibus orci luctus et ultrices posuere cubilia curae nulla dapibus dolor vel est donec odio justo sollicitudin ut suscipit a feugiat et
23650,Flashdog,bmcmaster6u@pcworld.com,+62 923 332 4172,integer pede justo lacinia eget tincidunt eget tempus vel pede morbi porttitor lorem id ligula suspendisse ornare consequat lectus in est risus auctor sed tristique in
23424,Meedoo,ykestell6v@auda.org.au,+62 761 231 0277,erat nulla tempus vivamus in felis eu sapien cursus vestibulum proin eu mi
23611,Realblab,fpurrier6w@toplist.cz,+62 730 363 6716,duis faucibus accumsan odio curabitur convallis duis consequat dui nec nisi volutpat eleifend donec ut dolor morbi vel lectus in quam fringilla rhoncus mauris enim leo rhoncus sed vestibulum sit amet cursus id turpis integer aliquet
23523,Skalith,sscamp6x@friendfeed.com,+351 408 699 4553,turpis sed ante vivamus tortor duis mattis egestas metus aenean fermentum donec ut
23868,Thoughtblab,erochester6y@quantcast.com,+92 789 989 8953,morbi non quam nec dui luctus rutrum nulla
23054,Twimm,zlortzing6z@ucsd.edu,+1 499 330 7886,est quam pharetra magna ac consequat metus sapien ut nunc vestibulum ante ipsum primis in faucibus orci luctus et ultrices posuere cubilia curae mauris viverra diam vitae quam suspendisse
23886,Topiclounge,fpirot70@msu.edu,+507 681 635 9317,eu massa donec dapibus duis at velit eu est congue elementum in hac habitasse platea dictumst morbi vestibulum velit
23693,Quaxo,rgarrard71@statcounter.com,+54 488 743 2527,turpis nec euismod scelerisque quam turpis adipiscing lorem vitae mattis nibh ligula nec sem duis aliquam convallis nunc proin
23788,Demivee,dgreder72@t.co,+62 216 217 6212,eleifend luctus ultricies eu nibh quisque id justo sit amet sapien dignissim vestibulum vestibulum ante
23465,Dabfeed,dgarretts73@telegraph.co.uk,+56 608 619 4302,ut ultrices vel augue vestibulum ante ipsum primis in faucibus orci luctus et ultrices posuere cubilia curae donec pharetra magna vestibulum aliquet ultrices erat tortor sollicitudin mi sit amet lobortis
23007,Gabvine,rmurrock74@craigslist.org,+7 690 667 2838,curae nulla dapibus dolor vel est donec odio justo sollicitudin ut suscipit a feugiat et eros vestibulum ac est lacinia nisi venenatis tristique fusce congue diam id ornare imperdiet sapien urna pretium nisl ut volutpat sapien
23441,Twinte,kduny75@instagram.com,+970 268 959 9651,nonummy maecenas tincidunt lacus at velit vivamus vel nulla eget eros elementum pellentesque quisque porta volutpat erat quisque erat eros viverra eget congue eget semper rutrum nulla nunc purus phasellus in
23982,Gabvine,esumbler76@rediff.com,+36 668 243 3979,ligula suspendisse ornare consequat lectus in est risus auctor
23618,Oyope,hwolstencroft77@wikispaces.com,+7 490 230 9854,id lobortis convallis tortor risus dapibus augue vel accumsan tellus nisi eu orci mauris lacinia sapien quis libero nullam sit amet turpis elementum ligula vehicula consequat morbi a ipsum integer a nibh in quis justo maecenas rhoncus aliquam lacus morbi quis tortor id nulla ultrices aliquet maecenas leo odio
23011,Oodoo,cgarn78@nba.com,+7 204 217 1087,id lobortis convallis tortor risus dapibus augue vel accumsan tellus nisi eu orci mauris lacinia sapien quis libero nullam sit amet
23880,Zooxo,mweall79@princeton.edu,+48 834 139 4949,nec nisi vulputate nonummy maecenas tincidunt lacus at velit vivamus vel nulla eget eros elementum pellentesque
23661,Wordpedia,mstandon7a@spotify.com,+48 613 539 6118,condimentum id luctus nec molestie sed justo pellentesque viverra pede ac
23034,Jabberbean,abessett7b@google.com.au,+44 896 161 0867,vitae nisi nam ultrices libero non mattis pulvinar nulla pede ullamcorper augue a suscipit nulla elit ac nulla sed vel enim sit amet nunc viverra dapibus
23858,Flipopia,ksleit7c@drupal.org,+1 823 569 6660,sem praesent id massa id nisl venenatis lacinia aenean sit amet justo morbi ut odio cras
23885,Flashdog,mmarham7d@4shared.com,+92 913 204 0438,tortor id nulla ultrices aliquet maecenas leo odio condimentum id luctus nec molestie sed justo pellentesque viverra pede ac diam cras pellentesque volutpat dui maecenas tristique est et tempus semper est quam pharetra magna ac
23536,Gabspot,tminchin7e@xinhuanet.com,+58 828 710 9969,urna pretium nisl ut volutpat sapien arcu sed augue aliquam erat
23895,Rhynoodle,hlots7f@digg.com,+977 420 116 9591,in porttitor pede justo eu massa donec dapibus duis at velit eu est congue elementum in hac habitasse platea dictumst morbi vestibulum velit id pretium iaculis diam erat fermentum justo nec condimentum neque sapien placerat ante nulla justo aliquam quis turpis eget elit sodales scelerisque mauris sit
23248,Zoonder,speever7g@printfriendly.com,+27 769 982 7952,vulputate justo in blandit ultrices enim lorem ipsum dolor sit amet consectetuer adipiscing elit proin interdum
23147,Myworks,ycalifornia7h@google.com,+351 165 886 5796,adipiscing molestie hendrerit at vulputate vitae nisl aenean lectus
23138,Minyx,aczajkowska7i@who.int,+967 832 533 3489,porttitor id consequat in consequat ut nulla sed accumsan felis ut at dolor quis odio consequat varius integer ac leo pellentesque ultrices mattis odio donec vitae nisi
23872,Skalith,smaxweell7j@smugmug.com,+380 368 770 1372,phasellus in felis donec semper sapien a libero nam dui proin leo odio porttitor id consequat in consequat ut nulla sed accumsan felis ut at dolor quis odio consequat varius integer ac leo pellentesque ultrices mattis odio donec vitae nisi nam ultrices libero non mattis pulvinar
23400,Tagopia,mshout7k@earthlink.net,+507 351 822 8995,mauris laoreet ut rhoncus aliquet pulvinar sed nisl nunc rhoncus dui
23624,LiveZ,dweld7l@1688.com,+86 751 309 1251,dui luctus rutrum nulla tellus in sagittis dui vel nisl duis ac nibh fusce lacus purus aliquet at feugiat non pretium quis lectus suspendisse potenti in eleifend quam a odio
23328,Wikibox,mhariot7m@comcast.net,+237 855 234 5194,ultrices vel augue vestibulum ante ipsum primis in
23917,Aimbu,aneller7n@yellowpages.com,+54 406 544 0654,dapibus nulla suscipit ligula in lacus curabitur at ipsum ac tellus semper interdum mauris ullamcorper purus sit amet nulla quisque arcu libero rutrum ac lobortis vel dapibus at diam nam tristique
23520,InnoZ,ssturgeon7o@webeden.co.uk,+86 769 490 1198,porta volutpat erat quisque erat eros
23811,Gabtype,tmidghall7p@gmpg.org,+55 757 823 6321,amet cursus id turpis integer aliquet massa id lobortis convallis tortor risus dapibus augue vel accumsan tellus nisi eu orci mauris lacinia sapien quis libero nullam sit amet turpis elementum ligula vehicula consequat morbi a ipsum integer a nibh in quis justo maecenas rhoncus aliquam lacus morbi quis tortor
23960,Youopia,cburgott7q@webeden.co.uk,+81 447 364 6173,tortor quis turpis sed ante vivamus tortor duis mattis egestas metus aenean fermentum donec ut mauris eget massa tempor convallis nulla neque
23123,Tagpad,aoppery7r@cisco.com,+963 822 394 3927,placerat praesent blandit nam nulla integer pede justo lacinia eget tincidunt eget tempus vel pede morbi porttitor lorem id ligula suspendisse ornare consequat lectus in est risus auctor sed tristique in tempus sit amet
23040,Eidel,aelcoux7s@china.com.cn,+60 238 199 5554,sed augue aliquam erat volutpat in congue etiam justo etiam pretium iaculis justo in hac habitasse platea dictumst etiam faucibus cursus urna ut tellus nulla ut erat id mauris vulputate elementum nullam varius nulla facilisi cras non velit
23612,Wordtune,zsans7t@google.es,+86 606 472 5884,morbi quis tortor id nulla ultrices aliquet maecenas leo odio condimentum id luctus nec molestie sed justo pellentesque viverra pede ac diam cras
23260,Zoombeat,lmattisssen7u@51.la,+381 104 111 1168,aenean lectus pellentesque eget nunc donec quis orci eget orci vehicula condimentum curabitur in libero ut massa volutpat
23188,Yodo,mferreiro7v@admin.ch,+86 912 531 2334,mollis molestie lorem quisque ut erat curabitur gravida nisi at nibh in hac habitasse platea dictumst aliquam augue quam sollicitudin
23091,Skinte,tquarles7w@comsenz.com,+372 534 750 1342,id consequat in consequat ut nulla sed accumsan felis ut at dolor quis odio consequat varius integer ac leo pellentesque ultrices mattis odio donec vitae nisi nam ultrices libero non mattis pulvinar nulla pede ullamcorper augue a suscipit nulla elit
23354,Dablist,bellif7x@nba.com,+33 260 565 7810,ante vestibulum ante ipsum primis in faucibus orci
23762,Thoughtstorm,gdaton7y@goo.ne.jp,+7 569 625 7326,suspendisse potenti in eleifend quam a odio in hac habitasse platea dictumst maecenas ut massa quis augue luctus tincidunt nulla mollis molestie lorem quisque ut erat curabitur gravida nisi at nibh in hac habitasse platea dictumst aliquam augue
23578,Photobean,rhurdis7z@yellowbook.com,+55 502 264 2648,iaculis diam erat fermentum justo nec condimentum
23810,Jabberstorm,mmahody80@spiegel.de,+53 415 164 1630,dolor sit amet consectetuer adipiscing elit proin risus praesent lectus vestibulum quam sapien varius ut blandit non interdum in ante vestibulum ante ipsum primis in faucibus orci luctus et ultrices posuere cubilia curae duis faucibus accumsan odio curabitur convallis duis consequat dui nec nisi volutpat eleifend donec
23769,Twitternation,ebotler81@com.com,+58 773 408 1946,consequat in consequat ut nulla sed accumsan felis ut at dolor quis odio consequat varius integer ac leo pellentesque
23869,Photolist,hwinridge82@51.la,+234 255 356 0573,ac est lacinia nisi venenatis tristique fusce congue diam id ornare imperdiet sapien urna pretium nisl ut volutpat sapien arcu sed augue aliquam erat volutpat in
23824,Quatz,mfeechan83@ebay.com,+86 522 572 1615,massa tempor convallis nulla neque libero convallis eget eleifend luctus ultricies eu nibh quisque id justo sit amet sapien dignissim vestibulum vestibulum ante ipsum primis in faucibus orci luctus et ultrices posuere cubilia curae nulla dapibus dolor vel est donec odio justo sollicitudin ut suscipit
23788,Feedfire,jsouttar84@google.com.hk,+62 449 236 8961,lectus suspendisse potenti in eleifend quam a odio in hac habitasse platea
23218,Viva,marber85@posterous.com,+86 870 992 1715,vel nisl duis ac nibh fusce lacus purus aliquet at feugiat non pretium quis lectus suspendisse potenti in eleifend quam a odio in hac habitasse platea dictumst maecenas ut massa quis augue luctus tincidunt nulla mollis molestie lorem
23437,Ainyx,mlorek86@storify.com,+62 841 164 4823,nunc rhoncus dui vel sem sed sagittis nam congue risus semper porta volutpat quam pede lobortis ligula sit amet eleifend pede libero quis orci nullam molestie nibh in lectus pellentesque at nulla suspendisse potenti cras in purus eu magna vulputate luctus cum sociis natoque penatibus et magnis dis parturient montes
23409,Fatz,msalack87@twitpic.com,+98 683 152 8021,quis turpis sed ante vivamus tortor duis mattis egestas metus aenean fermentum donec ut mauris eget massa tempor convallis nulla neque libero convallis
23338,Tagpad,kcoveny88@gmpg.org,+55 854 873 6280,lacus morbi quis tortor id nulla ultrices aliquet maecenas leo odio condimentum id luctus nec molestie sed justo pellentesque viverra pede ac diam cras
23685,Fiveclub,lperrington89@google.de,+7 838 600 7044,nascetur ridiculus mus etiam vel augue vestibulum
23212,Realcube,cdonizeau8a@bing.com,+48 397 956 5738,proin interdum mauris non ligula pellentesque ultrices phasellus id sapien in sapien iaculis congue vivamus metus arcu adipiscing molestie hendrerit at vulputate vitae nisl aenean lectus pellentesque eget nunc donec quis orci eget orci vehicula condimentum curabitur in
23989,Realbuzz,nradeliffe8b@hc360.com,+86 576 396 1728,tempor turpis nec euismod scelerisque quam turpis adipiscing lorem vitae mattis nibh ligula nec sem duis aliquam convallis nunc proin at turpis a pede posuere nonummy integer non velit donec diam neque vestibulum eget vulputate
23027,Browsecat,hendle8c@biblegateway.com,+51 298 657 9456,pede venenatis non sodales sed tincidunt
23589,Jazzy,kdiament8d@tripod.com,+234 423 888 0880,consectetuer adipiscing elit proin risus praesent lectus vestibulum quam sapien varius ut blandit non interdum in ante vestibulum ante ipsum primis in faucibus
23296,Yakidoo,bphalip8e@geocities.jp,+420 837 370 7255,curabitur in libero ut massa volutpat convallis morbi odio odio elementum eu interdum eu tincidunt in leo
23365,Eimbee,gtacker8f@e-recht24.de,+62 367 130 2307,habitasse platea dictumst aliquam augue quam sollicitudin vitae consectetuer eget rutrum at lorem integer tincidunt ante vel ipsum praesent blandit lacinia erat vestibulum sed magna at
23219,Zoomdog,lbuxcey8g@skyrock.com,+420 424 616 1103,turpis donec posuere metus vitae ipsum aliquam non mauris morbi non lectus aliquam sit amet diam in magna bibendum imperdiet nullam orci pede venenatis non sodales sed tincidunt eu felis fusce posuere felis sed lacus
23155,Izio,naisman8h@istockphoto.com,+46 300 426 0156,donec semper sapien a libero nam dui proin leo odio porttitor id consequat in consequat ut nulla sed accumsan felis ut at dolor quis odio consequat varius integer ac
23561,Realcube,kteml8i@walmart.com,+254 430 862 3789,in hac habitasse platea dictumst aliquam augue quam sollicitudin vitae consectetuer eget rutrum at lorem integer tincidunt ante vel ipsum praesent blandit
23079,Tagtune,mmattack8j@constantcontact.com,+86 534 839 6221,pede ac diam cras pellentesque volutpat dui maecenas tristique est et tempus semper est quam pharetra magna ac consequat metus sapien ut nunc vestibulum ante ipsum primis in faucibus orci luctus et ultrices posuere cubilia curae mauris
23718,Omba,aburlingame8k@spotify.com,+63 604 290 0611,lacinia sapien quis libero nullam sit amet turpis elementum ligula vehicula
23897,Teklist,rbrittle8l@comcast.net,+57 235 353 2115,erat quisque erat eros viverra eget congue eget semper rutrum nulla nunc purus phasellus in felis donec semper
23700,Gigazoom,lsmedley8m@delicious.com,+351 322 637 5524,euismod scelerisque quam turpis adipiscing lorem vitae mattis nibh ligula nec sem duis aliquam convallis nunc proin at turpis a pede posuere nonummy integer non velit donec diam neque vestibulum eget vulputate ut ultrices vel augue vestibulum ante ipsum primis in faucibus orci
23904,Skyndu,nhardage8n@ask.com,+420 858 151 8328,integer aliquet massa id lobortis convallis tortor risus dapibus augue vel accumsan tellus nisi eu orci mauris lacinia sapien quis libero nullam sit amet turpis elementum ligula vehicula consequat
23369,Dabvine,nblacklawe8o@sfgate.com,+94 534 375 4108,ut nunc vestibulum ante ipsum primis in faucibus orci luctus et ultrices posuere cubilia curae mauris viverra diam vitae quam suspendisse potenti nullam porttitor lacus at turpis donec posuere metus vitae ipsum aliquam non mauris morbi non lectus aliquam sit amet
23738,Abatz,afarnall8p@4shared.com,+86 948 594 7167,fusce posuere felis sed lacus morbi sem mauris laoreet ut rhoncus aliquet pulvinar sed nisl nunc rhoncus dui vel sem sed sagittis nam congue risus semper
23493,Fivespan,apoppleston8q@huffingtonpost.com,+93 255 175 1471,molestie sed justo pellentesque viverra pede ac diam cras pellentesque volutpat dui maecenas tristique est et tempus semper est quam pharetra magna ac consequat metus sapien ut nunc vestibulum ante ipsum primis in faucibus orci luctus et ultrices posuere cubilia curae mauris viverra diam vitae
23209,Linkbuzz,lkops8r@java.com,+7 219 934 1635,vestibulum ante ipsum primis in faucibus orci
23188,Realmix,fbartelli8s@msn.com,+381 176 962 9981,leo odio porttitor id consequat in consequat ut nulla sed accumsan felis ut at dolor quis odio consequat varius integer ac leo pellentesque ultrices mattis odio donec vitae
23184,Demizz,dsedgefield8t@mozilla.com,+375 374 152 6270,ac est lacinia nisi venenatis tristique fusce congue diam id ornare imperdiet sapien urna
23935,Gigazoom,rdunbavin8u@sun.com,+225 266 555 0983,rhoncus dui vel sem sed sagittis nam congue risus semper porta volutpat quam pede lobortis ligula sit amet eleifend pede libero quis orci nullam molestie nibh in lectus pellentesque at nulla suspendisse potenti cras in purus eu magna vulputate luctus cum sociis natoque penatibus et magnis dis parturient montes nascetur
23261,Wordware,sharte8v@fema.gov,+86 851 392 6883,nibh fusce lacus purus aliquet at feugiat non pretium quis lectus suspendisse potenti in eleifend quam a odio
23277,Minyx,bsanchiz8w@discovery.com,+62 317 910 6363,velit vivamus vel nulla eget eros elementum pellentesque quisque porta volutpat erat quisque erat eros viverra eget congue
23147,Mycat,rbeiderbecke8x@bluehost.com,+351 436 759 4936,odio in hac habitasse platea dictumst maecenas ut massa quis augue
23884,Jaxnation,kgreenier8y@fema.gov,+46 992 222 3166,iaculis justo in hac habitasse platea dictumst etiam faucibus cursus urna ut tellus nulla ut erat id mauris vulputate elementum nullam varius nulla facilisi cras non velit nec nisi vulputate nonummy maecenas tincidunt lacus at velit vivamus vel nulla eget eros elementum pellentesque quisque porta volutpat
23586,Zooveo,ptappor8z@purevolume.com,+1 458 723 8803,ante ipsum primis in faucibus orci luctus et ultrices posuere cubilia curae mauris viverra diam vitae quam suspendisse potenti nullam porttitor lacus at turpis donec posuere metus vitae ipsum aliquam non mauris morbi non
23728,Photojam,mbreffit90@yelp.com,+7 358 194 5748,rutrum nulla tellus in sagittis dui vel nisl duis
23370,Meeveo,bweekley91@youku.com,+33 632 979 1332,odio porttitor id consequat in consequat ut nulla sed accumsan felis ut at dolor quis odio consequat
23960,Realbuzz,hbangham92@unicef.org,+33 264 961 7666,a nibh in quis justo maecenas rhoncus aliquam lacus morbi quis tortor id nulla ultrices aliquet maecenas leo odio condimentum id luctus nec molestie sed justo pellentesque viverra pede ac diam cras pellentesque volutpat dui maecenas tristique est et tempus
23488,Twinte,spiniur93@e-recht24.de,+86 653 477 8309,sociis natoque penatibus et magnis dis parturient montes nascetur ridiculus mus vivamus
23107,Thoughtstorm,wpounder94@princeton.edu,+251 455 945 4643,maecenas tincidunt lacus at velit vivamus vel nulla eget eros elementum pellentesque quisque porta volutpat erat quisque erat eros viverra eget congue eget semper rutrum nulla nunc purus phasellus in felis donec semper sapien
23827,Zoombeat,jreely95@cam.ac.uk,+62 307 749 1840,pellentesque volutpat dui maecenas tristique est et tempus semper est quam pharetra magna ac consequat metus sapien ut nunc vestibulum ante ipsum primis in faucibus orci luctus et ultrices posuere cubilia curae mauris viverra diam vitae quam suspendisse potenti nullam porttitor lacus at turpis donec posuere metus
23367,Dabshots,kcuskery96@aboutads.info,+7 265 719 2478,convallis tortor risus dapibus augue vel accumsan tellus nisi eu orci mauris lacinia sapien quis libero nullam sit amet turpis elementum ligula vehicula consequat morbi a ipsum integer a nibh in quis justo maecenas rhoncus aliquam lacus morbi quis tortor id nulla ultrices
23128,Brainlounge,elovitt97@webs.com,+86 268 455 2662,vitae mattis nibh ligula nec sem duis aliquam convallis nunc proin
23603,Twinte,bwathell98@sitemeter.com,+7 205 474 7389,nascetur ridiculus mus vivamus vestibulum sagittis sapien cum sociis natoque penatibus et magnis dis parturient montes nascetur ridiculus mus etiam vel augue vestibulum rutrum rutrum neque aenean auctor gravida sem praesent id massa id nisl venenatis lacinia aenean sit amet justo morbi ut odio
23371,Lajo,gbennike99@army.mil,+381 154 205 1225,commodo placerat praesent blandit nam nulla integer pede justo lacinia eget tincidunt eget tempus vel pede morbi porttitor lorem id ligula suspendisse ornare consequat lectus
23650,Reallinks,frusk9a@ehow.com,+86 794 297 8842,ut mauris eget massa tempor convallis nulla neque libero convallis eget eleifend luctus ultricies eu nibh quisque id justo sit amet sapien dignissim vestibulum vestibulum ante ipsum primis in faucibus orci luctus et ultrices posuere cubilia curae nulla dapibus dolor vel est donec odio justo
23128,Leenti,mblaze9b@google.ca,+86 903 282 0516,dolor sit amet consectetuer adipiscing elit proin interdum mauris non ligula pellentesque ultrices phasellus id sapien in sapien iaculis congue vivamus metus arcu adipiscing molestie hendrerit
23214,Mudo,ctzuker9c@cam.ac.uk,+86 725 900 3660,mattis odio donec vitae nisi nam ultrices libero non mattis pulvinar nulla pede ullamcorper augue a suscipit nulla elit ac nulla sed vel enim sit amet nunc viverra dapibus nulla suscipit ligula in lacus curabitur at ipsum ac tellus semper interdum mauris ullamcorper purus
23117,Riffpedia,moglassane9d@nbcnews.com,+86 719 681 5795,tellus in sagittis dui vel nisl duis ac nibh fusce
23188,Wordpedia,amilillo9e@bluehost.com,+86 508 184 2495,semper est quam pharetra magna ac consequat metus sapien ut nunc vestibulum ante ipsum primis in faucibus orci
23990,Realfire,gkinforth9f@etsy.com,+86 711 778 1067,justo lacinia eget tincidunt eget tempus vel pede morbi porttitor lorem id ligula suspendisse ornare consequat lectus in est risus auctor sed tristique in tempus sit amet sem fusce consequat nulla nisl nunc nisl duis bibendum felis sed interdum venenatis turpis
23260,Blogtags,ghilbourne9g@chron.com,+966 549 140 1379,eros elementum pellentesque quisque porta volutpat erat quisque erat eros viverra eget congue
23838,Yabox,cagerskow9h@cornell.edu,+507 729 923 7815,quam sapien varius ut blandit non interdum in ante vestibulum ante ipsum primis in faucibus orci luctus et ultrices posuere cubilia curae duis faucibus accumsan odio curabitur
23753,Bluejam,fpeacock9i@kickstarter.com,+7 931 658 1503,pharetra magna vestibulum aliquet ultrices erat tortor sollicitudin mi sit amet lobortis sapien
