SupplierID,SupplierName,SupplierEmail,SupplierPhone,SupplierDescription
19001,Devify,rmcreynold0@nba.com,+86 838 714 3664,pulvinar nulla pede ullamcorper augue a suscipit nulla elit ac nulla sed vel
19002,Riffpedia,egoodhay1@spiegel.de,+86 886 296 8844,phasellus id sapien in sapien iaculis congue vivamus metus arcu adipiscing
19003,Ozu,czanetello2@instagram.com,+7 254 304 6650,eget tempus vel pede morbi porttitor lorem id ligula suspendisse ornare consequat lectus in est risus
19004,Jaloo,xlamprecht3@blog.com,+234 213 340 5525,semper rutrum nulla nunc purus phasellus in felis donec semper sapien a libero nam dui proin leo odio porttitor id consequat in consequat
19005,Livefish,dnodin4@buzzfeed.com,+880 834 126 7500,eu orci mauris lacinia sapien quis libero nullam sit amet turpis elementum ligula vehicula consequat morbi a ipsum integer a nibh in
19006,Jamia,sisacsson5@paypal.com,+230 934 272 9800,commodo placerat praesent blandit nam nulla integer pede justo lacinia eget tincidunt eget tempus vel pede morbi porttitor lorem
19007,Einti,salyutin6@people.com.cn,+420 747 518 1018,ante ipsum primis in faucibus orci luctus et ultrices posuere cubilia curae duis faucibus
19008,Realcube,jashfold7@tripadvisor.com,+62 209 665 5746,turpis adipiscing lorem vitae mattis nibh ligula nec sem duis aliquam convallis nunc proin at turpis a pede posuere
19009,Shufflebeat,cbinder8@com.com,+66 223 582 9007,sed accumsan felis ut at dolor quis odio consequat varius integer ac leo pellentesque ultrices mattis odio donec vitae nisi nam ultrices libero non
19010,Vinder,jpetrescu9@scientificamerican.com,+86 700 287 9690,semper interdum mauris ullamcorper purus sit amet nulla quisque arcu libero rutrum ac lobortis vel dapibus at diam
19011,Youbridge,eshewana@sina.com.cn,+351 899 329 5164,pretium nisl ut volutpat sapien arcu sed
19012,Devshare,sloobyb@virginia.edu,+63 747 445 6726,non mauris morbi non lectus aliquam sit amet diam in magna bibendum imperdiet nullam orci pede venenatis
19013,Tagcat,lharrismithc@edublogs.org,+86 890 903 6272,sagittis nam congue risus semper porta
19014,Twimbo,abrinklerd@dmoz.org,+7 507 620 3260,orci vehicula condimentum curabitur in libero ut
19015,Chatterpoint,aburgyne@addtoany.com,+977 221 379 2328,consequat in consequat ut nulla
19016,Demizz,njullianf@newyorker.com,+850 815 919 9086,nisl duis bibendum felis sed interdum venenatis turpis enim blandit mi in porttitor pede justo eu massa donec dapibus duis at velit eu est
19017,Gabspot,efrancombeg@npr.org,+976 930 141 2216,convallis tortor risus dapibus augue vel accumsan tellus nisi eu
19018,Blognation,cwicklingh@vimeo.com,+960 637 957 8197,velit donec diam neque vestibulum eget vulputate ut ultrices vel augue vestibulum ante ipsum primis in faucibus orci luctus et
19019,Photobug,egronnoi@biblegateway.com,+7 285 887 9276,lacinia erat vestibulum sed magna at nunc commodo placerat praesent blandit nam nulla
19020,Twimbo,shexhamj@nbcnews.com,+34 807 954 5474,mattis nibh ligula nec sem duis aliquam convallis nunc proin at turpis a pede posuere nonummy integer non velit donec diam neque vestibulum eget
19021,Yoveo,knelthorpek@ed.gov,+48 553 508 1389,vestibulum ac est lacinia nisi venenatis tristique fusce congue diam id ornare imperdiet sapien urna pretium nisl ut volutpat
19022,Youspan,kadlaml@guardian.co.uk,+86 679 946 0577,curabitur in libero ut massa volutpat convallis morbi odio odio
19023,Oyonder,onajafianm@amazon.co.uk,+7 598 894 8611,tellus nulla ut erat id mauris vulputate elementum nullam varius nulla facilisi
19024,Buzzdog,obrandassin@bravesites.com,+81 122 278 6306,lorem quisque ut erat curabitur gravida nisi at nibh
19025,Jatri,shollingbyo@plala.or.jp,+351 439 461 4210,at velit vivamus vel nulla eget eros elementum pellentesque quisque porta volutpat erat quisque erat eros viverra eget congue eget semper rutrum nulla
19026,Roodel,sleistp@wufoo.com,+967 238 608 3658,eleifend donec ut dolor morbi vel lectus in quam fringilla rhoncus mauris enim leo rhoncus sed vestibulum sit amet
19027,Eadel,afinlryq@theguardian.com,+55 875 628 8314,odio cras mi pede malesuada in imperdiet et commodo vulputate justo in blandit ultrices enim lorem ipsum dolor sit amet consectetuer adipiscing
19028,Yoveo,abaudainsr@wikipedia.org,+27 280 649 3098,turpis adipiscing lorem vitae mattis nibh ligula nec sem duis aliquam convallis nunc proin at turpis a pede posuere nonummy integer non velit donec diam
19029,Tekfly,mbalentynes@home.pl,+46 809 121 2223,ut mauris eget massa tempor
19030,Flashdog,bbasindalet@opensource.org,+52 144 966 1233,orci mauris lacinia sapien quis libero nullam sit amet turpis elementum ligula
19031,Jaxworks,fdullaghanu@sbwire.com,+33 986 332 3511,augue vestibulum ante ipsum primis in faucibus orci luctus et ultrices posuere cubilia curae donec pharetra magna
19032,Riffwire,dtzarv@craigslist.org,+359 376 362 2339,magna at nunc commodo placerat praesent blandit nam nulla integer pede justo lacinia eget
19033,Buzzster,gferraronew@istockphoto.com,+507 810 822 9564,sed ante vivamus tortor duis mattis egestas metus aenean fermentum donec ut mauris eget massa tempor convallis nulla
19034,Meejo,acarrivickx@domainmarket.com,+63 120 914 4570,ligula pellentesque ultrices phasellus id sapien in sapien iaculis congue vivamus metus arcu adipiscing molestie hendrerit at vulputate vitae nisl
19035,Mynte,glayey@ifeng.com,+233 742 362 8062,nibh ligula nec sem duis aliquam convallis nunc proin at turpis a pede posuere nonummy integer non velit donec diam neque
19036,Twitterworks,veburahz@java.com,+66 475 113 5188,pede lobortis ligula sit amet eleifend pede libero quis orci nullam molestie nibh
19037,Trilith,omatic10@samsung.com,+33 311 420 7502,curae nulla dapibus dolor vel est donec odio
19038,Jabbercube,agarred11@skyrock.com,+63 300 863 4388,nibh in lectus pellentesque at nulla
19039,Mybuzz,bcowterd12@wunderground.com,+82 582 155 2203,porta volutpat quam pede lobortis ligula sit amet eleifend
19040,Skynoodle,glockley13@yellowbook.com,+218 494 868 4382,habitasse platea dictumst maecenas ut
19041,Talane,fmunehay14@earthlink.net,+1 134 256 1726,et commodo vulputate justo in blandit ultrices enim lorem ipsum
19042,Eare,lmonteith15@google.ca,+62 630 362 7292,posuere cubilia curae donec pharetra magna vestibulum aliquet ultrices erat tortor sollicitudin mi sit amet lobortis sapien sapien non mi integer
19043,Youopia,dbarbrick16@booking.com,+66 727 285 8472,tempus vel pede morbi porttitor lorem id ligula suspendisse ornare consequat lectus in est risus auctor sed tristique in
19044,Camimbo,jdearle17@buzzfeed.com,+86 633 552 8289,rutrum neque aenean auctor gravida sem praesent id massa id nisl venenatis lacinia aenean sit amet
19045,Aivee,glinzee18@washingtonpost.com,+976 739 461 4050,non mi integer ac neque duis bibendum morbi non quam nec dui luctus rutrum nulla tellus in sagittis dui vel
19046,Viva,lwildish19@tumblr.com,+46 380 967 5916,nascetur ridiculus mus etiam vel augue vestibulum rutrum rutrum neque aenean auctor gravida sem praesent id massa id nisl venenatis lacinia
19047,Wordpedia,rchalliner1a@hexun.com,+57 698 174 8761,porttitor lacus at turpis donec posuere metus vitae ipsum aliquam non mauris morbi non lectus aliquam sit amet diam in magna bibendum imperdiet nullam
19048,Quaxo,fdallywater1b@w3.org,+86 652 941 3456,in hac habitasse platea dictumst
19049,Browsetype,eheardman1c@dot.gov,+593 626 490 7315,ultrices posuere cubilia curae mauris viverra diam vitae quam suspendisse potenti nullam porttitor lacus at turpis donec posuere metus vitae
19050,Thoughtbridge,egreader1d@soup.io,+46 496 222 6535,mauris enim leo rhoncus sed
19051,Flashpoint,cohannen1e@intel.com,+7 488 657 5401,magna vestibulum aliquet ultrices erat tortor sollicitudin
19052,Oozz,clittlechild1f@hubpages.com,+51 776 461 1232,ut suscipit a feugiat et eros vestibulum ac est lacinia nisi venenatis tristique
19053,Babbleset,kday1g@gravatar.com,+33 513 129 8374,sed lacus morbi sem mauris laoreet ut rhoncus aliquet pulvinar sed nisl nunc rhoncus dui vel sem sed sagittis nam congue risus semper porta volutpat
19054,Gigaclub,cduetsche1h@statcounter.com,+48 571 400 8055,at turpis a pede posuere nonummy integer non velit donec diam neque vestibulum eget vulputate
19055,Photobean,amarguerite1i@nba.com,+976 448 126 9279,euismod scelerisque quam turpis adipiscing lorem vitae
19056,Minyx,lpaler1j@ezinearticles.com,+95 747 173 4330,leo rhoncus sed vestibulum sit amet cursus id turpis integer aliquet massa id lobortis convallis tortor risus dapibus augue vel accumsan tellus nisi eu
19057,Thoughtworks,blismore1k@blogspot.com,+62 532 843 7115,nulla quisque arcu libero rutrum ac lobortis vel dapibus at
19058,Leexo,oneno1l@msu.edu,+55 301 514 0484,aliquam erat volutpat in congue etiam justo etiam pretium iaculis justo in hac
19059,Thoughtsphere,gwyatt1m@guardian.co.uk,+62 693 772 9663,ante ipsum primis in faucibus orci luctus et ultrices posuere cubilia curae duis faucibus accumsan odio curabitur convallis duis consequat dui
19060,Oyonder,jscurrey1n@google.co.jp,+504 869 256 2972,arcu adipiscing molestie hendrerit at vulputate vitae nisl aenean lectus pellentesque eget nunc donec quis orci eget
19061,Eire,msongust1o@go.com,+507 228 931 5242,lectus suspendisse potenti in eleifend quam a odio in hac habitasse platea dictumst maecenas ut massa quis augue luctus
19062,Tazzy,tridgedell1p@wix.com,+86 989 857 6098,arcu adipiscing molestie hendrerit at vulputate vitae nisl aenean lectus pellentesque eget nunc donec quis orci eget orci vehicula condimentum
19063,Gigabox,wlincoln1q@theatlantic.com,+31 813 748 9078,pede justo eu massa donec dapibus duis at velit eu est congue
19064,Browsebug,lwhiskerd1r@infoseek.co.jp,+62 772 838 7934,consequat dui nec nisi volutpat eleifend donec ut dolor morbi vel lectus in quam fringilla rhoncus mauris enim leo rhoncus sed vestibulum sit amet cursus
19065,Tagopia,nlehrian1s@ted.com,+976 928 872 5516,et tempus semper est quam pharetra magna ac consequat metus sapien ut nunc vestibulum
19066,Tazzy,cmouth1t@youtube.com,+63 620 741 8798,sit amet lobortis sapien sapien non mi integer ac neque
19067,Browsetype,cwalak1u@omniture.com,+36 328 736 5704,suspendisse ornare consequat lectus in est risus auctor sed tristique
19068,Quimba,mmohammad1v@thetimes.co.uk,+269 577 535 7636,tincidunt eu felis fusce posuere felis sed lacus morbi sem mauris laoreet ut rhoncus aliquet pulvinar sed nisl nunc rhoncus dui vel
19069,Quatz,bdulany1w@hud.gov,+355 317 972 6784,odio curabitur convallis duis consequat dui nec nisi volutpat eleifend donec ut dolor morbi
19070,Zooxo,lstraughan1x@arstechnica.com,+86 230 174 9590,odio odio elementum eu interdum eu tincidunt in
19071,Voolia,jvasyutin1y@geocities.jp,+62 281 205 3151,ultrices erat tortor sollicitudin mi sit amet lobortis sapien sapien non mi integer ac neque duis bibendum morbi non quam nec dui luctus
19072,Photojam,smacsherry1z@digg.com,+375 579 151 1641,vivamus tortor duis mattis egestas metus aenean fermentum donec ut mauris eget massa tempor convallis nulla neque libero convallis
19073,Roomm,nshucksmith20@t.co,+355 373 954 8722,purus sit amet nulla quisque arcu libero rutrum ac lobortis vel dapibus at diam nam
19074,Wordify,hdibdall21@posterous.com,+62 615 665 8298,vestibulum vestibulum ante ipsum primis in faucibus orci luctus et ultrices posuere cubilia curae nulla dapibus dolor vel
19075,Topdrive,iwestwater22@vkontakte.ru,+229 136 953 6944,in faucibus orci luctus et ultrices posuere
19076,Browsedrive,imoyne23@admin.ch,+33 848 233 3194,vestibulum ante ipsum primis in faucibus orci luctus et ultrices posuere cubilia curae nulla dapibus dolor vel est donec odio justo sollicitudin
19077,Photospace,qspelwood24@goodreads.com,+46 426 706 1039,aliquam augue quam sollicitudin vitae consectetuer eget rutrum at lorem integer tincidunt ante vel ipsum praesent blandit lacinia erat vestibulum sed magna at
19078,Livetube,nheadrick25@desdev.cn,+593 473 237 2307,nulla suspendisse potenti cras in purus eu magna vulputate luctus cum sociis natoque penatibus et magnis dis parturient
19079,Topicblab,aiashvili26@instagram.com,+63 845 236 9303,habitasse platea dictumst etiam faucibus cursus urna ut tellus nulla ut erat id mauris vulputate elementum
19080,Youtags,hgristock27@desdev.cn,+691 929 850 7869,faucibus orci luctus et ultrices posuere cubilia curae mauris viverra diam vitae quam suspendisse potenti nullam
19081,Centidel,bgoom28@time.com,+7 784 867 4395,phasellus id sapien in sapien iaculis congue vivamus metus arcu adipiscing molestie hendrerit at
19082,Meevee,tkleis29@trellian.com,+420 649 617 6704,in consequat ut nulla sed accumsan felis ut at dolor quis odio consequat varius
19083,Miboo,gshepperd2a@state.gov,+62 661 561 9835,mauris non ligula pellentesque ultrices phasellus id sapien in sapien iaculis congue vivamus metus arcu adipiscing molestie hendrerit at vulputate vitae nisl aenean lectus pellentesque
19084,Trudoo,dminico2b@jimdo.com,+420 288 998 1939,integer non velit donec diam neque vestibulum eget vulputate ut ultrices vel augue vestibulum ante ipsum primis in faucibus orci luctus et ultrices
19085,Meevee,runwins2c@indiatimes.com,+7 524 809 6153,sit amet lobortis sapien sapien non mi integer ac neque duis bibendum morbi non quam nec dui luctus rutrum nulla
19086,Twimm,akubasiewicz2d@google.com.au,+380 557 106 5916,dui proin leo odio porttitor id consequat in consequat ut nulla sed accumsan felis ut
19087,Devbug,rlennie2e@tmall.com,+1 137 129 3469,id sapien in sapien iaculis congue vivamus metus arcu adipiscing molestie hendrerit at vulputate vitae nisl aenean lectus pellentesque eget nunc donec quis orci
19088,Babbleopia,mmanklow2f@apache.org,+63 766 535 5654,libero convallis eget eleifend luctus ultricies
19089,Photobug,kmckenney2g@ihg.com,+33 697 656 7424,eleifend donec ut dolor morbi vel lectus in quam
19090,Fanoodle,lbenne2h@example.com,+51 614 325 7763,nisi nam ultrices libero non mattis pulvinar nulla pede ullamcorper augue a suscipit nulla elit ac nulla sed vel enim sit amet
19091,Eabox,bpallasch2i@bigcartel.com,+86 310 588 4646,neque aenean auctor gravida sem
19092,Zoombox,cquaintance2j@examiner.com,+62 497 508 0423,tortor risus dapibus augue vel accumsan tellus nisi eu orci mauris lacinia sapien quis libero nullam sit
19093,Gigashots,ccaney2k@blog.com,+255 915 392 3824,volutpat erat quisque erat eros viverra eget congue eget semper rutrum
19094,Browsedrive,bbalchen2l@forbes.com,+1 369 289 3692,pede ac diam cras pellentesque volutpat dui maecenas
19095,Bluezoom,rdeinhardt2m@google.com.hk,+63 447 299 1278,suscipit ligula in lacus curabitur at ipsum ac tellus semper interdum mauris ullamcorper purus sit amet nulla quisque arcu libero rutrum ac
19096,Youfeed,cmussett2n@deviantart.com,+62 641 244 5957,tortor risus dapibus augue vel
19097,Divanoodle,edrewclifton2o@reddit.com,+234 748 603 7691,luctus et ultrices posuere cubilia curae
19098,JumpXS,lduligal2p@ebay.com,+51 672 343 0779,nec nisi volutpat eleifend donec ut dolor morbi vel lectus in quam fringilla
19099,Feedbug,bkidd2q@mozilla.org,+86 975 958 6240,tellus nisi eu orci mauris lacinia sapien quis libero
19100,Eayo,hworrell2r@home.pl,+86 420 862 4009,sit amet cursus id turpis integer aliquet massa id
19101,Jabberstorm,plejean2s@elpais.com,+7 828 640 9956,rutrum at lorem integer tincidunt ante vel
19102,Gevee,mtremellan2t@pen.io,+351 939 290 1291,eget nunc donec quis orci eget orci
19103,Jaxbean,jgenty2u@prlog.org,+51 188 168 4892,eget rutrum at lorem integer tincidunt
19104,Dabvine,hwadelin2v@google.com,+86 731 528 4097,risus auctor sed tristique in tempus sit amet sem fusce consequat nulla nisl nunc nisl duis bibendum felis sed interdum venenatis turpis enim blandit
19105,Dynabox,ddarbyshire2w@fema.gov,+62 932 933 8667,ligula in lacus curabitur at ipsum ac tellus semper interdum mauris ullamcorper purus sit amet nulla
19106,Dynazzy,ckitchaside2x@amazon.co.jp,+86 253 396 2763,dictumst maecenas ut massa quis augue
19107,Katz,gmachel2y@unesco.org,+1 480 743 0739,ligula nec sem duis aliquam convallis nunc proin at turpis a pede posuere nonummy integer non velit donec diam neque vestibulum eget
19108,Latz,hbraiden2z@nifty.com,+86 648 933 8698,diam cras pellentesque volutpat dui maecenas tristique est et tempus semper est quam pharetra magna ac consequat metus sapien ut nunc vestibulum
19109,Pixope,fmatzeitis30@ning.com,+48 954 325 5759,vel augue vestibulum rutrum rutrum neque aenean auctor gravida sem praesent id massa id nisl venenatis lacinia aenean sit amet
19110,Pixoboo,cpottes31@timesonline.co.uk,+86 588 235 0044,porta volutpat erat quisque erat eros viverra eget congue eget semper rutrum nulla nunc purus
19111,Blogtag,lpingston32@newyorker.com,+48 277 523 5779,in lacus curabitur at ipsum ac tellus semper interdum mauris ullamcorper purus sit amet nulla quisque arcu libero rutrum ac lobortis
19112,Voonix,lgrayland33@uiuc.edu,+57 688 182 4884,id luctus nec molestie sed justo pellentesque viverra pede ac diam cras pellentesque volutpat dui maecenas tristique est et tempus semper est
19113,Photofeed,agammade34@clickbank.net,+57 336 776 0983,ligula sit amet eleifend pede libero quis orci nullam molestie nibh in lectus pellentesque at nulla suspendisse potenti cras in purus eu magna
19114,Skinder,rtorbard35@scientificamerican.com,+967 877 311 5350,non quam nec dui luctus rutrum nulla tellus in sagittis
19115,Edgetag,bbaline36@ft.com,+86 891 357 0842,vel augue vestibulum ante ipsum primis in faucibus orci luctus et ultrices posuere cubilia curae donec pharetra magna
19116,Edgeclub,tchatt37@boston.com,+33 451 245 6959,at lorem integer tincidunt ante vel ipsum praesent blandit lacinia erat vestibulum sed magna at nunc commodo placerat praesent
19117,Buzzshare,dvergo38@dot.gov,+86 584 347 7945,ipsum dolor sit amet consectetuer adipiscing elit proin interdum mauris non ligula pellentesque ultrices phasellus id sapien in sapien iaculis congue vivamus metus arcu
19118,Jaxspan,cmaccosto39@businessweek.com,+263 282 615 7341,nulla nunc purus phasellus in felis donec semper sapien a libero nam
19119,Rhynyx,fwinterton3a@examiner.com,+291 219 179 3623,in purus eu magna vulputate luctus cum sociis natoque penatibus et magnis dis parturient montes
19120,Photofeed,agraveson3b@businessinsider.com,+55 554 948 8394,pretium iaculis diam erat fermentum justo nec condimentum neque sapien placerat ante nulla justo aliquam quis turpis eget elit sodales scelerisque mauris
19121,Devcast,mbass3c@twitpic.com,+86 679 347 7653,luctus et ultrices posuere cubilia curae donec pharetra
19122,Roodel,bcancott3d@whitehouse.gov,+7 245 355 0177,erat vestibulum sed magna at nunc commodo placerat praesent
19123,Meevee,hmccrudden3e@netscape.com,+93 978 111 7580,faucibus orci luctus et ultrices posuere cubilia curae mauris viverra diam vitae quam suspendisse potenti nullam porttitor lacus at turpis donec posuere metus vitae
19124,Pixoboo,jdanihelka3f@java.com,+33 395 814 7499,faucibus orci luctus et ultrices posuere cubilia curae mauris viverra diam vitae quam
19125,Feedfire,ptidy3g@list-manage.com,+84 564 712 0802,luctus et ultrices posuere cubilia curae duis faucibus accumsan odio curabitur convallis duis consequat dui nec nisi volutpat eleifend donec ut dolor morbi vel lectus
19126,LiveZ,lhazelgrove3h@google.cn,+62 753 328 9688,massa donec dapibus duis at velit eu est congue elementum in hac habitasse platea dictumst
19127,Tambee,abenjafield3i@aboutads.info,+1 981 830 8313,amet turpis elementum ligula vehicula consequat morbi a
19128,Innotype,cbullen3j@scribd.com,+373 363 423 6525,ultrices posuere cubilia curae duis faucibus accumsan odio curabitur convallis duis consequat dui nec nisi volutpat eleifend donec ut
19129,Livepath,ppoles3k@deliciousdays.com,+62 162 680 6360,nullam molestie nibh in lectus pellentesque at nulla suspendisse potenti cras in purus eu magna vulputate luctus cum sociis natoque
19130,Tagpad,croels3l@answers.com,+53 579 110 7998,nec sem duis aliquam convallis nunc proin at turpis a pede posuere nonummy integer non velit donec diam neque vestibulum eget vulputate ut ultrices vel
19131,Meedoo,swardrope3m@google.ca,+86 521 721 4199,orci mauris lacinia sapien quis libero nullam sit amet turpis elementum ligula vehicula consequat
19132,Zoombeat,ssaville3n@amazon.co.jp,+86 901 610 7692,eget tincidunt eget tempus vel pede morbi porttitor lorem id ligula suspendisse ornare consequat lectus in est risus auctor sed tristique
19133,Shufflester,cbeseke3o@army.mil,+86 753 221 0531,morbi ut odio cras mi pede malesuada in imperdiet et commodo vulputate justo in
19134,Skipfire,ggobourn3p@gmpg.org,+46 114 895 6669,praesent blandit nam nulla integer pede justo lacinia eget tincidunt eget tempus vel pede morbi
19135,Skivee,kscorah3q@constantcontact.com,+30 411 752 2951,non velit donec diam neque vestibulum eget vulputate ut ultrices vel augue vestibulum ante ipsum
19136,Yambee,fnewcome3r@shareasale.com,+385 394 645 7804,quis augue luctus tincidunt nulla mollis molestie lorem quisque ut erat curabitur gravida nisi at nibh in hac habitasse platea dictumst aliquam augue quam
19137,Edgetag,lmacci3s@canalblog.com,+86 636 126 7251,felis donec semper sapien a libero nam dui proin leo odio porttitor id consequat in consequat ut nulla sed accumsan felis ut at dolor
19138,Meetz,bdantonio3t@geocities.com,+353 187 645 6131,enim sit amet nunc viverra dapibus nulla suscipit ligula in lacus curabitur at ipsum ac tellus semper interdum mauris ullamcorper purus sit amet nulla quisque
19139,Blogpad,zjenney3u@yelp.com,+351 172 256 0138,nullam sit amet turpis elementum ligula vehicula consequat morbi a ipsum integer a nibh in quis justo maecenas rhoncus
19140,Meevee,jpitts3v@quantcast.com,+7 934 239 0160,adipiscing elit proin interdum mauris non ligula pellentesque ultrices phasellus id sapien
19141,Wordpedia,vormes3w@google.es,+86 542 562 3205,felis ut at dolor quis odio consequat varius integer ac leo
19142,Babblestorm,snano3x@oracle.com,+62 767 228 1350,a libero nam dui proin
19143,Muxo,mthonger3y@cnbc.com,+48 429 919 7307,venenatis tristique fusce congue diam id
19144,Rhycero,okenwright3z@weather.com,+63 766 233 0425,turpis enim blandit mi in porttitor pede justo eu massa donec dapibus duis at velit eu est congue elementum in hac habitasse platea
19145,Thoughtworks,lackery40@wikipedia.org,+51 234 186 9575,pellentesque eget nunc donec quis orci eget orci vehicula condimentum curabitur in libero ut massa volutpat convallis morbi
19146,Skibox,aspearman41@fc2.com,+62 925 351 3268,pede justo lacinia eget tincidunt eget tempus vel pede morbi porttitor lorem id ligula suspendisse ornare consequat lectus in est risus auctor sed
19147,Jaxnation,dwalduck42@mlb.com,+55 184 511 2661,mattis egestas metus aenean fermentum donec ut mauris eget massa tempor convallis nulla neque libero convallis eget eleifend luctus ultricies
19148,Minyx,oprose43@engadget.com,+251 981 664 1606,aenean auctor gravida sem praesent id massa id nisl venenatis lacinia aenean sit amet justo morbi ut odio cras
19149,Tagpad,gmcarte44@infoseek.co.jp,+223 754 125 5975,quis augue luctus tincidunt nulla mollis molestie lorem quisque
19150,Trudeo,fwork45@gizmodo.com,+55 958 374 2005,pulvinar nulla pede ullamcorper augue a suscipit nulla elit
19151,Mybuzz,eholliar46@harvard.edu,+358 454 416 6281,dictumst morbi vestibulum velit id pretium iaculis diam erat fermentum justo nec condimentum neque sapien placerat ante nulla justo aliquam
19152,Riffwire,jtrouel47@is.gd,+351 619 765 1699,non mi integer ac neque duis bibendum morbi non quam nec dui luctus rutrum nulla tellus in
19153,Trudeo,bgarey48@usda.gov,+86 996 713 4912,sapien placerat ante nulla justo aliquam quis turpis eget elit sodales scelerisque
19154,Skibox,jfergusson49@unesco.org,+234 394 676 4301,metus sapien ut nunc vestibulum ante ipsum primis in faucibus orci
19155,Trupe,adevaney4a@topsy.com,+351 458 633 9401,primis in faucibus orci luctus et ultrices posuere cubilia curae donec pharetra magna vestibulum aliquet ultrices erat tortor sollicitudin mi
19156,Zoombeat,ldillaway4b@smugmug.com,+86 409 715 2660,pellentesque viverra pede ac diam cras pellentesque volutpat dui maecenas tristique
19157,Brainlounge,rrobardet4c@theatlantic.com,+86 541 674 5586,nulla suspendisse potenti cras in purus eu magna vulputate luctus cum sociis natoque penatibus et magnis dis parturient montes nascetur ridiculus mus vivamus vestibulum sagittis
19158,Topiczoom,gcastagnasso4d@wix.com,+380 794 194 9075,vulputate vitae nisl aenean lectus pellentesque eget nunc donec quis orci eget orci vehicula condimentum curabitur in libero ut massa volutpat convallis morbi
19159,Avamm,rmcavaddy4e@issuu.com,+27 108 797 5205,neque aenean auctor gravida sem praesent id massa id nisl venenatis lacinia aenean sit amet justo morbi ut odio cras mi
19160,Bubblemix,nmckeefry4f@4shared.com,+351 602 427 2561,curae nulla dapibus dolor vel est donec odio justo sollicitudin ut suscipit a
19161,Livetube,ktabord4g@tmall.com,+63 160 666 1890,eget massa tempor convallis nulla neque libero convallis eget eleifend luctus ultricies eu nibh quisque id justo sit amet sapien
19162,Trudeo,acarrabott4h@ow.ly,+970 122 560 6655,ipsum dolor sit amet consectetuer adipiscing
19163,Voolith,tcamock4i@economist.com,+34 970 751 8822,ante ipsum primis in faucibus orci
19164,Wikibox,wradborne4j@nymag.com,+54 662 514 2787,nullam porttitor lacus at turpis donec posuere metus vitae ipsum aliquam non mauris morbi non lectus aliquam sit amet diam
19165,Avavee,fruos4k@fc2.com,+216 196 949 1095,luctus et ultrices posuere cubilia curae duis faucibus accumsan odio curabitur convallis duis consequat dui nec
19166,Rhybox,splumbley4l@networksolutions.com,+44 858 944 8179,augue luctus tincidunt nulla mollis molestie lorem quisque ut erat
19167,Avamm,csowley4m@dion.ne.jp,+375 509 611 1115,sit amet nunc viverra dapibus nulla suscipit ligula in
19168,Trilia,mvannuchi4n@businessinsider.com,+351 500 845 5231,lorem ipsum dolor sit amet consectetuer adipiscing elit proin risus
