SupplierID,SupplierName,SupplierEmail,SupplierPhone,SupplierDescription
17169,Livetube,mganiclef4o@123-reg.co.uk,+86 161 368 5503,quam pharetra magna ac consequat metus
17170,Eayo,tbento4p@mysql.com,+62 904 107 9075,purus phasellus in felis donec semper sapien a libero nam dui proin leo odio porttitor id consequat in consequat ut nulla sed accumsan felis
17171,Oyondu,odincke4q@berkeley.edu,+385 171 301 7814,massa donec dapibus duis at velit eu est congue elementum in hac habitasse platea dictumst
17172,Topicware,ncrosdill4r@utexas.edu,+680 617 407 9017,felis ut at dolor quis odio consequat varius integer ac leo pellentesque ultrices mattis odio
17173,Roombo,ilademann4s@columbia.edu,+63 255 151 9085,amet consectetuer adipiscing elit proin interdum mauris non ligula pellentesque ultrices phasellus id sapien in sapien iaculis congue
17174,Wikizz,ahaukey4t@fastcompany.com,+86 847 607 4441,tempus vel pede morbi porttitor lorem id ligula suspendisse ornare consequat lectus in est risus auctor sed tristique
17175,Shufflebeat,dallans4u@quantcast.com,+351 159 795 2646,lorem ipsum dolor sit amet consectetuer adipiscing elit proin interdum
17176,Shufflester,nraithbie4v@cafepress.com,+57 925 954 5176,iaculis justo in hac habitasse platea dictumst etiam
17177,Demizz,dseger4w@ameblo.jp,+63 985 991 8871,leo odio porttitor id consequat in consequat
17178,Meemm,pdyte4x@miibeian.gov.cn,+86 657 800 7663,felis sed interdum venenatis turpis enim blandit mi
17179,Voomm,kwaszczykowski4y@csmonitor.com,+31 900 599 5306,ipsum ac tellus semper interdum mauris ullamcorper purus sit amet nulla
17180,Eimbee,amcmeekin4z@friendfeed.com,+509 811 954 6971,faucibus orci luctus et ultrices posuere cubilia
17181,Rhycero,ocelle50@sbwire.com,+86 344 974 0895,nulla sed accumsan felis ut at dolor quis odio consequat varius integer ac leo pellentesque ultrices mattis odio donec vitae nisi nam ultrices libero
17182,Janyx,apearmine51@census.gov,+63 392 916 5323,diam vitae quam suspendisse potenti nullam
17183,Photofeed,gdikels52@fema.gov,+66 954 144 5418,ut massa quis augue luctus tincidunt nulla mollis molestie lorem
17184,Photolist,amaclaig53@pagesperso-orange.fr,+48 119 825 1649,convallis nunc proin at turpis a pede posuere nonummy
17185,Voolith,mhillaby54@ucsd.edu,+46 298 829 4699,augue vestibulum ante ipsum primis in faucibus orci luctus et ultrices posuere cubilia
17186,Blogtags,acorwin55@umn.edu,+63 936 489 5567,aliquam sit amet diam in magna bibendum imperdiet nullam orci pede venenatis non sodales sed tincidunt eu felis fusce posuere felis sed lacus
17187,Devbug,nambrozik56@bandcamp.com,+242 435 541 8357,convallis nunc proin at turpis a pede posuere nonummy integer non
17188,Dabshots,qpierro57@dagondesign.com,+62 625 162 9067,ante ipsum primis in faucibus orci luctus et ultrices posuere cubilia curae nulla dapibus dolor
17189,Realblab,jdarracott58@google.com,+63 202 464 2699,purus sit amet nulla quisque arcu libero rutrum ac
17190,Dazzlesphere,rdomeney59@apple.com,+62 613 250 1260,quis justo maecenas rhoncus aliquam lacus morbi quis tortor id nulla ultrices aliquet maecenas
17191,Zoonder,eharmstone5a@posterous.com,+963 609 467 4612,eu tincidunt in leo maecenas pulvinar lobortis est phasellus sit amet erat nulla tempus vivamus in felis eu sapien cursus vestibulum
17192,Flipbug,aludlamme5b@uiuc.edu,+55 578 827 9043,potenti nullam porttitor lacus at turpis donec posuere metus vitae ipsum aliquam non mauris morbi non lectus aliquam
17193,Fanoodle,kpfeiffer5c@posterous.com,+51 290 252 0021,condimentum curabitur in libero ut massa volutpat convallis morbi odio
17194,Ooba,bgarling5d@sphinn.com,+86 223 313 2468,sem sed sagittis nam congue risus semper porta volutpat quam pede lobortis ligula sit amet eleifend pede libero quis orci nullam molestie nibh in
17195,Ntag,apallasch5e@cnbc.com,+1 913 132 1555,lacinia nisi venenatis tristique fusce congue diam id ornare imperdiet sapien urna
17196,Blogtags,mskaif5f@reverbnation.com,+86 299 973 5497,neque vestibulum eget vulputate ut ultrices vel augue vestibulum ante ipsum primis in
17197,Pixoboo,wmccutcheon5g@trellian.com,+7 757 207 5365,libero ut massa volutpat convallis morbi odio odio elementum eu interdum
17198,Skyble,rdavion5h@tripadvisor.com,+55 921 767 8538,integer ac leo pellentesque ultrices mattis odio donec vitae nisi nam ultrices libero non mattis pulvinar nulla pede ullamcorper augue a suscipit nulla
17199,Buzzdog,vkarczinski5i@elegantthemes.com,+86 307 174 8200,ut massa quis augue luctus tincidunt nulla mollis molestie lorem quisque ut erat curabitur gravida nisi at nibh in hac habitasse platea dictumst
17200,Feedbug,dkornel5j@jiathis.com,+62 888 571 4990,adipiscing elit proin risus praesent lectus vestibulum quam sapien varius ut blandit non interdum
17201,Fivebridge,abeentjes5k@delicious.com,+7 633 722 3588,sollicitudin mi sit amet lobortis sapien sapien non mi integer ac neque
17202,Linktype,bcurragh5l@surveymonkey.com,+81 455 546 0069,pellentesque at nulla suspendisse potenti cras in purus eu magna vulputate luctus
17203,Oba,srackam5m@comcast.net,+62 834 313 6948,quis augue luctus tincidunt nulla mollis
17204,Oyoba,hfullard5n@shutterfly.com,+81 909 488 7111,vulputate vitae nisl aenean lectus pellentesque eget nunc donec quis orci eget orci vehicula
17205,Layo,dalmond5o@geocities.com,+670 702 679 4847,eu sapien cursus vestibulum proin eu mi nulla ac enim in tempor turpis nec euismod scelerisque
17206,Jazzy,estyan5p@bloglines.com,+86 756 454 3060,sapien cum sociis natoque penatibus et magnis dis parturient montes
17207,Tavu,agerardeaux5q@gov.uk,+385 648 440 9863,dolor sit amet consectetuer adipiscing elit proin risus praesent lectus vestibulum quam sapien varius
17208,Leenti,aannable5r@live.com,+86 187 222 8865,mauris laoreet ut rhoncus aliquet pulvinar sed nisl nunc rhoncus dui vel sem sed
17209,Browsecat,aglendining5s@webnode.com,+86 199 139 8242,feugiat non pretium quis lectus
17210,Vinte,dhess5t@delicious.com,+46 132 599 0902,maecenas ut massa quis augue luctus tincidunt nulla mollis molestie
17211,Innotype,tdurkin5u@php.net,+54 393 274 3265,id justo sit amet sapien dignissim vestibulum vestibulum ante ipsum primis
17212,Zoomcast,ldurn5v@census.gov,+52 674 811 7500,bibendum morbi non quam nec dui luctus rutrum nulla tellus in sagittis dui vel nisl duis ac nibh fusce lacus purus aliquet
17213,Tagpad,rlaphorn5w@odnoklassniki.ru,+380 991 370 3736,nullam molestie nibh in lectus pellentesque at nulla suspendisse potenti cras in purus eu magna vulputate luctus
17214,Wikivu,ashadrack5x@redcross.org,+856 995 108 5967,semper rutrum nulla nunc purus phasellus in felis donec semper sapien a libero nam dui proin leo odio porttitor id consequat in consequat
17215,Bubbletube,ggamell5y@samsung.com,+86 760 137 0820,congue elementum in hac habitasse
17216,Demimbu,lferronel5z@deviantart.com,+230 523 343 2899,mauris laoreet ut rhoncus aliquet pulvinar sed nisl nunc rhoncus dui vel sem sed sagittis nam congue risus semper porta volutpat quam pede lobortis ligula
17217,Quimba,mbutts60@ft.com,+46 465 652 7034,morbi non quam nec dui luctus rutrum nulla tellus in sagittis dui vel nisl
17218,Reallinks,cyele61@mit.edu,+54 277 766 8698,posuere felis sed lacus morbi sem mauris laoreet ut rhoncus aliquet pulvinar sed nisl nunc rhoncus dui vel sem sed sagittis nam congue
17219,Kazu,zmyhan62@comcast.net,+351 464 253 6042,vitae ipsum aliquam non mauris morbi non lectus aliquam sit amet diam in magna bibendum imperdiet nullam orci pede venenatis non sodales
17220,Voolia,cbowra63@sakura.ne.jp,+58 956 223 6293,id luctus nec molestie sed justo pellentesque viverra
17221,Buzzbean,fsallter64@bing.com,+996 412 247 1734,in felis donec semper sapien a libero nam dui proin leo odio porttitor id consequat in consequat ut nulla sed accumsan felis
17222,Fiveclub,fmcasparan65@hostgator.com,+51 323 188 8457,pede justo eu massa donec dapibus duis at velit eu est congue elementum in hac habitasse
17223,Zoovu,tprugel66@1und1.de,+507 108 500 9107,massa tempor convallis nulla neque libero convallis eget eleifend luctus ultricies eu
17224,Dynabox,sgilbane67@blogs.com,+86 962 677 4630,elementum in hac habitasse platea dictumst morbi vestibulum velit
17225,Oodoo,mpemberton68@wisc.edu,+57 281 452 9349,pede posuere nonummy integer non velit donec diam neque vestibulum eget vulputate ut ultrices
17226,Roomm,amonget69@ezinearticles.com,+95 468 914 6257,sapien cursus vestibulum proin eu
17227,Dabfeed,vvanthoog6a@ifeng.com,+504 808 676 6418,vel nulla eget eros elementum pellentesque quisque porta volutpat erat quisque
17228,Blogpad,bbierling6b@shareasale.com,+81 634 707 0991,aliquet massa id lobortis convallis tortor risus dapibus augue vel accumsan tellus nisi eu orci mauris lacinia sapien
17229,Dabfeed,dvolage6c@theatlantic.com,+53 914 336 2735,elit ac nulla sed vel enim sit amet nunc viverra dapibus nulla suscipit ligula in lacus curabitur at ipsum ac tellus semper interdum
17230,Feedmix,mbalaisot6d@mozilla.org,+7 676 644 3195,ac neque duis bibendum morbi non quam nec dui luctus
17231,Gabtune,wshipston6e@163.com,+86 183 379 3148,eget rutrum at lorem integer tincidunt ante
17232,Lazz,mbatstone6f@wix.com,+33 391 964 5944,velit eu est congue elementum in
17233,Chatterpoint,gteaser6g@miibeian.gov.cn,+33 449 392 0195,montes nascetur ridiculus mus etiam vel augue vestibulum rutrum rutrum neque aenean auctor gravida sem praesent
17234,Oyonder,mvaughanhughes6h@fda.gov,+86 819 801 8240,leo odio porttitor id consequat in consequat ut nulla sed accumsan felis ut at dolor quis odio
17235,Fadeo,tvize6i@printfriendly.com,+86 776 137 2478,donec vitae nisi nam ultrices libero
17236,Wikibox,colcot6j@blinklist.com,+86 399 816 3902,lorem vitae mattis nibh ligula nec sem duis aliquam convallis nunc proin at turpis a pede posuere nonummy integer non velit
17237,Brainlounge,vjohansson6k@umich.edu,+1 717 806 2723,parturient montes nascetur ridiculus mus vivamus vestibulum sagittis sapien cum sociis natoque penatibus
17238,Topicstorm,qashling6l@trellian.com,+36 310 238 5252,nec nisi vulputate nonummy maecenas tincidunt lacus at velit vivamus vel nulla eget eros elementum pellentesque quisque porta volutpat erat quisque erat eros viverra
17239,Roomm,efairbrass6m@umich.edu,+593 847 106 1137,etiam pretium iaculis justo in hac habitasse platea dictumst etiam faucibus cursus urna
17240,Omba,mjoslin6n@vinaora.com,+86 214 254 7983,hendrerit at vulputate vitae nisl aenean lectus pellentesque eget nunc donec quis orci eget orci vehicula condimentum curabitur
17241,Twitterworks,rfolker6o@rakuten.co.jp,+86 234 995 6860,in blandit ultrices enim lorem ipsum dolor sit amet consectetuer adipiscing elit proin interdum mauris non ligula pellentesque ultrices phasellus id
17242,Tagtune,mflecknoe6p@studiopress.com,+86 336 955 0449,integer ac neque duis bibendum morbi non quam nec dui luctus rutrum nulla tellus in sagittis dui vel nisl duis ac nibh
17243,Yoveo,vcamilleri6q@cargocollective.com,+63 886 629 6838,dolor sit amet consectetuer adipiscing elit proin risus praesent lectus vestibulum quam sapien varius ut blandit non interdum in ante vestibulum ante ipsum primis in
17244,Tanoodle,ljinkin6r@360.cn,+62 375 894 8962,in porttitor pede justo eu massa donec dapibus duis at velit eu est congue elementum in hac habitasse platea
17245,Linkbuzz,dtisun6s@answers.com,+86 646 459 0999,vestibulum sed magna at nunc commodo placerat praesent blandit nam nulla integer pede justo lacinia eget tincidunt eget
17246,Zoombox,bbareford6t@newsvine.com,+7 387 997 4496,in eleifend quam a odio in hac habitasse platea dictumst maecenas ut massa quis
17247,Rhycero,thinkes6u@last.fm,+62 834 321 3496,sit amet cursus id turpis integer aliquet massa
17248,Katz,rasche6v@alexa.com,+86 991 915 9024,lorem ipsum dolor sit amet consectetuer adipiscing elit proin interdum mauris non ligula pellentesque ultrices phasellus id sapien in sapien
17249,Twinder,gmccague6w@miibeian.gov.cn,+1 143 527 0899,vivamus tortor duis mattis egestas metus aenean fermentum donec ut mauris eget massa tempor convallis
17250,Tazzy,elinder6x@behance.net,+86 860 219 8254,lorem ipsum dolor sit amet consectetuer adipiscing
17251,Voomm,mkadd6y@csmonitor.com,+33 473 374 8024,nullam porttitor lacus at turpis donec
17252,Photospace,tstodit6z@nymag.com,+63 680 212 7164,mollis molestie lorem quisque ut
17253,Zooxo,rheasley70@imdb.com,+93 327 474 7743,elit sodales scelerisque mauris sit amet eros suspendisse accumsan tortor quis turpis sed ante vivamus tortor duis mattis egestas metus aenean
17254,Aimbo,doglethorpe71@imageshack.us,+48 610 660 5096,sed vestibulum sit amet cursus id turpis integer aliquet massa id lobortis convallis tortor risus dapibus augue vel accumsan tellus nisi eu orci
17255,Fivebridge,ttunno72@networksolutions.com,+62 458 598 9530,lectus aliquam sit amet diam in magna bibendum imperdiet nullam orci pede venenatis
17256,Vidoo,afranks73@salon.com,+48 220 784 2895,morbi vel lectus in quam fringilla rhoncus
17257,Realcube,akermott74@phpbb.com,+55 858 742 6006,donec posuere metus vitae ipsum aliquam non
17258,Aimbu,rjeffries75@wisc.edu,+62 755 515 2505,malesuada in imperdiet et commodo vulputate justo in blandit ultrices enim lorem ipsum dolor sit amet
17259,Agivu,adrakes76@joomla.org,+62 821 878 4034,neque duis bibendum morbi non quam nec dui luctus rutrum nulla tellus in sagittis dui vel nisl duis ac nibh fusce
17260,Zava,pghidelli77@comcast.net,+7 121 783 2652,sit amet eros suspendisse accumsan tortor quis turpis sed ante vivamus tortor duis mattis egestas metus
17261,Youtags,eproswell78@globo.com,+225 448 844 8843,et ultrices posuere cubilia curae mauris viverra diam vitae quam suspendisse potenti nullam porttitor lacus at turpis donec posuere metus vitae ipsum
17262,Innojam,rbetho79@joomla.org,+7 289 603 7572,commodo vulputate justo in blandit
17263,Twitterbridge,achartman7a@pen.io,+86 453 170 9531,pellentesque quisque porta volutpat erat quisque erat eros viverra eget congue eget semper rutrum
17264,Dabvine,pleile7b@bravesites.com,+371 347 563 2897,morbi a ipsum integer a nibh in quis justo maecenas rhoncus
17265,Reallinks,ekennerley7c@wufoo.com,+63 741 523 1371,augue vel accumsan tellus nisi eu orci mauris lacinia sapien quis libero nullam
17266,Skilith,calmeida7d@storify.com,+86 986 805 9795,non pretium quis lectus suspendisse potenti in
17267,Tagfeed,dkubelka7e@sakura.ne.jp,+593 546 866 6716,luctus nec molestie sed justo pellentesque viverra pede ac diam cras pellentesque volutpat dui maecenas tristique est et tempus semper est
17268,Eare,dbrittan7f@addtoany.com,+62 631 722 2455,cursus urna ut tellus nulla ut erat id mauris vulputate elementum nullam varius nulla facilisi cras non
17269,Gabtype,lteare7g@trellian.com,+963 776 504 5517,et ultrices posuere cubilia curae nulla dapibus dolor vel est donec odio justo sollicitudin ut suscipit a feugiat et eros vestibulum ac est lacinia nisi
17270,Yoveo,flockner7h@springer.com,+33 643 672 6154,ut massa volutpat convallis morbi odio odio elementum eu interdum eu tincidunt
17271,Wordtune,rblockey7i@huffingtonpost.com,+977 943 905 5793,in tempus sit amet sem fusce consequat nulla nisl nunc nisl duis bibendum felis sed interdum venenatis turpis enim blandit
17272,Chatterpoint,apurkiss7j@instagram.com,+7 504 878 0821,ultrices aliquet maecenas leo odio condimentum id luctus nec molestie sed justo pellentesque viverra pede ac diam cras pellentesque volutpat dui maecenas tristique est
17273,Voonte,lgrahlman7k@cnbc.com,+55 852 277 2196,id luctus nec molestie sed justo pellentesque viverra pede ac diam cras pellentesque volutpat dui maecenas tristique est et tempus semper
17274,Camido,trumsby7l@businessinsider.com,+86 420 283 5546,aliquam sit amet diam in magna bibendum imperdiet nullam orci pede venenatis non sodales sed
17275,Abatz,zfinlry7m@blog.com,+856 483 237 4093,pretium quis lectus suspendisse potenti in eleifend quam a odio in hac habitasse platea dictumst
17276,Linktype,tfoston7n@boston.com,+353 870 590 8426,mauris viverra diam vitae quam suspendisse potenti nullam porttitor lacus at turpis donec posuere metus vitae ipsum aliquam non mauris morbi
17277,Vitz,fnolte7o@yahoo.com,+49 951 163 6859,luctus et ultrices posuere cubilia curae donec pharetra magna vestibulum aliquet ultrices erat tortor
17278,Rhynoodle,mburnell7p@dailymotion.com,+54 405 279 6164,justo lacinia eget tincidunt eget
17279,Mymm,scomizzoli7q@hhs.gov,+223 558 320 7166,amet eleifend pede libero quis orci nullam molestie nibh in lectus pellentesque at nulla suspendisse potenti cras in purus eu
17280,Fliptune,thanstock7r@surveymonkey.com,+1 705 347 9548,penatibus et magnis dis parturient montes nascetur ridiculus mus vivamus vestibulum sagittis sapien cum sociis natoque penatibus et magnis dis
17281,Livefish,gstienham7s@clickbank.net,+55 899 701 0462,donec ut mauris eget massa tempor convallis nulla
17282,Topiclounge,ldesorts7t@weather.com,+359 129 455 9775,neque sapien placerat ante nulla justo aliquam quis turpis
17283,Tagopia,omyrkus7u@lulu.com,+230 743 206 0078,elit proin risus praesent lectus vestibulum quam sapien varius ut blandit non interdum
17284,Kwilith,jfinessy7v@mac.com,+1 513 757 3659,risus auctor sed tristique in tempus
17285,BlogXS,achurm7w@cyberchimps.com,+234 747 271 5214,rhoncus aliquam lacus morbi quis tortor id nulla ultrices aliquet
17286,Skinix,mmacphee7x@guardian.co.uk,+55 256 352 4915,interdum mauris ullamcorper purus sit amet nulla quisque arcu
17287,Eimbee,ematejka7y@reverbnation.com,+54 409 471 6555,pede libero quis orci nullam molestie nibh in lectus pellentesque at nulla suspendisse potenti cras in
17288,Ainyx,abraunter7z@samsung.com,+63 924 420 9318,viverra dapibus nulla suscipit ligula in lacus curabitur at ipsum ac tellus semper interdum mauris ullamcorper purus sit amet nulla quisque arcu libero
17289,Skyba,aberston80@discuz.net,+48 629 262 4895,posuere metus vitae ipsum aliquam non mauris morbi non lectus aliquam sit amet diam in magna
17290,Plambee,ashepland81@gizmodo.com,+62 532 507 1434,ut rhoncus aliquet pulvinar sed nisl nunc rhoncus dui vel sem sed sagittis nam congue risus semper porta volutpat quam pede lobortis ligula
17291,Kwinu,wdoncaster82@wix.com,+685 617 651 4977,pellentesque viverra pede ac diam cras pellentesque volutpat dui maecenas tristique
17292,Mynte,mshipman83@marriott.com,+63 586 129 4154,commodo placerat praesent blandit nam nulla integer pede justo lacinia eget tincidunt
17293,Skyvu,jomahony84@nsw.gov.au,+48 423 692 2921,at velit eu est congue elementum
17294,Omba,mbrodest85@forbes.com,+62 841 765 5176,pede ac diam cras pellentesque
17295,Wordpedia,ksweetmore86@furl.net,+691 924 747 4055,ac nulla sed vel enim sit amet nunc viverra dapibus nulla suscipit ligula in lacus curabitur
17296,Trudeo,cbickerstaff87@walmart.com,+47 260 350 4347,donec vitae nisi nam ultrices libero non mattis pulvinar nulla pede
17297,Blogtags,jstevenson88@ifeng.com,+45 955 742 9094,orci eget orci vehicula condimentum curabitur in libero ut massa volutpat convallis morbi odio odio
17298,Rhynoodle,scharnock89@narod.ru,+506 303 461 6882,quis turpis sed ante vivamus tortor duis mattis egestas metus aenean fermentum donec ut mauris eget massa tempor convallis nulla neque libero convallis eget
17299,Skimia,tpirnie8a@mozilla.org,+54 137 500 2485,quis turpis sed ante vivamus tortor duis mattis egestas metus aenean fermentum donec ut mauris eget massa tempor convallis nulla neque libero convallis eget
17300,Trudeo,gestick8b@prnewswire.com,+62 706 455 9166,aliquet maecenas leo odio condimentum id luctus nec molestie sed justo pellentesque viverra pede ac diam cras pellentesque volutpat dui maecenas tristique est et
17301,Kwilith,ktremouille8c@purevolume.com,+994 452 581 5796,justo in hac habitasse platea dictumst etiam faucibus cursus urna ut tellus nulla ut erat id mauris vulputate elementum
17302,Cogibox,tsaer8d@google.it,+86 564 114 5339,lorem ipsum dolor sit amet consectetuer adipiscing elit proin interdum mauris
17303,Jamia,umacalpine8e@unc.edu,+385 769 985 2967,sed lacus morbi sem mauris laoreet ut rhoncus aliquet pulvinar sed nisl nunc rhoncus dui vel sem sed sagittis
17304,Chatterbridge,oabrahamsohn8f@blog.com,+381 528 538 3535,libero non mattis pulvinar nulla pede ullamcorper augue a suscipit nulla elit ac nulla sed vel
17305,Mybuzz,tkleyn8g@bloglovin.com,+55 536 568 8203,suspendisse potenti nullam porttitor lacus at turpis donec posuere
17306,Quinu,sboule8h@whitehouse.gov,+86 544 842 4558,eget massa tempor convallis nulla neque libero convallis eget eleifend luctus
17307,Livetube,dbohling8i@odnoklassniki.ru,+63 894 842 9831,vestibulum sit amet cursus id turpis
17308,Jabberbean,cjewess8j@bloomberg.com,+62 413 998 7656,eget rutrum at lorem integer tincidunt ante vel ipsum praesent blandit
17309,Wordtune,pkneal8k@hubpages.com,+86 677 456 9537,sapien urna pretium nisl ut volutpat sapien arcu
17310,Zoonder,cshimmin8l@marriott.com,+62 777 731 9546,velit vivamus vel nulla eget eros elementum pellentesque quisque porta volutpat erat quisque erat eros viverra
17311,Skinder,ashepherdson8m@wufoo.com,+63 398 743 5782,in congue etiam justo etiam pretium iaculis justo in hac habitasse platea dictumst etiam faucibus cursus urna
17312,Babblestorm,rloan8n@symantec.com,+7 185 410 3535,lectus pellentesque eget nunc donec quis orci eget orci vehicula
17313,Janyx,lpearsall8o@tinyurl.com,+27 464 992 3758,non mauris morbi non lectus aliquam sit amet diam in magna bibendum imperdiet nullam orci pede
17314,Bubblebox,sbrito8p@intel.com,+7 933 258 0145,imperdiet nullam orci pede venenatis non sodales sed
17315,Shufflebeat,cbrownscombe8q@gravatar.com,+62 825 435 5137,pellentesque ultrices mattis odio donec vitae nisi nam ultrices libero non mattis pulvinar nulla pede
17316,Pixope,mbarens8r@desdev.cn,+55 890 770 3134,lacinia nisi venenatis tristique fusce congue diam id ornare imperdiet sapien urna pretium nisl ut volutpat sapien arcu sed augue aliquam erat
17317,Edgeify,cjonin8s@instagram.com,+63 601 793 6161,non lectus aliquam sit amet diam in magna bibendum imperdiet nullam orci pede venenatis non sodales sed tincidunt eu felis fusce posuere felis sed
17318,Feedmix,ndeavin8t@bloglines.com,+46 834 152 8630,in hac habitasse platea dictumst maecenas ut massa quis augue luctus tincidunt nulla mollis molestie lorem quisque ut
17319,Jabberbean,odelwater8u@behance.net,+358 560 738 0423,quis justo maecenas rhoncus aliquam lacus morbi quis tortor id nulla ultrices aliquet maecenas leo odio condimentum id luctus nec molestie sed
17320,Skyba,mbalchen8v@blogspot.com,+86 799 205 3838,ipsum dolor sit amet consectetuer adipiscing elit proin risus praesent lectus vestibulum quam sapien varius
17321,Wikizz,lschukert8w@yahoo.co.jp,+63 917 158 4813,in sapien iaculis congue vivamus metus arcu adipiscing molestie hendrerit at vulputate vitae nisl aenean lectus pellentesque eget nunc donec quis orci eget orci vehicula
17322,Flipopia,fseignior8x@mit.edu,+358 616 275 9565,at feugiat non pretium quis lectus suspendisse potenti in eleifend quam a odio in hac habitasse platea dictumst maecenas
17323,JumpXS,podonohoe8y@google.nl,+63 556 255 8386,lectus in est risus auctor sed tristique in tempus sit amet
17324,Snaptags,cwakerley8z@comsenz.com,+223 395 635 8875,in hac habitasse platea dictumst aliquam augue quam sollicitudin vitae consectetuer eget rutrum at lorem integer tincidunt ante vel ipsum praesent blandit lacinia erat vestibulum
17325,Photofeed,gcrammy90@accuweather.com,+84 453 125 9091,non pretium quis lectus suspendisse potenti in eleifend quam a odio in hac habitasse platea dictumst maecenas ut massa quis augue luctus tincidunt
17326,Centidel,htellwright91@ameblo.jp,+670 362 737 5880,massa volutpat convallis morbi odio odio
17327,Divanoodle,tsisse92@sakura.ne.jp,+420 371 540 6309,nulla tempus vivamus in felis eu sapien cursus vestibulum proin eu mi
17328,Zoomdog,tmateiko93@jigsy.com,+505 995 789 9334,nisi vulputate nonummy maecenas tincidunt lacus at velit vivamus vel nulla
17329,Divavu,eportsmouth94@qq.com,+7 380 880 6039,cubilia curae nulla dapibus dolor vel est donec odio justo sollicitudin ut suscipit a feugiat et eros vestibulum ac est lacinia nisi venenatis tristique fusce
17330,Quire,htacker95@ucsd.edu,+504 974 808 3671,ligula in lacus curabitur at ipsum ac tellus semper interdum mauris ullamcorper purus sit amet nulla quisque arcu libero
17331,Avamm,rtesoe96@whitehouse.gov,+98 184 741 2719,praesent lectus vestibulum quam sapien varius ut blandit non interdum in ante vestibulum ante ipsum primis in
17332,Brainverse,ccockburn97@elegantthemes.com,+970 718 195 6079,facilisi cras non velit nec nisi vulputate nonummy maecenas tincidunt lacus at velit vivamus vel nulla eget eros elementum pellentesque quisque porta volutpat erat
17333,Trunyx,nrickwood98@adobe.com,+63 777 656 1683,nunc rhoncus dui vel sem sed sagittis nam congue risus semper porta volutpat quam pede lobortis ligula sit amet
17334,Quaxo,astarkie99@hud.gov,+244 694 390 3589,a odio in hac habitasse platea
17335,Dynabox,olownes9a@intel.com,+1 202 223 1521,morbi vestibulum velit id pretium iaculis diam erat fermentum justo
17336,Divanoodle,rohickey9b@artisteer.com,+33 730 805 5301,lectus pellentesque eget nunc donec quis orci eget orci vehicula
17337,Centidel,mwithnall9c@irs.gov,+63 918 336 8253,auctor sed tristique in tempus sit amet sem fusce consequat nulla nisl nunc nisl duis bibendum felis
17338,Ntag,rimeson9d@eventbrite.com,+62 112 231 3594,morbi vel lectus in quam fringilla rhoncus mauris enim leo rhoncus sed vestibulum sit amet cursus id turpis integer aliquet massa id lobortis convallis tortor
17339,Roodel,cheiton9e@yahoo.co.jp,+358 806 154 1961,at feugiat non pretium quis lectus suspendisse potenti in eleifend quam a odio in hac habitasse platea dictumst maecenas ut massa quis augue luctus tincidunt
17340,Quinu,vcarlson9f@ameblo.jp,+351 171 155 3394,id nisl venenatis lacinia aenean sit amet justo morbi ut odio cras mi pede malesuada in imperdiet et
