SupplierID,SupplierName,SupplierEmail,SupplierPhone,SupplierDescription
17341,Quimm,nsimacek9g@wikimedia.org,+98 595 335 0054,et tempus semper est quam pharetra magna ac consequat metus sapien ut nunc vestibulum ante ipsum primis in faucibus orci
17342,Oozz,morchard9h@miibeian.gov.cn,+381 780 276 2428,adipiscing lorem vitae mattis nibh ligula nec sem duis aliquam convallis nunc proin at turpis a pede posuere nonummy integer non velit
17343,Rhybox,cmarin9i@theguardian.com,+1 904 805 7823,mus etiam vel augue vestibulum rutrum rutrum neque aenean auctor gravida sem praesent id massa
17344,Chatterbridge,efrodsam9j@reddit.com,+503 459 314 2926,nullam sit amet turpis elementum ligula vehicula consequat morbi a ipsum integer a nibh in quis justo maecenas rhoncus aliquam lacus morbi
17345,Babbleblab,hschimek9k@infoseek.co.jp,+976 881 273 1547,aliquam erat volutpat in congue etiam justo etiam pretium iaculis justo in hac habitasse platea dictumst etiam faucibus cursus urna ut
17346,Tekfly,hcorteney9l@tinypic.com,+81 186 311 5483,justo lacinia eget tincidunt eget tempus
17347,Youopia,bbrinson9m@vistaprint.com,+46 157 324 7247,quam pharetra magna ac consequat metus sapien ut nunc vestibulum ante ipsum primis in faucibus orci
17348,Riffpedia,nlanchbury9n@va.gov,+86 759 217 3235,nam congue risus semper porta volutpat quam pede lobortis ligula sit amet eleifend pede libero quis orci nullam molestie nibh in lectus pellentesque
17349,Babblestorm,hfalkus9o@histats.com,+62 412 774 2932,ultrices enim lorem ipsum dolor sit amet consectetuer adipiscing elit proin interdum mauris non ligula pellentesque ultrices phasellus id sapien in sapien iaculis congue vivamus
17350,Dabtype,asmaile9p@sina.com.cn,+53 198 549 6882,sed justo pellentesque viverra pede ac diam cras pellentesque volutpat dui maecenas tristique est et tempus semper est quam pharetra magna ac consequat metus sapien
17351,Livefish,rhaking9q@sun.com,+86 308 246 7131,id consequat in consequat ut nulla sed accumsan felis ut at dolor quis
17352,Topicstorm,kgouldstraw9r@sakura.ne.jp,+55 630 484 3789,donec diam neque vestibulum eget vulputate
17353,Jabbersphere,eyorkston9s@sogou.com,+227 934 875 0072,rhoncus aliquet pulvinar sed nisl nunc rhoncus dui vel sem sed sagittis nam congue risus
17354,Zooveo,igimlet9t@tinypic.com,+372 599 880 0704,rutrum nulla tellus in sagittis dui vel nisl duis ac nibh fusce lacus purus aliquet at feugiat non pretium quis lectus suspendisse potenti in
17355,Skiptube,cbollon9u@dell.com,+86 105 329 5310,faucibus orci luctus et ultrices posuere cubilia curae duis faucibus accumsan odio curabitur convallis duis
17356,Kanoodle,wsimms9v@npr.org,+212 373 144 0834,ut dolor morbi vel lectus in quam fringilla rhoncus mauris enim
17357,Gabcube,mbagot9w@freewebs.com,+30 697 348 7535,massa donec dapibus duis at velit eu est congue elementum in hac habitasse platea dictumst morbi vestibulum velit id pretium iaculis
17358,Flipstorm,dpakenham9x@microsoft.com,+86 254 377 2500,dui vel sem sed sagittis nam congue risus semper porta
17359,Gigazoom,feddie9y@senate.gov,+63 452 216 5873,euismod scelerisque quam turpis adipiscing lorem vitae mattis nibh ligula nec sem duis aliquam convallis nunc proin at
17360,Voonyx,kcooling9z@berkeley.edu,+86 455 249 6604,aenean lectus pellentesque eget nunc
17361,Realbridge,jprendergrasta0@arstechnica.com,+234 321 591 1825,neque sapien placerat ante nulla justo aliquam quis
17362,Yodoo,squestea1@51.la,+1 943 687 7989,pellentesque ultrices mattis odio donec vitae nisi nam ultrices libero non mattis pulvinar nulla pede ullamcorper augue a suscipit nulla elit ac nulla sed vel
17363,Brightbean,mvidyapina2@miibeian.gov.cn,+94 186 107 3908,molestie sed justo pellentesque viverra pede ac diam cras pellentesque volutpat dui maecenas tristique est et tempus semper est quam pharetra magna ac consequat
17364,Fanoodle,madsheada3@yellowbook.com,+375 593 257 3608,quam suspendisse potenti nullam porttitor lacus at turpis donec posuere metus
17365,Fliptune,ostaggea4@t-online.de,+86 289 341 3205,lobortis sapien sapien non mi integer ac neque duis bibendum morbi non
17366,Flashdog,dlodea5@newyorker.com,+63 447 469 0466,nullam varius nulla facilisi cras non velit nec nisi vulputate nonummy maecenas tincidunt lacus at velit vivamus vel nulla eget eros
17367,Talane,jcustya6@webmd.com,+54 665 478 9324,ligula vehicula consequat morbi a ipsum integer a nibh in
17368,Youspan,gmacginneya7@storify.com,+7 604 418 9193,curae duis faucibus accumsan odio curabitur convallis duis consequat dui nec nisi volutpat eleifend donec ut dolor morbi vel
17369,Blognation,kdumbrilla8@dropbox.com,+86 402 722 5448,congue eget semper rutrum nulla nunc purus phasellus in felis donec semper
17370,Kazio,cknellera9@oakley.com,+358 178 117 4420,rhoncus aliquet pulvinar sed nisl nunc rhoncus dui vel sem
17371,Zoovu,cpolglaseaa@ft.com,+352 927 426 7310,eros vestibulum ac est lacinia nisi venenatis tristique fusce congue diam id ornare imperdiet sapien urna pretium nisl ut volutpat sapien arcu sed augue aliquam
17372,Lazzy,rstrappab@biglobe.ne.jp,+385 867 967 4476,volutpat sapien arcu sed augue aliquam erat volutpat in congue etiam justo etiam pretium iaculis justo in hac habitasse platea dictumst etiam
17373,Jabbertype,jcarlisiac@wordpress.org,+62 703 844 3937,maecenas pulvinar lobortis est phasellus sit amet erat nulla tempus vivamus in felis
17374,Yotz,ggrigautad@nydailynews.com,+30 640 315 3314,ante vivamus tortor duis mattis
17375,Tanoodle,mklampkae@time.com,+1 322 916 0859,eget elit sodales scelerisque mauris sit amet eros suspendisse accumsan tortor quis turpis sed ante vivamus
17376,Eabox,ccrummeyaf@illinois.edu,+967 957 486 4000,in est risus auctor sed tristique in tempus sit amet sem fusce consequat nulla nisl nunc nisl duis bibendum
17377,Oyope,rsolleyag@hostgator.com,+86 103 983 0300,luctus tincidunt nulla mollis molestie lorem quisque ut erat curabitur gravida nisi at nibh in hac habitasse platea dictumst aliquam augue quam sollicitudin
17378,Jaxspan,bjaimezah@myspace.com,+852 999 552 6933,arcu adipiscing molestie hendrerit at vulputate vitae
17379,Twinder,dflatherai@naver.com,+234 916 881 8388,cras in purus eu magna vulputate luctus cum sociis natoque penatibus et magnis
17380,Browsebug,swestmorlandaj@cbsnews.com,+52 354 482 5745,quam suspendisse potenti nullam porttitor lacus at turpis donec posuere metus
17381,JumpXS,mwainmanak@cam.ac.uk,+48 995 545 1938,ut volutpat sapien arcu sed augue aliquam erat volutpat in congue etiam justo etiam pretium iaculis justo in hac habitasse platea dictumst etiam
17382,Gabtype,vkenderal@apple.com,+354 375 330 0978,cras non velit nec nisi vulputate nonummy maecenas tincidunt
17383,Kimia,rcastellanosam@sitemeter.com,+263 277 737 6169,vel sem sed sagittis nam congue risus semper porta volutpat quam pede lobortis
17384,Trudeo,bpybworthan@sina.com.cn,+44 327 561 5918,ipsum integer a nibh in quis justo maecenas rhoncus aliquam lacus morbi quis tortor id nulla ultrices aliquet
17385,Eamia,lorganao@theguardian.com,+63 319 640 5480,congue elementum in hac habitasse platea dictumst morbi vestibulum velit id pretium iaculis diam erat fermentum justo nec condimentum
17386,Skibox,dlodoap@hud.gov,+976 221 813 0581,semper sapien a libero nam dui proin leo odio porttitor id consequat in consequat ut nulla sed
17387,Voomm,sbroydaq@netlog.com,+227 567 975 4289,vel nisl duis ac nibh fusce
17388,Oloo,blaverenzar@marketwatch.com,+7 967 988 8973,semper rutrum nulla nunc purus phasellus in felis donec semper sapien a libero nam dui proin leo odio porttitor id consequat in consequat
17389,Bluejam,scollardas@cloudflare.com,+964 903 634 0607,ut erat curabitur gravida nisi at nibh in hac habitasse platea dictumst aliquam augue quam sollicitudin
17390,Yozio,bbeckworthat@cbsnews.com,+62 170 870 2966,mauris laoreet ut rhoncus aliquet pulvinar sed nisl nunc rhoncus dui vel sem sed sagittis nam
17391,Kimia,mkulverau@dailymail.co.uk,+86 354 766 1694,dis parturient montes nascetur ridiculus mus etiam vel augue vestibulum rutrum rutrum neque aenean auctor gravida sem praesent id massa
17392,Vinder,msimisonav@cbslocal.com,+886 593 120 3825,nec condimentum neque sapien placerat
17393,Divanoodle,nberminghamaw@dagondesign.com,+55 791 801 3232,interdum venenatis turpis enim blandit mi in porttitor pede justo eu massa donec dapibus duis at velit eu est congue
17394,Meetz,dstoryax@wikipedia.org,+63 469 528 8985,tempor turpis nec euismod scelerisque quam turpis adipiscing lorem vitae mattis nibh ligula nec
17395,Yodel,rstillyay@skype.com,+63 638 865 4584,libero ut massa volutpat convallis morbi odio odio elementum eu interdum eu tincidunt in leo maecenas
17396,Eadel,hcinoaz@gmpg.org,+504 113 805 7993,lobortis ligula sit amet eleifend pede libero quis orci nullam molestie nibh in lectus pellentesque at nulla suspendisse potenti
17397,Thoughtworks,ydaunterb0@msn.com,+62 624 303 9657,sagittis nam congue risus semper porta volutpat quam pede lobortis ligula sit amet eleifend pede libero quis orci nullam
17398,Zoonder,sallibertonb1@cnbc.com,+86 839 735 4219,amet cursus id turpis integer aliquet massa id lobortis convallis tortor risus dapibus augue vel accumsan tellus nisi eu orci mauris lacinia sapien
17399,Rhybox,qtuckwoodb2@washingtonpost.com,+62 720 459 4454,viverra dapibus nulla suscipit ligula
17400,Zava,wpimmb3@blinklist.com,+62 230 876 1851,ridiculus mus etiam vel augue vestibulum rutrum rutrum
17401,Bluezoom,jciccoloib4@webeden.co.uk,+1 971 218 4302,amet turpis elementum ligula vehicula consequat morbi a ipsum integer a nibh in quis justo maecenas rhoncus aliquam lacus morbi quis tortor id nulla
17402,Thoughtworks,amacrob5@privacy.gov.au,+7 584 528 7087,amet sem fusce consequat nulla nisl nunc nisl duis bibendum felis sed interdum venenatis turpis
17403,Zoovu,fraviliousb6@walmart.com,+51 643 645 3564,donec vitae nisi nam ultrices libero non mattis pulvinar nulla pede ullamcorper augue a suscipit nulla elit ac nulla sed vel enim sit amet
17404,Topicstorm,laronowiczb7@purevolume.com,+43 482 585 5169,cum sociis natoque penatibus et magnis dis parturient montes nascetur ridiculus mus etiam vel augue vestibulum rutrum rutrum neque aenean
17405,Linkbuzz,molneyb8@google.com.au,+62 575 706 9812,congue diam id ornare imperdiet
17406,Gabcube,tkiffinb9@etsy.com,+57 880 646 0191,vel ipsum praesent blandit lacinia erat vestibulum sed magna at nunc commodo placerat praesent blandit nam nulla
17407,Kwimbee,dwarnesba@ehow.com,+48 614 260 1561,duis at velit eu est congue elementum in hac habitasse platea dictumst morbi vestibulum velit id pretium iaculis
17408,Dabjam,tstillbb@yahoo.com,+63 216 910 6751,eu tincidunt in leo maecenas pulvinar lobortis est phasellus sit amet erat nulla tempus vivamus in felis
17409,Oyoba,abomanbc@hao123.com,+84 397 759 5239,sit amet lobortis sapien sapien non
17410,Cogidoo,sblasebd@nsw.gov.au,+504 449 675 0179,non mattis pulvinar nulla pede ullamcorper augue a suscipit
17411,Yamia,fgreatreaxbe@ask.com,+66 145 362 9874,aliquet ultrices erat tortor sollicitudin mi sit amet lobortis sapien sapien non mi integer ac
17412,Jetwire,mgimbrettbf@dedecms.com,+86 449 437 1776,pellentesque volutpat dui maecenas tristique est
17413,Demizz,ndomenichellibg@csmonitor.com,+63 516 561 7490,lacus at velit vivamus vel nulla eget eros elementum pellentesque quisque porta volutpat erat quisque erat eros viverra eget congue eget semper rutrum
17414,Yodel,njeunebh@virginia.edu,+351 944 106 9087,lacus morbi quis tortor id nulla ultrices aliquet maecenas leo odio condimentum id luctus
17415,Tazzy,dbahiabi@google.co.uk,+81 570 815 0268,integer tincidunt ante vel ipsum praesent blandit lacinia erat vestibulum sed magna at nunc commodo
17416,Wikivu,kbransombj@multiply.com,+46 518 596 5890,ante ipsum primis in faucibus orci luctus et ultrices posuere
17417,Jabbersphere,mhelbeckbk@technorati.com,+86 278 521 4424,blandit non interdum in ante vestibulum ante ipsum primis in faucibus orci luctus et
17418,Realbridge,smckennanbl@imageshack.us,+86 129 628 2129,non ligula pellentesque ultrices phasellus id sapien in sapien iaculis congue vivamus metus arcu adipiscing
17419,Tagchat,nrafterbm@wordpress.com,+48 962 850 9338,nec dui luctus rutrum nulla tellus in sagittis dui vel nisl duis ac nibh fusce lacus purus aliquet at feugiat non
17420,Flipstorm,zismirniogloubn@blinklist.com,+7 155 213 3178,nascetur ridiculus mus etiam vel augue vestibulum rutrum rutrum neque aenean auctor gravida sem praesent
17421,Jayo,hkeydenbo@hp.com,+47 562 430 6870,ut erat curabitur gravida nisi at nibh in hac habitasse platea dictumst aliquam augue quam
17422,Skivee,efidellibp@dagondesign.com,+84 768 330 8570,justo pellentesque viverra pede ac diam cras pellentesque volutpat dui maecenas tristique est et tempus semper est quam pharetra magna ac consequat
17423,Skinte,sshollbq@ucla.edu,+93 688 393 5589,pede malesuada in imperdiet et commodo vulputate justo in blandit ultrices enim lorem ipsum dolor sit amet consectetuer adipiscing elit proin
17424,Omba,rgaybr@digg.com,+375 227 160 9864,orci luctus et ultrices posuere cubilia curae duis faucibus accumsan odio curabitur convallis duis consequat dui nec nisi volutpat
17425,Realcube,vconisbeebs@cam.ac.uk,+86 858 974 2807,convallis morbi odio odio elementum eu interdum eu tincidunt in leo maecenas pulvinar lobortis est phasellus sit
17426,Trupe,kdressellbt@guardian.co.uk,+420 935 386 1434,eu interdum eu tincidunt in leo maecenas pulvinar lobortis est phasellus sit amet erat nulla tempus vivamus in felis eu sapien
17427,Twimm,mnewingbu@pen.io,+86 173 628 5691,quam sapien varius ut blandit non interdum in ante vestibulum ante ipsum primis in faucibus orci luctus et ultrices posuere cubilia curae duis
17428,Quire,emcalinebv@cargocollective.com,+351 641 301 4956,in tempor turpis nec euismod
17429,Abata,jspenderbw@goo.gl,+86 693 598 2808,sollicitudin vitae consectetuer eget rutrum at lorem integer tincidunt ante vel ipsum praesent
17430,Meemm,sgwilymbx@blogger.com,+371 257 288 1777,eget eros elementum pellentesque quisque porta volutpat erat quisque erat eros viverra eget congue eget semper rutrum nulla nunc purus phasellus in felis
17431,Gabtype,frosendallby@github.io,+46 854 575 9380,odio condimentum id luctus nec molestie sed justo pellentesque viverra
17432,Thoughtmix,akillinerbz@infoseek.co.jp,+505 753 643 4121,dui nec nisi volutpat eleifend donec ut dolor morbi vel
17433,Feedbug,cjordinc0@mail.ru,+63 939 985 3073,integer non velit donec diam neque
17434,Browsedrive,jraittiec1@rediff.com,+7 825 775 0339,vel ipsum praesent blandit lacinia erat vestibulum sed magna at nunc commodo placerat praesent
17435,Twimbo,njakubovitchc2@domainmarket.com,+63 470 774 8469,eget vulputate ut ultrices vel augue vestibulum ante ipsum primis in faucibus orci luctus et ultrices posuere
17436,Jaloo,mmccoskerc3@sina.com.cn,+86 603 673 7652,sit amet nulla quisque arcu libero rutrum ac lobortis vel dapibus at diam nam tristique tortor
17437,Meemm,hcancuttc4@typepad.com,+55 509 255 5411,faucibus orci luctus et ultrices posuere cubilia curae nulla dapibus dolor vel est
17438,Aimbo,aruppc5@buzzfeed.com,+504 759 487 4203,imperdiet et commodo vulputate justo in blandit ultrices enim lorem ipsum dolor sit amet consectetuer adipiscing elit proin
17439,Divavu,lwollersc6@t.co,+254 353 142 6005,venenatis lacinia aenean sit amet
17440,Yozio,rstanfieldc7@ask.com,+351 417 769 9160,ut nulla sed accumsan felis ut at dolor quis odio consequat varius integer ac leo pellentesque ultrices mattis odio donec vitae nisi nam ultrices
17441,Youfeed,lfurmagierc8@diigo.com,+86 837 635 8984,tincidunt in leo maecenas pulvinar lobortis est phasellus sit amet erat nulla tempus vivamus in
17442,Oba,ramblerc9@about.me,+55 176 160 8443,pede ullamcorper augue a suscipit nulla elit ac nulla sed vel enim sit amet nunc viverra dapibus nulla suscipit ligula in
17443,Browsetype,tbalaisonca@pen.io,+351 734 260 2084,non mattis pulvinar nulla pede ullamcorper augue a suscipit nulla elit ac nulla sed vel enim sit
17444,Brightbean,hposthillcb@slate.com,+62 734 714 2728,at velit eu est congue elementum in hac habitasse platea dictumst morbi vestibulum velit id pretium iaculis diam erat fermentum justo nec
17445,Janyx,myettscc@yolasite.com,+66 606 890 6602,adipiscing lorem vitae mattis nibh ligula nec sem duis aliquam convallis nunc proin at turpis a pede posuere
17446,Skipfire,nmattingsoncd@instagram.com,+62 208 115 5981,ligula sit amet eleifend pede libero quis orci nullam molestie nibh in lectus pellentesque at
17447,Zoombox,kabrahamsonce@youku.com,+62 650 834 8328,aliquam quis turpis eget elit sodales scelerisque mauris sit amet eros suspendisse accumsan tortor quis turpis sed ante vivamus tortor duis
17448,Thoughtbridge,lpfaffelcf@mtv.com,+380 304 800 0887,tellus in sagittis dui vel nisl duis ac nibh fusce lacus purus aliquet at feugiat non pretium quis lectus suspendisse potenti in
17449,Twiyo,nbelliardcg@miibeian.gov.cn,+62 802 313 9740,rhoncus dui vel sem sed sagittis nam congue risus semper porta volutpat quam pede lobortis ligula sit
17450,Zoomdog,aliepmannch@ebay.co.uk,+57 745 831 5017,sapien iaculis congue vivamus metus arcu adipiscing molestie hendrerit at vulputate vitae nisl aenean lectus pellentesque eget nunc donec quis orci eget orci
17451,Voomm,kearthfieldci@reuters.com,+963 882 403 8271,eu sapien cursus vestibulum proin eu mi nulla ac enim in tempor turpis nec euismod scelerisque quam turpis adipiscing lorem vitae
17452,Devify,mgumlycj@whitehouse.gov,+260 859 134 0607,donec pharetra magna vestibulum aliquet
17453,Oyoyo,jrichmondck@phpbb.com,+380 448 896 1974,ultricies eu nibh quisque id justo sit amet sapien
17454,Miboo,pjanatacl@parallels.com,+63 639 706 5635,magnis dis parturient montes nascetur ridiculus mus etiam vel augue vestibulum rutrum rutrum neque aenean auctor gravida sem praesent id massa id nisl
17455,Feedfire,bhackingecm@odnoklassniki.ru,+389 575 961 8225,rhoncus aliquet pulvinar sed nisl nunc rhoncus dui vel sem sed sagittis nam congue risus semper porta volutpat quam pede lobortis ligula sit amet eleifend
17456,Flashpoint,yelvidgecn@washingtonpost.com,+351 513 542 2798,praesent blandit nam nulla integer pede justo lacinia eget tincidunt eget tempus vel pede morbi porttitor lorem id ligula suspendisse ornare
17457,Flashspan,iyallopco@youtu.be,+86 572 999 9784,molestie sed justo pellentesque viverra pede ac diam cras pellentesque volutpat dui maecenas tristique est et
17458,Avamm,bplaydencp@illinois.edu,+386 141 208 0972,viverra diam vitae quam suspendisse potenti nullam porttitor lacus at turpis donec posuere metus vitae ipsum aliquam
17459,Izio,jcrimpcq@vinaora.com,+48 759 109 6942,eu mi nulla ac enim in tempor turpis
17460,Skinix,euebelcr@paginegialle.it,+380 935 480 1583,penatibus et magnis dis parturient montes
17461,Tagtune,vcourtescs@ted.com,+358 812 446 8218,massa volutpat convallis morbi odio odio elementum eu interdum eu tincidunt in leo maecenas pulvinar lobortis est phasellus sit amet erat nulla tempus
17462,Avamba,kwalheddct@livejournal.com,+86 142 542 7340,phasellus in felis donec semper sapien a libero
17463,Wordtune,goheagertiecu@163.com,+506 859 107 3432,lacinia sapien quis libero nullam sit amet turpis
17464,Linktype,bstevencv@npr.org,+86 564 940 9227,lacus purus aliquet at feugiat non pretium quis lectus suspendisse potenti in eleifend quam a odio in hac habitasse
17465,Brightdog,seassomcw@usa.gov,+33 810 642 6805,donec odio justo sollicitudin ut suscipit a feugiat et eros vestibulum ac est lacinia nisi venenatis tristique fusce congue diam id ornare imperdiet sapien urna
17466,Devbug,nvasyutincx@apache.org,+86 122 688 8873,dis parturient montes nascetur ridiculus mus etiam vel augue vestibulum rutrum rutrum neque aenean auctor gravida sem praesent id massa id nisl
17467,Ntag,vmilellacy@themeforest.net,+63 155 191 6238,lacus morbi quis tortor id nulla ultrices aliquet maecenas leo odio condimentum id luctus nec
17468,Gigazoom,mdeftycz@nhs.uk,+62 305 918 0377,mauris ullamcorper purus sit amet nulla quisque arcu libero rutrum ac lobortis vel dapibus at diam nam tristique
17469,Avavee,jgaiterd0@about.me,+55 760 469 7229,sapien cursus vestibulum proin eu mi nulla ac enim in
17470,Yakijo,smartond1@freewebs.com,+62 480 838 3608,risus auctor sed tristique in
17471,Chatterbridge,ogulvind2@51.la,+7 600 675 5857,est et tempus semper est quam pharetra magna ac consequat
17472,Myworks,dcarillod3@netvibes.com,+351 431 276 0195,ante vel ipsum praesent blandit lacinia erat vestibulum sed magna at nunc commodo placerat praesent blandit nam nulla integer pede justo lacinia eget tincidunt eget
17473,Bubbletube,wnillesd4@abc.net.au,+86 374 991 6465,hac habitasse platea dictumst aliquam augue quam sollicitudin vitae consectetuer eget rutrum at lorem integer tincidunt ante
17474,Voonix,elathomd5@163.com,+98 868 593 3060,habitasse platea dictumst aliquam augue quam sollicitudin vitae consectetuer eget rutrum at lorem integer tincidunt ante vel ipsum praesent blandit
17475,Zoomzone,jromayned6@artisteer.com,+507 456 943 2140,habitasse platea dictumst maecenas ut massa quis augue luctus tincidunt nulla mollis molestie lorem quisque ut erat curabitur gravida nisi
17476,Thoughtworks,espurriard7@ed.gov,+86 864 918 8679,nisl venenatis lacinia aenean sit amet justo morbi ut odio cras mi pede malesuada in imperdiet et
17477,Rhyloo,kondrusekd8@scribd.com,+7 483 757 4145,vivamus tortor duis mattis egestas metus aenean
17478,Oyoloo,mfridd9@smugmug.com,+86 148 103 3052,congue risus semper porta volutpat quam pede lobortis ligula sit amet eleifend pede libero quis orci nullam
17479,Buzzshare,jwyethda@trellian.com,+33 678 476 3307,quam turpis adipiscing lorem vitae mattis nibh ligula nec sem duis aliquam convallis nunc proin at turpis a pede posuere
17480,Fatz,wshorlanddb@networksolutions.com,+86 166 684 9860,pulvinar nulla pede ullamcorper augue a suscipit nulla
17481,Wordpedia,jronnaydc@npr.org,+62 166 385 7641,molestie hendrerit at vulputate vitae nisl aenean lectus pellentesque eget nunc donec quis orci eget orci vehicula condimentum curabitur in libero ut massa volutpat convallis
17482,Flipbug,anunsondd@globo.com,+55 981 250 1845,eu tincidunt in leo maecenas pulvinar lobortis est phasellus sit amet erat
17483,Blognation,kadelbergde@weebly.com,+30 104 984 7973,justo in hac habitasse platea dictumst etiam faucibus cursus urna ut tellus
17484,Jamia,cmaccrackandf@bluehost.com,+86 458 219 8705,mattis odio donec vitae nisi nam
17485,Lazzy,llyndsdg@tripadvisor.com,+63 569 689 0811,commodo placerat praesent blandit nam nulla integer pede justo lacinia eget tincidunt
17486,Vipe,coherlihydh@admin.ch,+49 353 657 2012,parturient montes nascetur ridiculus mus etiam vel augue vestibulum rutrum
17487,Zoomzone,bworsnipdi@mayoclinic.com,+62 455 261 0635,nulla ultrices aliquet maecenas leo odio condimentum id luctus nec molestie sed justo pellentesque viverra pede ac diam cras pellentesque volutpat dui maecenas
17488,Zoombeat,cmattiazzidj@soup.io,+86 661 865 2713,eu est congue elementum in hac habitasse platea dictumst morbi vestibulum velit id pretium iaculis
17489,Demivee,ndymonddk@moonfruit.com,+58 812 597 8661,eros suspendisse accumsan tortor quis turpis sed ante vivamus tortor duis mattis egestas metus aenean fermentum donec ut mauris eget massa tempor convallis nulla
17490,Kwimbee,kdennisdl@surveymonkey.com,+86 431 193 1661,posuere cubilia curae mauris viverra diam vitae quam suspendisse potenti nullam porttitor lacus at turpis donec posuere metus vitae
17491,Tagcat,mroddelldm@reverbnation.com,+7 924 535 2092,id pretium iaculis diam erat fermentum justo nec condimentum neque sapien placerat ante nulla justo aliquam quis turpis eget elit sodales
17492,Tambee,ssmogurdn@vkontakte.ru,+46 328 190 1091,eget massa tempor convallis nulla neque libero convallis eget eleifend luctus ultricies eu nibh quisque id justo sit amet sapien dignissim vestibulum vestibulum ante
17493,Wordware,dcoatsdo@adobe.com,+63 877 482 2021,id massa id nisl venenatis lacinia aenean sit amet justo morbi ut odio cras mi pede malesuada
17494,Kwimbee,jocurrandp@who.int,+86 716 610 8969,platea dictumst aliquam augue quam
17495,Yakidoo,gmaccrackandq@cdc.gov,+86 307 878 8011,curabitur at ipsum ac tellus semper interdum mauris ullamcorper purus sit amet nulla quisque arcu libero
17496,Kwilith,sbykdr@hc360.com,+62 213 539 0222,a nibh in quis justo maecenas rhoncus aliquam lacus morbi quis tortor id nulla ultrices aliquet maecenas
17497,Eamia,tscarlands@cafepress.com,+375 357 889 4070,lacinia erat vestibulum sed magna at nunc commodo placerat praesent blandit nam nulla integer pede justo lacinia
17498,Eabox,jpuzeydt@de.vu,+381 225 921 4198,elit ac nulla sed vel enim sit amet nunc viverra dapibus
17499,Photobug,fyansondu@163.com,+970 537 744 5417,ridiculus mus etiam vel augue vestibulum rutrum rutrum neque aenean auctor gravida sem praesent id massa id nisl venenatis lacinia aenean sit amet justo morbi
17500,Skipstorm,ckisardv@hubpages.com,+261 832 151 4885,pede malesuada in imperdiet et commodo vulputate justo in blandit ultrices enim lorem ipsum dolor sit amet consectetuer adipiscing elit
17501,Pixonyx,hjanecekdw@springer.com,+86 192 735 4951,nisl nunc nisl duis bibendum felis sed interdum venenatis turpis enim
17502,Flipbug,hniesingdx@i2i.jp,+63 450 690 3032,a pede posuere nonummy integer non velit donec diam
17503,Tagopia,ddaldandy@amazon.co.uk,+62 567 219 0244,velit donec diam neque vestibulum eget vulputate ut ultrices vel augue vestibulum ante
17504,Cogilith,tstanniondz@xing.com,+380 867 660 6290,integer pede justo lacinia eget tincidunt eget tempus vel pede morbi porttitor lorem id ligula suspendisse ornare consequat lectus in est risus
17505,Yakijo,ldythame0@wisc.edu,+374 701 982 7921,morbi quis tortor id nulla ultrices aliquet maecenas leo odio condimentum id luctus nec molestie sed justo pellentesque viverra pede
