SupplierID,SupplierName,SupplierEmail,SupplierPhone,SupplierDescription
17001,Flipopia,eleckey0@sogou.com,+994 659 592 1043,morbi non quam nec dui luctus rutrum nulla tellus in sagittis dui vel nisl duis ac nibh fusce lacus purus aliquet at feugiat
17002,Photobug,ssurplice1@fc2.com,+63 147 625 8165,quis libero nullam sit amet turpis elementum ligula vehicula consequat morbi a ipsum integer a
17003,DabZ,mgrealey2@addthis.com,+683 760 437 2034,vehicula consequat morbi a ipsum integer a nibh in quis justo maecenas rhoncus
17004,Jaxnation,hlummus3@studiopress.com,+7 574 156 7384,proin risus praesent lectus vestibulum quam sapien varius ut blandit non interdum in ante vestibulum ante ipsum primis in faucibus
17005,Yodoo,emcparlin4@mayoclinic.com,+977 236 783 4729,eleifend donec ut dolor morbi vel lectus in quam
17006,Kwilith,pborgars5@google.it,+7 878 678 6322,risus praesent lectus vestibulum quam sapien varius ut blandit non interdum in ante vestibulum ante ipsum primis in
17007,Lazz,lgillino6@skype.com,+30 532 926 3520,congue vivamus metus arcu adipiscing molestie hendrerit at vulputate vitae nisl aenean lectus pellentesque eget nunc donec quis orci
17008,Oba,owadworth7@blinklist.com,+62 262 694 0711,et tempus semper est quam pharetra magna ac consequat metus sapien ut nunc vestibulum ante ipsum primis in faucibus
17009,Divanoodle,nwalklott8@jigsy.com,+62 531 103 7182,elementum eu interdum eu tincidunt in leo maecenas pulvinar lobortis est phasellus sit amet erat nulla tempus vivamus in felis eu sapien cursus vestibulum
17010,Thoughtbeat,bhush9@vkontakte.ru,+86 736 328 9039,pede posuere nonummy integer non velit donec diam neque vestibulum eget vulputate ut ultrices vel augue vestibulum ante ipsum primis in faucibus orci luctus
17011,Tagchat,sbaudineta@kickstarter.com,+63 830 418 8321,dis parturient montes nascetur ridiculus
17012,Fatz,sshaulb@jugem.jp,+62 885 924 1730,sapien non mi integer ac neque duis bibendum morbi non quam nec dui luctus rutrum nulla tellus in sagittis dui vel nisl
17013,Eayo,klayc@vistaprint.com,+62 388 272 5155,vitae quam suspendisse potenti nullam porttitor lacus at turpis donec posuere metus
17014,Mynte,vsived@imdb.com,+86 367 711 9237,velit id pretium iaculis diam erat fermentum justo nec condimentum neque sapien placerat ante nulla justo aliquam quis turpis eget elit
17015,Feedfire,blandale@washington.edu,+7 356 114 6168,quam turpis adipiscing lorem vitae mattis nibh ligula nec sem duis aliquam
17016,Reallinks,btunnockf@liveinternet.ru,+52 195 660 4949,et ultrices posuere cubilia curae donec pharetra magna vestibulum aliquet ultrices erat tortor sollicitudin mi sit amet lobortis sapien sapien non mi
17017,Tagfeed,bbraunsteing@behance.net,+351 635 467 8210,pretium quis lectus suspendisse potenti in eleifend quam a odio in
17018,Meevee,bbraunstonh@nifty.com,+62 846 319 5639,ipsum dolor sit amet consectetuer adipiscing elit proin risus praesent lectus vestibulum quam sapien varius ut blandit non interdum in ante vestibulum ante ipsum primis
17019,Flashdog,gcecii@comcast.net,+86 295 334 7154,odio condimentum id luctus nec molestie sed justo pellentesque viverra pede ac diam cras pellentesque volutpat dui maecenas tristique est et tempus semper est quam
17020,Bubbletube,jattenbrowj@php.net,+7 964 233 9140,diam vitae quam suspendisse potenti
17021,Jabbertype,wfaussettk@census.gov,+86 314 587 5699,pharetra magna ac consequat metus sapien ut nunc vestibulum ante ipsum primis in faucibus orci luctus et ultrices posuere cubilia curae mauris viverra diam vitae
17022,Twinder,sshilletol@ucla.edu,+62 615 584 9848,amet turpis elementum ligula vehicula consequat morbi a ipsum integer a nibh in quis justo
17023,Jetpulse,egippm@engadget.com,+63 904 383 3644,pellentesque at nulla suspendisse potenti cras in purus eu
17024,Snaptags,lmessern@networkadvertising.org,+254 971 469 8423,a nibh in quis justo maecenas rhoncus aliquam lacus morbi quis tortor id
17025,Devshare,jpagramo@1688.com,+63 382 954 2369,parturient montes nascetur ridiculus mus vivamus vestibulum sagittis sapien cum sociis natoque penatibus et magnis dis parturient montes
17026,Browseblab,cpodburyp@w3.org,+381 768 532 2943,dolor morbi vel lectus in quam fringilla rhoncus mauris enim leo rhoncus sed vestibulum sit amet cursus id
17027,Kimia,wbarenskieq@ehow.com,+48 646 619 3948,cum sociis natoque penatibus et magnis dis parturient montes nascetur ridiculus
17028,Realblab,bkilfederr@delicious.com,+27 867 975 2859,blandit non interdum in ante vestibulum ante ipsum primis in faucibus orci luctus et ultrices posuere cubilia curae duis faucibus accumsan odio curabitur
17029,Meevee,jsellans@surveymonkey.com,+55 143 298 6931,pede venenatis non sodales sed tincidunt eu felis fusce posuere felis sed lacus morbi sem mauris laoreet ut rhoncus
17030,Teklist,smouncet@list-manage.com,+351 457 532 7352,congue eget semper rutrum nulla nunc purus phasellus in felis donec semper sapien a libero nam dui
17031,Latz,gdanatu@apache.org,+387 774 527 8318,elit proin interdum mauris non ligula pellentesque ultrices
17032,Plambee,ivanarsdalenv@amazon.co.uk,+63 639 900 4685,ultrices vel augue vestibulum ante ipsum primis in faucibus orci luctus et ultrices posuere cubilia curae donec pharetra magna vestibulum aliquet ultrices
17033,Dabshots,dbrilonw@cnbc.com,+355 338 311 6946,quis orci nullam molestie nibh in lectus pellentesque at nulla suspendisse potenti cras in purus eu magna vulputate luctus cum sociis natoque penatibus et magnis
17034,Shuffledrive,rhawkeyx@gizmodo.com,+86 809 898 4816,luctus nec molestie sed justo pellentesque viverra pede ac diam cras pellentesque volutpat dui maecenas tristique est et tempus semper est quam pharetra magna
17035,Topicstorm,rsaundersy@accuweather.com,+351 388 779 8453,venenatis tristique fusce congue diam id ornare imperdiet sapien urna pretium
17036,Vinte,bmioniz@rediff.com,+355 542 404 1215,pretium nisl ut volutpat sapien arcu sed augue aliquam erat volutpat in congue etiam justo etiam pretium iaculis
17037,Centizu,lkrook10@newyorker.com,+63 524 244 0826,nunc donec quis orci eget orci vehicula condimentum curabitur in libero ut massa volutpat convallis
17038,Teklist,ssale11@cnet.com,+63 942 487 2045,varius ut blandit non interdum in ante vestibulum ante ipsum primis in faucibus orci
17039,Youtags,bscowcroft12@wordpress.com,+86 953 985 2305,platea dictumst aliquam augue quam sollicitudin vitae consectetuer eget rutrum at lorem integer tincidunt ante
17040,Roombo,cgazzard13@google.nl,+86 552 106 6851,faucibus cursus urna ut tellus nulla ut erat id mauris vulputate elementum nullam varius nulla facilisi cras non velit nec
17041,Tagchat,fgalland14@behance.net,+86 236 225 0165,eu interdum eu tincidunt in leo
17042,Browseblab,rsegge15@abc.net.au,+970 479 299 4381,eget tempus vel pede morbi porttitor lorem id ligula suspendisse ornare consequat lectus in est risus auctor sed tristique in tempus sit amet sem
17043,Skimia,lmunkley16@dot.gov,+62 479 188 5936,consequat ut nulla sed accumsan felis ut at dolor
17044,Topiclounge,kgentzsch17@amazon.co.jp,+352 423 883 5167,cras non velit nec nisi vulputate nonummy maecenas tincidunt lacus at
17045,Plajo,nmacilhench18@livejournal.com,+30 239 896 5205,feugiat non pretium quis lectus
17046,Jetwire,kmirfin19@skype.com,+48 582 906 2768,sapien ut nunc vestibulum ante ipsum primis in faucibus
17047,Bluejam,lminelli1a@multiply.com,+30 993 105 8575,vestibulum vestibulum ante ipsum primis in faucibus orci luctus et ultrices posuere cubilia curae nulla dapibus dolor vel est donec odio justo sollicitudin ut
17048,Browsezoom,pmerricks1b@ustream.tv,+420 991 640 4780,id luctus nec molestie sed justo pellentesque viverra pede ac diam cras pellentesque volutpat dui maecenas tristique est et tempus semper
17049,Aivee,sdacca1c@stanford.edu,+850 347 931 5241,vel nulla eget eros elementum pellentesque quisque porta volutpat erat quisque erat eros
17050,Realcube,mgogan1d@mozilla.org,+62 398 913 0196,porttitor pede justo eu massa donec dapibus duis at velit eu est congue elementum in hac habitasse
17051,Tagchat,iheadford1e@list-manage.com,+7 359 354 4549,luctus et ultrices posuere cubilia curae donec pharetra magna vestibulum aliquet ultrices erat tortor sollicitudin mi sit amet lobortis sapien sapien non mi integer ac
17052,Tagcat,rjanse1f@squarespace.com,+1 202 281 0726,etiam pretium iaculis justo in hac habitasse platea dictumst etiam faucibus cursus urna
17053,Zooxo,bwhartonby1g@facebook.com,+7 951 411 9038,sapien iaculis congue vivamus metus arcu adipiscing molestie hendrerit at vulputate vitae nisl aenean lectus pellentesque eget nunc donec quis orci
17054,Riffwire,drouse1h@uol.com.br,+47 621 364 9217,at turpis donec posuere metus vitae ipsum aliquam non mauris morbi non lectus
17055,Voonte,mboor1i@eventbrite.com,+216 991 622 2512,magna vulputate luctus cum sociis
17056,Roodel,ahiscocks1j@ustream.tv,+389 604 686 0572,luctus ultricies eu nibh quisque id justo sit amet sapien dignissim vestibulum vestibulum ante ipsum
17057,Gabspot,kfranchioni1k@princeton.edu,+63 195 432 3398,justo nec condimentum neque sapien placerat ante nulla justo aliquam quis
17058,Skiba,bapfler1l@yahoo.co.jp,+34 950 262 6967,non pretium quis lectus suspendisse potenti in eleifend quam a odio in
17059,Kare,mruppelin1m@reverbnation.com,+86 103 465 9059,ac leo pellentesque ultrices mattis odio donec vitae nisi
17060,Edgeify,jbussens1n@buzzfeed.com,+62 771 498 8267,donec semper sapien a libero nam dui proin leo odio porttitor id
17061,Abata,gcarlone1o@mapquest.com,+998 424 314 6812,faucibus accumsan odio curabitur convallis duis consequat dui nec nisi volutpat eleifend donec ut dolor morbi vel lectus in quam fringilla
17062,Einti,mchester1p@posterous.com,+502 214 209 8184,felis sed interdum venenatis turpis enim blandit mi in porttitor pede justo
17063,Vinte,mcownden1q@mail.ru,+62 563 347 8487,nunc vestibulum ante ipsum primis in faucibus orci luctus et ultrices posuere cubilia curae mauris viverra diam vitae quam suspendisse potenti nullam porttitor lacus
17064,Pixope,lrizon1r@symantec.com,+86 686 944 8584,ligula pellentesque ultrices phasellus id sapien in sapien iaculis congue vivamus metus arcu adipiscing
17065,Twinte,croach1s@google.ru,+595 607 976 2119,id pretium iaculis diam erat fermentum justo nec condimentum neque
17066,Youbridge,hospillane1t@zdnet.com,+86 955 621 3170,nulla ultrices aliquet maecenas leo odio condimentum id luctus nec molestie sed justo pellentesque viverra pede ac diam cras pellentesque volutpat dui
17067,Kaymbo,tellsworthe1u@smh.com.au,+86 386 618 3226,eros vestibulum ac est lacinia nisi venenatis tristique
17068,Janyx,wlamming1v@shinystat.com,+55 329 546 7245,dui vel nisl duis ac nibh fusce lacus
17069,Dynabox,hbrisley1w@infoseek.co.jp,+7 150 533 2610,nulla pede ullamcorper augue a suscipit nulla
17070,Gabvine,rmolnar1x@aol.com,+372 756 398 7324,ridiculus mus vivamus vestibulum sagittis sapien cum sociis natoque penatibus et magnis dis
17071,Photobug,mbreens1y@newsvine.com,+7 659 784 7927,condimentum curabitur in libero ut massa
17072,Vinte,jbrik1z@privacy.gov.au,+64 464 270 7567,aenean fermentum donec ut mauris eget massa tempor convallis nulla neque libero convallis eget eleifend luctus ultricies eu nibh quisque id justo sit
17073,Tagtune,cnorthidge20@ibm.com,+62 405 649 4566,tortor sollicitudin mi sit amet lobortis sapien sapien non mi integer ac neque duis bibendum morbi non quam nec dui luctus rutrum nulla tellus
17074,Eare,nhully21@weather.com,+52 781 299 5186,orci luctus et ultrices posuere cubilia curae duis faucibus accumsan odio curabitur convallis duis consequat dui nec nisi volutpat eleifend donec
17075,Eare,mlinny22@pcworld.com,+385 474 655 9629,convallis morbi odio odio elementum eu interdum eu tincidunt in leo maecenas pulvinar lobortis est phasellus sit amet erat nulla tempus vivamus
17076,Voonix,lgiannazzo23@whitehouse.gov,+63 694 945 5077,in lacus curabitur at ipsum ac tellus semper interdum
17077,Babbleblab,rogan24@timesonline.co.uk,+237 667 397 1433,orci luctus et ultrices posuere cubilia curae donec pharetra magna vestibulum aliquet ultrices erat tortor sollicitudin mi sit amet lobortis sapien
17078,Thoughtstorm,gberardt25@pinterest.com,+55 968 638 2231,nunc vestibulum ante ipsum primis in faucibus orci luctus et ultrices posuere cubilia curae mauris viverra diam vitae quam suspendisse potenti nullam porttitor
17079,Twitterworks,gleys26@technorati.com,+255 633 962 6383,tincidunt lacus at velit vivamus vel nulla eget eros elementum pellentesque quisque porta volutpat
17080,Demizz,blamy27@gov.uk,+86 951 153 6443,phasellus sit amet erat nulla tempus vivamus in felis
17081,Jabbersphere,gjeavon28@shop-pro.jp,+591 593 812 5776,vestibulum ante ipsum primis in faucibus orci luctus et ultrices posuere cubilia curae nulla dapibus dolor vel est donec odio justo
17082,Rooxo,sstowe29@last.fm,+380 782 749 3940,tristique fusce congue diam id ornare imperdiet sapien urna pretium nisl ut volutpat sapien arcu sed augue aliquam erat volutpat in congue etiam justo etiam
17083,Browsezoom,ojirka2a@vkontakte.ru,+420 218 725 9447,diam cras pellentesque volutpat dui maecenas tristique est
17084,Kare,ahazeldean2b@icq.com,+46 918 376 8125,augue vestibulum rutrum rutrum neque aenean auctor gravida sem praesent id massa id nisl venenatis lacinia aenean sit amet justo morbi
17085,Babbleopia,hdrayton2c@wp.com,+351 988 615 6668,orci vehicula condimentum curabitur in libero
17086,Yodo,dmackeig2d@mapquest.com,+55 706 866 1032,eros suspendisse accumsan tortor quis turpis sed ante vivamus tortor duis mattis egestas metus aenean fermentum donec
17087,Riffpedia,ogravatt2e@google.cn,+57 909 934 9202,non pretium quis lectus suspendisse potenti in eleifend quam a odio in hac habitasse platea dictumst maecenas
17088,Browsezoom,cwheatland2f@huffingtonpost.com,+55 867 553 9244,amet consectetuer adipiscing elit proin risus praesent lectus vestibulum quam sapien varius ut blandit non interdum in
17089,Brainlounge,hkohrt2g@4shared.com,+62 628 178 8371,donec posuere metus vitae ipsum aliquam non mauris
17090,Mydeo,enoar2h@1688.com,+62 152 778 8416,placerat praesent blandit nam nulla integer pede justo lacinia eget tincidunt eget tempus vel pede morbi porttitor lorem id ligula suspendisse ornare consequat lectus
17091,Digitube,akobes2i@cbslocal.com,+63 333 922 7843,accumsan odio curabitur convallis duis consequat dui nec nisi volutpat eleifend donec ut dolor morbi
17092,Blogpad,snightingale2j@addthis.com,+234 142 514 9613,mauris laoreet ut rhoncus aliquet pulvinar sed nisl nunc rhoncus dui vel sem sed sagittis nam congue risus semper porta volutpat quam
17093,Thoughtbeat,lwallen2k@technorati.com,+54 766 272 4261,vel ipsum praesent blandit lacinia erat vestibulum sed magna at nunc commodo placerat praesent blandit
17094,Thoughtbeat,oberthot2l@bandcamp.com,+63 813 624 0260,dolor quis odio consequat varius integer ac leo pellentesque ultrices mattis odio donec vitae nisi nam ultrices libero non mattis pulvinar nulla pede ullamcorper augue
17095,Centidel,teglaise2m@cyberchimps.com,+33 518 718 6612,quisque erat eros viverra eget congue eget semper rutrum nulla nunc purus phasellus in felis donec semper sapien a libero
17096,Eire,fornils2n@alexa.com,+62 172 788 2957,non velit nec nisi vulputate nonummy maecenas tincidunt lacus at velit vivamus vel nulla eget eros elementum pellentesque quisque
17097,Centimia,phousam2o@networkadvertising.org,+63 534 613 8243,arcu libero rutrum ac lobortis vel dapibus
17098,Gevee,nstubbs2p@slideshare.net,+86 855 100 5372,aliquet pulvinar sed nisl nunc rhoncus dui vel sem sed sagittis nam congue risus semper porta volutpat quam pede
17099,Skilith,cjerrems2q@sitemeter.com,+355 241 914 7741,rutrum nulla tellus in sagittis dui vel nisl duis ac nibh fusce lacus
17100,Topicblab,mkrause2r@blogtalkradio.com,+385 948 858 8738,nullam varius nulla facilisi cras non velit nec
17101,Youtags,rshea2s@irs.gov,+48 562 364 1086,orci luctus et ultrices posuere cubilia curae mauris viverra diam vitae quam suspendisse potenti nullam porttitor lacus at
17102,Jaloo,sdranfield2t@behance.net,+98 278 492 7284,pede malesuada in imperdiet et commodo vulputate justo in blandit ultrices enim lorem ipsum
17103,Brainlounge,sgavini2u@i2i.jp,+374 347 537 6710,purus sit amet nulla quisque arcu libero rutrum ac lobortis vel
17104,Tagcat,dsconce2v@amazon.co.jp,+63 558 314 2273,gravida nisi at nibh in hac habitasse platea dictumst aliquam augue quam sollicitudin vitae consectetuer eget rutrum
17105,Zoonoodle,lludford2w@hp.com,+81 361 991 4386,pretium nisl ut volutpat sapien arcu sed augue aliquam
17106,Kwilith,hspykins2x@vkontakte.ru,+218 905 656 0792,vestibulum sagittis sapien cum sociis natoque penatibus et magnis dis parturient montes nascetur ridiculus mus
17107,Voonder,lquernel2y@ehow.com,+389 374 531 8162,fusce lacus purus aliquet at feugiat non pretium quis lectus suspendisse potenti
17108,Yodo,cpeppard2z@reuters.com,+53 970 358 9888,odio in hac habitasse platea dictumst maecenas ut massa quis augue luctus tincidunt nulla mollis
17109,Topiclounge,ipistol30@networksolutions.com,+33 150 217 8544,rhoncus aliquet pulvinar sed nisl nunc rhoncus dui vel sem sed
17110,Jabbersphere,amaitland31@harvard.edu,+62 329 609 9988,risus semper porta volutpat quam pede lobortis ligula sit amet eleifend pede libero quis orci nullam molestie nibh in lectus pellentesque at nulla suspendisse
17111,Ooba,slouedey32@lycos.com,+86 584 311 8084,dui luctus rutrum nulla tellus in sagittis dui vel nisl duis ac nibh fusce lacus purus aliquet at feugiat non pretium quis lectus suspendisse potenti
17112,Linktype,ahearons33@wix.com,+1 246 656 6209,lobortis est phasellus sit amet erat nulla tempus vivamus in felis eu sapien cursus vestibulum proin eu mi nulla ac enim
17113,Muxo,ebarstowk34@mac.com,+63 612 830 7056,pretium iaculis diam erat fermentum justo nec condimentum neque sapien
17114,Oyoyo,aobrian35@spiegel.de,+375 533 743 7058,et commodo vulputate justo in blandit ultrices enim lorem ipsum dolor sit amet consectetuer adipiscing elit proin interdum mauris
17115,Voomm,mfriedman36@diigo.com,+60 730 302 2058,mi nulla ac enim in tempor turpis nec euismod scelerisque
17116,Tagchat,lbutterfill37@themeforest.net,+46 262 770 3898,nec condimentum neque sapien placerat ante nulla justo aliquam quis turpis eget elit sodales scelerisque mauris sit amet
17117,Skalith,largente38@pbs.org,+48 430 973 8651,maecenas tristique est et tempus semper est quam pharetra magna ac consequat metus sapien ut nunc vestibulum ante ipsum primis in faucibus orci
17118,Plambee,cgannon39@ftc.gov,+33 223 927 3414,ipsum primis in faucibus orci luctus et ultrices posuere cubilia curae nulla
17119,Roombo,cthunnercliffe3a@over-blog.com,+1 865 223 4515,elit proin risus praesent lectus vestibulum quam
17120,Lazzy,hkordova3b@wp.com,+46 682 469 0350,nulla sed accumsan felis ut at dolor quis odio consequat
17121,Brightdog,asprigings3c@csmonitor.com,+1 214 299 8354,cursus urna ut tellus nulla
17122,Zoombeat,sfingleton3d@craigslist.org,+62 591 934 6806,neque sapien placerat ante nulla justo aliquam quis turpis eget
17123,Skippad,nwilmore3e@blogtalkradio.com,+1 341 600 0623,lorem id ligula suspendisse ornare consequat lectus in est risus auctor sed tristique in tempus sit amet sem fusce consequat nulla nisl nunc
17124,Mynte,ubrame3f@chron.com,+48 636 958 0022,tortor sollicitudin mi sit amet lobortis sapien sapien non mi integer ac neque duis bibendum morbi non quam
17125,Vitz,jkeener3g@mapquest.com,+98 521 504 7520,in libero ut massa volutpat convallis morbi odio odio elementum
17126,Trilith,jleftbridge3h@xinhuanet.com,+86 376 663 9706,ornare consequat lectus in est risus auctor sed
17127,Voonix,cschirok3i@weebly.com,+358 999 177 8895,scelerisque mauris sit amet eros suspendisse accumsan tortor quis
17128,Kanoodle,ggaitung3j@wix.com,+1 239 280 8438,maecenas leo odio condimentum id luctus nec molestie sed justo pellentesque viverra
17129,Ooba,ebourchier3k@naver.com,+7 980 526 7306,vel sem sed sagittis nam congue risus semper porta volutpat quam pede lobortis ligula
17130,Devpoint,rtesto3l@ted.com,+27 543 798 9579,convallis nunc proin at turpis
17131,Flipstorm,rflea3m@altervista.org,+93 285 814 1139,suspendisse potenti cras in purus eu magna vulputate luctus
17132,Wordtune,aflag3n@toplist.cz,+351 722 113 6081,nunc rhoncus dui vel sem sed sagittis nam congue risus semper porta volutpat quam
17133,Photofeed,oboichat3o@163.com,+31 498 317 7885,volutpat convallis morbi odio odio elementum eu interdum eu tincidunt in leo maecenas
17134,Browsebug,cstukings3p@rambler.ru,+86 829 107 0141,elementum pellentesque quisque porta volutpat erat quisque erat eros viverra eget congue eget semper rutrum nulla nunc purus phasellus in
17135,Brightbean,hmcnalley3q@biglobe.ne.jp,+57 901 582 9189,sed lacus morbi sem mauris laoreet ut rhoncus aliquet pulvinar sed nisl nunc rhoncus dui vel
17136,Topiclounge,bcable3r@blinklist.com,+55 758 804 3065,adipiscing elit proin risus praesent lectus vestibulum quam sapien varius ut blandit non interdum in ante vestibulum
17137,Edgepulse,hhadwen3s@accuweather.com,+63 997 905 4305,sit amet sem fusce consequat nulla nisl nunc nisl duis bibendum felis sed interdum venenatis turpis enim blandit mi
17138,Wordpedia,lnertney3t@cpanel.net,+380 146 759 0298,eget rutrum at lorem integer tincidunt ante vel ipsum praesent blandit lacinia erat vestibulum sed magna
17139,Brainbox,dclamo3u@freewebs.com,+374 889 122 0661,cubilia curae donec pharetra magna vestibulum aliquet ultrices erat tortor sollicitudin mi sit amet lobortis sapien sapien non mi
17140,Aivee,bgammel3v@linkedin.com,+33 439 920 7824,id ornare imperdiet sapien urna pretium
17141,Flashspan,adauncey3w@yandex.ru,+351 844 367 0027,vulputate nonummy maecenas tincidunt lacus at velit vivamus vel
17142,Centizu,gisland3x@ebay.co.uk,+7 936 566 3716,convallis duis consequat dui nec nisi volutpat eleifend donec ut dolor morbi vel lectus in quam fringilla
17143,Devshare,bcastro3y@yellowpages.com,+86 358 302 1755,justo in hac habitasse platea dictumst etiam faucibus cursus urna ut tellus nulla ut erat id mauris vulputate elementum nullam varius nulla facilisi cras
17144,Jayo,ehanvey3z@technorati.com,+86 794 474 0867,tempus semper est quam pharetra magna ac consequat metus sapien ut nunc vestibulum
17145,Jayo,lstout40@nba.com,+33 688 791 0054,ut massa quis augue luctus tincidunt
17146,Skipfire,alavers41@infoseek.co.jp,+52 763 322 2940,ipsum ac tellus semper interdum mauris ullamcorper purus sit amet
17147,Skyvu,makehurst42@washingtonpost.com,+7 184 211 9936,tincidunt lacus at velit vivamus vel nulla eget eros elementum pellentesque quisque
17148,Quimba,wbunney43@barnesandnoble.com,+86 332 780 0155,orci mauris lacinia sapien quis
17149,Babbleblab,bmattusov44@flickr.com,+420 706 912 3165,tellus in sagittis dui vel nisl duis ac nibh fusce lacus purus aliquet at feugiat non pretium quis lectus suspendisse potenti in eleifend
17150,Realmix,sgideon45@gov.uk,+27 801 993 0358,praesent id massa id nisl venenatis lacinia aenean sit amet justo morbi ut odio cras
17151,Wordify,hpoulston46@twitter.com,+48 450 990 4800,in sapien iaculis congue vivamus metus arcu adipiscing molestie hendrerit at vulputate
17152,Twimbo,lbourrel47@cyberchimps.com,+92 830 139 0084,ut suscipit a feugiat et eros
17153,Flashdog,hmcconnulty48@boston.com,+358 938 336 3100,cum sociis natoque penatibus et magnis dis parturient montes nascetur ridiculus mus vivamus vestibulum sagittis sapien cum sociis natoque
17154,Oozz,vtopliss49@oaic.gov.au,+7 650 678 0655,venenatis lacinia aenean sit amet justo morbi ut odio cras mi pede malesuada in imperdiet et commodo vulputate justo in blandit ultrices enim
17155,Quatz,tchelley4a@weibo.com,+62 547 819 6191,odio donec vitae nisi nam ultrices libero non mattis pulvinar nulla pede ullamcorper augue a suscipit nulla elit ac nulla sed vel
17156,Ntag,etheml4b@example.com,+86 331 281 8428,at nunc commodo placerat praesent blandit nam nulla integer pede justo lacinia eget tincidunt eget tempus
17157,Skynoodle,kwalsham4c@wordpress.com,+55 433 555 9723,mauris lacinia sapien quis libero nullam sit amet turpis elementum ligula vehicula consequat morbi a ipsum integer a nibh in quis justo maecenas rhoncus aliquam
17158,Jabbersphere,lmclelland4d@infoseek.co.jp,+86 906 160 3025,eu interdum eu tincidunt in leo maecenas pulvinar lobortis est phasellus sit amet erat
17159,Rhynoodle,mscarlet4e@amazon.co.uk,+970 675 977 8749,purus sit amet nulla quisque arcu libero
17160,Centimia,dlapworth4f@washington.edu,+44 238 164 5409,proin risus praesent lectus vestibulum quam sapien varius ut blandit non interdum in ante vestibulum ante ipsum primis in faucibus orci
17161,Quaxo,ibradburne4g@lycos.com,+7 174 999 1745,at velit eu est congue elementum in hac habitasse platea dictumst morbi vestibulum velit
17162,Skiba,dallbrook4h@istockphoto.com,+62 627 232 5233,ultrices mattis odio donec vitae nisi nam ultrices libero non mattis pulvinar nulla pede ullamcorper
17163,Eayo,tcrosse4i@networksolutions.com,+381 763 578 2905,proin risus praesent lectus vestibulum quam sapien varius ut blandit non
17164,Devpoint,ykummerlowe4j@linkedin.com,+370 929 392 0309,duis bibendum felis sed interdum venenatis turpis enim blandit
17165,Eamia,rdavidovici4k@dagondesign.com,+86 803 357 6761,nulla tellus in sagittis dui vel nisl duis ac nibh fusce
17166,Brightbean,kruddoch4l@addtoany.com,+86 339 209 3792,ligula pellentesque ultrices phasellus id sapien in sapien iaculis congue vivamus metus arcu adipiscing molestie hendrerit at vulputate vitae nisl
17167,Yoveo,fnanson4m@google.co.uk,+46 448 149 9219,non ligula pellentesque ultrices phasellus id sapien in sapien iaculis congue vivamus metus arcu adipiscing molestie hendrerit at vulputate vitae nisl aenean lectus pellentesque eget
17168,Realmix,lspadari4n@addtoany.com,+234 658 581 1016,mauris laoreet ut rhoncus aliquet pulvinar sed nisl nunc rhoncus dui vel sem sed sagittis
