SupplierID,SupplierName,SupplierEmail,SupplierPhone,SupplierDescription
23313,Mycat,lizattiv@house.gov,+30 742 616 5151,consectetuer eget rutrum at lorem integer tincidunt ante vel ipsum praesent blandit lacinia erat vestibulum sed magna at nunc commodo placerat praesent blandit nam nulla integer pede justo lacinia eget tincidunt eget tempus vel pede morbi porttitor lorem id ligula suspendisse ornare
23391,Jayo,drudgerdiw@archive.org,+7 879 900 8286,proin at turpis a pede posuere nonummy integer non velit donec diam neque vestibulum eget vulputate ut ultrices vel augue vestibulum ante ipsum primis in faucibus orci luctus et ultrices posuere cubilia curae donec pharetra magna vestibulum aliquet ultrices erat tortor sollicitudin mi sit amet lobortis sapien sapien non mi
23233,Jaxbean,btironix@stanford.edu,+1 202 490 3794,vel augue vestibulum ante ipsum primis in faucibus orci luctus et ultrices posuere cubilia
23339,Bluejam,jmunsoniy@sina.com.cn,+47 395 932 4784,amet consectetuer adipiscing elit proin interdum mauris non ligula pellentesque ultrices phasellus id sapien in sapien iaculis congue vivamus metus arcu adipiscing molestie hendrerit at vulputate vitae nisl aenean lectus pellentesque eget nunc donec quis orci
23481,Devbug,hcaldecourtiz@jimdo.com,+84 188 765 3115,nam ultrices libero non mattis pulvinar nulla pede ullamcorper augue a suscipit nulla elit ac nulla sed vel enim sit amet nunc viverra dapibus nulla suscipit ligula in lacus curabitur at ipsum ac tellus semper interdum mauris ullamcorper
23878,Quatz,tdumperj0@plala.or.jp,+86 170 102 0284,ut odio cras mi pede malesuada in imperdiet et commodo vulputate justo in blandit ultrices enim lorem ipsum dolor sit amet consectetuer adipiscing elit proin interdum mauris non ligula pellentesque ultrices
23607,Edgeblab,gcecilj1@admin.ch,+386 860 274 8519,curae donec pharetra magna vestibulum aliquet ultrices erat tortor sollicitudin mi sit amet lobortis sapien sapien non mi integer ac neque duis bibendum morbi non quam
23900,Gigabox,loganianj2@apache.org,+353 721 168 5218,eros viverra eget congue eget semper rutrum nulla nunc purus phasellus in felis donec semper sapien a libero
23637,Tavu,jglanvillej3@furl.net,+234 789 374 0475,consectetuer adipiscing elit proin interdum mauris non ligula pellentesque ultrices phasellus id sapien in sapien iaculis congue vivamus metus arcu adipiscing molestie hendrerit at vulputate vitae nisl aenean lectus pellentesque eget nunc donec quis orci eget orci
23414,Gigashots,anashej4@flickr.com,+57 913 395 5010,vestibulum vestibulum ante ipsum primis in faucibus orci luctus et ultrices posuere cubilia curae nulla dapibus dolor vel est donec odio justo sollicitudin ut suscipit a feugiat et eros vestibulum ac est lacinia nisi venenatis tristique fusce congue diam
23329,Feedbug,sandertonj5@diigo.com,+62 322 335 4621,orci luctus et ultrices posuere cubilia curae mauris viverra diam vitae quam suspendisse potenti nullam porttitor lacus at turpis donec posuere metus vitae ipsum aliquam non mauris morbi non lectus aliquam sit amet diam in magna bibendum imperdiet nullam orci pede venenatis non sodales sed tincidunt
23592,Teklist,ckliemkej6@cargocollective.com,+63 210 835 7906,vel sem sed sagittis nam congue risus semper porta volutpat quam pede lobortis ligula sit amet eleifend pede libero quis orci nullam molestie nibh in lectus pellentesque at nulla suspendisse potenti cras in
23064,Dynabox,mnorthwoodj7@sciencedaily.com,+33 493 486 9619,erat fermentum justo nec condimentum neque sapien placerat ante nulla justo aliquam quis turpis eget elit sodales scelerisque mauris sit amet eros suspendisse accumsan tortor quis
23966,Janyx,hmccullochj8@nifty.com,+63 980 845 1182,ultrices erat tortor sollicitudin mi sit
23765,Voonder,jbamberyj9@friendfeed.com,+263 982 299 6738,diam id ornare imperdiet sapien urna pretium
23274,Thoughtmix,jromeufja@techcrunch.com,+62 665 955 8471,mattis nibh ligula nec sem duis aliquam convallis nunc proin at turpis a pede posuere nonummy integer non velit donec diam neque vestibulum eget vulputate ut ultrices vel augue vestibulum ante ipsum primis in faucibus orci luctus et ultrices posuere cubilia curae donec
23654,Skyndu,esplevinjb@yolasite.com,+86 373 558 7337,fusce posuere felis sed lacus morbi sem mauris laoreet ut rhoncus aliquet pulvinar sed
23275,Topicshots,mjahnischjc@bloglines.com,+593 843 982 1418,consectetuer eget rutrum at lorem integer tincidunt ante vel ipsum praesent
23767,Yombu,mchatburnjd@cloudflare.com,+62 745 429 7976,blandit ultrices enim lorem ipsum dolor sit amet consectetuer adipiscing elit proin interdum mauris non ligula pellentesque ultrices phasellus id sapien in sapien iaculis congue vivamus metus arcu
23326,Bluezoom,fcoyshje@xrea.com,+1 352 339 0498,eget elit sodales scelerisque mauris sit amet eros suspendisse accumsan tortor quis turpis sed
23029,Gigaclub,dhugojf@dropbox.com,+234 332 329 5941,vehicula consequat morbi a ipsum integer a nibh in quis justo maecenas rhoncus aliquam lacus morbi quis tortor id nulla ultrices aliquet
23296,Jaxbean,joniansjg@cisco.com,+86 283 188 3966,nulla nisl nunc nisl duis bibendum felis sed interdum venenatis turpis enim blandit mi in porttitor pede justo eu massa donec dapibus duis at velit eu est congue elementum in hac habitasse platea dictumst morbi vestibulum velit id pretium iaculis diam erat fermentum justo nec condimentum neque sapien placerat
23553,Rhybox,elewsiejh@vimeo.com,+86 820 205 6793,duis mattis egestas metus aenean fermentum donec ut mauris eget massa tempor convallis nulla neque libero convallis eget eleifend luctus ultricies eu nibh quisque id justo sit amet sapien
23488,Aimbu,pattargeji@salon.com,+46 818 745 7686,amet cursus id turpis integer aliquet massa id lobortis convallis tortor risus dapibus augue vel accumsan tellus nisi eu orci mauris lacinia sapien quis libero nullam sit amet turpis elementum ligula vehicula consequat morbi a ipsum integer a nibh
23051,Eayo,wstappardjj@shop-pro.jp,+54 272 735 6385,integer a nibh in quis justo maecenas rhoncus aliquam lacus morbi quis tortor id nulla ultrices aliquet maecenas leo odio condimentum id luctus nec
23107,Skaboo,fdudekjk@economist.com,+385 424 643 8916,varius integer ac leo pellentesque ultrices mattis odio donec vitae
23017,Zooxo,sorrilljl@macromedia.com,+48 436 362 1481,ante vivamus tortor duis mattis egestas metus aenean fermentum donec ut mauris eget massa tempor convallis nulla neque libero convallis eget eleifend luctus ultricies eu nibh quisque id justo sit amet sapien dignissim vestibulum vestibulum ante ipsum primis in faucibus orci luctus et ultrices posuere cubilia curae nulla dapibus
23528,Photobug,bolenanejm@histats.com,+86 431 622 1037,ultrices posuere cubilia curae duis faucibus accumsan odio curabitur convallis duis consequat dui nec nisi volutpat
23866,Voonix,wlaintonjn@typepad.com,+234 240 961 9759,laoreet ut rhoncus aliquet pulvinar sed nisl nunc
23855,Jayo,scokaynejo@cbc.ca,+48 138 651 7955,at velit vivamus vel nulla eget eros elementum pellentesque quisque porta volutpat erat
23878,Dabtype,kdowsingjp@sitemeter.com,+30 678 858 5505,ac nulla sed vel enim sit amet nunc viverra dapibus nulla suscipit ligula in lacus curabitur
23979,Skalith,bortellsjq@baidu.com,+86 717 568 4199,in magna bibendum imperdiet nullam orci pede venenatis non sodales sed tincidunt eu felis fusce posuere felis sed lacus morbi sem mauris laoreet ut rhoncus aliquet pulvinar sed nisl nunc rhoncus dui vel sem sed sagittis nam congue risus semper porta volutpat quam pede lobortis ligula sit amet
23373,Bubbletube,caspyjr@unesco.org,+82 807 346 1353,lacus morbi sem mauris laoreet ut rhoncus aliquet pulvinar sed nisl nunc rhoncus dui vel sem sed sagittis nam congue risus semper porta volutpat quam pede lobortis ligula sit amet eleifend pede
23084,Shuffletag,gkinkaidjs@ibm.com,+30 131 886 1154,eros viverra eget congue eget semper rutrum nulla nunc purus phasellus in felis donec semper sapien a libero nam dui proin leo odio porttitor id consequat in consequat ut nulla sed accumsan felis ut at
23510,Minyx,llavignejt@earthlink.net,+86 876 840 7978,nibh in hac habitasse platea dictumst aliquam augue quam sollicitudin vitae consectetuer
23344,Yadel,tbaberju@cnet.com,+86 953 492 8651,blandit non interdum in ante vestibulum ante ipsum primis in
23574,Mynte,atrownsonjv@elpais.com,+351 670 688 1081,molestie sed justo pellentesque viverra pede ac diam cras pellentesque volutpat
23011,Thoughtbridge,ehaggerwoodjw@comsenz.com,+964 487 243 5654,et ultrices posuere cubilia curae
23588,Oyoloo,ltilberryjx@ustream.tv,+86 762 810 2306,amet consectetuer adipiscing elit proin interdum mauris non ligula pellentesque ultrices phasellus id
23971,Babbleset,fclarkewilliamsjy@bigcartel.com,+62 321 263 2796,viverra eget congue eget semper
23470,Brainbox,fregardsoejz@hp.com,+54 522 575 4595,hac habitasse platea dictumst morbi vestibulum velit id pretium iaculis diam erat fermentum justo nec condimentum neque sapien placerat ante nulla justo aliquam quis turpis eget elit sodales scelerisque mauris
23342,Voonix,rbarbiek0@blinklist.com,+1 415 762 4141,venenatis tristique fusce congue diam id ornare imperdiet sapien urna pretium nisl ut volutpat sapien arcu sed augue aliquam erat volutpat in congue etiam justo etiam pretium iaculis justo in hac habitasse platea
23438,Flipstorm,dvanshink1@ihg.com,+234 351 631 3471,ultrices aliquet maecenas leo odio condimentum id luctus nec molestie sed justo pellentesque viverra pede ac diam cras pellentesque volutpat dui maecenas tristique est et tempus semper est quam pharetra magna ac consequat metus sapien ut nunc vestibulum
23281,Chatterbridge,rzuanellik2@bloglines.com,+7 252 633 9026,felis donec semper sapien a libero nam dui proin leo odio porttitor id consequat in consequat ut nulla sed accumsan felis ut at dolor quis odio consequat varius integer ac leo pellentesque ultrices mattis odio donec vitae nisi nam ultrices libero
23798,Linkbuzz,tcreenank3@trellian.com,+1 904 452 8304,aliquet maecenas leo odio condimentum id luctus nec molestie sed justo pellentesque viverra pede ac diam cras pellentesque volutpat dui maecenas tristique est et tempus semper est quam pharetra magna ac consequat metus sapien ut nunc vestibulum ante ipsum primis in faucibus orci luctus et ultrices posuere cubilia curae
23358,Rhyzio,tjosefsonk4@delicious.com,+1 502 886 2828,praesent id massa id nisl venenatis lacinia aenean sit amet justo morbi ut odio cras mi pede malesuada in imperdiet et commodo
23506,Oyoba,ehedylstonek5@columbia.edu,+62 516 922 6879,nascetur ridiculus mus etiam vel augue vestibulum rutrum rutrum neque aenean auctor gravida sem praesent id massa id nisl venenatis lacinia aenean sit amet justo morbi ut odio cras mi pede malesuada in imperdiet et
23185,Katz,ewadwellk6@nifty.com,+86 347 448 5110,primis in faucibus orci luctus et ultrices posuere cubilia curae mauris viverra
23285,Plajo,tcoglek7@cdc.gov,+33 310 203 2631,aliquam lacus morbi quis tortor id nulla ultrices aliquet maecenas leo odio condimentum id luctus nec molestie sed justo pellentesque viverra pede ac diam cras pellentesque volutpat dui maecenas tristique est et tempus semper est quam pharetra magna ac consequat metus sapien ut
23934,Quamba,lgoverk8@hud.gov,+46 972 651 0983,gravida nisi at nibh in hac habitasse platea dictumst aliquam augue quam sollicitudin vitae
23573,Rhyloo,rlatank9@list-manage.com,+62 292 832 3306,leo odio porttitor id consequat in consequat ut nulla sed accumsan felis ut at dolor quis odio consequat varius integer ac leo pellentesque ultrices mattis odio donec vitae nisi nam ultrices libero non mattis pulvinar nulla pede ullamcorper augue a suscipit nulla elit ac
23717,Twitterlist,nmoarka@feedburner.com,+62 631 259 9889,ligula sit amet eleifend pede libero quis orci nullam molestie nibh in lectus pellentesque at nulla suspendisse potenti cras in purus
23158,Twitterworks,spurveyskb@yahoo.com,+48 639 337 2644,amet consectetuer adipiscing elit proin risus praesent lectus vestibulum quam sapien varius ut blandit non interdum in ante vestibulum ante ipsum primis in
23816,Skipstorm,ddyekc@unblog.fr,+51 322 971 2370,morbi vel lectus in quam fringilla rhoncus mauris enim leo rhoncus sed vestibulum sit amet cursus id turpis integer aliquet massa id lobortis convallis tortor risus dapibus augue vel accumsan tellus nisi eu orci mauris lacinia sapien quis libero nullam sit
23125,Wordpedia,lpepyekd@artisteer.com,+62 314 874 3990,nisi at nibh in hac habitasse platea dictumst aliquam augue quam sollicitudin vitae consectetuer eget rutrum at lorem integer tincidunt ante vel ipsum praesent blandit lacinia erat vestibulum sed magna at nunc commodo placerat praesent blandit nam nulla integer
23321,Latz,bpedrike@cdc.gov,+63 291 390 6840,massa donec dapibus duis at velit eu est congue elementum in hac habitasse platea dictumst morbi vestibulum velit id pretium iaculis diam erat fermentum justo nec condimentum neque sapien placerat ante nulla justo aliquam quis turpis eget elit sodales scelerisque mauris sit amet
23588,Tanoodle,ktooleykf@ed.gov,+1 212 213 5235,et tempus semper est quam pharetra magna ac consequat metus sapien ut nunc vestibulum ante ipsum primis in faucibus orci luctus et ultrices posuere cubilia curae mauris viverra diam vitae quam suspendisse potenti
23931,Voomm,dlougheidkg@boston.com,+81 916 571 5220,nec dui luctus rutrum nulla tellus in sagittis dui vel nisl duis ac nibh fusce lacus
23259,Quire,gsimickh@about.com,+216 114 503 3592,nibh in hac habitasse platea dictumst aliquam augue quam sollicitudin vitae consectetuer eget rutrum at lorem integer tincidunt ante
23120,Dynazzy,felleyneki@senate.gov,+57 238 658 3477,in faucibus orci luctus et ultrices posuere cubilia curae nulla dapibus dolor vel est donec odio justo sollicitudin ut suscipit a feugiat
23536,Ailane,csherredkj@zimbio.com,+7 159 567 8753,congue risus semper porta volutpat quam pede lobortis ligula sit amet eleifend pede libero quis orci nullam molestie nibh in lectus pellentesque at nulla suspendisse
23240,Leexo,sbynethkk@liveinternet.ru,+57 750 648 2211,sed tincidunt eu felis fusce posuere felis sed lacus morbi sem mauris laoreet ut rhoncus aliquet pulvinar sed nisl nunc rhoncus dui vel sem sed sagittis nam congue risus semper porta
23956,Mudo,scuxsonkl@tamu.edu,+62 332 111 1986,sed ante vivamus tortor duis mattis egestas metus aenean fermentum donec ut mauris eget massa tempor convallis nulla neque libero convallis eget eleifend luctus ultricies eu nibh quisque id justo sit amet sapien dignissim vestibulum vestibulum ante
23364,Voolia,dbedwardkm@marketwatch.com,+255 530 675 1676,mattis nibh ligula nec sem duis aliquam convallis nunc proin at turpis a pede posuere nonummy integer non velit donec diam neque vestibulum eget vulputate ut ultrices
23538,Yodo,wstquintinkn@virginia.edu,+86 418 124 1981,eu mi nulla ac enim in tempor turpis nec euismod scelerisque quam turpis adipiscing lorem vitae mattis nibh ligula nec
23580,Jaxnation,cmccluskeyko@engadget.com,+62 773 802 1817,curabitur convallis duis consequat dui nec nisi volutpat eleifend donec ut dolor morbi vel lectus in quam fringilla rhoncus mauris enim leo rhoncus sed vestibulum sit amet cursus id turpis integer aliquet massa id lobortis convallis tortor risus dapibus augue vel accumsan tellus nisi
23694,Eire,mlucianokp@dyndns.org,+420 434 867 2942,elit proin risus praesent lectus vestibulum quam sapien varius ut blandit non interdum in ante vestibulum ante ipsum primis in faucibus orci luctus et ultrices posuere cubilia curae duis faucibus accumsan odio curabitur convallis duis consequat dui nec nisi volutpat eleifend donec
23329,Twitterwire,praisonkq@chicagotribune.com,+1 516 535 6751,hac habitasse platea dictumst etiam faucibus cursus urna ut tellus nulla ut erat id
23975,Voolia,ebrusinkr@xinhuanet.com,+57 930 657 0145,cras mi pede malesuada in imperdiet et commodo vulputate justo in blandit ultrices enim lorem ipsum dolor sit amet consectetuer adipiscing elit proin interdum mauris non ligula pellentesque ultrices phasellus id sapien in sapien iaculis congue vivamus metus arcu adipiscing molestie hendrerit at vulputate vitae nisl aenean lectus pellentesque eget
23833,Aibox,plinnemanks@twitpic.com,+62 363 882 8949,vel dapibus at diam nam tristique
23727,Myworks,sbraganzakt@discuz.net,+351 417 571 4093,ipsum integer a nibh in quis justo maecenas rhoncus aliquam lacus morbi quis tortor id nulla
23304,Gigashots,ljoncicku@cafepress.com,+48 327 639 9433,justo lacinia eget tincidunt eget tempus vel pede morbi porttitor lorem id ligula suspendisse ornare consequat lectus in est risus auctor sed tristique in tempus sit amet sem fusce
23918,Devify,fdymidowiczkv@china.com.cn,+63 532 327 6912,nec sem duis aliquam convallis nunc proin at turpis a pede posuere
23393,Eayo,cgailorkw@abc.net.au,+63 371 336 4740,a suscipit nulla elit ac nulla sed vel enim sit amet nunc viverra dapibus nulla suscipit ligula in lacus curabitur at ipsum
23041,Skinix,ogotcliffkx@cdbaby.com,+63 740 773 9075,quis turpis eget elit sodales scelerisque mauris sit amet eros suspendisse accumsan tortor quis turpis sed ante vivamus tortor duis mattis egestas metus aenean fermentum donec ut mauris eget massa tempor convallis nulla neque libero convallis eget eleifend luctus ultricies eu nibh quisque id justo sit amet sapien dignissim
23489,Gigashots,twolfartky@oakley.com,+389 633 109 8421,cursus urna ut tellus nulla ut erat id mauris vulputate elementum nullam varius nulla facilisi cras non velit nec nisi vulputate nonummy maecenas tincidunt lacus at velit vivamus vel nulla eget eros elementum pellentesque quisque porta volutpat erat quisque erat eros viverra eget congue eget
23359,Brainlounge,bharmankz@tripod.com,+507 722 966 7294,at lorem integer tincidunt ante vel ipsum praesent blandit lacinia erat vestibulum sed magna at nunc commodo placerat praesent blandit nam nulla integer pede justo lacinia eget tincidunt eget tempus vel pede morbi porttitor lorem id ligula
23050,Skajo,cdarkottl0@kickstarter.com,+86 486 517 8315,praesent blandit lacinia erat vestibulum sed magna at nunc commodo placerat praesent blandit nam
23436,Quatz,sstrickettl1@economist.com,+373 462 617 2120,odio odio elementum eu interdum eu tincidunt in leo maecenas pulvinar lobortis est phasellus sit amet
23171,Bubblemix,klaugheranl2@booking.com,+502 881 702 3278,ultrices aliquet maecenas leo odio condimentum id luctus nec molestie sed justo pellentesque viverra pede ac diam cras pellentesque
23884,Devbug,dscoltsl3@mayoclinic.com,+503 238 136 4159,sapien iaculis congue vivamus metus
23217,Dabfeed,aoxterbyl4@jugem.jp,+62 304 550 4551,ipsum integer a nibh in quis justo maecenas rhoncus aliquam lacus morbi quis tortor id nulla ultrices aliquet
23382,Tagpad,ltousyl5@bluehost.com,+255 332 856 4283,nisl duis ac nibh fusce lacus purus aliquet at feugiat non pretium quis lectus suspendisse potenti in eleifend quam a odio in hac habitasse platea dictumst maecenas ut massa quis augue luctus tincidunt nulla mollis molestie lorem
23772,Realcube,nblomefieldl6@home.pl,+48 196 523 3436,consectetuer adipiscing elit proin risus praesent lectus vestibulum quam sapien varius ut blandit non interdum in ante vestibulum ante ipsum primis in faucibus orci luctus et ultrices posuere cubilia curae duis faucibus accumsan
23499,Ooba,bstagl7@imdb.com,+86 317 909 5998,odio in hac habitasse platea dictumst maecenas ut massa quis augue luctus tincidunt nulla mollis molestie lorem
23871,Jetwire,htrusslerl8@macromedia.com,+47 912 537 8043,tincidunt eget tempus vel pede morbi porttitor lorem id ligula suspendisse ornare consequat
23842,Youspan,ebenoistl9@goo.gl,+62 188 242 4869,turpis donec posuere metus vitae ipsum aliquam non mauris morbi non lectus aliquam sit amet diam in magna bibendum imperdiet nullam orci pede venenatis non sodales sed tincidunt eu felis fusce posuere felis sed lacus morbi sem mauris laoreet ut rhoncus aliquet pulvinar
23380,Skipstorm,lclipshamla@homestead.com,+7 435 415 7673,at vulputate vitae nisl aenean lectus pellentesque eget nunc donec quis orci eget orci vehicula condimentum curabitur in libero ut massa volutpat convallis morbi odio odio elementum eu interdum eu tincidunt in leo maecenas pulvinar lobortis est phasellus sit amet erat nulla tempus vivamus
23125,Kanoodle,etraytonlb@mapquest.com,+30 319 228 2365,in hac habitasse platea dictumst aliquam augue quam sollicitudin vitae consectetuer eget rutrum at lorem integer tincidunt ante vel ipsum praesent
23316,Jetwire,awilkinslc@github.io,+62 119 223 8552,in leo maecenas pulvinar lobortis est phasellus sit amet erat nulla tempus vivamus in felis eu sapien cursus vestibulum proin eu mi nulla ac enim in tempor turpis nec euismod scelerisque quam turpis adipiscing lorem vitae mattis nibh ligula nec sem duis aliquam convallis nunc
23375,Edgewire,ppuddiferld@japanpost.jp,+86 943 193 4608,ut dolor morbi vel lectus in quam fringilla rhoncus mauris enim leo rhoncus sed
23328,Demimbu,jsaylorle@bloglines.com,+1 825 815 3579,porta volutpat erat quisque erat eros viverra eget congue eget semper rutrum nulla nunc purus phasellus in felis donec semper sapien a libero nam dui proin leo odio porttitor id consequat in consequat ut nulla sed
23454,Aimbo,hbossonlf@tumblr.com,+62 513 362 4330,id mauris vulputate elementum nullam varius nulla facilisi cras non velit nec nisi vulputate nonummy maecenas tincidunt lacus at
23639,Dynabox,mduferielg@xrea.com,+237 586 303 8714,in hac habitasse platea dictumst aliquam augue quam sollicitudin vitae consectetuer eget rutrum at lorem integer tincidunt ante vel ipsum praesent blandit lacinia erat vestibulum sed magna at
23216,Vidoo,jkibbellh@sfgate.com,+63 659 287 4205,blandit nam nulla integer pede justo lacinia eget tincidunt eget tempus
23448,Oyope,ograssili@4shared.com,+55 974 208 7041,nulla tempus vivamus in felis eu sapien cursus vestibulum proin eu mi nulla ac enim in tempor turpis nec euismod scelerisque quam turpis adipiscing
23305,Thoughtmix,mmortlj@uol.com.br,+30 796 569 0413,scelerisque quam turpis adipiscing lorem vitae mattis nibh ligula nec sem duis aliquam convallis nunc proin at turpis a pede posuere nonummy integer non velit donec diam neque vestibulum eget vulputate ut ultrices vel augue vestibulum
23827,Vinte,tcanetlk@ox.ac.uk,+54 579 230 7691,in quis justo maecenas rhoncus aliquam lacus morbi quis tortor id nulla ultrices aliquet maecenas leo odio condimentum id luctus nec
23195,Devbug,bspeakll@github.com,+385 339 805 4991,amet cursus id turpis integer aliquet massa id lobortis convallis tortor risus dapibus augue vel accumsan tellus nisi eu orci mauris lacinia sapien quis libero nullam sit amet turpis elementum ligula vehicula consequat morbi a ipsum integer a nibh in quis justo maecenas rhoncus aliquam lacus morbi quis
23370,Quatz,ayitshaklm@toplist.cz,+86 198 156 5734,amet turpis elementum ligula vehicula consequat morbi a ipsum integer a nibh in quis justo maecenas rhoncus aliquam lacus morbi quis tortor id nulla ultrices aliquet maecenas leo odio condimentum id luctus nec molestie
23727,Dabshots,blarsenln@umn.edu,+7 962 114 5895,in purus eu magna vulputate luctus cum sociis natoque penatibus et magnis dis parturient montes nascetur ridiculus mus vivamus vestibulum sagittis sapien cum sociis natoque penatibus et magnis dis parturient montes nascetur ridiculus mus etiam vel augue vestibulum rutrum rutrum neque aenean auctor gravida sem praesent
23070,Edgepulse,hwiltshearlo@technorati.com,+84 527 691 2847,odio curabitur convallis duis consequat dui nec nisi volutpat eleifend donec ut dolor morbi vel lectus in quam fringilla rhoncus mauris enim leo rhoncus sed vestibulum sit amet cursus id turpis integer aliquet massa id lobortis convallis tortor risus dapibus augue vel accumsan tellus nisi eu
23197,Oozz,hbrehaultlp@buzzfeed.com,+62 645 588 4963,non interdum in ante vestibulum ante ipsum primis in faucibus orci luctus et ultrices posuere cubilia curae duis faucibus accumsan odio curabitur convallis duis consequat dui
23355,Ntag,rattocklq@columbia.edu,+55 158 106 7067,quam pede lobortis ligula sit amet eleifend pede libero quis orci nullam molestie nibh in lectus pellentesque at nulla suspendisse potenti cras in purus eu magna vulputate luctus cum sociis natoque penatibus et magnis dis parturient montes nascetur
23967,Linktype,bfeatonbylr@soundcloud.com,+54 785 366 2563,non interdum in ante vestibulum
23435,Jabberstorm,fquirkels@discuz.net,+51 769 724 0562,aliquam lacus morbi quis tortor
23884,Zoombox,mmarrionlt@joomla.org,+234 166 273 0775,leo odio condimentum id luctus nec molestie sed justo pellentesque viverra pede ac diam cras pellentesque volutpat dui maecenas tristique est et tempus semper est quam pharetra magna ac consequat metus sapien ut nunc vestibulum ante ipsum primis in
23848,Youtags,jkettridgelu@google.ru,+86 336 424 4154,duis bibendum felis sed interdum venenatis turpis enim blandit mi in porttitor pede justo eu massa donec dapibus duis at velit eu est congue elementum in hac habitasse platea dictumst morbi vestibulum velit id pretium iaculis diam erat fermentum justo nec condimentum
23258,Talane,chaversumlv@icio.us,+291 296 491 0050,suspendisse potenti cras in purus eu magna vulputate luctus cum sociis natoque penatibus et magnis dis parturient montes nascetur ridiculus mus vivamus vestibulum sagittis
23541,Realmix,tdulsonlw@prweb.com,+63 397 273 7508,libero non mattis pulvinar nulla pede ullamcorper
23991,Dynabox,bskitchlx@cbsnews.com,+7 756 147 8006,amet diam in magna bibendum imperdiet nullam orci pede venenatis non sodales sed tincidunt eu felis fusce posuere felis sed lacus morbi sem mauris laoreet
23035,Skajo,mchallengerly@go.com,+62 736 148 9124,non mauris morbi non lectus aliquam sit amet diam in magna bibendum imperdiet nullam orci pede venenatis non sodales sed tincidunt eu felis fusce posuere felis sed lacus morbi sem mauris laoreet ut rhoncus aliquet pulvinar sed nisl
