SupplierID,SupplierName,SupplierEmail,SupplierPhone,SupplierDescription
19169,Divanoodle,hminigo4o@tmall.com,+7 932 793 9056,mattis nibh ligula nec sem duis aliquam convallis nunc proin at turpis a pede posuere nonummy integer non velit donec diam neque vestibulum
19170,Realbridge,fbrosoli4p@paypal.com,+972 748 953 1810,scelerisque quam turpis adipiscing lorem vitae mattis nibh ligula nec sem duis
19171,Kazu,egyves4q@newsvine.com,+86 360 970 4024,eget orci vehicula condimentum curabitur
19172,Shufflebeat,pthrustle4r@ca.gov,+380 399 771 1652,eros suspendisse accumsan tortor quis turpis sed ante vivamus tortor duis
19173,Feedspan,kgerry4s@cnet.com,+52 521 992 0241,orci mauris lacinia sapien quis libero nullam sit amet turpis elementum ligula
19174,Rooxo,hjakeman4t@businesswire.com,+1 702 983 4982,sit amet eros suspendisse accumsan tortor
19175,Jamia,purion4u@constantcontact.com,+593 754 744 5398,quis turpis sed ante vivamus tortor duis mattis egestas metus
19176,Wordify,cdunne4v@examiner.com,+48 701 304 7117,a nibh in quis justo maecenas rhoncus aliquam lacus morbi quis
19177,Brainsphere,gridulfo4w@freewebs.com,+51 867 163 0290,mattis pulvinar nulla pede ullamcorper augue a suscipit nulla elit ac nulla sed vel enim sit amet nunc viverra dapibus nulla suscipit
19178,Voonte,freedie4x@ucla.edu,+62 882 144 6567,at feugiat non pretium quis lectus suspendisse potenti in eleifend quam a odio
19179,Centizu,ndubois4y@yahoo.com,+54 487 914 0802,vestibulum ante ipsum primis in
19180,Muxo,rropp4z@loc.gov,+48 695 359 5933,ante ipsum primis in faucibus orci luctus et ultrices posuere cubilia
19181,Agivu,lnewell50@cnn.com,+48 793 799 1169,arcu adipiscing molestie hendrerit at vulputate vitae nisl aenean lectus pellentesque eget nunc donec
19182,Feedfire,tcallow51@blog.com,+57 825 932 1539,quis orci eget orci vehicula condimentum curabitur
19183,Skipstorm,atremlett52@live.com,+7 418 502 7955,arcu sed augue aliquam erat volutpat in congue etiam justo etiam pretium iaculis justo in hac habitasse platea dictumst
19184,Janyx,mnotti53@acquirethisname.com,+1 515 128 9382,cras in purus eu magna vulputate luctus cum
19185,Youopia,bbaldery54@answers.com,+48 939 114 7214,tincidunt nulla mollis molestie lorem quisque ut erat curabitur gravida nisi at nibh in hac habitasse platea dictumst aliquam augue quam sollicitudin vitae consectetuer
19186,Flashspan,dreuss55@360.cn,+7 989 875 3242,pulvinar nulla pede ullamcorper augue a suscipit nulla elit ac nulla
19187,Linkbuzz,ltewkesbury56@devhub.com,+261 827 406 1695,quam pede lobortis ligula sit amet eleifend pede libero quis orci nullam molestie
19188,Babbleblab,sorred57@vkontakte.ru,+7 202 496 5279,lorem id ligula suspendisse ornare consequat lectus in est risus
19189,Talane,ajolliss58@wp.com,+351 920 913 3137,vel sem sed sagittis nam congue risus semper porta volutpat quam pede lobortis ligula sit amet eleifend pede libero
19190,Myworks,awhelpton59@indiegogo.com,+420 452 694 2735,erat tortor sollicitudin mi sit amet lobortis sapien sapien non mi integer
19191,Zoovu,randrysek5a@telegraph.co.uk,+86 968 525 4007,nisi volutpat eleifend donec ut dolor morbi vel lectus in
19192,Mudo,abatha5b@people.com.cn,+62 321 507 1833,cras non velit nec nisi vulputate nonummy maecenas tincidunt lacus
19193,Innotype,asherbrook5c@devhub.com,+86 870 671 8607,nisi nam ultrices libero non mattis pulvinar nulla pede ullamcorper augue a suscipit nulla elit ac nulla sed vel enim sit amet
19194,Skippad,rburlingham5d@hp.com,+86 576 855 0747,volutpat erat quisque erat eros viverra eget
19195,Avaveo,eradley5e@furl.net,+86 929 259 6575,vel ipsum praesent blandit lacinia erat vestibulum sed magna at nunc commodo placerat praesent blandit nam nulla integer pede
19196,Photobean,fcanizares5f@t-online.de,+86 237 395 0086,justo maecenas rhoncus aliquam lacus morbi quis tortor id nulla ultrices aliquet maecenas leo odio condimentum id luctus nec molestie sed justo pellentesque viverra
19197,Meevee,elavers5g@histats.com,+86 202 411 7737,erat curabitur gravida nisi at nibh in hac habitasse platea dictumst aliquam augue quam sollicitudin vitae consectetuer eget rutrum at lorem integer
19198,Wikizz,gcotta5h@twitpic.com,+385 381 776 5397,mattis nibh ligula nec sem duis aliquam convallis nunc proin at turpis a pede posuere nonummy
19199,Bubbletube,pmellor5i@wix.com,+62 452 285 9082,eget eros elementum pellentesque quisque porta volutpat erat quisque erat eros viverra
19200,Avavee,gbarrett5j@google.co.uk,+977 289 725 1045,mi sit amet lobortis sapien sapien
19201,Yombu,gslimon5k@apple.com,+86 274 486 5959,eget congue eget semper rutrum nulla
19202,Browsecat,fearwicker5l@com.com,+92 693 145 4106,vulputate ut ultrices vel augue vestibulum ante ipsum primis in faucibus orci luctus et ultrices posuere cubilia
19203,Dablist,tandrejs5m@hugedomains.com,+260 235 333 7999,aenean sit amet justo morbi ut odio
19204,Topdrive,mligoe5n@topsy.com,+358 497 615 7723,ut volutpat sapien arcu sed augue aliquam erat volutpat in congue etiam justo
19205,Topicshots,dmccalister5o@google.ru,+55 682 130 5367,ridiculus mus etiam vel augue vestibulum rutrum rutrum neque
19206,Fadeo,hchesterton5p@unicef.org,+212 477 828 9545,duis aliquam convallis nunc proin at turpis a pede posuere nonummy integer non
19207,Meetz,gmoyler5q@cloudflare.com,+54 104 965 6298,habitasse platea dictumst maecenas ut massa quis augue luctus tincidunt nulla mollis molestie lorem quisque ut erat curabitur gravida nisi at nibh in hac
19208,Wikizz,lbartlomiejczyk5r@vkontakte.ru,+62 357 592 2224,vestibulum ante ipsum primis in faucibus orci luctus et ultrices posuere cubilia curae donec pharetra magna vestibulum aliquet ultrices erat tortor sollicitudin
19209,Camimbo,bgrout5s@edublogs.org,+1 202 216 6944,mauris morbi non lectus aliquam sit amet diam in magna bibendum imperdiet nullam orci pede venenatis non sodales sed tincidunt eu
19210,Zooveo,hfry5t@weather.com,+51 129 307 5823,potenti nullam porttitor lacus at turpis donec posuere metus vitae ipsum aliquam non mauris morbi non
19211,Jaxnation,gpenvarden5u@de.vu,+86 137 679 7726,tortor id nulla ultrices aliquet maecenas leo odio condimentum id luctus nec molestie sed justo pellentesque viverra pede
19212,Quimm,kguilloud5v@army.mil,+86 331 215 7753,rutrum nulla tellus in sagittis dui vel nisl duis ac nibh fusce lacus purus aliquet at feugiat
19213,Brightdog,lfairs5w@clickbank.net,+507 940 547 1913,porta volutpat quam pede lobortis ligula sit amet eleifend pede libero quis orci nullam
19214,Tazzy,kdalesio5x@vimeo.com,+62 250 849 2952,tincidunt nulla mollis molestie lorem quisque ut erat curabitur
19215,Edgeify,matack5y@wikia.com,+63 830 650 0221,arcu sed augue aliquam erat volutpat in congue etiam justo etiam pretium iaculis justo in
19216,Gigabox,twaterhouse5z@blogs.com,+7 229 186 3059,amet eros suspendisse accumsan tortor quis
19217,Skimia,bizon60@vk.com,+86 812 431 1385,rhoncus dui vel sem sed sagittis nam congue risus semper porta volutpat quam pede lobortis ligula
19218,Fivechat,vstorm61@xinhuanet.com,+55 386 694 1350,integer non velit donec diam neque vestibulum eget vulputate ut ultrices vel augue vestibulum ante ipsum primis in faucibus
19219,Aimbo,charman62@abc.net.au,+420 602 247 5670,pellentesque at nulla suspendisse potenti cras in purus eu magna vulputate luctus cum sociis natoque penatibus et magnis
19220,Babbleset,akelling63@oaic.gov.au,+86 197 435 1692,hac habitasse platea dictumst morbi vestibulum velit id pretium iaculis diam erat fermentum justo nec condimentum neque sapien placerat ante nulla justo aliquam quis
19221,Livepath,mlalonde64@ibm.com,+242 237 368 9230,nulla tempus vivamus in felis eu sapien cursus vestibulum
19222,Jatri,ktomicki65@un.org,+256 276 142 1015,proin risus praesent lectus vestibulum quam sapien varius ut blandit non interdum in
19223,Tekfly,fgarrood66@zdnet.com,+33 109 558 9339,felis eu sapien cursus vestibulum proin eu mi nulla ac enim in tempor turpis nec euismod scelerisque quam turpis adipiscing
19224,Mynte,pkeatch67@miitbeian.gov.cn,+62 747 663 2707,aliquet massa id lobortis convallis tortor risus dapibus augue vel accumsan tellus nisi eu orci mauris lacinia sapien quis libero nullam sit amet turpis elementum
19225,Devpulse,jsorrel68@unesco.org,+234 289 970 2906,at vulputate vitae nisl aenean lectus pellentesque eget nunc donec quis orci eget
19226,Fivebridge,lsteckings69@smugmug.com,+86 431 795 0383,pede posuere nonummy integer non velit donec diam neque vestibulum eget vulputate ut ultrices vel augue vestibulum ante ipsum primis in
19227,Photofeed,crowthorn6a@nbcnews.com,+1 303 488 0142,ipsum praesent blandit lacinia erat vestibulum sed magna at nunc commodo placerat praesent blandit nam nulla integer pede justo lacinia
19228,Browsebug,fneeves6b@spotify.com,+33 749 209 4248,lorem quisque ut erat curabitur gravida nisi at nibh in hac habitasse platea dictumst aliquam augue quam sollicitudin vitae consectetuer eget rutrum
19229,Photobug,twaywell6c@yahoo.co.jp,+33 688 295 3621,cubilia curae donec pharetra magna vestibulum aliquet ultrices erat tortor sollicitudin mi sit amet
19230,Thoughtworks,wpighills6d@who.int,+86 265 166 2982,elit sodales scelerisque mauris sit amet eros suspendisse accumsan tortor quis turpis sed ante vivamus tortor duis mattis egestas metus
19231,Skyndu,hjohns6e@creativecommons.org,+48 879 323 0007,viverra eget congue eget semper rutrum nulla nunc purus phasellus in felis donec semper
19232,Skipstorm,aoteague6f@spiegel.de,+374 299 442 7571,nunc rhoncus dui vel sem sed sagittis nam congue risus semper porta volutpat quam pede lobortis ligula sit amet eleifend pede libero quis orci nullam
19233,Yoveo,omacsween6g@hp.com,+62 853 867 9560,vel augue vestibulum ante ipsum primis
19234,Oyondu,dgeroldo6h@economist.com,+62 202 117 5144,faucibus accumsan odio curabitur convallis duis consequat dui nec nisi
19235,Twimbo,bbotterell6i@pagesperso-orange.fr,+27 864 306 8857,felis eu sapien cursus vestibulum proin eu mi nulla ac enim in tempor turpis nec euismod scelerisque
19236,Roodel,collivierre6j@facebook.com,+373 122 636 1151,porttitor lacus at turpis donec posuere metus vitae ipsum aliquam non mauris morbi non lectus aliquam sit amet diam in magna bibendum imperdiet nullam orci
19237,Thoughtbridge,cmcanalley6k@liveinternet.ru,+55 875 412 7641,ac enim in tempor turpis nec euismod scelerisque quam turpis adipiscing lorem vitae mattis nibh ligula nec sem duis aliquam convallis
19238,Rhynyx,crazoux6l@dyndns.org,+51 964 459 0536,ac nulla sed vel enim sit amet nunc viverra dapibus nulla suscipit ligula in lacus curabitur at ipsum ac tellus
19239,Topicshots,akordovani6m@umn.edu,+86 432 639 6419,mollis molestie lorem quisque ut erat curabitur gravida nisi at nibh
19240,Dynava,aarchanbault6n@aol.com,+46 573 620 6555,dolor sit amet consectetuer adipiscing elit proin interdum
19241,Meejo,lgrzegorek6o@yolasite.com,+86 903 449 0892,eros viverra eget congue eget
19242,Browsebug,enathan6p@weebly.com,+86 758 495 4654,ac leo pellentesque ultrices mattis odio donec vitae nisi nam ultrices libero non mattis pulvinar nulla pede ullamcorper augue a suscipit nulla elit ac nulla
19243,Camido,zfenner6q@blogs.com,+62 283 490 1956,dui nec nisi volutpat eleifend donec
19244,Yozio,vailward6r@360.cn,+62 661 357 7126,sapien in sapien iaculis congue
19245,Voonyx,oshetliff6s@delicious.com,+86 268 981 7322,ligula in lacus curabitur at ipsum ac tellus semper interdum mauris ullamcorper purus sit amet nulla
19246,Mudo,kjurczak6t@buzzfeed.com,+62 496 708 6706,posuere cubilia curae duis faucibus accumsan odio curabitur convallis duis consequat dui nec
19247,Tazz,awoolland6u@posterous.com,+385 311 757 6390,ligula sit amet eleifend pede libero quis orci nullam molestie nibh in lectus pellentesque at nulla suspendisse potenti cras in purus eu magna vulputate
19248,Babbleopia,kdunston6v@sohu.com,+506 713 161 1238,mattis odio donec vitae nisi
19249,Skinix,hspillett6w@usa.gov,+256 311 900 6971,ipsum primis in faucibus orci luctus et ultrices posuere cubilia curae donec pharetra magna vestibulum aliquet ultrices erat tortor sollicitudin mi
19250,Tagfeed,shoy6x@smugmug.com,+598 629 511 1276,pellentesque viverra pede ac diam cras pellentesque volutpat dui maecenas tristique est et tempus semper est quam
19251,Zoomdog,mbonsul6y@dyndns.org,+63 153 550 3294,faucibus orci luctus et ultrices posuere cubilia curae donec pharetra magna vestibulum aliquet ultrices erat tortor sollicitudin mi sit amet lobortis sapien sapien
19252,Meemm,mclowley6z@va.gov,+86 960 510 2197,eleifend quam a odio in hac habitasse platea dictumst maecenas ut massa quis augue luctus tincidunt nulla mollis molestie
19253,Devpulse,jsilverthorn70@dedecms.com,+7 990 111 9348,in hac habitasse platea dictumst morbi
19254,Skynoodle,hsherel71@blogs.com,+86 362 873 0998,id massa id nisl venenatis lacinia aenean sit amet justo morbi ut odio
19255,Zoonder,hthow72@wikia.com,+62 165 451 1638,eu tincidunt in leo maecenas pulvinar lobortis est phasellus
19256,Eare,cpaylie73@reddit.com,+46 529 130 7536,tristique est et tempus semper est quam pharetra magna ac consequat metus sapien ut nunc vestibulum ante ipsum primis in faucibus
19257,Aimbu,lthow74@scientificamerican.com,+34 383 446 2963,parturient montes nascetur ridiculus mus vivamus vestibulum sagittis sapien cum sociis natoque penatibus et magnis dis parturient montes nascetur ridiculus mus
19258,Tazzy,bflight75@purevolume.com,+381 211 765 8653,primis in faucibus orci luctus et ultrices posuere cubilia curae duis faucibus accumsan odio curabitur convallis duis consequat dui nec nisi volutpat eleifend
19259,Twitterbridge,rmaddams76@google.de,+371 186 515 8824,eu est congue elementum in hac habitasse platea dictumst morbi vestibulum
19260,Aibox,tsinclair77@msu.edu,+62 917 631 3341,lectus pellentesque eget nunc donec quis orci eget
19261,Brainsphere,aakast78@yahoo.com,+255 477 146 1666,primis in faucibus orci luctus et ultrices posuere cubilia curae duis faucibus accumsan odio curabitur convallis duis consequat dui nec nisi volutpat
19262,Tagopia,jgliddon79@ifeng.com,+504 663 611 1835,nulla suspendisse potenti cras in purus eu magna vulputate
19263,Shuffletag,ftonna7a@blogspot.com,+48 544 645 7821,eu massa donec dapibus duis at velit eu est congue elementum in hac habitasse platea dictumst morbi vestibulum velit id pretium iaculis diam erat fermentum
19264,Divavu,ffolca7b@nature.com,+968 612 997 7348,massa id nisl venenatis lacinia aenean sit amet
19265,Mydeo,zbosward7c@va.gov,+27 503 443 1080,erat curabitur gravida nisi at nibh in hac habitasse platea dictumst aliquam augue quam sollicitudin
19266,Kazio,ctarbath7d@google.co.jp,+1 312 999 4049,odio curabitur convallis duis consequat dui nec
19267,Tekfly,gharber7e@google.com.hk,+46 403 249 8877,at feugiat non pretium quis lectus suspendisse potenti in eleifend quam a odio in
19268,Yakidoo,lberzin7f@buzzfeed.com,+7 705 993 2506,velit id pretium iaculis diam erat fermentum justo nec condimentum neque sapien placerat ante nulla justo aliquam quis turpis eget elit sodales
19269,Babbleopia,mwoodier7g@oakley.com,+86 646 344 2617,justo maecenas rhoncus aliquam lacus morbi quis tortor id nulla ultrices aliquet maecenas leo odio
19270,Kazio,tcasson7h@wikipedia.org,+1 424 507 7441,sed ante vivamus tortor duis mattis egestas metus aenean fermentum donec ut mauris eget massa tempor convallis nulla neque libero convallis eget
19271,Twitterbeat,jgwynne7i@storify.com,+86 750 816 8717,potenti in eleifend quam a odio in
19272,Vidoo,mfreiburger7j@whitehouse.gov,+256 571 499 0682,ipsum integer a nibh in quis justo maecenas rhoncus aliquam lacus morbi quis tortor id nulla ultrices aliquet maecenas
19273,Oyoba,psacks7k@icio.us,+992 850 211 2888,hac habitasse platea dictumst maecenas ut massa quis augue luctus tincidunt nulla mollis molestie lorem quisque ut erat curabitur gravida nisi at nibh in hac
19274,Zooxo,smotto7l@phpbb.com,+1 811 734 5407,et commodo vulputate justo in blandit ultrices enim lorem ipsum dolor sit amet consectetuer adipiscing elit proin interdum mauris non
19275,Realbuzz,lpierpoint7m@booking.com,+504 724 940 3906,curae mauris viverra diam vitae quam suspendisse potenti nullam porttitor
19276,Gabspot,otempest7n@intel.com,+242 909 599 0303,eget congue eget semper rutrum nulla nunc purus phasellus in felis donec semper sapien a libero nam dui proin
19277,Snaptags,lwardall7o@tripadvisor.com,+420 638 843 5757,vestibulum ante ipsum primis in faucibus orci luctus et ultrices posuere cubilia curae mauris viverra diam vitae quam suspendisse potenti nullam porttitor lacus
19278,Kwilith,gdefreyne7p@tripadvisor.com,+62 468 182 0556,amet erat nulla tempus vivamus in felis eu sapien cursus vestibulum
19279,Oloo,rheale7q@blinklist.com,+46 581 369 0482,venenatis lacinia aenean sit amet justo morbi ut odio cras mi pede malesuada in imperdiet et
19280,Lazz,pnajera7r@digg.com,+86 776 265 6410,erat tortor sollicitudin mi sit amet lobortis sapien sapien non mi integer ac neque
19281,Realmix,lgadaud7s@google.com.hk,+351 981 330 2522,metus sapien ut nunc vestibulum ante ipsum primis in faucibus orci luctus
19282,Jabberstorm,gcoronado7t@smh.com.au,+63 517 868 7481,ante ipsum primis in faucibus orci luctus et ultrices posuere cubilia curae duis faucibus accumsan odio curabitur convallis duis consequat
19283,Ntags,dmcvrone7u@google.de,+66 268 227 0497,eu est congue elementum in hac habitasse platea dictumst morbi vestibulum velit
19284,Meeveo,aliebrecht7v@bravesites.com,+62 763 307 3111,est risus auctor sed tristique in tempus sit amet sem fusce consequat nulla nisl nunc nisl duis bibendum felis sed interdum venenatis turpis enim
19285,Jayo,kballinghall7w@patch.com,+62 821 517 8493,eros viverra eget congue eget semper rutrum nulla nunc purus phasellus in felis donec semper sapien a libero nam dui proin
19286,Thoughtbeat,hallmann7x@ihg.com,+1 229 684 3831,ut erat id mauris vulputate elementum nullam varius nulla facilisi cras non
19287,Quamba,amacuchadair7y@studiopress.com,+84 566 468 6833,vulputate elementum nullam varius nulla facilisi cras non velit nec nisi vulputate
19288,Fadeo,bcouvet7z@amazon.co.jp,+261 755 901 1182,posuere cubilia curae duis faucibus accumsan odio curabitur convallis duis consequat dui nec nisi volutpat eleifend donec ut dolor morbi vel lectus in quam
19289,Kwinu,magar80@slashdot.org,+7 979 340 2382,eget congue eget semper rutrum nulla nunc purus phasellus in felis donec semper sapien a
19290,Meedoo,dbrashier81@is.gd,+27 995 840 6437,eros elementum pellentesque quisque porta volutpat erat quisque erat
19291,Mynte,akeynd82@yellowbook.com,+63 551 262 2707,at nibh in hac habitasse platea dictumst aliquam augue quam sollicitudin vitae consectetuer eget rutrum at lorem integer tincidunt ante vel ipsum
19292,Zoozzy,aneely83@diigo.com,+254 333 755 2366,ipsum praesent blandit lacinia erat vestibulum sed magna at nunc commodo placerat praesent blandit nam nulla integer pede justo
19293,Flipopia,tdeleon84@sbwire.com,+385 296 615 5045,vel augue vestibulum rutrum rutrum
19294,Podcat,mburnel85@businessweek.com,+509 193 970 4490,venenatis non sodales sed tincidunt eu felis fusce posuere felis sed lacus morbi sem
19295,Skinix,lfullicks86@zimbio.com,+86 466 994 8593,sit amet consectetuer adipiscing elit proin interdum mauris non
19296,Kwideo,ngage87@wikispaces.com,+46 231 403 7324,semper sapien a libero nam dui proin leo odio porttitor id consequat in consequat ut
19297,Muxo,kkrahl88@123-reg.co.uk,+7 768 521 4580,ante vivamus tortor duis mattis egestas metus aenean fermentum donec ut
19298,Twitterwire,ajaouen89@disqus.com,+86 546 516 3736,leo odio porttitor id consequat in consequat ut nulla sed accumsan felis ut at dolor
19299,Skimia,sglascott8a@scribd.com,+86 278 968 6415,turpis donec posuere metus vitae ipsum aliquam non mauris morbi non lectus aliquam sit amet diam in magna bibendum imperdiet nullam orci pede venenatis non
19300,Jabbercube,pgibbins8b@skype.com,+7 647 212 9002,mauris viverra diam vitae quam suspendisse potenti nullam porttitor lacus at turpis donec posuere metus vitae
19301,Cogilith,krignall8c@elpais.com,+7 233 280 1091,leo odio porttitor id consequat in consequat ut nulla sed accumsan felis ut at dolor quis odio consequat varius integer
19302,Rhyzio,ldanielczyk8d@upenn.edu,+256 425 922 7025,rutrum neque aenean auctor gravida sem praesent id massa id nisl venenatis lacinia aenean sit amet justo morbi ut odio cras mi pede
19303,Oozz,fdulany8e@europa.eu,+86 460 394 0364,eu nibh quisque id justo sit amet sapien dignissim vestibulum vestibulum ante ipsum primis in faucibus orci
19304,Meedoo,kleathes8f@craigslist.org,+62 785 335 9844,et magnis dis parturient montes nascetur
19305,Vidoo,alithgow8g@army.mil,+420 942 409 1383,sed sagittis nam congue risus semper porta volutpat quam pede lobortis ligula sit amet eleifend pede
19306,Edgeblab,arevell8h@sohu.com,+48 692 791 1959,cras mi pede malesuada in imperdiet et commodo vulputate justo in blandit ultrices enim
19307,Rhybox,eveck8i@biglobe.ne.jp,+63 718 660 7975,porta volutpat quam pede lobortis ligula sit amet eleifend pede libero quis orci nullam molestie nibh in lectus pellentesque at nulla suspendisse potenti
19308,Youfeed,kcordsen8j@eepurl.com,+355 500 202 1210,neque sapien placerat ante nulla justo aliquam quis turpis eget elit sodales scelerisque mauris sit amet eros suspendisse
19309,Tanoodle,salyukin8k@upenn.edu,+86 799 645 6289,in sagittis dui vel nisl duis ac nibh
19310,Topicshots,bfilipiak8l@cdc.gov,+1 881 399 5989,magnis dis parturient montes nascetur ridiculus mus vivamus vestibulum sagittis sapien cum sociis natoque
19311,Edgetag,manderl8m@toplist.cz,+86 172 911 4116,lorem id ligula suspendisse ornare consequat lectus in
19312,Skiptube,lmanz8n@ted.com,+84 364 179 5393,eu massa donec dapibus duis at velit eu est congue elementum in hac
19313,Browsecat,wsea8o@weebly.com,+7 586 257 4556,fermentum justo nec condimentum neque sapien placerat ante nulla justo aliquam quis turpis eget elit sodales scelerisque mauris
19314,Edgeclub,lmarians8p@wordpress.org,+506 422 424 8700,dictumst maecenas ut massa quis augue luctus tincidunt nulla mollis molestie lorem quisque ut erat curabitur gravida nisi at
19315,Jamia,sdenisyuk8q@mayoclinic.com,+351 143 652 8171,ultrices mattis odio donec vitae nisi nam ultrices libero non mattis pulvinar nulla pede ullamcorper augue a suscipit nulla elit ac nulla sed vel
19316,Ailane,kgrief8r@cbslocal.com,+220 164 186 7770,penatibus et magnis dis parturient
19317,Flipbug,fdehoogh8s@yelp.com,+7 355 938 8785,eu magna vulputate luctus cum sociis natoque penatibus et magnis dis parturient montes nascetur ridiculus mus
19318,Meetz,mfawdrey8t@vimeo.com,+7 578 970 4779,consectetuer adipiscing elit proin risus praesent
19319,Feedfish,dcharnley8u@independent.co.uk,+380 537 274 7126,ultrices phasellus id sapien in sapien iaculis congue vivamus metus arcu adipiscing molestie hendrerit at
19320,Wordpedia,tgilhooley8v@utexas.edu,+381 271 927 8049,posuere cubilia curae mauris viverra diam vitae quam suspendisse potenti nullam porttitor lacus at turpis donec posuere
19321,Bubbletube,bgoodisson8w@boston.com,+595 525 938 7464,tincidunt eget tempus vel pede morbi porttitor lorem id ligula suspendisse ornare consequat lectus in est risus auctor sed tristique in tempus sit amet
19322,Devshare,nfossick8x@unblog.fr,+212 402 314 6682,erat fermentum justo nec condimentum neque sapien placerat ante nulla justo aliquam quis turpis eget elit sodales scelerisque mauris sit amet eros suspendisse accumsan tortor
19323,Mycat,lwallege8y@qq.com,+216 955 954 7708,curae donec pharetra magna vestibulum aliquet ultrices erat tortor sollicitudin mi sit amet
19324,Jatri,cwillimot8z@clickbank.net,+970 864 471 9631,pulvinar sed nisl nunc rhoncus dui vel
19325,Topicshots,tnortcliffe90@ifeng.com,+49 764 437 6515,morbi non lectus aliquam sit amet diam in magna bibendum imperdiet nullam orci pede venenatis non sodales sed
19326,Babbleopia,sdik91@list-manage.com,+33 782 891 8754,odio consequat varius integer ac leo pellentesque ultrices mattis odio
19327,Edgetag,qwoolvin92@yale.edu,+55 696 194 4017,turpis elementum ligula vehicula consequat morbi a ipsum integer
19328,Dynava,toglassane93@newyorker.com,+1 615 863 0257,erat vestibulum sed magna at nunc commodo placerat praesent blandit nam nulla integer pede justo lacinia eget tincidunt eget tempus vel pede
19329,Dabtype,lhousegoe94@tripod.com,+48 651 772 4442,feugiat non pretium quis lectus
19330,Realpoint,amacconnal95@businesswire.com,+7 851 718 9147,in tempor turpis nec euismod scelerisque quam turpis adipiscing lorem vitae
19331,Brainlounge,kgobolos96@squidoo.com,+55 480 433 3948,consequat nulla nisl nunc nisl duis bibendum felis sed interdum venenatis turpis enim
19332,Babbleopia,pmerfin97@google.com.au,+251 657 796 6128,donec dapibus duis at velit eu est congue elementum in hac habitasse platea dictumst morbi vestibulum velit id pretium iaculis diam erat fermentum justo
19333,Gigazoom,ggeely98@slate.com,+62 885 217 9260,aliquam non mauris morbi non lectus aliquam sit amet diam in magna bibendum
19334,Brightdog,mphysick99@vimeo.com,+46 140 956 7485,sapien dignissim vestibulum vestibulum ante ipsum primis in
19335,Babblestorm,sjane9a@tripod.com,+46 335 553 5649,augue vestibulum rutrum rutrum neque aenean auctor gravida sem praesent id massa id nisl venenatis
19336,Wordware,amcdugal9b@reddit.com,+86 912 458 0834,pretium quis lectus suspendisse potenti in eleifend quam a odio in hac habitasse
19337,Skinte,cdadamo9c@chicagotribune.com,+357 453 819 4615,quis justo maecenas rhoncus aliquam lacus morbi quis tortor id nulla ultrices aliquet maecenas leo odio condimentum id luctus nec molestie
19338,Fanoodle,mbeecroft9d@wired.com,+62 476 402 1136,sit amet sem fusce consequat nulla nisl
19339,Yozio,ksymcoxe9e@deliciousdays.com,+62 741 503 1274,in faucibus orci luctus et ultrices posuere cubilia curae mauris viverra diam vitae
19340,Browsedrive,astpaul9f@webs.com,+385 589 801 3282,id justo sit amet sapien dignissim vestibulum vestibulum ante ipsum primis in faucibus orci luctus
