SupplierID,SupplierName,SupplierEmail,SupplierPhone,SupplierDescription
23454,Zoombox,scoltan0@tuttocitta.it,+84 651 305 6552,eget rutrum at lorem integer tincidunt ante vel ipsum praesent blandit lacinia
23601,Devcast,mnicholl1@devhub.com,+967 804 186 8844,at nulla suspendisse potenti cras in purus eu magna vulputate luctus cum sociis natoque penatibus et magnis dis parturient montes nascetur ridiculus mus vivamus vestibulum sagittis sapien cum sociis natoque penatibus et magnis dis parturient montes nascetur ridiculus mus etiam vel augue vestibulum rutrum rutrum neque aenean auctor
23463,Browsetype,kfrankum2@histats.com,+55 896 880 7995,morbi non lectus aliquam sit amet diam
23442,Dazzlesphere,hiron3@4shared.com,+66 447 643 6153,turpis adipiscing lorem vitae mattis nibh ligula nec sem duis aliquam convallis nunc proin at turpis a pede posuere nonummy integer non velit donec diam neque vestibulum eget vulputate ut ultrices vel augue vestibulum ante ipsum primis in faucibus orci luctus et ultrices posuere cubilia curae donec pharetra
23355,Trudoo,kyerbury4@hao123.com,+7 937 692 3376,tincidunt eu felis fusce posuere felis sed lacus morbi sem mauris laoreet ut rhoncus aliquet pulvinar sed nisl nunc rhoncus dui vel sem
23688,Wordify,fjojic5@wp.com,+7 390 162 9517,auctor sed tristique in tempus sit amet sem fusce consequat nulla
23568,Rhyloo,ssmeeton6@youtu.be,+86 305 436 8946,neque libero convallis eget eleifend luctus ultricies eu nibh quisque id justo sit amet sapien dignissim vestibulum vestibulum ante ipsum primis in faucibus orci luctus et ultrices posuere cubilia curae nulla dapibus dolor vel est donec odio justo sollicitudin ut suscipit a
23283,Rooxo,scestard7@drupal.org,+7 388 515 8664,duis bibendum felis sed interdum venenatis turpis enim blandit mi in porttitor pede justo eu massa donec dapibus duis at velit eu est congue elementum in hac habitasse platea dictumst morbi vestibulum velit id pretium iaculis diam erat fermentum justo nec condimentum neque sapien placerat ante nulla justo aliquam quis
23357,Aimbu,ddwyr8@techcrunch.com,+7 297 320 5639,potenti cras in purus eu magna vulputate luctus cum sociis natoque penatibus et magnis dis parturient montes nascetur ridiculus mus vivamus vestibulum sagittis sapien cum sociis natoque penatibus et magnis dis parturient montes nascetur ridiculus mus etiam vel augue vestibulum rutrum rutrum neque aenean auctor gravida sem praesent
23340,Jabberbean,khawkett9@privacy.gov.au,+86 886 498 2259,turpis nec euismod scelerisque quam turpis adipiscing lorem vitae mattis nibh ligula nec sem
23719,Topicblab,mpoilea@ted.com,+7 224 343 1393,aliquam non mauris morbi non lectus aliquam sit amet diam in magna bibendum imperdiet nullam orci pede venenatis non sodales sed tincidunt eu felis fusce posuere felis sed lacus
23860,Skidoo,mhanesb@bravesites.com,+86 486 571 9309,nulla mollis molestie lorem quisque ut erat curabitur gravida nisi at nibh in hac habitasse platea
23790,Plajo,odumbeltonc@guardian.co.uk,+27 609 340 0792,amet sapien dignissim vestibulum vestibulum ante ipsum primis in faucibus orci luctus et ultrices posuere cubilia curae
23981,Dabshots,sspurrittd@cdc.gov,+351 484 605 8145,ut tellus nulla ut erat id mauris vulputate elementum nullam varius nulla facilisi cras non velit nec nisi vulputate nonummy maecenas tincidunt lacus at velit vivamus vel nulla eget eros
23092,Edgetag,twenname@princeton.edu,+46 365 254 1050,pede ullamcorper augue a suscipit nulla elit ac nulla sed vel enim sit amet nunc viverra dapibus nulla suscipit ligula in lacus curabitur at ipsum ac tellus semper interdum mauris ullamcorper purus sit amet nulla quisque arcu libero rutrum ac lobortis vel dapibus at diam nam tristique tortor eu
23624,Skyvu,glukerf@earthlink.net,+252 109 239 2006,ipsum praesent blandit lacinia erat vestibulum sed magna at nunc commodo placerat praesent blandit nam nulla integer pede justo lacinia eget tincidunt eget tempus vel
23231,Gabtype,ibamburyg@redcross.org,+7 524 803 2816,etiam vel augue vestibulum rutrum rutrum neque aenean auctor gravida sem praesent id massa id nisl venenatis lacinia aenean sit amet justo morbi ut odio cras mi pede malesuada in imperdiet et commodo vulputate justo in blandit ultrices enim lorem ipsum dolor sit amet
23599,Flipopia,rmeakeh@hhs.gov,+62 658 910 9196,parturient montes nascetur ridiculus mus etiam vel augue vestibulum rutrum rutrum neque aenean auctor gravida sem praesent id massa id nisl venenatis lacinia aenean sit amet justo morbi
23775,Ntags,hbelloni@constantcontact.com,+51 704 595 6111,ante ipsum primis in faucibus orci luctus et ultrices posuere cubilia curae duis faucibus accumsan
23129,Meezzy,lgyenesj@lulu.com,+53 732 216 0629,velit eu est congue elementum in hac habitasse platea dictumst morbi vestibulum velit id pretium iaculis diam erat fermentum justo nec condimentum neque sapien placerat ante nulla justo aliquam quis turpis eget elit sodales scelerisque mauris sit amet
23853,Kanoodle,efaringtonk@washingtonpost.com,+92 937 999 6990,nulla justo aliquam quis turpis eget elit sodales scelerisque mauris sit amet eros
23329,Trudoo,ghammerl@imgur.com,+86 223 235 0741,donec pharetra magna vestibulum aliquet ultrices erat tortor sollicitudin mi sit amet lobortis sapien sapien non mi integer ac neque duis bibendum morbi non quam nec dui luctus rutrum nulla tellus in sagittis dui vel nisl duis ac nibh fusce lacus purus aliquet at
23925,DabZ,gsieghartm@so-net.ne.jp,+48 392 577 2840,sapien arcu sed augue aliquam erat volutpat in congue etiam justo etiam pretium iaculis justo in hac habitasse platea dictumst etiam faucibus cursus urna ut tellus nulla ut erat id
23351,Camimbo,kpicoppn@tuttocitta.it,+7 796 579 6578,felis sed interdum venenatis turpis enim blandit mi in porttitor pede justo eu massa donec dapibus duis at velit eu est congue elementum in hac habitasse platea dictumst morbi vestibulum velit id pretium iaculis diam erat fermentum justo nec condimentum neque sapien placerat ante nulla justo aliquam quis turpis
23946,Flipopia,fosheeo@macromedia.com,+86 142 995 7460,in lectus pellentesque at nulla suspendisse potenti cras in purus eu magna vulputate luctus cum sociis natoque penatibus et magnis dis parturient montes nascetur ridiculus mus vivamus vestibulum sagittis sapien cum sociis natoque penatibus et magnis dis parturient montes
23230,Buzzdog,mweldp@discuz.net,+1 338 570 9010,nunc purus phasellus in felis donec semper sapien a libero nam dui proin leo odio porttitor id consequat in consequat ut nulla sed accumsan felis ut at dolor quis odio consequat varius integer ac leo pellentesque ultrices mattis odio donec vitae nisi nam ultrices libero non mattis pulvinar nulla
23427,Fatz,weschalotteq@examiner.com,+66 476 163 9978,non lectus aliquam sit amet diam in magna bibendum imperdiet nullam orci pede venenatis non sodales sed tincidunt eu felis
23826,Jazzy,jferner@senate.gov,+86 139 971 0143,duis ac nibh fusce lacus purus aliquet at feugiat non pretium quis lectus suspendisse potenti in eleifend quam a odio in hac habitasse platea dictumst maecenas ut massa quis augue luctus tincidunt nulla mollis molestie lorem quisque
23099,Yakidoo,lcomos@g.co,+81 519 549 0419,libero quis orci nullam molestie nibh in lectus pellentesque at nulla suspendisse potenti cras in purus eu magna vulputate luctus cum sociis natoque penatibus et magnis dis parturient montes nascetur ridiculus mus vivamus vestibulum sagittis sapien cum sociis natoque
23763,Zoomdog,akingslandt@wiley.com,+242 992 753 1791,augue a suscipit nulla elit ac nulla sed
23605,Gigaclub,gwoolwayu@pinterest.com,+86 730 517 4899,etiam vel augue vestibulum rutrum rutrum neque aenean auctor gravida sem praesent id massa id nisl venenatis lacinia aenean sit amet justo morbi ut odio cras mi pede malesuada in imperdiet et commodo vulputate justo in blandit ultrices enim lorem ipsum dolor
23980,Brainverse,tairetonv@linkedin.com,+372 196 608 4941,nec euismod scelerisque quam turpis adipiscing lorem vitae mattis nibh ligula nec sem duis aliquam convallis nunc proin at turpis a pede posuere nonummy integer non velit donec diam neque vestibulum eget vulputate ut
23983,Topicware,cbosmanw@nps.gov,+31 214 515 7037,lacinia nisi venenatis tristique fusce congue diam id ornare imperdiet sapien urna pretium nisl ut volutpat sapien arcu sed augue aliquam erat volutpat in congue etiam justo etiam pretium iaculis justo in hac habitasse platea dictumst etiam faucibus cursus urna ut tellus nulla ut erat id
23434,Skippad,pwoltonx@livejournal.com,+46 575 947 7646,nascetur ridiculus mus etiam vel augue vestibulum rutrum rutrum neque aenean auctor gravida sem
23367,Zoomcast,dhamely@google.com,+56 681 117 7829,sed ante vivamus tortor duis mattis egestas
23840,Realfire,lkiddz@reuters.com,+7 144 119 8496,turpis enim blandit mi in porttitor pede justo eu massa donec dapibus duis at velit eu est congue elementum in hac habitasse platea dictumst morbi vestibulum velit id pretium iaculis diam erat fermentum justo
23540,Omba,rwimpenny10@last.fm,+507 120 892 2260,justo sit amet sapien dignissim vestibulum vestibulum ante ipsum primis in faucibus orci luctus et ultrices posuere cubilia curae nulla dapibus dolor vel est donec
23263,Dazzlesphere,msollas11@livejournal.com,+55 806 362 0130,in quam fringilla rhoncus mauris enim leo rhoncus sed vestibulum sit amet cursus id
23921,Zoonoodle,dritter12@adobe.com,+55 577 852 5487,pede posuere nonummy integer non velit donec diam neque vestibulum eget
23950,Tagtune,vgiblett13@ebay.com,+7 229 245 5187,vehicula condimentum curabitur in libero ut massa volutpat convallis morbi odio odio elementum eu interdum eu tincidunt in leo maecenas pulvinar
23475,Skiptube,hsackler14@miitbeian.gov.cn,+46 119 348 8975,vulputate elementum nullam varius nulla facilisi cras non velit nec nisi vulputate nonummy maecenas tincidunt lacus at velit vivamus vel nulla eget eros elementum pellentesque quisque porta volutpat erat quisque
23678,Cogilith,ccreaser15@xrea.com,+351 737 878 6088,commodo placerat praesent blandit nam nulla integer pede justo lacinia eget tincidunt eget tempus vel pede morbi porttitor lorem id ligula suspendisse ornare consequat lectus in est risus auctor sed tristique in tempus sit amet sem fusce
23685,Quatz,ezavattari16@toplist.cz,+86 881 220 3463,quam sollicitudin vitae consectetuer eget rutrum at lorem integer tincidunt ante vel ipsum praesent blandit lacinia erat vestibulum sed magna at nunc commodo placerat praesent blandit nam nulla integer pede justo lacinia eget tincidunt eget tempus vel pede morbi porttitor lorem id ligula suspendisse
23828,Wikizz,dbuy17@dyndns.org,+1 582 795 6832,enim leo rhoncus sed vestibulum sit amet cursus id turpis integer aliquet massa id lobortis convallis tortor risus dapibus augue vel accumsan tellus nisi eu orci mauris lacinia sapien quis libero nullam sit amet turpis elementum ligula vehicula consequat morbi a ipsum integer a nibh in quis justo
23630,Mydo,kker18@zimbio.com,+45 877 124 3452,adipiscing molestie hendrerit at vulputate vitae nisl aenean lectus pellentesque eget nunc donec quis orci eget orci vehicula condimentum curabitur in libero ut massa volutpat convallis morbi odio odio elementum eu interdum eu tincidunt in leo maecenas pulvinar lobortis est
23745,Innojam,scaren19@ihg.com,+992 290 580 7600,quisque ut erat curabitur gravida nisi at nibh in hac habitasse platea dictumst aliquam augue quam sollicitudin vitae consectetuer eget rutrum at lorem integer tincidunt ante vel ipsum
23666,Ntag,tcumbes1a@github.com,+62 842 398 8501,at vulputate vitae nisl aenean lectus pellentesque eget nunc donec quis orci eget orci vehicula condimentum curabitur in libero ut massa volutpat convallis morbi odio odio elementum eu interdum
23008,Feedmix,lpanons1b@zdnet.com,+63 886 246 9788,quisque ut erat curabitur gravida nisi at nibh in hac habitasse platea dictumst aliquam augue quam sollicitudin vitae consectetuer eget rutrum at lorem integer tincidunt ante vel ipsum praesent blandit lacinia erat vestibulum sed magna at nunc commodo placerat praesent blandit
23842,Skalith,hdilucia1c@squarespace.com,+86 149 850 2730,faucibus cursus urna ut tellus nulla ut erat id mauris vulputate elementum nullam varius nulla facilisi cras non velit nec nisi vulputate nonummy maecenas tincidunt lacus at velit vivamus vel nulla eget eros elementum pellentesque quisque porta volutpat
23888,Npath,pwissbey1d@ucla.edu,+7 675 168 6998,luctus nec molestie sed justo pellentesque viverra pede ac diam cras pellentesque
23138,Quimm,kconachie1e@ovh.net,+60 657 989 9930,posuere cubilia curae nulla dapibus dolor vel est donec odio justo sollicitudin ut suscipit a feugiat et eros vestibulum ac est lacinia nisi venenatis tristique fusce congue diam id ornare imperdiet
23947,Twiyo,tkynaston1f@canalblog.com,+7 761 741 2942,semper interdum mauris ullamcorper purus sit amet
23586,Skinder,gbeynon1g@pagesperso-orange.fr,+1 917 955 7208,auctor gravida sem praesent id massa id nisl venenatis lacinia aenean sit amet justo morbi ut odio cras mi pede malesuada in imperdiet et commodo vulputate justo in blandit ultrices enim lorem ipsum dolor sit amet consectetuer adipiscing elit proin interdum
23359,Brightbean,lstuchburie1h@fda.gov,+58 306 707 2659,turpis integer aliquet massa id lobortis convallis
23017,Feedbug,acolthard1i@ifeng.com,+251 923 188 5108,consectetuer adipiscing elit proin risus praesent lectus vestibulum quam sapien varius ut blandit non interdum in
23561,Twiyo,spainten1j@princeton.edu,+86 316 206 6519,congue eget semper rutrum nulla nunc purus phasellus in felis donec semper sapien a libero nam dui proin leo odio porttitor id consequat in consequat
23644,Tekfly,lrimer1k@amazon.de,+351 926 433 4528,augue vel accumsan tellus nisi eu orci mauris lacinia sapien quis libero nullam sit amet turpis elementum ligula vehicula consequat morbi a ipsum integer a nibh in quis
23783,Zoomlounge,garnall1l@unc.edu,+7 834 713 3518,dui vel sem sed sagittis nam
23885,Eadel,rpunter1m@merriam-webster.com,+62 927 849 9523,eros vestibulum ac est lacinia nisi venenatis tristique fusce congue diam id ornare imperdiet sapien urna pretium nisl ut volutpat sapien arcu sed augue aliquam erat volutpat in congue etiam justo etiam pretium iaculis justo in hac habitasse platea dictumst etiam faucibus cursus urna ut tellus nulla ut erat
23793,Bluezoom,eskelton1n@biglobe.ne.jp,+62 449 102 4650,placerat praesent blandit nam nulla integer pede justo lacinia eget tincidunt eget tempus vel pede morbi porttitor lorem id ligula suspendisse ornare consequat lectus in est risus auctor sed tristique in tempus sit amet sem
23924,Feedspan,jbugdall1o@is.gd,+62 683 775 6442,vestibulum proin eu mi nulla ac enim in tempor turpis nec euismod scelerisque quam turpis adipiscing lorem vitae mattis nibh ligula nec sem duis aliquam convallis nunc proin at turpis a pede posuere nonummy integer non velit donec diam neque vestibulum eget vulputate
23634,Camido,aprover1p@blogger.com,+46 114 499 5336,nisi at nibh in hac habitasse platea dictumst aliquam augue quam sollicitudin vitae consectetuer eget rutrum at lorem integer tincidunt ante vel ipsum praesent blandit lacinia erat
23260,Skiptube,rcawdron1q@businessweek.com,+53 742 776 1243,orci luctus et ultrices posuere cubilia curae mauris viverra diam vitae quam suspendisse potenti nullam porttitor lacus at turpis donec posuere metus vitae ipsum aliquam non mauris morbi
23527,Buzzshare,vwhibley1r@studiopress.com,+971 919 409 3399,congue vivamus metus arcu adipiscing molestie hendrerit at vulputate vitae nisl aenean lectus pellentesque eget nunc donec quis orci eget orci vehicula condimentum curabitur in libero ut massa volutpat convallis morbi odio odio elementum eu interdum eu tincidunt in leo
23874,Zoomzone,cphilcott1s@eventbrite.com,+62 562 643 4747,amet sapien dignissim vestibulum vestibulum ante ipsum primis in faucibus orci luctus et ultrices posuere cubilia curae nulla dapibus dolor vel est donec odio justo sollicitudin ut suscipit a feugiat et eros
23860,Rhyzio,bjeske1t@woothemes.com,+598 142 435 5908,nascetur ridiculus mus etiam vel augue vestibulum rutrum rutrum neque aenean auctor gravida sem praesent id massa id nisl venenatis lacinia aenean sit amet justo morbi ut odio cras mi pede malesuada in imperdiet
23484,Oba,ehandlin1u@bbb.org,+994 647 671 6002,curae nulla dapibus dolor vel est donec odio justo sollicitudin ut suscipit a feugiat et eros vestibulum ac est lacinia nisi venenatis tristique fusce congue diam id ornare imperdiet sapien urna pretium nisl ut volutpat
23547,Topicshots,sriche1v@wired.com,+351 215 898 7037,neque vestibulum eget vulputate ut
23863,Skimia,mfilippozzi1w@cnn.com,+92 527 667 0196,justo pellentesque viverra pede ac diam cras pellentesque volutpat dui maecenas tristique est et tempus semper est quam pharetra magna ac consequat metus sapien ut nunc vestibulum ante ipsum primis in faucibus
23099,Avamba,tgovan1x@discuz.net,+98 290 960 6567,quisque ut erat curabitur gravida nisi at nibh in
23106,Tazzy,lrobbel1y@wikimedia.org,+977 200 343 9267,felis sed lacus morbi sem mauris laoreet ut rhoncus aliquet pulvinar sed nisl nunc rhoncus dui vel sem sed sagittis nam congue risus semper porta volutpat quam pede lobortis ligula sit amet eleifend pede
23865,Centimia,kgronno1z@about.com,+351 113 368 3383,in faucibus orci luctus et ultrices posuere cubilia curae donec pharetra magna vestibulum aliquet ultrices erat tortor sollicitudin mi sit amet lobortis sapien sapien non mi integer ac neque duis bibendum morbi non quam nec dui luctus rutrum nulla tellus in sagittis dui vel
23076,Yodel,bmcvity20@answers.com,+503 800 631 0547,lacus curabitur at ipsum ac tellus semper interdum
23678,Vidoo,wmccrossan21@pagesperso-orange.fr,+86 339 811 3723,massa id lobortis convallis tortor risus dapibus augue vel accumsan tellus nisi eu orci mauris lacinia sapien quis libero nullam sit amet turpis elementum ligula vehicula consequat morbi
23442,Dabtype,treddel22@cafepress.com,+60 382 761 9297,ornare imperdiet sapien urna pretium nisl ut volutpat sapien arcu sed augue aliquam erat volutpat in congue etiam justo
23975,Zoomlounge,gmoran23@moonfruit.com,+33 629 271 0071,nulla justo aliquam quis turpis eget elit sodales scelerisque mauris sit amet eros suspendisse accumsan tortor quis
23318,Teklist,nwardingley24@smugmug.com,+63 356 915 1164,amet nunc viverra dapibus nulla suscipit ligula in
23369,Twimm,rconlaund25@gravatar.com,+98 737 724 1211,turpis adipiscing lorem vitae mattis nibh ligula nec
23041,Skyble,pcellier26@dell.com,+55 120 746 9173,suscipit a feugiat et eros vestibulum ac est lacinia nisi venenatis tristique fusce congue diam
23252,Gabtype,hjandac27@canalblog.com,+30 558 334 9227,pharetra magna ac consequat metus sapien ut nunc vestibulum ante ipsum primis in faucibus orci luctus et ultrices posuere cubilia curae mauris viverra diam vitae quam suspendisse potenti nullam porttitor lacus at
23495,Brainlounge,dkornel28@ted.com,+63 146 318 2058,lectus pellentesque eget nunc donec quis orci eget orci vehicula condimentum curabitur in libero ut massa volutpat convallis morbi odio odio elementum eu interdum eu tincidunt in leo maecenas pulvinar lobortis
23511,Snaptags,kprigmore29@scribd.com,+1 632 703 4340,et magnis dis parturient montes nascetur ridiculus mus etiam vel augue vestibulum rutrum rutrum neque aenean auctor gravida sem
23150,Blogpad,tblaes2a@earthlink.net,+62 717 171 6607,aliquam lacus morbi quis tortor id nulla ultrices aliquet maecenas leo odio condimentum id luctus nec molestie
23404,Zoonder,jgammidge2b@etsy.com,+92 326 478 5471,nulla dapibus dolor vel est donec odio justo sollicitudin ut suscipit a feugiat et eros vestibulum ac est lacinia nisi venenatis tristique fusce congue diam id ornare imperdiet sapien urna pretium nisl ut volutpat sapien arcu sed augue aliquam erat volutpat in congue etiam justo etiam pretium iaculis justo
23277,Jetpulse,rkimble2c@wordpress.com,+7 173 760 0183,faucibus orci luctus et ultrices posuere cubilia curae nulla dapibus dolor vel est donec odio justo sollicitudin ut suscipit a
23275,Tekfly,rdubs2d@chron.com,+380 360 247 9087,volutpat erat quisque erat eros viverra eget congue eget semper rutrum nulla
23631,Yodoo,ipickup2e@ucsd.edu,+33 156 435 1574,vitae mattis nibh ligula nec sem duis aliquam convallis nunc proin at turpis a pede posuere nonummy integer non velit donec diam neque vestibulum eget
23983,Riffpath,nolennachain2f@npr.org,+30 277 352 3967,sit amet turpis elementum ligula vehicula consequat morbi a ipsum integer a nibh in quis justo maecenas rhoncus aliquam lacus
23639,Eazzy,fandrysiak2g@chron.com,+62 677 254 5199,amet consectetuer adipiscing elit proin interdum mauris non ligula pellentesque ultrices phasellus id sapien in sapien iaculis congue vivamus metus arcu adipiscing molestie
23059,Jetpulse,gchamp2h@miibeian.gov.cn,+591 624 324 5322,luctus tincidunt nulla mollis molestie lorem quisque ut erat curabitur gravida
23238,Realpoint,bloynton2i@hc360.com,+86 400 835 7116,lobortis est phasellus sit amet erat nulla tempus vivamus
23445,Skinder,xheindrich2j@alexa.com,+54 760 442 3153,est risus auctor sed tristique in tempus sit amet sem fusce consequat nulla nisl nunc nisl
23416,Trilia,chooks2k@sina.com.cn,+86 595 312 1057,faucibus orci luctus et ultrices posuere cubilia curae mauris viverra diam vitae quam
23704,Demimbu,bskim2l@jimdo.com,+62 955 422 2234,libero nam dui proin leo odio porttitor id consequat in
23847,Agivu,mdundendale2m@odnoklassniki.ru,+63 658 470 1194,euismod scelerisque quam turpis adipiscing lorem vitae mattis nibh ligula nec sem duis aliquam convallis nunc proin at turpis a pede posuere
23852,Pixope,ggrishinov2n@house.gov,+51 896 202 4502,amet justo morbi ut odio cras mi pede malesuada in imperdiet et commodo vulputate justo
23829,Edgeclub,ccowerd2o@topsy.com,+251 532 998 3655,quis justo maecenas rhoncus aliquam lacus morbi quis tortor id nulla ultrices aliquet maecenas leo odio condimentum id luctus nec molestie sed justo pellentesque viverra pede ac diam cras pellentesque volutpat dui maecenas tristique est et tempus semper est quam pharetra magna ac consequat metus sapien ut nunc
23040,Oyope,wwilloway2p@comsenz.com,+7 587 926 8201,velit id pretium iaculis diam erat fermentum justo nec condimentum neque sapien placerat
23400,Thoughtmix,nfenelow2q@skyrock.com,+33 444 608 2035,luctus tincidunt nulla mollis molestie lorem quisque ut erat curabitur gravida nisi at nibh in hac habitasse platea dictumst aliquam augue quam sollicitudin vitae consectetuer eget rutrum at lorem integer tincidunt ante vel ipsum praesent blandit lacinia erat vestibulum sed magna at nunc commodo placerat praesent blandit nam nulla
23635,Bubbletube,awegman2r@blogspot.com,+86 810 755 9252,risus praesent lectus vestibulum quam sapien varius ut blandit non interdum in ante vestibulum ante ipsum primis in faucibus orci
23637,Youtags,ldennis2s@123-reg.co.uk,+226 218 936 8424,turpis adipiscing lorem vitae mattis nibh ligula nec sem duis aliquam convallis nunc proin at turpis a pede posuere nonummy integer non velit donec diam
23511,Skipfire,cvonnassau2t@bbb.org,+33 258 122 3172,vitae consectetuer eget rutrum at lorem integer tincidunt ante vel ipsum praesent blandit lacinia
23160,Teklist,csimmen2u@cnbc.com,+1 214 292 8368,id turpis integer aliquet massa id lobortis convallis tortor risus dapibus augue vel accumsan tellus nisi eu orci mauris lacinia sapien quis libero nullam sit amet turpis elementum ligula vehicula consequat morbi a ipsum integer a nibh in quis justo maecenas rhoncus aliquam lacus morbi quis tortor id
23020,Teklist,ltothacot2v@noaa.gov,+33 424 742 8323,ac neque duis bibendum morbi non quam nec dui luctus rutrum nulla tellus in sagittis dui vel
23466,Tagpad,mbyway2w@over-blog.com,+254 361 119 4316,interdum eu tincidunt in leo maecenas pulvinar lobortis est phasellus sit amet erat nulla tempus vivamus in
23981,Wikido,pgreschke2x@mayoclinic.com,+62 758 508 0182,vivamus tortor duis mattis egestas metus aenean fermentum donec ut mauris eget massa tempor convallis nulla neque libero convallis eget eleifend luctus ultricies eu
23161,Gabtype,mdoneld2y@java.com,+48 912 893 7049,justo nec condimentum neque sapien placerat ante nulla justo aliquam quis turpis eget elit sodales scelerisque mauris sit amet eros suspendisse accumsan tortor quis turpis sed ante vivamus tortor duis mattis egestas metus aenean fermentum donec ut mauris eget massa tempor convallis nulla neque libero convallis eget eleifend luctus
23757,Lajo,wsedgemond2z@psu.edu,+351 824 289 1290,sem praesent id massa id nisl venenatis lacinia aenean sit amet justo morbi ut odio cras mi pede malesuada in imperdiet et commodo vulputate justo in blandit ultrices enim lorem ipsum dolor sit amet consectetuer adipiscing elit proin interdum mauris non ligula pellentesque ultrices phasellus
23049,Realbridge,lbussy30@sbwire.com,+691 862 650 1561,odio odio elementum eu interdum eu tincidunt in leo maecenas pulvinar lobortis est phasellus sit amet erat nulla tempus vivamus in felis eu sapien cursus vestibulum proin eu mi nulla
23572,Kwimbee,lwhickman31@eventbrite.com,+51 306 440 2235,eu mi nulla ac enim in tempor turpis nec euismod scelerisque quam turpis adipiscing lorem vitae mattis nibh ligula nec sem duis aliquam convallis nunc proin at turpis a pede posuere nonummy integer non velit donec diam neque vestibulum eget vulputate
23869,Jaxnation,abould32@cafepress.com,+55 254 865 5039,quam suspendisse potenti nullam porttitor lacus at turpis donec posuere metus vitae ipsum aliquam non mauris morbi non lectus aliquam sit amet diam in magna bibendum imperdiet nullam orci pede venenatis non sodales sed tincidunt eu felis fusce posuere felis sed lacus morbi
23856,Meetz,gbendson33@mayoclinic.com,+81 918 540 5653,mi nulla ac enim in tempor turpis nec euismod scelerisque quam turpis adipiscing lorem vitae mattis nibh ligula nec sem duis aliquam convallis nunc proin at turpis a
23260,JumpXS,mfearenside34@baidu.com,+81 280 291 1436,viverra dapibus nulla suscipit ligula in lacus
