SupplierID,SupplierName,SupplierEmail,SupplierPhone,SupplierDescription
17677,Gabtune,amichaelis@booking.com,+1 713 303 4413,vulputate justo in blandit ultrices enim lorem ipsum dolor sit amet consectetuer adipiscing
17678,Meezzy,ldundridgeit@eepurl.com,+7 453 526 4246,sem sed sagittis nam congue risus semper porta volutpat quam pede lobortis ligula sit amet eleifend pede libero quis orci nullam molestie nibh
17679,Quatz,ichamiu@sphinn.com,+84 741 474 9041,nulla nunc purus phasellus in felis donec semper sapien a libero nam dui proin leo odio porttitor
17680,Vipe,mcoopeyiv@reddit.com,+86 705 894 2326,erat quisque erat eros viverra eget congue eget semper
17681,Lazz,sbuglariw@sitemeter.com,+53 596 724 5504,vulputate ut ultrices vel augue
17682,Flashpoint,lmcilwraithix@miibeian.gov.cn,+86 705 923 9412,ante nulla justo aliquam quis turpis eget elit sodales scelerisque mauris sit amet
17683,Zooveo,dfaulliy@stumbleupon.com,+55 783 387 6594,diam cras pellentesque volutpat dui maecenas tristique est et tempus
17684,Yombu,fcoateiz@diigo.com,+62 483 514 5046,curae nulla dapibus dolor vel est donec odio justo sollicitudin ut suscipit a feugiat et eros vestibulum ac est lacinia nisi venenatis tristique fusce congue
17685,Meevee,rasipenkoj0@livejournal.com,+265 952 540 1420,ipsum integer a nibh in quis justo maecenas rhoncus aliquam lacus morbi quis tortor id nulla ultrices aliquet maecenas leo odio
17686,Realmix,tmusellij1@bandcamp.com,+7 128 276 5089,tincidunt nulla mollis molestie lorem quisque ut erat curabitur gravida nisi
17687,Flipstorm,clameyj2@howstuffworks.com,+351 407 302 5934,cum sociis natoque penatibus et magnis dis parturient montes nascetur
17688,Livetube,aconneelyj3@geocities.jp,+66 998 364 0181,habitasse platea dictumst maecenas ut massa quis
17689,Flashpoint,jcoatesj4@flickr.com,+55 416 336 4429,eget eleifend luctus ultricies eu nibh quisque
17690,Wordtune,gfateleyj5@usda.gov,+55 372 889 3557,rutrum nulla nunc purus phasellus in
17691,Wikibox,dmassardj6@cnn.com,+66 848 525 5567,hendrerit at vulputate vitae nisl aenean lectus pellentesque eget nunc donec quis orci eget orci vehicula condimentum curabitur in libero
17692,Flipbug,vgilffillanj7@blinklist.com,+62 351 325 1330,ut erat id mauris vulputate elementum nullam varius nulla facilisi cras non velit nec
17693,Shuffletag,apudgej8@bravesites.com,+229 869 459 8658,vestibulum ante ipsum primis in faucibus orci luctus et ultrices posuere cubilia curae duis faucibus accumsan
17694,Skilith,dcarthyj9@microsoft.com,+212 467 160 0046,tempus vel pede morbi porttitor lorem id ligula suspendisse ornare consequat lectus in est risus auctor sed tristique in tempus
17695,Shuffletag,jklampja@usnews.com,+86 219 244 4445,donec vitae nisi nam ultrices libero non mattis pulvinar nulla pede ullamcorper augue a suscipit nulla elit ac nulla sed vel
17696,Realcube,aadamczykjb@smugmug.com,+33 917 486 5281,donec odio justo sollicitudin ut suscipit a feugiat et eros vestibulum ac est lacinia
17697,Twitterworks,jgilbeyjc@blinklist.com,+420 376 481 6550,dolor morbi vel lectus in quam fringilla rhoncus mauris enim
17698,Browsetype,cclooneyjd@toplist.cz,+62 588 563 2466,integer ac neque duis bibendum morbi
17699,Meembee,aseniorje@cbslocal.com,+93 272 971 6799,diam in magna bibendum imperdiet
17700,Fliptune,mwapplingtonjf@homestead.com,+385 277 491 4411,justo nec condimentum neque sapien placerat ante nulla justo aliquam quis turpis eget elit sodales scelerisque mauris sit amet eros suspendisse
17701,Muxo,dwoodburnjg@mac.com,+62 307 979 0384,cum sociis natoque penatibus et magnis dis
17702,Brainsphere,bsparyjh@1688.com,+225 636 212 3774,vulputate elementum nullam varius nulla facilisi
17703,Innojam,egudginji@liveinternet.ru,+55 259 590 8171,eu felis fusce posuere felis sed lacus morbi sem mauris laoreet ut rhoncus aliquet pulvinar sed nisl nunc rhoncus dui vel sem sed sagittis
17704,Youspan,dquigleyjj@fc2.com,+63 579 652 1022,et ultrices posuere cubilia curae mauris viverra diam vitae quam suspendisse potenti nullam porttitor lacus at turpis donec posuere metus vitae ipsum aliquam non
17705,Quamba,adanterjk@answers.com,+381 149 722 4136,imperdiet sapien urna pretium nisl ut volutpat sapien arcu
17706,Topiclounge,bduckitjl@ox.ac.uk,+46 352 773 5292,dignissim vestibulum vestibulum ante ipsum primis in faucibus orci luctus et ultrices posuere
17707,Youbridge,ngerardijm@issuu.com,+351 618 571 2442,adipiscing elit proin risus praesent lectus vestibulum quam sapien varius ut blandit non interdum in ante vestibulum ante ipsum
17708,Tagtune,nlyonjn@samsung.com,+52 879 736 6838,magna bibendum imperdiet nullam orci pede venenatis non sodales sed tincidunt eu felis fusce posuere felis sed lacus morbi sem mauris laoreet
17709,Browsetype,edurwardjo@forbes.com,+51 473 733 8365,cum sociis natoque penatibus et magnis dis parturient montes nascetur ridiculus mus etiam vel
17710,Roomm,ckayzerjp@vimeo.com,+251 710 566 7484,metus vitae ipsum aliquam non mauris morbi non
17711,Skiba,bmonaghanjq@ow.ly,+62 897 860 8492,sit amet lobortis sapien sapien non mi integer ac neque duis bibendum
17712,Kayveo,sbrodneckejr@digg.com,+63 149 133 2530,amet justo morbi ut odio cras mi pede malesuada in imperdiet et commodo vulputate justo in blandit ultrices enim lorem ipsum dolor sit amet consectetuer
17713,Zoonoodle,rpelmanjs@hexun.com,+86 414 233 7019,congue diam id ornare imperdiet sapien urna pretium nisl ut volutpat sapien arcu sed augue aliquam erat volutpat
17714,Nlounge,mserchwelljt@usda.gov,+216 113 306 0382,ut odio cras mi pede malesuada in imperdiet et commodo vulputate justo in blandit ultrices enim lorem ipsum dolor sit amet consectetuer adipiscing elit
17715,Feedbug,gvicentju@alexa.com,+81 796 393 0145,magna at nunc commodo placerat praesent blandit nam nulla integer pede
17716,Livefish,dmarinjv@miibeian.gov.cn,+970 401 264 3965,nulla eget eros elementum pellentesque quisque porta volutpat erat quisque erat eros viverra eget congue eget
17717,Oyoyo,bwetherilljw@angelfire.com,+351 394 882 2580,tristique est et tempus semper
17718,Agimba,frockhilljx@hc360.com,+86 657 329 0327,at vulputate vitae nisl aenean lectus pellentesque eget nunc donec quis
17719,Aibox,theyneljy@scribd.com,+48 627 231 2047,auctor sed tristique in tempus sit amet sem fusce consequat nulla nisl nunc nisl duis
17720,Oloo,mcrowtherjz@newsvine.com,+33 881 957 2998,imperdiet sapien urna pretium nisl ut volutpat sapien
17721,Meezzy,hstermank0@hibu.com,+86 457 980 2985,gravida sem praesent id massa id nisl
17722,Kwinu,jmeadsk1@surveymonkey.com,+504 601 871 2408,morbi ut odio cras mi pede malesuada in imperdiet et commodo vulputate justo in blandit ultrices
17723,Bluezoom,skenank2@mit.edu,+86 859 605 1797,in lacus curabitur at ipsum ac tellus semper interdum mauris ullamcorper purus sit amet nulla quisque arcu libero rutrum ac lobortis vel dapibus at diam
17724,Snaptags,mpentonyk3@goodreads.com,+33 248 248 2020,pharetra magna vestibulum aliquet ultrices erat tortor sollicitudin mi sit amet lobortis
17725,Demivee,koreagank4@newsvine.com,+222 446 781 9331,enim lorem ipsum dolor sit amet consectetuer adipiscing elit proin interdum mauris non ligula pellentesque ultrices
17726,Devcast,sfarquark5@washington.edu,+62 614 434 4934,quam suspendisse potenti nullam porttitor lacus at turpis donec posuere metus vitae ipsum aliquam
17727,Avamm,kvaslerk6@ibm.com,+86 992 377 5839,ultrices aliquet maecenas leo odio condimentum id luctus nec molestie sed justo
17728,Shufflester,sbellochtk7@amazon.co.jp,+359 913 199 6719,vel sem sed sagittis nam congue risus semper porta volutpat quam pede lobortis ligula sit amet eleifend pede libero quis orci nullam molestie nibh in
17729,Edgeclub,lupexk8@php.net,+86 588 241 5537,duis faucibus accumsan odio curabitur convallis duis consequat dui nec nisi volutpat eleifend donec ut dolor morbi vel lectus in quam fringilla rhoncus mauris
17730,Chatterbridge,carrank9@flickr.com,+51 749 844 0869,in eleifend quam a odio in hac habitasse
17731,Quamba,jdulintyka@whitehouse.gov,+86 578 886 6624,egestas metus aenean fermentum donec ut mauris eget massa tempor convallis nulla neque libero convallis eget eleifend luctus ultricies eu
17732,Skidoo,jlayekb@amazon.co.jp,+7 875 434 1254,in felis eu sapien cursus vestibulum proin eu mi nulla ac enim in tempor turpis nec euismod scelerisque quam turpis
17733,Blogtag,imugekc@mapquest.com,+52 994 576 8617,sapien in sapien iaculis congue vivamus metus arcu adipiscing molestie hendrerit at vulputate vitae nisl aenean lectus pellentesque eget nunc donec quis orci eget
17734,Bubblemix,ngrazierkd@fema.gov,+48 459 374 7509,tellus nisi eu orci mauris lacinia sapien
17735,Skivee,pwestmacottke@nyu.edu,+86 857 574 3685,ut mauris eget massa tempor convallis nulla neque libero convallis eget
17736,Zoozzy,sbeeswingkf@buzzfeed.com,+51 772 703 5824,in quam fringilla rhoncus mauris enim leo rhoncus sed vestibulum sit amet cursus id turpis integer aliquet
17737,Wikizz,sskirvingkg@ucla.edu,+242 130 145 0422,elementum ligula vehicula consequat morbi a ipsum integer a nibh in quis justo maecenas rhoncus aliquam lacus morbi quis tortor
17738,Twitterbeat,rmccreedykh@va.gov,+33 257 376 5171,tellus nulla ut erat id
17739,Voonder,jthaineki@answers.com,+63 467 841 5258,sem mauris laoreet ut rhoncus aliquet pulvinar sed nisl nunc
17740,Jamia,adiaperkj@usgs.gov,+7 912 443 6808,donec vitae nisi nam ultrices libero non mattis pulvinar nulla pede ullamcorper augue a suscipit nulla elit ac nulla sed vel enim sit
17741,Yacero,apethrickkk@umn.edu,+55 622 765 2792,turpis sed ante vivamus tortor duis mattis egestas metus aenean fermentum donec ut mauris eget massa tempor convallis nulla neque libero
17742,Zooxo,sgilardonikl@over-blog.com,+351 285 512 8341,ligula suspendisse ornare consequat lectus in est risus auctor sed tristique in tempus sit amet sem fusce consequat nulla nisl nunc nisl duis bibendum
17743,Agimba,fdowningkm@wordpress.org,+51 672 412 7299,hac habitasse platea dictumst morbi vestibulum velit id pretium iaculis diam erat fermentum
17744,Teklist,chemberykn@state.gov,+297 590 430 7647,egestas metus aenean fermentum donec ut mauris
17745,Flashpoint,ffolliottko@godaddy.com,+375 882 472 5514,id turpis integer aliquet massa id lobortis convallis tortor risus dapibus augue vel accumsan tellus nisi eu
17746,Twitterworks,lpeatkp@seesaa.net,+62 177 123 9619,tortor sollicitudin mi sit amet lobortis sapien sapien non mi integer ac neque duis bibendum morbi non quam nec dui
17747,Edgeify,cbeetlestonekq@ning.com,+86 610 268 6650,tincidunt lacus at velit vivamus vel nulla eget eros elementum pellentesque quisque porta volutpat erat quisque erat
17748,Yodoo,fharesnapekr@nhs.uk,+62 693 597 1604,duis bibendum morbi non quam nec dui luctus rutrum nulla tellus in sagittis dui vel nisl duis
17749,Zava,tglancyks@dot.gov,+86 764 532 8311,fermentum donec ut mauris eget massa tempor convallis nulla neque libero convallis eget eleifend luctus ultricies eu nibh quisque id justo sit amet sapien dignissim
17750,Devshare,sboissieuxkt@facebook.com,+359 481 318 5586,viverra pede ac diam cras pellentesque volutpat dui maecenas tristique est
17751,Camimbo,mtytcombku@studiopress.com,+86 331 854 8926,nam ultrices libero non mattis pulvinar
17752,Jamia,eastridgekv@dmoz.org,+63 901 706 7129,odio odio elementum eu interdum eu tincidunt in leo maecenas
17753,Bubblebox,rolensbykw@bloglines.com,+48 872 781 9476,morbi vestibulum velit id pretium iaculis diam erat fermentum justo
17754,Zoonoodle,jgossartkx@cnbc.com,+84 999 650 0845,eu nibh quisque id justo sit amet sapien dignissim vestibulum vestibulum ante ipsum
17755,Tavu,klawsonky@live.com,+33 264 694 1035,quam nec dui luctus rutrum nulla tellus in sagittis
17756,Skajo,ccanizareskz@surveymonkey.com,+380 765 938 2267,leo pellentesque ultrices mattis odio donec vitae
17757,Brightbean,mwelbournl0@livejournal.com,+86 457 622 6533,at turpis a pede posuere nonummy integer non velit donec diam neque vestibulum eget vulputate ut
17758,Jaxnation,peadesl1@wix.com,+964 153 369 6592,consectetuer eget rutrum at lorem integer tincidunt ante vel ipsum praesent blandit lacinia erat vestibulum sed magna at nunc commodo placerat
17759,Photobug,hvamplusl2@yahoo.co.jp,+30 937 528 1365,eros suspendisse accumsan tortor quis turpis sed ante vivamus tortor duis mattis egestas metus aenean fermentum donec ut mauris eget massa tempor convallis nulla
17760,Divape,hkubeckal3@cmu.edu,+967 237 487 5141,vestibulum sed magna at nunc commodo placerat
17761,Omba,hdunsirel4@opensource.org,+231 266 160 6856,nulla facilisi cras non velit nec nisi vulputate nonummy maecenas tincidunt lacus at velit vivamus vel nulla eget eros elementum pellentesque quisque porta volutpat erat
17762,Meevee,rmalecl5@ebay.co.uk,+86 911 967 7138,in porttitor pede justo eu massa donec dapibus duis at velit eu est
17763,Skynoodle,npendleberyl6@jiathis.com,+998 655 649 0302,blandit lacinia erat vestibulum sed magna at nunc commodo
17764,Thoughtbridge,bgeraldl7@oaic.gov.au,+86 942 266 6417,non pretium quis lectus suspendisse potenti in eleifend quam a odio in hac habitasse platea dictumst maecenas ut massa quis augue luctus tincidunt
17765,Quimm,lfassanl8@globo.com,+62 752 629 5280,mauris vulputate elementum nullam varius nulla facilisi cras non velit nec nisi vulputate
17766,Photobug,dbleacherl9@chron.com,+886 658 366 5023,urna pretium nisl ut volutpat sapien arcu sed augue aliquam erat volutpat in congue etiam justo etiam pretium iaculis justo in hac
17767,Skiba,alilesla@berkeley.edu,+63 730 439 2026,placerat ante nulla justo aliquam quis turpis eget elit sodales scelerisque mauris sit amet eros suspendisse accumsan tortor
17768,Meezzy,ctitherlb@skype.com,+86 994 170 7662,lacus purus aliquet at feugiat non pretium quis
17769,Roodel,gnappinlc@deliciousdays.com,+1 890 900 1392,erat quisque erat eros viverra eget congue eget semper rutrum nulla
17770,Jetpulse,vrobleyld@ebay.com,+963 288 101 1696,nibh in hac habitasse platea dictumst aliquam augue quam sollicitudin vitae consectetuer eget rutrum
17771,Pixonyx,mbrosettile@psu.edu,+86 571 542 0856,molestie lorem quisque ut erat curabitur gravida nisi at nibh in
17772,Riffwire,jdrohanelf@nytimes.com,+357 321 743 0087,bibendum felis sed interdum venenatis turpis enim blandit mi in
17773,Vitz,cfyfelg@pagesperso-orange.fr,+66 610 638 5196,mauris lacinia sapien quis libero nullam sit
17774,Voomm,sseymourlh@tumblr.com,+7 513 705 2104,quam turpis adipiscing lorem vitae
17775,Twitterlist,nbartotli@nyu.edu,+62 799 869 9117,ultrices erat tortor sollicitudin mi sit amet lobortis sapien sapien non mi integer ac neque duis bibendum morbi non quam nec dui luctus
17776,Skipfire,mpeatheyjohnslj@paypal.com,+7 705 230 6108,tempus semper est quam pharetra magna ac consequat metus sapien ut nunc vestibulum ante ipsum primis in faucibus orci luctus et ultrices posuere
17777,Kimia,fsalzburgerlk@tuttocitta.it,+420 661 973 8751,vestibulum proin eu mi nulla ac enim in tempor turpis nec euismod scelerisque quam turpis adipiscing lorem vitae mattis nibh ligula nec sem duis
17778,Oyoba,rbeauchampll@google.com.br,+86 604 233 4061,adipiscing lorem vitae mattis nibh ligula nec sem duis aliquam convallis nunc proin at turpis a pede posuere nonummy integer
17779,Mydeo,sweeklylm@answers.com,+53 244 320 8876,sed accumsan felis ut at dolor quis odio consequat varius integer ac leo pellentesque ultrices mattis odio donec vitae nisi nam ultrices libero non
17780,Youbridge,abrucknerln@booking.com,+216 891 559 4892,erat nulla tempus vivamus in felis eu sapien cursus
17781,Voonte,cduckittlo@xrea.com,+66 789 468 7671,accumsan tortor quis turpis sed ante
17782,Jabbertype,rberceroslp@mtv.com,+351 572 743 2984,orci luctus et ultrices posuere cubilia curae nulla dapibus dolor vel est
17783,Zoonder,sneevelq@youtube.com,+46 453 369 5727,lacinia nisi venenatis tristique fusce congue diam id ornare imperdiet sapien urna
17784,Topiclounge,cdoftylr@unc.edu,+86 154 819 0326,sapien ut nunc vestibulum ante ipsum primis in faucibus orci luctus et ultrices posuere cubilia curae mauris viverra diam vitae quam suspendisse potenti nullam porttitor
17785,Kwideo,wjacobowitzls@tumblr.com,+353 751 883 2550,tincidunt ante vel ipsum praesent blandit lacinia erat vestibulum
17786,Mynte,sfollinglt@nyu.edu,+62 136 839 5510,nullam molestie nibh in lectus pellentesque at nulla
17787,Brainbox,breijmerslu@360.cn,+48 229 739 9391,amet diam in magna bibendum imperdiet nullam orci pede venenatis non
17788,Quinu,kvasilmanovlv@oracle.com,+966 140 959 2606,pellentesque at nulla suspendisse potenti cras in purus eu magna vulputate luctus cum sociis natoque penatibus et magnis dis parturient montes
17789,Browsezoom,oofarrislw@umich.edu,+505 655 308 5309,sapien dignissim vestibulum vestibulum ante ipsum primis in faucibus orci luctus et ultrices posuere cubilia curae nulla dapibus dolor vel
17790,Twitterbridge,habramamovlx@geocities.jp,+7 518 269 7944,eget vulputate ut ultrices vel augue vestibulum ante ipsum primis in faucibus orci luctus et ultrices posuere cubilia curae donec pharetra magna vestibulum
17791,Photospace,ewilsherely@ycombinator.com,+977 863 239 9081,in tempor turpis nec euismod scelerisque quam turpis adipiscing lorem vitae
17792,Gabspot,awitullz@fema.gov,+62 203 858 3810,dolor quis odio consequat varius integer ac leo pellentesque ultrices mattis odio donec vitae nisi nam ultrices libero
17793,Wikizz,lshipleym0@soundcloud.com,+356 951 733 2460,pede justo eu massa donec dapibus duis at velit eu est congue
17794,Plambee,jaffusom1@discovery.com,+33 263 517 8645,libero non mattis pulvinar nulla pede
17795,Brainverse,bmonrom2@sciencedirect.com,+351 303 797 0282,vel pede morbi porttitor lorem id ligula suspendisse ornare consequat lectus in est
17796,Voonyx,enewbandm3@edublogs.org,+86 303 966 4820,et ultrices posuere cubilia curae donec pharetra magna vestibulum aliquet
17797,Voolith,bbowldm4@redcross.org,+7 397 178 1507,at velit eu est congue elementum in hac habitasse platea dictumst morbi vestibulum velit id pretium iaculis diam erat fermentum justo nec condimentum neque
17798,Janyx,aetchellsm5@rediff.com,+48 848 639 3828,sagittis sapien cum sociis natoque penatibus et magnis dis parturient montes nascetur ridiculus mus etiam vel augue vestibulum rutrum rutrum neque aenean
17799,Jaxspan,thirschmannm6@slashdot.org,+58 953 866 0927,faucibus cursus urna ut tellus nulla ut
17800,Dazzlesphere,kluckmanm7@cpanel.net,+55 974 331 5182,turpis a pede posuere nonummy integer non velit
17801,Brightbean,jstibbsm8@deliciousdays.com,+63 325 668 7119,quam fringilla rhoncus mauris enim leo rhoncus sed vestibulum sit amet cursus id turpis integer aliquet massa id
17802,Skippad,kruusam9@admin.ch,+57 120 153 3031,metus sapien ut nunc vestibulum ante ipsum primis in
17803,Meezzy,gburberryma@un.org,+7 964 587 9999,quam sollicitudin vitae consectetuer eget rutrum at lorem integer tincidunt ante vel ipsum praesent blandit lacinia erat vestibulum sed magna at nunc commodo placerat praesent
17804,Zoombeat,fwallsmb@lycos.com,+355 322 714 5772,vel sem sed sagittis nam congue risus semper porta volutpat quam pede lobortis ligula sit amet eleifend pede libero quis orci nullam molestie
17805,Yodel,bwinhammc@webeden.co.uk,+7 177 251 1724,quisque ut erat curabitur gravida
17806,Twitterworks,gdyhousemd@cisco.com,+381 403 924 6245,libero quis orci nullam molestie nibh in lectus pellentesque at nulla suspendisse potenti cras in purus eu magna vulputate luctus cum sociis natoque penatibus
17807,Zazio,ghoppnerme@npr.org,+86 966 900 6495,pede ullamcorper augue a suscipit nulla elit ac nulla sed vel enim sit amet nunc viverra dapibus nulla suscipit
17808,Gigaclub,hhearfieldmf@oakley.com,+86 206 210 9866,vestibulum aliquet ultrices erat tortor sollicitudin mi sit amet lobortis sapien sapien non mi integer ac neque duis bibendum morbi non quam
17809,Photobean,gpetzmg@moonfruit.com,+86 313 815 7200,vehicula consequat morbi a ipsum integer a nibh in quis justo maecenas rhoncus aliquam lacus
17810,Gabtype,jproppermh@discuz.net,+33 857 861 3890,amet consectetuer adipiscing elit proin interdum mauris non ligula pellentesque ultrices phasellus id sapien in sapien iaculis
17811,Latz,aarentmi@abc.net.au,+351 701 914 3510,pede malesuada in imperdiet et commodo vulputate
17812,Tagpad,golivomj@mapy.cz,+226 111 496 9122,sapien in sapien iaculis congue vivamus metus arcu adipiscing molestie hendrerit at vulputate vitae nisl aenean lectus pellentesque
17813,Mudo,kceneymk@imdb.com,+62 266 111 4163,vivamus metus arcu adipiscing molestie hendrerit at vulputate vitae nisl aenean lectus pellentesque eget nunc donec quis
17814,Skiba,cwimpressml@comcast.net,+63 661 248 2270,luctus rutrum nulla tellus in sagittis dui vel nisl duis ac nibh fusce lacus
17815,Wordtune,jrucklessemm@g.co,+48 310 500 0703,eget congue eget semper rutrum nulla nunc purus phasellus in felis
17816,Talane,hsnazlemn@blogtalkradio.com,+62 336 570 8310,blandit mi in porttitor pede justo eu massa donec dapibus duis at velit eu
17817,Vitz,atellenbrokmo@jalbum.net,+82 644 999 1382,iaculis justo in hac habitasse platea dictumst etiam faucibus cursus urna ut tellus nulla ut erat id mauris vulputate elementum
17818,Katz,bulyetmp@umich.edu,+86 752 579 7621,luctus cum sociis natoque penatibus et magnis dis parturient montes nascetur ridiculus mus vivamus
17819,Fivespan,mwoodiermq@homestead.com,+33 784 507 2622,ut volutpat sapien arcu sed augue aliquam erat volutpat in congue etiam justo etiam
17820,Twitterbridge,gkenwinmr@printfriendly.com,+27 338 819 0495,non ligula pellentesque ultrices phasellus id sapien in sapien iaculis congue vivamus metus arcu adipiscing molestie hendrerit at vulputate vitae nisl
17821,Devpulse,soriginms@ihg.com,+91 785 762 2885,integer tincidunt ante vel ipsum praesent blandit lacinia erat vestibulum sed magna at nunc commodo placerat
17822,Fatz,apenrittmt@youtube.com,+33 575 906 9045,sed vestibulum sit amet cursus id turpis integer aliquet massa id lobortis convallis
17823,Photobug,asturzakermu@unicef.org,+351 932 409 1815,ipsum praesent blandit lacinia erat vestibulum sed magna at nunc commodo placerat praesent blandit nam nulla integer pede justo lacinia eget tincidunt eget
17824,Plajo,dkubanekmv@patch.com,+46 900 754 5992,potenti cras in purus eu magna vulputate luctus cum sociis natoque penatibus
17825,Zoombox,dfronzekmw@dell.com,+55 360 695 8015,eget eleifend luctus ultricies eu nibh quisque id justo sit amet sapien dignissim vestibulum vestibulum ante ipsum primis in faucibus orci luctus
17826,Vipe,omacquiremx@rakuten.co.jp,+86 507 223 5837,aliquam non mauris morbi non lectus aliquam sit amet diam in magna bibendum imperdiet nullam orci pede venenatis non sodales sed tincidunt eu felis
17827,Kazio,espatarulmy@bloglovin.com,+269 362 291 5195,ante ipsum primis in faucibus orci luctus et ultrices posuere cubilia curae nulla dapibus dolor vel est donec odio justo
17828,Kwilith,gandreollimz@dropbox.com,+380 103 361 2945,fusce consequat nulla nisl nunc nisl duis bibendum felis sed interdum venenatis turpis enim blandit mi in porttitor pede justo eu massa donec
17829,Meeveo,oseadonn0@usa.gov,+380 271 324 8743,nulla quisque arcu libero rutrum ac lobortis vel dapibus at diam nam
17830,Browseblab,tglenwrightn1@home.pl,+7 195 359 8617,nibh ligula nec sem duis aliquam convallis nunc proin at turpis a pede posuere nonummy integer
17831,Blogtags,mattewelln2@shareasale.com,+86 472 601 2582,parturient montes nascetur ridiculus mus vivamus vestibulum sagittis sapien cum
17832,Zoovu,mevertn3@scientificamerican.com,+33 411 288 7385,in hac habitasse platea dictumst aliquam augue quam sollicitudin vitae consectetuer eget rutrum at lorem
17833,Aimbo,kmorcomn4@tripadvisor.com,+86 911 221 1779,massa tempor convallis nulla neque libero convallis eget eleifend luctus
17834,Dynava,atolsonn5@1688.com,+970 293 122 7925,non velit donec diam neque vestibulum eget vulputate ut ultrices vel augue vestibulum ante ipsum primis in
17835,Flashspan,credfieldn6@uiuc.edu,+30 602 500 5603,phasellus sit amet erat nulla tempus vivamus in felis eu sapien
17836,Wordtune,anannizzin7@harvard.edu,+963 513 737 1983,lorem quisque ut erat curabitur gravida
17837,Meevee,npawlettn8@nymag.com,+46 392 834 9208,interdum mauris ullamcorper purus sit amet nulla quisque arcu libero rutrum ac lobortis vel dapibus at diam nam tristique tortor eu
17838,Kwinu,jgillingwatern9@purevolume.com,+506 802 895 3657,metus aenean fermentum donec ut mauris eget massa tempor convallis nulla neque libero convallis eget eleifend luctus ultricies eu nibh quisque id
17839,Jabberstorm,dbizleyna@walmart.com,+86 514 126 8384,habitasse platea dictumst morbi vestibulum
17840,Devpulse,nyanukhinnb@simplemachines.org,+62 691 419 0182,vulputate luctus cum sociis natoque penatibus et magnis dis parturient montes nascetur ridiculus mus vivamus vestibulum sagittis sapien cum sociis natoque penatibus
17841,Einti,mricardotnc@vkontakte.ru,+46 264 919 0196,neque libero convallis eget eleifend luctus ultricies eu nibh quisque id justo sit amet sapien dignissim vestibulum vestibulum ante ipsum primis in faucibus orci
17842,Brightdog,dgrundynd@foxnews.com,+353 136 119 2962,sem praesent id massa id nisl
17843,Tagpad,pcopasne@abc.net.au,+7 826 736 1120,sapien dignissim vestibulum vestibulum ante ipsum primis in faucibus orci luctus
17844,Zooveo,irogansnf@yale.edu,+86 770 877 6113,vitae mattis nibh ligula nec sem duis aliquam convallis nunc
17845,Zava,gmullengerng@photobucket.com,+62 594 991 6821,integer ac neque duis bibendum morbi non quam nec dui luctus rutrum nulla tellus in sagittis dui vel nisl duis ac nibh fusce lacus
17846,Youopia,kshearmernh@mapy.cz,+250 411 565 7150,semper interdum mauris ullamcorper purus sit amet nulla quisque arcu libero rutrum ac lobortis vel dapibus at diam nam
17847,Twinte,hbarukhni@phoca.cz,+34 461 231 1886,cubilia curae nulla dapibus dolor vel est donec odio justo sollicitudin ut suscipit a feugiat et eros vestibulum ac est lacinia nisi venenatis tristique fusce
