SupplierID,SupplierName,SupplierEmail,SupplierPhone,SupplierDescription
19341,Skiba,hzanussii9g@google.com.au,+52 577 201 9486,imperdiet nullam orci pede venenatis non sodales sed tincidunt eu felis fusce posuere felis sed lacus morbi sem mauris laoreet ut rhoncus aliquet pulvinar
19342,Babbleset,wbevar9h@tamu.edu,+370 436 297 1608,consectetuer adipiscing elit proin interdum mauris non ligula
19343,Meembee,vsiggs9i@joomla.org,+86 158 797 5415,gravida sem praesent id massa id nisl venenatis lacinia aenean sit amet justo morbi ut odio cras mi pede malesuada in
19344,Jetwire,mrivaland9j@wikipedia.org,+62 750 704 7499,blandit non interdum in ante vestibulum ante ipsum primis in faucibus orci luctus et
19345,Jaxworks,eamerici9k@w3.org,+380 830 174 5650,consectetuer adipiscing elit proin risus praesent lectus vestibulum quam sapien varius ut blandit non interdum in ante vestibulum ante ipsum primis in faucibus
19346,Realblab,bkleinholz9l@sfgate.com,+351 253 863 2401,curabitur at ipsum ac tellus semper interdum mauris ullamcorper purus sit
19347,Trudoo,hbussen9m@dot.gov,+86 962 529 5352,mauris viverra diam vitae quam suspendisse potenti nullam porttitor lacus at turpis
19348,Avaveo,odarbey9n@youku.com,+351 511 914 0986,sapien quis libero nullam sit amet turpis elementum ligula vehicula consequat morbi a ipsum integer a
19349,Yambee,ckirman9o@mapquest.com,+33 412 425 0362,magna at nunc commodo placerat praesent blandit nam nulla integer pede justo lacinia eget tincidunt eget
19350,Miboo,lthiolier9p@i2i.jp,+234 155 170 8976,in hac habitasse platea dictumst morbi vestibulum velit id pretium iaculis diam erat fermentum justo nec condimentum neque sapien placerat ante nulla
19351,Eidel,jdossettor9q@technorati.com,+7 889 335 5248,fusce consequat nulla nisl nunc nisl duis bibendum felis sed interdum venenatis turpis
19352,Oyope,hmckendo9r@fema.gov,+7 832 281 5937,nonummy integer non velit donec diam neque vestibulum eget vulputate ut ultrices vel augue vestibulum ante ipsum primis
19353,Feedmix,nfaragan9s@apple.com,+62 984 897 1414,elementum nullam varius nulla facilisi cras non
19354,Skilith,ehardison9t@toplist.cz,+62 812 326 0626,massa quis augue luctus tincidunt nulla mollis molestie lorem quisque ut erat curabitur gravida nisi at nibh
19355,Lajo,dwidd9u@about.com,+62 557 915 1767,augue aliquam erat volutpat in congue etiam justo etiam pretium iaculis justo in hac habitasse platea dictumst etiam faucibus cursus urna
19356,Jaxbean,fblowfelde9v@jiathis.com,+380 993 871 7341,in faucibus orci luctus et ultrices posuere cubilia curae mauris viverra diam vitae quam suspendisse potenti nullam porttitor
19357,Browsezoom,dstedson9w@sakura.ne.jp,+7 286 109 2707,vulputate elementum nullam varius nulla facilisi cras non velit nec nisi vulputate nonummy maecenas tincidunt lacus at velit vivamus vel nulla eget eros elementum pellentesque
19358,Bubbletube,mmueller9x@shareasale.com,+86 188 893 0515,massa volutpat convallis morbi odio odio elementum eu interdum eu tincidunt in leo maecenas pulvinar lobortis est phasellus sit
19359,Photojam,bkaubisch9y@4shared.com,+62 945 251 0395,laoreet ut rhoncus aliquet pulvinar sed nisl nunc rhoncus dui vel sem
19360,Wordware,jchiese9z@irs.gov,+55 872 711 4820,elementum ligula vehicula consequat morbi a
19361,Vipe,bbolstridgea0@fotki.com,+256 893 659 1916,facilisi cras non velit nec nisi vulputate nonummy maecenas tincidunt lacus at velit vivamus vel nulla eget eros elementum pellentesque quisque porta volutpat erat
19362,Vinte,gboothea1@bloglovin.com,+62 763 908 7123,integer ac neque duis bibendum morbi non quam nec dui luctus rutrum nulla tellus in sagittis dui vel nisl duis ac nibh fusce
19363,Jaxspan,egeorghioua2@creativecommons.org,+53 383 376 1053,orci mauris lacinia sapien quis libero nullam sit amet turpis elementum ligula vehicula consequat morbi a ipsum
19364,Myworks,crisebarera3@bandcamp.com,+591 660 669 3904,tincidunt lacus at velit vivamus vel nulla eget eros elementum pellentesque quisque
19365,Skipfire,ggriswooda4@paginegialle.it,+62 957 930 3606,ultrices enim lorem ipsum dolor sit amet consectetuer adipiscing elit proin interdum
19366,Kwinu,hoverilla5@lulu.com,+86 363 801 1980,ultrices vel augue vestibulum ante ipsum primis in faucibus orci luctus et ultrices posuere cubilia curae donec pharetra magna vestibulum aliquet ultrices erat tortor sollicitudin
19367,Feednation,nstarkingsa6@jigsy.com,+33 515 448 2405,sollicitudin mi sit amet lobortis sapien sapien non mi integer ac neque duis bibendum morbi non quam nec dui
19368,Gabtype,rdorbina7@weather.com,+7 778 772 7138,interdum venenatis turpis enim blandit mi in porttitor pede justo eu massa donec dapibus duis at velit eu est congue elementum in hac habitasse
19369,Eidel,aurridgea8@networkadvertising.org,+46 388 913 5179,cubilia curae mauris viverra diam vitae quam suspendisse potenti nullam porttitor lacus at turpis donec posuere metus
19370,Voonix,dtitchena9@answers.com,+351 331 564 8251,rutrum neque aenean auctor gravida sem praesent id massa id nisl venenatis lacinia aenean sit amet justo morbi ut odio cras
19371,Wikizz,cfurzeyaa@networkadvertising.org,+86 408 514 1686,ligula vehicula consequat morbi a ipsum integer
19372,Gigazoom,dkinnockab@google.com.br,+86 868 483 9728,consequat nulla nisl nunc nisl duis bibendum felis sed interdum venenatis turpis enim blandit mi in porttitor pede justo eu massa donec dapibus duis at
19373,Demizz,edumingosac@alexa.com,+86 361 359 1211,bibendum felis sed interdum venenatis turpis enim blandit mi in porttitor pede justo eu massa donec dapibus duis at velit
19374,Oyope,bcristofaroad@harvard.edu,+351 968 254 8181,augue vestibulum rutrum rutrum neque aenean auctor gravida sem praesent id massa
19375,Oyope,ablacklerae@multiply.com,+86 682 102 5432,est quam pharetra magna ac consequat metus sapien ut nunc vestibulum ante ipsum primis in faucibus orci
19376,Flipbug,tlingaf@last.fm,+63 214 748 8337,sapien in sapien iaculis congue vivamus metus arcu adipiscing molestie hendrerit at vulputate vitae nisl aenean lectus pellentesque
19377,Rooxo,ablyag@china.com.cn,+420 680 687 4503,congue elementum in hac habitasse platea dictumst morbi vestibulum velit id pretium iaculis diam
19378,Skyba,nrobeletah@csmonitor.com,+62 134 819 9907,risus semper porta volutpat quam pede lobortis ligula
19379,Mybuzz,anaylorai@yandex.ru,+234 188 262 7044,risus praesent lectus vestibulum quam
19380,Thoughtblab,bpaulmannaj@uol.com.br,+60 883 439 0130,dui luctus rutrum nulla tellus in sagittis dui vel nisl duis ac
19381,Dabshots,jslaghtak@boston.com,+358 283 368 6351,mauris eget massa tempor convallis nulla neque libero convallis eget eleifend luctus ultricies eu nibh quisque
19382,Janyx,ksonscheinal@bbc.co.uk,+86 465 639 8337,ut blandit non interdum in ante vestibulum ante ipsum primis in faucibus orci luctus et ultrices posuere cubilia curae duis faucibus accumsan
19383,Youtags,ddeartham@cornell.edu,+62 957 126 0542,nunc vestibulum ante ipsum primis in faucibus orci luctus et ultrices posuere cubilia curae mauris viverra diam vitae
19384,Browsebug,agleedan@aboutads.info,+86 722 664 0782,elit sodales scelerisque mauris sit amet eros suspendisse accumsan tortor quis turpis sed ante vivamus tortor duis
19385,Twitternation,nhalleyao@admin.ch,+593 952 536 5616,justo lacinia eget tincidunt eget tempus vel pede morbi porttitor lorem id ligula suspendisse ornare consequat lectus in est risus auctor sed tristique in tempus
19386,Tagpad,nwhitwoodap@sitemeter.com,+48 940 855 2196,a ipsum integer a nibh in quis justo maecenas rhoncus aliquam
19387,Nlounge,sblazewskiaq@japanpost.jp,+86 689 558 8107,vestibulum sagittis sapien cum sociis natoque penatibus
19388,Camimbo,dleftlyar@time.com,+7 654 948 6185,aliquam erat volutpat in congue etiam justo etiam pretium iaculis justo in hac habitasse platea dictumst etiam faucibus cursus urna
19389,Dabshots,mtillmanas@addtoany.com,+358 549 571 2002,morbi odio odio elementum eu interdum
19390,Pixoboo,hbooneat@tripod.com,+7 372 370 1697,nisl aenean lectus pellentesque eget nunc donec quis orci eget orci vehicula condimentum curabitur in libero ut massa volutpat convallis morbi odio odio
19391,Npath,mneylonau@nationalgeographic.com,+30 999 462 6059,bibendum felis sed interdum venenatis turpis enim blandit mi in porttitor pede
19392,Livefish,gjoseav@dedecms.com,+56 651 295 9799,ut mauris eget massa tempor convallis nulla neque libero convallis
19393,Mydo,dcurnnokaw@github.com,+54 293 739 3542,lobortis convallis tortor risus dapibus augue vel accumsan tellus nisi eu orci mauris lacinia
19394,Realbuzz,mcourceyax@utexas.edu,+62 475 326 6869,rutrum neque aenean auctor gravida sem praesent id massa id nisl venenatis lacinia
19395,Dabvine,rpaxfordeay@noaa.gov,+63 143 854 0529,sit amet nunc viverra dapibus nulla suscipit ligula in lacus curabitur at ipsum ac
19396,Livefish,yvargaaz@istockphoto.com,+7 689 163 8418,et ultrices posuere cubilia curae
19397,Voonder,dforlongeb0@angelfire.com,+52 641 212 6586,ligula sit amet eleifend pede libero quis orci nullam molestie
19398,Skinte,wzealb1@google.de,+86 839 847 4688,dis parturient montes nascetur ridiculus mus
19399,Jazzy,aspiringb2@yellowbook.com,+46 897 660 7120,rutrum at lorem integer tincidunt ante vel ipsum praesent blandit lacinia erat vestibulum sed magna at nunc commodo placerat
19400,Photojam,cspeareb3@globo.com,+62 904 130 2454,felis fusce posuere felis sed lacus morbi sem mauris laoreet ut rhoncus aliquet pulvinar sed
19401,Browsecat,dsabatheb4@tripod.com,+48 475 735 5421,praesent id massa id nisl
19402,Fanoodle,gpilmerb5@delicious.com,+86 637 759 8027,diam erat fermentum justo nec condimentum neque sapien placerat ante nulla justo aliquam quis turpis eget
19403,Thoughtstorm,emacloughlinb6@whitehouse.gov,+355 664 826 9753,penatibus et magnis dis parturient montes nascetur ridiculus mus etiam
19404,Gabtune,lwakleyb7@miitbeian.gov.cn,+375 237 995 3659,amet eleifend pede libero quis orci nullam molestie nibh
19405,Shufflebeat,eaguirrezabalab8@indiatimes.com,+7 341 637 5908,lacus curabitur at ipsum ac tellus semper interdum mauris ullamcorper purus sit amet nulla quisque arcu libero rutrum ac lobortis vel
19406,Flashdog,dandrib9@nbcnews.com,+62 289 560 5160,sit amet diam in magna bibendum imperdiet nullam orci pede venenatis non sodales sed tincidunt eu felis fusce posuere felis sed
19407,Buzzshare,ddrengba@va.gov,+374 438 235 6306,pede justo eu massa donec dapibus duis at velit eu est congue elementum in hac habitasse platea dictumst morbi
19408,Buzzbean,fmagarrellbb@biglobe.ne.jp,+57 570 934 1075,suspendisse accumsan tortor quis turpis sed ante vivamus tortor duis mattis egestas metus aenean fermentum donec ut mauris eget massa tempor convallis nulla neque
19409,Meetz,nharcombebc@goo.ne.jp,+86 656 464 1819,non quam nec dui luctus rutrum nulla tellus in sagittis dui vel nisl
19410,Thoughtworks,jduckerinbd@hugedomains.com,+687 557 393 2285,in tempor turpis nec euismod scelerisque quam turpis adipiscing lorem vitae mattis nibh ligula nec sem duis aliquam convallis nunc proin at turpis a
19411,Zoomzone,mbaughambe@netvibes.com,+678 614 508 8074,fringilla rhoncus mauris enim leo rhoncus sed vestibulum sit amet cursus id turpis
19412,Buzzdog,vlewcockbf@intel.com,+81 674 997 4702,consequat nulla nisl nunc nisl duis bibendum felis sed interdum venenatis
19413,Katz,ojoratbg@amazon.co.jp,+255 143 591 3253,aliquam convallis nunc proin at turpis a pede posuere nonummy integer non
19414,Twiyo,cmorstattbh@baidu.com,+54 560 657 1699,nulla integer pede justo lacinia eget tincidunt eget tempus vel pede morbi porttitor lorem id ligula suspendisse ornare consequat lectus
19415,Kaymbo,plaurencotbi@foxnews.com,+20 254 405 8640,risus praesent lectus vestibulum quam sapien varius ut blandit non interdum in ante vestibulum ante ipsum
19416,Dabjam,obenzibj@comcast.net,+381 878 451 0415,amet nulla quisque arcu libero rutrum ac lobortis vel dapibus at diam nam tristique tortor
19417,Zoomzone,pritmeierbk@cafepress.com,+84 368 149 7709,eu interdum eu tincidunt in leo maecenas pulvinar
19418,Janyx,cbazirebl@army.mil,+240 424 979 8412,eu tincidunt in leo maecenas pulvinar lobortis est phasellus
19419,Babblestorm,kcleallbm@pagesperso-orange.fr,+386 372 670 9300,duis at velit eu est congue elementum in hac habitasse platea dictumst morbi vestibulum velit
19420,Realbridge,mnewickbn@yelp.com,+86 404 440 4443,nisl venenatis lacinia aenean sit amet justo morbi ut odio cras mi pede malesuada in imperdiet et commodo vulputate justo in blandit ultrices enim
19421,Brainbox,cworttbo@howstuffworks.com,+86 744 597 3156,viverra diam vitae quam suspendisse potenti nullam porttitor lacus at turpis donec posuere metus vitae ipsum aliquam
19422,Brightdog,kvasilchikovbp@wiley.com,+355 424 727 9784,mattis nibh ligula nec sem duis aliquam convallis nunc proin at turpis a pede posuere nonummy integer non velit donec diam neque vestibulum
19423,Skyndu,nmcwatersbq@ed.gov,+86 550 343 5326,nam ultrices libero non mattis pulvinar nulla pede ullamcorper augue a suscipit nulla elit ac
19424,Vipe,bhughlandbr@cbsnews.com,+1 650 257 8370,nam nulla integer pede justo lacinia
19425,Divape,amcclaybs@ft.com,+54 969 490 1895,quis orci nullam molestie nibh in lectus pellentesque at nulla
19426,Kazu,cnewcomebt@amazon.de,+380 806 168 0664,mattis egestas metus aenean fermentum donec ut mauris
19427,Topiclounge,llarawaybu@a8.net,+86 677 355 0556,volutpat dui maecenas tristique est et tempus semper
19428,Eidel,hpetroulisbv@paginegialle.it,+55 848 393 8209,dolor sit amet consectetuer adipiscing elit proin interdum mauris non ligula pellentesque ultrices phasellus id sapien in sapien iaculis congue vivamus metus arcu
19429,Lazz,aballebw@reference.com,+7 312 180 8426,vel enim sit amet nunc viverra dapibus nulla suscipit ligula in lacus curabitur at ipsum ac tellus semper interdum mauris ullamcorper purus
19430,Photojam,dbottinellibx@reddit.com,+86 966 591 1465,quisque ut erat curabitur gravida nisi
19431,Mynte,abernetby@si.edu,+86 530 865 2556,cubilia curae mauris viverra diam vitae quam suspendisse potenti nullam porttitor lacus at turpis donec posuere metus vitae
19432,Twitterbeat,rstovinebz@bbb.org,+55 521 432 8501,magna vestibulum aliquet ultrices erat tortor sollicitudin mi sit amet lobortis sapien
19433,Yodel,jwoodrupc0@istockphoto.com,+373 268 697 9460,phasellus sit amet erat nulla tempus vivamus
19434,Meezzy,rwhearc1@sohu.com,+62 144 448 6751,in est risus auctor sed tristique in tempus
19435,Jazzy,abelvardc2@wix.com,+7 776 898 1691,in libero ut massa volutpat convallis morbi odio odio elementum eu interdum eu tincidunt in leo
19436,Voonder,jwaterhousec3@icio.us,+502 288 633 7947,ipsum praesent blandit lacinia erat vestibulum sed magna at nunc
19437,Dynabox,bsearyc4@plala.or.jp,+86 306 376 6615,proin leo odio porttitor id consequat
19438,Flipbug,kbiasioc5@digg.com,+63 793 840 7036,vulputate nonummy maecenas tincidunt lacus at velit vivamus vel nulla eget eros
19439,Tazzy,lbilamc6@pbs.org,+62 231 367 2221,nascetur ridiculus mus etiam vel
19440,Trudoo,hfarrisc7@phoca.cz,+62 527 157 2065,erat tortor sollicitudin mi sit amet lobortis sapien sapien non mi integer ac neque duis bibendum morbi non quam nec dui luctus rutrum
19441,Linkbridge,ksollemec8@360.cn,+66 539 227 3112,sapien dignissim vestibulum vestibulum ante ipsum primis in faucibus orci luctus et ultrices posuere
19442,Mita,snibleyc9@unc.edu,+62 257 370 3540,amet eros suspendisse accumsan tortor quis turpis sed ante
19443,Twitterbridge,prafteryca@devhub.com,+86 664 990 2365,tempus vivamus in felis eu sapien cursus vestibulum proin eu mi nulla ac enim in tempor turpis nec euismod scelerisque quam
19444,Tekfly,crubertellicb@myspace.com,+55 604 411 9304,blandit ultrices enim lorem ipsum dolor sit amet consectetuer adipiscing elit proin interdum mauris non ligula pellentesque ultrices phasellus id sapien in sapien iaculis
19445,Fatz,jkrugercc@yelp.com,+255 400 482 1100,massa id lobortis convallis tortor risus dapibus augue vel accumsan tellus nisi eu orci mauris lacinia sapien quis libero nullam
19446,Izio,grisencd@nydailynews.com,+86 795 664 8038,rutrum nulla tellus in sagittis dui vel nisl duis ac nibh fusce lacus purus aliquet at feugiat non pretium quis
19447,Tagpad,rromeice@usgs.gov,+227 190 782 1016,sit amet erat nulla tempus vivamus
19448,Tekfly,dmignotcf@g.co,+1 770 671 0260,orci luctus et ultrices posuere cubilia curae nulla dapibus dolor
19449,Yambee,rgeindrecg@nydailynews.com,+62 752 827 9204,nam congue risus semper porta volutpat quam pede
19450,Photofeed,trayburnch@feedburner.com,+46 173 244 4927,nam nulla integer pede justo lacinia eget
19451,Lajo,ncasfordci@prlog.org,+351 665 907 5713,vel augue vestibulum rutrum rutrum neque aenean auctor gravida sem praesent id massa id nisl venenatis lacinia aenean sit amet justo morbi ut
19452,Youbridge,froberticj@cnet.com,+54 448 823 9261,eget vulputate ut ultrices vel augue vestibulum ante ipsum primis in faucibus orci luctus et ultrices posuere cubilia
19453,Zoombeat,hshirilck@digg.com,+47 125 159 7006,neque vestibulum eget vulputate ut ultrices vel augue vestibulum ante
19454,Gabcube,mlarkkemcl@google.com.br,+62 345 742 2445,maecenas rhoncus aliquam lacus morbi quis tortor id nulla ultrices aliquet maecenas leo
19455,Agimba,bpoolecm@netscape.com,+7 185 255 4832,vitae ipsum aliquam non mauris morbi non lectus aliquam sit amet diam in magna bibendum imperdiet nullam orci pede
19456,Yambee,sbussellcn@accuweather.com,+62 246 513 6049,quisque porta volutpat erat quisque erat eros viverra
19457,Flashset,ffeasleyco@cam.ac.uk,+62 566 856 1863,rutrum neque aenean auctor gravida sem praesent id massa id nisl venenatis lacinia aenean sit amet justo morbi ut odio cras mi
19458,Gabtune,trasellescp@mtv.com,+1 281 502 6100,feugiat et eros vestibulum ac est
19459,Ntag,vwratescq@dyndns.org,+237 219 266 7514,est donec odio justo sollicitudin ut suscipit a feugiat et eros vestibulum ac est lacinia nisi venenatis tristique fusce
19460,Gigabox,vniavecr@imgur.com,+86 775 848 2807,id massa id nisl venenatis lacinia aenean sit amet justo morbi ut
19461,Feednation,pgeraldezcs@ustream.tv,+86 297 751 2441,vitae nisl aenean lectus pellentesque eget nunc donec quis orci eget orci vehicula condimentum curabitur in libero
19462,Photofeed,lruzekct@tiny.cc,+48 416 112 6742,tempus sit amet sem fusce consequat nulla nisl
19463,Youtags,gfulbrookcu@timesonline.co.uk,+63 396 538 7280,molestie nibh in lectus pellentesque at nulla suspendisse potenti cras in purus eu magna vulputate luctus
19464,Oyoyo,cthomasoncv@bigcartel.com,+86 271 908 8799,at velit eu est congue elementum in hac habitasse platea dictumst morbi vestibulum velit id pretium iaculis diam erat fermentum justo nec condimentum neque
19465,Avaveo,zjelkscw@kickstarter.com,+680 151 369 7692,duis faucibus accumsan odio curabitur convallis duis consequat dui nec nisi volutpat eleifend donec ut dolor morbi vel lectus in quam fringilla rhoncus mauris
19466,Talane,kvarlowcx@opera.com,+86 329 261 2170,eu felis fusce posuere felis sed lacus
19467,Blogpad,cizodcy@google.com.hk,+52 618 938 7939,nisi nam ultrices libero non mattis pulvinar nulla pede ullamcorper augue a suscipit
19468,Kwinu,mcriagcz@google.co.jp,+1 310 545 9561,vestibulum rutrum rutrum neque aenean auctor gravida sem praesent id massa id nisl venenatis lacinia aenean sit
19469,Photobean,pvasilikd0@cnn.com,+86 382 432 1177,magna ac consequat metus sapien ut nunc vestibulum ante ipsum primis in faucibus orci luctus et ultrices posuere cubilia
19470,Voomm,spencottd1@nih.gov,+7 554 969 9626,in felis eu sapien cursus vestibulum proin eu mi nulla ac enim in tempor turpis
19471,Voonix,idenidged2@google.fr,+507 992 208 1731,nisi eu orci mauris lacinia
19472,Browsecat,mhullahd3@netscape.com,+86 273 859 1807,vestibulum sed magna at nunc commodo placerat praesent blandit nam nulla integer pede justo lacinia eget
19473,Meembee,jcasfordd4@disqus.com,+63 579 201 1980,justo etiam pretium iaculis justo in hac habitasse platea dictumst etiam faucibus cursus urna ut tellus
19474,Dabfeed,bvirgind5@harvard.edu,+86 625 646 7310,in tempor turpis nec euismod scelerisque quam turpis adipiscing lorem vitae mattis nibh ligula nec sem duis aliquam convallis nunc proin at turpis a
19475,Feednation,dgladwelld6@istockphoto.com,+1 612 692 6218,habitasse platea dictumst morbi vestibulum velit id pretium iaculis diam erat fermentum justo nec condimentum neque sapien placerat ante nulla justo aliquam quis
19476,Wordtune,hcotesfordd7@wiley.com,+7 119 232 0683,non velit nec nisi vulputate nonummy maecenas tincidunt lacus at velit vivamus vel nulla eget eros elementum pellentesque quisque porta volutpat erat quisque
19477,Lazzy,ntunnowd8@hatena.ne.jp,+98 809 222 4879,nibh in lectus pellentesque at nulla suspendisse potenti cras in purus eu magna vulputate
19478,Skynoodle,clowlessd9@cargocollective.com,+62 326 221 5419,bibendum morbi non quam nec dui luctus rutrum nulla tellus in sagittis dui vel nisl duis
19479,Meeveo,blightbodyda@go.com,+264 991 928 5124,aenean auctor gravida sem praesent
19480,Yakitri,aheadingdb@freewebs.com,+7 701 212 2688,nullam porttitor lacus at turpis donec posuere
19481,Photolist,gozeltondc@barnesandnoble.com,+86 648 287 7281,tortor sollicitudin mi sit amet lobortis sapien sapien non mi integer ac neque duis bibendum morbi non quam
19482,Linktype,rhinzedd@mashable.com,+1 464 171 8734,eu felis fusce posuere felis sed lacus morbi sem mauris laoreet ut rhoncus aliquet pulvinar sed nisl nunc rhoncus dui vel sem sed sagittis nam
19483,Oyope,spriorde@wikipedia.org,+387 186 489 0186,consectetuer adipiscing elit proin interdum mauris non ligula pellentesque ultrices phasellus id sapien in sapien iaculis
19484,Voonyx,aabadamdf@prnewswire.com,+385 879 618 1367,dolor sit amet consectetuer adipiscing elit proin interdum mauris non ligula pellentesque ultrices phasellus id sapien in sapien iaculis congue
19485,Yabox,lweightmandg@t.co,+599 516 801 5837,id turpis integer aliquet massa id lobortis convallis tortor risus dapibus
19486,Zoomlounge,dgoskardh@tamu.edu,+420 215 307 7949,amet nunc viverra dapibus nulla suscipit ligula in lacus curabitur at ipsum ac
19487,Rhyloo,cheppnerdi@qq.com,+86 540 827 5839,ut erat id mauris vulputate elementum nullam varius nulla facilisi cras non velit nec nisi vulputate nonummy maecenas tincidunt lacus at
19488,Yakidoo,cceresadj@cbslocal.com,+66 597 519 6129,in faucibus orci luctus et ultrices posuere cubilia curae
19489,Skinix,dneavesdk@google.co.uk,+58 804 648 4659,amet lobortis sapien sapien non mi integer ac neque duis bibendum morbi non quam nec
19490,Livepath,mbrazurdl@github.com,+46 825 896 5904,justo in hac habitasse platea dictumst etiam faucibus cursus urna ut tellus nulla ut erat
19491,Thoughtbridge,blevermoredm@miibeian.gov.cn,+7 808 393 9379,diam neque vestibulum eget vulputate ut ultrices vel augue vestibulum
19492,Oyondu,amossdaledn@intel.com,+351 277 419 4533,massa donec dapibus duis at velit eu est congue elementum in hac habitasse platea dictumst morbi vestibulum velit
19493,Jayo,malmando@usnews.com,+7 596 847 1153,vestibulum eget vulputate ut ultrices vel augue vestibulum ante ipsum primis in faucibus orci luctus et ultrices posuere cubilia curae donec pharetra magna vestibulum
19494,Rhybox,jwoolbrookdp@imageshack.us,+82 220 715 9531,volutpat eleifend donec ut dolor morbi vel lectus in quam fringilla rhoncus mauris enim leo rhoncus sed vestibulum
19495,Bluejam,gkarpetsdq@g.co,+86 670 346 6668,est lacinia nisi venenatis tristique fusce congue diam id ornare imperdiet sapien urna
19496,Mymm,ppavlitschekdr@arizona.edu,+63 823 720 9882,vestibulum ante ipsum primis in faucibus orci luctus et ultrices posuere cubilia curae
19497,Kaymbo,ppuddingds@wunderground.com,+55 855 440 4879,turpis a pede posuere nonummy integer non velit donec diam
19498,Teklist,mbenedekdt@loc.gov,+86 811 944 4916,nullam sit amet turpis elementum ligula vehicula consequat morbi a
19499,Tagpad,dmcgrahdu@edublogs.org,+33 817 400 3858,turpis eget elit sodales scelerisque mauris sit amet eros suspendisse accumsan tortor quis turpis sed ante vivamus tortor duis
19500,Mydeo,pyarwooddv@alibaba.com,+86 457 251 6142,velit nec nisi vulputate nonummy maecenas tincidunt lacus at velit vivamus vel
19501,Thoughtbeat,gringdw@un.org,+355 899 240 0605,hendrerit at vulputate vitae nisl aenean lectus pellentesque eget nunc donec quis orci eget orci vehicula condimentum curabitur in libero ut massa volutpat
19502,Agivu,rpentlanddx@cocolog-nifty.com,+55 490 772 4908,nibh in lectus pellentesque at nulla suspendisse potenti cras in purus eu magna vulputate luctus cum sociis natoque penatibus et magnis dis parturient montes
19503,Skajo,jgidleydy@ucsd.edu,+420 468 572 4206,ipsum praesent blandit lacinia erat vestibulum sed magna at nunc commodo placerat praesent blandit nam nulla integer pede
19504,Gigaclub,gkarpenkodz@joomla.org,+352 412 323 6213,interdum eu tincidunt in leo maecenas pulvinar lobortis est phasellus sit
19505,Wordpedia,tpordalle0@smugmug.com,+86 776 895 5833,integer pede justo lacinia eget
19506,Oyonder,kalcidee1@foxnews.com,+84 594 564 6133,fringilla rhoncus mauris enim leo rhoncus sed vestibulum sit amet cursus id turpis integer aliquet massa id
19507,Yozio,ckenefordee2@youtube.com,+880 233 157 6674,non mattis pulvinar nulla pede ullamcorper augue a suscipit nulla elit ac nulla sed vel enim sit amet nunc viverra dapibus nulla
19508,Photofeed,shrynczyke3@desdev.cn,+84 402 597 0453,etiam faucibus cursus urna ut tellus nulla ut erat id mauris vulputate elementum nullam varius nulla facilisi cras non velit nec nisi vulputate
19509,Jabberbean,fgogartye4@photobucket.com,+54 156 335 5820,magna ac consequat metus sapien ut nunc vestibulum ante ipsum primis in faucibus orci luctus et ultrices posuere cubilia curae
19510,Rhyzio,lmccullume5@tiny.cc,+62 783 409 8990,morbi ut odio cras mi pede malesuada in imperdiet et commodo vulputate justo in blandit ultrices enim lorem ipsum dolor sit amet consectetuer adipiscing
