SupplierID,SupplierName,SupplierEmail,SupplierPhone,SupplierDescription
19691,Twiyo,tduiguidj6@irs.gov,+224 704 157 9305,luctus et ultrices posuere cubilia curae nulla dapibus dolor vel est donec
19692,Janyx,gconwayj7@goo.gl,+86 414 296 8819,quam fringilla rhoncus mauris enim leo rhoncus sed vestibulum sit amet cursus
19693,Talane,mmoorcraftj8@berkeley.edu,+60 973 324 8002,sed vel enim sit amet nunc viverra dapibus nulla suscipit ligula in lacus curabitur at ipsum ac tellus semper interdum mauris ullamcorper purus
19694,Devcast,kbrandinj9@addtoany.com,+351 360 149 5011,id massa id nisl venenatis lacinia aenean sit amet justo morbi ut
19695,Rhynyx,cfacchinija@plala.or.jp,+234 819 290 4367,nulla dapibus dolor vel est donec odio justo sollicitudin ut suscipit a feugiat et eros vestibulum ac
19696,Realpoint,rsigfridjb@free.fr,+86 265 862 5596,elementum pellentesque quisque porta volutpat erat quisque erat eros viverra eget congue eget semper rutrum nulla nunc purus phasellus in felis donec
19697,Skidoo,mschererjc@dropbox.com,+86 122 147 8716,elementum eu interdum eu tincidunt in leo maecenas pulvinar lobortis est
19698,Gabvine,tdibartolomeojd@fotki.com,+86 482 757 9394,sit amet erat nulla tempus
19699,Ntags,mdearloveje@edublogs.org,+27 395 818 7453,velit eu est congue elementum in hac habitasse platea dictumst morbi vestibulum velit id pretium iaculis diam erat fermentum justo
19700,Latz,mgoodbarnejf@tinyurl.com,+420 425 352 8050,turpis enim blandit mi in porttitor pede justo eu massa donec dapibus duis at
19701,Mudo,dspenceleyjg@mediafire.com,+593 709 231 2657,vitae quam suspendisse potenti nullam porttitor lacus at turpis donec posuere metus vitae ipsum aliquam non mauris morbi non lectus aliquam
19702,Avavee,jetheringtonjh@answers.com,+234 163 989 0148,justo sollicitudin ut suscipit a feugiat et eros vestibulum ac est
19703,Thoughtsphere,baimeji@mozilla.com,+46 516 236 2955,ipsum aliquam non mauris morbi non lectus aliquam sit amet diam in magna bibendum imperdiet nullam orci pede
19704,Eimbee,cdimblebeejj@economist.com,+386 391 560 1412,tincidunt nulla mollis molestie lorem quisque ut erat curabitur
19705,Youspan,ajerroltjk@csmonitor.com,+48 571 931 4026,dolor vel est donec odio justo sollicitudin ut suscipit a feugiat
19706,Photolist,mpywelljl@techcrunch.com,+60 749 885 7224,pellentesque ultrices mattis odio donec vitae nisi
19707,Gevee,hgethinjm@wired.com,+977 283 171 5005,congue etiam justo etiam pretium iaculis justo in hac habitasse platea dictumst etiam faucibus cursus urna ut tellus
19708,Kayveo,crunseyjn@mashable.com,+62 234 666 9191,justo nec condimentum neque sapien placerat ante nulla justo aliquam quis turpis eget
19709,Demimbu,gpawelecjo@uol.com.br,+31 305 861 6707,vivamus in felis eu sapien cursus vestibulum proin eu mi nulla ac enim in tempor turpis nec euismod scelerisque quam turpis
19710,Jamia,averlingjp@csmonitor.com,+62 226 548 3331,nunc proin at turpis a pede posuere nonummy integer non velit donec diam neque vestibulum eget vulputate ut ultrices vel augue vestibulum ante ipsum
19711,Gabcube,ysowthcotejq@360.cn,+54 998 290 7170,in magna bibendum imperdiet nullam orci
19712,Oloo,bjohannessonjr@tuttocitta.it,+86 614 261 3081,consequat in consequat ut nulla sed accumsan felis ut at dolor quis odio consequat varius integer ac leo pellentesque
19713,Zooveo,mreamejs@1und1.de,+54 364 471 2090,interdum mauris non ligula pellentesque ultrices phasellus id sapien in sapien iaculis congue vivamus metus arcu adipiscing molestie hendrerit at
19714,Browseblab,tbonhamjt@hexun.com,+81 592 327 7527,orci pede venenatis non sodales sed tincidunt eu felis fusce posuere felis sed lacus morbi sem mauris
19715,Oloo,alordenju@tmall.com,+86 883 701 2135,primis in faucibus orci luctus et ultrices
19716,Eidel,lgreenlandjv@istockphoto.com,+976 833 771 5084,ante vivamus tortor duis mattis egestas metus aenean fermentum
19717,BlogXS,agilvaryjw@state.tx.us,+86 702 465 1968,cubilia curae mauris viverra diam vitae quam suspendisse potenti nullam porttitor lacus at turpis donec
19718,Skimia,khulkesjx@vimeo.com,+63 477 924 1956,blandit non interdum in ante vestibulum ante
19719,Edgeblab,dquartermainejy@pbs.org,+81 271 492 6084,pede posuere nonummy integer non velit donec diam neque vestibulum eget vulputate ut ultrices vel augue vestibulum ante ipsum primis in faucibus orci
19720,Yakijo,drohlfjz@1688.com,+27 875 589 9477,placerat praesent blandit nam nulla integer pede justo lacinia eget tincidunt eget tempus vel pede morbi porttitor lorem id ligula suspendisse
19721,Browseblab,sspenderk0@oaic.gov.au,+63 910 168 8159,ut nulla sed accumsan felis ut at dolor quis odio consequat varius integer ac leo pellentesque
19722,Rhynoodle,cverickk1@cam.ac.uk,+506 191 826 9665,venenatis tristique fusce congue diam id
19723,Eidel,ajenickek2@canalblog.com,+33 959 423 9899,tempus sit amet sem fusce consequat nulla nisl nunc nisl duis bibendum felis sed interdum venenatis turpis enim blandit mi in porttitor
19724,Shuffledrive,lprierk3@behance.net,+86 493 917 4937,suspendisse potenti nullam porttitor lacus at turpis donec posuere metus vitae
19725,Yotz,amccolek4@noaa.gov,+46 385 643 8217,feugiat non pretium quis lectus suspendisse potenti in eleifend quam a odio in hac habitasse platea
19726,Gabspot,khurryk5@paypal.com,+54 199 148 5431,non pretium quis lectus suspendisse potenti in eleifend quam a odio in hac habitasse platea dictumst maecenas ut massa quis augue luctus
19727,Mynte,tconnork6@phoca.cz,+63 894 629 9491,nunc donec quis orci eget orci vehicula condimentum curabitur in libero ut massa volutpat
19728,Dabshots,spaladinik7@tinypic.com,+62 611 858 9775,justo nec condimentum neque sapien placerat ante nulla justo aliquam quis turpis eget elit sodales scelerisque mauris sit amet eros suspendisse accumsan tortor quis
19729,Aimbo,tbollardk8@nps.gov,+967 658 465 2043,curabitur in libero ut massa volutpat convallis morbi odio odio
19730,Quimm,mhamfleetk9@jalbum.net,+63 706 881 9347,sapien arcu sed augue aliquam erat volutpat in congue
19731,Zooxo,lmanuellika@intel.com,+504 561 276 1410,nec nisi vulputate nonummy maecenas tincidunt lacus at velit vivamus vel nulla eget
19732,Wikizz,avondracekkb@zimbio.com,+994 745 524 6022,amet cursus id turpis integer aliquet massa id lobortis convallis tortor risus dapibus augue vel accumsan tellus nisi eu
19733,Yotz,mjillettkc@un.org,+62 635 905 8343,nullam orci pede venenatis non sodales sed tincidunt eu felis fusce posuere felis sed lacus morbi sem mauris laoreet ut rhoncus
19734,Wordware,wminigokd@discuz.net,+46 898 486 6360,sit amet eros suspendisse accumsan tortor quis turpis sed ante vivamus tortor duis mattis egestas metus aenean fermentum donec
19735,Flashdog,rduffieldke@sohu.com,+51 748 740 9597,non mattis pulvinar nulla pede ullamcorper augue
19736,Digitube,jfriselkf@wp.com,+84 541 294 8767,semper rutrum nulla nunc purus phasellus in felis donec semper sapien a libero nam dui proin leo
19737,Ooba,hbrannkg@chicagotribune.com,+353 800 471 9350,nunc donec quis orci eget orci vehicula condimentum curabitur in libero
19738,Thoughtsphere,gipplettkh@yahoo.co.jp,+60 895 924 1824,ultrices posuere cubilia curae nulla
19739,Meedoo,adavidowki@deviantart.com,+52 657 732 4264,etiam pretium iaculis justo in hac habitasse platea dictumst
19740,Innojam,lparidgekj@pen.io,+670 320 465 7822,quisque ut erat curabitur gravida nisi at nibh in
19741,Quaxo,jrucklidgekk@craigslist.org,+48 915 304 1212,porttitor lacus at turpis donec posuere metus vitae ipsum aliquam non mauris morbi non
19742,Eimbee,achadbournkl@ucoz.ru,+7 422 515 5480,diam id ornare imperdiet sapien urna pretium
19743,Chatterbridge,dperetkm@cyberchimps.com,+86 564 221 0285,sem duis aliquam convallis nunc proin at turpis a pede posuere nonummy integer non velit donec diam neque vestibulum eget vulputate ut ultrices vel
19744,Zoomzone,lstockkn@bloglovin.com,+86 757 305 0811,odio donec vitae nisi nam
19745,Eidel,estedallko@about.com,+45 584 829 7283,duis bibendum morbi non quam nec dui luctus rutrum nulla tellus in sagittis dui vel nisl duis ac nibh fusce lacus purus
19746,Aimbo,imaunderskp@pcworld.com,+86 485 349 3365,morbi sem mauris laoreet ut rhoncus aliquet pulvinar sed nisl nunc rhoncus dui vel sem sed
19747,Oloo,vjohananoffkq@cdc.gov,+62 123 807 4560,eget semper rutrum nulla nunc purus phasellus in felis donec semper sapien a libero nam dui proin leo
19748,Meembee,dlydiardkr@feedburner.com,+420 268 590 7344,sagittis dui vel nisl duis ac nibh fusce lacus purus aliquet at feugiat non pretium quis lectus suspendisse
19749,Kazio,canstisks@ted.com,+30 529 666 0146,ultrices libero non mattis pulvinar nulla pede ullamcorper augue a suscipit nulla elit ac
19750,Zava,acanferkt@blog.com,+62 795 373 9410,erat id mauris vulputate elementum nullam varius nulla facilisi cras non velit nec nisi vulputate
19751,Voolia,jabeleku@ehow.com,+420 554 620 8881,eget vulputate ut ultrices vel augue vestibulum
19752,Skynoodle,ckeeveskv@unicef.org,+86 167 821 2411,sociis natoque penatibus et magnis dis parturient montes nascetur ridiculus mus etiam vel augue vestibulum rutrum rutrum neque
19753,Thoughtstorm,shyndkw@salon.com,+57 804 129 6418,aenean sit amet justo morbi ut odio cras mi pede malesuada
19754,Aimbu,aorviskx@yahoo.co.jp,+62 655 439 7710,elit sodales scelerisque mauris sit amet eros suspendisse accumsan tortor quis turpis
19755,Feedmix,ocannellky@google.pl,+58 862 911 6545,et eros vestibulum ac est lacinia nisi
19756,Omba,statlowekz@merriam-webster.com,+55 174 378 0279,sapien iaculis congue vivamus metus arcu adipiscing molestie hendrerit at
19757,Cogibox,mburkittl0@wikipedia.org,+1 469 733 9269,donec dapibus duis at velit eu est congue elementum in hac habitasse platea dictumst morbi vestibulum velit id pretium iaculis diam erat fermentum justo nec
19758,Yakidoo,jbaglinl1@buzzfeed.com,+63 526 689 6621,consectetuer adipiscing elit proin interdum mauris non ligula pellentesque ultrices phasellus id sapien in sapien iaculis congue vivamus
19759,Shuffledrive,dmilwardl2@washingtonpost.com,+86 172 934 0844,et magnis dis parturient montes nascetur ridiculus mus etiam vel augue vestibulum rutrum rutrum neque aenean auctor gravida
19760,Eazzy,hdeblel3@ebay.co.uk,+62 442 206 6253,curae duis faucibus accumsan odio curabitur convallis duis consequat dui nec nisi volutpat eleifend donec ut dolor morbi vel
19761,Yozio,jscamerdenl4@vk.com,+1 816 631 3913,non mauris morbi non lectus aliquam sit amet diam in magna bibendum imperdiet nullam orci pede venenatis non sodales
19762,Divape,aodownel5@omniture.com,+94 807 598 3947,non velit donec diam neque
19763,Flipopia,zartusl6@rakuten.co.jp,+48 850 433 3264,vestibulum ante ipsum primis in faucibus orci luctus et ultrices
19764,Gabspot,gthoulessl7@adobe.com,+62 959 726 0440,nulla eget eros elementum pellentesque quisque porta volutpat erat quisque erat eros viverra eget congue
19765,Skyvu,jwaghornel8@unc.edu,+880 596 412 2622,pellentesque eget nunc donec quis orci eget orci vehicula condimentum curabitur in libero ut massa volutpat convallis morbi odio odio elementum eu interdum
19766,Linktype,jbettonl9@omniture.com,+86 813 710 3349,rhoncus sed vestibulum sit amet cursus id turpis integer aliquet massa id lobortis convallis tortor risus dapibus augue vel accumsan tellus
19767,Photojam,ccroomela@senate.gov,+234 924 939 8341,ipsum praesent blandit lacinia erat vestibulum sed magna at nunc commodo placerat praesent blandit nam nulla integer pede justo lacinia eget tincidunt eget
19768,Gigazoom,trugierolb@ustream.tv,+86 571 239 5375,donec semper sapien a libero nam dui proin leo odio porttitor id
19769,Devcast,vspeeklc@aboutads.info,+27 623 918 9755,mauris ullamcorper purus sit amet nulla quisque arcu
19770,Gabtune,vgobournld@wordpress.org,+57 889 641 7164,porta volutpat erat quisque erat eros viverra eget congue eget semper rutrum nulla nunc purus
19771,Ntags,cgoudardle@slashdot.org,+222 881 201 9845,at nulla suspendisse potenti cras in purus eu magna vulputate luctus cum sociis natoque penatibus et magnis dis parturient montes
19772,Meevee,abraghinilf@exblog.jp,+351 161 139 2624,bibendum morbi non quam nec dui luctus rutrum nulla tellus
19773,Devpulse,psperringlg@businessinsider.com,+86 545 715 8530,odio cras mi pede malesuada in imperdiet et commodo vulputate justo in blandit ultrices
19774,Voonder,rcraythornlh@sun.com,+1 450 295 5048,rutrum nulla tellus in sagittis dui vel nisl duis ac nibh fusce lacus purus aliquet at feugiat non pretium quis lectus suspendisse potenti
19775,Tagopia,ndippleli@list-manage.com,+62 614 755 3999,nunc purus phasellus in felis donec semper sapien a libero nam dui proin leo odio porttitor id consequat in consequat
19776,Oyoyo,bburgenlj@4shared.com,+504 848 816 7303,massa volutpat convallis morbi odio odio elementum eu interdum eu tincidunt in leo maecenas
19777,Flashdog,dpattillolk@reddit.com,+385 951 545 9842,congue eget semper rutrum nulla nunc purus phasellus in felis donec semper sapien a libero nam dui proin leo odio porttitor
19778,Aivee,tcescotill@joomla.org,+48 925 595 9401,lacus at velit vivamus vel nulla eget eros elementum pellentesque quisque porta volutpat
19779,Leenti,tfieldstonelm@mysql.com,+62 365 980 7245,in blandit ultrices enim lorem ipsum dolor sit amet consectetuer adipiscing elit proin interdum mauris non ligula pellentesque ultrices phasellus id sapien in sapien
19780,Feednation,dstoiteln@webs.com,+58 121 509 6863,tincidunt lacus at velit vivamus vel nulla eget eros elementum pellentesque
19781,Wikido,ckencottlo@clickbank.net,+33 516 276 4823,felis sed interdum venenatis turpis enim blandit mi in porttitor pede justo eu massa donec
19782,Snaptags,perangylp@hc360.com,+359 993 959 2926,leo odio porttitor id consequat in consequat ut nulla sed accumsan felis
19783,Lazz,xcowderaylq@un.org,+62 591 334 8417,duis bibendum felis sed interdum venenatis
19784,Meeveo,achasonlr@g.co,+86 195 458 4628,nullam porttitor lacus at turpis donec posuere metus vitae ipsum aliquam non
19785,Realmix,sjumontls@t-online.de,+7 914 174 3977,sapien a libero nam dui proin leo odio porttitor id consequat in consequat ut nulla sed accumsan felis ut at dolor
19786,Eamia,dgodlylt@kickstarter.com,+62 127 874 9278,quisque ut erat curabitur gravida nisi at nibh in hac habitasse platea
19787,Feedspan,asallierlu@multiply.com,+386 757 213 0350,scelerisque mauris sit amet eros suspendisse accumsan tortor quis turpis sed ante vivamus tortor duis mattis egestas metus aenean fermentum donec ut
19788,Oloo,areachlv@e-recht24.de,+86 400 129 7658,erat quisque erat eros viverra eget congue eget semper rutrum
19789,Yabox,ctreadgalllw@who.int,+86 634 349 5933,magna at nunc commodo placerat praesent blandit nam nulla integer pede
19790,Trudeo,mcarlemanlx@engadget.com,+62 966 419 5759,integer a nibh in quis justo maecenas rhoncus aliquam lacus morbi quis
19791,Aivee,gnovacekly@ibm.com,+54 154 540 6171,augue luctus tincidunt nulla mollis molestie lorem quisque
19792,Trudeo,bcostylz@t.co,+33 827 913 1737,lacus at turpis donec posuere metus vitae ipsum aliquam non mauris morbi non lectus aliquam sit amet diam in magna bibendum imperdiet nullam
19793,Oyondu,aleslym0@aol.com,+7 162 140 9087,convallis nulla neque libero convallis eget eleifend luctus ultricies eu nibh quisque id justo sit amet sapien dignissim vestibulum vestibulum ante ipsum
19794,Devshare,aalbrightonm1@trellian.com,+64 235 539 3170,sollicitudin ut suscipit a feugiat et eros vestibulum ac est lacinia nisi venenatis tristique fusce congue diam id ornare imperdiet sapien urna pretium nisl ut
19795,Shuffledrive,jwallengerm2@ebay.co.uk,+86 299 791 0550,felis fusce posuere felis sed lacus morbi sem mauris laoreet ut rhoncus aliquet pulvinar sed nisl nunc rhoncus dui vel sem sed sagittis nam congue
19796,Pixoboo,asenussim3@weather.com,+86 455 207 4786,nec euismod scelerisque quam turpis adipiscing lorem vitae mattis nibh ligula nec sem duis aliquam convallis nunc proin at turpis a pede posuere nonummy integer
19797,Roomm,mseagoodm4@ovh.net,+351 401 122 0355,nulla neque libero convallis eget eleifend
19798,Vimbo,areadingsm5@unicef.org,+598 301 881 4382,justo eu massa donec dapibus duis at velit eu est congue
19799,Cogibox,cmagnusm6@youtube.com,+46 767 133 1659,dictumst morbi vestibulum velit id pretium iaculis diam erat fermentum justo nec condimentum neque sapien placerat
19800,Skalith,hgiraudoum7@dagondesign.com,+48 141 874 9056,at velit vivamus vel nulla eget eros elementum
19801,Browsezoom,dwallickerm8@netscape.com,+55 261 515 6685,pharetra magna ac consequat metus sapien ut nunc vestibulum ante ipsum primis in faucibus orci luctus
19802,Fivechat,loslarm9@google.ru,+86 976 622 6608,potenti cras in purus eu magna vulputate luctus cum sociis natoque penatibus et magnis dis parturient montes nascetur ridiculus mus vivamus vestibulum sagittis
19803,Tavu,cgulstonma@de.vu,+86 873 463 5021,quam turpis adipiscing lorem vitae mattis nibh ligula nec sem duis aliquam convallis nunc proin at turpis a pede
19804,Oyoyo,pjinksmb@opensource.org,+63 883 678 1573,rutrum nulla tellus in sagittis dui vel nisl duis ac nibh fusce lacus purus aliquet at feugiat non
19805,Shufflebeat,gcheeversmc@homestead.com,+46 657 769 7858,id massa id nisl venenatis lacinia aenean sit amet justo morbi ut
19806,Ainyx,ibarocmd@myspace.com,+351 766 750 3387,est congue elementum in hac habitasse platea dictumst morbi vestibulum velit id pretium iaculis diam erat fermentum justo nec condimentum
19807,Twinder,wcolisbeme@hhs.gov,+33 151 241 5407,ipsum integer a nibh in quis justo maecenas rhoncus aliquam lacus
19808,Twiyo,kcriermf@arizona.edu,+93 280 505 5540,ut rhoncus aliquet pulvinar sed nisl nunc rhoncus dui vel
19809,Einti,cesommg@nyu.edu,+249 876 931 9391,ante ipsum primis in faucibus orci
19810,Youopia,wmaciaszekmh@ucsd.edu,+86 446 351 1415,orci luctus et ultrices posuere cubilia curae donec pharetra magna
19811,Voonder,salsobrookmi@sohu.com,+46 630 980 6678,curae nulla dapibus dolor vel est donec odio justo sollicitudin ut suscipit a feugiat et eros vestibulum ac
19812,Janyx,lblackhammj@shareasale.com,+351 701 341 0691,pede justo eu massa donec dapibus duis at velit eu est
19813,Voonte,nmcfaulmk@xrea.com,+48 335 142 0570,nam nulla integer pede justo lacinia eget tincidunt eget tempus vel pede morbi porttitor lorem id ligula suspendisse ornare consequat lectus in est risus auctor
19814,Bubblebox,whedleyml@google.pl,+98 329 290 4238,leo maecenas pulvinar lobortis est phasellus sit amet erat nulla tempus vivamus in felis eu sapien cursus vestibulum proin eu mi nulla ac enim
19815,Ntags,amcilwreathmm@privacy.gov.au,+223 624 910 8253,eu est congue elementum in hac habitasse platea dictumst morbi vestibulum velit id pretium iaculis
19816,Abatz,kcutfordmn@paginegialle.it,+57 151 378 0209,viverra diam vitae quam suspendisse potenti nullam porttitor lacus at turpis donec posuere metus vitae ipsum
19817,Izio,ggrenehammo@discovery.com,+62 735 711 7349,hac habitasse platea dictumst aliquam augue quam sollicitudin vitae consectetuer eget rutrum at lorem integer tincidunt ante vel ipsum praesent blandit lacinia
19818,Wordware,phenriemp@smugmug.com,+86 789 362 5655,pede libero quis orci nullam molestie nibh in lectus pellentesque at nulla suspendisse potenti cras in purus eu
19819,Fivechat,tturkmq@issuu.com,+92 338 140 4829,ipsum aliquam non mauris morbi non lectus aliquam sit amet diam in magna bibendum imperdiet nullam orci pede venenatis non
19820,Jazzy,zgoveymr@slashdot.org,+216 969 120 3237,metus vitae ipsum aliquam non mauris morbi
19821,Wikido,rcovilms@cnbc.com,+62 142 450 0402,nunc purus phasellus in felis donec semper sapien a libero nam dui proin leo odio porttitor id consequat in consequat ut nulla sed accumsan
19822,Flipstorm,wellsommt@flickr.com,+62 863 495 6429,morbi non lectus aliquam sit
19823,Blogtags,gmcgralemu@twitter.com,+86 617 154 0483,potenti cras in purus eu magna vulputate luctus cum sociis natoque penatibus et
19824,Katz,lcockingmv@google.ru,+7 971 492 3675,amet sapien dignissim vestibulum vestibulum ante ipsum primis in faucibus orci luctus
19825,Voonyx,zbuckhammw@godaddy.com,+86 728 134 2527,sapien non mi integer ac neque duis bibendum morbi non quam nec
19826,Thoughtstorm,sdennantmx@salon.com,+86 819 464 0653,est risus auctor sed tristique in tempus sit amet sem fusce consequat nulla nisl nunc
19827,Pixope,jdavidssonmy@prnewswire.com,+30 466 322 6539,quisque erat eros viverra eget congue eget semper rutrum nulla nunc purus phasellus in felis donec semper sapien a libero nam dui
19828,Aibox,lilbertmz@seattletimes.com,+46 942 226 2615,tortor risus dapibus augue vel accumsan tellus nisi eu orci mauris lacinia sapien quis libero nullam sit amet turpis elementum ligula vehicula consequat morbi a
19829,Jabbercube,pyashaevn0@soundcloud.com,+62 974 369 2469,dui vel sem sed sagittis nam congue risus semper porta volutpat quam pede lobortis ligula sit amet eleifend pede libero quis orci nullam molestie
19830,Thoughtworks,dchapelln1@technorati.com,+46 385 925 6987,justo maecenas rhoncus aliquam lacus morbi quis tortor id nulla ultrices aliquet maecenas leo odio condimentum id luctus nec molestie sed justo pellentesque
19831,Eire,ctreffryn2@rediff.com,+86 888 498 6777,sed tristique in tempus sit amet sem fusce consequat nulla nisl nunc nisl duis bibendum felis sed interdum venenatis turpis enim
19832,Mudo,abrummelln3@github.io,+63 912 332 5982,consequat varius integer ac leo pellentesque ultrices mattis odio
19833,Kazu,npittwoodn4@reverbnation.com,+1 314 243 2204,lorem vitae mattis nibh ligula nec sem duis aliquam convallis nunc proin at turpis a pede posuere nonummy integer non
19834,Divanoodle,irickerbyn5@sogou.com,+86 578 176 3763,justo in hac habitasse platea dictumst
19835,Fatz,ggorringen6@chron.com,+7 932 911 3176,quis justo maecenas rhoncus aliquam lacus morbi quis tortor id
19836,Centidel,swildorn7@samsung.com,+62 873 290 1864,mattis egestas metus aenean fermentum donec ut mauris
19837,InnoZ,ttremathackn8@rambler.ru,+86 257 659 9180,duis mattis egestas metus aenean
19838,Edgeclub,nsadlern9@joomla.org,+7 357 160 0206,congue vivamus metus arcu adipiscing molestie hendrerit at vulputate vitae nisl aenean lectus pellentesque eget nunc donec quis
19839,Quatz,cgoodingna@unesco.org,+1 408 323 8520,id ligula suspendisse ornare consequat lectus in est risus auctor sed tristique in tempus sit amet sem fusce consequat nulla nisl nunc nisl duis bibendum
19840,Topicware,dchatelainnb@jalbum.net,+62 406 757 0050,augue aliquam erat volutpat in congue etiam justo etiam pretium iaculis justo in hac habitasse platea dictumst etiam faucibus cursus urna ut
19841,Voonyx,acamelianc@parallels.com,+63 813 858 1108,ut at dolor quis odio consequat
19842,Quimm,nschimpkend@diigo.com,+62 988 695 6606,eget tincidunt eget tempus vel pede morbi porttitor lorem id ligula suspendisse ornare consequat lectus in est risus auctor sed tristique in tempus
19843,Riffpath,mjeppensenne@cargocollective.com,+27 593 590 8668,et tempus semper est quam pharetra magna ac consequat metus sapien ut nunc vestibulum ante ipsum primis
19844,Jaxnation,gmaccreanf@digg.com,+86 440 651 6140,bibendum imperdiet nullam orci pede venenatis non
19845,Einti,lhadcroftng@walmart.com,+237 636 393 6170,aliquam sit amet diam in
19846,Linklinks,qcrambnh@sohu.com,+81 623 961 2336,fusce consequat nulla nisl nunc nisl duis bibendum felis sed interdum venenatis turpis enim
19847,Riffwire,gromushkinni@symantec.com,+45 377 912 1190,hac habitasse platea dictumst maecenas
19848,Skaboo,dstylenj@geocities.com,+48 467 800 8722,cum sociis natoque penatibus et magnis dis parturient montes nascetur ridiculus mus vivamus
19849,Skyba,aseillernk@reuters.com,+380 278 659 3873,vestibulum sit amet cursus id turpis integer aliquet massa id lobortis convallis tortor risus
19850,Katz,jgorlingnl@booking.com,+1 119 254 2288,nibh fusce lacus purus aliquet at feugiat non pretium quis lectus suspendisse potenti in eleifend quam
19851,Voonte,ksleathnm@bluehost.com,+1 581 993 4725,curae mauris viverra diam vitae quam suspendisse potenti nullam porttitor lacus at turpis
19852,Miboo,kblighnn@bloglines.com,+1 418 506 9899,molestie nibh in lectus pellentesque at nulla
19853,Skinte,bkemmonsno@auda.org.au,+48 319 449 3813,consectetuer adipiscing elit proin risus praesent lectus vestibulum quam sapien varius ut blandit non interdum in ante vestibulum ante ipsum primis in
19854,Dynabox,lsantacrolenp@slashdot.org,+48 948 992 9368,ac est lacinia nisi venenatis
19855,Ntag,tmitrovicnq@furl.net,+86 785 734 6591,faucibus orci luctus et ultrices
19856,Wikivu,abackshellnr@europa.eu,+63 284 908 2596,at nibh in hac habitasse platea dictumst aliquam augue quam sollicitudin vitae consectetuer
19857,Avavee,bbennittns@networksolutions.com,+20 547 369 3955,eu est congue elementum in hac habitasse platea dictumst morbi vestibulum velit id pretium iaculis diam erat fermentum justo nec condimentum neque sapien placerat ante
19858,Yodel,hkondrachenkont@facebook.com,+62 625 599 2865,nulla tellus in sagittis dui vel
19859,Photolist,gpengilleynu@twitter.com,+52 115 769 4103,nulla tellus in sagittis dui
19860,Camido,gmacconchienv@so-net.ne.jp,+1 814 351 1920,rhoncus dui vel sem sed sagittis
19861,Skibox,bwymannw@parallels.com,+86 360 373 1652,nulla sed vel enim sit amet nunc viverra dapibus nulla suscipit ligula in lacus curabitur at ipsum ac tellus semper interdum mauris ullamcorper
19862,Zoomlounge,calwennx@sourceforge.net,+55 513 232 7724,nullam molestie nibh in lectus pellentesque at nulla suspendisse potenti cras in purus eu magna vulputate luctus cum
19863,Abatz,rargileny@tmall.com,+33 702 879 7421,vel pede morbi porttitor lorem id ligula suspendisse
19864,Youspan,rgounardnz@mysql.com,+52 827 321 6523,ultrices libero non mattis pulvinar nulla pede ullamcorper augue a suscipit nulla elit ac
19865,Ailane,bvynollo0@cbc.ca,+351 522 701 7102,tincidunt eget tempus vel pede morbi porttitor lorem
