SupplierID,SupplierName,SupplierEmail,SupplierPhone,SupplierDescription
5639,Oloo,ecoffelt9k@infoseek.co.jp,+380 167 101 3932,convallis duis consequat dui nec nisi volutpat eleifend donec ut dolor morbi vel lectus in quam fringilla rhoncus mauris enim
5664,Voonte,prandlesome9l@epa.gov,+62 775 509 9400,luctus et ultrices posuere cubilia curae donec pharetra magna vestibulum aliquet ultrices erat tortor sollicitudin mi sit amet lobortis sapien
5869,Rhynoodle,kbracco9m@blogger.com,+62 128 259 8394,in tempus sit amet sem fusce consequat nulla nisl nunc nisl
5812,Oyonder,csymondson9n@auda.org.au,+420 978 254 1959,sollicitudin mi sit amet lobortis sapien sapien non mi integer ac neque duis bibendum morbi non quam nec dui luctus rutrum nulla
5548,Yamia,rkelshaw9o@istockphoto.com,+62 967 562 6055,fusce consequat nulla nisl nunc nisl duis bibendum felis sed interdum venenatis turpis enim blandit mi in porttitor
6147,Youtags,lhuyton9p@blogtalkradio.com,+62 151 946 3651,tempus vel pede morbi porttitor lorem id ligula suspendisse ornare consequat lectus in est risus
5336,Roombo,jlyddiard9q@blogspot.com,+591 948 165 2138,maecenas ut massa quis augue luctus tincidunt nulla mollis molestie lorem quisque ut erat curabitur gravida nisi at nibh in hac habitasse platea dictumst aliquam
5467,Flashpoint,rwoodworth9r@g.co,+55 144 949 4275,donec ut mauris eget massa tempor convallis nulla neque libero
5564,Vinte,fstyan9s@plala.or.jp,+351 255 845 6909,dapibus augue vel accumsan tellus nisi eu orci mauris lacinia sapien quis libero nullam
5297,Twitterbridge,astandingford9t@elegantthemes.com,+387 319 371 0462,odio consequat varius integer ac leo pellentesque ultrices mattis
5364,Gabtune,dbantham9u@163.com,+355 480 581 6844,consequat dui nec nisi volutpat eleifend donec ut dolor morbi vel lectus in quam fringilla rhoncus mauris enim leo rhoncus sed
6087,Yata,jrawe9v@behance.net,+86 683 198 5496,luctus ultricies eu nibh quisque id justo sit amet sapien dignissim vestibulum vestibulum ante ipsum primis in faucibus orci luctus et ultrices posuere
5645,Twitterworks,bedden9w@vimeo.com,+992 283 223 4008,augue vestibulum rutrum rutrum neque aenean auctor gravida sem praesent id massa
5179,Jetpulse,rcammis9x@irs.gov,+86 519 908 3539,fusce lacus purus aliquet at feugiat non pretium quis lectus suspendisse potenti in eleifend quam a odio in
5984,Eamia,abitchener9y@ox.ac.uk,+234 813 891 5157,eleifend pede libero quis orci nullam molestie nibh in lectus pellentesque at nulla suspendisse potenti cras in purus eu magna vulputate luctus cum sociis
5995,Dynabox,wriha9z@spotify.com,+976 467 898 9043,ut volutpat sapien arcu sed augue aliquam erat volutpat in congue etiam justo etiam pretium iaculis justo
6006,Kanoodle,disaqa0@themeforest.net,+62 334 295 8153,mauris eget massa tempor convallis nulla neque libero convallis eget eleifend luctus ultricies eu nibh quisque id
5821,Vinte,umaylarda1@bigcartel.com,+850 174 937 8609,adipiscing lorem vitae mattis nibh
6000,Lazz,nmassota2@hubpages.com,+967 924 516 8668,eleifend donec ut dolor morbi vel
6375,Edgeify,sgoulbourna3@nba.com,+33 319 774 3650,cum sociis natoque penatibus et magnis dis parturient montes nascetur ridiculus mus vivamus vestibulum sagittis sapien cum sociis natoque
6103,Zoomlounge,vwattinga4@cmu.edu,+86 212 437 9953,volutpat convallis morbi odio odio elementum eu interdum eu tincidunt in leo maecenas pulvinar lobortis est phasellus sit
5418,Realbridge,cbynerta5@ucoz.ru,+86 593 617 4007,pharetra magna ac consequat metus sapien ut nunc vestibulum ante ipsum primis in faucibus
5412,Yata,bblackera6@merriam-webster.com,+62 418 592 8687,mi in porttitor pede justo eu massa donec dapibus duis at velit eu est congue elementum in hac habitasse platea dictumst morbi vestibulum velit id
5207,Rhybox,fcoggera7@cloudflare.com,+53 477 261 9215,hac habitasse platea dictumst aliquam augue quam sollicitudin vitae consectetuer eget rutrum
6122,Rhynoodle,kspencelayha8@deliciousdays.com,+44 637 601 9725,egestas metus aenean fermentum donec ut mauris eget massa
5921,Skalith,kstockdalea9@jalbum.net,+86 766 667 6707,tristique est et tempus semper est quam pharetra magna ac consequat metus sapien
6076,Skivee,aiskovaa@nytimes.com,+33 222 270 0398,nec dui luctus rutrum nulla tellus in sagittis dui vel
5456,Divanoodle,vcoreab@virginia.edu,+62 659 233 8413,ultrices phasellus id sapien in sapien iaculis congue vivamus
5529,Minyx,emalinowskiac@imgur.com,+351 356 569 0030,congue diam id ornare imperdiet sapien urna pretium
5358,Meemm,gmariollead@arizona.edu,+33 297 573 4135,turpis nec euismod scelerisque quam turpis adipiscing lorem vitae mattis nibh
6034,Reallinks,rthomasonae@google.co.jp,+420 934 354 7615,justo pellentesque viverra pede ac
5639,Skibox,ghenighanaf@scientificamerican.com,+7 823 824 3654,non velit donec diam neque vestibulum eget vulputate ut ultrices vel augue vestibulum ante ipsum primis in faucibus
6380,Tazzy,eizakovag@storify.com,+48 281 902 6162,luctus rutrum nulla tellus in sagittis dui vel nisl duis ac nibh fusce
5526,Lajo,jsiberryah@theatlantic.com,+53 612 631 2308,nunc nisl duis bibendum felis sed interdum venenatis turpis enim blandit mi in porttitor pede justo eu massa donec dapibus duis at
5866,Dynabox,sshevelsai@google.com.br,+30 968 378 3581,a pede posuere nonummy integer non velit donec diam neque vestibulum eget vulputate ut ultrices vel augue vestibulum ante ipsum primis in faucibus orci
6413,Photojam,ksnodinaj@dagondesign.com,+1 989 539 3254,blandit ultrices enim lorem ipsum dolor sit amet consectetuer adipiscing
5135,Vinte,pchristescuak@google.pl,+1 888 873 4404,turpis a pede posuere nonummy integer non velit donec diam neque vestibulum eget vulputate
5522,Photobean,agarlingal@cnbc.com,+93 807 958 9146,aliquam sit amet diam in magna bibendum
6259,Vitz,fcorream@flavors.me,+351 517 135 7993,ligula sit amet eleifend pede libero quis
5286,Zooxo,rmarzellean@freewebs.com,+86 932 887 8926,duis faucibus accumsan odio curabitur
5592,Zoombox,astaceao@jiathis.com,+66 652 594 7899,vel augue vestibulum ante ipsum primis in faucibus orci luctus
5635,Devpulse,htriggelap@1und1.de,+55 277 464 5998,quis orci nullam molestie nibh in lectus pellentesque at nulla suspendisse potenti cras in purus
6201,Reallinks,dallgoodaq@whitehouse.gov,+55 234 951 5768,pellentesque quisque porta volutpat erat quisque erat eros viverra eget congue eget semper rutrum nulla nunc purus phasellus in felis donec
5915,Cogilith,swallmanar@economist.com,+62 729 718 3990,elementum ligula vehicula consequat morbi a ipsum integer a nibh in quis justo maecenas rhoncus
6389,Leexo,dbourhillas@hhs.gov,+33 743 324 7445,donec vitae nisi nam ultrices libero non mattis pulvinar nulla
5436,Eare,rpadburyat@hc360.com,+7 159 442 9593,sed accumsan felis ut at
5357,Demimbu,omereweatherau@intel.com,+352 516 493 5287,eget orci vehicula condimentum curabitur
6352,Flashset,gbessellav@woothemes.com,+86 533 872 7230,nec dui luctus rutrum nulla tellus in sagittis dui vel nisl duis ac nibh fusce lacus purus aliquet
6117,Podcat,igillmoraw@creativecommons.org,+55 543 465 6052,tellus in sagittis dui vel nisl duis
5773,Dynava,bkornyakovax@cam.ac.uk,+420 463 440 8773,justo in blandit ultrices enim lorem ipsum dolor sit amet consectetuer adipiscing elit proin interdum mauris non ligula pellentesque
6466,Lazz,ekroinay@tumblr.com,+224 688 369 2904,enim sit amet nunc viverra dapibus nulla suscipit ligula in lacus curabitur at ipsum ac
5440,Quatz,ckapiloffaz@multiply.com,+60 308 347 3706,viverra diam vitae quam suspendisse potenti nullam porttitor lacus at turpis
5564,Feedbug,tgoveb0@e-recht24.de,+387 614 338 5750,donec quis orci eget orci vehicula condimentum curabitur
6273,Flashspan,hperratb1@skyrock.com,+86 871 428 2224,vel sem sed sagittis nam congue risus semper porta volutpat quam pede lobortis ligula sit
5208,Fanoodle,kwoodrowb2@vk.com,+33 467 535 1955,convallis morbi odio odio elementum eu interdum eu tincidunt in leo maecenas pulvinar lobortis est phasellus sit amet erat nulla tempus
5569,Gabtune,hportchb3@uol.com.br,+57 973 163 8465,ut nulla sed accumsan felis ut at dolor quis odio consequat varius integer ac
6417,Flashpoint,heathorneb4@istockphoto.com,+265 250 603 5351,orci luctus et ultrices posuere
5095,Fivechat,emcmeylerb5@diigo.com,+51 339 655 2474,lacus curabitur at ipsum ac tellus semper interdum mauris ullamcorper purus sit amet nulla quisque
5824,Jetwire,alarozeb6@google.fr,+66 633 934 3748,tellus nisi eu orci mauris lacinia sapien quis libero nullam sit amet turpis elementum ligula vehicula
6174,Ailane,wcolerickb7@marriott.com,+86 953 365 7932,maecenas pulvinar lobortis est phasellus sit amet erat nulla tempus vivamus
5204,Voonte,pgenningsb8@gravatar.com,+886 772 352 4392,integer pede justo lacinia eget
5463,Voonix,nklimshukb9@irs.gov,+62 753 397 8871,orci pede venenatis non sodales sed tincidunt eu felis fusce
6290,Youfeed,bworldba@furl.net,+55 773 862 7010,nibh fusce lacus purus aliquet at feugiat non pretium quis lectus suspendisse potenti in eleifend quam
5442,Devify,bgraftonherbertbb@samsung.com,+420 981 205 4984,consequat metus sapien ut nunc vestibulum ante ipsum primis in faucibus orci
6043,Kazio,isloybc@buzzfeed.com,+62 524 499 1381,vel nisl duis ac nibh fusce lacus purus aliquet at feugiat non pretium
5695,Voolia,cbartsbd@123-reg.co.uk,+62 748 477 3788,vestibulum ante ipsum primis in faucibus orci luctus et ultrices posuere cubilia curae mauris viverra diam vitae quam suspendisse potenti nullam porttitor
5524,Kwimbee,nargilebe@multiply.com,+55 648 212 6802,velit eu est congue elementum in hac habitasse platea dictumst morbi vestibulum velit id pretium iaculis diam erat fermentum justo
5750,Oyondu,gscreetonbf@blog.com,+66 962 776 5661,pede ullamcorper augue a suscipit nulla elit ac nulla sed vel enim sit amet nunc viverra dapibus nulla suscipit ligula in
5010,Mynte,ccavalierbg@facebook.com,+54 628 245 3937,vulputate justo in blandit ultrices enim lorem ipsum
5452,Bluezoom,lshirlandbh@cbsnews.com,+1 570 511 8232,etiam vel augue vestibulum rutrum rutrum neque
5094,Photofeed,ogeibelbi@cbc.ca,+86 756 172 0947,ridiculus mus etiam vel augue vestibulum rutrum rutrum
5441,Skippad,cadamobj@jugem.jp,+54 476 930 4517,eu mi nulla ac enim in tempor turpis nec euismod scelerisque quam
5904,Livefish,tbinesbk@sfgate.com,+1 626 648 4335,libero ut massa volutpat convallis
5719,Youspan,kpennigarbl@dot.gov,+62 642 442 4497,nisl venenatis lacinia aenean sit
6037,Realbridge,kmckennanbm@msn.com,+86 724 298 0075,cursus urna ut tellus nulla ut erat id mauris vulputate elementum nullam varius
5508,Chatterbridge,rrawnsleybn@hhs.gov,+356 715 628 3151,lectus vestibulum quam sapien varius ut blandit non interdum in ante vestibulum ante ipsum primis in faucibus orci luctus et ultrices posuere cubilia curae duis
5249,Jazzy,slackingtonbo@ucla.edu,+48 853 735 4982,faucibus cursus urna ut tellus
5326,Tagopia,bstonebanksbp@skyrock.com,+86 197 458 0306,lectus aliquam sit amet diam in magna bibendum imperdiet nullam orci pede venenatis non sodales sed tincidunt eu felis fusce posuere felis sed lacus morbi
5158,Trudoo,cbertelsenbq@irs.gov,+63 409 773 3679,vulputate ut ultrices vel augue vestibulum ante ipsum primis in faucibus orci luctus et ultrices posuere cubilia curae donec pharetra
5009,Devpulse,thummbr@dagondesign.com,+359 173 946 1052,convallis tortor risus dapibus augue vel accumsan tellus nisi eu orci mauris lacinia sapien quis libero nullam sit amet
6144,Mycat,pbingellbs@webnode.com,+387 537 679 9782,id ornare imperdiet sapien urna pretium nisl ut volutpat sapien arcu sed augue aliquam erat volutpat in
5093,Zoovu,adebischopbt@yale.edu,+86 617 663 4901,porttitor id consequat in consequat ut nulla
5363,Babblestorm,apatchingbu@gmpg.org,+81 876 849 4851,eu orci mauris lacinia sapien quis libero nullam sit amet turpis elementum ligula vehicula consequat morbi a ipsum integer
5615,Minyx,mbrysonbv@telegraph.co.uk,+33 271 528 0114,eleifend pede libero quis orci nullam molestie nibh in lectus pellentesque at nulla suspendisse potenti cras in purus eu magna vulputate luctus
6254,Realblab,cwarbybw@cbsnews.com,+351 530 249 0640,ligula in lacus curabitur at
6073,Fadeo,jdufferbx@spiegel.de,+593 997 463 1184,nisi vulputate nonummy maecenas tincidunt lacus at velit vivamus vel nulla eget eros elementum pellentesque quisque porta volutpat erat quisque erat
5966,Zooveo,tlettuceby@t-online.de,+55 823 315 6712,ante ipsum primis in faucibus orci luctus et ultrices posuere cubilia curae donec pharetra magna vestibulum aliquet ultrices erat
5600,Dablist,ffeldheimbz@github.io,+998 449 702 4639,erat vestibulum sed magna at nunc commodo placerat praesent blandit nam nulla integer pede justo lacinia eget tincidunt eget tempus vel pede morbi porttitor
6399,Fivebridge,eguessc0@histats.com,+998 767 328 0162,tristique in tempus sit amet sem fusce consequat nulla nisl nunc nisl duis bibendum felis sed
5410,Brainlounge,clindberghc1@ycombinator.com,+63 988 305 6009,pede ac diam cras pellentesque volutpat dui maecenas tristique est
6312,Meevee,rsibbetc2@spotify.com,+86 587 151 6870,donec pharetra magna vestibulum aliquet ultrices erat tortor sollicitudin mi sit amet lobortis sapien
5742,Muxo,aibbotsonc3@unesco.org,+33 490 981 8913,fusce consequat nulla nisl nunc nisl duis bibendum felis
6365,Avavee,jprocterc4@yahoo.com,+383 658 430 4164,duis bibendum morbi non quam nec dui luctus rutrum nulla tellus in sagittis dui vel nisl duis ac nibh fusce lacus
5677,Blogspan,blyddiardc5@reuters.com,+57 311 954 2780,ipsum praesent blandit lacinia erat vestibulum sed magna at nunc commodo placerat praesent blandit nam nulla
5610,Flipstorm,ssmoutenc6@freewebs.com,+62 995 299 5153,interdum in ante vestibulum ante ipsum primis in faucibus orci luctus et ultrices posuere cubilia curae duis faucibus accumsan odio curabitur convallis duis consequat
5457,Photofeed,rgascarc7@delicious.com,+86 914 751 1225,et ultrices posuere cubilia curae nulla dapibus dolor vel est donec odio justo sollicitudin ut
6220,Trilith,bfolcac8@vimeo.com,+86 503 330 8446,pede libero quis orci nullam molestie nibh in lectus pellentesque at nulla suspendisse potenti cras in purus
6182,Twitterbridge,gendersbyc9@chronoengine.com,+86 653 596 5155,quisque porta volutpat erat quisque erat eros viverra eget congue eget semper rutrum
6320,Midel,jcastagnaroca@squidoo.com,+234 240 784 1641,risus praesent lectus vestibulum quam sapien varius ut blandit non interdum in ante vestibulum ante ipsum primis in
6175,Tazzy,amcgoogancb@usnews.com,+86 762 202 4033,in faucibus orci luctus et ultrices posuere cubilia
6152,Divanoodle,hspringthorpcc@shutterfly.com,+965 226 885 0986,odio in hac habitasse platea dictumst maecenas ut massa quis augue luctus tincidunt nulla mollis molestie lorem quisque ut erat curabitur gravida nisi at
6455,Skalith,kmaddafordcd@deviantart.com,+375 664 530 7504,dictumst maecenas ut massa quis augue luctus tincidunt
5837,Skyble,khundleyce@patch.com,+1 916 359 2952,sed vestibulum sit amet cursus id turpis integer aliquet massa id lobortis convallis tortor risus dapibus augue vel accumsan tellus nisi
6197,Einti,twhitleycf@wikispaces.com,+62 585 711 9608,libero non mattis pulvinar nulla pede ullamcorper augue a suscipit nulla elit ac nulla sed vel enim sit amet
5472,Yakitri,dbachelliercg@i2i.jp,+86 764 969 3049,morbi vestibulum velit id pretium iaculis diam erat fermentum justo nec condimentum neque sapien placerat ante nulla justo aliquam quis turpis eget elit sodales scelerisque
5636,Wordtune,brubrach@newsvine.com,+962 510 181 4218,magnis dis parturient montes nascetur ridiculus mus etiam vel augue vestibulum rutrum rutrum neque aenean
6445,Quinu,fbettertonci@nhs.uk,+7 639 257 7674,orci eget orci vehicula condimentum curabitur in libero ut massa volutpat convallis morbi odio odio elementum eu interdum eu tincidunt
5194,Livefish,pdarragoncj@huffingtonpost.com,+1 221 800 7827,elementum eu interdum eu tincidunt in leo maecenas pulvinar lobortis est
5289,Geba,arozetck@businessweek.com,+255 905 934 7765,ligula suspendisse ornare consequat lectus in est risus auctor sed tristique
5928,Rooxo,mmockettcl@360.cn,+63 758 935 8354,nam dui proin leo odio porttitor id consequat in consequat ut nulla sed accumsan felis ut at dolor quis odio consequat
6297,Jamia,dphlippsencm@mozilla.com,+7 156 310 2265,adipiscing elit proin interdum mauris
5176,Skajo,haloshikincn@diigo.com,+63 934 757 4276,sed magna at nunc commodo placerat praesent blandit nam nulla integer pede justo lacinia eget tincidunt eget tempus
5004,Gigaclub,fmabbsco@prweb.com,+86 740 329 6677,rhoncus aliquam lacus morbi quis tortor id nulla ultrices aliquet maecenas leo odio condimentum id luctus nec molestie sed justo pellentesque viverra pede ac
6037,JumpXS,bjackecp@yale.edu,+47 305 585 5702,eros elementum pellentesque quisque porta volutpat erat quisque erat eros viverra eget
5211,Riffpath,lbutencq@squidoo.com,+84 654 698 5501,non interdum in ante vestibulum ante ipsum primis in faucibus orci luctus et ultrices posuere
5866,Muxo,rdeppencr@soup.io,+374 961 302 9576,duis consequat dui nec nisi
5029,Gigashots,clahrscs@cafepress.com,+86 571 439 5401,nam ultrices libero non mattis pulvinar nulla pede ullamcorper augue a suscipit nulla elit ac nulla sed vel enim sit
6296,Yadel,ffaithfullct@house.gov,+92 212 955 4255,orci eget orci vehicula condimentum curabitur in libero
5985,Photolist,gbabstcu@hhs.gov,+7 592 286 1423,nam congue risus semper porta
5889,Realcube,psimchenkocv@prlog.org,+81 993 660 3821,posuere cubilia curae mauris viverra diam vitae quam suspendisse
6347,Buzzdog,hwelshcw@npr.org,+66 949 267 3085,parturient montes nascetur ridiculus mus etiam vel augue vestibulum rutrum rutrum neque aenean
5809,Eimbee,spepallcx@army.mil,+55 116 527 9972,nibh in lectus pellentesque at nulla suspendisse potenti cras in purus eu magna vulputate luctus cum sociis natoque penatibus et magnis dis parturient montes nascetur
6167,Flashspan,mgollingcy@va.gov,+86 916 765 0814,potenti in eleifend quam a odio in hac habitasse platea dictumst maecenas ut massa quis augue luctus tincidunt
5004,LiveZ,lkuschelcz@microsoft.com,+86 254 467 1474,nec molestie sed justo pellentesque viverra pede ac diam cras
5632,Skinix,arootd0@blogger.com,+33 318 806 0017,platea dictumst aliquam augue quam sollicitudin vitae consectetuer eget rutrum at lorem integer tincidunt
6439,Kaymbo,rgluyasd1@i2i.jp,+7 283 534 8748,nunc purus phasellus in felis donec semper sapien a libero nam dui proin leo odio porttitor id consequat in consequat
5593,Shufflebeat,mbenneyworthd2@histats.com,+62 376 727 1090,vestibulum ante ipsum primis in faucibus orci
5433,Linkbridge,acalcuttd3@bloomberg.com,+33 505 103 8556,ligula vehicula consequat morbi a ipsum integer a nibh in quis
5510,Avaveo,lbebisd4@dailymotion.com,+86 888 262 6126,elementum ligula vehicula consequat morbi a ipsum integer a nibh in quis
6306,Meetz,amucklowd5@goo.gl,+55 146 291 2470,tristique est et tempus semper est
6473,Livetube,mknilld6@boston.com,+86 115 665 2989,pede justo lacinia eget tincidunt eget tempus
5394,Topdrive,rshaftod7@biglobe.ne.jp,+48 954 454 5858,rhoncus aliquet pulvinar sed nisl
5807,Edgepulse,mgaleyd8@intel.com,+62 952 411 3689,eleifend quam a odio in
5591,Babbleblab,dcroughand9@youku.com,+255 439 921 4327,justo pellentesque viverra pede ac diam cras pellentesque volutpat dui maecenas tristique est et tempus semper est quam pharetra
5907,Eamia,thailda@surveymonkey.com,+82 529 563 1822,id pretium iaculis diam erat fermentum justo nec condimentum neque sapien placerat ante nulla justo aliquam quis turpis eget elit sodales scelerisque mauris
6107,Brightdog,ibrokenshawdb@nationalgeographic.com,+34 687 201 8544,hac habitasse platea dictumst maecenas ut massa quis augue luctus tincidunt nulla mollis molestie lorem quisque ut erat curabitur gravida nisi
5913,Leenti,rizendc@fc2.com,+380 471 749 8802,dis parturient montes nascetur ridiculus mus vivamus vestibulum sagittis sapien cum sociis natoque penatibus et magnis dis parturient
5321,Aibox,lburrilldd@symantec.com,+63 207 864 9635,ac est lacinia nisi venenatis tristique fusce congue diam id ornare imperdiet sapien
6326,Photojam,aginnellyde@issuu.com,+86 789 587 1759,facilisi cras non velit nec nisi vulputate
5229,Avamm,aaddekindf@wordpress.com,+48 258 997 2017,aliquam non mauris morbi non lectus aliquam sit amet diam in magna bibendum imperdiet nullam orci pede venenatis non sodales sed tincidunt
6341,Fivechat,oguitondg@prnewswire.com,+970 578 343 5031,vel pede morbi porttitor lorem id ligula suspendisse ornare consequat lectus in est risus auctor sed tristique in tempus sit amet sem
5382,Mynte,iallebonedh@odnoklassniki.ru,+36 204 663 8317,id massa id nisl venenatis lacinia aenean sit amet justo morbi ut odio cras mi pede malesuada in imperdiet et commodo
5031,Mudo,cjusticedi@nih.gov,+62 114 734 0005,ultrices mattis odio donec vitae nisi nam ultrices libero non mattis pulvinar nulla pede ullamcorper augue a suscipit nulla elit ac nulla
5301,Centimia,hmcinnerydj@photobucket.com,+86 692 801 5093,congue etiam justo etiam pretium iaculis justo in hac habitasse platea dictumst etiam faucibus
5179,Realcube,malbasinydk@adobe.com,+86 977 180 6885,dapibus nulla suscipit ligula in lacus curabitur at ipsum ac tellus semper interdum mauris ullamcorper purus sit amet nulla quisque arcu libero rutrum
5773,Dynabox,lwodhamdl@mlb.com,+385 703 142 6360,lectus suspendisse potenti in eleifend quam a odio in hac habitasse platea dictumst maecenas ut massa quis augue luctus tincidunt nulla mollis
6280,Yata,wmitforddm@google.cn,+48 957 828 5590,amet sem fusce consequat nulla nisl nunc nisl duis bibendum
6432,Mydo,aprowsedn@lulu.com,+351 455 298 5794,diam in magna bibendum imperdiet nullam orci pede venenatis non sodales sed tincidunt eu felis fusce posuere felis sed lacus
5009,Oyoba,rshrievesdo@craigslist.org,+380 810 307 7640,augue aliquam erat volutpat in congue etiam justo etiam pretium iaculis justo in hac habitasse platea dictumst etiam faucibus
5126,Photobug,rmaffuccidp@behance.net,+86 806 995 2607,nec nisi vulputate nonummy maecenas tincidunt lacus
6486,LiveZ,rvennarddq@tamu.edu,+82 466 166 9892,vivamus in felis eu sapien cursus vestibulum proin eu
5271,Kanoodle,afranckedr@go.com,+7 897 281 7575,integer aliquet massa id lobortis convallis tortor risus dapibus augue vel accumsan tellus nisi eu orci mauris
5629,Skinder,sdavenellds@nyu.edu,+7 433 995 0379,mus etiam vel augue vestibulum rutrum
5691,Chatterpoint,tvasicdt@sohu.com,+82 676 242 9735,eget eros elementum pellentesque quisque porta volutpat erat
5813,Oloo,lquinceydu@gravatar.com,+86 693 865 3154,posuere cubilia curae mauris viverra diam vitae quam suspendisse potenti nullam porttitor lacus at turpis
5877,Thoughtbeat,hcundeydv@paginegialle.it,+351 935 362 8290,duis mattis egestas metus aenean fermentum donec ut mauris eget massa tempor
5967,Lajo,treedyhoughdw@123-reg.co.uk,+86 707 491 4805,ac tellus semper interdum mauris ullamcorper purus sit amet nulla quisque arcu libero rutrum ac lobortis vel dapibus at
6192,Trudoo,dpounderdx@goo.ne.jp,+86 528 778 8214,augue luctus tincidunt nulla mollis molestie
5364,Flashdog,hcundydy@purevolume.com,+48 735 621 4307,luctus et ultrices posuere cubilia curae donec pharetra magna vestibulum aliquet ultrices erat tortor sollicitudin mi sit amet lobortis sapien sapien non mi
6317,Topiclounge,wmorettodz@nytimes.com,+63 638 597 1715,tempor convallis nulla neque libero
5454,Twitterbridge,ddunseathe0@answers.com,+57 736 711 2402,pharetra magna ac consequat metus sapien ut nunc vestibulum ante ipsum primis in faucibus
5290,Skipstorm,bgainsburghe1@bloglines.com,+7 638 589 5251,phasellus sit amet erat nulla tempus vivamus in felis eu sapien cursus vestibulum proin eu mi nulla ac enim in tempor turpis
5302,Twitterbridge,bhunee2@t.co,+351 219 732 5119,consequat metus sapien ut nunc vestibulum ante ipsum
6202,Tagtune,lcoolinge3@usgs.gov,+229 533 355 1534,odio curabitur convallis duis consequat dui nec nisi volutpat eleifend donec ut dolor morbi
5008,Meemm,rklimpkee4@istockphoto.com,+94 969 131 9738,accumsan odio curabitur convallis duis consequat dui nec nisi volutpat eleifend donec ut dolor morbi vel lectus in quam fringilla rhoncus mauris enim
5610,Kazu,rstrittone5@smugmug.com,+7 642 266 5970,nonummy integer non velit donec diam neque vestibulum eget vulputate ut ultrices vel augue vestibulum
5644,Bluejam,rflecknelle6@chronoengine.com,+86 200 243 3612,ultrices posuere cubilia curae nulla dapibus dolor vel est donec odio justo sollicitudin
5921,Jayo,fdeethe7@accuweather.com,+358 899 441 1076,eros elementum pellentesque quisque porta volutpat erat quisque erat eros viverra eget congue eget semper rutrum nulla nunc purus
5397,Katz,lscuttere8@opera.com,+86 649 122 4509,est risus auctor sed tristique in tempus sit amet sem fusce consequat nulla nisl nunc
6169,Tagpad,ebaxe9@purevolume.com,+226 835 248 9135,amet lobortis sapien sapien non mi
5340,Centimia,hheugelea@umn.edu,+7 952 991 2956,nascetur ridiculus mus vivamus vestibulum sagittis sapien cum sociis natoque penatibus et magnis dis parturient montes nascetur ridiculus mus
6163,Twitterbridge,nphizackarleyeb@stumbleupon.com,+976 684 532 0226,justo pellentesque viverra pede ac diam cras pellentesque volutpat
5836,Yombu,sjenceyec@cpanel.net,+86 673 409 3387,in consequat ut nulla sed accumsan felis
6209,Yabox,fstidworthyed@wordpress.com,+1 403 515 3265,erat fermentum justo nec condimentum neque sapien placerat ante nulla justo aliquam quis turpis eget elit sodales scelerisque mauris sit amet eros suspendisse accumsan tortor
5920,Skivee,rklaassensee@zdnet.com,+62 291 802 7728,nulla neque libero convallis eget
6402,Innojam,jlakeref@sina.com.cn,+81 815 729 6948,non velit donec diam neque vestibulum eget vulputate ut ultrices vel
5681,Fiveclub,dgrigorescueg@skype.com,+7 194 283 4708,pellentesque ultrices phasellus id sapien in sapien iaculis congue vivamus metus arcu adipiscing molestie hendrerit
6185,Tavu,scawseeh@buzzfeed.com,+389 684 170 9305,in tempus sit amet sem fusce consequat
