SupplierID,SupplierName,SupplierEmail,SupplierPhone,SupplierDescription
14832,Ntag,itreat96@wired.com,+86 795 806 9886,nibh ligula nec sem duis aliquam convallis nunc proin at turpis a pede posuere nonummy integer non velit donec diam neque vestibulum
14030,Latz,maumerle97@ow.ly,+62 527 612 6116,ut volutpat sapien arcu sed augue aliquam erat volutpat in congue etiam justo etiam pretium iaculis justo in hac habitasse platea dictumst etiam faucibus cursus
13903,Tanoodle,jgilluley98@sphinn.com,+86 691 173 4917,sapien non mi integer ac neque duis bibendum morbi non quam nec dui
14260,Cogidoo,cricold99@furl.net,+47 973 924 6280,diam cras pellentesque volutpat dui maecenas tristique est
13949,Wordpedia,rmowett9a@webmd.com,+86 206 890 7896,ullamcorper purus sit amet nulla quisque arcu libero rutrum ac lobortis vel dapibus
14168,Skajo,kciubutaro9b@twitpic.com,+63 733 190 5746,quam sollicitudin vitae consectetuer eget rutrum at lorem integer tincidunt ante vel ipsum praesent blandit lacinia erat vestibulum sed magna at nunc
14321,Kamba,ccarneck9c@netlog.com,+389 455 762 4260,fusce lacus purus aliquet at feugiat non pretium quis lectus suspendisse potenti in eleifend quam a odio in hac habitasse platea dictumst
13924,Jaxspan,jfrarey9d@flavors.me,+7 837 399 1722,ut massa quis augue luctus tincidunt nulla mollis molestie
14924,Avavee,nserrels9e@yahoo.com,+51 375 196 1876,quam turpis adipiscing lorem vitae mattis nibh ligula nec sem duis aliquam convallis nunc proin at turpis a pede posuere nonummy
13966,Divanoodle,dfessions9f@narod.ru,+963 350 734 4875,tincidunt in leo maecenas pulvinar lobortis est phasellus sit amet erat nulla tempus vivamus in felis eu sapien cursus vestibulum proin eu
14797,Mynte,kplait9g@blogger.com,+63 451 868 5491,vestibulum sagittis sapien cum sociis natoque penatibus et magnis dis parturient montes nascetur ridiculus mus etiam vel augue
14008,Edgeblab,mbrewood9h@utexas.edu,+62 464 281 7856,fusce congue diam id ornare imperdiet sapien urna pretium nisl ut volutpat sapien arcu sed augue aliquam erat volutpat in
14951,Avamba,cmcmichan9i@wordpress.org,+54 842 922 4090,vestibulum ante ipsum primis in faucibus orci luctus et ultrices posuere cubilia curae duis faucibus accumsan
14078,Rhycero,jgilders9j@vistaprint.com,+420 119 390 1722,tortor id nulla ultrices aliquet maecenas leo odio
14189,Kimia,mtobias9k@yale.edu,+48 914 834 4663,pede justo lacinia eget tincidunt eget
13928,Youbridge,jdoctor9l@reference.com,+48 950 697 1756,primis in faucibus orci luctus et ultrices posuere cubilia curae mauris viverra diam vitae quam suspendisse potenti
14451,Eidel,plisamore9m@nymag.com,+48 824 516 1983,suspendisse accumsan tortor quis turpis sed ante vivamus tortor duis mattis egestas metus aenean fermentum donec ut mauris eget massa tempor
14241,Zoombeat,orickardsson9n@1und1.de,+48 953 872 8255,tempus semper est quam pharetra magna ac consequat metus sapien
14807,Kwideo,jgaraway9o@hao123.com,+55 833 403 2062,a libero nam dui proin leo odio porttitor id consequat in consequat ut nulla sed accumsan felis ut at dolor quis odio
14468,Linkbuzz,gtant9p@mail.ru,+62 832 263 4677,iaculis diam erat fermentum justo nec condimentum neque sapien placerat ante nulla justo aliquam quis turpis eget elit sodales scelerisque mauris sit amet eros suspendisse
14426,Shuffletag,afilipychev9q@newsvine.com,+509 787 987 4110,nunc vestibulum ante ipsum primis in faucibus orci luctus et ultrices posuere cubilia
14421,Tagtune,qmorey9r@angelfire.com,+351 816 610 5389,nullam orci pede venenatis non sodales
14948,Trupe,tbugdale9s@noaa.gov,+33 422 138 2602,vitae consectetuer eget rutrum at lorem integer tincidunt ante vel ipsum praesent blandit lacinia erat vestibulum sed magna at nunc commodo placerat praesent
14465,Skiba,ccaffery9t@ovh.net,+598 576 407 8325,malesuada in imperdiet et commodo vulputate
14943,Kayveo,wbrooks9u@yellowpages.com,+380 699 926 9635,in hac habitasse platea dictumst maecenas ut massa quis augue luctus tincidunt nulla mollis molestie lorem
14311,Latz,rwakely9v@amazon.de,+33 332 572 9465,amet diam in magna bibendum imperdiet nullam orci pede venenatis non sodales sed tincidunt eu felis
14256,Gigazoom,cmably9w@wikia.com,+593 390 883 3170,dapibus augue vel accumsan tellus nisi eu orci mauris lacinia sapien quis
14816,Divavu,lgerler9x@bravesites.com,+81 970 928 8809,luctus rutrum nulla tellus in sagittis
14007,Ntags,mdallosso9y@g.co,+966 999 661 7701,odio donec vitae nisi nam ultrices libero non mattis pulvinar nulla pede ullamcorper augue a suscipit nulla elit ac nulla sed vel
14047,Flashset,akornas9z@soundcloud.com,+86 870 477 3632,rutrum rutrum neque aenean auctor gravida sem praesent id massa id nisl venenatis lacinia aenean sit amet justo morbi ut odio
14562,Quimba,mgraberta0@shop-pro.jp,+52 296 811 7957,lacus curabitur at ipsum ac tellus semper interdum mauris ullamcorper purus sit amet nulla quisque arcu libero rutrum ac
14359,Divape,zspottswooda1@linkedin.com,+7 245 457 0907,cubilia curae nulla dapibus dolor vel est donec odio justo sollicitudin ut suscipit a feugiat et eros vestibulum ac est
14912,Kwinu,bbaldacka2@google.com.br,+62 786 242 6631,proin at turpis a pede posuere nonummy integer non velit donec diam neque vestibulum eget vulputate
13944,Devpulse,sboolera3@wufoo.com,+44 453 961 4944,pellentesque volutpat dui maecenas tristique est et tempus semper est quam pharetra magna ac consequat metus sapien
14752,Oyoloo,wdomaschkea4@weibo.com,+591 240 774 8093,in sapien iaculis congue vivamus metus arcu adipiscing molestie hendrerit at
13965,Buzzster,adrona5@google.de,+504 446 561 0941,ante vel ipsum praesent blandit
13939,Topicshots,jbecketa6@google.nl,+54 548 829 2059,mauris non ligula pellentesque ultrices
14553,Feedmix,ddrevera7@tinypic.com,+7 545 915 2297,amet eleifend pede libero quis orci nullam molestie nibh in lectus pellentesque at nulla suspendisse
14637,Riffwire,cbausmanna8@si.edu,+51 595 700 5543,sollicitudin ut suscipit a feugiat et eros vestibulum ac est lacinia nisi venenatis tristique fusce congue diam id ornare imperdiet sapien urna pretium nisl
14489,Photofeed,jboyacka9@shop-pro.jp,+86 320 127 9295,quam nec dui luctus rutrum nulla tellus in sagittis
14753,Rhynoodle,acysonaa@forbes.com,+86 648 901 0040,elementum nullam varius nulla facilisi cras non velit nec nisi vulputate nonummy maecenas tincidunt lacus at velit vivamus vel nulla eget eros elementum pellentesque
14652,Gigabox,rmaciverab@wikipedia.org,+46 954 898 7327,condimentum curabitur in libero ut massa volutpat convallis morbi
14138,Fanoodle,adixceyac@wisc.edu,+48 195 202 2713,sem fusce consequat nulla nisl nunc nisl duis bibendum felis sed interdum venenatis turpis enim blandit mi in porttitor pede
14724,Topiczoom,cevequead@hp.com,+7 422 989 6506,eget eleifend luctus ultricies eu nibh quisque id
14539,Zoomzone,achaneyae@dailymotion.com,+63 675 307 2997,rhoncus mauris enim leo rhoncus sed vestibulum sit amet cursus id turpis integer aliquet massa id lobortis convallis tortor
14974,Skynoodle,tdisleeaf@princeton.edu,+86 652 635 3127,quam pede lobortis ligula sit amet eleifend pede libero
14185,Zoozzy,rzamoranoag@cocolog-nifty.com,+1 214 399 0587,varius nulla facilisi cras non velit nec nisi vulputate nonummy maecenas tincidunt lacus at velit vivamus vel nulla eget
14537,Topicshots,erylattah@goo.gl,+46 406 100 6938,lacus purus aliquet at feugiat non
14654,Ailane,bcisecai@miibeian.gov.cn,+385 698 843 0508,volutpat in congue etiam justo etiam pretium iaculis justo in hac habitasse platea dictumst etiam faucibus cursus urna ut tellus nulla ut erat id mauris
14469,Oyonder,hjestaj@ow.ly,+86 939 630 6940,ac consequat metus sapien ut nunc
13949,Skinte,abourgesak@army.mil,+66 521 138 3656,a feugiat et eros vestibulum ac est lacinia nisi venenatis tristique fusce congue diam
14944,Divanoodle,gpfliegeral@baidu.com,+27 645 829 0812,in faucibus orci luctus et ultrices posuere cubilia curae nulla dapibus dolor vel
14901,Rhynoodle,sfeldbergeram@gov.uk,+995 914 297 6185,orci pede venenatis non sodales sed tincidunt eu
14913,Twitterbeat,fstubbinsan@baidu.com,+63 612 351 2518,nisi nam ultrices libero non mattis pulvinar nulla pede
14761,Cogilith,epeevorao@telegraph.co.uk,+213 663 273 1015,et eros vestibulum ac est lacinia nisi venenatis tristique fusce
13960,Flashspan,dslocketap@qq.com,+86 449 548 8311,vel pede morbi porttitor lorem id
14193,Izio,abellefantaq@cmu.edu,+81 839 449 7010,habitasse platea dictumst aliquam augue quam sollicitudin vitae consectetuer eget rutrum at lorem integer tincidunt ante vel ipsum praesent blandit
14841,Brightdog,rblyar@loc.gov,+1 490 533 1529,bibendum imperdiet nullam orci pede venenatis non sodales sed tincidunt eu
14440,Zoomlounge,jquirkeas@list-manage.com,+54 940 567 6051,tortor quis turpis sed ante vivamus tortor duis mattis egestas metus aenean fermentum donec ut mauris eget massa tempor convallis nulla neque libero convallis eget
14611,Digitube,sbreissanat@desdev.cn,+57 263 110 7498,accumsan felis ut at dolor quis odio consequat varius integer ac leo pellentesque ultrices mattis odio donec vitae nisi nam ultrices libero non mattis
13998,Flipstorm,ctrowsdallau@illinois.edu,+7 152 636 6374,natoque penatibus et magnis dis parturient montes nascetur ridiculus mus etiam vel
14566,Trudoo,hpoltunav@arstechnica.com,+62 759 934 2288,ut blandit non interdum in ante vestibulum ante ipsum primis
14432,Shuffledrive,mchampneysaw@blogger.com,+86 167 450 2693,eros suspendisse accumsan tortor quis turpis sed ante vivamus tortor duis mattis egestas metus aenean fermentum donec ut mauris eget
14344,Skimia,ogiggax@ibm.com,+224 769 255 5209,a ipsum integer a nibh in
14484,Wikido,bcromptonay@businessinsider.com,+7 503 687 3974,posuere cubilia curae nulla dapibus dolor vel est donec odio justo sollicitudin ut suscipit a
14607,Yambee,bstottaz@linkedin.com,+51 787 303 6701,pede justo lacinia eget tincidunt eget tempus vel pede morbi porttitor lorem id ligula suspendisse ornare consequat lectus in est risus auctor sed
14057,Brightbean,slabbeyb0@cargocollective.com,+380 608 108 8851,nam nulla integer pede justo lacinia eget tincidunt eget tempus vel pede morbi porttitor lorem id ligula suspendisse ornare consequat lectus in
14696,Innojam,gjutsonb1@yolasite.com,+1 703 831 0303,quis orci eget orci vehicula condimentum curabitur in libero ut massa volutpat convallis morbi odio odio elementum eu interdum
14328,Skibox,jtumilityb2@hugedomains.com,+86 308 940 7641,pede lobortis ligula sit amet eleifend pede libero quis orci nullam molestie
14052,Kazu,aselmanb3@china.com.cn,+86 737 723 5399,aenean lectus pellentesque eget nunc donec quis
14309,Skaboo,bchippinb4@google.co.uk,+51 497 682 8129,nunc donec quis orci eget orci vehicula condimentum curabitur in libero ut massa volutpat convallis morbi odio
14618,Aibox,dbenningtonb5@addtoany.com,+351 530 257 1874,hac habitasse platea dictumst etiam faucibus cursus urna
14742,Rhynyx,gswaylandb6@geocities.com,+86 891 867 1504,montes nascetur ridiculus mus etiam vel augue vestibulum rutrum rutrum neque aenean auctor gravida sem praesent id massa id nisl
14859,Blognation,dwisniowskib7@yelp.com,+63 749 146 5912,donec diam neque vestibulum eget vulputate ut ultrices vel augue vestibulum ante
14006,Katz,praymentb8@ca.gov,+352 214 157 8388,magna at nunc commodo placerat praesent blandit nam nulla integer pede justo lacinia eget tincidunt eget tempus vel pede morbi porttitor lorem
14388,Browsedrive,abogiesb9@parallels.com,+86 661 640 0612,cubilia curae nulla dapibus dolor vel est donec odio justo sollicitudin ut
14564,Quatz,mnutbrownba@nifty.com,+62 148 497 2156,vulputate vitae nisl aenean lectus pellentesque eget nunc donec quis orci eget orci vehicula condimentum curabitur in libero ut massa volutpat
14059,Meejo,rseviourbb@cmu.edu,+234 634 391 9769,felis fusce posuere felis sed lacus morbi sem mauris laoreet ut rhoncus aliquet pulvinar sed nisl
14907,Skynoodle,dblazibc@privacy.gov.au,+86 441 671 3091,pretium nisl ut volutpat sapien arcu sed augue aliquam erat volutpat in congue etiam justo etiam pretium iaculis justo in
14689,Voonte,swedonbd@rambler.ru,+7 253 390 1824,erat curabitur gravida nisi at nibh in hac habitasse platea dictumst aliquam augue quam sollicitudin vitae consectetuer eget
14640,Aimbo,jfurnellbe@tmall.com,+86 753 507 5364,convallis nunc proin at turpis a
13945,Vinte,sleaneybf@shop-pro.jp,+507 957 948 9081,pellentesque eget nunc donec quis orci eget orci
14388,Lazz,ddoweybg@chronoengine.com,+86 591 284 2601,a nibh in quis justo maecenas
14823,Eazzy,lsinnockbh@miitbeian.gov.cn,+386 716 441 5433,ut massa quis augue luctus tincidunt nulla mollis molestie lorem quisque ut
14253,Oyoloo,scauseybi@ca.gov,+31 485 960 9269,eget massa tempor convallis nulla neque libero convallis eget eleifend luctus ultricies eu nibh quisque id justo sit amet sapien dignissim
14317,Twitterbridge,ddonaldbj@hibu.com,+86 536 173 8936,adipiscing elit proin risus praesent lectus vestibulum quam sapien varius ut blandit non interdum in ante vestibulum ante ipsum primis in faucibus orci luctus et
14184,Gigaclub,bbaronbk@rakuten.co.jp,+255 847 836 9461,vulputate elementum nullam varius nulla facilisi cras non velit nec nisi vulputate nonummy maecenas tincidunt lacus at velit vivamus vel nulla eget eros elementum
14703,Skimia,afoundbl@paypal.com,+52 668 568 8461,quam a odio in hac habitasse platea dictumst maecenas ut massa quis augue luctus tincidunt nulla
14544,Bubblebox,fklewerbm@mapquest.com,+233 862 587 1563,tortor quis turpis sed ante vivamus tortor duis mattis egestas metus aenean fermentum donec ut mauris eget massa tempor convallis nulla neque
14532,Reallinks,dchealesbn@angelfire.com,+212 103 861 1416,risus semper porta volutpat quam pede lobortis ligula sit amet eleifend pede libero quis orci nullam molestie nibh in
14268,Gigazoom,edigancebo@google.ca,+55 320 872 3146,adipiscing molestie hendrerit at vulputate vitae nisl aenean lectus pellentesque eget nunc donec quis orci eget
14104,Camimbo,alipscombbp@tamu.edu,+82 545 746 8957,faucibus orci luctus et ultrices posuere cubilia curae duis faucibus accumsan odio curabitur convallis duis consequat dui nec nisi volutpat eleifend
14640,Twitterlist,kgerberbq@alibaba.com,+31 341 182 7221,ipsum primis in faucibus orci luctus et ultrices posuere cubilia curae duis faucibus accumsan odio curabitur convallis duis consequat dui nec nisi volutpat eleifend donec
14218,Gabcube,gfishlybr@youtube.com,+976 331 843 7378,cubilia curae mauris viverra diam vitae quam
14487,Vidoo,pousleybs@tmall.com,+52 186 473 6058,sem fusce consequat nulla nisl nunc nisl duis bibendum felis sed
14447,Wordtune,kdeanesybt@nasa.gov,+62 785 669 5385,dui luctus rutrum nulla tellus in sagittis dui vel nisl duis ac nibh fusce lacus purus aliquet
14708,Muxo,wmackerethbu@blogtalkradio.com,+373 416 557 1797,euismod scelerisque quam turpis adipiscing lorem vitae mattis nibh
14552,Katz,hantosikbv@unblog.fr,+86 512 268 2745,in lacus curabitur at ipsum ac tellus semper interdum mauris ullamcorper purus sit amet nulla quisque arcu libero rutrum
14168,Browsebug,jloosmorebw@behance.net,+225 244 289 6808,donec ut dolor morbi vel lectus in quam fringilla rhoncus mauris
14276,Babblestorm,koheaneybx@dailymotion.com,+81 825 554 1607,massa id lobortis convallis tortor
14439,Minyx,ctealby@youtube.com,+7 999 919 7091,leo pellentesque ultrices mattis odio donec vitae nisi
14137,Blogspan,kslorachbz@yelp.com,+7 825 461 7915,venenatis tristique fusce congue diam id ornare imperdiet sapien urna pretium nisl ut volutpat sapien arcu sed augue aliquam erat volutpat in
14310,Quinu,bprykec0@behance.net,+228 183 722 1848,cras mi pede malesuada in imperdiet et commodo vulputate justo in blandit ultrices enim lorem ipsum dolor sit amet consectetuer adipiscing
14067,Topdrive,nbeardwoodc1@cloudflare.com,+33 758 253 4693,mauris viverra diam vitae quam suspendisse potenti nullam porttitor lacus at turpis donec posuere metus vitae ipsum aliquam non mauris morbi
14065,Cogibox,ppolesc2@europa.eu,+86 897 754 1111,non mauris morbi non lectus
14816,Livetube,fmoehlec3@1und1.de,+7 291 264 2338,ligula pellentesque ultrices phasellus id sapien in sapien iaculis congue vivamus metus arcu adipiscing molestie hendrerit at vulputate
14871,Twimbo,jjermeyc4@xinhuanet.com,+86 883 782 8466,cubilia curae mauris viverra diam vitae quam suspendisse potenti nullam porttitor
14192,Realbridge,sdunckleyc5@nytimes.com,+62 363 594 8044,felis ut at dolor quis odio consequat varius
14681,Meemm,lbartsc6@zdnet.com,+62 811 752 5146,in quam fringilla rhoncus mauris enim leo rhoncus
14040,Flashpoint,dandrasc7@digg.com,+7 861 849 9687,eleifend quam a odio in hac
14512,Kazio,tmapamc8@tripadvisor.com,+48 975 617 9245,at nibh in hac habitasse platea dictumst aliquam augue quam sollicitudin vitae consectetuer eget rutrum at lorem integer tincidunt
14448,Twiyo,ageraghtyc9@istockphoto.com,+63 688 456 2519,etiam faucibus cursus urna ut tellus nulla ut erat id mauris vulputate elementum nullam varius nulla facilisi cras
14318,Lazz,zkeenleysideca@ifeng.com,+86 108 400 9292,nulla tempus vivamus in felis eu sapien cursus vestibulum proin eu mi nulla ac enim in tempor turpis nec euismod scelerisque
14372,Browsedrive,esorrocb@dropbox.com,+351 678 787 3827,in felis eu sapien cursus
14112,Trunyx,bslowleycc@ning.com,+86 686 168 0059,lectus pellentesque at nulla suspendisse potenti cras in purus
14814,Trunyx,rduffieldcd@devhub.com,+380 196 533 6094,potenti in eleifend quam a odio in hac habitasse platea dictumst
14759,Photospace,cbenedictce@symantec.com,+46 584 863 3624,volutpat quam pede lobortis ligula sit amet eleifend pede libero quis orci nullam molestie
14954,Voonte,obrownsmithcf@gravatar.com,+86 565 448 4091,quisque porta volutpat erat quisque erat
14793,Rhynyx,alestorcg@typepad.com,+86 317 880 0688,pretium nisl ut volutpat sapien arcu sed augue aliquam erat volutpat in
14639,Miboo,xferrerasch@fda.gov,+86 203 443 4551,suscipit a feugiat et eros vestibulum ac est lacinia nisi venenatis tristique fusce congue diam id ornare imperdiet sapien urna pretium nisl ut volutpat sapien
14106,Thoughtworks,ccraykci@latimes.com,+381 614 475 4879,suspendisse potenti nullam porttitor lacus at turpis donec
14030,Realblab,jpechetcj@devhub.com,+57 193 577 8462,nisl nunc nisl duis bibendum
14377,Bluejam,rshowlerck@unicef.org,+86 450 627 4692,et eros vestibulum ac est lacinia
14464,Fivebridge,marnaldocl@bluehost.com,+46 521 166 0613,eu sapien cursus vestibulum proin
14371,Zoomdog,ggoslincm@histats.com,+81 411 286 9803,etiam justo etiam pretium iaculis justo in hac habitasse platea dictumst etiam faucibus cursus urna ut tellus nulla
14242,Jetwire,lkleimtcn@acquirethisname.com,+81 468 993 6691,aliquet maecenas leo odio condimentum
13972,Gabvine,rgeroldinico@dyndns.org,+62 100 597 7019,aliquet ultrices erat tortor sollicitudin mi
14515,Voonyx,ngagincp@wikipedia.org,+976 691 796 7151,urna pretium nisl ut volutpat sapien arcu sed augue aliquam erat volutpat in congue etiam
14295,Dabfeed,dbarneveldcq@phoca.cz,+27 129 420 1626,est risus auctor sed tristique in tempus sit amet sem fusce consequat nulla nisl nunc nisl duis
14746,Roomm,dvoyseycr@bloglines.com,+252 427 736 7914,duis faucibus accumsan odio curabitur convallis duis consequat
14482,Gigashots,dsandoncs@joomla.org,+251 147 562 3531,ut at dolor quis odio consequat varius integer ac leo pellentesque ultrices mattis
14844,Feedspan,fgalileect@cbc.ca,+81 573 169 0439,laoreet ut rhoncus aliquet pulvinar sed nisl nunc rhoncus dui vel sem sed
14694,Blogtags,lshermarcu@xing.com,+62 862 751 6289,aliquet massa id lobortis convallis tortor risus dapibus augue vel
14503,Rhybox,hcameliacv@reddit.com,+7 891 395 1313,fusce congue diam id ornare imperdiet sapien urna pretium
14289,Rhycero,dbenkacw@toplist.cz,+86 444 392 6374,aenean lectus pellentesque eget nunc donec quis orci eget orci vehicula condimentum curabitur in libero ut massa volutpat convallis morbi odio odio elementum eu interdum
14090,Latz,gyoskowitzcx@spotify.com,+970 224 405 2915,sed ante vivamus tortor duis mattis egestas metus aenean fermentum donec ut mauris
14191,Browsecat,bcreswellcy@odnoklassniki.ru,+51 141 814 7729,aliquam quis turpis eget elit sodales scelerisque mauris sit amet eros suspendisse
14451,Oyonder,sluckcz@godaddy.com,+1 212 311 2676,sed lacus morbi sem mauris laoreet ut rhoncus aliquet pulvinar sed nisl nunc rhoncus dui vel sem sed sagittis nam congue risus
14374,Skinix,eshemmansd0@typepad.com,+30 510 401 5034,massa donec dapibus duis at velit eu est congue
14731,Browsecat,snittid1@51.la,+63 957 110 3887,libero convallis eget eleifend luctus
14541,Linktype,gyvend2@ocn.ne.jp,+81 511 852 5625,sed vel enim sit amet nunc viverra dapibus nulla
13993,Gabspot,mbordmand3@bluehost.com,+30 438 101 0032,maecenas rhoncus aliquam lacus morbi quis tortor id nulla ultrices aliquet maecenas leo odio condimentum id luctus nec molestie sed
14983,Gigabox,psichd4@mayoclinic.com,+86 407 739 7993,pellentesque eget nunc donec quis orci eget orci vehicula condimentum curabitur in libero ut massa volutpat convallis morbi odio odio elementum eu
14063,Edgeify,bkilmurrayd5@topsy.com,+380 485 307 3597,porttitor lacus at turpis donec posuere metus vitae ipsum aliquam non mauris morbi
14095,Dynabox,cjackettsd6@smh.com.au,+963 121 645 8085,in imperdiet et commodo vulputate justo in blandit ultrices enim
14921,Skajo,vmccoskerd7@google.com,+30 527 217 9673,in imperdiet et commodo vulputate justo in blandit ultrices enim lorem ipsum dolor sit amet consectetuer adipiscing elit proin interdum mauris non ligula pellentesque ultrices
14337,Skajo,dleckenbyd8@marketwatch.com,+62 104 570 6293,proin eu mi nulla ac enim in tempor turpis nec euismod scelerisque quam
13968,Blogpad,mkettowd9@pinterest.com,+81 479 202 0786,ipsum dolor sit amet consectetuer adipiscing elit proin interdum mauris
14475,Kayveo,jhubandda@last.fm,+55 881 243 6324,pede libero quis orci nullam molestie nibh in lectus
14084,Youfeed,etimbridgedb@apache.org,+387 305 213 0070,ante nulla justo aliquam quis turpis eget elit sodales scelerisque mauris sit amet eros suspendisse accumsan tortor quis
14198,Devify,alargentdc@stanford.edu,+62 439 548 5546,convallis tortor risus dapibus augue vel accumsan tellus nisi eu orci mauris
14001,Lazz,bbarfforddd@washingtonpost.com,+90 126 352 9731,vel nulla eget eros elementum pellentesque quisque porta
14440,Kimia,apuckerde@ning.com,+353 908 260 1495,in purus eu magna vulputate luctus cum sociis natoque penatibus et magnis dis parturient
14715,Gigabox,npinnickdf@posterous.com,+7 947 806 5438,vestibulum rutrum rutrum neque aenean auctor gravida
14988,Voonyx,mdillondg@hud.gov,+33 578 863 6453,nulla elit ac nulla sed vel enim sit amet nunc viverra dapibus nulla suscipit ligula in lacus curabitur at
14507,Thoughtsphere,briefdh@cnbc.com,+20 908 912 7301,interdum mauris ullamcorper purus sit amet nulla quisque arcu libero rutrum ac lobortis
14796,Vipe,ijaquindi@skyrock.com,+48 664 315 9109,mauris laoreet ut rhoncus aliquet pulvinar
14822,Wordpedia,whitchamdj@woothemes.com,+7 313 392 8403,vestibulum aliquet ultrices erat tortor sollicitudin
14224,Cogilith,dgalgeydk@forbes.com,+48 525 487 4499,elit ac nulla sed vel enim sit amet nunc viverra
14721,Jamia,gphilipeaudl@networkadvertising.org,+86 388 990 3797,augue vel accumsan tellus nisi eu orci mauris lacinia sapien quis libero nullam sit amet turpis elementum ligula vehicula consequat morbi
14819,Meembee,mwolstencroftdm@mit.edu,+46 874 799 6242,molestie lorem quisque ut erat curabitur gravida nisi at nibh in hac habitasse platea dictumst
14637,Devbug,eknibbsdn@tripadvisor.com,+98 205 611 7976,magna vulputate luctus cum sociis natoque penatibus et magnis dis
14994,Twitterbridge,cabramowitzdo@ocn.ne.jp,+1 253 219 8200,semper sapien a libero nam dui proin leo odio porttitor id consequat in consequat ut nulla sed accumsan felis ut at dolor quis odio
13965,Tambee,rpaurdp@loc.gov,+86 549 136 9630,magna vulputate luctus cum sociis natoque penatibus et magnis dis parturient montes nascetur ridiculus mus vivamus vestibulum sagittis sapien
14037,Youopia,gabbatinidq@webnode.com,+86 942 474 1326,mi integer ac neque duis bibendum morbi non quam nec dui luctus rutrum
14951,Skinte,mslyvesterdr@pbs.org,+49 483 621 8178,justo etiam pretium iaculis justo in hac habitasse platea dictumst etiam faucibus cursus urna
14372,Geba,pgrelkads@bandcamp.com,+66 212 267 5565,suscipit nulla elit ac nulla sed vel enim sit amet nunc viverra dapibus nulla suscipit ligula in
13938,Avamba,adauneydt@sbwire.com,+351 248 330 0650,pede ullamcorper augue a suscipit nulla elit ac nulla sed vel enim sit amet nunc viverra dapibus nulla suscipit ligula in lacus curabitur at ipsum
14941,Zoozzy,ehehldu@netvibes.com,+86 642 617 3227,ante vel ipsum praesent blandit lacinia
13938,Skinder,cvossgendv@narod.ru,+506 469 998 5802,vel est donec odio justo sollicitudin ut suscipit a feugiat et eros vestibulum ac
14630,Mydeo,ljoselevitchdw@unblog.fr,+359 999 560 2287,nunc rhoncus dui vel sem sed sagittis
14527,Tagpad,ecreavindx@howstuffworks.com,+48 893 797 3894,at vulputate vitae nisl aenean lectus pellentesque eget nunc
14104,Skilith,epittawaydy@addtoany.com,+7 406 539 7467,sapien arcu sed augue aliquam erat volutpat in congue etiam justo etiam pretium iaculis justo in hac habitasse platea dictumst
13912,Kwinu,mneylandz@xing.com,+95 959 358 5508,sed magna at nunc commodo placerat praesent blandit nam nulla integer pede justo lacinia eget tincidunt eget tempus vel pede
13928,Topiclounge,jmcnicole0@hc360.com,+237 250 812 2674,vulputate vitae nisl aenean lectus pellentesque eget nunc donec quis orci eget orci vehicula condimentum curabitur in libero ut massa volutpat convallis morbi
14261,Dynava,mmackissacke1@rambler.ru,+86 325 843 6327,enim in tempor turpis nec euismod scelerisque quam turpis adipiscing lorem vitae mattis nibh ligula nec sem duis aliquam
14735,Blogtag,lsturleye2@google.cn,+7 597 989 2577,orci vehicula condimentum curabitur in libero ut massa volutpat convallis morbi odio odio elementum eu interdum eu tincidunt
