SupplierID,SupplierName,SupplierEmail,SupplierPhone,SupplierDescription
14038,Twinder,wmchaffy0@tuttocitta.it,+595 926 248 3059,posuere metus vitae ipsum aliquam non mauris
14770,Twinder,sperfect1@businessinsider.com,+86 525 554 5774,vestibulum proin eu mi nulla ac enim in tempor turpis nec euismod scelerisque
14219,Edgeblab,vnuzzti2@state.gov,+970 457 871 5832,sapien placerat ante nulla justo aliquam quis turpis eget elit sodales scelerisque mauris
14722,Thoughtstorm,khaslen3@wordpress.org,+218 656 418 9468,accumsan felis ut at dolor quis odio consequat varius integer ac leo pellentesque ultrices mattis odio donec vitae nisi
14977,Katz,brodliff4@harvard.edu,+62 117 919 3094,vehicula condimentum curabitur in libero ut massa volutpat convallis morbi odio odio elementum eu interdum eu tincidunt in leo maecenas pulvinar lobortis
14328,Yozio,hdavley5@webs.com,+62 337 836 3590,semper porta volutpat quam pede lobortis ligula sit amet eleifend pede libero quis orci nullam molestie nibh
14087,Kwilith,mperrins6@netvibes.com,+48 848 122 1344,pede libero quis orci nullam molestie nibh
13969,Edgepulse,emcqueen7@time.com,+57 893 906 6371,augue a suscipit nulla elit ac nulla sed vel enim sit amet nunc viverra dapibus nulla suscipit ligula
14523,Ozu,asnuggs8@istockphoto.com,+86 230 353 7776,at velit vivamus vel nulla eget eros elementum pellentesque quisque porta volutpat
14474,Kwideo,ecameli9@51.la,+7 675 223 9432,pellentesque viverra pede ac diam cras pellentesque volutpat dui maecenas tristique est et tempus semper est quam pharetra magna
14832,Devbug,mhauxwella@live.com,+63 300 387 9303,pellentesque volutpat dui maecenas tristique est et tempus semper est quam pharetra magna ac consequat metus sapien ut nunc vestibulum ante ipsum primis in faucibus
14869,Skippad,kcalkenb@parallels.com,+359 171 155 0265,parturient montes nascetur ridiculus mus vivamus vestibulum sagittis sapien cum sociis natoque penatibus et magnis dis parturient montes nascetur
14613,Mybuzz,kschimpkec@eventbrite.com,+420 913 507 3833,turpis enim blandit mi in porttitor pede justo eu massa donec dapibus duis at velit eu est congue elementum in hac habitasse
13933,Topicblab,samysd@linkedin.com,+254 170 970 7014,lectus pellentesque at nulla suspendisse potenti cras in purus eu magna vulputate luctus cum sociis natoque penatibus
14487,Aimbu,kdownese@cnbc.com,+7 673 733 5603,adipiscing lorem vitae mattis nibh ligula nec sem duis aliquam convallis nunc proin at
14693,Zooxo,pjankuf@myspace.com,+86 120 862 4568,blandit nam nulla integer pede justo lacinia eget tincidunt eget tempus
14888,Thoughtbeat,mdewisg@apple.com,+592 404 990 8061,vivamus in felis eu sapien cursus vestibulum proin eu mi nulla ac enim in tempor turpis nec euismod scelerisque quam turpis adipiscing lorem vitae
14274,Babbleopia,amcilveenh@posterous.com,+46 228 288 9117,nulla elit ac nulla sed vel enim sit amet nunc viverra dapibus nulla suscipit ligula in lacus curabitur at ipsum ac tellus semper
13934,Ozu,ocraisei@surveymonkey.com,+55 630 470 6601,ante ipsum primis in faucibus orci luctus
14156,Bubbletube,glefleyj@nytimes.com,+86 342 883 9737,sapien a libero nam dui proin leo odio porttitor id consequat in consequat ut nulla sed accumsan felis ut at dolor
14322,Brainsphere,mlovelessk@cmu.edu,+63 433 309 3454,odio consequat varius integer ac leo pellentesque ultrices mattis odio donec vitae nisi nam ultrices libero non mattis pulvinar nulla pede ullamcorper augue
14352,Flashdog,pwhistonl@rediff.com,+81 858 795 6002,sed tincidunt eu felis fusce posuere felis sed lacus morbi sem
14705,Mybuzz,mjouanetonm@quantcast.com,+51 943 774 5284,mus etiam vel augue vestibulum rutrum rutrum neque aenean auctor gravida sem
13931,Brightbean,kreynaldsn@exblog.jp,+1 961 884 2776,aliquet massa id lobortis convallis tortor risus dapibus augue vel accumsan tellus nisi eu orci mauris lacinia sapien quis libero nullam sit amet turpis
14293,Oyonder,mflecknello@jalbum.net,+7 198 514 2423,lorem vitae mattis nibh ligula nec sem duis aliquam convallis nunc proin at
14683,Edgetag,lcowansp@omniture.com,+86 538 304 0362,rhoncus aliquet pulvinar sed nisl nunc rhoncus dui vel sem sed sagittis nam congue risus
14241,Photofeed,fmartyq@dmoz.org,+48 530 364 4452,donec ut dolor morbi vel lectus in quam fringilla rhoncus mauris enim leo rhoncus sed vestibulum sit amet cursus id turpis integer aliquet
13943,Flashspan,efranceschinor@storify.com,+86 695 825 3286,nulla pede ullamcorper augue a
14613,Voolith,hbuseks@ca.gov,+234 890 141 3962,pede malesuada in imperdiet et commodo vulputate justo in blandit ultrices enim lorem ipsum dolor sit amet consectetuer
14843,Youfeed,sliggonst@abc.net.au,+1 505 181 9366,erat fermentum justo nec condimentum neque sapien placerat ante nulla justo aliquam quis turpis eget elit
14106,Photobean,bomarau@toplist.cz,+386 757 886 3904,lorem integer tincidunt ante vel ipsum praesent blandit lacinia erat vestibulum sed magna at nunc commodo placerat praesent blandit
14108,Plambee,cchappellv@parallels.com,+62 742 398 8589,vulputate nonummy maecenas tincidunt lacus at velit vivamus vel nulla eget eros elementum pellentesque quisque porta volutpat erat quisque erat eros viverra
14052,Abata,csladw@1und1.de,+98 184 534 0855,morbi vestibulum velit id pretium iaculis diam erat fermentum justo nec condimentum
14509,Linklinks,clouthx@hp.com,+58 142 431 3503,est congue elementum in hac habitasse platea dictumst morbi vestibulum velit id pretium iaculis diam erat fermentum justo nec condimentum neque sapien placerat ante nulla
14108,Kwideo,jstianty@craigslist.org,+86 992 163 5465,maecenas tincidunt lacus at velit vivamus vel nulla eget eros elementum pellentesque quisque porta volutpat erat quisque erat eros viverra eget
14968,Eamia,cgonsalvezz@indiatimes.com,+1 305 640 6789,cras in purus eu magna vulputate luctus cum sociis natoque penatibus et magnis dis parturient montes nascetur
14008,Jazzy,gpadley10@bloglovin.com,+55 276 197 8200,mauris eget massa tempor convallis nulla neque libero convallis eget eleifend luctus ultricies eu nibh quisque id justo sit amet sapien dignissim vestibulum vestibulum ante
14477,Katz,lburtenshaw11@blogger.com,+63 376 587 0892,sit amet turpis elementum ligula vehicula consequat morbi a ipsum integer a nibh in quis justo maecenas rhoncus aliquam lacus morbi
13926,Photobean,khaistwell12@fotki.com,+63 858 126 9495,imperdiet et commodo vulputate justo in blandit ultrices enim lorem ipsum dolor sit amet consectetuer adipiscing elit proin interdum mauris non ligula
14184,Gabvine,vmacdearmid13@cornell.edu,+593 343 374 9413,lorem integer tincidunt ante vel
14734,Thoughtblab,roldred14@jalbum.net,+420 709 331 2544,integer ac leo pellentesque ultrices mattis odio donec vitae nisi nam ultrices libero non mattis pulvinar nulla pede
14735,Youtags,jiskowicz15@drupal.org,+30 133 244 2721,non quam nec dui luctus rutrum nulla tellus in sagittis dui vel nisl duis ac nibh fusce lacus purus aliquet
14092,Wikido,pbattelle16@microsoft.com,+351 271 135 4881,ligula suspendisse ornare consequat lectus in est risus auctor sed tristique in tempus sit amet
14145,Oba,aredmayne17@plala.or.jp,+689 221 623 1600,vestibulum sit amet cursus id turpis integer aliquet massa id lobortis convallis tortor
14370,Divanoodle,ecabotto18@harvard.edu,+55 811 953 6849,posuere metus vitae ipsum aliquam non mauris morbi non lectus aliquam sit amet diam in magna bibendum imperdiet nullam
14240,Jaxspan,rgunter19@instagram.com,+351 151 266 7557,vitae mattis nibh ligula nec sem duis aliquam convallis nunc proin
14553,Quatz,rplues1a@sbwire.com,+7 807 498 8445,nulla quisque arcu libero rutrum ac lobortis vel dapibus at diam nam tristique
14457,Quinu,habbey1b@hc360.com,+504 242 170 4852,odio cras mi pede malesuada in imperdiet et commodo vulputate
14097,Flashset,cbrimmell1c@facebook.com,+86 178 477 0096,semper est quam pharetra magna ac consequat metus sapien ut nunc vestibulum ante ipsum primis in faucibus orci luctus et ultrices posuere
13909,Youfeed,cwimbury1d@japanpost.jp,+380 655 433 8853,ultrices posuere cubilia curae mauris viverra diam vitae quam suspendisse
14531,Photojam,adallicott1e@ustream.tv,+33 447 704 3345,vel nisl duis ac nibh fusce lacus purus aliquet at feugiat non pretium quis lectus suspendisse potenti in eleifend quam a odio in
14389,Oozz,msiddell1f@who.int,+55 167 752 1664,leo pellentesque ultrices mattis odio donec vitae nisi nam ultrices libero non mattis pulvinar nulla
14706,Centidel,hcrowcher1g@berkeley.edu,+86 146 611 3925,dapibus dolor vel est donec odio justo sollicitudin ut suscipit a feugiat et eros vestibulum ac
14410,Teklist,ahuddart1h@last.fm,+86 862 527 2702,dolor morbi vel lectus in quam fringilla rhoncus mauris enim leo rhoncus sed vestibulum sit amet cursus id turpis integer aliquet
14732,Flashspan,amcclune1i@blog.com,+86 596 658 2717,mauris non ligula pellentesque ultrices phasellus id sapien in sapien iaculis
14350,Blognation,abrumfitt1j@drupal.org,+86 205 761 8186,eget tempus vel pede morbi porttitor lorem id ligula suspendisse ornare consequat lectus
14041,Babbleblab,flethbury1k@spotify.com,+351 668 182 4487,congue elementum in hac habitasse platea dictumst
14703,Divanoodle,ncottu1l@vinaora.com,+234 500 714 6550,vitae ipsum aliquam non mauris morbi non lectus aliquam sit amet
14869,Blognation,aohenehan1m@deviantart.com,+1 419 572 1586,morbi sem mauris laoreet ut rhoncus aliquet pulvinar sed nisl nunc rhoncus dui vel sem sed sagittis nam congue risus semper porta volutpat
14599,Jaxspan,cshorthouse1n@latimes.com,+86 432 589 5066,dignissim vestibulum vestibulum ante ipsum primis in faucibus orci luctus et ultrices posuere cubilia curae nulla dapibus dolor vel est
14841,Brainbox,qloughead1o@bing.com,+86 896 345 6016,molestie nibh in lectus pellentesque at nulla suspendisse potenti cras in purus eu magna vulputate luctus cum sociis natoque penatibus
14637,Skyndu,bcorr1p@microsoft.com,+62 738 979 0353,amet erat nulla tempus vivamus in felis eu sapien cursus vestibulum proin eu mi nulla
14880,Cogilith,cabelwhite1q@npr.org,+55 651 654 8956,elementum eu interdum eu tincidunt in leo maecenas pulvinar lobortis est phasellus sit amet erat nulla tempus vivamus in felis eu
14512,Twitternation,dedney1r@dmoz.org,+7 982 114 8904,nulla mollis molestie lorem quisque ut erat curabitur gravida nisi at nibh in hac habitasse platea
14196,Voonte,emccaughren1s@discuz.net,+62 300 673 5288,felis sed lacus morbi sem mauris laoreet ut rhoncus aliquet pulvinar sed nisl nunc rhoncus dui vel sem sed sagittis nam congue risus semper porta
14990,Brainbox,ssolon1t@wikispaces.com,+81 961 287 4519,nec condimentum neque sapien placerat ante nulla justo
14776,Dabshots,rmcauliffe1u@cbslocal.com,+47 108 903 5550,iaculis congue vivamus metus arcu adipiscing molestie hendrerit at vulputate vitae nisl aenean lectus
14592,Dazzlesphere,klakeland1v@nydailynews.com,+62 179 146 6023,interdum venenatis turpis enim blandit mi in porttitor
14776,Kaymbo,mhambleton1w@addtoany.com,+62 547 267 8480,sed tristique in tempus sit amet sem fusce consequat nulla nisl nunc nisl duis bibendum felis sed interdum venenatis turpis
14235,Riffpath,ameere1x@ed.gov,+86 832 221 0244,posuere nonummy integer non velit donec diam neque vestibulum eget vulputate ut ultrices vel augue
13948,Twitterlist,mlasselle1y@wordpress.com,+86 364 917 9178,lorem id ligula suspendisse ornare consequat lectus in est risus auctor sed tristique in tempus sit amet sem fusce
13941,Brightdog,jchorlton1z@archive.org,+55 652 339 3418,ipsum primis in faucibus orci luctus et ultrices
14711,Gigashots,ttrosdall20@sun.com,+57 302 938 3922,non lectus aliquam sit amet diam in magna bibendum imperdiet nullam orci pede venenatis non sodales sed tincidunt eu felis fusce posuere felis sed
14667,Bluejam,sfasler21@goo.ne.jp,+229 468 212 1741,sapien arcu sed augue aliquam erat volutpat
14347,Tazzy,nserrurier22@nytimes.com,+62 268 701 4995,nullam orci pede venenatis non sodales
14381,Meezzy,jannatt23@networkadvertising.org,+63 753 254 9120,pretium nisl ut volutpat sapien arcu sed augue aliquam erat volutpat in congue etiam justo etiam pretium iaculis justo in
14711,Meetz,vprewer24@infoseek.co.jp,+62 416 963 6850,iaculis congue vivamus metus arcu adipiscing molestie hendrerit at vulputate vitae nisl aenean lectus pellentesque eget nunc donec quis orci eget orci
14622,Photojam,crugge25@istockphoto.com,+86 623 283 7013,blandit mi in porttitor pede justo eu massa donec dapibus duis at velit eu est congue elementum in
14659,Rhyzio,ncritchell26@google.pl,+63 863 231 3050,vel augue vestibulum rutrum rutrum neque aenean auctor gravida
14940,Teklist,fedwicke27@creativecommons.org,+86 648 775 9533,placerat ante nulla justo aliquam quis turpis eget elit sodales scelerisque mauris sit amet eros suspendisse accumsan tortor quis turpis
14800,Yacero,jwillbourne28@clickbank.net,+420 842 505 6368,in eleifend quam a odio in hac habitasse platea
14118,Digitube,dgodthaab29@washingtonpost.com,+234 632 405 7033,sagittis nam congue risus semper porta volutpat quam pede lobortis ligula sit amet eleifend pede libero quis orci nullam
14090,Skinte,cdenton2a@tmall.com,+976 477 476 9161,ipsum praesent blandit lacinia erat vestibulum sed magna at nunc commodo placerat praesent
14898,Eidel,jnaisbitt2b@weibo.com,+30 673 577 5703,pede posuere nonummy integer non velit donec diam neque vestibulum eget
14468,Podcat,shurich2c@wiley.com,+358 327 576 3477,metus vitae ipsum aliquam non mauris morbi non lectus aliquam sit
14932,Skynoodle,mmallen2d@noaa.gov,+234 996 905 9559,vehicula condimentum curabitur in libero ut massa volutpat convallis morbi odio
14131,Skyndu,tstuckow2e@cyberchimps.com,+48 112 564 4167,in purus eu magna vulputate luctus cum sociis natoque penatibus et magnis dis parturient montes nascetur ridiculus mus vivamus vestibulum sagittis sapien cum sociis natoque
13954,Gabvine,cbulfoy2f@meetup.com,+86 508 829 4166,non mauris morbi non lectus aliquam sit amet diam in
14677,Avavee,pprudham2g@yandex.ru,+351 849 346 0409,vestibulum rutrum rutrum neque aenean auctor gravida sem praesent id massa id nisl venenatis lacinia aenean sit amet justo morbi ut odio cras
13977,Innojam,jvogeller2h@a8.net,+996 397 854 2919,fusce posuere felis sed lacus morbi sem mauris laoreet ut rhoncus aliquet pulvinar sed nisl nunc rhoncus dui vel sem sed sagittis nam
14853,Feedspan,rpearcy2i@toplist.cz,+237 977 115 0188,lorem vitae mattis nibh ligula nec sem duis aliquam convallis nunc proin at turpis a pede posuere nonummy integer non velit donec diam neque vestibulum
14815,Camido,aboocock2j@chron.com,+46 802 901 3814,suscipit ligula in lacus curabitur at ipsum ac tellus semper interdum mauris ullamcorper purus sit amet nulla quisque arcu
14956,Zoombox,kbliven2k@slideshare.net,+385 975 725 6849,cursus vestibulum proin eu mi nulla ac enim in tempor turpis nec euismod scelerisque quam turpis adipiscing lorem vitae
14967,Kanoodle,aginity2l@naver.com,+66 297 999 5372,odio in hac habitasse platea dictumst maecenas ut massa quis augue
14018,Shuffledrive,fbaglan2m@omniture.com,+86 556 251 7438,vivamus in felis eu sapien cursus vestibulum proin eu mi nulla ac enim in tempor turpis nec euismod
14100,Fatz,gmarchington2n@ask.com,+86 826 636 5938,nunc viverra dapibus nulla suscipit
14903,Realmix,psegar2o@google.es,+86 840 578 4757,nunc donec quis orci eget
14281,Demimbu,educkworth2p@google.de,+351 577 302 4287,cum sociis natoque penatibus et magnis dis parturient montes nascetur ridiculus mus vivamus vestibulum sagittis sapien cum sociis natoque penatibus et magnis
14055,Meezzy,hgever2q@e-recht24.de,+996 402 486 7061,lacus at velit vivamus vel nulla eget eros elementum pellentesque quisque porta volutpat erat quisque erat eros
14445,Flipbug,evant2r@sciencedirect.com,+86 226 745 1944,consectetuer adipiscing elit proin interdum mauris non ligula pellentesque ultrices phasellus id sapien in sapien iaculis congue vivamus metus arcu
14233,Roomm,emacinerney2s@github.io,+51 516 147 5190,lacinia nisi venenatis tristique fusce congue diam id ornare imperdiet sapien
14425,Mymm,dchaloner2t@oracle.com,+355 297 344 7148,sit amet cursus id turpis integer aliquet
14587,Kayveo,jblundell2u@nasa.gov,+358 586 682 2081,velit nec nisi vulputate nonummy maecenas tincidunt lacus at velit vivamus vel nulla eget eros elementum pellentesque quisque porta volutpat erat quisque
14245,Oyope,mviles2v@ebay.co.uk,+86 833 759 3683,scelerisque quam turpis adipiscing lorem vitae mattis nibh ligula nec sem duis aliquam convallis nunc proin at turpis a pede posuere nonummy integer non velit
14281,Jaxbean,rvinas2w@amazonaws.com,+7 679 933 1791,parturient montes nascetur ridiculus mus vivamus vestibulum sagittis sapien cum sociis natoque penatibus et magnis dis
14190,Fliptune,mreary2x@hibu.com,+1 906 847 2043,in libero ut massa volutpat convallis morbi odio odio elementum eu interdum
14273,Linkbridge,ccabbell2y@tuttocitta.it,+234 415 447 3503,tellus nisi eu orci mauris lacinia sapien quis libero nullam sit amet turpis elementum
13950,Zoonder,gsignoret2z@google.de,+62 720 606 2024,tortor sollicitudin mi sit amet lobortis sapien sapien non mi integer ac neque duis bibendum morbi non
14189,Wordpedia,mhatherell30@istockphoto.com,+52 890 277 7425,libero convallis eget eleifend luctus ultricies eu nibh quisque id justo sit amet sapien dignissim vestibulum
14988,Izio,cdonovan31@comsenz.com,+1 916 506 5605,nisl ut volutpat sapien arcu sed augue aliquam erat volutpat in congue etiam justo
14878,Skinder,pshawcroft32@stumbleupon.com,+58 153 656 8480,a pede posuere nonummy integer non velit donec diam neque vestibulum eget vulputate ut ultrices vel augue vestibulum ante ipsum primis
14655,Jayo,plawfull33@ibm.com,+52 160 621 5556,rutrum nulla tellus in sagittis dui vel nisl duis ac nibh fusce lacus purus aliquet at feugiat non pretium quis
14144,Topicblab,cgulston34@amazon.de,+1 978 843 1618,interdum mauris non ligula pellentesque ultrices phasellus id sapien in sapien iaculis congue vivamus metus arcu adipiscing molestie hendrerit at vulputate vitae nisl aenean lectus
14353,Kaymbo,idanniel35@mediafire.com,+86 140 772 0329,in hac habitasse platea dictumst aliquam augue quam sollicitudin vitae consectetuer
14576,Wordtune,gduckhouse36@google.com,+64 201 596 7928,tempus vel pede morbi porttitor lorem id ligula suspendisse ornare consequat lectus in est risus auctor
14171,Feednation,mcrich37@loc.gov,+46 984 776 9942,ante vestibulum ante ipsum primis in faucibus orci luctus et ultrices posuere cubilia curae duis faucibus accumsan odio curabitur
14596,Jabbertype,bleahy38@tuttocitta.it,+223 919 981 3859,justo eu massa donec dapibus duis at velit eu est congue elementum in hac
14612,Oyoba,awhyteman39@photobucket.com,+66 818 217 8196,luctus ultricies eu nibh quisque id justo sit amet sapien dignissim vestibulum vestibulum ante ipsum primis in faucibus orci luctus et ultrices posuere cubilia curae
14308,Avamm,sskyrm3a@wunderground.com,+30 908 819 9881,pellentesque at nulla suspendisse potenti cras in purus eu magna vulputate luctus cum sociis natoque penatibus et magnis dis parturient montes nascetur ridiculus mus vivamus
14729,Fliptune,bivanuschka3b@jimdo.com,+48 756 149 5034,sit amet lobortis sapien sapien non mi integer ac neque duis bibendum morbi non quam nec dui luctus rutrum nulla tellus in
13974,Twitterworks,mkrates3c@ebay.com,+7 623 907 8739,eget semper rutrum nulla nunc purus phasellus in felis
14743,Zava,mokroy3d@edublogs.org,+62 100 519 4023,ligula suspendisse ornare consequat lectus in est risus auctor sed tristique in tempus sit amet sem fusce consequat nulla nisl
14504,Yata,bsteeples3e@usatoday.com,+55 786 778 3264,maecenas tristique est et tempus semper est quam pharetra magna ac consequat metus
14408,Edgeblab,sadhams3f@friendfeed.com,+86 831 187 6615,platea dictumst etiam faucibus cursus urna
13904,Skyndu,hjoddins3g@digg.com,+46 262 936 3712,quisque ut erat curabitur gravida nisi at nibh in hac habitasse platea dictumst aliquam augue quam sollicitudin vitae consectetuer
14335,Skibox,llockner3h@bbb.org,+86 294 319 3593,semper rutrum nulla nunc purus phasellus in felis donec semper sapien a libero nam dui proin leo odio
13920,Dazzlesphere,sexon3i@bloomberg.com,+54 493 435 3743,erat curabitur gravida nisi at nibh in hac habitasse platea dictumst aliquam
15000,Wordware,adaine3j@google.cn,+86 517 454 4208,nisi eu orci mauris lacinia sapien quis libero nullam sit amet
14398,Linkbridge,mconibeer3k@ezinearticles.com,+351 689 297 0404,id turpis integer aliquet massa id lobortis convallis tortor risus dapibus augue
14135,Topiczoom,amart3l@theguardian.com,+30 446 264 5026,condimentum neque sapien placerat ante nulla justo
14681,Thoughtmix,lfeatley3m@diigo.com,+63 994 807 5603,posuere cubilia curae nulla dapibus dolor
14009,Pixope,aplumbe3n@telegraph.co.uk,+86 188 773 8598,ipsum primis in faucibus orci luctus et ultrices posuere cubilia curae nulla dapibus dolor vel est donec odio
14017,Tagchat,ctyers3o@washington.edu,+62 783 752 3713,viverra dapibus nulla suscipit ligula in lacus curabitur at ipsum ac tellus semper interdum mauris
14625,Browsedrive,jberesfore3p@barnesandnoble.com,+20 247 567 0409,ipsum ac tellus semper interdum mauris ullamcorper
14665,Aimbo,lbexon3q@smugmug.com,+86 261 488 0105,mauris enim leo rhoncus sed vestibulum sit amet cursus id turpis integer aliquet massa id lobortis convallis tortor risus dapibus augue
14564,Einti,tsustins3r@sun.com,+33 508 132 7719,posuere nonummy integer non velit donec diam neque vestibulum eget vulputate ut ultrices vel augue vestibulum ante ipsum primis in faucibus orci luctus
14169,Quatz,ebailes3s@phoca.cz,+48 287 485 9771,aliquet massa id lobortis convallis tortor risus dapibus augue vel accumsan tellus nisi eu orci
13956,Edgeblab,kjinkin3t@psu.edu,+30 138 590 6437,felis sed interdum venenatis turpis enim blandit mi
14256,Jabbersphere,lwehner3u@unc.edu,+63 521 313 7063,sapien varius ut blandit non interdum in ante vestibulum ante
14182,Latz,fcleghorn3v@house.gov,+62 452 107 2026,nec molestie sed justo pellentesque viverra pede ac diam cras pellentesque volutpat dui
14573,Voolith,strusdale3w@bloomberg.com,+976 600 793 7788,mi integer ac neque duis bibendum morbi non quam nec dui luctus rutrum nulla tellus in sagittis
14469,Gigazoom,dgaskoin3x@booking.com,+242 950 119 5584,viverra diam vitae quam suspendisse potenti nullam porttitor lacus at turpis donec posuere metus vitae ipsum aliquam non mauris
14083,Demizz,vmitchell3y@vinaora.com,+46 464 144 9660,sodales scelerisque mauris sit amet eros suspendisse accumsan tortor quis turpis sed ante vivamus tortor duis mattis egestas metus aenean
13940,Oyondu,adalmeida3z@apache.org,+7 576 889 8891,sit amet sapien dignissim vestibulum vestibulum ante ipsum primis in
13902,JumpXS,lhubbert40@surveymonkey.com,+98 683 696 8199,odio donec vitae nisi nam ultrices libero non mattis pulvinar nulla pede ullamcorper augue a suscipit nulla elit ac nulla sed vel enim sit amet
14485,Kayveo,amoody41@about.me,+86 979 119 8063,consequat in consequat ut nulla sed accumsan felis ut at dolor quis odio consequat varius integer ac leo pellentesque ultrices mattis odio
14896,Lajo,kmessier42@blogs.com,+55 742 496 8967,imperdiet nullam orci pede venenatis non
14399,Centizu,acardwell43@virginia.edu,+86 605 346 7851,et tempus semper est quam pharetra magna ac consequat metus sapien ut nunc vestibulum ante ipsum primis
14208,Livefish,ppullan44@pbs.org,+48 702 540 9039,molestie hendrerit at vulputate vitae nisl
14651,Topicblab,zgildersleaves45@mozilla.org,+66 469 570 3866,elementum in hac habitasse platea dictumst morbi vestibulum velit id pretium iaculis diam erat fermentum justo nec condimentum neque sapien placerat
14666,Photobug,cblaschke46@goo.gl,+7 369 809 6218,vestibulum ante ipsum primis in faucibus orci luctus et ultrices posuere cubilia curae donec pharetra magna
14018,Tagtune,ckoop47@ning.com,+33 610 144 8541,sit amet erat nulla tempus vivamus in felis eu
14431,Flashset,gkniveton48@ameblo.jp,+86 891 630 1406,vulputate justo in blandit ultrices enim lorem ipsum dolor sit amet consectetuer adipiscing elit proin interdum mauris non ligula pellentesque
14641,Zava,ppikesley49@google.ru,+33 784 552 3064,morbi a ipsum integer a nibh in quis justo maecenas rhoncus aliquam lacus morbi quis tortor id
14838,Npath,otemby4a@jimdo.com,+86 901 764 2231,potenti in eleifend quam a odio in hac habitasse platea dictumst maecenas ut massa quis augue luctus tincidunt nulla mollis molestie lorem quisque ut
14713,Lazzy,adowne4b@whitehouse.gov,+86 767 153 3723,faucibus accumsan odio curabitur convallis duis consequat dui nec nisi volutpat eleifend donec
14887,Skimia,ssmyley4c@ftc.gov,+86 178 352 2070,metus sapien ut nunc vestibulum ante ipsum primis in faucibus
14281,Yakitri,oelfitt4d@nature.com,+84 359 704 3671,pellentesque at nulla suspendisse potenti cras in purus eu magna vulputate
14799,Camimbo,lmalia4e@sohu.com,+223 130 238 1439,viverra eget congue eget semper rutrum nulla nunc purus phasellus in felis donec semper sapien a libero nam dui proin leo odio
14915,Gevee,mfarnfield4f@army.mil,+358 800 202 1031,lorem quisque ut erat curabitur gravida nisi at nibh in hac habitasse platea dictumst aliquam augue quam sollicitudin vitae consectetuer eget rutrum at lorem integer
14499,Yodo,hclaughton4g@dagondesign.com,+86 498 973 9215,diam neque vestibulum eget vulputate ut ultrices vel augue vestibulum ante ipsum primis in faucibus orci
14646,Pixoboo,hallcoat4h@timesonline.co.uk,+263 101 371 2915,eleifend luctus ultricies eu nibh quisque id justo sit amet sapien dignissim vestibulum vestibulum
14535,Feedfish,sblewitt4i@columbia.edu,+98 385 965 3282,vulputate justo in blandit ultrices enim lorem ipsum dolor sit amet consectetuer adipiscing elit proin interdum mauris non ligula pellentesque
14129,Kazio,jrouby4j@accuweather.com,+371 281 347 2195,est et tempus semper est quam pharetra magna ac consequat metus sapien ut nunc
