SupplierID,SupplierName,SupplierEmail,SupplierPhone,SupplierDescription
6683,Edgewire,cwoolattiy@devhub.com,+81 363 568 3314,libero convallis eget eleifend luctus ultricies eu nibh quisque id justo sit amet sapien
6684,Riffwire,dheathcoatiz@opera.com,+218 704 989 1883,quisque ut erat curabitur gravida nisi at nibh in hac habitasse platea dictumst aliquam augue quam sollicitudin vitae consectetuer eget
6685,Edgetag,bbabbj0@networkadvertising.org,+45 842 402 5547,nullam molestie nibh in lectus pellentesque at nulla
6686,Meeveo,zantalj1@nyu.edu,+86 581 659 8999,volutpat convallis morbi odio odio elementum eu interdum eu tincidunt in leo maecenas pulvinar lobortis est phasellus
6687,Camido,kdressellj2@examiner.com,+351 528 543 6090,lorem integer tincidunt ante vel ipsum praesent blandit lacinia erat vestibulum sed magna at nunc commodo
6688,Avamm,msimakovj3@wikispaces.com,+30 937 757 1472,ultricies eu nibh quisque id justo sit amet sapien dignissim vestibulum vestibulum ante ipsum primis in faucibus orci luctus et ultrices posuere
6689,Edgewire,rhulburtj4@upenn.edu,+93 625 203 4443,eleifend luctus ultricies eu nibh quisque id justo sit amet sapien dignissim vestibulum vestibulum ante ipsum primis in faucibus
6690,Eamia,aricholdj5@go.com,+51 261 813 5659,venenatis lacinia aenean sit amet justo morbi ut odio cras mi pede malesuada in imperdiet et commodo vulputate justo in blandit ultrices
6691,Voomm,aalvenj6@mysql.com,+218 670 833 9209,diam neque vestibulum eget vulputate ut ultrices vel augue vestibulum ante ipsum primis
6692,Rhybox,ecracknallj7@tinypic.com,+380 793 769 8794,blandit non interdum in ante vestibulum
6693,Devbug,mbergj8@rakuten.co.jp,+351 986 216 7413,enim in tempor turpis nec euismod scelerisque quam turpis adipiscing lorem vitae mattis nibh ligula nec sem duis aliquam convallis nunc proin at
6694,Trilia,ospargoj9@bloomberg.com,+375 280 904 7574,ultrices enim lorem ipsum dolor sit amet consectetuer adipiscing elit proin interdum mauris non ligula pellentesque ultrices phasellus id sapien
6695,Flashset,rwhatleyja@amazon.co.jp,+86 253 466 0150,nisl duis ac nibh fusce lacus purus aliquet at feugiat non pretium quis lectus suspendisse potenti in eleifend quam a odio in hac habitasse
6696,Aimbo,cengelbrechtjb@dyndns.org,+66 905 202 9806,odio donec vitae nisi nam ultrices
6697,Trudoo,rnoireljc@baidu.com,+86 159 134 7615,in leo maecenas pulvinar lobortis est phasellus sit amet
6698,Oloo,syanukhinjd@ox.ac.uk,+57 456 376 1174,commodo placerat praesent blandit nam
6699,Trudeo,mshillingje@sakura.ne.jp,+234 641 382 6302,morbi sem mauris laoreet ut rhoncus aliquet pulvinar sed nisl nunc rhoncus dui vel sem sed
6700,Dabjam,rmottershawjf@spiegel.de,+7 678 520 1823,proin leo odio porttitor id consequat in consequat ut nulla sed accumsan felis ut at dolor quis odio consequat varius integer ac leo pellentesque
6701,Zoombeat,fklaffjg@alibaba.com,+27 637 353 2649,diam neque vestibulum eget vulputate ut ultrices vel augue vestibulum ante ipsum primis in faucibus orci luctus et ultrices posuere
6702,Twitterworks,csheftonjh@homestead.com,+86 992 652 4485,maecenas leo odio condimentum id luctus nec molestie sed justo pellentesque viverra pede ac diam cras pellentesque volutpat dui maecenas tristique est et tempus semper
6703,Jabbersphere,wtrassji@webnode.com,+48 922 184 2521,nulla sed vel enim sit amet nunc viverra dapibus
6704,Digitube,mkinsonjj@statcounter.com,+54 422 916 7894,quam sapien varius ut blandit non interdum in ante vestibulum ante
6705,Ozu,jcustedjk@hugedomains.com,+33 686 226 1659,id ornare imperdiet sapien urna pretium nisl ut volutpat sapien arcu sed augue aliquam erat volutpat in congue etiam justo etiam pretium
6706,Geba,ghoffjl@ucsd.edu,+52 378 572 2877,sagittis nam congue risus semper porta volutpat quam pede lobortis ligula sit amet eleifend pede libero quis orci nullam molestie nibh in lectus pellentesque
6707,Yakitri,ahuckerjm@examiner.com,+63 167 103 0413,ultrices libero non mattis pulvinar nulla pede ullamcorper augue a suscipit nulla elit ac nulla sed vel enim sit amet nunc viverra dapibus
6708,Latz,rfearnejn@bloglovin.com,+595 534 742 4531,imperdiet et commodo vulputate justo in blandit ultrices enim lorem ipsum
6709,Eire,gmingeyjo@amazon.co.uk,+7 743 338 2706,tristique in tempus sit amet sem fusce consequat
6710,Lazz,emongetjp@earthlink.net,+48 399 910 2423,pellentesque volutpat dui maecenas tristique est et tempus semper est quam pharetra magna
6711,Snaptags,tmcguffjq@newyorker.com,+86 536 150 5150,pede lobortis ligula sit amet eleifend pede libero quis orci nullam molestie nibh
6712,Fivespan,tlaurensjr@wikispaces.com,+86 336 335 7635,scelerisque mauris sit amet eros suspendisse accumsan tortor quis turpis sed ante vivamus tortor duis mattis egestas metus aenean fermentum donec ut mauris
6713,Quatz,jkemstonjs@blinklist.com,+54 227 604 2130,molestie sed justo pellentesque viverra pede ac diam cras pellentesque
6714,Realpoint,benriquezjt@uiuc.edu,+56 421 813 9584,vel pede morbi porttitor lorem id ligula suspendisse ornare consequat lectus in est
6715,Twinte,sjeaysju@studiopress.com,+62 565 904 4080,vestibulum rutrum rutrum neque aenean auctor gravida sem praesent
6716,Topicshots,ctaylersonjv@purevolume.com,+54 188 190 3199,eu interdum eu tincidunt in leo maecenas pulvinar lobortis est phasellus sit amet erat nulla tempus vivamus in
6717,Buzzbean,wstoditjw@friendfeed.com,+1 759 920 6057,sit amet consectetuer adipiscing elit proin risus praesent lectus
6718,Cogibox,fblanchflowerjx@yahoo.com,+62 421 470 9813,elit proin risus praesent lectus vestibulum quam sapien varius ut blandit non interdum in ante vestibulum ante ipsum
6719,Yozio,mbeloejy@clickbank.net,+387 194 104 9600,nec nisi vulputate nonummy maecenas tincidunt lacus at velit vivamus vel nulla eget eros
6720,Jamia,jmastertonjz@w3.org,+351 218 678 3626,felis sed interdum venenatis turpis enim blandit mi in porttitor pede justo eu massa donec dapibus duis at velit eu est congue elementum in hac
6721,Skidoo,ltrevascusk0@drupal.org,+86 171 642 4768,sit amet eleifend pede libero quis orci nullam molestie nibh in lectus pellentesque at nulla
6722,Twitternation,earnowk1@spotify.com,+63 770 175 8060,faucibus accumsan odio curabitur convallis duis consequat dui
6723,Tagfeed,spenswickk2@ucla.edu,+230 250 464 2908,integer non velit donec diam neque vestibulum
6724,Youtags,cschleswigholsteink3@blinklist.com,+380 394 393 7866,vestibulum sed magna at nunc commodo placerat praesent blandit nam nulla integer pede justo lacinia eget tincidunt eget tempus vel pede
6725,Thoughtstorm,vmcellenk4@edublogs.org,+46 973 910 6495,ligula vehicula consequat morbi a ipsum integer a nibh in quis justo maecenas rhoncus aliquam lacus morbi quis tortor id nulla ultrices
6726,Gabtune,mlefeverk5@godaddy.com,+7 115 920 1456,mattis pulvinar nulla pede ullamcorper augue a suscipit nulla elit ac nulla sed vel enim
6727,Chatterbridge,maldisk6@last.fm,+86 485 619 9733,potenti cras in purus eu magna
6728,Devify,rmarchellik7@elegantthemes.com,+60 128 900 6120,at dolor quis odio consequat varius integer ac leo pellentesque ultrices mattis odio donec
6729,Oyoba,hadelbergk8@google.co.uk,+30 450 535 8224,diam neque vestibulum eget vulputate ut ultrices vel augue vestibulum ante ipsum primis in faucibus orci luctus et ultrices posuere cubilia curae
6730,Kwimbee,bdeavink9@statcounter.com,+48 293 532 5366,donec ut mauris eget massa tempor
6731,Rhynyx,tedisonka@usatoday.com,+385 962 323 7228,non velit nec nisi vulputate nonummy maecenas tincidunt lacus at velit vivamus vel nulla eget eros elementum pellentesque quisque porta volutpat erat quisque
6732,Shuffledrive,agergelykb@europa.eu,+31 378 182 6916,mauris sit amet eros suspendisse accumsan tortor quis
6733,Zoombox,hnaishkc@myspace.com,+86 350 736 1119,placerat praesent blandit nam nulla integer pede justo lacinia eget tincidunt eget tempus vel pede morbi porttitor lorem id ligula suspendisse ornare consequat lectus in
6734,Jabbertype,bdellcasakd@sciencedaily.com,+385 468 427 4625,accumsan tortor quis turpis sed ante vivamus tortor duis mattis egestas metus aenean fermentum donec ut mauris
6735,Oodoo,nrudlandke@phoca.cz,+62 646 963 9341,leo rhoncus sed vestibulum sit amet cursus id turpis integer aliquet massa id lobortis convallis tortor risus dapibus augue vel accumsan tellus nisi eu orci
6736,Vidoo,ktofaninikf@infoseek.co.jp,+46 177 761 8115,ac leo pellentesque ultrices mattis odio donec vitae
6737,Einti,wlassetterkg@last.fm,+7 370 890 5333,urna pretium nisl ut volutpat sapien arcu sed augue aliquam erat volutpat in congue etiam justo etiam pretium iaculis justo in hac habitasse
6738,Vipe,amcelhargykh@biglobe.ne.jp,+264 137 703 7584,morbi odio odio elementum eu interdum
6739,Tazzy,gchansonneki@weebly.com,+47 909 962 2227,libero nam dui proin leo odio porttitor id consequat in consequat ut nulla sed
6740,Roombo,cdellenbrookkj@printfriendly.com,+54 304 985 5071,proin leo odio porttitor id consequat in consequat ut nulla sed
6741,Dablist,jwilkowskikk@google.ru,+86 567 276 6394,luctus et ultrices posuere cubilia curae nulla dapibus dolor vel est donec odio justo sollicitudin ut suscipit a feugiat et eros vestibulum ac est
6742,Janyx,dscraftonkl@slideshare.net,+48 107 291 0174,eget eleifend luctus ultricies eu nibh quisque id justo sit
6743,Yoveo,asiviterkm@friendfeed.com,+62 255 187 3448,pulvinar sed nisl nunc rhoncus dui vel sem sed sagittis nam congue risus semper porta volutpat
6744,Npath,wfulstowkn@stumbleupon.com,+55 887 582 1035,viverra diam vitae quam suspendisse potenti
6745,Tagpad,hpetrieko@salon.com,+218 499 569 2863,ligula pellentesque ultrices phasellus id sapien in sapien iaculis congue vivamus metus arcu adipiscing
6746,Fiveclub,atrowellkp@nationalgeographic.com,+86 256 786 7936,porttitor lacus at turpis donec posuere metus vitae ipsum aliquam non mauris morbi non lectus aliquam
6747,Einti,apitmankq@nih.gov,+234 825 914 5348,pretium quis lectus suspendisse potenti in eleifend quam a odio in hac
6748,Youfeed,ajeffrykr@ucoz.ru,+358 485 812 5379,congue elementum in hac habitasse platea dictumst morbi vestibulum velit id pretium iaculis diam erat fermentum justo nec
6749,Leexo,aackhurstks@yahoo.co.jp,+86 253 538 6754,nunc viverra dapibus nulla suscipit ligula in lacus curabitur at ipsum ac tellus semper interdum mauris ullamcorper purus sit amet nulla
6750,Zoonder,lduffinkt@tripadvisor.com,+1 202 982 6074,ut nunc vestibulum ante ipsum primis in faucibus orci luctus et ultrices posuere cubilia
6751,Zava,dlonghornku@wordpress.org,+62 180 808 9639,eu mi nulla ac enim in tempor turpis nec euismod
6752,Aimbu,wjorgkv@ow.ly,+86 285 982 2948,diam erat fermentum justo nec condimentum neque sapien placerat ante nulla justo aliquam quis turpis eget elit sodales scelerisque mauris sit amet
6753,Talane,jslatefordkw@hatena.ne.jp,+62 802 889 8443,luctus et ultrices posuere cubilia curae donec pharetra magna vestibulum aliquet ultrices erat tortor sollicitudin mi sit amet lobortis
6754,Gabtype,mmundwellkx@myspace.com,+263 256 415 7323,id lobortis convallis tortor risus dapibus augue vel accumsan
6755,Fivespan,cwrenky@wikipedia.org,+46 585 771 7433,luctus tincidunt nulla mollis molestie lorem quisque ut erat
6756,Roombo,rkeavykz@tumblr.com,+223 527 388 7930,varius ut blandit non interdum in ante vestibulum ante ipsum primis in faucibus
6757,Gigabox,dbulmerl0@hao123.com,+55 680 358 6557,quisque ut erat curabitur gravida nisi at nibh in hac habitasse platea dictumst aliquam augue quam sollicitudin vitae consectetuer eget rutrum at lorem integer
6758,Ooba,wmouldenl1@twitter.com,+63 447 272 3834,dui proin leo odio porttitor id consequat in consequat ut nulla sed accumsan
6759,Meemm,eewenl2@foxnews.com,+46 142 364 8421,dictumst etiam faucibus cursus urna ut tellus
6760,Gabtype,amcgilvaryl3@wikipedia.org,+55 254 778 6034,tortor quis turpis sed ante vivamus
6761,Divape,srenniel4@guardian.co.uk,+86 638 318 2640,mauris morbi non lectus aliquam sit amet diam in magna bibendum imperdiet nullam orci pede venenatis non sodales sed tincidunt
6762,Babblestorm,mtraversl5@about.me,+7 561 203 8642,in faucibus orci luctus et ultrices posuere cubilia curae donec pharetra magna vestibulum aliquet ultrices erat tortor sollicitudin mi sit amet lobortis sapien sapien non
6763,Flashpoint,nkovelmannl6@indiegogo.com,+48 471 631 7771,ligula suspendisse ornare consequat lectus in est risus auctor sed tristique in tempus sit
6764,Demivee,rberensl7@time.com,+86 504 164 4690,dis parturient montes nascetur ridiculus mus etiam vel augue vestibulum rutrum rutrum neque aenean auctor gravida sem praesent id massa id
6765,Twitterbeat,ffourmanl8@cnn.com,+599 368 426 4879,sapien sapien non mi integer ac neque duis bibendum morbi non quam nec dui
6766,Dynabox,tgrindlayl9@baidu.com,+62 667 544 0538,neque vestibulum eget vulputate ut ultrices vel augue vestibulum ante ipsum primis in faucibus orci
6767,Oba,hrennickla@go.com,+62 733 435 5048,sagittis dui vel nisl duis ac nibh fusce lacus purus aliquet at feugiat non pretium quis lectus suspendisse potenti
6768,Bluezoom,bcrosslandlb@about.com,+374 265 628 8687,quam a odio in hac habitasse platea dictumst maecenas ut massa
6769,Yodoo,kmacuchadairlc@theguardian.com,+55 901 656 8047,mi pede malesuada in imperdiet et commodo
6770,Gevee,vsculpherld@nih.gov,+63 670 601 6414,nec nisi volutpat eleifend donec ut dolor morbi vel lectus in quam fringilla rhoncus mauris enim leo rhoncus
6771,Centizu,smcaughtriele@dyndns.org,+62 665 434 6518,mauris vulputate elementum nullam varius nulla facilisi cras non velit nec nisi vulputate nonummy maecenas tincidunt lacus at velit
6772,Voolith,dmothlf@loc.gov,+216 617 338 9339,cras mi pede malesuada in imperdiet et commodo vulputate justo in blandit ultrices enim lorem ipsum dolor sit amet consectetuer adipiscing elit proin interdum mauris
6773,Quatz,kfoxtonlg@acquirethisname.com,+351 225 439 3440,lorem quisque ut erat curabitur gravida nisi at nibh in hac habitasse platea dictumst aliquam augue quam
6774,Oba,ischulzelh@flickr.com,+60 534 571 5038,nullam molestie nibh in lectus pellentesque at nulla suspendisse potenti cras in purus eu magna vulputate
6775,Browsetype,gholdrenli@jugem.jp,+62 433 794 1552,morbi sem mauris laoreet ut rhoncus aliquet pulvinar sed nisl nunc rhoncus dui vel sem sed sagittis nam congue risus
6776,Wikizz,btreasadenlj@cisco.com,+95 978 232 8182,sit amet eros suspendisse accumsan tortor quis turpis sed ante vivamus
6777,Eire,zbagguleylk@goo.ne.jp,+380 763 221 3839,pharetra magna ac consequat metus sapien ut
6778,Browsezoom,cnewtonll@bloglines.com,+351 138 861 0450,sagittis dui vel nisl duis ac nibh fusce
6779,Yodel,fstansbylm@privacy.gov.au,+57 670 713 2889,nibh ligula nec sem duis
6780,Bubblemix,dalcidoln@nbcnews.com,+62 577 337 2357,in libero ut massa volutpat convallis morbi odio odio elementum eu interdum eu tincidunt in leo maecenas pulvinar lobortis est phasellus sit amet erat nulla
6781,Innojam,dmacalorenlo@shop-pro.jp,+976 510 808 2338,platea dictumst morbi vestibulum velit
6782,Edgeclub,ubartolomalp@lycos.com,+7 156 814 1828,commodo vulputate justo in blandit ultrices enim lorem ipsum dolor sit amet consectetuer
6783,Gigashots,tfearslq@pbs.org,+33 206 531 0526,fermentum justo nec condimentum neque sapien placerat ante nulla justo aliquam quis turpis eget
6784,Oozz,mbeckelr@bbb.org,+39 820 207 6116,est donec odio justo sollicitudin ut suscipit a feugiat et eros vestibulum ac est lacinia nisi venenatis tristique fusce
6785,Eabox,araymentls@washingtonpost.com,+351 847 830 9908,at lorem integer tincidunt ante vel ipsum praesent blandit lacinia erat vestibulum sed magna at
6786,Tagchat,eglanisterlt@businessweek.com,+86 345 162 0020,cras mi pede malesuada in imperdiet et commodo vulputate justo in blandit ultrices
6787,Twitterwire,fjanlu@twitter.com,+595 747 994 5516,consectetuer adipiscing elit proin interdum mauris non ligula pellentesque ultrices phasellus id sapien in sapien iaculis congue vivamus metus arcu adipiscing molestie hendrerit
6788,Devify,hyarnoldlv@latimes.com,+504 443 450 8614,tortor sollicitudin mi sit amet lobortis sapien sapien non mi integer ac neque duis bibendum
6789,Zoomlounge,kmckomblw@odnoklassniki.ru,+261 756 706 0200,tristique in tempus sit amet sem fusce consequat nulla
6790,Wordware,dchickenlx@dailymail.co.uk,+86 892 892 6798,proin at turpis a pede posuere nonummy integer non velit donec diam neque vestibulum
6791,Thoughtbeat,mguirardinly@ustream.tv,+86 247 849 2793,nulla integer pede justo lacinia eget tincidunt eget tempus vel pede morbi porttitor lorem id ligula suspendisse ornare
6792,Avavee,amackleylz@elegantthemes.com,+54 852 335 6362,nonummy integer non velit donec diam neque vestibulum eget
6793,Tazz,lhugonetm0@domainmarket.com,+420 248 664 2517,odio curabitur convallis duis consequat dui nec nisi volutpat eleifend donec ut dolor morbi vel
6794,Skyndu,acarnem1@live.com,+351 525 803 2702,ipsum primis in faucibus orci luctus et ultrices posuere cubilia curae donec pharetra magna vestibulum aliquet ultrices erat tortor sollicitudin mi sit amet lobortis sapien
6795,Tambee,ystapfordm2@loc.gov,+47 444 274 0906,morbi quis tortor id nulla ultrices aliquet maecenas leo odio condimentum id luctus nec
6796,Livepath,rmincherm3@dropbox.com,+86 578 333 4976,cursus vestibulum proin eu mi nulla ac enim in tempor turpis nec euismod scelerisque quam turpis adipiscing lorem vitae mattis nibh ligula nec sem duis
6797,Zazio,dbromellm4@cdc.gov,+27 913 740 2364,ut massa volutpat convallis morbi odio odio elementum eu interdum
6798,Livetube,medgintonm5@usatoday.com,+351 206 515 5229,eleifend pede libero quis orci nullam molestie nibh in lectus pellentesque at nulla suspendisse potenti cras in
6799,Agivu,kprenem6@google.nl,+62 371 577 8253,lorem quisque ut erat curabitur gravida nisi at nibh in hac habitasse platea dictumst aliquam augue quam sollicitudin vitae consectetuer
6800,Eabox,cartissm7@amazon.co.jp,+967 706 651 1542,quis odio consequat varius integer ac leo pellentesque ultrices mattis odio donec vitae nisi nam ultrices libero non
6801,Oodoo,zgummowm8@thetimes.co.uk,+375 166 842 4793,fusce lacus purus aliquet at feugiat non pretium quis lectus suspendisse potenti in eleifend
6802,Quimba,nstratleym9@imdb.com,+86 722 812 3031,eget tempus vel pede morbi porttitor
6803,Quatz,ebulbrookma@loc.gov,+62 711 749 2090,diam cras pellentesque volutpat dui maecenas tristique est et tempus semper est quam pharetra magna ac consequat metus sapien ut nunc vestibulum ante
6804,Quatz,eclaypoolemb@timesonline.co.uk,+62 864 156 3090,tortor sollicitudin mi sit amet lobortis sapien sapien non mi
6805,Photobug,cjeffelsmc@cnbc.com,+251 265 294 3194,varius nulla facilisi cras non velit nec nisi vulputate nonummy maecenas tincidunt lacus at velit vivamus vel nulla
6806,Jetwire,lcorpmd@networksolutions.com,+7 630 485 5231,risus semper porta volutpat quam pede lobortis ligula sit amet eleifend pede libero quis
6807,Riffpath,bkenworthyme@biglobe.ne.jp,+62 816 854 8303,sapien cum sociis natoque penatibus
6808,Realblab,scaronmf@dagondesign.com,+62 934 150 5666,ante nulla justo aliquam quis turpis eget elit sodales scelerisque mauris sit amet
6809,Dynazzy,wscorthornemg@tamu.edu,+86 338 778 7594,vulputate vitae nisl aenean lectus pellentesque eget nunc
6810,Yakijo,mdumsdaymh@nps.gov,+351 232 590 2156,dolor sit amet consectetuer adipiscing elit proin risus praesent lectus vestibulum quam sapien varius ut blandit non interdum
6811,Babblestorm,hbarmbymi@godaddy.com,+46 611 301 2866,est risus auctor sed tristique in tempus sit amet sem fusce consequat nulla nisl
6812,Browsecat,cmacelhargemj@simplemachines.org,+55 916 558 3216,lacinia erat vestibulum sed magna at nunc commodo placerat praesent blandit nam nulla integer pede justo lacinia eget tincidunt
6813,Dynazzy,lisworthmk@over-blog.com,+54 751 742 6572,lectus vestibulum quam sapien varius ut blandit non interdum in
6814,Leexo,lmuslaml@is.gd,+93 459 509 2879,ligula vehicula consequat morbi a ipsum integer a
6815,Aimbo,pdickonsmm@phoca.cz,+47 849 341 8752,varius integer ac leo pellentesque ultrices mattis odio donec vitae nisi nam ultrices libero non mattis pulvinar
6816,Topiclounge,abeasantmn@sina.com.cn,+230 631 636 2832,maecenas tristique est et tempus semper est quam pharetra magna ac
6817,Jabbercube,adiceymo@cloudflare.com,+249 722 408 4520,nibh ligula nec sem duis aliquam convallis nunc proin at turpis a pede posuere nonummy integer non velit donec diam neque vestibulum eget vulputate ut
6818,Livetube,gjobbingmp@myspace.com,+49 548 888 6118,augue vel accumsan tellus nisi eu orci mauris lacinia sapien quis libero nullam sit amet
6819,Kwilith,ztorransmq@technorati.com,+53 389 334 4983,odio odio elementum eu interdum eu tincidunt in leo maecenas pulvinar lobortis est phasellus sit amet erat nulla tempus vivamus in felis eu sapien cursus
6820,Brainbox,asissemr@hao123.com,+372 600 636 5771,augue aliquam erat volutpat in congue etiam justo etiam pretium iaculis justo
6821,Trudeo,emaccullochms@multiply.com,+251 394 327 4300,non lectus aliquam sit amet
6822,Meejo,itomasonimt@va.gov,+62 414 861 1003,quis orci nullam molestie nibh in lectus pellentesque at nulla suspendisse potenti cras in purus eu
6823,Yakijo,meptonmu@xing.com,+86 436 726 7210,enim in tempor turpis nec euismod scelerisque quam turpis adipiscing
6824,Mymm,ztremellingmv@nasa.gov,+994 689 421 4211,a libero nam dui proin leo odio porttitor id consequat in consequat ut nulla sed accumsan felis ut
6825,Realcube,glangdalemw@flickr.com,+36 240 663 3336,aliquam lacus morbi quis tortor id
6826,Pixope,irudloffmx@apache.org,+62 624 228 6309,sapien arcu sed augue aliquam erat
6827,Twiyo,kdiclaudiomy@sbwire.com,+872 176 987 6487,ligula nec sem duis aliquam convallis nunc proin at turpis a pede posuere nonummy integer non velit donec diam neque vestibulum
6828,Mita,bdysonmz@over-blog.com,+385 846 563 4652,leo pellentesque ultrices mattis odio donec vitae nisi nam ultrices libero non mattis pulvinar
6829,Tanoodle,jjimenon0@loc.gov,+84 321 644 0963,nunc commodo placerat praesent blandit nam nulla integer pede justo lacinia eget tincidunt eget tempus
6830,Youspan,nguyann1@jigsy.com,+1 266 669 1431,maecenas pulvinar lobortis est phasellus sit amet erat nulla tempus vivamus in felis eu sapien cursus vestibulum
6831,Jabbersphere,cneemn2@guardian.co.uk,+57 937 844 0052,vivamus vel nulla eget eros elementum pellentesque quisque porta volutpat erat quisque erat eros viverra eget congue
6832,Trupe,cwintourn3@cpanel.net,+381 592 643 0089,convallis tortor risus dapibus augue vel accumsan tellus nisi eu orci mauris
6833,Realfire,nclingann4@weibo.com,+46 269 130 8681,nec condimentum neque sapien placerat ante nulla justo aliquam quis turpis eget elit sodales scelerisque mauris
6834,Pixonyx,rlarmourn5@businessweek.com,+505 124 177 0898,felis fusce posuere felis sed lacus morbi sem mauris laoreet ut
6835,Zoombeat,srottchern6@microsoft.com,+54 971 403 3612,feugiat non pretium quis lectus suspendisse potenti
6836,Bubblebox,pboramn7@yolasite.com,+30 147 679 5490,vel enim sit amet nunc viverra dapibus nulla suscipit ligula in lacus curabitur at ipsum ac
6837,Flipstorm,gboncoren8@yellowbook.com,+380 493 988 1140,pede lobortis ligula sit amet eleifend pede libero quis orci nullam molestie nibh in lectus pellentesque at nulla
6838,Brainverse,amouldenn9@vimeo.com,+62 577 350 4270,eget elit sodales scelerisque mauris sit
6839,Aimbu,haharonina@state.tx.us,+34 946 675 6252,mi in porttitor pede justo eu massa donec dapibus duis at velit eu est congue elementum in
6840,Kazio,bcopingnb@xrea.com,+62 499 451 1012,venenatis turpis enim blandit mi in porttitor pede justo
6841,Oyoba,ypulsfordnc@stumbleupon.com,+7 976 379 0694,nulla neque libero convallis eget eleifend luctus ultricies eu nibh quisque id justo sit amet sapien dignissim vestibulum vestibulum ante ipsum primis in faucibus orci
6842,Linkbuzz,mtapsonnd@unc.edu,+86 824 188 7916,sem mauris laoreet ut rhoncus aliquet pulvinar sed nisl nunc rhoncus
6843,Meetz,clikelyne@ibm.com,+258 170 288 6238,nibh ligula nec sem duis aliquam convallis nunc proin
6844,Snaptags,dfarmloenf@economist.com,+86 407 683 7448,luctus ultricies eu nibh quisque id justo sit amet sapien dignissim vestibulum
6845,Zoomlounge,aotterwellng@smh.com.au,+502 379 383 0194,consequat lectus in est risus auctor sed tristique in
6846,Riffpath,ifarfolomeevnh@dropbox.com,+420 570 453 5100,quam turpis adipiscing lorem vitae mattis nibh ligula nec sem duis aliquam convallis nunc proin at turpis
6847,Skynoodle,cchristophersonni@last.fm,+86 405 543 0648,dapibus augue vel accumsan tellus nisi eu orci mauris lacinia sapien quis libero nullam sit amet turpis elementum ligula
6848,Wordtune,liannuzzinj@weibo.com,+48 210 664 7359,eleifend donec ut dolor morbi vel lectus in quam
6849,Feedspan,tflecknoenk@irs.gov,+48 971 381 0174,platea dictumst maecenas ut massa quis augue luctus tincidunt
6850,Yata,fblaxtonnl@nymag.com,+86 113 740 2621,diam in magna bibendum imperdiet nullam orci pede venenatis non
6851,Plajo,lswitzernm@naver.com,+385 451 210 9325,sapien cum sociis natoque penatibus et magnis dis parturient montes nascetur ridiculus mus etiam vel augue vestibulum rutrum rutrum neque aenean auctor gravida sem
6852,Zooxo,amcginleynn@wikia.com,+86 627 212 0081,quis odio consequat varius integer ac leo pellentesque ultrices mattis odio donec vitae nisi
6853,Yotz,hrucklesseno@cocolog-nifty.com,+84 477 161 0671,metus arcu adipiscing molestie hendrerit at vulputate vitae nisl aenean lectus pellentesque eget nunc
6854,Brightdog,wsabathenp@whitehouse.gov,+54 757 803 6068,cras mi pede malesuada in imperdiet et commodo vulputate justo in blandit ultrices enim
6855,Linktype,hdeningtonnq@narod.ru,+234 224 674 6689,eros viverra eget congue eget semper rutrum nulla nunc
6856,Yodo,tpeintonnr@google.co.jp,+62 700 722 6531,mauris sit amet eros suspendisse accumsan tortor quis turpis sed ante vivamus tortor
6857,Innotype,gbraidonns@va.gov,+63 885 918 0100,ligula vehicula consequat morbi a ipsum integer
