SupplierID,SupplierName,SupplierEmail,SupplierPhone,SupplierDescription
14362,Skinder,scoytesiy@t-online.de,+7 418 543 8360,curabitur convallis duis consequat dui nec nisi volutpat eleifend donec ut dolor morbi vel lectus in quam fringilla rhoncus
14899,Flashspan,pdurieiz@wired.com,+47 406 326 0212,curabitur gravida nisi at nibh in hac habitasse platea dictumst aliquam augue quam sollicitudin vitae consectetuer eget rutrum at lorem integer tincidunt ante vel
14726,Zooxo,sfeldhammerj0@mysql.com,+47 328 458 8424,interdum mauris non ligula pellentesque ultrices phasellus id sapien in sapien iaculis congue vivamus metus arcu adipiscing molestie hendrerit
14710,Trunyx,okimblyj1@adobe.com,+86 291 415 8165,eros viverra eget congue eget semper rutrum nulla nunc purus phasellus in felis donec
14481,Kazio,cduckitj2@psu.edu,+62 713 532 8673,ut volutpat sapien arcu sed augue aliquam erat volutpat in congue etiam justo etiam pretium iaculis justo in hac habitasse platea dictumst etiam faucibus
14266,Kare,vevelynj3@hibu.com,+48 461 489 5382,mauris laoreet ut rhoncus aliquet
14885,Podcat,bdeverauxj4@lycos.com,+351 463 750 1856,nulla ut erat id mauris vulputate elementum nullam varius nulla facilisi cras non velit nec nisi vulputate nonummy maecenas tincidunt lacus at velit vivamus vel
14327,Gabtune,kchessorj5@imdb.com,+63 751 887 6686,a ipsum integer a nibh in quis justo maecenas rhoncus aliquam lacus morbi quis tortor
14924,Trudeo,ctemlj6@taobao.com,+81 793 860 5491,ante ipsum primis in faucibus orci luctus et
14033,Edgeclub,kreisenbergj7@yolasite.com,+86 727 796 0437,tincidunt nulla mollis molestie lorem quisque ut erat curabitur gravida nisi at nibh in hac habitasse platea dictumst aliquam
14976,Tagtune,vgouldebyj8@nasa.gov,+256 666 748 3914,vestibulum quam sapien varius ut blandit non interdum in ante vestibulum ante ipsum primis in faucibus orci luctus et ultrices posuere cubilia
14225,Tagchat,htocherj9@constantcontact.com,+231 553 817 3610,libero non mattis pulvinar nulla pede ullamcorper augue a suscipit nulla elit ac nulla sed
13989,Voonix,mpridgeonja@pbs.org,+86 927 721 7966,in hac habitasse platea dictumst morbi vestibulum velit id pretium iaculis diam erat fermentum justo nec condimentum neque sapien placerat
14030,Yodoo,kmatieujb@devhub.com,+7 939 943 8146,ut ultrices vel augue vestibulum ante ipsum primis in faucibus orci luctus et ultrices posuere cubilia curae donec
14260,Eazzy,jclotherjc@ox.ac.uk,+962 738 532 5177,potenti in eleifend quam a odio in hac habitasse platea dictumst maecenas ut massa quis augue luctus tincidunt
14274,Dabfeed,acazereaujd@about.com,+380 403 558 0886,rutrum rutrum neque aenean auctor gravida sem praesent id massa id
14996,Photospace,lverdieje@dot.gov,+856 911 859 5680,congue vivamus metus arcu adipiscing molestie hendrerit at vulputate vitae nisl aenean lectus pellentesque eget nunc donec quis orci eget orci vehicula condimentum
14181,Mydeo,gklynjf@columbia.edu,+62 366 196 4393,orci vehicula condimentum curabitur in libero ut massa volutpat convallis morbi odio odio elementum eu interdum eu tincidunt in leo
14265,Skimia,rmcgormanjg@cocolog-nifty.com,+33 529 195 8652,ac lobortis vel dapibus at diam nam tristique tortor
14750,Buzzdog,ldefontjh@va.gov,+48 761 418 6553,at turpis a pede posuere nonummy
14331,Pixoboo,gcogdellji@goo.gl,+63 428 777 9252,mauris morbi non lectus aliquam sit amet diam in magna bibendum imperdiet nullam orci pede venenatis non sodales sed tincidunt eu
14031,Edgeify,jkilbeyjj@bloomberg.com,+86 526 431 4554,duis at velit eu est
14715,Riffwire,cbrogiottijk@howstuffworks.com,+223 127 784 9082,mauris viverra diam vitae quam suspendisse potenti nullam porttitor lacus at turpis donec posuere metus
14595,Kanoodle,hpagittjl@privacy.gov.au,+62 484 487 2111,mattis pulvinar nulla pede ullamcorper augue a suscipit nulla elit ac nulla sed vel enim sit
14634,Oyope,fkuhntjm@ftc.gov,+351 331 971 9804,pharetra magna vestibulum aliquet ultrices erat tortor sollicitudin mi sit amet lobortis sapien sapien non mi integer ac neque duis
14602,Tagtune,ckealeyjn@topsy.com,+54 360 277 4493,ridiculus mus etiam vel augue vestibulum rutrum rutrum neque aenean auctor gravida sem praesent id massa id nisl venenatis lacinia aenean sit
14017,Lazzy,fsucklingjo@github.io,+7 869 532 5202,sem sed sagittis nam congue risus semper porta volutpat quam pede lobortis
14452,Dabtype,mlerhinanjp@sakura.ne.jp,+216 929 823 3580,pede libero quis orci nullam molestie nibh in lectus pellentesque at nulla suspendisse potenti cras in
14438,Kazu,cpickringjq@dot.gov,+46 602 211 1515,nullam porttitor lacus at turpis donec posuere metus vitae ipsum aliquam non mauris morbi non lectus aliquam sit amet
14192,Kwilith,cfarendenjr@barnesandnoble.com,+62 396 534 7468,tincidunt nulla mollis molestie lorem quisque ut erat curabitur gravida nisi at nibh in hac habitasse platea dictumst aliquam augue quam
14250,Trunyx,ireignoldsjs@techcrunch.com,+62 433 970 8651,eu sapien cursus vestibulum proin eu mi nulla ac enim in tempor
14346,Dabjam,abratcherjt@t-online.de,+86 867 264 7901,curabitur in libero ut massa volutpat
14482,Yadel,agrassotju@dyndns.org,+52 184 439 4161,quis turpis eget elit sodales scelerisque mauris sit amet eros suspendisse accumsan tortor quis turpis sed ante vivamus tortor duis mattis egestas metus aenean fermentum
14544,Fadeo,hmazzillijv@statcounter.com,+355 194 801 8085,donec pharetra magna vestibulum aliquet ultrices erat tortor sollicitudin mi sit amet lobortis sapien sapien non
14846,Oyope,lvanderkruisjw@alexa.com,+382 735 412 6390,et ultrices posuere cubilia curae nulla dapibus dolor
13913,Zazio,hsieghardjx@fema.gov,+371 601 594 9946,at ipsum ac tellus semper interdum mauris ullamcorper purus sit
14673,Pixope,jwakelyjy@marketwatch.com,+86 137 553 6284,nulla nunc purus phasellus in felis
14608,Yoveo,fgoligherjz@salon.com,+7 320 385 9549,eros vestibulum ac est lacinia nisi venenatis tristique fusce congue diam id ornare imperdiet sapien urna pretium nisl ut volutpat
14070,Tagcat,ggranek0@msn.com,+251 235 449 4813,nunc rhoncus dui vel sem sed sagittis nam congue risus
14535,Roombo,bgirodierk1@123-reg.co.uk,+62 705 692 4283,tristique fusce congue diam id ornare imperdiet sapien urna pretium nisl ut volutpat sapien arcu
14323,Twimm,gakermank2@washingtonpost.com,+7 630 403 1966,lorem ipsum dolor sit amet consectetuer adipiscing elit proin risus praesent lectus vestibulum quam sapien varius ut blandit
14747,Eazzy,tbraunek3@dyndns.org,+62 411 758 3522,in blandit ultrices enim lorem ipsum dolor sit amet consectetuer adipiscing elit proin interdum mauris non ligula pellentesque ultrices phasellus id sapien in
13954,Mydo,ashelmerdinek4@vimeo.com,+86 931 558 7786,bibendum felis sed interdum venenatis turpis enim blandit mi in porttitor pede justo eu massa donec dapibus duis at velit eu est
14955,Voonte,vspradberyk5@webmd.com,+62 125 304 2070,ultrices libero non mattis pulvinar nulla pede ullamcorper augue a suscipit nulla elit
14636,Oodoo,jcasacciok6@usgs.gov,+55 404 599 0207,eros suspendisse accumsan tortor quis turpis sed ante vivamus tortor duis mattis egestas metus aenean fermentum donec ut mauris eget massa
14899,Dynava,reymerk7@wsj.com,+86 879 478 5817,at ipsum ac tellus semper interdum mauris ullamcorper purus sit amet nulla quisque arcu
14072,Zoombeat,malessandrinik8@wisc.edu,+62 289 582 1431,sodales sed tincidunt eu felis
14732,Mybuzz,noddiek9@purevolume.com,+81 752 873 0839,tortor quis turpis sed ante vivamus tortor duis mattis egestas metus aenean fermentum donec ut mauris eget massa tempor convallis nulla
14764,Fivespan,rainsbyka@yahoo.co.jp,+36 328 927 9156,orci luctus et ultrices posuere cubilia curae mauris viverra diam vitae quam
14919,Rooxo,rbroseniuskb@imdb.com,+48 418 298 0158,lectus aliquam sit amet diam in magna bibendum imperdiet nullam orci pede venenatis non sodales sed tincidunt eu
13946,Bubbletube,gpawelkekc@google.cn,+20 649 911 8074,aenean auctor gravida sem praesent id massa id nisl venenatis lacinia aenean sit amet justo morbi ut odio
14934,Bubblemix,jbartholatkd@bloglovin.com,+420 909 719 0828,convallis eget eleifend luctus ultricies eu nibh quisque id
14184,Voomm,okennellyke@irs.gov,+850 108 171 8314,vestibulum sed magna at nunc commodo placerat praesent blandit nam nulla integer pede justo lacinia eget tincidunt eget tempus vel pede morbi porttitor lorem
13982,Feedfire,gdackombekf@blogger.com,+55 309 617 2990,risus praesent lectus vestibulum quam sapien varius ut blandit non interdum in ante vestibulum ante ipsum primis in faucibus
14961,Meevee,jgogginkg@census.gov,+227 891 460 3688,tristique est et tempus semper est quam pharetra magna ac consequat metus
14276,Aivee,ccratkh@sphinn.com,+967 668 492 0737,quis libero nullam sit amet turpis elementum ligula vehicula consequat morbi a ipsum
14319,Jaloo,jlambrichtki@illinois.edu,+62 294 241 2459,venenatis lacinia aenean sit amet justo morbi ut odio cras mi
14099,Linkbridge,ubottomleykj@ifeng.com,+351 956 463 6175,dictumst aliquam augue quam sollicitudin vitae consectetuer eget rutrum at lorem integer tincidunt
14945,Babbleset,keverallkk@slashdot.org,+62 103 712 1242,mattis odio donec vitae nisi nam ultrices libero non mattis pulvinar nulla pede ullamcorper augue a suscipit
14318,Podcat,ggreenleeskl@unicef.org,+53 224 298 5877,amet sem fusce consequat nulla nisl nunc nisl duis bibendum felis sed interdum
14121,Youtags,jperrellekm@smh.com.au,+62 691 708 9320,lacinia aenean sit amet justo morbi ut odio cras mi pede malesuada in imperdiet et commodo
14523,Podcat,rburlekn@narod.ru,+86 627 915 6322,consectetuer adipiscing elit proin risus praesent lectus vestibulum quam sapien varius ut blandit non interdum in ante vestibulum
14204,Tagopia,deddollsko@amazon.com,+677 996 784 4484,sapien placerat ante nulla justo aliquam quis
14406,Topiczoom,akirwoodkp@t.co,+374 133 903 4388,viverra pede ac diam cras pellentesque volutpat dui maecenas tristique est et tempus semper est quam pharetra
14565,Dablist,tnewmankq@geocities.com,+86 539 573 3327,dis parturient montes nascetur ridiculus mus etiam vel augue vestibulum rutrum rutrum neque aenean auctor gravida sem praesent id massa id
14369,Mynte,cglasscottkr@soundcloud.com,+55 244 522 9667,tellus nisi eu orci mauris lacinia sapien quis libero nullam sit amet turpis elementum ligula vehicula consequat
14068,Zoovu,hcaseriks@nsw.gov.au,+7 457 506 9322,sapien sapien non mi integer ac neque
14489,Photolist,gdykekt@reverbnation.com,+30 497 252 7232,dictumst etiam faucibus cursus urna ut tellus nulla ut erat id mauris vulputate elementum nullam varius nulla facilisi cras non velit nec nisi vulputate nonummy
14473,Rhynyx,wcreelmanku@businesswire.com,+62 809 784 2072,ornare imperdiet sapien urna pretium nisl ut volutpat sapien arcu sed augue
14596,Eimbee,talphonsokv@fc2.com,+86 809 237 2265,nec sem duis aliquam convallis nunc proin at turpis a pede posuere
14591,Tambee,aelderbrantkw@phoca.cz,+507 424 733 3248,nascetur ridiculus mus vivamus vestibulum sagittis sapien cum sociis natoque penatibus et magnis dis parturient montes nascetur ridiculus mus etiam vel augue vestibulum rutrum rutrum
14359,Kwideo,leliezkx@timesonline.co.uk,+380 949 919 7431,pretium quis lectus suspendisse potenti in eleifend quam a odio in hac habitasse platea dictumst maecenas ut massa quis augue
14475,Wordtune,lruckky@sohu.com,+62 843 477 7859,metus vitae ipsum aliquam non mauris morbi non lectus aliquam sit amet
14009,Photobug,esanperkz@gizmodo.com,+62 941 410 5161,vestibulum eget vulputate ut ultrices vel augue
14064,Izio,kcaldarol0@dailymotion.com,+63 675 176 1285,etiam justo etiam pretium iaculis justo in hac habitasse platea dictumst etiam faucibus cursus urna ut
14876,Zooveo,ccornelll1@blogtalkradio.com,+86 681 974 0657,odio condimentum id luctus nec molestie sed justo pellentesque viverra pede ac diam cras pellentesque volutpat dui maecenas tristique est et tempus semper est quam
14900,Buzzster,mnighl2@furl.net,+86 539 601 5589,nascetur ridiculus mus etiam vel augue vestibulum rutrum rutrum neque aenean auctor gravida sem
14768,Wordtune,ystathersl3@skyrock.com,+30 855 963 5303,sapien cum sociis natoque penatibus et magnis dis parturient montes
14659,Meemm,ngeallel4@telegraph.co.uk,+46 652 292 2850,sagittis dui vel nisl duis
14286,Topicstorm,kvasilischevl5@ftc.gov,+48 248 598 3309,purus aliquet at feugiat non pretium quis lectus suspendisse potenti in eleifend quam a odio in
14536,Rooxo,pwalbyl6@topsy.com,+234 829 626 5491,pede malesuada in imperdiet et commodo vulputate justo in blandit ultrices enim lorem ipsum
14428,Divape,dgullefordl7@economist.com,+62 176 845 6236,tempor turpis nec euismod scelerisque quam turpis adipiscing lorem vitae mattis nibh ligula
14047,Zoovu,shunl8@g.co,+33 951 874 0995,suscipit nulla elit ac nulla sed vel enim sit amet nunc viverra dapibus nulla suscipit ligula in lacus curabitur at ipsum ac tellus semper
14039,JumpXS,aakhurstl9@cbslocal.com,+86 905 508 4851,et ultrices posuere cubilia curae donec pharetra magna
13988,Yambee,klantuffela@friendfeed.com,+351 215 529 6765,tempor turpis nec euismod scelerisque quam turpis adipiscing lorem vitae mattis nibh ligula nec sem duis aliquam convallis nunc proin at turpis a pede
14394,Camido,epautelb@mail.ru,+1 166 357 5192,nunc purus phasellus in felis
14787,Rhyzio,gharbylc@naver.com,+86 805 351 7488,aliquet ultrices erat tortor sollicitudin mi sit amet lobortis sapien sapien non mi integer ac neque duis bibendum morbi non quam nec
14536,Edgeclub,dcotheyld@gizmodo.com,+55 112 665 5843,potenti in eleifend quam a odio in hac habitasse platea dictumst
14069,Browsebug,fbakewellle@ebay.co.uk,+86 830 911 4234,tellus semper interdum mauris ullamcorper purus sit amet nulla quisque arcu libero rutrum ac lobortis vel dapibus at diam nam tristique tortor eu
14699,Divanoodle,hhulcooplf@nps.gov,+81 544 879 2041,condimentum id luctus nec molestie sed justo pellentesque
14289,Riffpedia,edeblasilg@twitter.com,+52 405 629 6962,suscipit a feugiat et eros vestibulum ac est lacinia nisi venenatis tristique fusce
14734,Devify,jcainlh@ftc.gov,+86 115 387 9613,posuere cubilia curae mauris viverra diam vitae quam suspendisse potenti nullam porttitor
14602,Kimia,lpowlandli@adobe.com,+63 500 990 8770,dignissim vestibulum vestibulum ante ipsum primis in faucibus orci luctus et ultrices posuere cubilia curae nulla dapibus dolor vel est donec odio
14037,Plambee,ewoolhamlj@constantcontact.com,+33 847 469 3526,vulputate luctus cum sociis natoque penatibus et magnis
14494,Podcat,nhoofelk@cdbaby.com,+353 112 963 3171,quisque ut erat curabitur gravida nisi at nibh in hac habitasse platea dictumst aliquam augue quam sollicitudin vitae consectetuer eget rutrum at lorem integer tincidunt
14990,Jetwire,cbucknerll@pcworld.com,+48 863 543 1241,vestibulum ante ipsum primis in faucibus orci luctus et ultrices posuere cubilia curae duis faucibus accumsan odio curabitur convallis duis consequat dui nec nisi
14518,Trilia,gloosmorelm@mozilla.org,+351 175 764 3546,nec condimentum neque sapien placerat ante nulla justo aliquam quis turpis eget elit sodales scelerisque mauris
14539,Meejo,telsegoodln@purevolume.com,+353 691 440 3727,tincidunt nulla mollis molestie lorem quisque ut erat curabitur gravida nisi at nibh in hac habitasse platea dictumst aliquam augue quam sollicitudin vitae consectetuer
14329,Browsecat,rdavielo@imgur.com,+86 284 937 4979,primis in faucibus orci luctus et ultrices posuere
14033,Realmix,amccrackenlp@msn.com,+54 574 792 8792,donec quis orci eget orci vehicula condimentum curabitur in libero ut
14208,Zoovu,wextancelq@addthis.com,+7 681 612 6238,lacus at velit vivamus vel nulla eget eros elementum pellentesque quisque porta volutpat erat quisque erat eros
14508,Centizu,mmattislr@plala.or.jp,+380 141 551 8878,posuere nonummy integer non velit
14420,Meevee,mkitchenls@aol.com,+62 158 228 3420,rhoncus aliquam lacus morbi quis tortor
14790,Midel,arupplt@techcrunch.com,+48 725 674 3708,tincidunt in leo maecenas pulvinar lobortis est phasellus sit amet erat nulla tempus vivamus in felis eu sapien cursus vestibulum proin eu
14875,Mita,gjoscelinlu@google.es,+55 980 545 2347,massa quis augue luctus tincidunt nulla mollis molestie lorem quisque ut erat curabitur gravida nisi at nibh in hac habitasse platea dictumst aliquam
14633,Twitterbeat,lpauellv@state.gov,+420 894 757 6408,libero rutrum ac lobortis vel dapibus at diam nam
14999,Dabfeed,lcassedylw@miitbeian.gov.cn,+86 499 700 9321,tempor turpis nec euismod scelerisque quam turpis
14532,Izio,mrathmelllx@paginegialle.it,+48 341 821 7880,sem praesent id massa id nisl venenatis lacinia aenean sit amet justo morbi ut odio cras mi pede
14495,Youspan,alamblinly@theatlantic.com,+7 864 234 8331,ultrices erat tortor sollicitudin mi sit amet lobortis sapien sapien non mi integer ac neque duis bibendum morbi non quam
14171,Lajo,mbriatlz@nyu.edu,+420 652 655 9070,semper rutrum nulla nunc purus phasellus in felis donec semper sapien a libero nam dui proin leo odio
14845,Minyx,dzemlerm0@phoca.cz,+1 916 873 2251,volutpat sapien arcu sed augue aliquam erat volutpat in congue etiam justo etiam pretium iaculis justo in hac habitasse platea dictumst etiam faucibus
14017,Babbleopia,jhalfpennym1@t-online.de,+351 554 430 9643,in consequat ut nulla sed accumsan felis ut at dolor
14170,Shuffletag,mengehamm2@homestead.com,+502 260 581 6224,bibendum morbi non quam nec dui luctus rutrum nulla tellus in sagittis dui vel nisl duis ac nibh fusce lacus purus aliquet at feugiat
14172,Thoughtblab,rmattackm3@photobucket.com,+7 674 201 8967,ipsum ac tellus semper interdum mauris ullamcorper purus sit amet nulla quisque arcu libero rutrum ac lobortis vel
14159,Dazzlesphere,moveralm4@mapy.cz,+63 703 399 3335,suspendisse potenti nullam porttitor lacus at turpis donec posuere metus vitae ipsum aliquam non
14882,Yakijo,fdaethm5@apple.com,+33 468 502 6777,et ultrices posuere cubilia curae mauris viverra diam vitae
14546,Oyope,nsharrocksm6@oakley.com,+55 121 958 7470,proin leo odio porttitor id consequat in consequat ut nulla sed accumsan felis ut at dolor quis odio consequat varius integer ac
14372,Twinte,rrustanm7@bandcamp.com,+260 269 518 4444,nulla sed accumsan felis ut
14304,Twiyo,smagrannellm8@cpanel.net,+238 288 659 8736,tortor quis turpis sed ante vivamus tortor duis mattis egestas metus aenean fermentum donec ut mauris eget massa tempor convallis nulla neque
14841,Zoomlounge,rmoncurm9@comsenz.com,+62 172 209 6962,nisi nam ultrices libero non mattis pulvinar nulla pede ullamcorper augue a suscipit nulla elit ac
14457,InnoZ,jdoyleyma@theglobeandmail.com,+86 692 496 1112,ultrices posuere cubilia curae duis faucibus accumsan odio curabitur convallis duis consequat dui nec nisi
14468,Brainverse,eocollopymb@msn.com,+7 380 345 9886,luctus rutrum nulla tellus in sagittis dui vel nisl duis ac nibh fusce lacus
14321,Kaymbo,zmortonmc@home.pl,+7 809 236 1840,in lectus pellentesque at nulla suspendisse potenti cras
14304,Wikizz,mmcquilliammd@bluehost.com,+55 123 259 3220,auctor gravida sem praesent id massa id nisl venenatis lacinia aenean sit amet justo morbi ut odio cras mi pede
14618,Dabtype,tmattacksme@oakley.com,+358 999 338 5871,nulla eget eros elementum pellentesque quisque porta volutpat erat quisque erat eros viverra eget congue eget
14816,Izio,gsturdeymf@g.co,+30 251 462 2328,et ultrices posuere cubilia curae nulla
14913,Youbridge,sjindacekmg@examiner.com,+62 967 462 7751,non velit donec diam neque vestibulum eget vulputate ut ultrices vel
14927,Livepath,emagrannellmh@wikispaces.com,+30 897 713 0779,fermentum donec ut mauris eget massa tempor convallis nulla neque libero convallis eget eleifend luctus ultricies eu nibh quisque
14295,Edgeify,belegoodmi@purevolume.com,+86 341 318 2022,amet turpis elementum ligula vehicula consequat morbi a ipsum integer a nibh in quis justo maecenas rhoncus aliquam lacus morbi
14356,Skyba,jcorromj@multiply.com,+86 911 968 6863,pede malesuada in imperdiet et
14365,Meejo,dgreslymk@eepurl.com,+81 903 435 2387,ultrices posuere cubilia curae nulla dapibus dolor vel est donec odio justo sollicitudin ut suscipit a feugiat et eros vestibulum ac est lacinia
14980,Dynava,kvernauml@cargocollective.com,+86 243 897 4143,vel enim sit amet nunc viverra dapibus nulla suscipit ligula in lacus curabitur at ipsum ac tellus semper interdum mauris
14091,Quamba,asivornmm@theglobeandmail.com,+63 292 210 2117,pulvinar nulla pede ullamcorper augue
14549,Edgeify,cwickiemn@usgs.gov,+505 973 446 6862,parturient montes nascetur ridiculus mus etiam vel augue vestibulum rutrum rutrum neque aenean auctor gravida sem praesent id massa id
14568,Browseblab,aromaynemo@fema.gov,+506 208 754 3657,potenti in eleifend quam a odio in hac habitasse platea dictumst maecenas ut massa quis augue luctus tincidunt nulla
14194,Yacero,lfieldstonemp@dailymotion.com,+55 508 489 5698,urna ut tellus nulla ut erat id mauris
14166,Tagopia,bdonnanmq@jalbum.net,+86 240 344 6878,dui luctus rutrum nulla tellus in sagittis dui vel nisl duis ac nibh fusce lacus purus aliquet at
14832,Riffwire,psterlingmr@craigslist.org,+48 984 582 6955,vivamus tortor duis mattis egestas metus aenean fermentum donec ut mauris eget massa tempor convallis nulla neque libero
14903,Dablist,cwillbondms@g.co,+33 427 939 8300,eu mi nulla ac enim in tempor turpis
14782,Snaptags,tgilyattmt@histats.com,+95 716 229 9439,vel ipsum praesent blandit lacinia erat vestibulum sed magna at nunc
14234,Gigashots,pvarvellmu@ehow.com,+34 696 981 0628,platea dictumst etiam faucibus cursus urna ut tellus nulla ut erat id mauris vulputate elementum nullam varius nulla facilisi
14722,Edgeify,lwalshmv@cocolog-nifty.com,+86 402 179 9376,maecenas tristique est et tempus semper est quam pharetra magna ac consequat metus sapien ut
14498,Mynte,tbeattiemw@redcross.org,+62 580 964 6393,diam cras pellentesque volutpat dui maecenas tristique est et tempus semper est quam pharetra magna ac consequat metus sapien ut nunc vestibulum ante ipsum primis
14546,Fivespan,abalasinimx@geocities.com,+30 197 493 6732,volutpat erat quisque erat eros viverra eget congue eget semper rutrum nulla nunc purus phasellus in
14015,Dynava,mdifriscomy@multiply.com,+46 409 998 8966,sodales sed tincidunt eu felis fusce posuere felis sed lacus morbi sem mauris laoreet ut
14877,Roombo,bwhitehornemz@storify.com,+7 294 714 2450,sapien placerat ante nulla justo aliquam quis turpis eget elit sodales scelerisque mauris
14774,Wikizz,lcollenn0@vistaprint.com,+33 990 904 9864,sit amet sapien dignissim vestibulum vestibulum ante ipsum primis in faucibus orci luctus et ultrices posuere
14807,Vinte,akerinn1@psu.edu,+86 205 339 2066,mi sit amet lobortis sapien sapien non mi integer ac neque duis bibendum morbi non quam nec dui luctus rutrum nulla tellus in
14277,Jaxnation,ewithringtonn2@oakley.com,+420 894 243 6034,bibendum felis sed interdum venenatis turpis enim blandit mi in porttitor pede justo eu massa donec
14825,Leexo,wdrohanen3@ycombinator.com,+62 427 272 7515,aliquet pulvinar sed nisl nunc rhoncus dui vel sem sed sagittis nam congue risus semper
14291,Oodoo,lladenn4@prweb.com,+55 906 338 5955,nullam molestie nibh in lectus pellentesque at nulla suspendisse potenti cras
14368,Buzzbean,jleleun5@flickr.com,+46 154 587 6136,nullam varius nulla facilisi cras non velit
14189,Omba,jmeredithn6@hud.gov,+56 894 706 6131,quam a odio in hac habitasse platea dictumst maecenas ut massa quis augue luctus tincidunt nulla mollis molestie lorem quisque ut
14369,Yoveo,raubertn7@lulu.com,+86 630 922 9085,eget rutrum at lorem integer tincidunt ante
14764,Twinte,lpowen8@jalbum.net,+48 392 751 8409,in imperdiet et commodo vulputate justo in blandit ultrices enim
14191,Katz,wcastillen9@friendfeed.com,+63 159 351 7656,tellus nisi eu orci mauris
14500,Oloo,mglandna@about.me,+63 547 745 2837,gravida sem praesent id massa id nisl venenatis lacinia aenean sit amet justo morbi ut
14347,Midel,mpetriknb@moonfruit.com,+86 347 860 0034,urna pretium nisl ut volutpat sapien arcu sed augue
14823,Bluejam,cgrigorinc@cyberchimps.com,+358 257 116 9100,luctus rutrum nulla tellus in sagittis dui vel nisl duis ac nibh fusce lacus purus aliquet
14154,Voonder,labramind@buzzfeed.com,+86 370 974 5158,semper sapien a libero nam dui proin leo odio porttitor id consequat in consequat
14917,Browsecat,gboynne@wisc.edu,+505 478 677 4937,accumsan odio curabitur convallis duis consequat dui nec nisi volutpat eleifend donec ut dolor morbi vel lectus in
14069,Bubbletube,cbeurichnf@taobao.com,+81 507 687 8757,a suscipit nulla elit ac nulla sed vel enim sit amet nunc viverra dapibus nulla suscipit ligula
14965,Plajo,khaworthng@tinyurl.com,+34 341 323 4061,luctus rutrum nulla tellus in sagittis dui vel nisl duis ac nibh fusce lacus purus aliquet at feugiat non pretium quis lectus suspendisse
14116,Realpoint,bledinghamnh@usatoday.com,+245 702 554 3389,nulla sed accumsan felis ut at dolor quis odio consequat varius integer ac leo pellentesque ultrices mattis odio donec vitae nisi nam
13922,Meetz,cvigorsni@amazon.co.jp,+63 467 231 5627,ipsum praesent blandit lacinia erat vestibulum sed magna at nunc commodo
14518,Yamia,bvarrannj@cnn.com,+33 862 808 0828,ac consequat metus sapien ut nunc vestibulum ante ipsum primis in faucibus orci luctus et ultrices
14333,Aimbo,cgellingnk@tripadvisor.com,+86 256 409 5242,donec semper sapien a libero nam dui
14481,Feedspan,mcadmannl@google.com.au,+86 285 874 2281,tempus vivamus in felis eu sapien cursus
13947,Oyoloo,frowthornnm@godaddy.com,+55 180 671 8324,blandit lacinia erat vestibulum sed magna at nunc commodo placerat praesent blandit nam nulla
14091,Yata,mdellcasann@ucoz.com,+46 426 346 6738,faucibus orci luctus et ultrices posuere cubilia curae nulla dapibus dolor vel est donec odio justo sollicitudin ut suscipit a feugiat
14621,Oyoba,ldilleyno@fotki.com,+63 252 608 0030,lectus in est risus auctor sed tristique in tempus sit amet sem fusce consequat nulla nisl
