SupplierID,SupplierName,SupplierEmail,SupplierPhone,SupplierDescription
6169,Skimia,imargerrison4o@psu.edu,+86 536 786 4790,metus aenean fermentum donec ut mauris eget massa tempor convallis nulla neque libero convallis eget eleifend luctus ultricies eu nibh quisque id justo sit
6170,Plambee,adansey4p@is.gd,+62 568 862 5379,at lorem integer tincidunt ante vel ipsum praesent blandit lacinia erat vestibulum sed magna at nunc commodo placerat praesent blandit nam
6171,Skyble,sbontein4q@drupal.org,+1 801 760 5539,mauris eget massa tempor convallis nulla neque libero convallis eget eleifend luctus ultricies eu
6172,Wordpedia,mgonnely4r@macromedia.com,+86 680 128 4631,luctus tincidunt nulla mollis molestie lorem quisque ut erat curabitur gravida nisi at nibh in hac habitasse
6173,Digitube,gsmaile4s@youtube.com,+86 814 900 3722,nunc nisl duis bibendum felis
6174,Eire,sgentsch4t@arizona.edu,+62 757 680 3693,sollicitudin vitae consectetuer eget rutrum at
6175,Zoombox,gbrimacombe4u@mayoclinic.com,+1 168 812 2461,ultrices libero non mattis pulvinar nulla pede ullamcorper augue a suscipit
6176,Blognation,dfurbank4v@pen.io,+962 271 533 9751,sagittis sapien cum sociis natoque penatibus et magnis dis parturient montes nascetur ridiculus mus etiam vel augue
6177,Ooba,edemullett4w@ovh.net,+242 301 529 5374,eu est congue elementum in hac habitasse platea dictumst morbi vestibulum velit id pretium iaculis diam erat
6178,Skibox,qnoller4x@boston.com,+33 524 717 4398,rhoncus aliquet pulvinar sed nisl nunc rhoncus dui vel sem sed sagittis nam congue risus semper porta volutpat quam pede
6179,Leenti,shuggin4y@abc.net.au,+963 185 885 6997,sem mauris laoreet ut rhoncus aliquet pulvinar sed nisl
6180,Eazzy,jhansley4z@mtv.com,+52 564 865 7983,eget semper rutrum nulla nunc purus phasellus in felis donec
6181,Cogidoo,rneeds50@simplemachines.org,+46 506 283 5822,pretium quis lectus suspendisse potenti in eleifend quam
6182,Vinder,whurleston51@ucsd.edu,+86 101 945 2084,amet sapien dignissim vestibulum vestibulum ante ipsum primis in faucibus orci luctus et ultrices posuere cubilia curae
6183,Myworks,mvigneron52@i2i.jp,+232 841 617 5570,nulla justo aliquam quis turpis eget elit
6184,Flipstorm,kcoop53@mapy.cz,+7 768 543 1023,ante vestibulum ante ipsum primis in faucibus orci luctus et ultrices posuere
6185,Browsecat,mmcilmorie54@noaa.gov,+502 673 651 5486,ipsum aliquam non mauris morbi non
6186,Abatz,ceverett55@odnoklassniki.ru,+46 206 661 7482,vestibulum ante ipsum primis in faucibus orci
6187,Skilith,barrigo56@comsenz.com,+591 719 236 0834,amet eleifend pede libero quis orci nullam molestie nibh in lectus pellentesque at nulla suspendisse
6188,Myworks,bdwyer57@ocn.ne.jp,+62 175 684 8953,sapien iaculis congue vivamus metus arcu adipiscing molestie hendrerit at vulputate vitae nisl aenean
6189,Brainlounge,kspottiswood58@nifty.com,+57 333 422 0000,nulla nunc purus phasellus in felis donec
6190,Tekfly,ngabbitis59@vkontakte.ru,+374 838 561 2024,metus arcu adipiscing molestie hendrerit at vulputate vitae nisl aenean lectus pellentesque eget nunc donec quis orci eget orci
6191,Youbridge,wmacilriach5a@prlog.org,+351 154 254 1456,etiam faucibus cursus urna ut tellus nulla ut erat id mauris vulputate elementum nullam varius nulla facilisi cras non velit nec nisi
6192,Aivee,rmakinson5b@yahoo.co.jp,+86 110 335 9339,nunc purus phasellus in felis donec semper sapien a libero nam dui proin leo odio porttitor id consequat in consequat
6193,Npath,treddell5c@epa.gov,+255 810 423 4912,hac habitasse platea dictumst maecenas ut massa quis augue luctus tincidunt nulla mollis molestie lorem quisque ut erat curabitur gravida nisi
6194,Jaxworks,bimlin5d@hao123.com,+86 850 586 6069,pede justo lacinia eget tincidunt eget tempus vel pede morbi porttitor lorem id ligula suspendisse ornare consequat lectus in est risus auctor
6195,Voomm,sstorah5e@newsvine.com,+86 625 892 4444,leo odio porttitor id consequat in consequat ut
6196,Fadeo,mwing5f@hp.com,+86 691 200 9905,in lectus pellentesque at nulla suspendisse
6197,Aimbo,gchilley5g@google.cn,+49 903 813 6614,odio cras mi pede malesuada in imperdiet et commodo vulputate justo in
6198,Quinu,kmaddison5h@sphinn.com,+62 387 216 9778,vestibulum vestibulum ante ipsum primis in faucibus orci luctus et ultrices posuere cubilia curae nulla dapibus dolor vel est donec odio justo
6199,Youbridge,mcasolla5i@mapy.cz,+86 829 286 3712,luctus cum sociis natoque penatibus et magnis dis
6200,Browsebug,skeepence5j@intel.com,+33 329 887 2204,nisl duis bibendum felis sed interdum venenatis turpis enim blandit mi in porttitor pede justo eu massa donec dapibus duis at velit eu est congue
6201,Einti,gperel5k@sciencedirect.com,+48 456 742 5426,ipsum primis in faucibus orci luctus et ultrices posuere cubilia curae donec pharetra magna vestibulum
6202,Centimia,hgerrell5l@sakura.ne.jp,+62 517 709 1153,a feugiat et eros vestibulum ac est lacinia nisi venenatis tristique fusce congue diam id ornare imperdiet sapien urna pretium nisl
6203,Wikizz,bsillis5m@deviantart.com,+31 986 546 9168,est donec odio justo sollicitudin ut suscipit a feugiat et eros vestibulum
6204,Eare,omilverton5n@google.com.br,+86 425 837 2114,ac consequat metus sapien ut nunc vestibulum ante ipsum primis in faucibus orci luctus et ultrices posuere cubilia curae mauris viverra diam vitae quam suspendisse
6205,Innojam,cmurden5o@elpais.com,+81 125 967 7984,eu magna vulputate luctus cum sociis natoque penatibus et magnis dis parturient montes nascetur ridiculus mus vivamus vestibulum sagittis sapien cum sociis
6206,Avamba,bborrow5p@g.co,+55 621 899 6649,turpis a pede posuere nonummy integer
6207,Brainverse,ldreier5q@cnn.com,+62 104 443 7507,orci pede venenatis non sodales sed tincidunt eu felis fusce posuere felis sed lacus morbi sem mauris laoreet ut rhoncus aliquet pulvinar sed nisl nunc
6208,Eare,cyakobovitz5r@discuz.net,+216 266 344 4162,eu nibh quisque id justo sit amet sapien dignissim vestibulum
6209,Bubblemix,ejelf5s@reference.com,+241 303 128 6479,mauris morbi non lectus aliquam sit amet diam in magna bibendum imperdiet nullam orci pede venenatis non sodales sed
6210,Reallinks,ccannings5t@purevolume.com,+57 800 136 9913,at ipsum ac tellus semper interdum mauris ullamcorper purus sit
6211,Skiba,osallows5u@home.pl,+86 304 650 5328,donec odio justo sollicitudin ut suscipit a feugiat et
6212,Twinte,fgligoraci5v@seattletimes.com,+62 559 809 1729,sollicitudin mi sit amet lobortis sapien sapien non mi
6213,Devbug,kshurlock5w@reddit.com,+47 435 532 1710,varius nulla facilisi cras non velit nec nisi vulputate nonummy maecenas tincidunt lacus at
6214,Rhybox,bsignore5x@businessweek.com,+351 823 189 6110,nulla eget eros elementum pellentesque quisque porta volutpat erat quisque erat eros viverra eget congue eget semper
6215,Realcube,jgrebert5y@oakley.com,+7 277 163 1910,hac habitasse platea dictumst aliquam augue quam sollicitudin vitae consectetuer eget rutrum at lorem integer tincidunt ante vel
6216,Blogspan,ldwane5z@statcounter.com,+52 580 285 4652,sem praesent id massa id nisl venenatis lacinia aenean sit amet justo morbi ut odio cras mi pede malesuada in imperdiet et commodo
6217,Thoughtbridge,oslaymaker60@stanford.edu,+420 425 236 8318,iaculis justo in hac habitasse platea dictumst etiam faucibus cursus urna ut tellus nulla ut erat id mauris vulputate elementum nullam varius
6218,Edgetag,wstollman61@va.gov,+55 755 121 4644,nullam porttitor lacus at turpis donec posuere
6219,Tagpad,zbastick62@businesswire.com,+7 534 559 3512,platea dictumst maecenas ut massa quis augue luctus tincidunt nulla mollis molestie lorem
6220,Jaxspan,wlyddy63@surveymonkey.com,+33 241 596 1936,nulla ut erat id mauris vulputate elementum nullam varius nulla facilisi cras non velit nec
6221,Avamm,eszanto64@businessinsider.com,+374 328 866 1709,vel lectus in quam fringilla rhoncus
6222,Skimia,nalfonsetti65@amazonaws.com,+86 853 626 8716,suspendisse potenti in eleifend quam a odio in hac habitasse platea
6223,Livepath,wfergyson66@webeden.co.uk,+420 668 812 5672,cubilia curae donec pharetra magna vestibulum aliquet ultrices erat tortor sollicitudin mi sit amet lobortis sapien sapien non mi integer
6224,Teklist,apendleton67@xrea.com,+351 157 854 0848,libero nullam sit amet turpis elementum ligula vehicula consequat morbi a ipsum
6225,Fivechat,tmcgillivray68@biglobe.ne.jp,+86 948 277 3408,id massa id nisl venenatis lacinia aenean sit
6226,Oba,pwaymont69@yahoo.co.jp,+591 163 325 6728,non sodales sed tincidunt eu felis fusce posuere felis sed lacus morbi
6227,Fadeo,cmayoral6a@infoseek.co.jp,+86 755 904 7472,nam congue risus semper porta volutpat quam pede lobortis ligula sit amet eleifend pede libero quis orci
6228,Jazzy,scrake6b@opensource.org,+57 756 448 0160,consequat in consequat ut nulla sed accumsan felis ut at dolor quis odio consequat varius integer ac leo pellentesque ultrices mattis odio donec vitae
6229,Skynoodle,pocannan6c@ezinearticles.com,+86 353 799 6718,nunc vestibulum ante ipsum primis
6230,Wikizz,ustanworth6d@amazon.co.uk,+420 545 944 8049,tristique fusce congue diam id ornare imperdiet sapien urna pretium nisl ut volutpat sapien arcu sed augue aliquam erat volutpat in congue
6231,Photobug,elange6e@upenn.edu,+63 211 687 4864,donec odio justo sollicitudin ut suscipit a feugiat et eros vestibulum ac est lacinia nisi venenatis tristique fusce congue diam
6232,Twitterbridge,dhartzog6f@shinystat.com,+62 721 673 3628,eleifend pede libero quis orci nullam
6233,Rooxo,wcressingham6g@e-recht24.de,+81 433 473 1755,habitasse platea dictumst aliquam augue quam sollicitudin vitae consectetuer eget rutrum at lorem integer tincidunt ante vel ipsum praesent blandit lacinia erat vestibulum
6234,Brightdog,htellenbrook6h@howstuffworks.com,+63 437 610 9395,tincidunt nulla mollis molestie lorem quisque ut erat curabitur gravida nisi at nibh in hac habitasse platea dictumst
6235,Gabcube,mspark6i@netscape.com,+593 194 495 3250,consequat in consequat ut nulla sed accumsan felis ut at dolor quis odio consequat varius integer ac leo pellentesque
6236,Lajo,tbertot6j@com.com,+63 403 172 8017,vestibulum sed magna at nunc commodo placerat praesent blandit nam nulla integer pede justo lacinia eget tincidunt eget tempus vel pede morbi porttitor lorem
6237,Livepath,dbury6k@google.it,+994 447 656 8860,in quis justo maecenas rhoncus aliquam lacus morbi quis
6238,Latz,mvasovic6l@rediff.com,+86 209 899 9476,libero quis orci nullam molestie nibh in lectus pellentesque at nulla suspendisse potenti cras in purus eu magna vulputate
6239,Feedfish,waherne6m@pbs.org,+261 874 453 4095,erat vestibulum sed magna at nunc commodo placerat praesent blandit nam nulla integer pede justo lacinia eget tincidunt eget tempus vel pede morbi porttitor
6240,Jabbersphere,afansy6n@dell.com,+351 151 451 3387,et ultrices posuere cubilia curae mauris viverra diam vitae quam suspendisse potenti nullam porttitor lacus at turpis donec
6241,Roomm,athunder6o@histats.com,+86 831 506 1891,mattis nibh ligula nec sem duis aliquam convallis nunc proin at turpis a pede
6242,Jabbertype,lmothersdale6p@yellowpages.com,+46 899 376 4940,quisque erat eros viverra eget congue eget semper rutrum nulla nunc purus phasellus in felis donec semper sapien a libero nam dui proin
6243,Edgetag,nmapledorum6q@engadget.com,+48 851 217 6037,interdum venenatis turpis enim blandit mi in porttitor pede justo eu massa donec dapibus duis at velit eu est congue elementum in
6244,Jazzy,acrathern6r@bloomberg.com,+86 678 768 6136,vitae nisl aenean lectus pellentesque eget nunc donec quis orci eget orci vehicula condimentum curabitur in libero ut massa volutpat convallis morbi odio odio elementum
6245,Linkbuzz,ssomerfield6s@gnu.org,+375 856 268 2019,pretium iaculis justo in hac habitasse platea dictumst etiam faucibus cursus
6246,Voomm,gborchardt6t@hatena.ne.jp,+62 404 820 0596,ante ipsum primis in faucibus orci luctus et ultrices posuere cubilia curae donec pharetra magna vestibulum aliquet ultrices erat tortor sollicitudin mi sit
6247,Youopia,cskeats6u@bandcamp.com,+63 144 645 3289,parturient montes nascetur ridiculus mus etiam
6248,Kwimbee,gfonteyne6v@github.com,+81 902 140 5645,tincidunt eu felis fusce posuere felis sed lacus morbi sem mauris laoreet ut rhoncus aliquet pulvinar sed nisl nunc rhoncus dui vel sem sed
6249,Browsebug,mcayzer6w@delicious.com,+30 113 868 6492,lectus in est risus auctor sed tristique
6250,Centidel,dninnis6x@cdc.gov,+86 788 887 2714,luctus ultricies eu nibh quisque id justo sit amet sapien dignissim vestibulum vestibulum
6251,Tazzy,msimeoli6y@xinhuanet.com,+380 247 889 1707,montes nascetur ridiculus mus vivamus vestibulum sagittis sapien cum sociis natoque penatibus et magnis dis parturient montes nascetur ridiculus
6252,Yoveo,ldran6z@netlog.com,+351 346 523 6641,est phasellus sit amet erat nulla tempus vivamus in felis eu
6253,DabZ,mheakey70@angelfire.com,+98 287 770 8325,duis at velit eu est congue elementum in hac habitasse platea
6254,Fatz,rcudbird71@jiathis.com,+351 789 483 5918,ut massa volutpat convallis morbi odio odio elementum eu interdum eu tincidunt in leo maecenas pulvinar
6255,Kanoodle,afell72@adobe.com,+62 362 692 8740,in est risus auctor sed tristique in tempus sit amet sem fusce consequat nulla nisl nunc nisl duis bibendum felis sed interdum venenatis turpis enim
6256,Devcast,vmacturlough73@theatlantic.com,+51 640 686 9170,commodo vulputate justo in blandit
6257,Katz,bdurant74@ameblo.jp,+63 856 601 9170,morbi sem mauris laoreet ut rhoncus aliquet pulvinar sed nisl nunc rhoncus dui
6258,Realfire,lfetherstone75@bluehost.com,+7 576 439 9729,sapien iaculis congue vivamus metus arcu adipiscing molestie hendrerit at vulputate vitae nisl aenean lectus pellentesque eget nunc donec quis orci eget orci vehicula condimentum
6259,Jaloo,kgirodon76@posterous.com,+1 718 811 6807,justo pellentesque viverra pede ac diam
6260,Quinu,knorvell77@nydailynews.com,+86 560 781 3967,id nisl venenatis lacinia aenean sit amet justo morbi ut odio cras mi pede malesuada
6261,Livetube,bbarczewski78@europa.eu,+57 382 425 0549,suscipit ligula in lacus curabitur at
6262,Oyope,ftrett79@hud.gov,+20 857 795 3025,nulla ac enim in tempor turpis nec
6263,Skilith,ndaniau7a@themeforest.net,+62 778 181 2829,ipsum praesent blandit lacinia erat vestibulum sed magna at
6264,Thoughtbridge,gfeeley7b@mtv.com,+355 452 794 3793,suspendisse potenti nullam porttitor lacus at turpis donec posuere metus vitae ipsum aliquam
6265,Wikido,rnason7c@cyberchimps.com,+60 239 530 0941,et ultrices posuere cubilia curae nulla dapibus dolor vel est donec odio justo
6266,Feedmix,wtoy7d@cloudflare.com,+351 189 757 8060,ut nunc vestibulum ante ipsum primis in faucibus orci luctus et ultrices posuere cubilia curae mauris viverra diam vitae quam suspendisse potenti nullam
6267,Browsetype,dhegg7e@last.fm,+63 338 111 6686,molestie nibh in lectus pellentesque at nulla suspendisse potenti cras in purus eu magna vulputate luctus cum sociis natoque penatibus et magnis dis parturient montes
6268,Oyope,aruttgers7f@ustream.tv,+86 630 706 8997,interdum in ante vestibulum ante ipsum primis in faucibus orci luctus et ultrices posuere cubilia curae duis faucibus accumsan odio curabitur convallis duis consequat dui
6269,Voomm,ddebney7g@prlog.org,+57 360 255 7683,ultrices vel augue vestibulum ante ipsum primis in faucibus orci luctus
6270,Katz,gdybald7h@ameblo.jp,+27 824 652 5050,at turpis donec posuere metus vitae ipsum aliquam non mauris morbi non lectus aliquam sit amet diam in magna bibendum
6271,Realfire,agyse7i@scientificamerican.com,+374 769 678 7229,tellus nisi eu orci mauris lacinia sapien quis libero nullam sit amet turpis elementum ligula vehicula consequat morbi a ipsum integer
6272,Skibox,ibromilow7j@ted.com,+359 545 359 3950,nullam molestie nibh in lectus pellentesque at nulla suspendisse potenti cras in purus eu magna vulputate luctus cum
6273,Photobug,bboyde7k@pinterest.com,+62 161 198 1163,ipsum dolor sit amet consectetuer adipiscing elit proin risus praesent lectus vestibulum quam sapien varius ut blandit non interdum in ante vestibulum
6274,Photolist,vgeockle7l@histats.com,+1 813 135 8583,quam pede lobortis ligula sit
6275,Topicblab,ptwinning7m@wikispaces.com,+36 764 646 0622,pulvinar sed nisl nunc rhoncus dui vel sem sed sagittis nam congue risus semper porta volutpat quam pede lobortis ligula sit amet eleifend
6276,Lazzy,bfarnsworth7n@cyberchimps.com,+86 591 256 8811,ipsum primis in faucibus orci luctus et ultrices posuere cubilia curae nulla dapibus dolor vel est donec odio justo sollicitudin
6277,Devpoint,rmcnabb7o@dyndns.org,+53 368 140 9820,primis in faucibus orci luctus et ultrices posuere cubilia curae
6278,Yodoo,gcasado7p@wikipedia.org,+387 468 875 0995,in leo maecenas pulvinar lobortis
6279,Zava,bwithers7q@latimes.com,+359 660 164 1486,rutrum rutrum neque aenean auctor gravida sem praesent id massa id nisl venenatis lacinia aenean sit amet justo morbi ut odio cras mi
6280,Oyondu,tgrigoliis7r@amazon.de,+256 797 792 6513,praesent blandit nam nulla integer pede justo lacinia eget tincidunt eget tempus vel pede
6281,Photobug,lcrosbie7s@desdev.cn,+291 194 788 3815,nullam molestie nibh in lectus pellentesque at nulla suspendisse potenti cras in purus eu magna vulputate luctus cum sociis natoque penatibus et
6282,Roodel,ithomesson7t@marriott.com,+386 738 442 2222,dui maecenas tristique est et tempus semper est
6283,Vinder,vsnelle7u@so-net.ne.jp,+62 572 978 7937,ridiculus mus etiam vel augue vestibulum rutrum rutrum neque aenean auctor gravida sem praesent id massa id nisl venenatis lacinia aenean sit amet justo morbi
6284,Jaxspan,rscintsbury7v@gov.uk,+351 508 264 8119,non velit donec diam neque vestibulum eget vulputate ut ultrices vel augue vestibulum
6285,Skipfire,rperago7w@fema.gov,+62 153 544 9217,orci luctus et ultrices posuere cubilia curae mauris viverra diam vitae quam suspendisse potenti nullam porttitor lacus at turpis donec posuere metus
6286,Skipfire,aclose7x@godaddy.com,+86 633 456 9310,mauris viverra diam vitae quam suspendisse potenti nullam porttitor lacus
6287,Meejo,gmcilvenny7y@diigo.com,+7 780 352 4398,eu nibh quisque id justo sit amet sapien dignissim vestibulum vestibulum ante ipsum
6288,Yodo,wbrownsey7z@mediafire.com,+371 877 405 0931,potenti nullam porttitor lacus at turpis donec posuere metus vitae ipsum aliquam non mauris
6289,Blogtags,cbertome80@vimeo.com,+81 515 792 6402,lorem id ligula suspendisse ornare consequat lectus in est risus auctor sed tristique in tempus sit amet sem fusce consequat nulla nisl nunc nisl duis
6290,Gabspot,rfasset81@google.de,+86 900 942 2349,in sagittis dui vel nisl duis ac
6291,Topicshots,mbrokenshaw82@zimbio.com,+86 853 318 0104,quisque porta volutpat erat quisque erat eros viverra eget congue
6292,Dablist,bfrank83@weebly.com,+95 451 564 7273,metus arcu adipiscing molestie hendrerit at vulputate vitae nisl aenean
6293,Twitterwire,cpriddie84@bandcamp.com,+86 300 220 4985,faucibus cursus urna ut tellus nulla ut erat id mauris vulputate elementum nullam varius nulla facilisi
6294,Zoomcast,resposi85@seesaa.net,+62 323 239 2684,at dolor quis odio consequat varius integer ac leo pellentesque ultrices mattis odio donec vitae nisi nam ultrices libero non
6295,Viva,fvasquez86@slideshare.net,+355 513 325 4075,urna pretium nisl ut volutpat sapien arcu sed
6296,Zooveo,sexon87@princeton.edu,+86 581 143 0339,id nisl venenatis lacinia aenean sit amet
6297,Yabox,tmorbey88@usnews.com,+52 768 650 0829,vestibulum ante ipsum primis in faucibus orci luctus et ultrices posuere
6298,Gigashots,jrolley89@infoseek.co.jp,+48 251 659 7040,aliquet massa id lobortis convallis
6299,Twiyo,mbampford8a@zdnet.com,+86 906 476 7563,penatibus et magnis dis parturient
6300,Jayo,zmclenaghan8b@chronoengine.com,+94 754 427 0114,sit amet turpis elementum ligula vehicula consequat morbi a ipsum integer a nibh in quis justo maecenas rhoncus aliquam lacus morbi quis tortor id
6301,Dynazzy,mcardew8c@imgur.com,+52 246 267 9157,ultrices libero non mattis pulvinar nulla pede ullamcorper augue a suscipit nulla elit ac nulla sed vel enim sit amet nunc viverra dapibus nulla suscipit
6302,Vimbo,abernade8d@fema.gov,+504 928 837 2058,et ultrices posuere cubilia curae duis faucibus accumsan odio curabitur convallis duis consequat dui nec nisi volutpat eleifend donec ut dolor
6303,Rooxo,pfeehan8e@illinois.edu,+86 333 618 6256,nisl aenean lectus pellentesque eget nunc donec quis
6304,Twinte,atolomio8f@mozilla.org,+55 544 151 5953,lectus suspendisse potenti in eleifend quam a odio
6305,Twimm,gcorbally8g@berkeley.edu,+30 435 900 8077,justo sit amet sapien dignissim vestibulum vestibulum
6306,Lazz,jnarbett8h@npr.org,+86 480 510 3329,ultrices vel augue vestibulum ante ipsum primis in faucibus orci luctus et ultrices posuere cubilia curae donec pharetra magna vestibulum aliquet
6307,Centimia,tmerner8i@zdnet.com,+86 695 742 9915,arcu adipiscing molestie hendrerit at vulputate vitae nisl aenean lectus
6308,Dabvine,skean8j@nationalgeographic.com,+46 507 480 5586,quam a odio in hac habitasse platea dictumst maecenas ut massa quis augue luctus tincidunt nulla mollis molestie
6309,Blogtag,dcraster8k@ifeng.com,+48 209 182 0891,morbi vel lectus in quam fringilla
6310,Edgepulse,ecaplen8l@ocn.ne.jp,+66 302 696 5378,molestie sed justo pellentesque viverra pede ac diam cras pellentesque volutpat dui maecenas tristique est et tempus
6311,Linklinks,hleask8m@live.com,+48 993 997 4805,nonummy integer non velit donec diam neque vestibulum eget vulputate ut ultrices vel augue vestibulum ante ipsum primis in faucibus orci luctus et ultrices
6312,Eayo,fcudihy8n@exblog.jp,+27 287 423 9501,augue quam sollicitudin vitae consectetuer eget rutrum at lorem integer tincidunt ante vel ipsum praesent blandit lacinia erat
6313,Roomm,ecaberas8o@delicious.com,+63 879 526 3394,nulla facilisi cras non velit nec nisi vulputate nonummy maecenas tincidunt lacus at velit vivamus
6314,Centizu,kcathel8p@auda.org.au,+62 759 219 4471,at turpis a pede posuere
6315,Brightbean,aterbruggen8q@odnoklassniki.ru,+234 536 771 4682,augue vestibulum rutrum rutrum neque aenean auctor gravida sem praesent id massa id nisl venenatis lacinia aenean sit amet justo morbi ut odio
6316,Buzzbean,ajoost8r@list-manage.com,+55 901 998 4645,mauris eget massa tempor convallis nulla neque libero convallis eget eleifend
6317,Thoughtsphere,istienham8s@t.co,+591 946 988 8476,natoque penatibus et magnis dis parturient montes nascetur ridiculus mus etiam vel augue vestibulum rutrum rutrum neque aenean auctor gravida sem praesent id
6318,Trilith,gferagh8t@dell.com,+48 600 618 8614,adipiscing lorem vitae mattis nibh ligula nec sem duis aliquam convallis nunc proin at
6319,Realbuzz,gosgarby8u@diigo.com,+7 910 998 8487,morbi quis tortor id nulla ultrices aliquet maecenas leo odio condimentum id luctus nec molestie sed justo
6320,Oodoo,diddiens8v@booking.com,+81 619 347 4229,ipsum primis in faucibus orci luctus et ultrices posuere cubilia curae duis faucibus accumsan odio curabitur
6321,Zoovu,amcdonell8w@shop-pro.jp,+86 576 947 8257,integer ac leo pellentesque ultrices mattis odio donec vitae
6322,Flashspan,lwibberley8x@howstuffworks.com,+52 430 843 8575,blandit lacinia erat vestibulum sed magna at nunc commodo placerat praesent blandit nam nulla integer pede justo lacinia eget
6323,Demimbu,dhandmore8y@youtube.com,+62 108 882 0445,etiam pretium iaculis justo in hac habitasse platea dictumst etiam faucibus cursus urna ut tellus nulla ut erat id mauris vulputate elementum nullam varius nulla
6324,Jabberstorm,cfrankiss8z@virginia.edu,+48 768 897 1675,mauris ullamcorper purus sit amet nulla quisque arcu libero rutrum ac lobortis vel dapibus
6325,Flashspan,ovideneev90@goo.ne.jp,+351 105 433 2159,nulla dapibus dolor vel est donec odio justo sollicitudin ut suscipit a feugiat et eros vestibulum ac est lacinia
6326,Meembee,hsime91@youtu.be,+46 911 940 7174,tristique est et tempus semper est quam pharetra
6327,Flashdog,tseaborn92@weibo.com,+351 417 716 8344,donec vitae nisi nam ultrices libero non mattis pulvinar nulla
6328,Bubblemix,taizikovich93@liveinternet.ru,+62 490 985 9217,viverra diam vitae quam suspendisse potenti nullam porttitor lacus at turpis donec posuere metus vitae ipsum aliquam non mauris morbi non
6329,Voonyx,lfeeley94@irs.gov,+51 721 220 8512,amet diam in magna bibendum imperdiet nullam orci pede venenatis non sodales sed tincidunt eu
6330,Vipe,ptroppmann95@youtube.com,+55 377 377 5713,aliquet maecenas leo odio condimentum id
6331,Zoonoodle,crouby96@elegantthemes.com,+57 615 515 0802,pellentesque viverra pede ac diam cras pellentesque volutpat dui maecenas tristique est et
6332,Skyble,esteffens97@thetimes.co.uk,+86 744 770 9778,morbi odio odio elementum eu interdum eu tincidunt in leo maecenas pulvinar lobortis est phasellus sit amet erat nulla tempus vivamus in felis eu
6333,Latz,jox98@smugmug.com,+49 771 119 6430,sit amet consectetuer adipiscing elit proin
6334,Dabtype,afreeborne99@prweb.com,+55 731 468 4776,vestibulum sed magna at nunc commodo
6335,Wordware,mchallace9a@bloglines.com,+33 388 966 2360,nisi vulputate nonummy maecenas tincidunt lacus at velit vivamus vel nulla eget eros elementum
6336,Blogtags,aurquhart9b@gravatar.com,+66 228 953 4306,sapien cursus vestibulum proin eu mi
6337,Quimba,mbriggdale9c@google.fr,+63 465 553 9237,posuere cubilia curae donec pharetra magna vestibulum aliquet ultrices erat tortor sollicitudin mi sit
6338,Buzzshare,hlamb9d@biglobe.ne.jp,+218 370 612 2221,nunc commodo placerat praesent blandit nam nulla integer pede justo
6339,Yakidoo,tshawe9e@prweb.com,+62 377 645 2595,vel est donec odio justo sollicitudin ut suscipit a feugiat et eros vestibulum ac est lacinia nisi venenatis tristique fusce congue diam
6340,Leexo,gburgise9f@dailymail.co.uk,+51 570 557 2490,donec dapibus duis at velit eu est congue elementum in hac habitasse platea dictumst
6341,Ozu,ibelton9g@shareasale.com,+380 252 398 8769,in tempus sit amet sem fusce consequat nulla nisl nunc nisl duis bibendum felis sed interdum
