SupplierID,SupplierName,SupplierEmail,SupplierPhone,SupplierDescription
6161,Skaboo,kstrute0@loc.gov,+359 147 955 8957,sapien quis libero nullam sit
5331,Kanoodle,ldubois1@rediff.com,+61 978 601 3568,ac lobortis vel dapibus at diam nam tristique tortor eu
6177,Mudo,bgaynsford2@wsj.com,+86 898 363 9517,enim in tempor turpis nec euismod scelerisque quam turpis adipiscing lorem vitae mattis nibh ligula nec sem duis aliquam convallis nunc proin at
5047,Fivespan,afiloniere3@issuu.com,+62 408 320 5125,vel sem sed sagittis nam congue risus semper porta volutpat quam pede lobortis ligula sit amet eleifend pede libero
5084,Snaptags,cfynan4@japanpost.jp,+81 571 515 0365,quis augue luctus tincidunt nulla mollis molestie lorem quisque
5933,JumpXS,drupke5@bloglines.com,+86 434 443 2450,metus arcu adipiscing molestie hendrerit at vulputate vitae nisl aenean lectus pellentesque eget
5749,Kamba,wprint6@archive.org,+503 362 847 9508,sagittis nam congue risus semper porta volutpat quam pede lobortis ligula sit amet eleifend pede libero quis orci nullam molestie
5487,Quatz,emcgovern7@google.com.br,+7 457 213 4659,ac tellus semper interdum mauris ullamcorper purus sit amet nulla quisque
5103,Aimbu,mtheurer8@google.co.jp,+58 949 904 4387,tincidunt nulla mollis molestie lorem quisque ut erat curabitur gravida nisi at nibh in hac habitasse platea dictumst aliquam augue quam sollicitudin vitae consectetuer
6077,Rhyzio,cjeves9@umich.edu,+7 776 475 5875,lacus at turpis donec posuere metus vitae ipsum aliquam non mauris morbi non lectus aliquam sit amet diam in magna bibendum imperdiet nullam orci
5462,Camido,mattoca@ca.gov,+1 936 525 3854,vel augue vestibulum ante ipsum primis in faucibus orci luctus et ultrices posuere cubilia curae donec pharetra
5476,Edgeblab,tforceb@123-reg.co.uk,+502 487 907 2733,ultrices posuere cubilia curae duis faucibus accumsan odio
5340,Thoughtstorm,mskehensc@sakura.ne.jp,+86 940 477 4272,a feugiat et eros vestibulum ac
5684,Yombu,ndymickd@ox.ac.uk,+81 278 715 6015,vestibulum eget vulputate ut ultrices vel augue vestibulum ante ipsum primis in
5427,Devbug,zmenarye@whitehouse.gov,+47 546 483 2591,adipiscing elit proin risus praesent lectus vestibulum quam sapien varius ut blandit non
5449,Bubblemix,blaurief@cdc.gov,+86 282 486 1267,sollicitudin mi sit amet lobortis sapien sapien
5562,Twitterlist,sakroydg@people.com.cn,+48 217 701 4974,sapien iaculis congue vivamus metus arcu adipiscing molestie hendrerit
5423,Wikivu,zfabryh@dmoz.org,+420 451 185 6961,vulputate justo in blandit ultrices enim lorem ipsum dolor sit amet consectetuer adipiscing elit proin interdum mauris non ligula pellentesque
5304,Jetwire,kkissocki@google.com.hk,+7 135 487 7441,convallis duis consequat dui nec
5218,Skimia,htipplerj@fc2.com,+1 256 504 6697,consequat dui nec nisi volutpat eleifend donec ut dolor morbi
5903,Devshare,emcbeathk@berkeley.edu,+380 585 931 7164,et eros vestibulum ac est lacinia nisi venenatis tristique fusce congue diam id ornare imperdiet sapien
5241,Flashpoint,ploeberl@ifeng.com,+7 527 455 1092,vel pede morbi porttitor lorem id ligula suspendisse
6030,Shuffletag,treckem@ox.ac.uk,+63 688 580 9799,lobortis convallis tortor risus dapibus augue vel accumsan tellus nisi eu
5623,Realcube,rpenwrightn@nature.com,+41 200 636 3409,eu est congue elementum in hac habitasse platea dictumst morbi vestibulum velit
5761,Edgeclub,bvondracho@cpanel.net,+86 804 538 3691,dapibus augue vel accumsan tellus
6086,Skidoo,swillarsp@uol.com.br,+93 279 632 4043,nunc rhoncus dui vel sem sed sagittis nam congue risus semper porta volutpat quam pede lobortis ligula
6381,Realmix,aquinq@amazon.co.uk,+86 833 372 7347,semper porta volutpat quam pede lobortis ligula sit amet eleifend
6099,Ozu,pliler@google.it,+380 200 832 6851,dolor vel est donec odio justo sollicitudin ut suscipit a feugiat et
6358,Cogilith,jbrambills@reference.com,+62 165 262 6363,purus sit amet nulla quisque arcu libero rutrum ac lobortis vel dapibus at diam nam tristique tortor eu
5857,Voonix,dchristmast@altervista.org,+55 350 583 3994,ut odio cras mi pede malesuada in imperdiet
6454,Meeveo,gnassyu@usa.gov,+63 835 337 7138,curae nulla dapibus dolor vel est donec odio justo sollicitudin ut suscipit a feugiat
6278,Voolia,fgaunterv@sciencedirect.com,+62 972 156 4835,mi integer ac neque duis bibendum morbi non quam nec dui luctus rutrum nulla tellus in sagittis dui vel nisl
5664,Meevee,msillitoew@free.fr,+86 292 393 6435,rutrum rutrum neque aenean auctor gravida sem praesent id massa
5175,Topiczoom,dverlanderx@infoseek.co.jp,+62 982 123 5094,bibendum felis sed interdum venenatis turpis enim blandit mi in porttitor pede justo eu massa donec dapibus duis at velit eu est congue elementum
6219,Jaxnation,ksandersony@dailymail.co.uk,+48 598 195 3334,ac tellus semper interdum mauris ullamcorper
5786,Flipstorm,tholmez@aol.com,+62 339 550 6932,nullam molestie nibh in lectus pellentesque at nulla suspendisse potenti cras in purus eu magna vulputate luctus cum
5797,Jetpulse,dtilling10@geocities.jp,+86 397 666 7116,integer ac leo pellentesque ultrices mattis odio donec vitae nisi nam ultrices libero non mattis pulvinar nulla pede ullamcorper augue
5839,Blogpad,sseaking11@tumblr.com,+62 494 106 5639,ut suscipit a feugiat et eros vestibulum ac est lacinia nisi venenatis tristique fusce congue diam id ornare imperdiet
5800,Minyx,scolhoun12@storify.com,+970 211 602 3046,ridiculus mus vivamus vestibulum sagittis sapien cum sociis natoque penatibus et
5491,Twinte,wlongfut13@amazon.com,+41 977 633 1818,aenean auctor gravida sem praesent id massa id
5395,Kwideo,jrembrandt14@stanford.edu,+224 170 138 1163,integer a nibh in quis justo maecenas rhoncus aliquam
6067,Realblab,mmccrystal15@dagondesign.com,+7 729 489 8879,luctus cum sociis natoque penatibus et magnis
6086,Flipstorm,jdanielot16@photobucket.com,+970 403 632 6753,habitasse platea dictumst morbi vestibulum velit id pretium iaculis diam erat fermentum justo nec condimentum neque sapien placerat
6455,Zooxo,aerrichelli17@163.com,+46 268 348 7967,ullamcorper augue a suscipit nulla elit
5904,Gigabox,krabbe18@ning.com,+81 549 896 7905,cursus vestibulum proin eu mi nulla ac enim in
5111,Jaxnation,mbrecken19@gravatar.com,+33 630 896 6457,congue etiam justo etiam pretium iaculis justo in hac habitasse platea
5496,Youfeed,kswinden1a@engadget.com,+63 280 763 6239,varius ut blandit non interdum in ante vestibulum ante ipsum primis in faucibus orci luctus et ultrices posuere cubilia curae duis faucibus accumsan odio
5980,Tekfly,respinet1b@wikipedia.org,+51 636 697 4631,augue vel accumsan tellus nisi eu orci mauris lacinia sapien quis libero nullam sit amet turpis elementum
5753,Skibox,mlineker1c@economist.com,+60 724 985 9857,metus vitae ipsum aliquam non mauris morbi non lectus aliquam sit amet diam in magna bibendum imperdiet nullam orci pede venenatis non
6342,Wordify,proizin1d@blogspot.com,+81 532 253 1769,vestibulum sagittis sapien cum sociis natoque penatibus et magnis
5678,Blogpad,jwanell1e@washingtonpost.com,+7 883 666 0638,massa donec dapibus duis at velit eu est congue elementum in hac habitasse platea dictumst morbi vestibulum velit id pretium iaculis diam erat
5988,Kaymbo,hhatchette1f@unicef.org,+86 672 543 5339,vel enim sit amet nunc viverra dapibus nulla suscipit ligula in lacus curabitur at ipsum ac tellus semper interdum mauris ullamcorper purus sit amet nulla
6075,Shuffletag,jdarke1g@accuweather.com,+62 450 257 7637,vel sem sed sagittis nam congue risus semper porta volutpat quam pede lobortis
5646,Gabcube,bsmolan1h@huffingtonpost.com,+86 505 558 5975,ultricies eu nibh quisque id justo sit amet sapien dignissim vestibulum vestibulum ante ipsum primis
5787,Jetpulse,ntomsa1i@sfgate.com,+63 304 480 0382,volutpat eleifend donec ut dolor morbi vel
6026,Twitterbeat,gnapleton1j@bandcamp.com,+1 120 258 9990,justo sollicitudin ut suscipit a feugiat et eros vestibulum ac est lacinia nisi venenatis tristique fusce congue diam id ornare
5120,Photojam,mdannett1k@reddit.com,+81 462 727 2895,magna at nunc commodo placerat praesent blandit nam nulla integer pede justo
6008,Brightbean,htoombs1l@toplist.cz,+52 589 739 4711,a suscipit nulla elit ac nulla sed vel enim sit amet nunc viverra dapibus nulla suscipit
5923,Aimbo,mbanbury1m@vk.com,+1 322 823 1917,donec vitae nisi nam ultrices libero non mattis pulvinar nulla pede ullamcorper augue a suscipit nulla elit ac nulla sed vel enim
5328,Tazz,ajellico1n@google.com,+81 171 494 1295,erat tortor sollicitudin mi sit amet lobortis sapien sapien non mi integer ac neque duis bibendum morbi non quam
5463,Tagchat,faristide1o@zdnet.com,+385 497 175 1896,aliquet pulvinar sed nisl nunc rhoncus dui vel sem sed sagittis nam congue risus semper
6427,Youspan,fyitzhok1p@123-reg.co.uk,+351 879 188 8249,justo pellentesque viverra pede ac diam cras pellentesque volutpat dui maecenas tristique est et tempus
5035,Innotype,bserrels1q@liveinternet.ru,+86 839 243 1912,rutrum at lorem integer tincidunt ante vel ipsum praesent blandit lacinia erat vestibulum sed magna at nunc
5320,Brightbean,rhazlewood1r@seattletimes.com,+62 861 191 1401,dui maecenas tristique est et tempus semper est quam pharetra magna ac consequat metus sapien ut nunc vestibulum ante ipsum primis
5199,Thoughtstorm,jagneau1s@vistaprint.com,+55 247 396 7169,nisi eu orci mauris lacinia sapien quis libero nullam sit amet turpis elementum ligula vehicula consequat morbi a ipsum integer
6417,Topdrive,kjaukovic1t@indiegogo.com,+381 595 677 2873,sem duis aliquam convallis nunc
5704,Linkbuzz,amacrorie1u@360.cn,+86 937 336 3514,erat vestibulum sed magna at nunc commodo placerat praesent blandit nam nulla integer pede justo lacinia eget tincidunt eget tempus vel pede
5328,Myworks,bcordes1v@tumblr.com,+55 331 928 7788,at lorem integer tincidunt ante vel ipsum praesent blandit lacinia erat vestibulum sed magna at nunc commodo placerat praesent blandit
5543,Chatterpoint,lpentlow1w@cbc.ca,+81 508 865 1108,sodales sed tincidunt eu felis
6175,Pixope,lwhatford1x@bluehost.com,+98 639 129 3453,ornare consequat lectus in est risus auctor sed tristique in tempus sit amet sem fusce
6280,Gabcube,owoolmore1y@google.nl,+55 524 153 9112,lacus purus aliquet at feugiat non pretium quis lectus suspendisse potenti in eleifend quam a
5866,Meezzy,lstamps1z@sakura.ne.jp,+62 620 621 1835,quis lectus suspendisse potenti in eleifend quam a odio in hac habitasse platea dictumst maecenas ut massa
6027,Photobug,dtelford20@com.com,+86 608 784 9512,fermentum donec ut mauris eget massa tempor convallis nulla neque libero convallis eget eleifend luctus ultricies eu nibh
6418,Jaloo,lbourgourd21@google.co.jp,+385 613 285 1747,mauris morbi non lectus aliquam sit amet diam in magna bibendum imperdiet nullam orci pede venenatis non sodales sed tincidunt eu
5123,Jayo,mboaler22@fotki.com,+86 393 413 3968,quis augue luctus tincidunt nulla mollis molestie lorem
5494,Twinder,adennant23@dailymotion.com,+385 496 326 2624,facilisi cras non velit nec nisi vulputate nonummy maecenas
6225,Fivechat,ablanque24@bluehost.com,+54 880 924 1533,lacus curabitur at ipsum ac tellus semper interdum mauris ullamcorper purus sit amet nulla quisque arcu libero rutrum ac lobortis vel dapibus at diam
5437,Quamba,dbellingham25@istockphoto.com,+58 270 185 8155,venenatis tristique fusce congue diam id ornare imperdiet sapien urna
6384,Innojam,fgudahy26@amazonaws.com,+54 256 739 5035,erat fermentum justo nec condimentum neque
5673,Trudoo,hemtage27@spotify.com,+255 132 622 1524,lacinia eget tincidunt eget tempus vel pede morbi porttitor lorem id ligula suspendisse ornare consequat lectus in est risus auctor sed tristique in tempus sit
6386,Layo,nmcginnis28@csmonitor.com,+62 950 543 5032,euismod scelerisque quam turpis adipiscing lorem vitae mattis nibh ligula nec sem duis aliquam convallis nunc proin at turpis a pede posuere
6222,Photobug,twatford29@redcross.org,+251 928 114 9699,ut nunc vestibulum ante ipsum primis in faucibus
5189,Trunyx,ghobgen2a@hatena.ne.jp,+44 772 335 9372,ante ipsum primis in faucibus orci luctus et ultrices posuere cubilia curae mauris
5742,Edgepulse,bdalgarno2b@dion.ne.jp,+86 287 453 4139,sapien a libero nam dui proin leo odio porttitor id consequat in consequat ut nulla sed accumsan
6232,Lazz,jhubane2c@wikia.com,+1 733 484 0658,orci nullam molestie nibh in lectus pellentesque at nulla suspendisse potenti cras in purus eu magna vulputate luctus cum sociis natoque penatibus et magnis
6432,Yoveo,ggladdolph2d@icio.us,+57 239 658 7799,lacus at velit vivamus vel nulla eget eros elementum pellentesque quisque porta volutpat erat
6153,Fadeo,jsinton2e@fastcompany.com,+81 563 920 6343,justo in blandit ultrices enim lorem ipsum dolor sit amet consectetuer adipiscing elit proin interdum mauris non ligula pellentesque ultrices phasellus id sapien
6015,Photojam,mschinetti2f@zdnet.com,+86 145 306 2145,sapien ut nunc vestibulum ante ipsum primis in faucibus orci luctus et ultrices posuere cubilia curae mauris viverra
5141,Divape,sharpham2g@tripadvisor.com,+972 696 933 3305,dolor sit amet consectetuer adipiscing elit proin interdum mauris
6291,Twitterworks,lkorous2h@engadget.com,+30 435 862 3387,non mauris morbi non lectus aliquam
5909,Wikido,gcrossthwaite2i@ihg.com,+263 173 977 2321,erat nulla tempus vivamus in felis eu sapien cursus vestibulum proin eu mi nulla ac enim in tempor turpis nec euismod scelerisque quam turpis
6031,Kanoodle,sesposita2j@github.io,+48 231 966 2159,condimentum neque sapien placerat ante nulla justo aliquam quis turpis eget elit sodales scelerisque mauris sit amet eros suspendisse
5939,Mybuzz,jgierck2k@nymag.com,+86 635 607 9264,vel augue vestibulum rutrum rutrum neque aenean auctor gravida sem praesent id massa id nisl venenatis lacinia aenean sit amet justo
5279,Skyvu,bwhatham2l@over-blog.com,+46 249 377 8300,cras non velit nec nisi vulputate nonummy maecenas tincidunt lacus at
5106,Photospace,pmccarter2m@rediff.com,+62 362 188 3987,in magna bibendum imperdiet nullam orci pede venenatis non sodales sed tincidunt
5679,Blognation,hpaule2n@dailymail.co.uk,+380 686 647 6894,bibendum morbi non quam nec dui luctus rutrum nulla tellus in sagittis dui
6200,Vidoo,wlaskey2o@comcast.net,+504 612 631 0848,sit amet consectetuer adipiscing elit proin risus praesent lectus vestibulum quam sapien varius ut blandit non interdum in ante
5799,Gigaclub,mvigietti2p@ycombinator.com,+86 116 786 9603,consequat in consequat ut nulla sed accumsan felis ut at dolor quis odio consequat varius integer ac leo pellentesque ultrices mattis
5643,Realmix,astollmeyer2q@nymag.com,+351 119 239 5388,at nunc commodo placerat praesent blandit nam nulla integer pede justo lacinia eget tincidunt eget tempus vel
5036,Kwideo,jferrar2r@cnbc.com,+62 463 509 9959,augue a suscipit nulla elit ac nulla sed vel enim sit amet nunc viverra dapibus nulla suscipit ligula in lacus curabitur at ipsum ac
6433,Trupe,tmendoza2s@creativecommons.org,+86 103 635 2741,dignissim vestibulum vestibulum ante ipsum primis in
5882,Mybuzz,cmasi2t@biblegateway.com,+7 405 183 3205,nisl duis ac nibh fusce lacus purus aliquet at feugiat non pretium
5729,Tagtune,darmsby2u@skyrock.com,+82 827 122 7391,tempus vel pede morbi porttitor lorem id ligula suspendisse ornare consequat lectus in est risus auctor sed tristique in tempus
6062,Mydo,amanketell2v@is.gd,+84 789 989 8730,diam cras pellentesque volutpat dui maecenas
6392,Devpulse,svirgo2w@economist.com,+62 480 523 1735,tellus nulla ut erat id mauris vulputate elementum nullam varius nulla facilisi cras non velit nec nisi vulputate nonummy
5130,Eidel,lstenbridge2x@homestead.com,+57 223 788 9208,integer ac leo pellentesque ultrices mattis odio donec vitae nisi nam ultrices libero non mattis pulvinar nulla pede ullamcorper augue a suscipit nulla elit ac
5264,Meejo,mrandlesome2y@yahoo.com,+86 765 934 3647,in est risus auctor sed tristique in tempus sit amet
5965,Avavee,ssarton2z@opera.com,+86 313 985 1037,bibendum imperdiet nullam orci pede venenatis non sodales sed tincidunt eu felis fusce posuere felis sed lacus morbi sem mauris laoreet ut rhoncus
5724,Gabspot,bstrippel30@reverbnation.com,+251 264 190 6305,sit amet erat nulla tempus vivamus in felis eu sapien cursus vestibulum proin eu mi nulla ac enim in tempor turpis nec euismod
6135,Aimbo,ckobpal31@lycos.com,+380 672 475 7741,gravida nisi at nibh in hac habitasse platea dictumst aliquam augue quam sollicitudin vitae consectetuer eget rutrum at lorem integer
5095,Twitterwire,gskirrow32@who.int,+375 688 949 8933,commodo placerat praesent blandit nam nulla integer pede justo lacinia eget tincidunt eget tempus vel pede morbi porttitor lorem id ligula suspendisse ornare consequat lectus
5166,Fadeo,nnewrick33@livejournal.com,+48 203 531 3609,justo in hac habitasse platea dictumst etiam faucibus cursus urna ut tellus nulla ut erat id mauris
5940,Roodel,adumini34@opensource.org,+48 668 786 8611,accumsan tellus nisi eu orci mauris lacinia sapien quis libero nullam sit amet
6188,Fliptune,rmoreland35@timesonline.co.uk,+63 903 611 5291,ultrices aliquet maecenas leo odio condimentum id luctus nec molestie
5093,Thoughtsphere,mvasentsov36@ask.com,+351 303 990 5025,et commodo vulputate justo in blandit ultrices enim lorem ipsum dolor sit amet
5404,Mycat,rmelson37@epa.gov,+1 502 993 8184,magna ac consequat metus sapien ut nunc vestibulum ante ipsum primis in faucibus orci luctus et ultrices posuere cubilia curae
5370,Skinix,bcoppock38@i2i.jp,+60 156 427 3058,sed tincidunt eu felis fusce
5940,Buzzster,kaldous39@goo.gl,+230 752 646 1422,faucibus accumsan odio curabitur convallis duis
5205,Skiba,rdoylend3a@senate.gov,+86 354 870 8968,porta volutpat quam pede lobortis
5294,Jabbersphere,mcawsby3b@indiegogo.com,+60 191 756 6497,tellus in sagittis dui vel nisl duis ac nibh fusce lacus purus aliquet at feugiat non pretium quis lectus suspendisse potenti in eleifend quam
5757,Skynoodle,npaty3c@umich.edu,+86 260 830 0680,non velit nec nisi vulputate nonummy maecenas tincidunt lacus at velit vivamus vel nulla eget eros elementum
5602,Livefish,rbuxton3d@mapy.cz,+86 914 540 1140,curabitur convallis duis consequat dui nec nisi volutpat eleifend
6076,Topiclounge,ccreber3e@google.com,+51 950 753 4191,convallis duis consequat dui nec nisi volutpat eleifend donec ut dolor morbi vel lectus in quam fringilla rhoncus mauris enim leo
5090,Abatz,folynn3f@flickr.com,+62 836 910 3206,orci mauris lacinia sapien quis libero nullam sit amet turpis elementum ligula vehicula consequat morbi a ipsum integer a nibh in quis justo maecenas rhoncus
6161,Skajo,dfulep3g@answers.com,+81 199 572 1968,convallis duis consequat dui nec nisi volutpat eleifend donec ut dolor morbi vel lectus in quam fringilla rhoncus mauris
6471,Thoughtstorm,fcreak3h@sciencedirect.com,+86 514 855 3038,tempus vel pede morbi porttitor lorem id
5774,Twimbo,emcsporon3i@ca.gov,+1 559 849 5639,luctus cum sociis natoque penatibus et magnis dis parturient montes nascetur ridiculus mus vivamus vestibulum sagittis sapien cum sociis natoque penatibus et magnis dis parturient
5509,Tazzy,roscannill3j@archive.org,+372 411 100 0686,blandit lacinia erat vestibulum sed magna at nunc commodo
5110,Devpulse,gbrazenor3k@artisteer.com,+359 594 920 1538,sed sagittis nam congue risus semper porta volutpat quam pede lobortis ligula sit amet eleifend pede libero quis orci nullam molestie
5825,Fanoodle,mperceval3l@newyorker.com,+1 330 391 4883,convallis tortor risus dapibus augue vel accumsan tellus nisi eu orci mauris lacinia sapien quis libero nullam sit amet turpis
5789,Geba,mbarrabeale3m@tmall.com,+86 328 600 9856,ultrices aliquet maecenas leo odio condimentum id luctus nec molestie
5706,Twiyo,dhawkslee3n@jiathis.com,+86 440 641 9900,porttitor id consequat in consequat ut nulla sed accumsan
5604,Demimbu,tswetmore3o@disqus.com,+84 236 146 3046,consectetuer adipiscing elit proin interdum mauris non ligula pellentesque ultrices phasellus id sapien in
5357,Fiveclub,pbedingfield3p@deviantart.com,+385 406 693 6290,nibh quisque id justo sit amet sapien dignissim vestibulum vestibulum ante
5401,Blogtags,rdegiorgi3q@pagesperso-orange.fr,+675 883 339 4617,libero rutrum ac lobortis vel
5725,Devpoint,jbutchard3r@sciencedirect.com,+351 315 742 1414,integer ac neque duis bibendum morbi non quam nec dui luctus rutrum nulla tellus
5982,Voonyx,ajurczyk3s@engadget.com,+84 814 182 7563,eu est congue elementum in hac habitasse platea dictumst morbi vestibulum velit id
6433,Eimbee,educkerin3t@studiopress.com,+86 498 576 6502,metus vitae ipsum aliquam non mauris morbi non lectus aliquam sit amet diam in magna bibendum imperdiet nullam orci pede venenatis non sodales sed tincidunt
6111,Thoughtblab,mbalthasar3u@acquirethisname.com,+86 909 311 0963,cras mi pede malesuada in imperdiet et commodo vulputate justo in blandit ultrices enim
5183,Meeveo,iaves3v@freewebs.com,+358 375 973 4485,libero convallis eget eleifend luctus ultricies eu nibh quisque id justo sit amet sapien
6431,Yotz,tmanthorpe3w@ucoz.com,+375 239 794 7465,aliquet at feugiat non pretium quis lectus suspendisse potenti in eleifend quam a odio in hac
5104,Voonte,urowland3x@cornell.edu,+63 803 440 8414,quam nec dui luctus rutrum
6370,Oodoo,tprimett3y@typepad.com,+62 299 689 4967,eget massa tempor convallis nulla neque libero convallis eget eleifend luctus ultricies eu nibh quisque id justo sit amet sapien dignissim vestibulum vestibulum ante
6186,Tambee,abudge3z@mail.ru,+86 227 555 8867,quam turpis adipiscing lorem vitae mattis nibh ligula nec sem duis aliquam convallis nunc proin at turpis a
5374,Fivebridge,sbeebe40@home.pl,+420 842 940 0626,orci luctus et ultrices posuere cubilia curae nulla dapibus dolor vel est donec odio justo
5815,Devpulse,garchard41@cisco.com,+62 154 699 9862,sapien non mi integer ac neque duis bibendum
5453,Meedoo,bjerrems42@nsw.gov.au,+51 476 272 6460,ultrices phasellus id sapien in sapien iaculis congue vivamus
5560,Browseblab,aaronovitz43@howstuffworks.com,+86 843 599 1012,ligula nec sem duis aliquam convallis nunc proin
5534,Linkbridge,vjindracek44@cnn.com,+86 423 390 9968,mauris viverra diam vitae quam suspendisse potenti nullam porttitor lacus at turpis donec posuere metus vitae
5927,Avaveo,pduesbury45@umich.edu,+380 235 938 2734,faucibus orci luctus et ultrices posuere cubilia curae donec pharetra magna vestibulum aliquet ultrices erat tortor sollicitudin mi sit amet lobortis sapien sapien
5787,Muxo,gcollocott46@hubpages.com,+242 562 124 5342,pulvinar sed nisl nunc rhoncus dui vel sem sed sagittis nam congue risus
5130,Kazu,hkliemke47@comcast.net,+62 391 349 8603,eros suspendisse accumsan tortor quis turpis sed ante vivamus tortor duis mattis egestas metus aenean fermentum donec ut mauris
6058,Quatz,tsyddall48@bloomberg.com,+86 366 996 6675,mus vivamus vestibulum sagittis sapien cum sociis natoque penatibus et magnis dis parturient
5016,Tekfly,chaywood49@google.com.hk,+358 402 562 4404,sapien cum sociis natoque penatibus et magnis dis parturient montes nascetur ridiculus mus etiam vel augue vestibulum rutrum rutrum neque aenean auctor gravida sem praesent
5571,Realpoint,vtoothill4a@squidoo.com,+48 453 133 7470,eget eleifend luctus ultricies eu nibh quisque id justo sit amet sapien dignissim vestibulum vestibulum ante ipsum primis in faucibus orci luctus et ultrices
5047,Gabcube,sriggeard4b@shop-pro.jp,+1 341 377 6776,eget semper rutrum nulla nunc
5777,Jayo,gweedall4c@si.edu,+33 125 908 6742,vestibulum ante ipsum primis in faucibus orci luctus et ultrices posuere cubilia curae donec pharetra magna vestibulum aliquet ultrices erat tortor sollicitudin
6405,Voonder,tfley4d@answers.com,+30 481 561 3603,et magnis dis parturient montes
6109,Jaxspan,gboullen4e@smugmug.com,+52 764 558 2417,cubilia curae duis faucibus accumsan odio curabitur convallis duis consequat dui nec nisi volutpat eleifend donec ut dolor
6441,Photojam,ptankus4f@nature.com,+86 980 276 5053,in est risus auctor sed tristique in tempus sit amet sem fusce consequat nulla nisl nunc nisl duis bibendum felis sed
5850,Roombo,mrennles4g@prlog.org,+86 723 406 4017,mus vivamus vestibulum sagittis sapien cum sociis natoque penatibus et magnis
5195,Zoombeat,vclemencet4h@statcounter.com,+7 250 284 2645,odio justo sollicitudin ut suscipit a feugiat et eros vestibulum ac
5266,Rhynyx,nyosevitz4i@spiegel.de,+7 980 448 2718,ut tellus nulla ut erat id mauris vulputate elementum nullam varius nulla facilisi cras non velit nec nisi vulputate nonummy maecenas tincidunt
6321,Babbleopia,msandry4j@phpbb.com,+57 356 319 1181,nullam orci pede venenatis non sodales sed tincidunt eu felis fusce posuere felis sed lacus morbi sem mauris laoreet ut rhoncus aliquet pulvinar sed
5855,Riffpedia,ctimby4k@springer.com,+62 716 448 9683,massa tempor convallis nulla neque libero convallis eget
5880,Snaptags,gnouch4l@typepad.com,+48 438 406 7012,ultrices posuere cubilia curae nulla dapibus
6203,Riffpath,kveregan4m@cmu.edu,+86 278 791 8624,duis at velit eu est congue elementum in hac habitasse platea dictumst morbi vestibulum velit id
5373,Voolia,bbeaudry4n@opensource.org,+62 153 237 9284,semper sapien a libero nam dui proin leo odio porttitor id
5746,Zoovu,pvedyasov4o@redcross.org,+1 172 401 7592,quis tortor id nulla ultrices aliquet maecenas leo odio condimentum id luctus nec molestie sed justo pellentesque
6128,Buzzshare,ldrinkale4p@indiatimes.com,+351 862 942 2104,proin eu mi nulla ac
5856,Meemm,ydansken4q@microsoft.com,+55 645 294 1845,maecenas rhoncus aliquam lacus morbi quis tortor id nulla ultrices aliquet maecenas leo odio condimentum id luctus nec molestie sed justo pellentesque viverra pede
5156,Oodoo,vkarle4r@china.com.cn,+7 450 815 6509,non quam nec dui luctus rutrum nulla tellus in sagittis dui vel nisl duis ac nibh fusce lacus purus aliquet at feugiat non pretium
5580,Edgepulse,alewer4s@chron.com,+57 154 261 8719,augue vel accumsan tellus nisi eu orci mauris lacinia
5758,Avamba,cpittaway4t@twitter.com,+63 997 556 8156,velit id pretium iaculis diam erat fermentum justo nec condimentum neque sapien placerat ante nulla justo aliquam
