SupplierID,SupplierName,SupplierEmail,SupplierPhone,SupplierDescription
6001,Topiczoom,hkeen0@fda.gov,+63 939 574 7796,nulla ultrices aliquet maecenas leo odio condimentum id luctus nec molestie sed justo pellentesque viverra pede ac diam cras
6002,Twinder,bvirgo1@cafepress.com,+7 359 471 5673,et eros vestibulum ac est lacinia nisi venenatis tristique
6003,Livetube,tslowly2@cyberchimps.com,+27 834 240 2836,justo sollicitudin ut suscipit a feugiat et eros vestibulum ac est lacinia nisi venenatis tristique fusce congue diam
6004,Viva,llangcastle3@unc.edu,+86 186 838 1932,dui proin leo odio porttitor id consequat in consequat ut nulla sed accumsan felis ut at
6005,Eamia,pstickley4@cam.ac.uk,+63 925 491 4927,venenatis non sodales sed tincidunt eu felis fusce posuere felis sed lacus morbi sem mauris laoreet ut rhoncus aliquet pulvinar sed nisl
6006,Omba,lallibon5@t.co,+86 910 682 2921,nulla suspendisse potenti cras in
6007,Aivee,zaveray6@dailymotion.com,+62 942 123 5108,faucibus orci luctus et ultrices posuere cubilia curae nulla dapibus dolor vel est donec odio justo sollicitudin ut suscipit a feugiat et eros vestibulum
6008,Browsebug,vbrewers7@deliciousdays.com,+86 681 386 1402,elit proin risus praesent lectus vestibulum quam sapien varius ut blandit non interdum in ante vestibulum ante ipsum
6009,Brightdog,yflucks8@reference.com,+33 319 982 7529,rutrum at lorem integer tincidunt ante
6010,Gigazoom,ncapel9@is.gd,+55 790 132 6471,at velit eu est congue elementum in hac habitasse platea dictumst morbi vestibulum velit id pretium iaculis
6011,Yamia,cmcginleya@nba.com,+49 289 664 5631,vel dapibus at diam nam tristique tortor eu
6012,Oyoloo,jdewisb@surveymonkey.com,+46 203 476 1141,fusce lacus purus aliquet at feugiat non pretium quis lectus
6013,Yata,nananc@tinyurl.com,+93 233 705 2276,bibendum morbi non quam nec dui luctus rutrum nulla tellus in sagittis dui vel nisl duis ac nibh fusce lacus purus aliquet at
6014,Twitterbeat,fdafterd@delicious.com,+86 123 235 8194,lectus aliquam sit amet diam in magna bibendum imperdiet nullam orci pede venenatis non sodales sed
6015,Meembee,esanbrokee@google.com,+48 424 664 8091,sed accumsan felis ut at dolor quis odio consequat varius integer
6016,Photobug,ebacklerf@wsj.com,+55 481 744 2929,maecenas rhoncus aliquam lacus morbi quis
6017,Twitternation,xcaldeirog@disqus.com,+56 977 384 3670,vestibulum proin eu mi nulla ac enim in tempor turpis nec euismod scelerisque quam turpis adipiscing lorem vitae mattis nibh
6018,Tazz,rcalterah@gnu.org,+66 563 993 4246,aenean fermentum donec ut mauris eget massa tempor convallis nulla neque libero convallis eget
6019,Oozz,cbeartupi@t-online.de,+351 679 574 9800,semper porta volutpat quam pede lobortis ligula sit amet eleifend pede libero quis orci nullam molestie nibh in lectus pellentesque at nulla suspendisse
6020,Tavu,eharmsonj@usa.gov,+86 419 116 0343,in eleifend quam a odio in hac
6021,Skyndu,mgrenfellk@marketwatch.com,+234 441 724 9595,eu mi nulla ac enim in tempor turpis nec euismod scelerisque quam turpis adipiscing lorem
6022,Skipstorm,ggerrardl@nyu.edu,+255 475 584 8972,habitasse platea dictumst etiam faucibus cursus urna ut tellus nulla ut erat id mauris vulputate elementum nullam varius nulla facilisi cras non velit nec
6023,Rooxo,bbindingm@washingtonpost.com,+86 629 931 0761,rutrum nulla tellus in sagittis dui vel nisl
6024,Skyndu,jdengaten@bluehost.com,+86 900 633 6577,augue vestibulum rutrum rutrum neque
6025,Katz,gmattingsono@quantcast.com,+95 961 137 0120,sed vestibulum sit amet cursus id turpis integer aliquet massa id lobortis convallis tortor risus dapibus augue vel accumsan tellus nisi eu orci mauris lacinia
6026,Tagtune,ecapesp@nature.com,+52 862 946 6862,nulla justo aliquam quis turpis eget elit sodales scelerisque mauris sit amet eros suspendisse accumsan
6027,Thoughtmix,rjentetq@vk.com,+86 749 944 5496,eu est congue elementum in hac habitasse platea dictumst morbi vestibulum velit id pretium iaculis diam erat fermentum justo
6028,Edgepulse,chabbalr@wikia.com,+86 745 194 1925,vulputate luctus cum sociis natoque penatibus et magnis dis parturient montes nascetur
6029,Zooveo,pwalkleys@macromedia.com,+54 186 610 2196,sit amet cursus id turpis integer aliquet massa id lobortis convallis tortor risus dapibus augue vel accumsan tellus nisi eu orci mauris lacinia sapien
6030,Oyope,ltowlert@hhs.gov,+30 841 290 0424,vel est donec odio justo sollicitudin ut suscipit a feugiat et eros vestibulum ac
6031,Topicshots,acrumpeu@skype.com,+7 897 413 0009,amet consectetuer adipiscing elit proin risus praesent lectus vestibulum quam sapien varius ut blandit non
6032,Youspan,acorteisv@ucoz.ru,+98 675 552 3110,sapien sapien non mi integer ac neque duis bibendum morbi
6033,Edgewire,kbrameltw@utexas.edu,+63 591 483 4732,cursus id turpis integer aliquet massa id lobortis convallis tortor
6034,Topicware,kcurmanx@dailymotion.com,+7 415 631 8649,est congue elementum in hac habitasse platea dictumst morbi vestibulum velit id pretium iaculis diam erat fermentum justo nec condimentum neque sapien placerat ante nulla
6035,Tazzy,rallewelly@list-manage.com,+86 571 770 7357,pede posuere nonummy integer non velit donec diam neque vestibulum eget vulputate ut ultrices vel augue vestibulum ante ipsum primis in
6036,Skivee,jhandmorez@archive.org,+242 395 536 5360,nunc donec quis orci eget orci vehicula condimentum curabitur in libero ut massa volutpat convallis morbi odio odio elementum eu interdum eu tincidunt
6037,Viva,kbradnick10@mlb.com,+86 987 371 9211,nulla mollis molestie lorem quisque ut erat curabitur gravida nisi at nibh in hac habitasse platea
6038,Realbridge,dlesarr11@gizmodo.com,+51 238 728 0331,mauris sit amet eros suspendisse accumsan tortor quis turpis sed ante vivamus tortor
6039,Cogilith,bdaile12@myspace.com,+420 608 596 7469,odio justo sollicitudin ut suscipit
6040,Rhybox,sduckett13@google.es,+218 977 212 5462,pede posuere nonummy integer non velit donec diam neque vestibulum eget vulputate ut ultrices vel augue vestibulum ante ipsum primis in faucibus orci luctus
6041,Jaxspan,adoughartie14@topsy.com,+1 915 140 3630,congue diam id ornare imperdiet sapien urna pretium nisl ut volutpat sapien
6042,Zooxo,lheaphy15@va.gov,+60 621 868 5103,in lacus curabitur at ipsum ac tellus
6043,Ozu,kclapham16@timesonline.co.uk,+66 802 230 5773,fusce posuere felis sed lacus morbi sem mauris laoreet ut rhoncus aliquet pulvinar sed nisl nunc rhoncus dui vel sem sed sagittis nam congue
6044,Trilia,eboldra17@google.fr,+63 791 633 7391,congue elementum in hac habitasse platea dictumst morbi vestibulum velit id pretium iaculis diam erat
6045,Izio,bcaulcott18@simplemachines.org,+856 916 820 4645,vel lectus in quam fringilla rhoncus mauris enim leo rhoncus sed vestibulum sit amet cursus id
6046,Realpoint,cnaismith19@vkontakte.ru,+420 346 997 4719,ipsum integer a nibh in quis justo maecenas rhoncus aliquam lacus morbi quis tortor id nulla ultrices aliquet maecenas leo odio condimentum id
6047,Katz,oolligan1a@printfriendly.com,+58 114 179 2524,iaculis congue vivamus metus arcu adipiscing molestie hendrerit at vulputate vitae nisl aenean lectus pellentesque eget
6048,Blogtags,mmeagher1b@moonfruit.com,+374 528 871 7488,orci vehicula condimentum curabitur in libero ut massa volutpat convallis morbi odio odio
6049,Flipbug,jgimert1c@timesonline.co.uk,+55 289 654 3413,eget nunc donec quis orci eget orci vehicula condimentum curabitur in libero ut massa volutpat convallis morbi odio odio elementum eu interdum eu tincidunt in
6050,Yoveo,bsammonds1d@archive.org,+351 778 670 4838,turpis integer aliquet massa id lobortis convallis tortor risus dapibus augue vel accumsan tellus nisi eu orci mauris
6051,Zoombeat,bbitchener1e@google.com.br,+51 769 209 3639,integer ac leo pellentesque ultrices mattis odio donec vitae nisi nam ultrices libero non mattis
6052,JumpXS,omacloughlin1f@istockphoto.com,+7 778 921 0305,sed interdum venenatis turpis enim blandit mi in porttitor pede justo eu massa donec dapibus duis at velit eu est congue
6053,Skibox,adecruze1g@dropbox.com,+86 916 725 6278,vehicula condimentum curabitur in libero ut massa volutpat convallis morbi odio odio elementum eu
6054,Devpoint,rfuke1h@surveymonkey.com,+92 753 271 5392,eu magna vulputate luctus cum sociis natoque penatibus et
6055,Geba,sbleyman1i@un.org,+62 544 942 3247,ligula sit amet eleifend pede libero quis orci nullam molestie nibh in lectus pellentesque at nulla suspendisse potenti cras in purus eu
6056,Eare,ihales1j@theglobeandmail.com,+351 425 755 2982,nibh quisque id justo sit amet sapien dignissim vestibulum vestibulum ante ipsum primis in faucibus orci luctus et ultrices posuere cubilia curae nulla
6057,Gigaclub,esteffens1k@dion.ne.jp,+7 715 566 9764,nibh in lectus pellentesque at nulla suspendisse potenti cras in purus eu magna vulputate luctus cum sociis
6058,Centizu,gpayfoot1l@buzzfeed.com,+1 469 828 0272,ut nunc vestibulum ante ipsum primis in faucibus orci luctus et ultrices posuere cubilia
6059,Vinder,dfedorchenko1m@elegantthemes.com,+420 816 357 6074,praesent blandit nam nulla integer pede justo lacinia eget tincidunt eget tempus vel pede morbi
6060,Kamba,rwhiteoak1n@skyrock.com,+223 933 956 0319,augue vestibulum ante ipsum primis in faucibus orci luctus et ultrices
6061,Yozio,emaving1o@un.org,+86 130 207 7423,vulputate justo in blandit ultrices enim lorem
6062,Avamm,hohalligan1p@bravesites.com,+62 905 521 3125,sapien urna pretium nisl ut volutpat sapien arcu sed augue aliquam erat volutpat in congue etiam justo
6063,Feedbug,jsemark1q@livejournal.com,+998 525 286 6480,nullam molestie nibh in lectus pellentesque at nulla suspendisse potenti cras in purus eu magna vulputate luctus
6064,Ailane,abascombe1r@fc2.com,+86 508 391 3240,vel accumsan tellus nisi eu orci mauris lacinia sapien quis libero nullam sit
6065,Oba,tjonke1s@google.ca,+86 163 156 3691,diam vitae quam suspendisse potenti nullam porttitor lacus at turpis donec posuere metus vitae ipsum aliquam non mauris morbi non lectus aliquam
6066,Shuffledrive,bgrainge1t@goo.ne.jp,+51 133 231 2480,vivamus metus arcu adipiscing molestie hendrerit at vulputate vitae nisl aenean lectus pellentesque eget nunc donec quis orci eget orci vehicula
6067,Lazzy,cravenscroftt1u@bbb.org,+86 661 589 1321,suscipit ligula in lacus curabitur at ipsum ac tellus semper interdum mauris ullamcorper purus sit amet nulla quisque arcu
6068,Devbug,lhalm1v@rambler.ru,+34 730 708 8696,sapien iaculis congue vivamus metus arcu adipiscing molestie hendrerit at vulputate vitae nisl aenean lectus pellentesque eget nunc donec quis orci eget
6069,Centimia,iashburner1w@gov.uk,+86 129 185 0283,mus vivamus vestibulum sagittis sapien cum sociis natoque penatibus et magnis dis parturient montes nascetur ridiculus
6070,Fiveclub,afehely1x@cornell.edu,+86 426 107 2130,sociis natoque penatibus et magnis dis parturient montes nascetur ridiculus mus vivamus vestibulum sagittis sapien cum sociis natoque penatibus et magnis dis parturient montes
6071,Twitterworks,estocking1y@walmart.com,+55 355 698 3846,in faucibus orci luctus et ultrices posuere cubilia curae mauris viverra
6072,Brainbox,kmahy1z@theguardian.com,+7 592 307 7968,faucibus orci luctus et ultrices posuere cubilia curae mauris viverra diam vitae quam suspendisse potenti nullam
6073,Livetube,ntrounson20@hatena.ne.jp,+62 673 463 1245,quam pharetra magna ac consequat metus sapien ut nunc vestibulum ante
6074,Voonix,pdenes21@gmpg.org,+63 572 667 9719,augue vestibulum ante ipsum primis in faucibus orci luctus et ultrices
6075,Buzzster,ipitfield22@nps.gov,+62 382 573 9602,cras mi pede malesuada in imperdiet et
6076,Gigaclub,calldis23@github.io,+63 691 382 2867,odio cras mi pede malesuada in imperdiet et commodo vulputate justo in blandit ultrices
6077,Skyba,ssoots24@go.com,+63 574 728 7184,mi nulla ac enim in tempor turpis nec euismod
6078,Aivee,acockran25@mayoclinic.com,+56 946 223 7695,luctus et ultrices posuere cubilia curae duis faucibus accumsan odio curabitur convallis duis consequat dui nec nisi volutpat eleifend donec ut dolor morbi
6079,Quamba,kpetrakov26@clickbank.net,+86 356 800 2512,dui luctus rutrum nulla tellus in sagittis dui vel nisl duis ac
6080,Voonte,bdabling27@sakura.ne.jp,+1 937 564 6389,mattis odio donec vitae nisi nam ultrices libero non mattis pulvinar
6081,Voonder,sbulward28@theatlantic.com,+7 348 171 8221,mauris viverra diam vitae quam suspendisse potenti nullam porttitor lacus at turpis donec posuere metus vitae
6082,Meetz,abrace29@ox.ac.uk,+358 544 785 1925,purus aliquet at feugiat non pretium
6083,Skalith,owasteney2a@a8.net,+81 157 667 7311,rutrum rutrum neque aenean auctor gravida sem praesent id massa id nisl venenatis lacinia aenean sit amet justo morbi ut odio cras mi pede malesuada
6084,Myworks,jchurches2b@cbslocal.com,+351 852 625 9430,quam sapien varius ut blandit non interdum in ante vestibulum ante ipsum primis in faucibus orci luctus et ultrices posuere cubilia curae duis faucibus accumsan
6085,Tanoodle,cjeffes2c@wikimedia.org,+55 831 226 2383,cras in purus eu magna vulputate luctus cum sociis natoque penatibus et magnis dis parturient montes
6086,Gigazoom,ahutfield2d@jimdo.com,+420 487 631 0068,aliquam lacus morbi quis tortor id nulla ultrices aliquet maecenas leo odio condimentum id luctus nec molestie sed justo pellentesque viverra pede ac diam
6087,Topicshots,mduckitt2e@pcworld.com,+351 730 635 3383,lectus suspendisse potenti in eleifend quam a
6088,Skalith,kbatsford2f@hexun.com,+351 720 145 3559,in faucibus orci luctus et ultrices posuere cubilia curae nulla dapibus dolor vel est donec odio justo sollicitudin ut suscipit a feugiat
6089,Skinder,rwakeman2g@dagondesign.com,+7 312 409 0091,consectetuer adipiscing elit proin risus praesent lectus vestibulum quam sapien
6090,Jetwire,sdykes2h@yolasite.com,+503 935 173 4953,turpis donec posuere metus vitae ipsum aliquam non mauris morbi non lectus aliquam sit amet diam in magna
6091,Youopia,wlanglois2i@ucoz.ru,+66 876 679 4773,amet nunc viverra dapibus nulla suscipit ligula in lacus
6092,Devbug,cfandrich2j@webnode.com,+63 128 798 2155,ac tellus semper interdum mauris ullamcorper purus sit amet nulla quisque arcu libero rutrum ac lobortis vel dapibus at diam nam tristique tortor eu
6093,Topicshots,pelstob2k@tiny.cc,+33 100 420 5567,nec molestie sed justo pellentesque viverra pede ac diam cras pellentesque
6094,Buzzbean,idorran2l@bigcartel.com,+55 574 762 1745,proin interdum mauris non ligula pellentesque ultrices phasellus id sapien in sapien iaculis congue vivamus
6095,Tagtune,zbernhardsson2m@friendfeed.com,+234 716 821 8803,metus arcu adipiscing molestie hendrerit at vulputate vitae nisl aenean lectus pellentesque eget nunc donec quis orci eget orci
6096,Oozz,prangell2n@boston.com,+58 485 484 6029,pede venenatis non sodales sed tincidunt eu felis fusce posuere felis sed lacus
6097,Roombo,ughilardini2o@lulu.com,+86 847 977 1333,nullam orci pede venenatis non
6098,Mybuzz,ameenehan2p@youku.com,+7 482 775 0216,eros viverra eget congue eget semper rutrum nulla
6099,Aivee,acastagno2q@hostgator.com,+62 917 655 6431,ultrices libero non mattis pulvinar nulla pede ullamcorper augue a suscipit nulla elit ac nulla sed
6100,Kamba,ccostall2r@nba.com,+33 677 202 1723,rutrum rutrum neque aenean auctor gravida sem praesent id massa id
6101,Zooveo,ewiddup2s@webnode.com,+420 498 879 0609,posuere nonummy integer non velit donec diam neque vestibulum eget vulputate ut ultrices vel augue vestibulum ante ipsum primis in faucibus
6102,Youfeed,mbarraclough2t@yale.edu,+51 953 869 8299,ut ultrices vel augue vestibulum ante ipsum primis in faucibus orci luctus et ultrices posuere cubilia curae donec pharetra magna vestibulum aliquet ultrices erat tortor
6103,Yadel,tdooly2u@bigcartel.com,+593 203 970 4027,in eleifend quam a odio in hac habitasse platea dictumst maecenas ut massa quis augue luctus
6104,Photojam,ksopp2v@squidoo.com,+30 144 286 0721,in porttitor pede justo eu massa donec
6105,Blogpad,dcrosen2w@naver.com,+55 555 355 1437,odio justo sollicitudin ut suscipit a feugiat
6106,Skinder,spaulmann2x@nymag.com,+66 456 237 0666,est lacinia nisi venenatis tristique fusce congue diam id ornare imperdiet
6107,Devify,amcillroy2y@storify.com,+55 878 750 0176,donec ut mauris eget massa tempor convallis nulla neque libero convallis eget eleifend luctus ultricies eu nibh quisque
6108,Twinder,lgalia2z@oracle.com,+86 112 363 4543,dui proin leo odio porttitor id consequat in consequat ut nulla sed
6109,Skivee,floukes30@craigslist.org,+57 247 763 3497,diam neque vestibulum eget vulputate ut ultrices vel augue vestibulum ante ipsum primis in faucibus orci luctus et ultrices posuere cubilia curae donec pharetra magna
6110,Browseblab,vsarrell31@webmd.com,+62 461 939 2101,libero nam dui proin leo odio porttitor id consequat in
6111,Jetpulse,bbengtsson32@yale.edu,+380 944 451 5347,ac diam cras pellentesque volutpat dui maecenas tristique est et tempus semper est quam pharetra magna ac consequat metus sapien ut
6112,Twitterlist,sbartunek33@scientificamerican.com,+51 279 574 0158,hac habitasse platea dictumst morbi vestibulum velit id pretium iaculis diam erat fermentum justo nec condimentum neque sapien placerat ante nulla justo
6113,BlogXS,mgiffard34@slate.com,+62 926 999 6746,id lobortis convallis tortor risus dapibus augue vel accumsan tellus nisi eu orci mauris lacinia sapien quis libero nullam sit amet turpis elementum
6114,Skipfire,ekey35@elpais.com,+62 281 778 8921,vestibulum proin eu mi nulla ac
6115,Eare,sadamski36@sbwire.com,+86 241 164 4747,aliquam quis turpis eget elit sodales scelerisque mauris sit amet eros suspendisse accumsan tortor quis turpis sed ante vivamus tortor duis mattis egestas
6116,Realbridge,pturrell37@engadget.com,+33 496 888 7739,ultrices enim lorem ipsum dolor sit amet consectetuer adipiscing elit proin interdum mauris non ligula pellentesque ultrices phasellus id sapien
6117,Innotype,ctanzig38@dailymail.co.uk,+251 896 623 5888,mi pede malesuada in imperdiet et commodo vulputate justo in blandit ultrices enim lorem ipsum
6118,Skiptube,scornfoot39@pinterest.com,+595 973 475 9744,tempus vel pede morbi porttitor lorem id ligula suspendisse ornare consequat lectus in est risus auctor sed tristique in tempus sit amet
6119,Voonder,zpawelek3a@freewebs.com,+86 642 196 5569,neque libero convallis eget eleifend luctus ultricies eu nibh quisque id justo sit amet sapien dignissim vestibulum vestibulum ante ipsum primis in faucibus
6120,Brightbean,ebanaszewski3b@reuters.com,+507 332 971 9644,a pede posuere nonummy integer non velit donec diam neque vestibulum eget vulputate ut ultrices vel augue vestibulum ante ipsum primis in
6121,Aibox,dpashbee3c@ucoz.com,+48 387 963 8008,rhoncus aliquet pulvinar sed nisl nunc rhoncus dui vel sem sed sagittis nam congue risus
6122,Flashspan,dgreenshiels3d@webeden.co.uk,+86 671 807 3159,ante vivamus tortor duis mattis egestas metus aenean fermentum donec ut mauris eget massa tempor convallis nulla neque
6123,Livepath,dpeasnone3e@blogtalkradio.com,+1 408 162 8204,enim lorem ipsum dolor sit amet consectetuer adipiscing elit proin interdum mauris non ligula pellentesque ultrices phasellus
6124,Devpoint,mclother3f@google.nl,+358 662 868 0693,orci luctus et ultrices posuere cubilia curae duis faucibus accumsan odio curabitur convallis duis consequat dui nec nisi volutpat
6125,Zoomzone,lharden3g@mozilla.org,+86 675 106 4150,curabitur gravida nisi at nibh in hac habitasse platea
6126,Eabox,tshine3h@trellian.com,+593 433 834 7069,sed magna at nunc commodo placerat praesent blandit nam nulla integer pede justo lacinia eget
6127,Chatterbridge,dbrandle3i@discuz.net,+7 609 947 4599,posuere cubilia curae duis faucibus accumsan odio curabitur convallis duis consequat dui nec nisi volutpat eleifend donec ut dolor
6128,Divavu,bmacieiczyk3j@bravesites.com,+48 282 164 9802,eleifend pede libero quis orci nullam molestie nibh in lectus pellentesque at nulla
6129,Feedbug,dbatie3k@feedburner.com,+45 384 613 3250,aenean lectus pellentesque eget nunc donec quis orci eget orci vehicula condimentum curabitur in libero ut massa volutpat convallis
6130,Flipstorm,ibyrcher3l@ucoz.com,+86 977 928 2648,mattis nibh ligula nec sem duis aliquam convallis nunc proin at turpis a pede posuere nonummy integer non
6131,Camido,cbrookshaw3m@arizona.edu,+7 987 868 1534,nunc vestibulum ante ipsum primis in faucibus orci luctus et ultrices posuere cubilia curae mauris viverra diam vitae quam suspendisse potenti nullam porttitor lacus
6132,Roombo,smerrigans3n@rambler.ru,+86 223 821 0000,nulla quisque arcu libero rutrum ac lobortis vel
6133,Realbridge,cneesham3o@yelp.com,+55 621 613 1764,dis parturient montes nascetur ridiculus mus etiam vel augue vestibulum rutrum rutrum neque
6134,Fivechat,leby3p@php.net,+66 731 678 5492,nulla nisl nunc nisl duis bibendum felis sed interdum venenatis turpis enim blandit
6135,Trudeo,tbendik3q@yelp.com,+62 721 982 1694,congue etiam justo etiam pretium iaculis justo in
6136,Youopia,bstuchberry3r@desdev.cn,+86 933 463 5276,pellentesque eget nunc donec quis orci eget orci vehicula condimentum curabitur in libero ut massa volutpat
6137,Jabbersphere,ttawton3s@loc.gov,+355 164 184 6110,aliquet pulvinar sed nisl nunc rhoncus dui vel sem
6138,Edgepulse,rvarley3t@elegantthemes.com,+964 898 485 0339,aliquam lacus morbi quis tortor id nulla ultrices aliquet maecenas leo odio condimentum
6139,Jabberstorm,dcamber3u@netscape.com,+1 814 577 4749,habitasse platea dictumst etiam faucibus cursus urna ut tellus nulla ut erat id mauris vulputate elementum nullam
6140,Tagfeed,mstarling3v@va.gov,+31 929 986 5967,vestibulum sed magna at nunc commodo placerat praesent blandit
6141,Mycat,gnoot3w@1688.com,+46 814 851 5852,eu tincidunt in leo maecenas pulvinar lobortis est phasellus sit
6142,Zoomdog,gpadkin3x@amazon.co.jp,+86 134 821 8174,eget eros elementum pellentesque quisque porta
6143,Reallinks,wglossop3y@tripadvisor.com,+242 214 333 3159,sed sagittis nam congue risus semper porta volutpat quam pede lobortis ligula sit amet eleifend
6144,Devshare,svobes3z@wordpress.com,+225 626 846 9522,et ultrices posuere cubilia curae nulla dapibus dolor vel est donec odio justo sollicitudin ut suscipit a feugiat et eros vestibulum ac
6145,Jaxbean,tdragon40@cmu.edu,+1 472 698 0937,rhoncus sed vestibulum sit amet cursus
6146,Ailane,fburdge41@devhub.com,+86 633 702 2490,orci nullam molestie nibh in lectus pellentesque at nulla suspendisse potenti cras in purus eu
6147,Eimbee,mlanglands42@com.com,+55 684 294 8765,curae duis faucibus accumsan odio curabitur convallis duis consequat dui nec nisi volutpat eleifend donec ut dolor morbi vel lectus in quam fringilla
6148,Kare,ocrook43@utexas.edu,+62 136 784 7724,ipsum primis in faucibus orci luctus et ultrices posuere cubilia curae donec pharetra magna vestibulum aliquet ultrices erat tortor
6149,Oyoyo,ecolcutt44@mayoclinic.com,+375 318 735 5451,tellus nisi eu orci mauris
6150,Bubbletube,dmilward45@studiopress.com,+51 806 626 1684,condimentum curabitur in libero ut massa volutpat convallis morbi odio odio elementum eu interdum
6151,JumpXS,acolleck46@technorati.com,+86 473 619 0028,ipsum dolor sit amet consectetuer adipiscing elit proin interdum mauris non ligula pellentesque ultrices phasellus id sapien in sapien iaculis congue
6152,Gabspot,jleadley47@cdbaby.com,+63 855 127 3067,tempor convallis nulla neque libero convallis eget eleifend luctus ultricies
6153,Thoughtstorm,ncanellas48@mail.ru,+62 695 283 0973,felis ut at dolor quis odio consequat varius integer ac leo pellentesque ultrices mattis odio donec vitae nisi nam ultrices libero non mattis pulvinar
6154,Blogpad,fjandera49@tamu.edu,+58 728 456 0277,posuere cubilia curae mauris viverra diam vitae quam suspendisse potenti nullam porttitor lacus at turpis donec posuere metus vitae ipsum aliquam non
6155,Babblestorm,cilem4a@dot.gov,+86 339 542 7565,amet sem fusce consequat nulla nisl nunc
6156,Skivee,cvidgeon4b@phpbb.com,+62 310 135 8729,orci vehicula condimentum curabitur in libero ut massa volutpat convallis morbi odio odio elementum eu interdum eu tincidunt in leo
6157,Avaveo,aservante4c@histats.com,+86 173 740 2981,vestibulum ac est lacinia nisi venenatis tristique fusce congue diam id ornare imperdiet sapien urna pretium nisl ut volutpat sapien arcu sed augue aliquam
6158,Zoombeat,ghuddle4d@4shared.com,+7 886 743 6108,aliquet massa id lobortis convallis tortor risus dapibus augue vel accumsan tellus nisi eu orci mauris lacinia sapien
6159,Aimbo,lbryson4e@techcrunch.com,+1 714 614 7796,nisi volutpat eleifend donec ut dolor morbi vel
6160,Muxo,gseabourne4f@youtube.com,+351 552 234 2397,eros elementum pellentesque quisque porta volutpat erat quisque erat eros viverra eget
6161,Topdrive,seaglesham4g@vinaora.com,+62 194 630 3146,consequat lectus in est risus auctor sed tristique in tempus sit
6162,Yoveo,fbarwood4h@simplemachines.org,+251 652 863 2754,rutrum at lorem integer tincidunt ante vel ipsum praesent blandit lacinia erat vestibulum sed magna at nunc
6163,Feedbug,jmacclancey4i@over-blog.com,+86 979 199 9749,nec dui luctus rutrum nulla
6164,Wikibox,bdelany4j@mozilla.com,+1 320 687 7061,pharetra magna vestibulum aliquet ultrices erat
6165,Skidoo,rmalpass4k@columbia.edu,+86 366 997 3455,sit amet turpis elementum ligula vehicula consequat morbi a ipsum integer a nibh in quis justo maecenas rhoncus aliquam lacus morbi quis tortor id nulla
6166,Gigaclub,sstockwell4l@edublogs.org,+420 276 389 1887,et magnis dis parturient montes nascetur ridiculus mus etiam vel augue vestibulum rutrum rutrum neque aenean auctor gravida sem praesent id massa id nisl venenatis
6167,Mudo,rdimbleby4m@freewebs.com,+86 532 824 5364,turpis nec euismod scelerisque quam turpis adipiscing
6168,Tanoodle,edowns4n@twitter.com,+86 946 770 0959,eu magna vulputate luctus cum sociis natoque penatibus et magnis dis parturient montes nascetur ridiculus mus vivamus vestibulum sagittis sapien cum sociis natoque
