SupplierID,SupplierName,SupplierEmail,SupplierPhone,SupplierDescription
5818,Oyondu,dthewlisjb@qq.com,+92 561 234 3134,nulla elit ac nulla sed vel enim sit amet nunc viverra dapibus nulla suscipit ligula in lacus curabitur at ipsum ac tellus semper interdum
5729,Oba,bwapplejc@hubpages.com,+81 444 638 6575,est phasellus sit amet erat nulla tempus vivamus in felis eu sapien cursus vestibulum proin eu mi nulla ac enim in tempor turpis nec
5827,Browseblab,cmcfadejd@ebay.com,+48 856 960 3799,magnis dis parturient montes nascetur ridiculus mus vivamus vestibulum sagittis sapien cum sociis
5309,Wikizz,dbockinje@icq.com,+62 269 109 0255,mauris eget massa tempor convallis nulla neque libero convallis eget eleifend luctus ultricies eu
5538,Bluejam,amaplethorpejf@fc2.com,+46 837 156 5568,massa tempor convallis nulla neque libero convallis eget eleifend luctus ultricies eu nibh quisque id justo sit amet
6169,Topiczoom,sbaldryjg@amazon.com,+86 244 434 7733,metus aenean fermentum donec ut mauris eget massa
6300,Buzzster,fbulmerjh@tripadvisor.com,+51 674 837 7747,et ultrices posuere cubilia curae donec
5601,Edgeify,bbachmanji@usatoday.com,+54 547 332 6873,quis tortor id nulla ultrices aliquet
5234,Jayo,ahainsworthjj@typepad.com,+1 727 305 6834,ante ipsum primis in faucibus orci luctus et ultrices posuere cubilia curae duis faucibus accumsan odio curabitur convallis duis consequat dui nec
5171,Skidoo,omacnucatorjk@bloomberg.com,+62 569 111 3003,lacinia eget tincidunt eget tempus vel pede morbi porttitor lorem id ligula suspendisse ornare consequat lectus in est risus auctor sed tristique in tempus
5009,Janyx,agoodredgejl@google.com.hk,+62 654 695 2305,eget tempus vel pede morbi porttitor lorem id ligula suspendisse ornare consequat lectus
6390,Kamba,icawtjm@google.es,+420 683 477 0773,tincidunt ante vel ipsum praesent blandit lacinia erat
5217,Feedfire,cstollenwerckjn@digg.com,+7 929 106 8174,felis fusce posuere felis sed lacus morbi sem mauris laoreet ut rhoncus aliquet pulvinar
6301,Quatz,bpettojo@addthis.com,+420 525 400 9699,erat id mauris vulputate elementum nullam varius nulla facilisi cras non velit nec nisi vulputate nonummy maecenas tincidunt lacus at velit vivamus vel
5145,Photospace,jpetrazzijp@dion.ne.jp,+351 528 857 8225,cras in purus eu magna vulputate luctus cum sociis natoque penatibus et magnis dis parturient montes nascetur ridiculus mus vivamus vestibulum sagittis sapien cum sociis
5938,Gigashots,laimerjq@vistaprint.com,+7 430 390 7166,et ultrices posuere cubilia curae donec pharetra magna vestibulum aliquet ultrices erat tortor sollicitudin mi sit amet lobortis sapien sapien non mi integer ac neque
5289,Camimbo,sjerromejr@abc.net.au,+598 132 810 2120,justo etiam pretium iaculis justo in hac habitasse platea dictumst etiam faucibus cursus urna ut tellus nulla ut erat id mauris vulputate elementum nullam
5523,Photofeed,ndannettjs@purevolume.com,+212 441 489 0662,ac est lacinia nisi venenatis tristique fusce congue diam id ornare imperdiet sapien urna pretium nisl ut volutpat sapien
5191,Skiptube,sgeerdtsjt@bravesites.com,+63 284 985 8334,id justo sit amet sapien dignissim vestibulum vestibulum ante ipsum primis in
5837,Shufflebeat,cgrealyju@slate.com,+54 653 632 7457,imperdiet et commodo vulputate justo in blandit ultrices enim lorem ipsum dolor sit amet consectetuer adipiscing elit
5005,Trilia,fdearjv@dion.ne.jp,+62 689 515 2816,lobortis vel dapibus at diam nam tristique tortor
6441,Kayveo,nbowhayjw@dedecms.com,+86 959 965 7152,sapien urna pretium nisl ut volutpat sapien arcu sed augue
5700,Aibox,glowndesjx@yellowpages.com,+375 358 602 7467,condimentum curabitur in libero ut massa volutpat convallis morbi odio odio elementum
5721,Muxo,eivashovjy@yandex.ru,+33 405 513 9269,proin leo odio porttitor id consequat in consequat ut nulla sed accumsan felis ut at dolor quis odio consequat
5601,Zooveo,udunnionjz@rakuten.co.jp,+33 625 223 5061,at turpis a pede posuere nonummy integer non velit donec diam neque
5874,Skimia,araubenheimk0@php.net,+1 817 541 3913,et magnis dis parturient montes nascetur ridiculus mus etiam vel augue vestibulum
5089,Kwinu,sbrookesk1@thetimes.co.uk,+86 424 133 9425,consequat metus sapien ut nunc vestibulum ante ipsum primis in faucibus orci luctus
6453,Quimba,esextik2@pinterest.com,+372 512 584 4089,libero rutrum ac lobortis vel dapibus at
5001,Yodoo,inisiusk3@blogtalkradio.com,+55 857 326 6556,quam a odio in hac habitasse platea dictumst
5813,Bubbletube,tpereirak4@cdbaby.com,+60 333 907 2734,arcu libero rutrum ac lobortis vel dapibus at
5362,Photospace,eenevoldsenk5@gov.uk,+234 916 179 2696,ultrices vel augue vestibulum ante
5821,Realcube,lantenk6@newsvine.com,+86 153 773 4462,semper rutrum nulla nunc purus phasellus in felis donec semper sapien a libero nam dui proin leo odio porttitor
6051,Tagopia,hbroughk7@angelfire.com,+7 771 175 4076,morbi a ipsum integer a nibh in quis justo maecenas rhoncus aliquam lacus morbi quis tortor id nulla ultrices aliquet maecenas leo odio condimentum
5541,Quatz,cstammerk8@ed.gov,+48 471 563 6929,proin eu mi nulla ac enim in tempor turpis nec
5979,Ozu,bkohlermank9@economist.com,+57 503 235 7227,mauris viverra diam vitae quam suspendisse potenti nullam porttitor lacus at turpis donec posuere metus vitae ipsum aliquam non mauris morbi non lectus aliquam
5727,Jaxnation,othreadgouldka@utexas.edu,+63 474 295 9117,nec condimentum neque sapien placerat ante nulla justo aliquam quis turpis eget elit sodales scelerisque mauris sit
5528,Edgeclub,scorradinokb@github.com,+86 606 445 0157,hac habitasse platea dictumst maecenas ut
5725,Kazio,kcleminshawkc@hp.com,+351 769 502 3572,eros vestibulum ac est lacinia nisi venenatis tristique fusce congue diam id ornare imperdiet sapien urna
6202,Bubblebox,bedscerkd@clickbank.net,+86 892 859 4684,dolor quis odio consequat varius integer ac leo pellentesque ultrices mattis odio donec vitae nisi nam ultrices libero non mattis
5595,Vidoo,bbooelnke@archive.org,+63 545 197 6172,morbi porttitor lorem id ligula suspendisse ornare consequat lectus in est risus auctor sed tristique in tempus sit amet sem fusce
5461,Wikibox,vaustingkf@naver.com,+63 645 634 1236,metus aenean fermentum donec ut mauris eget
6383,Jetwire,lknowldenkg@google.ru,+226 625 910 1909,id mauris vulputate elementum nullam varius nulla facilisi cras non velit nec nisi
6039,Eimbee,fgorringkh@parallels.com,+84 616 843 2700,hac habitasse platea dictumst aliquam augue quam sollicitudin vitae consectetuer eget rutrum at lorem integer tincidunt ante vel ipsum praesent
5558,Oyope,koheneryki@cdc.gov,+992 134 783 3714,etiam pretium iaculis justo in hac habitasse platea dictumst etiam faucibus cursus urna ut tellus nulla ut
6212,Mycat,fwainscotkj@soup.io,+385 622 340 7156,morbi non quam nec dui luctus rutrum nulla tellus in sagittis dui
5652,Mita,scarmodykk@moonfruit.com,+7 350 190 9853,nonummy integer non velit donec diam neque vestibulum eget vulputate ut ultrices vel
6360,Meemm,evlasinkl@gov.uk,+66 669 117 6277,curae duis faucibus accumsan odio curabitur convallis duis consequat dui nec
5078,Yodel,gdomenckm@wix.com,+57 711 597 2359,lacinia sapien quis libero nullam sit amet turpis elementum
5050,Skidoo,ydollingkn@fema.gov,+62 207 551 9545,venenatis lacinia aenean sit amet justo morbi ut odio cras mi pede malesuada in imperdiet et commodo vulputate justo
5157,Youtags,cwaghornko@addtoany.com,+63 202 952 3004,porta volutpat erat quisque erat eros viverra eget
5096,Jabbercube,cpaskkp@google.it,+86 389 157 3147,orci eget orci vehicula condimentum curabitur in libero ut massa volutpat convallis morbi
5011,Yambee,sfowlerkq@ask.com,+242 687 342 0731,molestie hendrerit at vulputate vitae nisl aenean lectus pellentesque eget nunc
6215,Aivee,mjennaroykr@myspace.com,+58 988 239 5445,sem sed sagittis nam congue risus semper porta volutpat quam pede lobortis ligula sit amet eleifend pede libero quis orci nullam molestie nibh in lectus
5134,Feedfire,bdelahuntyks@diigo.com,+591 414 742 7819,vulputate vitae nisl aenean lectus pellentesque eget nunc donec
5667,Meevee,lmcaleesekt@wikimedia.org,+385 412 985 3170,scelerisque quam turpis adipiscing lorem vitae mattis nibh ligula nec sem duis aliquam convallis nunc proin
5569,Rhynoodle,fnansomku@newyorker.com,+62 854 762 8208,hac habitasse platea dictumst morbi vestibulum velit id pretium iaculis diam erat fermentum justo nec condimentum neque sapien
5095,Centimia,bhiggankv@dailymail.co.uk,+33 871 447 4221,quisque id justo sit amet sapien dignissim vestibulum vestibulum ante ipsum primis in
5237,Gabtune,etargetterkw@google.de,+46 539 639 4909,nibh in hac habitasse platea dictumst aliquam augue quam sollicitudin vitae
5119,Browsecat,screegankx@marriott.com,+963 879 984 7295,ligula in lacus curabitur at ipsum ac tellus semper interdum
5579,Flashpoint,hkoppenky@indiatimes.com,+223 809 735 6559,odio curabitur convallis duis consequat dui nec nisi volutpat eleifend donec ut dolor morbi vel lectus in quam fringilla rhoncus mauris enim leo rhoncus
5594,Kwideo,cmcgillivriekz@bloomberg.com,+7 109 331 9062,nulla suspendisse potenti cras in purus eu magna vulputate luctus cum sociis natoque penatibus et magnis dis parturient montes nascetur ridiculus mus vivamus vestibulum
5727,Pixonyx,bsucklingl0@reference.com,+52 404 830 6567,proin interdum mauris non ligula pellentesque ultrices phasellus id sapien in sapien iaculis congue vivamus metus arcu adipiscing molestie hendrerit
5499,Topicstorm,pgiraudotl1@pcworld.com,+374 892 132 7971,nisi eu orci mauris lacinia sapien quis libero nullam sit amet turpis elementum ligula vehicula consequat
6477,Yotz,wwhybornl2@biglobe.ne.jp,+54 326 267 8121,vestibulum proin eu mi nulla ac enim in tempor turpis nec euismod scelerisque quam
5111,JumpXS,bhammersleyl3@baidu.com,+299 533 523 6873,quam a odio in hac habitasse platea dictumst maecenas ut massa
5811,Dabfeed,igurnettl4@mysql.com,+420 281 942 1417,ut massa quis augue luctus tincidunt nulla mollis molestie lorem quisque ut erat curabitur gravida
5688,Zoomlounge,mblanchetl5@dedecms.com,+86 138 214 8268,ipsum primis in faucibus orci luctus et
5313,Gigazoom,ffilchakovl6@ca.gov,+48 841 169 1644,consectetuer adipiscing elit proin interdum mauris non ligula pellentesque ultrices phasellus id sapien in
6199,Mybuzz,sgronnol7@alexa.com,+86 132 169 8536,vitae nisl aenean lectus pellentesque eget nunc donec
6224,Voonyx,sfaircleyl8@prlog.org,+258 975 629 9379,eu tincidunt in leo maecenas pulvinar lobortis est phasellus sit amet erat nulla tempus
5238,Twitterbridge,mredbournl9@state.gov,+62 402 144 3485,vulputate luctus cum sociis natoque penatibus et magnis dis parturient montes
6423,Twitterbridge,fwartnabyla@tripod.com,+351 286 704 5370,tincidunt eu felis fusce posuere felis sed lacus morbi sem mauris laoreet ut rhoncus aliquet pulvinar sed
5863,Feedfish,mwinninglb@theguardian.com,+7 486 491 3626,vel lectus in quam fringilla rhoncus mauris enim leo rhoncus sed vestibulum sit amet
5986,Youfeed,jkilliklc@tripod.com,+81 406 118 4137,maecenas tristique est et tempus
5746,Twitternation,ehughesld@cmu.edu,+351 545 942 9519,arcu sed augue aliquam erat volutpat in congue etiam justo etiam pretium iaculis justo in
5480,Skippad,gglowachle@mediafire.com,+7 359 724 7144,nibh ligula nec sem duis aliquam convallis nunc proin at turpis a pede
6006,Kwilith,rkivlehanlf@usnews.com,+86 438 494 2138,consectetuer adipiscing elit proin risus praesent lectus
5090,Fivespan,jpratleylg@harvard.edu,+506 391 278 7178,elementum in hac habitasse platea dictumst morbi
6067,Youfeed,mpittwoodlh@accuweather.com,+7 609 556 2262,cum sociis natoque penatibus et magnis dis parturient montes
5966,Bluejam,elunamli@cafepress.com,+86 804 464 6069,nec nisi vulputate nonummy maecenas tincidunt lacus at velit vivamus vel nulla eget eros elementum pellentesque quisque porta volutpat
6383,Omba,snasilj@cisco.com,+86 689 615 6708,fermentum justo nec condimentum neque sapien placerat ante nulla justo aliquam quis turpis eget elit sodales scelerisque mauris
5997,Dynava,bmeakerlk@istockphoto.com,+62 345 774 5533,tristique est et tempus semper
5735,Divape,jwaszkiewiczll@taobao.com,+81 315 227 7590,odio condimentum id luctus nec molestie sed justo pellentesque viverra
6165,Omba,oscuffhamlm@bigcartel.com,+7 904 199 3329,elementum pellentesque quisque porta volutpat erat quisque erat eros viverra eget congue eget semper
5567,Browsezoom,ebrodeauln@accuweather.com,+92 478 600 3978,praesent blandit nam nulla integer pede justo lacinia eget tincidunt eget tempus vel pede morbi porttitor lorem id ligula suspendisse ornare consequat
6336,Fliptune,epodmorelo@msn.com,+27 143 577 3080,in est risus auctor sed tristique in tempus sit amet sem
6469,Jayo,frickerlp@sourceforge.net,+46 121 749 7517,ligula vehicula consequat morbi a ipsum integer a nibh in quis justo maecenas rhoncus aliquam lacus morbi quis tortor id nulla ultrices aliquet maecenas leo
6082,Topicshots,sheadslq@mtv.com,+370 689 582 0107,quis orci nullam molestie nibh in lectus pellentesque at nulla suspendisse
5187,Dabtype,cmailelr@angelfire.com,+504 182 289 5568,vulputate vitae nisl aenean lectus pellentesque eget nunc donec quis orci
5634,Jaxbean,stoffanellils@ibm.com,+86 749 937 5866,auctor gravida sem praesent id massa id nisl venenatis lacinia aenean sit amet justo morbi
5017,Eayo,lkleinsmuntzlt@google.it,+383 180 179 9155,in lacus curabitur at ipsum ac tellus semper interdum mauris ullamcorper
5704,Avamba,ypachecolu@businessweek.com,+86 736 354 0376,justo in hac habitasse platea dictumst etiam faucibus cursus urna ut tellus nulla ut erat id
5300,Shufflebeat,awaterlv@si.edu,+1 513 523 1738,tempus semper est quam pharetra magna ac consequat metus sapien ut nunc vestibulum ante ipsum primis in
5297,Gabtype,amcpartlinlw@washingtonpost.com,+62 699 966 2932,faucibus cursus urna ut tellus nulla ut erat id mauris
5911,Jabbertype,wmcgeffenlx@china.com.cn,+218 255 435 0437,interdum venenatis turpis enim blandit mi in porttitor pede justo eu massa donec dapibus duis at velit eu
6360,Ozu,nclowly@artisteer.com,+27 975 431 6749,nulla sed accumsan felis ut at dolor quis odio consequat varius integer ac leo pellentesque ultrices
5052,Jetpulse,alowderlz@geocities.com,+7 337 120 8327,odio cras mi pede malesuada in imperdiet et commodo vulputate justo in blandit ultrices enim lorem ipsum dolor sit amet consectetuer adipiscing
6156,Wikizz,bmaham0@state.gov,+229 214 986 3460,turpis adipiscing lorem vitae mattis nibh ligula nec sem duis aliquam convallis nunc proin at turpis a pede posuere nonummy integer non velit
6201,Dynabox,espinksm1@cisco.com,+66 100 902 0998,eget vulputate ut ultrices vel augue vestibulum ante ipsum primis in faucibus orci luctus et ultrices
5690,Gigabox,cquickendenm2@imageshack.us,+54 931 996 0215,risus praesent lectus vestibulum quam sapien varius ut blandit non interdum in ante vestibulum ante ipsum
6084,Cogibox,lpopplestonem3@house.gov,+55 799 712 2640,elit sodales scelerisque mauris sit amet eros suspendisse accumsan tortor quis turpis sed ante vivamus tortor duis mattis egestas metus aenean fermentum donec ut mauris
5668,Devify,kfrichleym4@zdnet.com,+30 413 323 2242,vestibulum sed magna at nunc commodo placerat praesent
5198,Npath,paschem5@army.mil,+86 749 262 9572,justo sollicitudin ut suscipit a feugiat et eros
6302,Lazzy,zhellwichm6@who.int,+63 320 628 9137,orci luctus et ultrices posuere cubilia curae duis faucibus accumsan
5018,Twitterbeat,kamysm7@sohu.com,+1 757 676 6282,leo maecenas pulvinar lobortis est phasellus sit amet erat
6271,Divape,sstockdalem8@ca.gov,+359 857 773 1808,non lectus aliquam sit amet diam in magna bibendum imperdiet nullam orci pede
5911,Tagfeed,wsimonittom9@amazon.de,+48 694 994 2830,suspendisse potenti nullam porttitor lacus at turpis donec posuere
5166,Zoozzy,jjurkowskima@china.com.cn,+62 584 900 9604,vestibulum vestibulum ante ipsum primis in faucibus orci luctus et ultrices posuere cubilia
5660,Fanoodle,hkegginmb@ted.com,+55 692 388 7566,lacinia eget tincidunt eget tempus vel pede morbi porttitor lorem id ligula suspendisse ornare consequat lectus in est
5641,Yakidoo,iparletmc@springer.com,+7 861 887 9440,ut nulla sed accumsan felis ut at dolor quis odio consequat
6005,Layo,cshropshiremd@china.com.cn,+33 445 774 8069,pede ac diam cras pellentesque volutpat
5291,Skyble,hpileme@princeton.edu,+81 518 520 9866,rutrum nulla tellus in sagittis dui vel nisl duis ac nibh fusce lacus purus aliquet at feugiat non pretium quis lectus suspendisse potenti in
5011,Jabbertype,gaprahamianmf@angelfire.com,+62 197 742 5892,risus semper porta volutpat quam pede lobortis ligula sit amet eleifend pede libero quis orci nullam molestie nibh in
5625,Viva,piacobomg@europa.eu,+63 797 642 0750,blandit lacinia erat vestibulum sed magna at nunc commodo placerat praesent blandit nam nulla integer pede justo lacinia eget tincidunt eget tempus vel pede
5547,Rhyloo,jnimmomh@unicef.org,+55 334 542 8288,et ultrices posuere cubilia curae donec pharetra magna vestibulum aliquet ultrices
5979,Feednation,rcrawleymi@amazon.de,+94 543 378 8700,consectetuer adipiscing elit proin interdum mauris non ligula pellentesque ultrices phasellus id sapien in sapien iaculis congue vivamus metus arcu adipiscing molestie hendrerit at vulputate
6131,Devcast,vjantelmj@cdbaby.com,+505 546 906 7094,quis turpis eget elit sodales scelerisque mauris sit amet eros suspendisse accumsan tortor quis turpis sed ante vivamus tortor duis mattis egestas metus aenean
5958,Photofeed,mjanmk@tamu.edu,+7 465 653 8148,massa id nisl venenatis lacinia aenean sit amet justo morbi ut odio cras mi pede malesuada in imperdiet et commodo vulputate justo in blandit
5553,Meevee,bberresfordml@multiply.com,+63 355 238 3195,est et tempus semper est quam pharetra magna ac consequat metus sapien ut nunc vestibulum ante ipsum primis in faucibus orci luctus et
5793,Aivee,tbartleymm@narod.ru,+51 259 311 5857,rutrum neque aenean auctor gravida sem praesent id massa id nisl venenatis lacinia aenean sit amet justo morbi ut odio cras mi pede
5491,Quinu,dcoatsmn@umn.edu,+86 114 743 0942,amet erat nulla tempus vivamus in felis eu sapien cursus vestibulum proin eu mi
5173,Babbleopia,pemmetmo@sun.com,+60 963 335 8252,in ante vestibulum ante ipsum primis in faucibus orci luctus et ultrices
5431,Browsezoom,bgeorgmp@usnews.com,+86 334 361 0353,donec pharetra magna vestibulum aliquet ultrices erat tortor sollicitudin mi sit amet lobortis sapien sapien non mi integer ac neque duis bibendum morbi non quam
5092,Youopia,cgullanemq@howstuffworks.com,+7 836 361 3649,faucibus accumsan odio curabitur convallis duis consequat dui
5242,Photolist,aboribalmr@hp.com,+98 449 663 9809,dictumst aliquam augue quam sollicitudin vitae consectetuer eget
5077,Kare,melleryms@netscape.com,+86 479 276 5353,in magna bibendum imperdiet nullam orci pede venenatis non sodales sed tincidunt eu
5182,Feedmix,beallismt@hexun.com,+81 469 297 1810,eget congue eget semper rutrum
6048,Kwimbee,jarkillmu@plala.or.jp,+7 955 260 9920,dui nec nisi volutpat eleifend donec ut dolor morbi vel lectus in quam
6248,Centidel,prodolphemv@digg.com,+34 886 264 7777,quam a odio in hac habitasse platea dictumst maecenas ut massa quis augue luctus tincidunt nulla mollis molestie lorem quisque ut erat
5956,Ailane,bosbaldestonmw@wunderground.com,+30 556 808 3953,sodales sed tincidunt eu felis fusce posuere felis sed lacus morbi sem mauris laoreet ut rhoncus aliquet pulvinar sed nisl nunc rhoncus dui
5495,Geba,rkarczinskimx@sina.com.cn,+63 365 575 4051,ac neque duis bibendum morbi non quam nec dui luctus rutrum nulla tellus in sagittis dui vel nisl duis
5677,Youtags,crolfimy@harvard.edu,+86 437 508 4821,sem sed sagittis nam congue risus semper porta volutpat quam pede lobortis ligula sit amet eleifend pede libero quis orci nullam
6445,Shufflester,tstellmanmz@biglobe.ne.jp,+86 988 469 5313,turpis sed ante vivamus tortor duis mattis egestas metus aenean fermentum
5414,Einti,cblunkettn0@time.com,+48 615 956 7501,felis sed interdum venenatis turpis enim blandit
5130,Yotz,jheinzlern1@army.mil,+63 998 585 7396,est congue elementum in hac
6137,Brainverse,rmcgeachyn2@yahoo.co.jp,+966 792 698 0889,eros suspendisse accumsan tortor quis turpis sed ante vivamus tortor duis mattis egestas metus aenean fermentum donec ut mauris eget massa tempor convallis nulla neque
5913,Zazio,smckinstryn3@ifeng.com,+86 333 576 4455,bibendum felis sed interdum venenatis turpis enim blandit mi
6244,Flashset,mgoldesn4@paginegialle.it,+420 728 882 0513,donec pharetra magna vestibulum aliquet ultrices erat tortor sollicitudin mi sit
5402,Jabberbean,elegendren5@theatlantic.com,+7 936 699 3101,lacus curabitur at ipsum ac tellus
6500,Twimm,khencken6@soup.io,+372 812 401 1750,vel augue vestibulum rutrum rutrum neque
6073,Feedfish,sworvilln7@paginegialle.it,+1 352 933 0966,porttitor lorem id ligula suspendisse ornare consequat lectus in est risus auctor sed tristique
5657,Gabspot,ycammacken8@goodreads.com,+1 734 545 9993,nulla tellus in sagittis dui vel nisl
5151,Realblab,aealdenn9@ucoz.ru,+86 586 956 8614,quis augue luctus tincidunt nulla mollis molestie lorem quisque ut erat curabitur gravida nisi at nibh in hac habitasse platea dictumst aliquam
5685,Thoughtstorm,tbaumadierna@netlog.com,+63 459 569 4244,donec ut dolor morbi vel lectus in quam fringilla rhoncus mauris enim leo rhoncus sed vestibulum sit amet cursus id turpis
6215,Rhynyx,seddlestonnb@sphinn.com,+420 629 259 8233,sed lacus morbi sem mauris laoreet ut rhoncus aliquet pulvinar sed nisl nunc rhoncus dui vel sem sed sagittis nam congue risus semper porta
6211,Yamia,ecosternc@istockphoto.com,+92 927 443 9705,adipiscing elit proin interdum mauris non ligula pellentesque ultrices phasellus id sapien in sapien iaculis congue vivamus
5946,Vitz,nloudwellnd@springer.com,+86 824 348 2761,nulla pede ullamcorper augue a suscipit
5259,Oozz,vmacquarriene@narod.ru,+51 363 283 6283,nulla tellus in sagittis dui vel nisl duis ac nibh fusce lacus purus aliquet
5749,Kwideo,mnorthallnf@google.com.br,+351 696 347 9327,quam turpis adipiscing lorem vitae mattis nibh ligula nec sem duis aliquam convallis nunc proin at turpis
5096,Gabvine,kjonkng@webeden.co.uk,+86 561 752 4265,sagittis sapien cum sociis natoque penatibus
6154,Photospace,rberfordnh@spotify.com,+370 398 721 4025,hac habitasse platea dictumst morbi vestibulum velit id pretium iaculis diam erat fermentum justo nec condimentum
5559,Jaxbean,kegintonni@wikia.com,+1 199 105 5258,in tempus sit amet sem fusce consequat nulla nisl nunc nisl duis bibendum felis sed interdum venenatis turpis
5188,Realbuzz,dkuresnj@virginia.edu,+20 782 329 1029,id nulla ultrices aliquet maecenas leo odio condimentum id luctus nec molestie sed justo pellentesque viverra pede ac diam cras pellentesque volutpat dui
6174,Edgeblab,sjozwiaknk@stumbleupon.com,+55 831 455 1033,iaculis justo in hac habitasse platea dictumst etiam faucibus cursus urna ut tellus
5329,Avamba,rbrucksteinnl@xinhuanet.com,+380 441 317 7757,magna bibendum imperdiet nullam orci pede venenatis non sodales sed tincidunt eu felis fusce posuere felis sed lacus morbi sem mauris laoreet ut rhoncus aliquet
6266,Oba,jstrikernm@booking.com,+86 132 259 2715,nulla nisl nunc nisl duis bibendum felis sed
5970,Kwimbee,esheafnn@domainmarket.com,+351 864 987 4736,metus arcu adipiscing molestie hendrerit at
5888,Centidel,tpeartno@mozilla.com,+33 603 768 1947,in lacus curabitur at ipsum ac tellus semper interdum mauris ullamcorper purus sit amet nulla quisque arcu libero rutrum ac lobortis vel dapibus at
5276,Photobug,cbrennenstuhlnp@nifty.com,+31 851 554 9529,proin leo odio porttitor id consequat in consequat ut nulla
6490,Mydeo,tpredohlnq@cbsnews.com,+7 287 938 8052,nunc proin at turpis a pede posuere nonummy integer non
5497,Aimbo,cbambroughnr@independent.co.uk,+86 848 961 8407,erat eros viverra eget congue eget semper
5117,Yombu,tportailns@webeden.co.uk,+260 175 386 2445,non mauris morbi non lectus aliquam sit amet diam in magna bibendum imperdiet
5841,Centizu,tbeadlent@exblog.jp,+48 499 587 9825,convallis nunc proin at turpis a pede posuere nonummy integer non velit donec diam neque vestibulum eget vulputate
5711,Mymm,lmellenbynu@thetimes.co.uk,+31 884 341 5870,donec quis orci eget orci vehicula
5799,Photobean,anelthroppnv@ocn.ne.jp,+63 315 594 4626,potenti cras in purus eu magna
5032,Divape,atotterdellnw@cnbc.com,+30 474 201 0999,vulputate justo in blandit ultrices enim lorem ipsum dolor sit amet consectetuer adipiscing elit proin interdum mauris non ligula pellentesque ultrices
6159,Babbleblab,acowndennx@rakuten.co.jp,+62 990 931 1168,vel est donec odio justo sollicitudin ut suscipit a feugiat et eros vestibulum ac est lacinia nisi venenatis tristique fusce congue
6023,Wordtune,cfairbraceny@virginia.edu,+86 707 843 4204,aliquam erat volutpat in congue etiam justo etiam pretium iaculis justo in hac habitasse platea dictumst etiam
6426,Mymm,sakednz@163.com,+1 202 586 2932,eget vulputate ut ultrices vel augue
6163,Snaptags,fwatkinsono0@ucsd.edu,+63 795 655 2555,magna at nunc commodo placerat praesent blandit nam nulla integer pede justo lacinia eget tincidunt eget tempus vel pede morbi porttitor lorem id ligula
6097,Riffpedia,pgageno1@yellowpages.com,+352 596 131 5198,aliquet ultrices erat tortor sollicitudin mi sit amet lobortis sapien sapien non mi integer ac neque
5258,Edgeclub,bgerreltso2@skyrock.com,+27 839 674 3554,in eleifend quam a odio in hac habitasse platea dictumst maecenas ut massa quis augue luctus tincidunt nulla mollis
6400,Dabjam,abentjeo3@tuttocitta.it,+62 888 984 5269,sodales sed tincidunt eu felis fusce posuere
5172,Tagchat,esabineo4@example.com,+47 610 725 8779,vitae consectetuer eget rutrum at lorem integer tincidunt ante vel ipsum praesent blandit lacinia erat vestibulum sed magna at nunc commodo placerat praesent blandit
6095,Voomm,rbarhimso5@craigslist.org,+972 640 933 0546,rutrum at lorem integer tincidunt ante vel ipsum praesent blandit lacinia erat vestibulum sed
5097,Lazzy,dboldto6@geocities.com,+63 875 500 4966,adipiscing lorem vitae mattis nibh ligula nec
