SupplierID,SupplierName,SupplierEmail,SupplierPhone,SupplierDescription
5770,Jaloo,trevey4u@rambler.ru,+86 832 124 6185,nisi nam ultrices libero non mattis pulvinar nulla pede ullamcorper augue a
5073,Dabshots,gkidner4v@tinyurl.com,+81 461 626 8322,pretium quis lectus suspendisse potenti in eleifend quam a odio in hac habitasse platea dictumst
5634,Avamm,rbrearton4w@thetimes.co.uk,+51 394 397 5939,mollis molestie lorem quisque ut erat
5018,Skyndu,lflippini4x@europa.eu,+86 250 799 0231,platea dictumst morbi vestibulum velit id pretium iaculis diam erat fermentum justo nec condimentum neque sapien placerat ante nulla
5837,Oodoo,kodoran4y@economist.com,+351 348 473 2212,platea dictumst morbi vestibulum velit id pretium iaculis diam erat fermentum justo nec condimentum neque sapien placerat ante nulla
5081,Fadeo,dalcorn4z@printfriendly.com,+62 709 780 6327,neque sapien placerat ante nulla justo aliquam quis turpis eget elit sodales scelerisque mauris sit amet eros suspendisse
5633,Zoomdog,arolley50@cargocollective.com,+66 192 290 4649,eget eleifend luctus ultricies eu nibh quisque id justo sit amet sapien dignissim vestibulum
5024,Tekfly,gjealous51@slate.com,+63 353 531 4280,sit amet sem fusce consequat nulla nisl nunc nisl duis bibendum felis sed interdum
5887,Leexo,hdamp52@liveinternet.ru,+1 481 886 4685,pede ullamcorper augue a suscipit nulla elit ac nulla sed vel enim sit amet nunc viverra dapibus nulla suscipit ligula in
5643,Brainbox,dfowles53@home.pl,+86 811 632 9324,id massa id nisl venenatis lacinia aenean sit amet justo morbi ut odio cras mi pede malesuada in imperdiet et
6377,Livefish,bidill54@slate.com,+86 357 975 7534,vitae quam suspendisse potenti nullam porttitor
5804,Midel,mfreebury55@rediff.com,+62 686 181 6320,proin risus praesent lectus vestibulum quam sapien varius ut blandit non interdum in ante vestibulum ante ipsum primis in
5254,DabZ,lmarrion56@ocn.ne.jp,+86 855 474 8744,nec dui luctus rutrum nulla tellus in sagittis dui vel nisl duis ac nibh fusce lacus purus aliquet
6207,Abatz,lstirley57@jimdo.com,+46 207 213 4178,vestibulum aliquet ultrices erat tortor sollicitudin mi
5279,Skimia,dbenez58@scribd.com,+51 641 587 9419,lacinia erat vestibulum sed magna at nunc commodo placerat praesent blandit nam nulla integer pede justo
5199,Vimbo,vsouthby59@foxnews.com,+63 826 866 1990,dapibus nulla suscipit ligula in lacus curabitur at ipsum ac
5859,Jetpulse,csecrett5a@yandex.ru,+380 390 659 2140,ipsum dolor sit amet consectetuer adipiscing elit proin interdum mauris non ligula pellentesque ultrices phasellus id sapien in sapien iaculis
5182,Topicware,lerett5b@oracle.com,+86 627 803 6100,lacinia nisi venenatis tristique fusce congue diam id ornare imperdiet sapien urna pretium nisl ut volutpat sapien arcu sed
5098,Rhynyx,tstaples5c@time.com,+62 685 140 6962,sit amet sapien dignissim vestibulum vestibulum
5566,Cogilith,cweatherdon5d@photobucket.com,+263 464 689 2031,imperdiet et commodo vulputate justo in blandit ultrices enim lorem ipsum
6002,InnoZ,epellman5e@hostgator.com,+86 628 822 4565,at nibh in hac habitasse platea dictumst aliquam augue quam sollicitudin vitae consectetuer eget rutrum at lorem integer tincidunt ante vel
5201,Mynte,sbutchart5f@goo.gl,+356 242 303 8641,ut odio cras mi pede malesuada in imperdiet et commodo vulputate justo
5188,Dynabox,helement5g@discuz.net,+351 496 659 0836,suspendisse potenti in eleifend quam a odio in hac habitasse platea dictumst
5282,Vinder,edibernardo5h@google.cn,+86 620 489 4431,maecenas rhoncus aliquam lacus morbi quis tortor id nulla ultrices aliquet maecenas leo odio condimentum id luctus nec
6101,Chatterpoint,wtrouel5i@cmu.edu,+7 987 642 2664,praesent blandit lacinia erat vestibulum sed magna at nunc commodo placerat praesent blandit nam nulla integer pede justo lacinia eget
5841,Katz,cdoodney5j@ibm.com,+86 505 404 3806,mauris eget massa tempor convallis nulla
5703,Yodoo,gpheby5k@google.pl,+48 752 306 5639,aenean sit amet justo morbi ut odio cras
5073,Dynazzy,scastagnier5l@tripod.com,+48 769 974 6311,maecenas rhoncus aliquam lacus morbi quis tortor
5979,Innotype,ppoltun5m@shareasale.com,+976 252 317 6666,donec diam neque vestibulum eget vulputate ut ultrices vel augue vestibulum ante ipsum
5885,Dabvine,jbenet5n@oaic.gov.au,+255 501 522 3886,ante vestibulum ante ipsum primis in faucibus orci luctus et ultrices posuere cubilia curae duis faucibus accumsan odio curabitur convallis duis
5440,DabZ,kfrayn5o@google.fr,+86 801 456 4505,aenean auctor gravida sem praesent id massa id nisl venenatis lacinia aenean sit amet justo morbi
5655,Gabvine,rkasparski5p@pcworld.com,+7 572 238 0939,hac habitasse platea dictumst aliquam augue quam sollicitudin vitae consectetuer eget rutrum at lorem integer tincidunt ante vel ipsum praesent blandit lacinia erat
6294,Shuffledrive,cbawdon5q@craigslist.org,+52 435 621 0492,eros suspendisse accumsan tortor quis turpis sed ante vivamus tortor duis mattis egestas metus aenean fermentum donec
5941,Quinu,sstening5r@usnews.com,+351 935 850 0663,sit amet sapien dignissim vestibulum vestibulum ante ipsum primis in
5536,Skivee,dchalliss5s@technorati.com,+86 112 428 0394,viverra eget congue eget semper rutrum nulla nunc
5885,Podcat,pgossart5t@engadget.com,+234 187 652 0793,non mattis pulvinar nulla pede ullamcorper augue a suscipit nulla elit ac nulla
5051,Voonte,ebamb5u@naver.com,+86 155 510 6089,scelerisque mauris sit amet eros suspendisse accumsan tortor quis turpis sed ante vivamus tortor duis mattis
5214,Lajo,cgeator5v@cisco.com,+54 991 250 9643,posuere cubilia curae duis faucibus accumsan odio curabitur convallis duis consequat dui nec nisi
5256,Mycat,mhennington5w@hc360.com,+66 284 627 4939,scelerisque mauris sit amet eros suspendisse accumsan tortor quis turpis sed ante vivamus
5721,Voonte,hwellsman5x@nsw.gov.au,+63 963 183 1751,porta volutpat erat quisque erat eros viverra eget congue eget semper
6232,Demivee,jtumbridge5y@pcworld.com,+62 930 387 2995,mi pede malesuada in imperdiet et commodo vulputate justo in blandit ultrices enim
6134,Jabberstorm,rspringford5z@free.fr,+54 789 843 2806,morbi vestibulum velit id pretium iaculis diam erat fermentum justo nec condimentum neque sapien
5594,Yabox,aoag60@intel.com,+33 748 376 7693,montes nascetur ridiculus mus vivamus vestibulum sagittis sapien cum sociis natoque penatibus
5323,Brainlounge,gloosemore61@telegraph.co.uk,+39 327 778 3312,interdum eu tincidunt in leo maecenas pulvinar lobortis est phasellus
6446,Devpoint,apashen62@google.ca,+63 807 344 8655,tellus semper interdum mauris ullamcorper purus sit amet nulla quisque arcu
5192,Quatz,mbuxsy63@is.gd,+58 179 907 5412,ligula sit amet eleifend pede libero quis
6305,Cogibox,aedgeson64@altervista.org,+62 813 254 0605,quis lectus suspendisse potenti in eleifend quam a odio in hac habitasse platea dictumst maecenas ut massa quis augue luctus tincidunt nulla mollis
5651,Yakijo,adressell65@mlb.com,+7 722 613 7514,tempor convallis nulla neque libero convallis eget eleifend luctus ultricies eu nibh quisque id justo sit amet sapien dignissim vestibulum
5381,Blogpad,gissard66@cornell.edu,+249 283 419 2288,integer pede justo lacinia eget tincidunt eget tempus vel pede morbi porttitor lorem id
5963,Youbridge,bflintiff67@walmart.com,+63 558 978 8665,vel sem sed sagittis nam congue risus semper porta volutpat quam pede lobortis
5461,Tagchat,lpiller68@theguardian.com,+55 839 370 6942,cras non velit nec nisi vulputate nonummy maecenas tincidunt lacus at velit vivamus vel nulla
5609,Yodo,vgashion69@cbc.ca,+64 370 812 1211,libero ut massa volutpat convallis morbi odio odio elementum eu interdum
5388,Realbridge,dapark6a@ocn.ne.jp,+1 314 819 6176,eros suspendisse accumsan tortor quis turpis sed ante vivamus tortor duis
5108,Voonder,agirardetti6b@dot.gov,+86 678 714 3137,lectus in est risus auctor sed tristique in tempus sit amet sem fusce consequat nulla nisl nunc
5493,Yodel,gmashal6c@discovery.com,+86 494 443 7622,etiam vel augue vestibulum rutrum rutrum neque aenean auctor gravida sem praesent id
6293,Dynabox,feltun6d@elpais.com,+81 542 153 1762,eros vestibulum ac est lacinia nisi venenatis tristique fusce congue diam id ornare imperdiet sapien urna pretium nisl ut volutpat sapien arcu sed augue aliquam
6332,Thoughtmix,lfotherby6e@pcworld.com,+1 577 480 2359,convallis eget eleifend luctus ultricies eu nibh quisque id justo sit amet sapien dignissim vestibulum vestibulum ante ipsum
5559,Skibox,lvasichev6f@e-recht24.de,+48 103 526 5555,faucibus cursus urna ut tellus nulla ut erat id mauris vulputate elementum nullam varius nulla facilisi cras non velit nec nisi
6468,Rhyzio,etuison6g@harvard.edu,+53 616 758 9458,platea dictumst aliquam augue quam sollicitudin vitae consectetuer eget rutrum at lorem integer tincidunt ante vel ipsum praesent blandit lacinia erat vestibulum sed magna
6169,Youspan,mwhyte6h@ehow.com,+226 438 221 4666,ante ipsum primis in faucibus orci luctus et ultrices posuere cubilia curae mauris
5156,Izio,igoneau6i@utexas.edu,+351 107 408 2185,mus vivamus vestibulum sagittis sapien
5899,Jaxspan,hlawland6j@ocn.ne.jp,+58 763 552 8859,donec ut dolor morbi vel lectus in quam fringilla rhoncus mauris enim leo rhoncus sed vestibulum sit amet cursus id turpis integer aliquet massa id
5340,Voomm,ieddoes6k@imdb.com,+48 356 647 3036,pretium iaculis diam erat fermentum justo nec condimentum neque sapien placerat ante nulla justo aliquam quis turpis eget elit sodales scelerisque mauris sit
5480,Devcast,gmourbey6l@xrea.com,+86 262 375 7906,cursus urna ut tellus nulla ut erat id mauris vulputate elementum nullam varius nulla facilisi
5035,Voonder,mblakeway6m@dropbox.com,+351 559 913 6558,metus aenean fermentum donec ut mauris eget massa tempor convallis nulla neque libero convallis eget eleifend luctus
5391,Thoughtsphere,rfessler6n@nasa.gov,+389 462 658 2177,sed magna at nunc commodo
6025,Skajo,dheight6o@issuu.com,+31 543 129 6650,sollicitudin ut suscipit a feugiat et eros vestibulum ac
5239,Tanoodle,jmaw6p@mozilla.org,+81 291 396 7382,feugiat non pretium quis lectus suspendisse potenti in eleifend quam a odio in hac
5615,Quatz,plarret6q@jimdo.com,+66 924 347 7854,tempor turpis nec euismod scelerisque quam turpis adipiscing lorem vitae mattis nibh ligula nec sem duis aliquam convallis nunc proin at
6021,Thoughtworks,rwilcott6r@google.fr,+86 386 289 7484,in faucibus orci luctus et ultrices posuere cubilia curae donec pharetra magna vestibulum aliquet ultrices erat tortor sollicitudin mi sit amet lobortis sapien sapien
5157,Blogpad,revans6s@netvibes.com,+374 343 379 8391,cubilia curae donec pharetra magna vestibulum aliquet ultrices erat tortor sollicitudin
6324,Twitternation,zwhitloe6t@opensource.org,+1 913 443 5077,nulla suspendisse potenti cras in purus
5442,Photospace,aanthoney6u@ebay.co.uk,+86 670 475 0766,vitae nisi nam ultrices libero non mattis pulvinar nulla
5836,Yodoo,aemmitt6v@dagondesign.com,+63 603 581 8573,scelerisque mauris sit amet eros suspendisse accumsan
6151,Gabtune,bburtwhistle6w@reuters.com,+381 515 806 7325,sollicitudin mi sit amet lobortis sapien sapien non mi integer ac
6359,Dynava,smaddin6x@mysql.com,+86 263 386 0118,quam sollicitudin vitae consectetuer eget rutrum at lorem integer tincidunt ante vel ipsum praesent blandit lacinia erat vestibulum sed magna
5236,Flashpoint,flemmens6y@ed.gov,+33 924 155 7963,vel pede morbi porttitor lorem id ligula suspendisse ornare
5029,Dynava,mhousam6z@scientificamerican.com,+57 742 432 9882,vestibulum ante ipsum primis in faucibus orci
5132,Twitterbeat,mvanne70@noaa.gov,+98 899 396 9917,pretium nisl ut volutpat sapien arcu sed
5043,Photojam,mwagge71@macromedia.com,+63 312 160 3770,mauris lacinia sapien quis libero nullam sit amet turpis elementum ligula vehicula consequat morbi a ipsum integer a nibh in quis
5415,Yakidoo,snasey72@go.com,+86 208 209 3030,mattis egestas metus aenean fermentum donec ut mauris eget massa tempor convallis nulla neque libero convallis eget eleifend luctus ultricies
5070,Zoovu,cbrearley73@nhs.uk,+55 327 592 5243,magnis dis parturient montes nascetur ridiculus mus etiam vel augue vestibulum rutrum rutrum neque aenean auctor gravida sem
5270,Roomm,telnough74@uol.com.br,+33 738 925 4289,libero ut massa volutpat convallis morbi odio odio elementum eu interdum eu tincidunt in leo maecenas pulvinar lobortis est phasellus
5622,Eadel,bbentjens75@washington.edu,+507 254 296 6493,amet erat nulla tempus vivamus in felis eu sapien cursus vestibulum proin eu mi nulla ac enim in tempor turpis nec euismod
5432,Muxo,dkomorowski76@networksolutions.com,+509 626 812 2799,lectus pellentesque at nulla suspendisse potenti cras in purus eu magna vulputate luctus
5396,Zoomlounge,ndublin77@feedburner.com,+234 265 275 2965,eget semper rutrum nulla nunc purus phasellus in felis donec semper sapien a libero nam dui proin leo odio porttitor id consequat
6279,Zoomlounge,ayeldon78@sohu.com,+7 630 321 0776,sollicitudin mi sit amet lobortis sapien sapien non mi integer ac neque duis bibendum morbi non quam nec dui luctus rutrum
5413,Flashdog,nsproat79@deliciousdays.com,+375 229 134 7880,duis ac nibh fusce lacus purus aliquet at feugiat non pretium quis lectus suspendisse potenti in eleifend quam a odio
5550,Gigashots,bcathrall7a@smh.com.au,+54 854 957 0266,amet cursus id turpis integer aliquet massa id lobortis convallis tortor risus dapibus augue vel accumsan tellus nisi eu orci mauris lacinia sapien quis libero
5911,Oyondu,edmitrichenko7b@independent.co.uk,+46 766 188 8581,sem duis aliquam convallis nunc proin at turpis a pede posuere nonummy
5795,Skipfire,gcrummy7c@wired.com,+7 307 761 5338,diam id ornare imperdiet sapien
5100,Divape,mrosie7d@biglobe.ne.jp,+374 957 618 8512,at dolor quis odio consequat varius integer
5436,Realpoint,pfrohock7e@drupal.org,+7 154 546 7259,luctus ultricies eu nibh quisque id justo sit amet sapien dignissim vestibulum vestibulum ante ipsum primis in faucibus orci
5572,Eidel,mjost7f@lycos.com,+86 774 437 4831,lobortis convallis tortor risus dapibus augue vel accumsan tellus nisi eu orci mauris lacinia sapien quis libero nullam sit amet turpis elementum ligula vehicula
5610,Rhycero,dbyles7g@addtoany.com,+86 512 299 0670,volutpat erat quisque erat eros viverra eget congue eget semper rutrum nulla nunc purus phasellus in felis donec semper sapien
6225,Skimia,kridgers7h@example.com,+86 997 705 4870,ultrices enim lorem ipsum dolor sit amet
6317,Oozz,cwombwell7i@scribd.com,+62 676 796 2949,nulla tempus vivamus in felis eu sapien
6351,Livepath,epiken7j@blogs.com,+93 588 459 8729,cum sociis natoque penatibus et magnis dis parturient montes nascetur ridiculus mus vivamus vestibulum sagittis sapien cum sociis natoque penatibus et magnis dis parturient montes
5590,Wordpedia,kdavidoff7k@macromedia.com,+63 847 242 2814,sem mauris laoreet ut rhoncus aliquet pulvinar sed nisl nunc rhoncus dui vel sem sed sagittis nam congue risus semper porta
5366,Tanoodle,kmackibbon7l@geocities.com,+57 864 375 9487,ipsum primis in faucibus orci luctus et ultrices
5684,Zoozzy,lmcleoid7m@webeden.co.uk,+52 882 533 8263,vestibulum ante ipsum primis in faucibus orci luctus et ultrices posuere cubilia curae donec pharetra magna vestibulum aliquet ultrices erat tortor
6376,Flashset,ebunney7n@soup.io,+7 633 595 6611,justo nec condimentum neque sapien placerat ante nulla justo aliquam quis turpis eget elit sodales scelerisque
6056,Wikivu,bmander7o@smugmug.com,+255 878 627 0316,amet sem fusce consequat nulla nisl nunc nisl duis bibendum felis sed interdum venenatis turpis enim blandit mi in porttitor pede
5788,Tavu,ageorg7p@wikia.com,+380 457 872 4542,nunc rhoncus dui vel sem sed sagittis nam congue risus semper porta volutpat quam pede lobortis ligula sit amet
5670,Bluezoom,ahartnup7q@jalbum.net,+51 259 764 7750,a feugiat et eros vestibulum ac est lacinia nisi
5997,Zoombox,awollaston7r@51.la,+33 775 237 7883,potenti in eleifend quam a odio in hac habitasse platea dictumst maecenas ut massa quis augue luctus
5272,Roombo,dsevery7s@booking.com,+267 983 692 5699,at velit eu est congue elementum in hac habitasse
5360,Tagtune,mmurdoch7t@irs.gov,+967 250 790 5322,lectus pellentesque at nulla suspendisse potenti cras in purus eu magna vulputate luctus cum sociis natoque penatibus et magnis dis parturient
5396,Tazzy,vquant7u@webnode.com,+420 721 176 8029,quis libero nullam sit amet turpis elementum ligula vehicula consequat morbi a ipsum integer a nibh in quis justo maecenas rhoncus aliquam lacus
6425,Gigazoom,moutram7v@geocities.jp,+86 429 598 8871,lacus morbi sem mauris laoreet ut rhoncus aliquet pulvinar sed nisl nunc rhoncus dui vel sem sed
6290,Podcat,dluty7w@goo.ne.jp,+351 939 353 5750,libero quis orci nullam molestie nibh in lectus pellentesque at nulla suspendisse potenti cras in purus eu magna vulputate luctus cum sociis
5599,Fadeo,acaccavale7x@comsenz.com,+212 534 952 5468,nisi volutpat eleifend donec ut dolor morbi vel lectus in quam fringilla rhoncus mauris enim leo rhoncus sed vestibulum sit
5606,Realblab,aquant7y@xing.com,+351 613 343 4719,diam neque vestibulum eget vulputate ut ultrices vel augue vestibulum ante ipsum primis in faucibus orci luctus et ultrices posuere cubilia curae
5219,Yodoo,fpeakman7z@bing.com,+62 688 462 6277,tincidunt lacus at velit vivamus vel nulla eget eros elementum pellentesque quisque porta volutpat erat quisque erat eros viverra eget
5155,Trupe,psnaden80@senate.gov,+66 134 367 7591,maecenas pulvinar lobortis est phasellus sit amet erat nulla tempus vivamus in felis eu sapien cursus vestibulum proin eu mi nulla ac enim in
6138,Oyoloo,rgonet81@myspace.com,+255 385 711 3547,parturient montes nascetur ridiculus mus etiam vel augue vestibulum rutrum rutrum neque aenean auctor gravida sem praesent id massa id nisl venenatis lacinia
6484,Topiclounge,awhitwood82@hhs.gov,+57 748 605 7414,non mi integer ac neque duis bibendum morbi non quam nec dui luctus rutrum nulla tellus in sagittis
5259,Oyoloo,ecodner83@nature.com,+63 799 937 1170,dui vel sem sed sagittis nam congue risus semper porta volutpat quam pede lobortis ligula sit amet eleifend pede libero quis orci
6161,Photobug,mlycett84@blinklist.com,+95 283 191 6358,convallis nunc proin at turpis a pede posuere
6436,Rhycero,vgove85@creativecommons.org,+7 122 498 7385,sed nisl nunc rhoncus dui vel sem sed sagittis nam congue risus semper porta volutpat quam pede lobortis ligula sit amet eleifend
6417,Livetube,sloxley86@ow.ly,+55 278 250 8532,vestibulum ac est lacinia nisi venenatis tristique fusce congue diam id ornare imperdiet sapien
5964,Yakitri,ebachellier87@tamu.edu,+371 287 755 6544,accumsan odio curabitur convallis duis consequat dui nec nisi volutpat eleifend donec ut dolor morbi vel lectus in quam fringilla rhoncus
6221,Dabfeed,prichens88@webs.com,+86 622 380 4596,lorem vitae mattis nibh ligula
5216,Aivee,eturland89@skyrock.com,+1 615 742 6698,vulputate ut ultrices vel augue vestibulum ante ipsum
6223,Thoughtmix,iapark8a@wiley.com,+220 525 463 2674,enim leo rhoncus sed vestibulum
5519,DabZ,narndell8b@earthlink.net,+62 467 918 9830,tempor turpis nec euismod scelerisque quam turpis adipiscing lorem vitae mattis nibh ligula nec sem duis aliquam
5332,Bluezoom,vclother8c@pen.io,+46 461 328 9233,vulputate nonummy maecenas tincidunt lacus at velit vivamus vel nulla eget eros elementum pellentesque quisque porta volutpat erat quisque erat
6162,Vipe,tglaves8d@reverbnation.com,+234 840 317 6782,odio condimentum id luctus nec molestie sed justo pellentesque viverra pede ac diam cras pellentesque volutpat dui maecenas tristique est et tempus
5548,Ainyx,ltimmens8e@bing.com,+86 707 498 1343,mauris sit amet eros suspendisse accumsan tortor quis turpis sed ante vivamus tortor duis mattis egestas metus aenean fermentum
5720,Geba,mohara8f@wiley.com,+86 737 751 9370,velit id pretium iaculis diam
5860,Thoughtbeat,jumpleby8g@blinklist.com,+1 805 791 0246,quam pede lobortis ligula sit amet eleifend pede libero quis orci nullam molestie nibh in
5882,Jazzy,lorange8h@geocities.com,+1 425 691 0980,est phasellus sit amet erat nulla tempus vivamus in felis eu sapien cursus vestibulum proin eu mi nulla ac enim in tempor turpis nec euismod
6424,Photofeed,tcastro8i@quantcast.com,+93 313 630 9681,dapibus duis at velit eu est congue elementum in hac habitasse
5762,Teklist,bbellson8j@cmu.edu,+62 470 589 1488,vestibulum rutrum rutrum neque aenean auctor gravida sem praesent id massa id nisl venenatis lacinia aenean sit
6152,Browsetype,esotham8k@blogspot.com,+994 200 164 0444,diam cras pellentesque volutpat dui maecenas tristique est et tempus semper est
6016,Livetube,ejuett8l@harvard.edu,+54 467 719 6760,fermentum donec ut mauris eget massa tempor convallis nulla neque libero convallis eget eleifend luctus
5060,Realblab,mdas8m@loc.gov,+62 930 783 2344,aliquet at feugiat non pretium quis lectus suspendisse potenti in eleifend quam a odio in hac habitasse platea dictumst maecenas ut massa
5381,Thoughtbeat,ggimenez8n@berkeley.edu,+351 343 567 6498,nec nisi vulputate nonummy maecenas tincidunt lacus at velit vivamus
6350,JumpXS,cdabrowski8o@furl.net,+385 799 857 6994,at nulla suspendisse potenti cras in purus eu magna vulputate luctus cum sociis
5650,Camimbo,shelmke8p@jiathis.com,+86 639 873 0656,etiam pretium iaculis justo in hac habitasse platea dictumst etiam
6257,Rhynyx,bkendred8q@ifeng.com,+963 473 232 2170,vestibulum ante ipsum primis in faucibus orci luctus et ultrices posuere cubilia curae nulla dapibus dolor vel est donec odio justo
5831,Eimbee,lbogace8r@springer.com,+86 111 326 1085,pede venenatis non sodales sed tincidunt eu felis fusce posuere felis sed lacus morbi
5056,Twitterlist,mstephens8s@wikipedia.org,+86 349 422 3629,convallis morbi odio odio elementum eu interdum eu tincidunt in leo maecenas pulvinar lobortis est phasellus sit amet erat nulla tempus
5583,Midel,wguiraud8t@qq.com,+353 528 866 8097,purus aliquet at feugiat non pretium quis lectus suspendisse potenti in eleifend
6284,Abatz,gwadworth8u@sina.com.cn,+86 659 980 3538,nulla suspendisse potenti cras in purus eu magna vulputate luctus cum sociis natoque penatibus
5806,Jaloo,freeson8v@icio.us,+92 220 461 6220,ipsum primis in faucibus orci luctus et ultrices posuere cubilia curae
6429,Yozio,nstening8w@goo.gl,+57 316 715 8686,adipiscing elit proin risus praesent lectus vestibulum quam sapien varius ut blandit non interdum in ante vestibulum ante ipsum
5857,Quamba,amattys8x@microsoft.com,+86 305 839 5803,justo eu massa donec dapibus duis at velit eu est congue elementum in hac
6399,Brainsphere,elegat8y@blogspot.com,+970 150 137 4350,in felis eu sapien cursus vestibulum proin eu mi nulla ac enim in tempor turpis nec euismod scelerisque quam
6322,Leexo,eharradine8z@usatoday.com,+62 993 699 9062,montes nascetur ridiculus mus etiam vel augue vestibulum rutrum rutrum neque aenean auctor gravida sem praesent id
5676,Zooxo,bgynne90@sitemeter.com,+86 771 231 9922,vulputate vitae nisl aenean lectus pellentesque eget nunc donec quis orci eget orci vehicula condimentum curabitur in libero ut massa volutpat convallis morbi odio
6288,Feedbug,dfeighry91@google.ca,+33 539 313 4752,mollis molestie lorem quisque ut erat curabitur gravida nisi at nibh in hac habitasse platea dictumst aliquam augue quam sollicitudin vitae consectetuer eget
5256,Wordtune,pbrookbank92@comcast.net,+351 758 192 3366,phasellus sit amet erat nulla tempus vivamus in felis eu sapien cursus vestibulum proin
5001,Tagcat,dsitlington93@geocities.jp,+970 782 952 8943,etiam faucibus cursus urna ut tellus nulla ut erat id mauris vulputate elementum nullam varius nulla
5173,Twitterbeat,klynn94@patch.com,+81 196 517 3280,erat curabitur gravida nisi at nibh in hac habitasse platea dictumst aliquam augue quam sollicitudin vitae consectetuer eget rutrum at lorem
6154,Skyba,nblindermann95@accuweather.com,+33 450 353 8776,habitasse platea dictumst etiam faucibus cursus urna ut tellus nulla ut erat
6284,Photobug,kmattaser96@freewebs.com,+62 996 385 4479,egestas metus aenean fermentum donec ut mauris eget massa tempor convallis nulla neque libero convallis eget eleifend luctus ultricies eu nibh
6018,Zoombox,sfaust97@networkadvertising.org,+63 539 553 7875,curabitur gravida nisi at nibh in hac habitasse platea dictumst aliquam augue quam sollicitudin
5069,Twinder,lwolstenholme98@cbslocal.com,+86 195 943 9012,tristique est et tempus semper est quam pharetra magna ac consequat metus sapien ut nunc vestibulum
5054,Oyoyo,edymick99@latimes.com,+86 300 219 9283,vitae consectetuer eget rutrum at lorem integer tincidunt
5067,Skyvu,xsimoneschi9a@ow.ly,+380 867 497 8412,potenti nullam porttitor lacus at turpis donec posuere
5128,Oyoyo,cgonzalez9b@ask.com,+86 525 892 1586,rutrum at lorem integer tincidunt ante vel ipsum praesent blandit lacinia erat vestibulum sed
5673,Gabspot,tyezafovich9c@fema.gov,+351 754 844 2820,vel nulla eget eros elementum pellentesque quisque porta volutpat erat quisque erat eros viverra eget congue eget semper rutrum nulla nunc purus
6378,Mynte,dprydden9d@omniture.com,+63 568 369 2305,justo nec condimentum neque sapien
5351,Topicblab,mdickinson9e@phpbb.com,+1 571 372 4418,non mauris morbi non lectus aliquam sit amet diam in magna bibendum imperdiet nullam orci pede venenatis non sodales sed tincidunt eu felis
6093,Eazzy,mbuye9f@scribd.com,+216 946 612 0810,sapien arcu sed augue aliquam erat volutpat in congue etiam justo etiam pretium iaculis justo in hac habitasse platea dictumst etiam faucibus cursus urna
5814,Eare,bcrudginton9g@sbwire.com,+7 638 911 6299,sagittis dui vel nisl duis ac nibh fusce lacus purus aliquet at feugiat non pretium quis lectus suspendisse potenti in eleifend quam a
5315,Innotype,vsuthren9h@pen.io,+7 787 156 0022,donec posuere metus vitae ipsum aliquam non mauris morbi non lectus aliquam sit
5974,Wikido,tackers9i@army.mil,+7 793 836 0671,imperdiet et commodo vulputate justo
5305,Yacero,akindleysides9j@constantcontact.com,+260 941 506 3831,sagittis nam congue risus semper porta volutpat quam pede lobortis ligula sit amet eleifend pede libero quis orci nullam molestie
