SupplierID,SupplierName,SupplierEmail,SupplierPhone,SupplierDescription
6342,Ntag,gbrazel9h@boston.com,+86 204 394 5901,vel ipsum praesent blandit lacinia erat vestibulum sed magna at nunc commodo placerat praesent blandit nam nulla integer pede
6343,Muxo,mgarnson9i@ehow.com,+55 242 920 5784,primis in faucibus orci luctus et ultrices posuere cubilia curae mauris viverra diam vitae quam suspendisse potenti nullam porttitor
6344,Topicstorm,smcgaugie9j@studiopress.com,+55 765 160 6646,ligula vehicula consequat morbi a ipsum integer a nibh in quis justo maecenas rhoncus aliquam lacus morbi quis tortor id nulla ultrices aliquet maecenas leo
6345,Voonder,smellings9k@tinypic.com,+234 650 375 9022,cursus vestibulum proin eu mi nulla ac enim in tempor turpis nec
6346,Feedfire,rhuggons9l@fastcompany.com,+66 900 778 5354,rhoncus aliquam lacus morbi quis tortor id nulla ultrices aliquet maecenas leo odio condimentum id luctus nec molestie sed justo
6347,Shuffletag,kransbury9m@storify.com,+7 821 445 6178,porttitor lorem id ligula suspendisse ornare consequat lectus in est
6348,Fivespan,nkerrey9n@arizona.edu,+44 158 244 0814,ac tellus semper interdum mauris ullamcorper purus sit amet nulla quisque
6349,Bluejam,qmaruszewski9o@google.com,+48 965 430 3210,odio porttitor id consequat in consequat ut nulla sed accumsan felis ut at dolor quis odio consequat varius integer ac leo pellentesque
6350,Eadel,wmacandrew9p@flavors.me,+86 128 686 2607,dui luctus rutrum nulla tellus in sagittis dui vel nisl duis ac nibh fusce lacus purus aliquet at
6351,Realcube,emcivor9q@jigsy.com,+63 265 711 8991,orci luctus et ultrices posuere cubilia curae duis faucibus accumsan odio curabitur convallis duis consequat dui
6352,Kazio,dsteddall9r@virginia.edu,+60 110 361 6093,sollicitudin ut suscipit a feugiat et eros vestibulum ac est lacinia nisi venenatis tristique fusce congue diam
6353,Vipe,wliccardi9s@answers.com,+1 919 532 0237,nulla sed accumsan felis ut at dolor quis odio consequat varius integer ac leo pellentesque ultrices mattis odio donec vitae nisi nam
6354,Fliptune,rcappell9t@deviantart.com,+55 604 893 0375,id justo sit amet sapien dignissim vestibulum vestibulum ante ipsum primis in faucibus orci luctus et ultrices posuere cubilia curae nulla dapibus dolor
6355,Skimia,vwoodard9u@biblegateway.com,+976 261 532 4229,pulvinar sed nisl nunc rhoncus dui vel sem sed sagittis nam congue risus semper
6356,Jabberstorm,gruggiero9v@free.fr,+45 834 913 3221,nulla nisl nunc nisl duis bibendum felis sed interdum venenatis turpis enim blandit mi in porttitor pede
6357,Youfeed,kwhitwam9w@mysql.com,+86 454 472 9513,praesent blandit lacinia erat vestibulum sed
6358,Innotype,lsonnenschein9x@wordpress.com,+48 796 940 6396,nulla quisque arcu libero rutrum ac lobortis vel
6359,Meemm,ahodjetts9y@opera.com,+62 859 648 2476,egestas metus aenean fermentum donec ut mauris eget massa tempor convallis nulla neque libero convallis eget eleifend luctus ultricies eu nibh
6360,Zoombox,ctomek9z@wordpress.org,+33 446 607 9483,augue quam sollicitudin vitae consectetuer eget rutrum at
6361,Browsetype,dremmersa0@ebay.co.uk,+63 352 693 4016,velit donec diam neque vestibulum eget vulputate ut
6362,Skalith,ccrewsa1@altervista.org,+48 516 765 0249,ante vestibulum ante ipsum primis in faucibus orci luctus et
6363,Flashset,adolbya2@nifty.com,+380 269 662 2524,blandit nam nulla integer pede
6364,Zooveo,vmariellea3@npr.org,+86 645 539 6084,eu mi nulla ac enim in tempor turpis nec euismod scelerisque quam turpis adipiscing lorem vitae mattis nibh ligula nec sem
6365,Thoughtsphere,pedensa4@so-net.ne.jp,+502 846 558 8495,ut massa volutpat convallis morbi odio odio elementum eu interdum eu tincidunt in leo
6366,Bluejam,hpatershalla5@bbc.co.uk,+967 118 920 3652,lorem quisque ut erat curabitur gravida nisi at nibh in hac habitasse platea dictumst aliquam augue quam
6367,Buzzster,tdalgarnoa6@intel.com,+86 710 790 8651,volutpat convallis morbi odio odio elementum eu interdum eu tincidunt in leo maecenas pulvinar lobortis est phasellus sit amet erat nulla tempus vivamus in felis
6368,Browsezoom,shewella7@admin.ch,+593 549 981 2928,pretium quis lectus suspendisse potenti in eleifend quam a odio in hac habitasse platea dictumst maecenas ut massa quis augue luctus tincidunt
6369,Thoughtmix,ldellcasaa8@reddit.com,+51 757 971 1707,nibh quisque id justo sit amet sapien dignissim
6370,Zoonoodle,gbyfforda9@simplemachines.org,+86 542 686 8657,libero quis orci nullam molestie nibh in lectus pellentesque at nulla suspendisse potenti cras in purus eu
6371,Browseblab,myashinaa@devhub.com,+1 443 172 2127,mollis molestie lorem quisque ut erat curabitur gravida nisi at nibh in hac habitasse platea
6372,Skiba,sbonusab@pbs.org,+51 768 609 8471,cras non velit nec nisi vulputate nonummy maecenas tincidunt lacus at velit vivamus vel nulla eget eros elementum
6373,Jayo,henticknapac@ibm.com,+86 310 465 8058,consequat morbi a ipsum integer a nibh in quis justo maecenas rhoncus aliquam lacus morbi quis tortor id nulla ultrices
6374,Edgetag,bcopinad@oaic.gov.au,+30 196 456 4869,tincidunt ante vel ipsum praesent blandit lacinia erat vestibulum sed magna at nunc commodo placerat praesent blandit nam nulla integer pede justo lacinia eget
6375,Browsezoom,wspareyae@nytimes.com,+224 338 364 8490,pede justo eu massa donec dapibus duis at velit eu est congue
6376,Babblestorm,fnolliaf@time.com,+86 365 913 5237,lacus at velit vivamus vel nulla eget eros elementum
6377,Oyondu,bcanapeag@yelp.com,+1 504 625 5144,non sodales sed tincidunt eu felis fusce posuere felis sed lacus morbi sem mauris laoreet ut rhoncus aliquet pulvinar sed
6378,Trilith,jearpah@sourceforge.net,+234 161 551 3600,curabitur at ipsum ac tellus semper interdum
6379,Oyoba,bstakerai@wiley.com,+62 272 223 8805,ridiculus mus vivamus vestibulum sagittis sapien cum sociis natoque penatibus et magnis dis parturient montes
6380,Skinte,ftenbrugaj@sphinn.com,+591 419 540 3563,mattis odio donec vitae nisi nam ultrices libero non mattis pulvinar
6381,Lazz,fstoddak@google.it,+62 168 482 0584,congue diam id ornare imperdiet sapien urna pretium nisl ut volutpat sapien arcu
6382,Buzzbean,adawtryal@ucoz.com,+963 147 699 8409,in felis eu sapien cursus vestibulum proin eu mi nulla ac enim in tempor turpis nec euismod
6383,Babbleset,cpopovam@twitpic.com,+220 805 445 6102,consectetuer adipiscing elit proin risus praesent lectus vestibulum quam sapien varius ut blandit non interdum in ante vestibulum ante ipsum primis in faucibus orci
6384,Browseblab,alatesan@goodreads.com,+66 203 378 5746,duis faucibus accumsan odio curabitur convallis duis consequat
6385,Mydeo,awainao@alibaba.com,+62 614 662 0534,integer pede justo lacinia eget tincidunt eget tempus
6386,Mita,rsimakap@deliciousdays.com,+358 447 430 6493,amet erat nulla tempus vivamus in felis eu sapien cursus vestibulum proin
6387,Babbleopia,sfloyedaq@squarespace.com,+380 781 709 0862,interdum eu tincidunt in leo maecenas pulvinar lobortis est
6388,Riffpath,nscimonelliar@usda.gov,+358 789 479 4664,interdum eu tincidunt in leo maecenas pulvinar lobortis est phasellus sit
6389,Quaxo,pelpheeas@state.gov,+358 917 502 3642,est phasellus sit amet erat nulla tempus vivamus in felis eu sapien cursus vestibulum proin eu mi nulla ac enim in tempor turpis nec euismod
6390,Brainverse,lkivitsat@chronoengine.com,+86 332 312 5040,ante vel ipsum praesent blandit lacinia
6391,Livetube,tphilcoxau@skype.com,+86 326 867 9166,elit sodales scelerisque mauris sit amet eros suspendisse accumsan tortor quis turpis sed ante vivamus tortor duis mattis egestas metus aenean fermentum
6392,Brightbean,dburnappav@ehow.com,+1 747 820 8114,risus dapibus augue vel accumsan tellus nisi eu orci mauris lacinia
6393,Jayo,rsalvinaw@si.edu,+62 844 312 6568,id massa id nisl venenatis lacinia aenean sit amet justo morbi ut odio cras mi pede malesuada
6394,Fatz,vcowinax@prweb.com,+62 966 100 5478,ligula nec sem duis aliquam convallis nunc proin at turpis a pede posuere nonummy integer non velit donec diam neque vestibulum eget vulputate ut
6395,Pixoboo,jologanay@discovery.com,+58 580 513 4061,nascetur ridiculus mus vivamus vestibulum sagittis sapien cum sociis natoque penatibus
6396,Voolith,cpeggramaz@pagesperso-orange.fr,+675 641 252 0173,luctus et ultrices posuere cubilia curae donec pharetra magna vestibulum aliquet ultrices erat tortor sollicitudin mi sit amet
6397,Buzzshare,cmoyesb0@geocities.com,+370 696 162 1615,ut rhoncus aliquet pulvinar sed nisl nunc rhoncus dui vel sem sed sagittis nam
6398,Meejo,mbiagionib1@histats.com,+60 947 335 5463,sapien non mi integer ac neque duis bibendum morbi non quam
6399,Rhycero,oloveittb2@ovh.net,+86 685 256 4637,lectus pellentesque at nulla suspendisse potenti
6400,Roodel,bgriffithsb3@cisco.com,+86 665 468 7581,vulputate justo in blandit ultrices enim lorem ipsum dolor sit amet consectetuer adipiscing elit proin interdum mauris non ligula pellentesque
6401,Voolith,njackalinb4@bandcamp.com,+66 279 657 3425,suspendisse accumsan tortor quis turpis sed ante vivamus tortor duis mattis egestas
6402,Skipstorm,jitscovitzb5@over-blog.com,+86 628 510 1082,non mauris morbi non lectus aliquam sit amet diam in
6403,Zoomcast,amorrowb6@pen.io,+46 649 240 3779,odio porttitor id consequat in consequat ut nulla sed accumsan felis ut at dolor quis odio consequat varius integer ac leo pellentesque ultrices
6404,Avamm,sclucasb7@comcast.net,+351 142 453 5615,luctus et ultrices posuere cubilia curae nulla dapibus dolor vel est donec odio justo sollicitudin ut suscipit a feugiat
6405,Jabbersphere,awarykb8@desdev.cn,+45 786 712 0984,magna ac consequat metus sapien ut nunc vestibulum ante ipsum primis in faucibus orci luctus et ultrices posuere cubilia curae mauris viverra diam vitae
6406,Snaptags,epeileb9@cargocollective.com,+81 661 561 5927,enim in tempor turpis nec euismod scelerisque quam turpis adipiscing lorem vitae
6407,Linkbuzz,wiskowiczba@ovh.net,+92 327 364 4624,malesuada in imperdiet et commodo vulputate justo in blandit ultrices enim lorem ipsum dolor sit amet consectetuer adipiscing elit proin
6408,Feedfish,cswannellbb@economist.com,+7 797 586 2120,nisl ut volutpat sapien arcu sed augue aliquam erat volutpat in congue etiam justo etiam pretium iaculis justo
6409,Omba,ppretoriusbc@naver.com,+86 147 653 3865,justo eu massa donec dapibus duis at velit eu est congue elementum
6410,Yombu,tpoelbd@washingtonpost.com,+86 279 994 8287,phasellus id sapien in sapien iaculis congue vivamus metus arcu adipiscing molestie hendrerit at vulputate vitae nisl aenean
6411,Skinder,estanggjertsenbe@oakley.com,+351 835 510 3377,congue elementum in hac habitasse platea
6412,Kwinu,mdrabblebf@engadget.com,+1 714 577 8878,in felis eu sapien cursus vestibulum proin eu mi nulla ac enim in tempor turpis nec euismod scelerisque quam turpis adipiscing
6413,Shuffletag,dabrahamsohnbg@mediafire.com,+60 306 672 3306,porttitor id consequat in consequat ut nulla sed accumsan felis
6414,Realbridge,ganandbh@google.it,+380 709 717 8829,mauris lacinia sapien quis libero nullam sit amet turpis
6415,Feednation,vnunnbi@stanford.edu,+351 446 584 0719,montes nascetur ridiculus mus etiam vel augue vestibulum rutrum rutrum neque aenean auctor gravida sem praesent id massa id nisl venenatis lacinia aenean
6416,Brightdog,mskeatsbj@ft.com,+66 216 813 5010,adipiscing lorem vitae mattis nibh ligula nec sem duis
6417,Voonyx,mvitterybk@cocolog-nifty.com,+30 643 400 5947,in quam fringilla rhoncus mauris enim leo rhoncus sed vestibulum sit amet cursus id turpis integer aliquet massa id
6418,Brainbox,jtimmermannbl@wikia.com,+86 782 103 4455,cras in purus eu magna vulputate luctus cum sociis natoque penatibus et magnis dis parturient montes nascetur ridiculus mus vivamus vestibulum sagittis sapien
6419,Topicstorm,cculleybm@usatoday.com,+46 632 301 5404,imperdiet nullam orci pede venenatis non sodales sed tincidunt eu felis fusce posuere felis sed lacus morbi sem mauris laoreet ut rhoncus aliquet
6420,Rhynoodle,chatrybn@ebay.com,+86 658 662 2336,scelerisque quam turpis adipiscing lorem vitae mattis nibh ligula nec sem duis aliquam convallis nunc proin at turpis a
6421,Flipopia,bsiddonbo@elegantthemes.com,+7 708 594 9470,pretium quis lectus suspendisse potenti in eleifend quam a odio in hac
6422,Minyx,bfazakerleybp@yahoo.co.jp,+54 333 307 4607,sit amet eleifend pede libero quis orci
6423,Abata,bgerritzenbq@jalbum.net,+52 593 308 2951,velit nec nisi vulputate nonummy maecenas tincidunt lacus at velit vivamus vel nulla eget eros elementum
6424,Jaxspan,aburchfieldbr@vk.com,+380 344 663 9054,ultrices enim lorem ipsum dolor sit amet consectetuer adipiscing elit proin interdum mauris non ligula pellentesque ultrices phasellus id sapien in sapien iaculis congue
6425,Blogtag,oaichesonbs@ibm.com,+1 493 362 4154,proin leo odio porttitor id consequat in consequat ut nulla sed accumsan felis ut at dolor quis odio consequat varius integer ac
6426,Oba,brisbybt@google.co.uk,+93 319 903 7488,elit proin interdum mauris non
6427,Yoveo,ghadgkissbu@businessweek.com,+52 426 665 9258,a suscipit nulla elit ac nulla sed vel enim sit amet nunc
6428,Quire,bcammishbv@1und1.de,+86 486 525 9108,odio donec vitae nisi nam ultrices libero non mattis pulvinar nulla pede ullamcorper augue
6429,Dabshots,csouthworthbw@imgur.com,+55 615 893 4363,et ultrices posuere cubilia curae donec pharetra magna vestibulum aliquet ultrices erat tortor sollicitudin mi sit amet lobortis sapien sapien non
6430,Yodel,wlightningbx@51.la,+46 441 350 8182,quisque arcu libero rutrum ac lobortis vel dapibus at diam nam tristique tortor
6431,Kwilith,jrudsdaleby@fotki.com,+86 737 214 6034,accumsan odio curabitur convallis duis consequat dui nec nisi volutpat eleifend donec ut dolor morbi vel lectus in quam fringilla rhoncus mauris enim leo rhoncus
6432,Blogtag,pfilimorebz@sourceforge.net,+86 400 430 9393,augue vestibulum ante ipsum primis in faucibus orci luctus et ultrices posuere cubilia curae donec pharetra magna vestibulum
6433,Riffpath,mdietzc0@china.com.cn,+86 560 766 1605,maecenas rhoncus aliquam lacus morbi quis tortor id nulla ultrices aliquet maecenas leo
6434,Twitternation,jkickc1@cbsnews.com,+30 525 102 8740,amet eros suspendisse accumsan tortor quis turpis sed ante vivamus tortor duis mattis egestas metus aenean fermentum donec
6435,Twitterlist,smcianc2@devhub.com,+993 997 197 9931,lectus pellentesque eget nunc donec quis orci eget orci
6436,Twitterbridge,ckalderonc3@jalbum.net,+55 807 442 4299,ante vel ipsum praesent blandit lacinia erat vestibulum sed magna at nunc commodo placerat praesent blandit nam nulla integer
6437,Feedfish,lampsc4@tuttocitta.it,+86 465 449 8501,accumsan felis ut at dolor quis odio consequat varius integer ac leo pellentesque ultrices mattis odio donec
6438,Livetube,elowmanc5@dedecms.com,+7 128 391 4867,nunc proin at turpis a pede posuere nonummy integer non velit donec diam neque vestibulum eget vulputate ut ultrices
6439,Gabvine,drennerc6@shareasale.com,+380 204 567 2480,sit amet consectetuer adipiscing elit
6440,Realbuzz,rnealeyc7@constantcontact.com,+269 448 399 6496,sed sagittis nam congue risus semper porta volutpat quam
6441,Roodel,bcorballyc8@ox.ac.uk,+86 721 388 1571,ultrices erat tortor sollicitudin mi sit amet lobortis sapien
6442,Riffpedia,aeynonc9@posterous.com,+230 521 794 0184,diam in magna bibendum imperdiet nullam orci pede venenatis non sodales
6443,Rhycero,sholtonca@miitbeian.gov.cn,+81 740 526 8107,lacinia eget tincidunt eget tempus vel pede morbi porttitor lorem id ligula suspendisse ornare consequat
6444,Izio,ashepcuttcb@csmonitor.com,+504 920 755 8331,odio porttitor id consequat in consequat ut nulla sed accumsan felis ut at dolor quis odio consequat
6445,Quinu,imatousekcc@msn.com,+420 447 235 0622,turpis eget elit sodales scelerisque mauris sit amet eros suspendisse accumsan tortor quis turpis sed
6446,Jaxspan,gcurnokkcd@apple.com,+381 167 862 7739,est phasellus sit amet erat nulla tempus vivamus in felis eu sapien cursus vestibulum proin eu mi nulla ac
6447,Mycat,eandriessence@youtu.be,+86 780 246 9607,rhoncus sed vestibulum sit amet cursus id turpis integer aliquet massa id lobortis convallis
6448,Leexo,lscholardcf@elegantthemes.com,+7 262 189 0932,blandit ultrices enim lorem ipsum dolor sit amet consectetuer adipiscing elit proin interdum mauris non ligula pellentesque ultrices phasellus id sapien
6449,Layo,gmcasgillcg@java.com,+86 858 361 2788,diam cras pellentesque volutpat dui maecenas tristique est et tempus semper est quam pharetra magna
6450,Skidoo,rinnwoodch@nationalgeographic.com,+502 914 200 7467,odio donec vitae nisi nam ultrices libero non mattis pulvinar nulla pede ullamcorper augue a suscipit nulla elit ac nulla sed
6451,Feedfire,mdunkirkci@intel.com,+1 131 808 8197,proin at turpis a pede posuere nonummy integer
6452,Oba,ctyzackcj@indiegogo.com,+380 129 673 4197,luctus tincidunt nulla mollis molestie lorem quisque ut erat curabitur gravida nisi at nibh in hac habitasse platea dictumst aliquam
6453,Meevee,jhelstripck@npr.org,+86 158 966 5071,id nisl venenatis lacinia aenean sit amet justo
6454,Realbuzz,sbelleniecl@g.co,+86 959 867 7142,tortor id nulla ultrices aliquet maecenas leo odio condimentum id luctus nec molestie sed justo pellentesque viverra
6455,Kayveo,wriglercm@ycombinator.com,+63 260 525 5532,erat fermentum justo nec condimentum neque sapien placerat ante nulla justo aliquam quis turpis eget elit sodales scelerisque mauris sit
6456,Devshare,wbaisoncn@ftc.gov,+63 658 442 0641,accumsan felis ut at dolor quis odio consequat varius integer ac leo pellentesque ultrices mattis odio donec vitae nisi nam ultrices libero non mattis
6457,Jazzy,raldermanco@usda.gov,+48 687 741 0779,sapien cum sociis natoque penatibus et magnis
6458,Edgeclub,asheddencp@gov.uk,+81 289 588 8536,at ipsum ac tellus semper interdum mauris ullamcorper
6459,Realbridge,aduestercq@t.co,+86 494 360 1967,morbi non quam nec dui luctus rutrum nulla tellus in sagittis dui vel nisl duis ac nibh fusce lacus
6460,Nlounge,amaccoughencr@nature.com,+357 405 439 4487,ut blandit non interdum in ante vestibulum ante ipsum primis in faucibus orci luctus et ultrices posuere
6461,Innojam,osawbridgecs@utexas.edu,+1 571 226 4264,blandit nam nulla integer pede justo lacinia eget tincidunt eget tempus vel pede morbi
6462,Dynazzy,dkornilyevct@gmpg.org,+84 330 141 5070,volutpat quam pede lobortis ligula sit amet eleifend pede libero quis orci nullam molestie nibh in lectus pellentesque at nulla suspendisse potenti cras in
6463,Trupe,mklugercu@mysql.com,+351 512 580 5787,amet erat nulla tempus vivamus
6464,Chatterpoint,khendrickscv@vinaora.com,+34 162 642 6471,cras mi pede malesuada in imperdiet
6465,Eayo,ccranmorecw@deviantart.com,+380 784 444 5284,nisl ut volutpat sapien arcu sed augue aliquam erat volutpat in congue etiam justo etiam pretium iaculis justo in hac habitasse platea dictumst
6466,Tavu,mcorderocx@qq.com,+62 938 223 8382,sapien a libero nam dui proin leo odio porttitor id consequat in
6467,Jayo,hbusselcy@feedburner.com,+30 764 460 2661,condimentum curabitur in libero ut massa volutpat convallis morbi odio odio elementum eu interdum eu
6468,Quire,jkembercz@flickr.com,+86 470 659 8347,justo pellentesque viverra pede ac diam cras pellentesque volutpat dui maecenas tristique est et tempus semper est quam pharetra magna ac consequat
6469,Twitterwire,kexterd0@ebay.com,+63 242 958 9236,pellentesque volutpat dui maecenas tristique
6470,Skyvu,bhowsegod1@woothemes.com,+381 192 520 8143,aliquet at feugiat non pretium quis lectus suspendisse potenti in eleifend quam a odio in hac habitasse platea dictumst maecenas
6471,Dynazzy,blitherlandd2@ning.com,+86 128 633 9039,nulla suspendisse potenti cras in purus eu magna vulputate luctus cum sociis natoque penatibus et magnis dis parturient montes nascetur ridiculus mus
6472,Vipe,agadsond3@pagesperso-orange.fr,+62 204 603 9306,venenatis turpis enim blandit mi in porttitor pede justo eu massa donec dapibus duis at velit eu est congue elementum
6473,Roodel,aarletd4@sciencedirect.com,+420 847 846 9832,posuere cubilia curae donec pharetra magna vestibulum aliquet ultrices erat tortor sollicitudin mi sit amet lobortis sapien sapien non mi
6474,Photobug,apollokd5@youtube.com,+257 215 785 9854,quam fringilla rhoncus mauris enim leo rhoncus
6475,Gabcube,flenind6@google.ca,+27 613 594 1378,eu magna vulputate luctus cum sociis natoque penatibus et magnis dis
6476,Zoonoodle,vprattyd7@wired.com,+212 813 767 3656,praesent id massa id nisl venenatis lacinia aenean sit amet justo morbi ut odio cras mi pede malesuada in imperdiet et commodo
6477,Thoughtbeat,tbannermand8@constantcontact.com,+298 865 475 5742,in faucibus orci luctus et ultrices posuere cubilia curae nulla dapibus dolor
6478,Thoughtblab,awoolmored9@cbsnews.com,+57 935 290 2210,justo in hac habitasse platea dictumst
6479,Gabspot,nempletonda@jugem.jp,+351 396 912 7471,eu orci mauris lacinia sapien quis libero nullam sit amet turpis elementum
6480,Devify,fhartdb@prweb.com,+380 604 118 4780,lacinia sapien quis libero nullam sit amet turpis elementum ligula vehicula consequat morbi
6481,Dabjam,adreghorndc@salon.com,+351 523 826 6926,tincidunt nulla mollis molestie lorem quisque ut erat curabitur gravida nisi at nibh in hac habitasse platea dictumst aliquam augue quam sollicitudin vitae
6482,Zava,cnutondd@google.ru,+52 622 278 8005,luctus et ultrices posuere cubilia curae nulla dapibus dolor vel est donec odio justo sollicitudin ut suscipit a feugiat et eros vestibulum ac
6483,LiveZ,slukasde@mtv.com,+86 341 319 5534,augue vestibulum rutrum rutrum neque aenean
6484,Edgepulse,rdugooddf@feedburner.com,+62 338 952 4394,justo in blandit ultrices enim
6485,Youtags,ghallgoughdg@samsung.com,+7 205 662 1130,ante vivamus tortor duis mattis egestas metus aenean fermentum
6486,Feedfire,sgiveendh@fc2.com,+86 903 987 7515,nulla nisl nunc nisl duis bibendum felis sed interdum venenatis turpis enim blandit mi
6487,Vinder,orumminsdi@creativecommons.org,+380 883 285 9538,vehicula condimentum curabitur in libero ut massa volutpat convallis morbi odio
6488,Skyvu,schessildj@wsj.com,+264 340 630 2263,eleifend luctus ultricies eu nibh quisque id justo sit amet sapien dignissim vestibulum vestibulum ante ipsum primis in faucibus orci
6489,Agivu,lpavlitschekdk@opensource.org,+86 998 361 7808,magnis dis parturient montes nascetur ridiculus mus etiam vel augue vestibulum rutrum rutrum neque aenean auctor gravida sem
6490,Lazz,vhanscombdl@smugmug.com,+45 405 824 7745,arcu adipiscing molestie hendrerit at vulputate vitae
6491,Flipopia,ccritzendm@europa.eu,+86 426 465 2860,at nulla suspendisse potenti cras in purus eu magna vulputate luctus cum sociis
6492,Mydo,omassydn@springer.com,+33 701 908 3980,nascetur ridiculus mus etiam vel augue vestibulum rutrum rutrum neque
6493,Jaxworks,gtoedo@microsoft.com,+63 455 742 5665,luctus rutrum nulla tellus in sagittis dui vel nisl
6494,Ntag,ksaltwelldp@admin.ch,+62 386 812 9296,cras mi pede malesuada in imperdiet et commodo vulputate justo in blandit ultrices enim lorem ipsum dolor sit amet
6495,Jayo,lmacconnaldq@privacy.gov.au,+63 927 813 5408,lacus morbi quis tortor id nulla ultrices aliquet maecenas
6496,Avamba,bmellanbydr@wufoo.com,+86 573 778 3928,natoque penatibus et magnis dis parturient montes nascetur ridiculus mus vivamus vestibulum sagittis sapien cum sociis natoque penatibus et magnis dis
6497,Dabshots,lbottrellds@comcast.net,+351 211 413 7553,turpis sed ante vivamus tortor
6498,Skajo,ssordt@wix.com,+7 314 970 9966,sapien cursus vestibulum proin eu mi nulla ac enim in tempor turpis nec euismod scelerisque quam turpis
6499,Layo,akleynermansdu@constantcontact.com,+46 365 953 4751,dis parturient montes nascetur ridiculus mus etiam vel augue vestibulum rutrum rutrum neque aenean auctor gravida sem praesent id massa id nisl
6500,DabZ,fbasforddv@furl.net,+93 556 768 5904,augue vel accumsan tellus nisi eu orci mauris lacinia
6501,Dabvine,ndidomenicodw@icio.us,+86 252 903 3794,mauris non ligula pellentesque ultrices phasellus id sapien in sapien iaculis congue
6502,Dabshots,mlanddx@whitehouse.gov,+86 227 282 2162,proin eu mi nulla ac enim in tempor turpis nec euismod scelerisque quam turpis adipiscing lorem vitae mattis nibh ligula
6503,Divavu,klantdy@go.com,+86 943 145 1612,hac habitasse platea dictumst morbi vestibulum
6504,Leenti,hkirschdz@sciencedaily.com,+54 831 680 6235,sagittis sapien cum sociis natoque penatibus et magnis dis parturient montes nascetur ridiculus mus etiam vel augue vestibulum rutrum
6505,Shufflebeat,sbarfforde0@cyberchimps.com,+86 604 836 6349,diam erat fermentum justo nec condimentum neque sapien placerat ante nulla justo aliquam quis turpis eget elit sodales scelerisque mauris sit amet
6506,Voonte,skilnere1@shop-pro.jp,+63 950 518 1708,velit id pretium iaculis diam erat fermentum justo nec condimentum neque sapien placerat ante nulla justo
6507,Gabtune,bbunclarke2@ox.ac.uk,+963 316 622 7241,pellentesque quisque porta volutpat erat quisque erat eros viverra eget congue eget semper rutrum
6508,Rhybox,sprinnette3@linkedin.com,+264 317 177 3778,ante ipsum primis in faucibus orci luctus et ultrices posuere cubilia curae nulla dapibus dolor vel est donec odio justo sollicitudin ut suscipit a feugiat
6509,Blogtag,emaruskae4@csmonitor.com,+420 529 609 1156,quis tortor id nulla ultrices aliquet maecenas leo odio condimentum id luctus nec molestie sed
6510,Jamia,zsussexe5@exblog.jp,+963 665 532 1288,sociis natoque penatibus et magnis dis parturient montes nascetur ridiculus mus etiam vel augue vestibulum rutrum rutrum neque
6511,Shuffletag,thuddlese6@altervista.org,+86 484 698 7588,augue luctus tincidunt nulla mollis molestie
6512,Browsetype,vstreake7@bing.com,+998 246 700 8850,nulla nunc purus phasellus in felis donec semper sapien a libero
6513,Buzzdog,eoglee8@google.com,+46 886 986 3240,donec semper sapien a libero nam dui proin leo odio porttitor id
