SupplierID,SupplierName,SupplierEmail,SupplierPhone,SupplierDescription
14650,Aimbu,fwaszkiewicz4k@is.gd,+420 912 435 6891,cum sociis natoque penatibus et magnis dis parturient montes nascetur ridiculus mus vivamus vestibulum sagittis sapien cum sociis natoque penatibus et
14550,Livetube,zstarbeck4l@intel.com,+55 564 612 8482,primis in faucibus orci luctus et ultrices posuere cubilia curae duis faucibus accumsan odio
14484,Demivee,bduberry4m@instagram.com,+63 651 143 9217,eget nunc donec quis orci eget orci vehicula condimentum curabitur in libero ut massa
14519,Twitterbeat,mbernade4n@webeden.co.uk,+46 599 532 7053,augue luctus tincidunt nulla mollis molestie lorem quisque ut erat curabitur gravida nisi at nibh in hac habitasse platea dictumst aliquam augue quam
14557,Teklist,igrishenkov4o@pen.io,+86 903 472 9715,posuere nonummy integer non velit donec diam neque vestibulum eget vulputate
14654,Buzzster,epena4p@nih.gov,+62 736 957 3772,rhoncus mauris enim leo rhoncus sed vestibulum sit amet cursus id turpis integer aliquet massa id lobortis convallis tortor risus dapibus
14337,Twitterbridge,ccroson4q@nymag.com,+20 649 441 9775,odio justo sollicitudin ut suscipit a feugiat et eros vestibulum ac est lacinia nisi venenatis tristique fusce congue diam id ornare
13935,Yadel,cjaram4r@goo.ne.jp,+46 114 133 4302,tempus sit amet sem fusce consequat nulla nisl nunc nisl duis bibendum felis sed interdum venenatis turpis enim
14626,Thoughtmix,bberriball4s@netvibes.com,+62 929 281 1154,viverra pede ac diam cras pellentesque volutpat dui maecenas tristique est et tempus semper est quam pharetra magna ac consequat metus sapien ut nunc vestibulum
14822,Babbleset,mpenhale4t@odnoklassniki.ru,+691 436 245 3972,justo maecenas rhoncus aliquam lacus morbi quis
14875,Tagfeed,telverstone4u@nifty.com,+86 129 414 1710,a pede posuere nonummy integer non velit donec diam neque vestibulum eget vulputate ut ultrices vel augue vestibulum ante ipsum primis in
14528,Avaveo,hposthill4v@fotki.com,+57 807 441 2347,volutpat quam pede lobortis ligula sit amet eleifend pede libero quis
14833,Shufflebeat,bkiltie4w@house.gov,+54 590 720 6804,sit amet diam in magna bibendum imperdiet nullam orci pede
14190,Skipfire,cboule4x@cyberchimps.com,+66 802 197 6896,ut nulla sed accumsan felis ut at dolor quis odio consequat varius integer ac leo pellentesque ultrices mattis odio donec vitae nisi
14485,Tagpad,wphillot4y@myspace.com,+7 685 464 9164,in faucibus orci luctus et ultrices posuere cubilia curae nulla dapibus dolor vel est donec odio justo sollicitudin ut
14868,Livefish,hmilkeham4z@eventbrite.com,+55 414 839 9404,elementum ligula vehicula consequat morbi a ipsum integer a nibh
14201,Zoombeat,pbows50@wikia.com,+62 520 544 2003,dignissim vestibulum vestibulum ante ipsum primis in faucibus orci luctus et
14014,LiveZ,pmacgillacolm51@theglobeandmail.com,+55 996 541 1332,sit amet consectetuer adipiscing elit proin interdum mauris non ligula pellentesque ultrices
13957,Innotype,rmulgrew52@mapy.cz,+86 568 874 2253,in tempus sit amet sem fusce consequat nulla
14257,Brightdog,dcrotty53@pcworld.com,+48 729 421 2889,mauris viverra diam vitae quam suspendisse potenti nullam porttitor lacus at turpis donec posuere metus vitae ipsum aliquam non mauris morbi non
14104,Wordpedia,kwhettleton54@elegantthemes.com,+52 516 121 5003,convallis duis consequat dui nec nisi volutpat eleifend donec ut dolor morbi vel lectus
13965,Eimbee,tduncanson55@wikimedia.org,+976 209 183 7004,lorem quisque ut erat curabitur gravida nisi at nibh in hac habitasse platea dictumst aliquam
14872,Brightdog,vbreckwell56@ucla.edu,+62 787 939 9504,morbi vestibulum velit id pretium iaculis diam erat fermentum justo nec condimentum neque sapien placerat ante nulla justo aliquam
14775,Trudoo,agammidge57@slashdot.org,+254 696 375 8273,consequat dui nec nisi volutpat eleifend donec ut dolor morbi vel lectus in quam fringilla rhoncus mauris
14575,Vimbo,lgoghin58@dailymail.co.uk,+81 300 925 1801,aliquet at feugiat non pretium quis
14875,BlogXS,faylett59@icio.us,+420 519 757 4301,accumsan odio curabitur convallis duis consequat dui nec nisi volutpat eleifend donec ut dolor morbi vel lectus in
14774,Avamba,dsecker5a@hatena.ne.jp,+63 828 423 4835,erat quisque erat eros viverra eget congue eget semper rutrum nulla nunc purus phasellus in felis donec semper sapien a libero
14622,Vinder,kbossingham5b@ehow.com,+54 118 692 9648,amet justo morbi ut odio cras mi pede malesuada in imperdiet et commodo vulputate justo in blandit
13984,Riffwire,sduddy5c@slashdot.org,+86 257 233 1969,convallis tortor risus dapibus augue vel accumsan tellus nisi eu orci mauris lacinia sapien quis libero
14225,Ozu,cgagie5d@fc2.com,+351 329 544 1685,ut erat id mauris vulputate elementum nullam varius nulla facilisi cras non velit nec nisi vulputate nonummy maecenas tincidunt lacus at velit
14852,Kamba,jwasylkiewicz5e@ucla.edu,+81 487 630 6704,nam dui proin leo odio porttitor id consequat in consequat ut nulla sed accumsan felis ut at dolor quis odio consequat varius integer
14659,Feedfire,srait5f@guardian.co.uk,+86 917 143 3687,eu est congue elementum in hac habitasse platea dictumst morbi vestibulum velit id pretium iaculis diam
14582,Rhycero,lhowen5g@shutterfly.com,+86 285 503 6729,vitae ipsum aliquam non mauris morbi non lectus aliquam sit amet diam in magna bibendum imperdiet nullam orci pede venenatis
14107,Skalith,acowell5h@usgs.gov,+62 413 898 1048,vehicula condimentum curabitur in libero ut massa volutpat convallis morbi odio odio elementum
14690,Youbridge,srigate5i@zdnet.com,+86 902 558 5892,mauris viverra diam vitae quam suspendisse potenti nullam porttitor lacus at turpis donec posuere metus vitae ipsum aliquam non mauris morbi
14923,Oloo,fbatrick5j@yahoo.co.jp,+237 665 325 1116,neque duis bibendum morbi non quam nec dui luctus rutrum nulla tellus in
14024,Pixonyx,wnormant5k@smh.com.au,+7 836 130 2212,porttitor lorem id ligula suspendisse ornare consequat lectus in est risus auctor sed tristique in tempus sit
14277,Buzzster,dthorold5l@cocolog-nifty.com,+385 808 234 1039,ac enim in tempor turpis nec euismod scelerisque quam turpis adipiscing lorem vitae mattis nibh ligula nec sem duis aliquam convallis nunc proin at
14504,Feedfish,wsoutar5m@blogtalkradio.com,+86 407 366 1482,in hac habitasse platea dictumst morbi vestibulum velit id pretium iaculis diam erat fermentum justo nec condimentum neque
14567,Wordtune,psmerdon5n@lulu.com,+7 157 385 6127,in lacus curabitur at ipsum ac tellus semper interdum mauris ullamcorper purus sit amet nulla quisque
14984,Blogtags,eouldcott5o@howstuffworks.com,+66 486 112 9942,in magna bibendum imperdiet nullam orci
14392,Vidoo,jpearmine5p@nsw.gov.au,+63 555 260 4162,posuere cubilia curae mauris viverra
14645,Realcube,oberkeley5q@blinklist.com,+93 220 883 8002,nisl nunc rhoncus dui vel sem sed sagittis nam congue risus semper porta volutpat quam pede lobortis ligula sit amet eleifend pede libero quis orci
14048,Agivu,tshackleton5r@csmonitor.com,+63 292 300 3434,donec semper sapien a libero nam dui proin leo odio porttitor id consequat in consequat ut
14543,Blogtag,rnardoni5s@alibaba.com,+52 756 736 6364,orci mauris lacinia sapien quis libero nullam sit amet
14693,Blogpad,vlupson5t@slideshare.net,+590 512 214 0030,nisl nunc rhoncus dui vel sem sed sagittis nam congue risus semper porta volutpat quam pede lobortis ligula sit amet eleifend pede libero quis orci
14111,Oyoloo,gwaud5u@smugmug.com,+86 362 799 0754,pulvinar nulla pede ullamcorper augue a suscipit nulla
14369,Feedspan,fsanzio5v@bluehost.com,+86 904 138 4962,tempus vivamus in felis eu sapien cursus vestibulum proin eu mi nulla ac enim in tempor turpis nec euismod scelerisque quam turpis adipiscing lorem
14892,Kamba,ftoby5w@china.com.cn,+230 786 817 2396,magna bibendum imperdiet nullam orci pede venenatis non sodales sed tincidunt eu felis fusce
14875,Jabbercube,ssodor5x@dedecms.com,+34 306 950 7219,amet consectetuer adipiscing elit proin interdum mauris non ligula pellentesque ultrices phasellus id sapien in sapien iaculis congue vivamus metus arcu
13961,Oyoloo,rgarvin5y@mtv.com,+7 533 969 9040,rhoncus sed vestibulum sit amet cursus id turpis integer aliquet massa
14424,Zoozzy,edanelutti5z@columbia.edu,+7 128 985 0474,ac diam cras pellentesque volutpat dui maecenas tristique est et tempus semper
14716,Eimbee,bwinear60@163.com,+269 490 594 7405,neque libero convallis eget eleifend luctus ultricies eu nibh quisque
14548,Flashdog,mmcilmorow61@wiley.com,+1 682 254 8442,enim sit amet nunc viverra dapibus nulla suscipit ligula in lacus curabitur at ipsum ac tellus semper interdum mauris ullamcorper purus sit amet nulla
14290,Bubblebox,wbeautyman62@hostgator.com,+55 878 904 4214,vulputate justo in blandit ultrices enim lorem ipsum dolor sit amet consectetuer adipiscing elit proin interdum mauris non ligula pellentesque ultrices phasellus
14626,Layo,efortun63@pinterest.com,+967 486 842 6669,morbi porttitor lorem id ligula suspendisse ornare consequat lectus in est risus auctor sed tristique in tempus sit
14641,Photobean,cnelthorpe64@com.com,+63 487 945 7522,consequat nulla nisl nunc nisl duis bibendum felis sed interdum venenatis turpis enim blandit mi in porttitor pede justo eu
14925,Skyvu,klief65@chicagotribune.com,+55 950 846 2447,fermentum justo nec condimentum neque sapien placerat ante nulla justo aliquam
14757,Dabjam,jdorbin66@ftc.gov,+372 703 243 7139,magnis dis parturient montes nascetur ridiculus mus
14864,Omba,sivanishev67@yellowpages.com,+48 908 935 0138,dapibus duis at velit eu est congue elementum in hac habitasse platea dictumst morbi vestibulum velit id pretium iaculis diam erat fermentum justo nec condimentum
14652,Brainlounge,enunesnabarro68@yelp.com,+385 842 362 2940,habitasse platea dictumst morbi vestibulum velit id pretium iaculis diam erat fermentum justo nec condimentum neque sapien placerat ante nulla
14271,Mymm,lvisco69@mayoclinic.com,+62 652 648 8464,tempus vivamus in felis eu sapien cursus vestibulum proin eu mi nulla ac enim in tempor turpis nec euismod scelerisque quam turpis adipiscing
14255,Yodel,gduffitt6a@yelp.com,+62 932 940 2974,leo maecenas pulvinar lobortis est phasellus sit amet erat nulla
14186,Devbug,bscholig6b@histats.com,+54 560 200 8085,ultrices aliquet maecenas leo odio condimentum
14408,Lajo,cbrankley6c@1und1.de,+7 686 381 8599,purus aliquet at feugiat non pretium quis lectus suspendisse potenti in eleifend quam a odio in hac habitasse platea dictumst maecenas ut
14949,Livetube,rshutte6d@imgur.com,+62 838 928 4808,aliquet pulvinar sed nisl nunc rhoncus dui vel sem
14653,Twitterlist,nmoncrieffe6e@dagondesign.com,+48 696 708 4308,consectetuer eget rutrum at lorem integer tincidunt ante vel ipsum praesent blandit lacinia erat vestibulum sed
14348,Quinu,gdani6f@archive.org,+31 821 967 0849,ipsum ac tellus semper interdum
14983,Meemm,team6g@photobucket.com,+251 846 735 6471,vulputate vitae nisl aenean lectus pellentesque eget nunc donec quis orci eget orci vehicula condimentum curabitur in libero ut massa volutpat
13954,Voonte,lcuttell6h@wiley.com,+48 525 379 4877,vestibulum vestibulum ante ipsum primis in faucibus orci luctus et ultrices posuere cubilia curae nulla dapibus dolor vel est donec odio justo sollicitudin ut
14805,Latz,pcabera6i@google.com.hk,+1 612 762 2288,amet turpis elementum ligula vehicula consequat morbi a ipsum
14108,Twinder,fsills6j@squidoo.com,+86 979 305 3430,tellus semper interdum mauris ullamcorper purus sit amet nulla quisque arcu libero rutrum ac lobortis
14440,Tagpad,cnatt6k@gravatar.com,+386 332 131 4235,erat quisque erat eros viverra eget congue
14137,Topiczoom,agrouvel6l@qq.com,+49 333 159 3334,quisque erat eros viverra eget congue
14450,Yakitri,fconquer6m@paginegialle.it,+420 471 175 3133,erat vestibulum sed magna at nunc commodo placerat praesent blandit nam nulla
14447,Skivee,dthomasset6n@unicef.org,+86 377 294 0469,morbi porttitor lorem id ligula suspendisse ornare consequat lectus in est risus auctor sed tristique in
13933,Oyondu,aluis6o@storify.com,+27 436 914 5583,etiam pretium iaculis justo in hac habitasse platea dictumst etiam faucibus cursus urna ut tellus nulla ut erat id mauris vulputate elementum
14083,Skinix,bbearns6p@free.fr,+387 704 882 5089,imperdiet et commodo vulputate justo in blandit ultrices enim lorem ipsum dolor sit amet consectetuer adipiscing elit proin interdum mauris non ligula pellentesque
14049,Npath,tcrosfeld6q@upenn.edu,+92 573 435 0102,sed vestibulum sit amet cursus id turpis integer aliquet massa id lobortis convallis tortor risus dapibus augue vel accumsan
14212,Oba,chamblin6r@digg.com,+64 868 160 8388,eu sapien cursus vestibulum proin
14008,Zoombox,mgheeorghie6s@blinklist.com,+86 973 553 8038,neque vestibulum eget vulputate ut ultrices vel augue vestibulum ante ipsum primis in faucibus orci luctus et ultrices
14164,Gabspot,tquesne6t@uiuc.edu,+86 801 645 8894,accumsan tellus nisi eu orci mauris lacinia sapien quis libero nullam sit amet turpis elementum ligula vehicula consequat morbi a
14175,Realfire,jheinzel6u@hp.com,+54 497 581 6778,ipsum ac tellus semper interdum mauris ullamcorper purus sit amet nulla quisque
14010,Yotz,kmitchenson6v@yellowpages.com,+86 569 814 1346,quam pede lobortis ligula sit amet eleifend pede libero quis orci nullam molestie nibh in lectus pellentesque at nulla
14632,Brainlounge,dhardson6w@furl.net,+420 639 711 7201,hac habitasse platea dictumst morbi vestibulum velit id pretium iaculis diam
14594,Janyx,fcowpertwait6x@upenn.edu,+86 663 108 5052,at dolor quis odio consequat varius integer ac leo pellentesque ultrices mattis odio donec vitae nisi nam ultrices libero non mattis pulvinar
14415,Innotype,ogathwaite6y@cisco.com,+1 865 787 7749,vivamus vestibulum sagittis sapien cum sociis natoque penatibus et magnis dis parturient montes nascetur ridiculus mus etiam vel augue vestibulum rutrum rutrum
14059,Zoomcast,matthowe6z@rakuten.co.jp,+86 240 306 4025,elementum pellentesque quisque porta volutpat erat quisque erat eros viverra eget congue eget semper rutrum nulla nunc purus phasellus in felis donec semper
14465,Eabox,mjeannequin70@booking.com,+86 318 442 8567,luctus et ultrices posuere cubilia curae nulla dapibus dolor vel est donec odio justo sollicitudin ut suscipit a feugiat et eros vestibulum ac est lacinia
13933,Eazzy,abernhard71@rambler.ru,+86 232 645 0777,mollis molestie lorem quisque ut erat
14060,Photospace,dmacgilrewy72@mac.com,+66 720 926 5756,nam ultrices libero non mattis pulvinar nulla pede ullamcorper augue a suscipit nulla elit ac nulla sed vel enim sit amet nunc
14277,Skidoo,abrewitt73@ovh.net,+33 978 471 8343,bibendum morbi non quam nec dui luctus rutrum nulla tellus in sagittis dui vel nisl duis ac
13975,Oba,lstrognell74@bloomberg.com,+46 549 989 5975,id lobortis convallis tortor risus dapibus augue vel accumsan tellus nisi eu orci mauris lacinia sapien quis libero
14123,Trudoo,vaucock75@nytimes.com,+86 674 782 6026,convallis tortor risus dapibus augue vel accumsan tellus
13944,Meetz,rantuoni76@sina.com.cn,+351 948 442 5816,orci luctus et ultrices posuere cubilia curae nulla dapibus dolor
14324,Reallinks,agarey77@shop-pro.jp,+98 353 711 8346,dapibus augue vel accumsan tellus nisi eu orci mauris lacinia sapien quis libero nullam sit amet turpis elementum ligula vehicula consequat morbi a
14499,Photobug,akelsey78@msn.com,+267 238 610 0362,accumsan felis ut at dolor quis odio consequat varius integer ac leo pellentesque ultrices mattis odio donec vitae nisi nam ultrices libero
14365,Zoonder,pettridge79@wunderground.com,+7 408 340 8702,ultrices mattis odio donec vitae nisi nam ultrices libero non mattis pulvinar nulla pede
14282,JumpXS,jgouley7a@gnu.org,+7 364 259 7813,posuere felis sed lacus morbi sem mauris laoreet ut rhoncus aliquet pulvinar sed nisl nunc rhoncus dui vel sem sed
14018,Quinu,bglanester7b@addthis.com,+352 418 790 1319,pede posuere nonummy integer non velit donec diam neque vestibulum eget vulputate ut ultrices vel augue vestibulum ante
14200,Riffpedia,gbrisbane7c@friendfeed.com,+27 320 591 5344,nulla sed accumsan felis ut at dolor quis odio consequat varius integer ac leo pellentesque ultrices mattis odio donec vitae nisi
14624,Flashset,tbleythin7d@psu.edu,+1 312 618 2446,aliquam erat volutpat in congue etiam justo etiam pretium iaculis justo in hac habitasse platea dictumst etiam faucibus cursus urna ut tellus
14435,Rhyloo,nwoolland7e@51.la,+57 285 731 2428,nam ultrices libero non mattis pulvinar nulla pede ullamcorper augue a suscipit nulla elit ac nulla sed vel enim
14800,Blogpad,lcecchetelli7f@washington.edu,+962 219 256 1968,est donec odio justo sollicitudin ut suscipit a feugiat et
14128,Jazzy,dmacpaike7g@diigo.com,+62 349 419 9450,porta volutpat erat quisque erat eros viverra eget congue eget
13983,Gabtype,efilon7h@xinhuanet.com,+86 937 585 4004,non lectus aliquam sit amet diam in magna bibendum imperdiet nullam orci pede venenatis non sodales sed tincidunt eu felis fusce posuere felis sed
14182,Babbleopia,acalderonello7i@shop-pro.jp,+62 377 185 2688,dis parturient montes nascetur ridiculus mus etiam vel augue vestibulum rutrum rutrum
13985,Aivee,emarriot7j@cdc.gov,+56 373 785 1806,posuere cubilia curae mauris viverra
14768,Voonyx,agillies7k@smugmug.com,+33 312 371 9937,morbi vestibulum velit id pretium iaculis
14428,Riffpath,bmonkley7l@google.cn,+86 461 803 5461,volutpat sapien arcu sed augue aliquam erat volutpat in congue etiam
14780,Dynabox,hasbury7m@gmpg.org,+55 385 184 0263,nunc vestibulum ante ipsum primis in faucibus orci luctus et ultrices posuere cubilia curae mauris viverra diam vitae quam suspendisse potenti
14123,Divanoodle,ipellington7n@smh.com.au,+351 116 829 8909,ante ipsum primis in faucibus orci luctus et ultrices posuere cubilia curae donec pharetra magna vestibulum
13971,Mycat,yemmatt7o@gmpg.org,+351 843 859 7018,aliquet massa id lobortis convallis tortor risus dapibus augue vel accumsan
14426,Tagtune,nshelmardine7p@macromedia.com,+261 705 922 5658,sem fusce consequat nulla nisl nunc nisl duis bibendum felis sed interdum venenatis turpis enim blandit mi in porttitor pede justo
14500,Zazio,mcoope7q@sun.com,+62 564 475 2916,amet cursus id turpis integer aliquet massa id lobortis convallis tortor risus dapibus augue vel accumsan tellus nisi eu
14376,Jaxnation,ahelks7r@youtu.be,+55 717 126 1899,gravida sem praesent id massa id nisl venenatis lacinia aenean sit amet justo morbi ut odio
14373,Midel,hpheasant7s@yellowbook.com,+244 504 993 8300,leo pellentesque ultrices mattis odio donec vitae nisi nam ultrices
13986,Twimbo,mkuzma7t@wikispaces.com,+57 586 165 8167,augue vestibulum ante ipsum primis in faucibus orci luctus et ultrices posuere cubilia curae donec pharetra magna vestibulum aliquet ultrices
14731,Ainyx,vsaveall7u@howstuffworks.com,+359 963 791 0470,nulla suspendisse potenti cras in purus eu magna vulputate luctus cum sociis natoque penatibus et magnis dis parturient montes nascetur ridiculus mus
14127,Cogidoo,abagehot7v@youku.com,+351 662 858 8240,vivamus in felis eu sapien cursus vestibulum proin eu mi
14922,Meejo,asushams7w@cbslocal.com,+60 664 102 2093,gravida sem praesent id massa id
14486,Yakitri,jandreutti7x@acquirethisname.com,+507 374 553 4518,varius ut blandit non interdum in ante vestibulum ante ipsum primis in faucibus orci luctus
14435,Skyble,rcharnley7y@devhub.com,+81 167 174 5609,nulla ultrices aliquet maecenas leo odio condimentum id luctus nec molestie sed justo
14920,Geba,pdilks7z@census.gov,+63 488 237 4942,porta volutpat erat quisque erat eros
14414,Yakitri,cfitch80@hhs.gov,+507 467 441 4498,et ultrices posuere cubilia curae
14588,Zoombeat,jedgett81@vinaora.com,+351 543 474 0575,faucibus accumsan odio curabitur convallis duis consequat dui nec nisi volutpat eleifend donec ut dolor morbi
13907,Ainyx,nceyssen82@rakuten.co.jp,+351 924 709 8308,eu mi nulla ac enim in tempor turpis nec euismod scelerisque quam turpis adipiscing lorem vitae mattis nibh ligula nec sem duis
14051,Miboo,fmattersley83@nytimes.com,+380 935 102 0410,vestibulum ante ipsum primis in faucibus orci luctus et ultrices posuere cubilia curae nulla dapibus dolor vel est donec odio justo sollicitudin ut suscipit a
14118,Yata,avatini84@paginegialle.it,+63 295 831 8875,odio in hac habitasse platea dictumst maecenas ut massa quis augue luctus tincidunt nulla mollis molestie lorem quisque ut erat curabitur gravida nisi at nibh
13996,Centidel,yjackways85@live.com,+225 737 700 8414,magna vestibulum aliquet ultrices erat tortor sollicitudin mi sit amet lobortis sapien sapien
14694,Realcube,wworham86@studiopress.com,+62 479 914 4375,diam in magna bibendum imperdiet nullam orci pede venenatis non sodales sed tincidunt eu felis fusce posuere felis sed lacus morbi
14348,Buzzster,tasbrey87@tinyurl.com,+86 349 124 6876,accumsan odio curabitur convallis duis consequat dui nec nisi volutpat eleifend donec ut dolor morbi vel lectus in quam
14625,Jetpulse,halvarado88@businessweek.com,+1 512 149 5491,mollis molestie lorem quisque ut erat curabitur gravida nisi at nibh in hac habitasse platea dictumst aliquam augue quam sollicitudin vitae consectetuer eget rutrum
14451,Voonyx,rhancke89@altervista.org,+63 459 112 3858,quam sapien varius ut blandit non interdum in ante vestibulum ante ipsum primis in faucibus orci luctus et ultrices posuere cubilia curae duis
14306,Pixoboo,dgaveltone8a@comsenz.com,+46 511 277 2944,ornare imperdiet sapien urna pretium
14792,Ooba,bmoulden8b@dyndns.org,+7 200 810 9672,eget massa tempor convallis nulla
14963,Voonder,amcintee8c@mozilla.org,+62 473 450 5366,non velit donec diam neque vestibulum eget vulputate ut ultrices vel augue vestibulum ante
13940,Kayveo,nfowells8d@com.com,+234 473 695 5321,nulla ultrices aliquet maecenas leo odio
14260,Avaveo,hmalkin8e@spiegel.de,+86 137 907 8061,libero nullam sit amet turpis elementum ligula vehicula consequat morbi a ipsum integer a nibh in quis justo
14188,Chatterbridge,nsansam8f@ustream.tv,+55 548 698 2168,ut volutpat sapien arcu sed augue aliquam erat volutpat in congue etiam justo etiam pretium iaculis
14581,Livetube,lphilbin8g@edublogs.org,+62 554 422 6128,sapien iaculis congue vivamus metus arcu adipiscing molestie hendrerit at vulputate vitae nisl aenean lectus pellentesque
14715,Camimbo,pburdon8h@nyu.edu,+63 835 430 6004,platea dictumst aliquam augue quam sollicitudin vitae consectetuer eget rutrum at
14598,Quamba,awetherburn8i@woothemes.com,+63 796 937 6302,varius ut blandit non interdum in ante vestibulum ante ipsum primis in faucibus orci luctus
14858,Skynoodle,amoyse8j@pinterest.com,+56 315 360 9839,odio justo sollicitudin ut suscipit a feugiat et eros vestibulum ac est lacinia nisi venenatis tristique fusce congue diam id ornare imperdiet sapien urna pretium
14010,Kwimbee,nwiddocks8k@dailymail.co.uk,+86 348 668 3044,amet eros suspendisse accumsan tortor quis turpis sed ante vivamus tortor duis mattis egestas metus aenean fermentum
14951,Yakijo,bsmowton8l@hatena.ne.jp,+251 552 334 8976,nulla sed accumsan felis ut at dolor quis odio consequat varius integer ac leo pellentesque ultrices mattis
14538,Vipe,roleagham8m@canalblog.com,+967 188 541 8053,non velit nec nisi vulputate nonummy maecenas tincidunt lacus at velit vivamus vel nulla eget eros elementum pellentesque
13915,Gevee,tjammes8n@indiatimes.com,+86 899 737 1764,quis orci eget orci vehicula condimentum curabitur in libero ut massa volutpat convallis morbi odio odio elementum eu interdum eu tincidunt
14748,Eayo,chuffey8o@cdbaby.com,+86 446 328 9494,vestibulum proin eu mi nulla ac enim in tempor turpis nec euismod scelerisque quam turpis
14066,Zoozzy,vkingcote8p@umn.edu,+86 479 882 7312,libero convallis eget eleifend luctus ultricies eu nibh quisque id justo sit amet sapien
14875,Miboo,aniblo8q@w3.org,+62 643 900 3093,quam suspendisse potenti nullam porttitor lacus at turpis donec posuere metus vitae ipsum aliquam non mauris morbi non lectus aliquam sit amet diam in
14026,Babbleopia,sjochanany8r@tuttocitta.it,+86 528 152 8340,posuere felis sed lacus morbi sem mauris
14690,Flipbug,bsherman8s@elegantthemes.com,+265 131 263 2263,etiam faucibus cursus urna ut tellus nulla ut erat id mauris vulputate elementum nullam varius nulla facilisi cras
13930,Flashpoint,kgrigoletti8t@furl.net,+994 605 800 0954,placerat ante nulla justo aliquam quis turpis
14048,Wordpedia,bwilkenson8u@creativecommons.org,+63 555 757 8364,ut ultrices vel augue vestibulum ante ipsum primis in faucibus orci luctus et ultrices posuere cubilia curae
14557,Topicshots,mbullier8v@mozilla.com,+1 740 755 7685,nibh ligula nec sem duis aliquam convallis nunc proin at
14667,Roomm,mhallums8w@deliciousdays.com,+48 510 161 0904,sem sed sagittis nam congue
14932,Kayveo,cvasilyonok8x@spiegel.de,+1 711 206 0039,interdum in ante vestibulum ante ipsum primis in faucibus orci luctus et ultrices posuere cubilia
14719,Divavu,pzambonini8y@goo.gl,+48 972 794 3439,sit amet sem fusce consequat nulla nisl nunc nisl duis bibendum felis sed interdum venenatis turpis enim blandit mi in porttitor
14865,Oyoyo,bdougher8z@unesco.org,+86 133 714 5186,nibh ligula nec sem duis aliquam convallis nunc proin at turpis a pede posuere nonummy integer non velit
14826,Bubblebox,bmossman90@si.edu,+51 191 411 8599,velit donec diam neque vestibulum eget vulputate ut ultrices vel augue vestibulum ante
13944,Jabbersphere,bkeyte91@cnet.com,+55 490 451 7958,vitae quam suspendisse potenti nullam porttitor lacus at turpis donec posuere metus vitae ipsum aliquam non mauris morbi non lectus
14948,Brainbox,aallicock92@photobucket.com,+92 824 381 6800,vivamus vestibulum sagittis sapien cum sociis natoque
14832,Meedoo,scostelloe93@prweb.com,+54 490 845 2511,mauris viverra diam vitae quam suspendisse potenti nullam porttitor lacus at
13908,Browsetype,bdogg94@elpais.com,+238 294 836 7319,ac nulla sed vel enim sit
14173,Wikibox,fsaltrese95@skype.com,+33 696 548 9179,eu nibh quisque id justo
