GarantyID,NameGaranty,Duration,PriceGaranty,DescriptionGaranty
741,Additional reseller's warranty,125,71.84,consequat lectus in est risus auctor sed tristique in tempus sit amet sem fusce consequat nulla
742,Manufacturer's special warranty,93,74.18,sed vel enim sit amet nunc viverra dapibus nulla suscipit ligula in lacus
743,Full manufacturer's warranty,548,77.72,sem sed sagittis nam congue risus semper porta volutpat quam pede lobortis
744,Manufacturer's special warranty,548,96.67,amet eleifend pede libero quis orci nullam molestie nibh in lectus pellentesque at nulla suspendisse potenti
745,Standard Manufacturer's,125,83.05,lacus purus aliquet at feugiat non pretium quis lectus suspendisse potenti in eleifend quam a odio
746,Full manufacturer's warranty,365,68.61,etiam vel augue vestibulum rutrum rutrum neque aenean auctor gravida sem praesent id massa id nisl venenatis lacinia
747,Standard Manufacturer's,125,60.41,morbi vel lectus in quam fringilla rhoncus mauris enim leo rhoncus sed vestibulum sit amet cursus id turpis integer aliquet
748,Full manufacturer's warranty,365,71.62,nisl venenatis lacinia aenean sit amet justo morbi ut odio cras mi pede malesuada in imperdiet et
749,Manufacturer's special warranty,548,88.52,amet consectetuer adipiscing elit proin risus praesent lectus vestibulum quam sapien varius ut blandit non interdum in
750,Full manufacturer's warranty,125,70.40,quis augue luctus tincidunt nulla mollis molestie lorem quisque ut erat curabitur gravida nisi at nibh in hac
751,Standard Manufacturer's,125,69.44,praesent id massa id nisl venenatis lacinia aenean sit amet
752,Manufacturer's special warranty,125,75.78,neque duis bibendum morbi non quam nec dui luctus rutrum nulla tellus in
753,Full manufacturer's warranty,93,61.06,velit donec diam neque vestibulum eget vulputate ut ultrices vel augue vestibulum ante ipsum primis in
754,Full manufacturer's warranty,125,70.63,et commodo vulputate justo in blandit ultrices enim lorem ipsum dolor sit amet consectetuer adipiscing elit
755,Full manufacturer's warranty,93,64.88,mollis molestie lorem quisque ut erat curabitur gravida nisi at nibh in hac habitasse platea dictumst
756,Additional reseller's warranty,125,69.58,ut mauris eget massa tempor convallis nulla neque libero convallis eget eleifend luctus ultricies eu
757,Manufacturer's special warranty,548,64.23,scelerisque quam turpis adipiscing lorem vitae mattis nibh ligula nec sem duis aliquam convallis
758,Additional reseller's warranty,365,97.37,sit amet erat nulla tempus vivamus in felis eu sapien cursus vestibulum proin eu mi nulla ac enim in
759,Standard Manufacturer's,93,92.46,quis turpis sed ante vivamus tortor duis mattis egestas metus
760,Manufacturer's special warranty,548,92.54,et magnis dis parturient montes nascetur ridiculus mus etiam vel augue vestibulum rutrum rutrum neque aenean auctor gravida sem
761,Full manufacturer's warranty,365,61.12,maecenas leo odio condimentum id luctus nec molestie sed justo pellentesque viverra
762,Full manufacturer's warranty,365,92.69,sed vel enim sit amet nunc viverra dapibus nulla suscipit
763,Additional reseller's warranty,93,66.92,nec sem duis aliquam convallis nunc proin at turpis a pede posuere nonummy integer non velit donec
764,Additional reseller's warranty,125,71.46,praesent id massa id nisl venenatis lacinia aenean sit amet justo morbi
765,Manufacturer's special warranty,183,87.63,tempus vel pede morbi porttitor lorem id ligula suspendisse ornare consequat lectus in est
766,Full manufacturer's warranty,93,95.38,nulla integer pede justo lacinia eget tincidunt eget tempus vel pede morbi porttitor lorem id ligula suspendisse
767,Additional reseller's warranty,183,64.66,non mauris morbi non lectus aliquam sit amet diam in
768,Standard Manufacturer's,548,99.01,tincidunt ante vel ipsum praesent blandit lacinia erat vestibulum sed magna at nunc commodo placerat praesent blandit nam nulla integer
769,Standard Manufacturer's,93,77.01,ipsum primis in faucibus orci luctus et ultrices posuere cubilia
770,Manufacturer's special warranty,183,96.61,sed vel enim sit amet nunc viverra dapibus nulla suscipit
771,Manufacturer's special warranty,125,81.32,luctus et ultrices posuere cubilia curae nulla dapibus dolor vel est donec odio justo sollicitudin
772,Additional reseller's warranty,365,85.54,amet sem fusce consequat nulla nisl nunc nisl duis bibendum felis
773,Manufacturer's special warranty,125,60.01,diam neque vestibulum eget vulputate ut ultrices vel augue vestibulum ante ipsum primis in faucibus orci
774,Additional reseller's warranty,548,92.94,rhoncus mauris enim leo rhoncus sed vestibulum sit amet cursus id turpis
775,Standard Manufacturer's,93,97.84,sit amet nunc viverra dapibus nulla suscipit ligula in lacus curabitur at ipsum ac
776,Full manufacturer's warranty,125,80.23,consequat varius integer ac leo pellentesque ultrices mattis odio donec vitae nisi nam ultrices libero
777,Additional reseller's warranty,125,64.76,feugiat non pretium quis lectus suspendisse potenti in eleifend quam a odio in hac habitasse platea dictumst
778,Standard Manufacturer's,365,75.64,aliquam quis turpis eget elit sodales scelerisque mauris sit amet eros suspendisse accumsan tortor quis turpis sed
779,Full manufacturer's warranty,365,65.66,praesent lectus vestibulum quam sapien varius ut blandit non interdum in ante vestibulum ante ipsum primis in faucibus orci
780,Full manufacturer's warranty,183,69.39,ultricies eu nibh quisque id justo sit amet sapien dignissim vestibulum vestibulum ante ipsum primis
781,Standard Manufacturer's,365,78.46,nullam orci pede venenatis non sodales sed tincidunt eu felis fusce posuere felis sed lacus morbi
782,Standard Manufacturer's,183,63.52,morbi porttitor lorem id ligula suspendisse ornare consequat lectus in est risus auctor sed tristique
783,Manufacturer's special warranty,365,86.01,sapien in sapien iaculis congue vivamus metus arcu adipiscing molestie hendrerit
784,Additional reseller's warranty,93,80.32,venenatis lacinia aenean sit amet justo morbi ut odio cras mi pede malesuada in imperdiet et commodo
785,Manufacturer's special warranty,125,65.78,ac tellus semper interdum mauris ullamcorper purus sit amet nulla quisque arcu libero rutrum ac lobortis vel dapibus
786,Full manufacturer's warranty,365,62.39,pharetra magna ac consequat metus sapien ut nunc vestibulum ante ipsum primis in faucibus orci
787,Manufacturer's special warranty,183,97.11,pede lobortis ligula sit amet eleifend pede libero quis orci nullam molestie nibh in lectus pellentesque at nulla suspendisse potenti
788,Manufacturer's special warranty,365,63.51,quam fringilla rhoncus mauris enim leo rhoncus sed vestibulum sit amet cursus id
789,Standard Manufacturer's,365,92.41,sit amet sapien dignissim vestibulum vestibulum ante ipsum primis in faucibus orci luctus et ultrices
790,Additional reseller's warranty,365,66.46,justo in blandit ultrices enim lorem ipsum dolor sit amet consectetuer adipiscing elit proin interdum mauris non ligula pellentesque
791,Manufacturer's special warranty,365,85.61,cras in purus eu magna vulputate luctus cum sociis natoque penatibus et magnis dis parturient montes nascetur
792,Full manufacturer's warranty,125,60.50,natoque penatibus et magnis dis parturient montes nascetur ridiculus mus vivamus
793,Full manufacturer's warranty,125,97.59,vestibulum vestibulum ante ipsum primis in faucibus orci luctus et ultrices posuere cubilia curae nulla dapibus dolor
794,Full manufacturer's warranty,125,83.35,odio porttitor id consequat in consequat ut nulla sed accumsan felis ut at dolor quis odio consequat varius integer ac
795,Manufacturer's special warranty,93,73.33,ligula nec sem duis aliquam convallis nunc proin at turpis a pede posuere nonummy integer non velit donec diam neque
796,Full manufacturer's warranty,548,72.76,integer non velit donec diam neque vestibulum eget vulputate ut ultrices vel augue vestibulum ante ipsum primis
797,Additional reseller's warranty,125,60.77,at velit eu est congue elementum in hac habitasse platea dictumst morbi vestibulum velit
798,Full manufacturer's warranty,125,71.06,quisque ut erat curabitur gravida nisi at nibh in hac habitasse platea dictumst aliquam augue quam sollicitudin vitae
799,Standard Manufacturer's,183,61.27,id sapien in sapien iaculis congue vivamus metus arcu adipiscing molestie hendrerit at vulputate vitae nisl aenean lectus pellentesque
800,Manufacturer's special warranty,183,93.60,enim lorem ipsum dolor sit amet consectetuer adipiscing elit proin interdum mauris
801,Manufacturer's special warranty,125,93.15,quam sapien varius ut blandit non interdum in ante vestibulum ante ipsum primis in faucibus orci luctus et ultrices posuere
802,Standard Manufacturer's,125,98.96,urna pretium nisl ut volutpat sapien arcu sed augue aliquam erat volutpat in congue etiam
803,Additional reseller's warranty,183,69.40,id massa id nisl venenatis lacinia aenean sit amet justo morbi ut odio cras mi pede malesuada
804,Standard Manufacturer's,125,72.04,in hac habitasse platea dictumst etiam faucibus cursus urna ut tellus nulla ut erat id mauris vulputate elementum
805,Manufacturer's special warranty,125,64.90,metus vitae ipsum aliquam non mauris morbi non lectus aliquam sit amet diam in magna bibendum imperdiet nullam orci
806,Additional reseller's warranty,125,79.78,enim leo rhoncus sed vestibulum sit amet cursus id turpis integer aliquet
807,Full manufacturer's warranty,365,89.68,proin risus praesent lectus vestibulum quam sapien varius ut blandit non interdum in
808,Manufacturer's special warranty,548,71.50,nisi volutpat eleifend donec ut dolor morbi vel lectus in quam fringilla rhoncus mauris enim leo rhoncus
809,Manufacturer's special warranty,548,93.60,augue vel accumsan tellus nisi eu orci mauris lacinia sapien quis libero nullam sit amet turpis elementum ligula
810,Standard Manufacturer's,93,87.09,ac consequat metus sapien ut nunc vestibulum ante ipsum primis in faucibus orci luctus et ultrices posuere
811,Full manufacturer's warranty,183,73.58,eleifend pede libero quis orci nullam molestie nibh in lectus pellentesque at nulla suspendisse potenti cras
812,Full manufacturer's warranty,365,87.10,purus aliquet at feugiat non pretium quis lectus suspendisse potenti in eleifend quam a odio in hac habitasse platea dictumst
813,Standard Manufacturer's,125,86.67,nunc purus phasellus in felis donec semper sapien a libero nam dui proin leo odio porttitor id consequat in consequat
814,Additional reseller's warranty,93,80.39,turpis integer aliquet massa id lobortis convallis tortor risus dapibus augue vel
815,Manufacturer's special warranty,365,92.20,ut suscipit a feugiat et eros vestibulum ac est lacinia nisi venenatis tristique fusce congue diam id ornare imperdiet sapien
816,Standard Manufacturer's,125,73.90,tempus semper est quam pharetra magna ac consequat metus sapien ut nunc vestibulum ante ipsum primis in faucibus
817,Standard Manufacturer's,93,64.17,ipsum ac tellus semper interdum mauris ullamcorper purus sit amet
818,Additional reseller's warranty,93,88.06,pede ac diam cras pellentesque volutpat dui maecenas tristique est et tempus semper
819,Full manufacturer's warranty,125,89.22,mauris viverra diam vitae quam suspendisse potenti nullam porttitor lacus at turpis donec posuere
820,Full manufacturer's warranty,548,71.46,phasellus id sapien in sapien iaculis congue vivamus metus arcu adipiscing molestie hendrerit at vulputate vitae
821,Standard Manufacturer's,183,88.70,pede malesuada in imperdiet et commodo vulputate justo in blandit ultrices enim lorem ipsum dolor sit
822,Standard Manufacturer's,365,82.44,pede ullamcorper augue a suscipit nulla elit ac nulla sed vel enim sit amet nunc viverra
823,Full manufacturer's warranty,125,60.20,sit amet sem fusce consequat nulla nisl nunc nisl duis bibendum felis sed interdum
824,Manufacturer's special warranty,548,77.23,neque vestibulum eget vulputate ut ultrices vel augue vestibulum ante ipsum primis in
825,Standard Manufacturer's,183,82.52,praesent blandit lacinia erat vestibulum sed magna at nunc commodo placerat praesent blandit nam nulla integer pede justo lacinia
826,Manufacturer's special warranty,183,96.18,curabitur at ipsum ac tellus semper interdum mauris ullamcorper purus sit amet nulla quisque arcu libero rutrum
827,Standard Manufacturer's,183,84.82,non mi integer ac neque duis bibendum morbi non quam nec dui luctus rutrum nulla tellus
828,Full manufacturer's warranty,93,83.99,duis bibendum felis sed interdum venenatis turpis enim blandit mi in porttitor pede justo eu massa donec dapibus
829,Manufacturer's special warranty,183,82.93,mauris sit amet eros suspendisse accumsan tortor quis turpis sed ante vivamus tortor
830,Full manufacturer's warranty,183,63.22,egestas metus aenean fermentum donec ut mauris eget massa tempor convallis nulla neque
831,Manufacturer's special warranty,125,69.86,integer aliquet massa id lobortis convallis tortor risus dapibus augue vel accumsan tellus nisi
832,Manufacturer's special warranty,183,85.49,turpis adipiscing lorem vitae mattis nibh ligula nec sem duis aliquam convallis nunc proin at turpis
833,Manufacturer's special warranty,183,96.94,nascetur ridiculus mus etiam vel augue vestibulum rutrum rutrum neque aenean auctor gravida sem praesent
834,Full manufacturer's warranty,548,98.82,nibh fusce lacus purus aliquet at feugiat non pretium quis lectus
835,Full manufacturer's warranty,93,87.36,adipiscing elit proin interdum mauris non ligula pellentesque ultrices phasellus id
836,Full manufacturer's warranty,548,89.97,leo pellentesque ultrices mattis odio donec vitae nisi nam ultrices libero non mattis pulvinar nulla
837,Manufacturer's special warranty,365,60.10,lectus in quam fringilla rhoncus mauris enim leo rhoncus sed vestibulum sit amet cursus id turpis integer
838,Manufacturer's special warranty,183,81.06,massa tempor convallis nulla neque libero convallis eget eleifend luctus ultricies eu nibh quisque id
839,Full manufacturer's warranty,93,69.25,curae donec pharetra magna vestibulum aliquet ultrices erat tortor sollicitudin mi sit amet lobortis sapien sapien non mi integer
840,Additional reseller's warranty,548,70.65,diam id ornare imperdiet sapien urna pretium nisl ut volutpat sapien arcu sed augue aliquam
841,Manufacturer's special warranty,548,93.71,commodo placerat praesent blandit nam nulla integer pede justo lacinia eget tincidunt eget
842,Manufacturer's special warranty,548,85.97,venenatis lacinia aenean sit amet justo morbi ut odio cras mi
843,Standard Manufacturer's,183,64.78,potenti cras in purus eu magna vulputate luctus cum sociis
844,Additional reseller's warranty,125,79.86,nulla integer pede justo lacinia eget tincidunt eget tempus vel pede morbi
845,Manufacturer's special warranty,548,88.56,magnis dis parturient montes nascetur ridiculus mus vivamus vestibulum sagittis sapien cum sociis natoque penatibus et magnis dis parturient
846,Full manufacturer's warranty,183,77.83,posuere nonummy integer non velit donec diam neque vestibulum eget vulputate ut ultrices vel augue vestibulum ante
847,Full manufacturer's warranty,365,62.13,mauris non ligula pellentesque ultrices phasellus id sapien in sapien iaculis congue vivamus metus
848,Manufacturer's special warranty,183,73.67,aenean lectus pellentesque eget nunc donec quis orci eget orci vehicula
849,Full manufacturer's warranty,365,77.55,suscipit ligula in lacus curabitur at ipsum ac tellus semper interdum mauris ullamcorper purus sit amet nulla quisque arcu libero
850,Manufacturer's special warranty,365,88.29,at nulla suspendisse potenti cras in purus eu magna vulputate luctus cum sociis
851,Standard Manufacturer's,365,60.78,lacus curabitur at ipsum ac tellus semper interdum mauris ullamcorper purus sit amet nulla quisque
852,Standard Manufacturer's,93,62.67,in consequat ut nulla sed accumsan felis ut at dolor quis odio consequat varius integer ac leo pellentesque ultrices mattis
853,Additional reseller's warranty,93,91.73,integer tincidunt ante vel ipsum praesent blandit lacinia erat vestibulum sed magna at
854,Standard Manufacturer's,125,84.14,erat nulla tempus vivamus in felis eu sapien cursus vestibulum proin eu mi nulla ac enim in tempor turpis nec
855,Additional reseller's warranty,93,68.34,amet nunc viverra dapibus nulla suscipit ligula in lacus curabitur at ipsum ac tellus semper interdum mauris ullamcorper purus sit
856,Additional reseller's warranty,125,83.44,sem duis aliquam convallis nunc proin at turpis a pede posuere nonummy integer non velit donec diam neque
857,Additional reseller's warranty,548,96.90,pharetra magna vestibulum aliquet ultrices erat tortor sollicitudin mi sit amet lobortis
858,Standard Manufacturer's,125,78.14,ornare consequat lectus in est risus auctor sed tristique in tempus sit amet
859,Additional reseller's warranty,125,82.90,nulla ut erat id mauris vulputate elementum nullam varius nulla
860,Full manufacturer's warranty,183,78.66,urna ut tellus nulla ut erat id mauris vulputate elementum nullam
861,Full manufacturer's warranty,365,86.93,ante ipsum primis in faucibus orci luctus et ultrices posuere cubilia curae mauris viverra
862,Additional reseller's warranty,365,60.20,vulputate nonummy maecenas tincidunt lacus at velit vivamus vel nulla eget eros elementum pellentesque quisque porta volutpat erat quisque erat
863,Full manufacturer's warranty,93,94.84,quisque porta volutpat erat quisque erat eros viverra eget congue eget semper rutrum nulla nunc purus phasellus
864,Additional reseller's warranty,365,83.83,lorem id ligula suspendisse ornare consequat lectus in est risus auctor sed tristique in tempus
865,Additional reseller's warranty,365,78.24,suspendisse ornare consequat lectus in est risus auctor sed tristique in tempus sit
866,Manufacturer's special warranty,93,66.25,maecenas tristique est et tempus semper est quam pharetra magna ac consequat metus sapien ut nunc vestibulum ante ipsum
867,Full manufacturer's warranty,183,62.22,est donec odio justo sollicitudin ut suscipit a feugiat et eros vestibulum
868,Full manufacturer's warranty,183,70.17,cum sociis natoque penatibus et magnis dis parturient montes nascetur ridiculus mus
869,Manufacturer's special warranty,93,66.65,odio in hac habitasse platea dictumst maecenas ut massa quis augue luctus tincidunt nulla mollis
870,Full manufacturer's warranty,183,60.77,nisi at nibh in hac habitasse platea dictumst aliquam augue quam sollicitudin vitae consectetuer
871,Manufacturer's special warranty,548,89.32,semper sapien a libero nam dui proin leo odio porttitor id consequat in consequat
872,Manufacturer's special warranty,125,96.56,sed vel enim sit amet nunc viverra dapibus nulla suscipit ligula in lacus curabitur at ipsum
873,Manufacturer's special warranty,183,88.16,molestie lorem quisque ut erat curabitur gravida nisi at nibh in hac
874,Full manufacturer's warranty,93,77.13,at feugiat non pretium quis lectus suspendisse potenti in eleifend quam a odio in hac habitasse platea
875,Manufacturer's special warranty,183,68.93,rhoncus aliquam lacus morbi quis tortor id nulla ultrices aliquet maecenas leo
876,Manufacturer's special warranty,365,81.15,facilisi cras non velit nec nisi vulputate nonummy maecenas tincidunt lacus at
877,Full manufacturer's warranty,183,67.07,sapien quis libero nullam sit amet turpis elementum ligula vehicula consequat morbi a ipsum integer a nibh in quis
878,Manufacturer's special warranty,365,75.79,dui nec nisi volutpat eleifend donec ut dolor morbi vel lectus in quam fringilla rhoncus mauris enim
879,Additional reseller's warranty,183,75.33,ut at dolor quis odio consequat varius integer ac leo pellentesque ultrices mattis odio donec vitae nisi nam ultrices
880,Additional reseller's warranty,365,81.13,ullamcorper augue a suscipit nulla elit ac nulla sed vel enim sit amet nunc
881,Additional reseller's warranty,548,87.90,dui luctus rutrum nulla tellus in sagittis dui vel nisl duis ac nibh fusce lacus purus aliquet at feugiat non
882,Manufacturer's special warranty,125,75.02,felis sed lacus morbi sem mauris laoreet ut rhoncus aliquet pulvinar sed nisl nunc rhoncus dui vel
883,Additional reseller's warranty,183,71.96,sed magna at nunc commodo placerat praesent blandit nam nulla integer pede justo
884,Additional reseller's warranty,183,70.73,nulla quisque arcu libero rutrum ac lobortis vel dapibus at diam
885,Additional reseller's warranty,365,81.30,interdum venenatis turpis enim blandit mi in porttitor pede justo eu massa
886,Manufacturer's special warranty,125,70.97,eget tincidunt eget tempus vel pede morbi porttitor lorem id ligula
887,Manufacturer's special warranty,365,98.45,dictumst etiam faucibus cursus urna ut tellus nulla ut erat id mauris vulputate elementum nullam varius nulla
888,Standard Manufacturer's,125,80.94,parturient montes nascetur ridiculus mus etiam vel augue vestibulum rutrum rutrum neque aenean auctor gravida sem praesent id
889,Standard Manufacturer's,548,64.98,nisl nunc rhoncus dui vel sem sed sagittis nam congue risus semper porta volutpat quam pede
890,Additional reseller's warranty,125,95.54,primis in faucibus orci luctus et ultrices posuere cubilia curae mauris viverra
891,Standard Manufacturer's,365,98.07,feugiat non pretium quis lectus suspendisse potenti in eleifend quam a odio in
892,Full manufacturer's warranty,125,73.40,amet lobortis sapien sapien non mi integer ac neque duis bibendum morbi non quam nec dui luctus
893,Standard Manufacturer's,548,61.65,eget tempus vel pede morbi porttitor lorem id ligula suspendisse ornare consequat lectus in est risus
894,Full manufacturer's warranty,125,69.61,ante ipsum primis in faucibus orci luctus et ultrices posuere cubilia curae
895,Manufacturer's special warranty,365,91.96,at ipsum ac tellus semper interdum mauris ullamcorper purus sit
896,Standard Manufacturer's,183,91.95,purus sit amet nulla quisque arcu libero rutrum ac lobortis vel dapibus at diam nam tristique tortor eu
897,Full manufacturer's warranty,365,77.62,nisi venenatis tristique fusce congue diam id ornare imperdiet sapien urna pretium nisl ut volutpat sapien arcu sed
898,Manufacturer's special warranty,125,89.81,sollicitudin vitae consectetuer eget rutrum at lorem integer tincidunt ante vel ipsum praesent blandit
899,Full manufacturer's warranty,93,67.18,et ultrices posuere cubilia curae nulla dapibus dolor vel est donec odio justo sollicitudin ut suscipit a
900,Standard Manufacturer's,365,95.02,luctus et ultrices posuere cubilia curae duis faucibus accumsan odio curabitur convallis duis consequat dui nec nisi volutpat eleifend donec
901,Standard Manufacturer's,548,82.51,nisl duis ac nibh fusce lacus purus aliquet at feugiat non pretium quis lectus suspendisse potenti in eleifend quam
902,Full manufacturer's warranty,365,61.43,blandit mi in porttitor pede justo eu massa donec dapibus duis at
903,Full manufacturer's warranty,93,88.58,integer a nibh in quis justo maecenas rhoncus aliquam lacus
904,Additional reseller's warranty,93,80.28,turpis elementum ligula vehicula consequat morbi a ipsum integer a nibh in quis justo maecenas rhoncus aliquam
905,Additional reseller's warranty,125,65.43,proin eu mi nulla ac enim in tempor turpis nec euismod
906,Manufacturer's special warranty,93,82.43,elit proin interdum mauris non ligula pellentesque ultrices phasellus id sapien in
907,Additional reseller's warranty,93,60.48,varius nulla facilisi cras non velit nec nisi vulputate nonummy maecenas tincidunt
908,Standard Manufacturer's,125,86.68,vestibulum aliquet ultrices erat tortor sollicitudin mi sit amet lobortis sapien sapien non
909,Full manufacturer's warranty,365,98.69,cubilia curae donec pharetra magna vestibulum aliquet ultrices erat tortor sollicitudin mi sit amet lobortis sapien
910,Standard Manufacturer's,93,73.35,et tempus semper est quam pharetra magna ac consequat metus sapien ut nunc vestibulum ante ipsum primis in faucibus orci
911,Manufacturer's special warranty,93,97.00,vitae mattis nibh ligula nec sem duis aliquam convallis nunc proin at turpis a pede
912,Additional reseller's warranty,365,97.52,tellus nulla ut erat id mauris vulputate elementum nullam varius nulla facilisi cras non velit nec nisi vulputate nonummy
913,Full manufacturer's warranty,125,99.29,adipiscing molestie hendrerit at vulputate vitae nisl aenean lectus pellentesque eget nunc donec quis orci eget orci vehicula condimentum
914,Manufacturer's special warranty,183,68.65,porta volutpat erat quisque erat eros viverra eget congue eget semper rutrum nulla nunc purus phasellus in felis donec
915,Standard Manufacturer's,93,90.80,aenean fermentum donec ut mauris eget massa tempor convallis nulla neque libero convallis eget eleifend luctus ultricies eu
916,Manufacturer's special warranty,548,81.03,sit amet consectetuer adipiscing elit proin interdum mauris non ligula pellentesque
917,Standard Manufacturer's,548,71.90,pede morbi porttitor lorem id ligula suspendisse ornare consequat lectus in est risus auctor sed tristique in tempus sit amet
918,Manufacturer's special warranty,125,81.57,ut volutpat sapien arcu sed augue aliquam erat volutpat in congue etiam
919,Full manufacturer's warranty,125,99.93,proin interdum mauris non ligula pellentesque ultrices phasellus id sapien in sapien iaculis congue vivamus metus arcu adipiscing molestie
920,Standard Manufacturer's,183,69.83,felis fusce posuere felis sed lacus morbi sem mauris laoreet
921,Additional reseller's warranty,183,72.39,sapien a libero nam dui proin leo odio porttitor id consequat in consequat ut nulla sed
922,Standard Manufacturer's,183,90.55,ipsum aliquam non mauris morbi non lectus aliquam sit amet
923,Standard Manufacturer's,183,88.21,non lectus aliquam sit amet diam in magna bibendum imperdiet
924,Additional reseller's warranty,365,69.82,elit ac nulla sed vel enim sit amet nunc viverra dapibus nulla suscipit ligula
925,Standard Manufacturer's,548,93.50,proin leo odio porttitor id consequat in consequat ut nulla sed accumsan felis ut
