GarantyID,NameGaranty,Duration,PriceGaranty,DescriptionGaranty
372,Standard Manufacturer's,365,79.52,sit amet nulla quisque arcu libero rutrum ac lobortis vel dapibus at diam nam tristique tortor eu
373,Standard Manufacturer's,365,81.94,justo sollicitudin ut suscipit a feugiat et eros vestibulum ac est
374,Full manufacturer's warranty,183,87.28,pede malesuada in imperdiet et commodo vulputate justo in blandit ultrices enim
375,Full manufacturer's warranty,183,77.88,scelerisque quam turpis adipiscing lorem vitae mattis nibh ligula nec sem duis aliquam convallis nunc proin
376,Additional reseller's warranty,93,63.50,curabitur convallis duis consequat dui nec nisi volutpat eleifend donec ut dolor
377,Additional reseller's warranty,365,66.72,aliquet at feugiat non pretium quis lectus suspendisse potenti in eleifend quam a odio in hac habitasse platea dictumst
378,Additional reseller's warranty,183,88.10,donec dapibus duis at velit eu est congue elementum in hac habitasse platea
379,Additional reseller's warranty,183,93.90,ipsum primis in faucibus orci luctus et ultrices posuere cubilia curae nulla dapibus dolor vel est donec odio justo sollicitudin
380,Additional reseller's warranty,365,61.30,lorem quisque ut erat curabitur gravida nisi at nibh in hac habitasse platea dictumst aliquam augue quam sollicitudin
381,Additional reseller's warranty,125,87.17,cursus urna ut tellus nulla ut erat id mauris vulputate elementum nullam varius nulla
382,Additional reseller's warranty,548,64.79,odio in hac habitasse platea dictumst maecenas ut massa quis augue luctus tincidunt nulla mollis molestie
383,Full manufacturer's warranty,365,86.34,id consequat in consequat ut nulla sed accumsan felis ut at dolor quis odio consequat varius integer
384,Standard Manufacturer's,548,92.36,nibh in hac habitasse platea dictumst aliquam augue quam sollicitudin vitae consectetuer eget rutrum
385,Additional reseller's warranty,365,78.02,dictumst aliquam augue quam sollicitudin vitae consectetuer eget rutrum at lorem integer tincidunt ante vel ipsum praesent blandit
386,Additional reseller's warranty,548,62.07,bibendum morbi non quam nec dui luctus rutrum nulla tellus in sagittis dui vel nisl duis
387,Full manufacturer's warranty,548,61.13,donec ut dolor morbi vel lectus in quam fringilla rhoncus mauris enim leo rhoncus sed vestibulum
388,Manufacturer's special warranty,125,83.80,etiam justo etiam pretium iaculis justo in hac habitasse platea dictumst etiam faucibus cursus
389,Manufacturer's special warranty,548,82.02,ligula sit amet eleifend pede libero quis orci nullam molestie nibh in lectus pellentesque at nulla suspendisse potenti
390,Additional reseller's warranty,183,94.39,pellentesque quisque porta volutpat erat quisque erat eros viverra eget congue eget semper rutrum nulla nunc purus phasellus in felis
391,Standard Manufacturer's,183,74.22,lectus vestibulum quam sapien varius ut blandit non interdum in ante vestibulum ante ipsum
392,Manufacturer's special warranty,183,69.82,nulla nunc purus phasellus in felis donec semper sapien a libero nam dui proin leo odio
393,Additional reseller's warranty,183,91.60,sit amet diam in magna bibendum imperdiet nullam orci pede venenatis non sodales sed tincidunt eu
394,Standard Manufacturer's,125,61.70,justo in hac habitasse platea dictumst etiam faucibus cursus urna ut tellus nulla ut erat id mauris vulputate
395,Full manufacturer's warranty,93,85.74,nisl aenean lectus pellentesque eget nunc donec quis orci eget orci vehicula condimentum curabitur
396,Additional reseller's warranty,183,66.95,hac habitasse platea dictumst aliquam augue quam sollicitudin vitae consectetuer eget rutrum at lorem integer tincidunt ante vel ipsum praesent
397,Manufacturer's special warranty,365,72.31,eu nibh quisque id justo sit amet sapien dignissim vestibulum vestibulum ante ipsum
398,Manufacturer's special warranty,93,87.51,pulvinar nulla pede ullamcorper augue a suscipit nulla elit ac
399,Manufacturer's special warranty,548,81.94,odio elementum eu interdum eu tincidunt in leo maecenas pulvinar
400,Full manufacturer's warranty,548,77.54,cras in purus eu magna vulputate luctus cum sociis natoque
401,Manufacturer's special warranty,183,93.22,etiam justo etiam pretium iaculis justo in hac habitasse platea dictumst etiam faucibus cursus urna ut tellus nulla ut
402,Full manufacturer's warranty,548,96.28,etiam vel augue vestibulum rutrum rutrum neque aenean auctor gravida sem praesent id massa id
403,Manufacturer's special warranty,365,72.80,convallis nunc proin at turpis a pede posuere nonummy integer non velit donec diam neque vestibulum
404,Manufacturer's special warranty,365,74.62,sapien quis libero nullam sit amet turpis elementum ligula vehicula consequat morbi a ipsum integer a nibh in quis justo
405,Additional reseller's warranty,183,76.63,montes nascetur ridiculus mus etiam vel augue vestibulum rutrum rutrum neque aenean auctor gravida sem praesent id
406,Standard Manufacturer's,125,71.59,ac tellus semper interdum mauris ullamcorper purus sit amet nulla quisque arcu libero rutrum ac lobortis vel
407,Manufacturer's special warranty,93,91.60,diam neque vestibulum eget vulputate ut ultrices vel augue vestibulum ante ipsum
408,Full manufacturer's warranty,548,98.56,amet cursus id turpis integer aliquet massa id lobortis convallis tortor risus dapibus
409,Manufacturer's special warranty,548,84.62,nunc purus phasellus in felis donec semper sapien a libero nam dui proin leo odio porttitor id consequat in
410,Additional reseller's warranty,548,72.23,ligula vehicula consequat morbi a ipsum integer a nibh in quis justo maecenas rhoncus aliquam lacus
411,Full manufacturer's warranty,93,95.76,mattis nibh ligula nec sem duis aliquam convallis nunc proin at turpis a pede posuere
412,Additional reseller's warranty,183,67.79,in purus eu magna vulputate luctus cum sociis natoque penatibus et magnis dis parturient montes nascetur ridiculus
413,Manufacturer's special warranty,548,88.16,morbi vel lectus in quam fringilla rhoncus mauris enim leo rhoncus sed vestibulum sit amet cursus id turpis
414,Standard Manufacturer's,365,68.46,vitae consectetuer eget rutrum at lorem integer tincidunt ante vel ipsum praesent blandit lacinia erat vestibulum sed magna at nunc
415,Standard Manufacturer's,183,61.26,in libero ut massa volutpat convallis morbi odio odio elementum eu interdum
416,Standard Manufacturer's,93,85.49,etiam justo etiam pretium iaculis justo in hac habitasse platea dictumst etiam faucibus
417,Manufacturer's special warranty,365,69.95,lectus pellentesque eget nunc donec quis orci eget orci vehicula condimentum curabitur in
418,Standard Manufacturer's,548,85.60,suscipit a feugiat et eros vestibulum ac est lacinia nisi venenatis tristique
419,Manufacturer's special warranty,183,73.63,leo maecenas pulvinar lobortis est phasellus sit amet erat nulla tempus vivamus in felis eu sapien
420,Standard Manufacturer's,183,89.85,quam nec dui luctus rutrum nulla tellus in sagittis dui vel nisl duis ac nibh fusce lacus purus aliquet
421,Standard Manufacturer's,93,72.28,consequat in consequat ut nulla sed accumsan felis ut at dolor quis odio consequat varius integer ac
422,Manufacturer's special warranty,93,60.84,amet nunc viverra dapibus nulla suscipit ligula in lacus curabitur at ipsum ac tellus semper interdum mauris ullamcorper
423,Standard Manufacturer's,548,70.71,turpis nec euismod scelerisque quam turpis adipiscing lorem vitae mattis nibh
424,Manufacturer's special warranty,93,74.73,mauris ullamcorper purus sit amet nulla quisque arcu libero rutrum ac lobortis vel dapibus at diam nam tristique
425,Full manufacturer's warranty,548,90.10,nisl duis bibendum felis sed interdum venenatis turpis enim blandit
426,Additional reseller's warranty,125,70.98,porttitor id consequat in consequat ut nulla sed accumsan felis ut at dolor quis odio consequat varius integer ac leo
427,Standard Manufacturer's,548,61.38,tortor quis turpis sed ante vivamus tortor duis mattis egestas metus aenean fermentum donec ut mauris
428,Full manufacturer's warranty,183,95.46,congue vivamus metus arcu adipiscing molestie hendrerit at vulputate vitae nisl aenean lectus pellentesque
429,Additional reseller's warranty,93,89.23,cum sociis natoque penatibus et magnis dis parturient montes nascetur
430,Additional reseller's warranty,125,62.09,nisi volutpat eleifend donec ut dolor morbi vel lectus in quam
431,Standard Manufacturer's,548,87.91,suscipit nulla elit ac nulla sed vel enim sit amet nunc viverra
432,Manufacturer's special warranty,548,62.14,nunc viverra dapibus nulla suscipit ligula in lacus curabitur at ipsum ac tellus
433,Standard Manufacturer's,183,62.43,fusce consequat nulla nisl nunc nisl duis bibendum felis sed interdum venenatis turpis enim blandit mi in porttitor pede
434,Full manufacturer's warranty,365,88.69,sed nisl nunc rhoncus dui vel sem sed sagittis nam congue risus semper porta volutpat quam pede lobortis ligula
435,Additional reseller's warranty,125,80.72,est et tempus semper est quam pharetra magna ac consequat metus sapien
436,Standard Manufacturer's,125,87.53,nisi vulputate nonummy maecenas tincidunt lacus at velit vivamus vel nulla eget eros elementum pellentesque
437,Manufacturer's special warranty,183,81.86,posuere cubilia curae nulla dapibus dolor vel est donec odio justo sollicitudin ut suscipit a
438,Standard Manufacturer's,125,76.12,in faucibus orci luctus et ultrices posuere cubilia curae nulla dapibus dolor vel est donec odio justo sollicitudin
439,Additional reseller's warranty,548,91.02,justo maecenas rhoncus aliquam lacus morbi quis tortor id nulla ultrices aliquet maecenas leo odio
440,Manufacturer's special warranty,365,96.81,sollicitudin vitae consectetuer eget rutrum at lorem integer tincidunt ante
441,Standard Manufacturer's,548,60.57,montes nascetur ridiculus mus vivamus vestibulum sagittis sapien cum sociis natoque penatibus et
442,Full manufacturer's warranty,183,83.37,eu felis fusce posuere felis sed lacus morbi sem mauris laoreet
443,Manufacturer's special warranty,365,70.69,nisl duis ac nibh fusce lacus purus aliquet at feugiat non pretium quis lectus suspendisse potenti
444,Standard Manufacturer's,548,93.03,cursus id turpis integer aliquet massa id lobortis convallis tortor risus dapibus augue
445,Full manufacturer's warranty,93,71.94,diam in magna bibendum imperdiet nullam orci pede venenatis non sodales sed tincidunt eu
446,Additional reseller's warranty,365,78.48,magna bibendum imperdiet nullam orci pede venenatis non sodales sed tincidunt eu felis fusce posuere felis
447,Additional reseller's warranty,548,69.12,mus etiam vel augue vestibulum rutrum rutrum neque aenean auctor gravida sem praesent id massa id nisl venenatis lacinia aenean
448,Manufacturer's special warranty,548,74.80,id massa id nisl venenatis lacinia aenean sit amet justo morbi
449,Standard Manufacturer's,183,73.83,pretium quis lectus suspendisse potenti in eleifend quam a odio in hac
450,Standard Manufacturer's,548,71.79,rutrum at lorem integer tincidunt ante vel ipsum praesent blandit lacinia erat vestibulum sed
451,Additional reseller's warranty,548,61.61,nibh in quis justo maecenas rhoncus aliquam lacus morbi quis tortor id nulla ultrices aliquet maecenas leo odio condimentum id
452,Full manufacturer's warranty,125,97.65,libero nullam sit amet turpis elementum ligula vehicula consequat morbi a ipsum integer a nibh in
453,Manufacturer's special warranty,93,73.00,luctus et ultrices posuere cubilia curae nulla dapibus dolor vel est donec odio justo
454,Full manufacturer's warranty,548,92.60,hac habitasse platea dictumst maecenas ut massa quis augue luctus tincidunt nulla mollis molestie lorem quisque ut
455,Additional reseller's warranty,125,89.33,natoque penatibus et magnis dis parturient montes nascetur ridiculus mus vivamus
456,Additional reseller's warranty,93,79.08,suspendisse potenti cras in purus eu magna vulputate luctus cum sociis
457,Full manufacturer's warranty,93,95.77,amet nulla quisque arcu libero rutrum ac lobortis vel dapibus at diam
458,Standard Manufacturer's,183,98.39,eget eros elementum pellentesque quisque porta volutpat erat quisque erat eros viverra eget congue eget semper
459,Standard Manufacturer's,365,68.20,purus sit amet nulla quisque arcu libero rutrum ac lobortis vel dapibus at diam nam tristique tortor eu
460,Full manufacturer's warranty,125,99.62,morbi sem mauris laoreet ut rhoncus aliquet pulvinar sed nisl nunc rhoncus dui vel sem sed sagittis
461,Manufacturer's special warranty,548,89.83,justo nec condimentum neque sapien placerat ante nulla justo aliquam quis turpis eget elit
462,Full manufacturer's warranty,183,63.37,aliquet pulvinar sed nisl nunc rhoncus dui vel sem sed sagittis nam congue risus
463,Standard Manufacturer's,548,96.40,sagittis nam congue risus semper porta volutpat quam pede lobortis ligula sit amet eleifend pede libero
464,Additional reseller's warranty,93,67.62,pretium nisl ut volutpat sapien arcu sed augue aliquam erat volutpat in congue
465,Full manufacturer's warranty,365,83.22,ante ipsum primis in faucibus orci luctus et ultrices posuere cubilia
466,Full manufacturer's warranty,365,69.23,rhoncus dui vel sem sed sagittis nam congue risus semper porta volutpat quam
467,Standard Manufacturer's,365,72.38,diam cras pellentesque volutpat dui maecenas tristique est et tempus semper est quam pharetra magna ac
468,Full manufacturer's warranty,365,64.41,rutrum nulla tellus in sagittis dui vel nisl duis ac nibh fusce lacus purus aliquet at feugiat non pretium
469,Standard Manufacturer's,93,97.96,ultrices phasellus id sapien in sapien iaculis congue vivamus metus arcu adipiscing molestie hendrerit at vulputate vitae
470,Manufacturer's special warranty,125,67.83,diam cras pellentesque volutpat dui maecenas tristique est et tempus semper est quam pharetra magna ac consequat metus
471,Additional reseller's warranty,125,65.61,commodo placerat praesent blandit nam nulla integer pede justo lacinia
472,Additional reseller's warranty,183,74.04,duis at velit eu est congue elementum in hac habitasse platea dictumst morbi vestibulum velit id
473,Manufacturer's special warranty,125,97.34,eget eleifend luctus ultricies eu nibh quisque id justo sit amet sapien dignissim
474,Manufacturer's special warranty,548,78.63,volutpat in congue etiam justo etiam pretium iaculis justo in hac habitasse platea dictumst etiam faucibus cursus urna ut tellus
475,Additional reseller's warranty,365,91.41,arcu sed augue aliquam erat volutpat in congue etiam justo etiam pretium iaculis justo in hac habitasse platea
476,Standard Manufacturer's,365,72.55,penatibus et magnis dis parturient montes nascetur ridiculus mus vivamus vestibulum sagittis sapien cum sociis natoque penatibus et magnis
477,Manufacturer's special warranty,365,64.08,lacus at velit vivamus vel nulla eget eros elementum pellentesque quisque porta volutpat erat quisque erat eros viverra eget
478,Additional reseller's warranty,93,72.84,quam fringilla rhoncus mauris enim leo rhoncus sed vestibulum sit amet cursus id turpis integer aliquet
479,Full manufacturer's warranty,183,77.38,at velit vivamus vel nulla eget eros elementum pellentesque quisque
480,Full manufacturer's warranty,125,91.34,integer a nibh in quis justo maecenas rhoncus aliquam lacus morbi quis tortor id nulla ultrices aliquet maecenas
481,Standard Manufacturer's,125,64.54,neque aenean auctor gravida sem praesent id massa id nisl venenatis lacinia aenean
482,Full manufacturer's warranty,93,64.54,turpis enim blandit mi in porttitor pede justo eu massa donec dapibus duis at velit
483,Additional reseller's warranty,93,62.66,cursus urna ut tellus nulla ut erat id mauris vulputate elementum nullam varius nulla facilisi cras non
484,Manufacturer's special warranty,365,64.84,blandit mi in porttitor pede justo eu massa donec dapibus duis at velit eu est congue
485,Manufacturer's special warranty,93,93.08,mauris laoreet ut rhoncus aliquet pulvinar sed nisl nunc rhoncus dui vel sem sed sagittis nam congue risus
486,Additional reseller's warranty,548,94.66,proin eu mi nulla ac enim in tempor turpis nec euismod scelerisque
487,Manufacturer's special warranty,365,65.43,non mi integer ac neque duis bibendum morbi non quam nec dui luctus rutrum nulla tellus in sagittis dui vel
488,Full manufacturer's warranty,183,66.72,leo odio porttitor id consequat in consequat ut nulla sed accumsan felis
489,Additional reseller's warranty,125,66.44,ac nibh fusce lacus purus aliquet at feugiat non pretium quis lectus suspendisse potenti in
490,Additional reseller's warranty,183,63.85,natoque penatibus et magnis dis parturient montes nascetur ridiculus mus vivamus vestibulum sagittis
491,Standard Manufacturer's,365,90.95,pede libero quis orci nullam molestie nibh in lectus pellentesque at nulla suspendisse potenti cras in purus eu magna vulputate
492,Manufacturer's special warranty,548,77.21,eget vulputate ut ultrices vel augue vestibulum ante ipsum primis in faucibus
493,Manufacturer's special warranty,365,75.34,consequat metus sapien ut nunc vestibulum ante ipsum primis in faucibus orci
494,Manufacturer's special warranty,183,68.85,bibendum imperdiet nullam orci pede venenatis non sodales sed tincidunt
495,Full manufacturer's warranty,365,64.47,enim in tempor turpis nec euismod scelerisque quam turpis adipiscing lorem vitae mattis nibh ligula nec sem duis aliquam
496,Manufacturer's special warranty,93,87.85,enim leo rhoncus sed vestibulum sit amet cursus id turpis integer aliquet massa id lobortis convallis
497,Full manufacturer's warranty,548,94.41,accumsan tortor quis turpis sed ante vivamus tortor duis mattis egestas metus aenean fermentum
498,Full manufacturer's warranty,183,71.03,egestas metus aenean fermentum donec ut mauris eget massa tempor convallis nulla neque libero convallis eget eleifend
499,Full manufacturer's warranty,125,83.75,nibh in lectus pellentesque at nulla suspendisse potenti cras in purus
500,Additional reseller's warranty,93,72.10,natoque penatibus et magnis dis parturient montes nascetur ridiculus mus vivamus vestibulum sagittis sapien cum
501,Additional reseller's warranty,93,66.49,erat tortor sollicitudin mi sit amet lobortis sapien sapien non mi integer ac neque duis bibendum morbi non quam
502,Manufacturer's special warranty,125,74.51,nulla suspendisse potenti cras in purus eu magna vulputate luctus cum sociis natoque penatibus et magnis
503,Full manufacturer's warranty,365,65.38,at nulla suspendisse potenti cras in purus eu magna vulputate luctus cum sociis natoque penatibus et magnis dis parturient montes
504,Additional reseller's warranty,365,74.13,non lectus aliquam sit amet diam in magna bibendum imperdiet nullam orci pede
505,Additional reseller's warranty,365,89.95,at dolor quis odio consequat varius integer ac leo pellentesque ultrices mattis odio donec vitae
506,Standard Manufacturer's,93,69.99,donec quis orci eget orci vehicula condimentum curabitur in libero ut massa volutpat convallis morbi odio odio elementum
507,Additional reseller's warranty,183,72.87,neque libero convallis eget eleifend luctus ultricies eu nibh quisque id justo sit amet sapien dignissim vestibulum vestibulum
508,Full manufacturer's warranty,93,98.96,vivamus metus arcu adipiscing molestie hendrerit at vulputate vitae nisl
509,Standard Manufacturer's,183,76.07,lacinia eget tincidunt eget tempus vel pede morbi porttitor lorem id ligula suspendisse ornare consequat lectus in
510,Manufacturer's special warranty,125,72.91,tincidunt lacus at velit vivamus vel nulla eget eros elementum pellentesque quisque porta
511,Manufacturer's special warranty,548,91.61,in faucibus orci luctus et ultrices posuere cubilia curae nulla dapibus dolor
512,Manufacturer's special warranty,365,69.02,duis at velit eu est congue elementum in hac habitasse platea dictumst morbi
513,Additional reseller's warranty,93,81.32,cursus urna ut tellus nulla ut erat id mauris vulputate elementum
514,Manufacturer's special warranty,365,76.28,nulla elit ac nulla sed vel enim sit amet nunc viverra dapibus nulla suscipit ligula in lacus
515,Standard Manufacturer's,548,77.71,lorem ipsum dolor sit amet consectetuer adipiscing elit proin risus praesent
516,Standard Manufacturer's,125,74.36,magnis dis parturient montes nascetur ridiculus mus etiam vel augue vestibulum rutrum rutrum neque aenean auctor gravida
517,Additional reseller's warranty,183,81.39,et ultrices posuere cubilia curae donec pharetra magna vestibulum aliquet
518,Manufacturer's special warranty,93,96.36,nunc proin at turpis a pede posuere nonummy integer non velit donec diam neque vestibulum
519,Standard Manufacturer's,125,98.50,nisi nam ultrices libero non mattis pulvinar nulla pede ullamcorper augue a suscipit
520,Standard Manufacturer's,125,60.71,porta volutpat quam pede lobortis ligula sit amet eleifend pede libero quis orci nullam molestie nibh in lectus pellentesque
521,Additional reseller's warranty,365,93.99,libero ut massa volutpat convallis morbi odio odio elementum eu interdum eu tincidunt in leo maecenas pulvinar
522,Additional reseller's warranty,183,80.80,pretium iaculis justo in hac habitasse platea dictumst etiam faucibus
523,Standard Manufacturer's,125,99.78,elit sodales scelerisque mauris sit amet eros suspendisse accumsan tortor
524,Full manufacturer's warranty,125,91.74,massa donec dapibus duis at velit eu est congue elementum in hac habitasse platea dictumst morbi vestibulum velit id pretium
525,Full manufacturer's warranty,183,80.00,fringilla rhoncus mauris enim leo rhoncus sed vestibulum sit amet cursus
526,Full manufacturer's warranty,93,70.52,id sapien in sapien iaculis congue vivamus metus arcu adipiscing molestie hendrerit at vulputate vitae nisl
527,Standard Manufacturer's,365,96.98,nisl venenatis lacinia aenean sit amet justo morbi ut odio cras
528,Standard Manufacturer's,365,62.11,aliquet at feugiat non pretium quis lectus suspendisse potenti in
529,Additional reseller's warranty,183,98.53,non velit nec nisi vulputate nonummy maecenas tincidunt lacus at velit vivamus vel
530,Manufacturer's special warranty,365,79.18,ut at dolor quis odio consequat varius integer ac leo pellentesque ultrices mattis odio donec vitae nisi nam ultrices
531,Additional reseller's warranty,548,90.05,mauris enim leo rhoncus sed vestibulum sit amet cursus id turpis integer aliquet massa id lobortis convallis
532,Additional reseller's warranty,548,98.10,quis turpis eget elit sodales scelerisque mauris sit amet eros suspendisse accumsan tortor quis turpis sed
533,Manufacturer's special warranty,93,76.50,volutpat quam pede lobortis ligula sit amet eleifend pede libero quis
534,Standard Manufacturer's,93,79.29,id ornare imperdiet sapien urna pretium nisl ut volutpat sapien arcu sed
535,Manufacturer's special warranty,125,95.83,suscipit ligula in lacus curabitur at ipsum ac tellus semper interdum mauris ullamcorper purus sit amet nulla
536,Standard Manufacturer's,548,72.93,dapibus duis at velit eu est congue elementum in hac habitasse platea dictumst morbi vestibulum velit id pretium iaculis
537,Standard Manufacturer's,93,91.65,morbi sem mauris laoreet ut rhoncus aliquet pulvinar sed nisl nunc rhoncus dui vel sem sed sagittis
538,Full manufacturer's warranty,125,96.20,proin leo odio porttitor id consequat in consequat ut nulla sed accumsan felis ut
539,Manufacturer's special warranty,125,99.13,at nulla suspendisse potenti cras in purus eu magna vulputate luctus cum sociis
540,Additional reseller's warranty,125,67.53,ornare consequat lectus in est risus auctor sed tristique in tempus sit amet sem fusce consequat nulla nisl nunc
541,Full manufacturer's warranty,548,78.09,vulputate luctus cum sociis natoque penatibus et magnis dis parturient montes nascetur ridiculus mus
542,Additional reseller's warranty,548,63.22,mus etiam vel augue vestibulum rutrum rutrum neque aenean auctor
543,Standard Manufacturer's,125,97.35,quis turpis eget elit sodales scelerisque mauris sit amet eros suspendisse accumsan tortor quis turpis sed ante vivamus
544,Manufacturer's special warranty,93,77.09,amet eros suspendisse accumsan tortor quis turpis sed ante vivamus tortor
545,Manufacturer's special warranty,365,91.17,eu orci mauris lacinia sapien quis libero nullam sit amet turpis elementum ligula vehicula consequat morbi a ipsum integer a
546,Standard Manufacturer's,125,87.72,morbi vel lectus in quam fringilla rhoncus mauris enim leo rhoncus sed vestibulum sit amet cursus
547,Full manufacturer's warranty,125,67.69,diam in magna bibendum imperdiet nullam orci pede venenatis non sodales sed
548,Additional reseller's warranty,183,70.80,dis parturient montes nascetur ridiculus mus etiam vel augue vestibulum
549,Manufacturer's special warranty,548,62.09,vulputate luctus cum sociis natoque penatibus et magnis dis parturient montes nascetur ridiculus mus vivamus vestibulum sagittis sapien cum sociis
550,Standard Manufacturer's,93,63.68,accumsan odio curabitur convallis duis consequat dui nec nisi volutpat eleifend donec ut dolor morbi vel lectus in quam fringilla
551,Additional reseller's warranty,125,69.01,sapien a libero nam dui proin leo odio porttitor id consequat in consequat ut nulla
552,Full manufacturer's warranty,93,84.64,non velit nec nisi vulputate nonummy maecenas tincidunt lacus at velit vivamus vel nulla eget
553,Full manufacturer's warranty,93,94.26,odio condimentum id luctus nec molestie sed justo pellentesque viverra pede ac diam cras
554,Standard Manufacturer's,93,77.72,in libero ut massa volutpat convallis morbi odio odio elementum eu interdum eu tincidunt in
555,Manufacturer's special warranty,183,94.67,aliquet pulvinar sed nisl nunc rhoncus dui vel sem sed sagittis nam congue risus semper porta volutpat quam pede
556,Standard Manufacturer's,125,62.17,sit amet turpis elementum ligula vehicula consequat morbi a ipsum integer a
557,Standard Manufacturer's,183,74.16,a odio in hac habitasse platea dictumst maecenas ut massa quis augue
