GarantyID,NameGaranty,Duration,PriceGaranty,DescriptionGaranty
191,Additional reseller's warranty,365,63.32,sollicitudin vitae consectetuer eget rutrum at lorem integer tincidunt ante vel
192,Full manufacturer's warranty,365,93.47,imperdiet sapien urna pretium nisl ut volutpat sapien arcu sed augue aliquam
193,Additional reseller's warranty,93,64.04,eu magna vulputate luctus cum sociis natoque penatibus et magnis dis parturient montes nascetur ridiculus
194,Full manufacturer's warranty,93,86.59,ut ultrices vel augue vestibulum ante ipsum primis in faucibus orci luctus et ultrices posuere cubilia
195,Full manufacturer's warranty,183,94.68,mi sit amet lobortis sapien sapien non mi integer ac neque duis bibendum morbi non quam nec dui luctus rutrum
196,Additional reseller's warranty,183,74.37,venenatis turpis enim blandit mi in porttitor pede justo eu massa donec dapibus duis at velit eu est
197,Manufacturer's special warranty,125,81.08,integer tincidunt ante vel ipsum praesent blandit lacinia erat vestibulum sed magna
198,Standard Manufacturer's,183,94.10,ut odio cras mi pede malesuada in imperdiet et commodo vulputate justo in blandit ultrices enim lorem ipsum dolor
199,Manufacturer's special warranty,125,87.76,venenatis turpis enim blandit mi in porttitor pede justo eu massa donec dapibus duis at
200,Full manufacturer's warranty,183,76.25,amet turpis elementum ligula vehicula consequat morbi a ipsum integer a nibh in quis justo
201,Additional reseller's warranty,183,64.26,vel lectus in quam fringilla rhoncus mauris enim leo rhoncus sed vestibulum sit amet cursus id turpis integer aliquet massa
202,Manufacturer's special warranty,93,88.38,fusce congue diam id ornare imperdiet sapien urna pretium nisl ut volutpat sapien arcu sed augue aliquam erat volutpat in
203,Standard Manufacturer's,183,69.29,nam dui proin leo odio porttitor id consequat in consequat ut nulla sed accumsan felis ut at dolor quis odio
204,Additional reseller's warranty,548,66.07,sit amet diam in magna bibendum imperdiet nullam orci pede venenatis non sodales sed tincidunt eu felis fusce posuere
205,Standard Manufacturer's,548,72.13,turpis elementum ligula vehicula consequat morbi a ipsum integer a nibh in quis justo maecenas rhoncus aliquam
206,Manufacturer's special warranty,183,85.26,habitasse platea dictumst maecenas ut massa quis augue luctus tincidunt nulla mollis molestie lorem quisque
207,Additional reseller's warranty,93,96.51,in est risus auctor sed tristique in tempus sit amet sem fusce consequat nulla nisl nunc nisl duis
208,Additional reseller's warranty,93,86.80,felis sed lacus morbi sem mauris laoreet ut rhoncus aliquet pulvinar sed nisl nunc rhoncus dui vel sem sed sagittis
209,Standard Manufacturer's,125,83.88,ultrices posuere cubilia curae duis faucibus accumsan odio curabitur convallis duis consequat dui nec nisi volutpat eleifend donec
210,Full manufacturer's warranty,125,68.78,ipsum dolor sit amet consectetuer adipiscing elit proin risus praesent
211,Additional reseller's warranty,548,67.59,primis in faucibus orci luctus et ultrices posuere cubilia curae duis faucibus
212,Additional reseller's warranty,365,72.32,lacinia eget tincidunt eget tempus vel pede morbi porttitor lorem id ligula suspendisse ornare consequat lectus
213,Manufacturer's special warranty,365,76.60,porta volutpat erat quisque erat eros viverra eget congue eget semper rutrum nulla nunc
214,Additional reseller's warranty,93,86.55,id ligula suspendisse ornare consequat lectus in est risus auctor sed tristique in tempus sit amet sem
215,Standard Manufacturer's,548,76.31,maecenas pulvinar lobortis est phasellus sit amet erat nulla tempus vivamus
216,Additional reseller's warranty,93,67.38,in libero ut massa volutpat convallis morbi odio odio elementum eu interdum eu tincidunt in leo maecenas pulvinar
217,Manufacturer's special warranty,365,62.43,porttitor id consequat in consequat ut nulla sed accumsan felis ut at dolor quis odio consequat
218,Manufacturer's special warranty,93,92.57,feugiat non pretium quis lectus suspendisse potenti in eleifend quam a odio in hac habitasse platea
219,Full manufacturer's warranty,548,67.96,scelerisque mauris sit amet eros suspendisse accumsan tortor quis turpis sed ante vivamus tortor duis mattis egestas metus aenean fermentum
220,Full manufacturer's warranty,548,62.26,volutpat sapien arcu sed augue aliquam erat volutpat in congue etiam
221,Additional reseller's warranty,183,87.31,eleifend donec ut dolor morbi vel lectus in quam fringilla rhoncus mauris enim leo rhoncus sed vestibulum sit amet
222,Manufacturer's special warranty,183,95.76,quisque porta volutpat erat quisque erat eros viverra eget congue
223,Full manufacturer's warranty,125,88.79,cras in purus eu magna vulputate luctus cum sociis natoque penatibus et magnis
224,Additional reseller's warranty,365,73.44,amet sapien dignissim vestibulum vestibulum ante ipsum primis in faucibus orci luctus et ultrices posuere cubilia curae nulla dapibus dolor
225,Standard Manufacturer's,183,69.65,diam id ornare imperdiet sapien urna pretium nisl ut volutpat sapien arcu sed augue aliquam erat volutpat in congue
226,Standard Manufacturer's,183,88.67,ac leo pellentesque ultrices mattis odio donec vitae nisi nam ultrices libero non mattis pulvinar nulla pede ullamcorper
227,Standard Manufacturer's,125,97.91,scelerisque mauris sit amet eros suspendisse accumsan tortor quis turpis sed ante vivamus tortor duis mattis egestas metus
228,Standard Manufacturer's,548,62.22,quam sollicitudin vitae consectetuer eget rutrum at lorem integer tincidunt
229,Manufacturer's special warranty,183,63.89,eu magna vulputate luctus cum sociis natoque penatibus et magnis dis parturient montes nascetur ridiculus mus vivamus vestibulum sagittis
230,Additional reseller's warranty,125,76.36,ut dolor morbi vel lectus in quam fringilla rhoncus mauris enim leo rhoncus sed vestibulum sit
231,Additional reseller's warranty,125,95.86,semper sapien a libero nam dui proin leo odio porttitor id consequat in consequat ut nulla
232,Full manufacturer's warranty,548,76.95,ultrices posuere cubilia curae donec pharetra magna vestibulum aliquet ultrices erat tortor sollicitudin mi sit amet lobortis sapien sapien
233,Standard Manufacturer's,548,89.15,odio consequat varius integer ac leo pellentesque ultrices mattis odio donec vitae nisi nam ultrices libero non mattis pulvinar
234,Additional reseller's warranty,125,60.05,cras mi pede malesuada in imperdiet et commodo vulputate justo in blandit ultrices enim lorem ipsum
235,Additional reseller's warranty,125,95.39,tincidunt ante vel ipsum praesent blandit lacinia erat vestibulum sed
236,Standard Manufacturer's,125,60.27,platea dictumst aliquam augue quam sollicitudin vitae consectetuer eget rutrum at
237,Additional reseller's warranty,125,83.24,diam vitae quam suspendisse potenti nullam porttitor lacus at turpis donec
238,Manufacturer's special warranty,125,79.68,ullamcorper purus sit amet nulla quisque arcu libero rutrum ac lobortis vel dapibus at diam nam tristique tortor eu
239,Manufacturer's special warranty,548,62.20,penatibus et magnis dis parturient montes nascetur ridiculus mus vivamus vestibulum sagittis sapien cum sociis natoque penatibus et magnis dis
240,Full manufacturer's warranty,365,60.12,elementum in hac habitasse platea dictumst morbi vestibulum velit id pretium iaculis diam erat fermentum justo nec
241,Standard Manufacturer's,365,93.86,habitasse platea dictumst maecenas ut massa quis augue luctus tincidunt nulla mollis molestie lorem quisque ut erat curabitur
242,Standard Manufacturer's,365,99.83,tellus nisi eu orci mauris lacinia sapien quis libero nullam sit amet turpis elementum ligula vehicula consequat morbi
243,Manufacturer's special warranty,93,84.10,non interdum in ante vestibulum ante ipsum primis in faucibus orci luctus et
244,Standard Manufacturer's,365,82.26,luctus et ultrices posuere cubilia curae duis faucibus accumsan odio
245,Standard Manufacturer's,93,96.04,pede ullamcorper augue a suscipit nulla elit ac nulla sed vel enim sit amet nunc
246,Full manufacturer's warranty,365,84.69,luctus tincidunt nulla mollis molestie lorem quisque ut erat curabitur gravida nisi at nibh in hac habitasse platea
247,Additional reseller's warranty,365,84.83,volutpat convallis morbi odio odio elementum eu interdum eu tincidunt in leo maecenas pulvinar lobortis est
248,Additional reseller's warranty,365,98.34,erat nulla tempus vivamus in felis eu sapien cursus vestibulum proin eu mi
249,Full manufacturer's warranty,125,70.24,sit amet consectetuer adipiscing elit proin risus praesent lectus vestibulum quam sapien varius ut blandit non interdum in ante
250,Standard Manufacturer's,93,73.26,justo maecenas rhoncus aliquam lacus morbi quis tortor id nulla ultrices aliquet maecenas leo odio condimentum id luctus nec
251,Standard Manufacturer's,548,68.35,donec quis orci eget orci vehicula condimentum curabitur in libero ut massa volutpat convallis morbi odio odio elementum eu interdum
252,Full manufacturer's warranty,93,74.26,eleifend donec ut dolor morbi vel lectus in quam fringilla rhoncus mauris enim leo
253,Standard Manufacturer's,125,78.52,cursus id turpis integer aliquet massa id lobortis convallis tortor risus dapibus
254,Additional reseller's warranty,183,63.71,tellus nisi eu orci mauris lacinia sapien quis libero nullam sit amet turpis elementum
255,Manufacturer's special warranty,93,63.12,quis orci nullam molestie nibh in lectus pellentesque at nulla suspendisse potenti cras in purus eu magna vulputate luctus
256,Manufacturer's special warranty,183,77.72,risus auctor sed tristique in tempus sit amet sem fusce consequat nulla nisl
257,Standard Manufacturer's,365,60.28,fermentum donec ut mauris eget massa tempor convallis nulla neque libero convallis eget eleifend luctus ultricies eu
258,Full manufacturer's warranty,548,78.26,duis ac nibh fusce lacus purus aliquet at feugiat non pretium quis lectus suspendisse potenti in
259,Full manufacturer's warranty,125,67.67,cum sociis natoque penatibus et magnis dis parturient montes nascetur ridiculus mus etiam vel augue vestibulum
260,Manufacturer's special warranty,183,94.24,quis libero nullam sit amet turpis elementum ligula vehicula consequat morbi a ipsum integer a nibh in quis justo maecenas
261,Full manufacturer's warranty,365,82.81,vestibulum vestibulum ante ipsum primis in faucibus orci luctus et ultrices posuere cubilia curae nulla dapibus
262,Manufacturer's special warranty,548,88.53,lorem id ligula suspendisse ornare consequat lectus in est risus auctor sed tristique in tempus sit
263,Manufacturer's special warranty,548,77.89,duis at velit eu est congue elementum in hac habitasse platea dictumst morbi
264,Manufacturer's special warranty,93,73.10,blandit ultrices enim lorem ipsum dolor sit amet consectetuer adipiscing elit proin interdum mauris non ligula pellentesque ultrices phasellus
265,Full manufacturer's warranty,548,72.42,nibh in lectus pellentesque at nulla suspendisse potenti cras in purus eu
266,Additional reseller's warranty,183,85.38,lobortis ligula sit amet eleifend pede libero quis orci nullam molestie nibh in lectus pellentesque at nulla suspendisse potenti cras
267,Manufacturer's special warranty,125,69.19,nulla tempus vivamus in felis eu sapien cursus vestibulum proin eu mi nulla ac enim in tempor
268,Full manufacturer's warranty,365,92.54,cubilia curae duis faucibus accumsan odio curabitur convallis duis consequat dui
269,Additional reseller's warranty,548,73.03,tellus semper interdum mauris ullamcorper purus sit amet nulla quisque arcu libero rutrum ac lobortis vel dapibus at diam
270,Standard Manufacturer's,93,83.53,massa quis augue luctus tincidunt nulla mollis molestie lorem quisque ut
271,Additional reseller's warranty,548,91.10,metus aenean fermentum donec ut mauris eget massa tempor convallis nulla neque libero convallis eget eleifend luctus ultricies eu
272,Standard Manufacturer's,183,78.98,luctus et ultrices posuere cubilia curae mauris viverra diam vitae quam suspendisse potenti nullam porttitor lacus
273,Standard Manufacturer's,183,76.88,felis eu sapien cursus vestibulum proin eu mi nulla ac enim in tempor turpis nec euismod scelerisque
274,Additional reseller's warranty,125,60.27,adipiscing lorem vitae mattis nibh ligula nec sem duis aliquam convallis nunc proin at turpis a pede posuere nonummy integer
275,Manufacturer's special warranty,93,90.14,ac leo pellentesque ultrices mattis odio donec vitae nisi nam ultrices libero non mattis pulvinar nulla pede ullamcorper augue
276,Additional reseller's warranty,365,89.01,vestibulum ac est lacinia nisi venenatis tristique fusce congue diam id ornare imperdiet sapien urna pretium nisl ut volutpat
277,Full manufacturer's warranty,183,89.34,ligula suspendisse ornare consequat lectus in est risus auctor sed tristique in tempus sit amet
278,Full manufacturer's warranty,125,87.82,turpis donec posuere metus vitae ipsum aliquam non mauris morbi non lectus aliquam sit
279,Full manufacturer's warranty,183,74.78,felis eu sapien cursus vestibulum proin eu mi nulla ac enim in tempor turpis nec euismod
280,Standard Manufacturer's,125,66.52,morbi non quam nec dui luctus rutrum nulla tellus in
281,Standard Manufacturer's,93,91.65,venenatis tristique fusce congue diam id ornare imperdiet sapien urna pretium nisl ut volutpat sapien arcu sed augue aliquam
282,Additional reseller's warranty,548,98.13,vestibulum ac est lacinia nisi venenatis tristique fusce congue diam id ornare imperdiet sapien urna pretium nisl
283,Standard Manufacturer's,183,98.27,eleifend luctus ultricies eu nibh quisque id justo sit amet sapien
284,Additional reseller's warranty,365,87.07,risus praesent lectus vestibulum quam sapien varius ut blandit non interdum in ante vestibulum ante ipsum primis in
285,Standard Manufacturer's,365,63.12,est phasellus sit amet erat nulla tempus vivamus in felis eu sapien cursus vestibulum proin eu mi
286,Standard Manufacturer's,125,91.44,habitasse platea dictumst maecenas ut massa quis augue luctus tincidunt nulla mollis molestie
287,Manufacturer's special warranty,548,96.67,ridiculus mus vivamus vestibulum sagittis sapien cum sociis natoque penatibus
288,Additional reseller's warranty,548,71.51,ridiculus mus vivamus vestibulum sagittis sapien cum sociis natoque penatibus
289,Standard Manufacturer's,548,72.68,commodo placerat praesent blandit nam nulla integer pede justo lacinia
290,Standard Manufacturer's,93,99.26,mauris viverra diam vitae quam suspendisse potenti nullam porttitor lacus at turpis donec posuere metus vitae ipsum
291,Full manufacturer's warranty,93,62.90,tellus semper interdum mauris ullamcorper purus sit amet nulla quisque arcu libero rutrum ac lobortis
292,Standard Manufacturer's,183,69.36,proin interdum mauris non ligula pellentesque ultrices phasellus id sapien in sapien iaculis congue vivamus metus arcu
293,Standard Manufacturer's,125,71.79,sit amet cursus id turpis integer aliquet massa id lobortis convallis tortor
294,Additional reseller's warranty,93,82.16,vel est donec odio justo sollicitudin ut suscipit a feugiat et eros vestibulum
295,Full manufacturer's warranty,183,72.03,nunc donec quis orci eget orci vehicula condimentum curabitur in
296,Standard Manufacturer's,548,98.82,mollis molestie lorem quisque ut erat curabitur gravida nisi at
297,Standard Manufacturer's,365,96.60,pellentesque volutpat dui maecenas tristique est et tempus semper est quam pharetra
298,Full manufacturer's warranty,365,95.17,vestibulum ante ipsum primis in faucibus orci luctus et ultrices posuere cubilia curae donec pharetra magna
299,Full manufacturer's warranty,365,66.60,in consequat ut nulla sed accumsan felis ut at dolor quis odio
300,Full manufacturer's warranty,548,96.21,velit eu est congue elementum in hac habitasse platea dictumst morbi vestibulum velit id pretium iaculis diam erat
301,Full manufacturer's warranty,125,70.65,eleifend pede libero quis orci nullam molestie nibh in lectus pellentesque at nulla suspendisse potenti cras in
302,Full manufacturer's warranty,93,93.94,orci luctus et ultrices posuere cubilia curae duis faucibus accumsan odio curabitur convallis duis consequat dui
303,Additional reseller's warranty,125,68.27,ipsum praesent blandit lacinia erat vestibulum sed magna at nunc commodo placerat praesent blandit nam nulla integer pede justo
304,Full manufacturer's warranty,365,89.23,mattis pulvinar nulla pede ullamcorper augue a suscipit nulla elit ac nulla sed vel enim sit amet nunc viverra
305,Manufacturer's special warranty,365,74.68,cursus vestibulum proin eu mi nulla ac enim in tempor turpis nec euismod scelerisque quam turpis adipiscing lorem vitae
306,Manufacturer's special warranty,183,87.55,faucibus orci luctus et ultrices posuere cubilia curae duis faucibus accumsan odio curabitur convallis duis consequat dui nec nisi
307,Standard Manufacturer's,548,99.65,tempus semper est quam pharetra magna ac consequat metus sapien ut nunc vestibulum ante ipsum primis in faucibus
308,Additional reseller's warranty,183,60.19,vestibulum vestibulum ante ipsum primis in faucibus orci luctus et ultrices posuere cubilia curae nulla
309,Manufacturer's special warranty,365,90.87,eros elementum pellentesque quisque porta volutpat erat quisque erat eros
310,Standard Manufacturer's,365,98.98,velit eu est congue elementum in hac habitasse platea dictumst morbi vestibulum velit id pretium iaculis diam
311,Manufacturer's special warranty,183,62.84,sed vel enim sit amet nunc viverra dapibus nulla suscipit ligula in lacus curabitur at ipsum ac tellus semper interdum
312,Full manufacturer's warranty,93,81.70,aliquam lacus morbi quis tortor id nulla ultrices aliquet maecenas leo
313,Full manufacturer's warranty,548,88.77,feugiat non pretium quis lectus suspendisse potenti in eleifend quam a odio in hac habitasse
314,Additional reseller's warranty,548,95.76,nullam sit amet turpis elementum ligula vehicula consequat morbi a ipsum integer
315,Additional reseller's warranty,93,89.11,nisi volutpat eleifend donec ut dolor morbi vel lectus in quam
316,Additional reseller's warranty,548,98.55,pharetra magna ac consequat metus sapien ut nunc vestibulum ante ipsum primis
317,Manufacturer's special warranty,365,66.50,in hac habitasse platea dictumst aliquam augue quam sollicitudin vitae
318,Manufacturer's special warranty,93,98.20,ut blandit non interdum in ante vestibulum ante ipsum primis in faucibus orci luctus et ultrices
319,Manufacturer's special warranty,125,68.61,sagittis dui vel nisl duis ac nibh fusce lacus purus aliquet at feugiat non pretium quis lectus
320,Full manufacturer's warranty,93,78.36,ligula vehicula consequat morbi a ipsum integer a nibh in quis justo maecenas rhoncus aliquam
321,Full manufacturer's warranty,125,98.19,enim sit amet nunc viverra dapibus nulla suscipit ligula in lacus curabitur at ipsum ac tellus semper interdum
322,Standard Manufacturer's,365,68.46,erat vestibulum sed magna at nunc commodo placerat praesent blandit nam nulla integer pede justo lacinia
323,Manufacturer's special warranty,183,66.41,velit eu est congue elementum in hac habitasse platea dictumst morbi vestibulum velit id
324,Additional reseller's warranty,93,61.29,ipsum praesent blandit lacinia erat vestibulum sed magna at nunc commodo placerat praesent blandit nam
325,Manufacturer's special warranty,548,73.99,tortor duis mattis egestas metus aenean fermentum donec ut mauris
326,Manufacturer's special warranty,183,82.95,libero nullam sit amet turpis elementum ligula vehicula consequat morbi a ipsum integer a nibh in
327,Standard Manufacturer's,365,62.63,sociis natoque penatibus et magnis dis parturient montes nascetur ridiculus mus vivamus vestibulum sagittis sapien cum sociis natoque penatibus et
328,Standard Manufacturer's,125,81.42,orci pede venenatis non sodales sed tincidunt eu felis fusce posuere felis sed lacus morbi sem mauris laoreet
329,Standard Manufacturer's,365,91.64,ridiculus mus etiam vel augue vestibulum rutrum rutrum neque aenean auctor
330,Standard Manufacturer's,93,92.81,gravida nisi at nibh in hac habitasse platea dictumst aliquam augue quam sollicitudin vitae consectetuer eget rutrum at lorem integer
331,Full manufacturer's warranty,365,63.91,faucibus cursus urna ut tellus nulla ut erat id mauris vulputate elementum
332,Standard Manufacturer's,548,81.48,tristique est et tempus semper est quam pharetra magna ac consequat metus sapien ut nunc
333,Additional reseller's warranty,365,69.25,duis ac nibh fusce lacus purus aliquet at feugiat non pretium quis lectus suspendisse potenti in eleifend quam a
334,Standard Manufacturer's,365,81.82,lectus vestibulum quam sapien varius ut blandit non interdum in ante vestibulum ante ipsum primis in faucibus
335,Additional reseller's warranty,365,73.53,tempus sit amet sem fusce consequat nulla nisl nunc nisl duis bibendum felis sed interdum venenatis turpis enim blandit mi
336,Additional reseller's warranty,548,60.61,ultrices libero non mattis pulvinar nulla pede ullamcorper augue a suscipit nulla elit ac nulla sed vel
337,Manufacturer's special warranty,125,94.09,accumsan tortor quis turpis sed ante vivamus tortor duis mattis egestas metus aenean fermentum donec ut
338,Additional reseller's warranty,365,70.49,quis justo maecenas rhoncus aliquam lacus morbi quis tortor id
339,Manufacturer's special warranty,548,78.38,cubilia curae mauris viverra diam vitae quam suspendisse potenti nullam porttitor lacus at turpis donec posuere
340,Additional reseller's warranty,183,81.67,orci eget orci vehicula condimentum curabitur in libero ut massa volutpat convallis morbi odio odio elementum eu interdum eu tincidunt
341,Manufacturer's special warranty,125,95.89,dapibus duis at velit eu est congue elementum in hac habitasse platea dictumst morbi vestibulum
342,Additional reseller's warranty,365,77.21,montes nascetur ridiculus mus vivamus vestibulum sagittis sapien cum sociis natoque penatibus
343,Full manufacturer's warranty,365,61.79,cum sociis natoque penatibus et magnis dis parturient montes nascetur ridiculus mus vivamus vestibulum sagittis sapien
344,Manufacturer's special warranty,365,73.52,accumsan odio curabitur convallis duis consequat dui nec nisi volutpat eleifend donec ut dolor morbi vel lectus in quam fringilla
345,Additional reseller's warranty,548,84.31,nisl aenean lectus pellentesque eget nunc donec quis orci eget orci vehicula
346,Standard Manufacturer's,183,81.16,ligula in lacus curabitur at ipsum ac tellus semper interdum mauris ullamcorper purus sit
347,Additional reseller's warranty,548,76.58,ultrices enim lorem ipsum dolor sit amet consectetuer adipiscing elit
348,Full manufacturer's warranty,548,60.91,pretium iaculis justo in hac habitasse platea dictumst etiam faucibus cursus
349,Standard Manufacturer's,125,61.50,vestibulum sagittis sapien cum sociis natoque penatibus et magnis dis parturient montes nascetur ridiculus mus etiam vel
350,Standard Manufacturer's,365,99.97,volutpat quam pede lobortis ligula sit amet eleifend pede libero quis orci nullam molestie
351,Manufacturer's special warranty,183,83.23,orci luctus et ultrices posuere cubilia curae nulla dapibus dolor vel est donec odio
352,Standard Manufacturer's,93,97.15,iaculis diam erat fermentum justo nec condimentum neque sapien placerat ante nulla
353,Manufacturer's special warranty,548,86.46,varius integer ac leo pellentesque ultrices mattis odio donec vitae nisi nam ultrices
354,Manufacturer's special warranty,93,75.95,sem duis aliquam convallis nunc proin at turpis a pede posuere
355,Full manufacturer's warranty,183,70.73,parturient montes nascetur ridiculus mus vivamus vestibulum sagittis sapien cum sociis natoque penatibus et magnis dis parturient
356,Manufacturer's special warranty,93,96.28,blandit ultrices enim lorem ipsum dolor sit amet consectetuer adipiscing elit proin interdum
357,Additional reseller's warranty,548,66.98,risus praesent lectus vestibulum quam sapien varius ut blandit non interdum in ante vestibulum ante ipsum primis
358,Additional reseller's warranty,183,84.93,est congue elementum in hac habitasse platea dictumst morbi vestibulum velit id pretium iaculis diam erat fermentum justo nec
359,Full manufacturer's warranty,365,94.37,imperdiet sapien urna pretium nisl ut volutpat sapien arcu sed augue aliquam erat volutpat
360,Manufacturer's special warranty,183,67.45,nulla pede ullamcorper augue a suscipit nulla elit ac nulla sed vel enim sit amet
361,Manufacturer's special warranty,365,97.14,neque sapien placerat ante nulla justo aliquam quis turpis eget elit sodales scelerisque mauris sit amet
362,Standard Manufacturer's,548,82.87,vel nulla eget eros elementum pellentesque quisque porta volutpat erat quisque erat eros viverra eget
363,Standard Manufacturer's,125,64.57,dapibus dolor vel est donec odio justo sollicitudin ut suscipit a feugiat et eros vestibulum ac est lacinia nisi venenatis
364,Standard Manufacturer's,93,60.22,est lacinia nisi venenatis tristique fusce congue diam id ornare imperdiet sapien urna pretium nisl
365,Full manufacturer's warranty,125,79.57,et ultrices posuere cubilia curae mauris viverra diam vitae quam suspendisse potenti nullam porttitor lacus at turpis donec posuere
366,Full manufacturer's warranty,183,83.86,eget nunc donec quis orci eget orci vehicula condimentum curabitur
367,Manufacturer's special warranty,548,78.69,lacus morbi sem mauris laoreet ut rhoncus aliquet pulvinar sed
368,Additional reseller's warranty,548,94.69,consequat nulla nisl nunc nisl duis bibendum felis sed interdum venenatis turpis enim blandit mi in porttitor pede justo eu
369,Full manufacturer's warranty,183,98.63,lectus suspendisse potenti in eleifend quam a odio in hac habitasse platea dictumst maecenas ut massa quis augue luctus
370,Full manufacturer's warranty,548,61.04,luctus et ultrices posuere cubilia curae donec pharetra magna vestibulum aliquet ultrices
371,Manufacturer's special warranty,125,96.02,turpis eget elit sodales scelerisque mauris sit amet eros suspendisse accumsan
