GarantyID,NameGaranty,Duration,PriceGaranty,DescriptionGaranty
1370,Manufacturer's special warranty,183,97.54,massa quis augue luctus tincidunt nulla mollis molestie lorem quisque ut erat curabitur
1371,Full manufacturer's warranty,125,94.51,quis augue luctus tincidunt nulla mollis molestie lorem quisque ut erat curabitur gravida nisi
1372,Standard Manufacturer's,548,61.32,sit amet eros suspendisse accumsan tortor quis turpis sed ante vivamus tortor
1373,Full manufacturer's warranty,548,90.18,aliquam sit amet diam in magna bibendum imperdiet nullam orci pede venenatis non sodales sed tincidunt eu felis fusce
1374,Standard Manufacturer's,548,80.99,vitae ipsum aliquam non mauris morbi non lectus aliquam sit amet diam in magna
1375,Additional reseller's warranty,183,95.67,neque duis bibendum morbi non quam nec dui luctus rutrum nulla tellus in
1376,Full manufacturer's warranty,548,76.64,turpis enim blandit mi in porttitor pede justo eu massa donec dapibus duis at velit eu est congue elementum in
1377,Full manufacturer's warranty,365,63.68,at velit eu est congue elementum in hac habitasse platea dictumst morbi vestibulum velit id pretium iaculis diam erat fermentum
1378,Manufacturer's special warranty,548,94.23,id nulla ultrices aliquet maecenas leo odio condimentum id luctus nec molestie sed justo pellentesque
1379,Full manufacturer's warranty,183,64.49,in felis donec semper sapien a libero nam dui proin
1380,Manufacturer's special warranty,548,60.62,curabitur gravida nisi at nibh in hac habitasse platea dictumst
1381,Standard Manufacturer's,183,65.04,augue a suscipit nulla elit ac nulla sed vel enim sit amet nunc viverra dapibus nulla suscipit ligula
1382,Standard Manufacturer's,548,72.61,consectetuer eget rutrum at lorem integer tincidunt ante vel ipsum praesent
1383,Standard Manufacturer's,125,67.24,donec ut mauris eget massa tempor convallis nulla neque libero convallis eget eleifend luctus ultricies eu
1384,Manufacturer's special warranty,548,83.9,venenatis tristique fusce congue diam id ornare imperdiet sapien urna pretium nisl ut volutpat sapien arcu sed augue aliquam erat
1385,Manufacturer's special warranty,93,67.03,justo sit amet sapien dignissim vestibulum vestibulum ante ipsum primis in faucibus orci luctus et ultrices posuere cubilia
1386,Additional reseller's warranty,365,97.64,pulvinar nulla pede ullamcorper augue a suscipit nulla elit ac nulla sed vel enim sit amet nunc
1387,Full manufacturer's warranty,365,79.87,vestibulum ante ipsum primis in faucibus orci luctus et ultrices posuere cubilia
1388,Full manufacturer's warranty,93,63.64,placerat praesent blandit nam nulla integer pede justo lacinia eget tincidunt eget tempus vel pede morbi porttitor lorem id
1389,Standard Manufacturer's,125,86.87,adipiscing elit proin risus praesent lectus vestibulum quam sapien varius ut blandit non interdum in ante vestibulum ante ipsum primis
1390,Additional reseller's warranty,183,69.59,sapien in sapien iaculis congue vivamus metus arcu adipiscing molestie hendrerit at vulputate vitae nisl aenean lectus
1391,Standard Manufacturer's,183,66.03,ut massa quis augue luctus tincidunt nulla mollis molestie lorem quisque ut erat curabitur gravida nisi at nibh in
1392,Standard Manufacturer's,125,83.33,est risus auctor sed tristique in tempus sit amet sem fusce consequat
1393,Manufacturer's special warranty,93,90.51,bibendum imperdiet nullam orci pede venenatis non sodales sed tincidunt eu felis
1394,Full manufacturer's warranty,548,75.47,neque aenean auctor gravida sem praesent id massa id nisl
1395,Manufacturer's special warranty,548,73.22,vel pede morbi porttitor lorem id ligula suspendisse ornare consequat lectus in est risus
1396,Manufacturer's special warranty,125,91.22,pede posuere nonummy integer non velit donec diam neque vestibulum eget vulputate ut
1397,Standard Manufacturer's,183,72,aliquam quis turpis eget elit sodales scelerisque mauris sit amet eros suspendisse accumsan tortor quis turpis sed
1398,Full manufacturer's warranty,548,96.25,blandit nam nulla integer pede justo lacinia eget tincidunt eget
1399,Full manufacturer's warranty,183,63.75,etiam vel augue vestibulum rutrum rutrum neque aenean auctor gravida sem
1400,Additional reseller's warranty,183,80.23,primis in faucibus orci luctus et ultrices posuere cubilia curae duis faucibus accumsan odio curabitur convallis
1401,Full manufacturer's warranty,125,70.15,tortor duis mattis egestas metus aenean fermentum donec ut mauris eget massa tempor convallis nulla
1402,Standard Manufacturer's,548,77.25,accumsan tellus nisi eu orci mauris lacinia sapien quis libero nullam sit amet turpis elementum
1403,Manufacturer's special warranty,183,92.85,metus aenean fermentum donec ut mauris eget massa tempor convallis nulla neque libero convallis eget
1404,Standard Manufacturer's,365,99.77,ut suscipit a feugiat et eros vestibulum ac est lacinia nisi venenatis tristique fusce congue diam id ornare
1405,Standard Manufacturer's,183,63.18,tincidunt nulla mollis molestie lorem quisque ut erat curabitur gravida nisi at nibh in hac
1406,Full manufacturer's warranty,548,94.92,eleifend donec ut dolor morbi vel lectus in quam fringilla rhoncus mauris enim
1407,Manufacturer's special warranty,548,81.83,habitasse platea dictumst morbi vestibulum velit id pretium iaculis diam
1408,Standard Manufacturer's,365,91.65,consectetuer adipiscing elit proin risus praesent lectus vestibulum quam sapien varius ut blandit non
1409,Manufacturer's special warranty,365,83.95,pellentesque ultrices mattis odio donec vitae nisi nam ultrices libero non mattis pulvinar nulla pede ullamcorper augue a
1410,Standard Manufacturer's,125,68.94,donec pharetra magna vestibulum aliquet ultrices erat tortor sollicitudin mi sit amet lobortis sapien sapien non mi integer ac
1411,Additional reseller's warranty,125,90.87,fusce congue diam id ornare imperdiet sapien urna pretium nisl ut volutpat sapien arcu
1412,Additional reseller's warranty,365,72.1,nulla nisl nunc nisl duis bibendum felis sed interdum venenatis turpis enim blandit mi in porttitor pede justo eu
1413,Manufacturer's special warranty,125,72.83,odio justo sollicitudin ut suscipit a feugiat et eros vestibulum ac est lacinia nisi venenatis tristique
1414,Standard Manufacturer's,365,86.33,convallis morbi odio odio elementum eu interdum eu tincidunt in leo maecenas pulvinar lobortis est phasellus sit amet
1415,Standard Manufacturer's,125,74.89,tortor duis mattis egestas metus aenean fermentum donec ut mauris eget massa tempor convallis
1416,Additional reseller's warranty,183,82.06,turpis sed ante vivamus tortor duis mattis egestas metus aenean fermentum donec ut mauris
1417,Full manufacturer's warranty,93,76.04,interdum mauris non ligula pellentesque ultrices phasellus id sapien in sapien iaculis congue vivamus metus arcu adipiscing molestie hendrerit
1418,Full manufacturer's warranty,183,85.68,eu est congue elementum in hac habitasse platea dictumst morbi vestibulum
1419,Manufacturer's special warranty,183,95.69,curabitur in libero ut massa volutpat convallis morbi odio odio elementum eu interdum eu
1420,Additional reseller's warranty,365,96.18,hac habitasse platea dictumst morbi vestibulum velit id pretium iaculis diam erat fermentum justo nec
1421,Additional reseller's warranty,183,73.49,in hac habitasse platea dictumst maecenas ut massa quis augue luctus tincidunt nulla mollis molestie lorem quisque ut erat curabitur
1422,Manufacturer's special warranty,93,92.04,lobortis sapien sapien non mi integer ac neque duis bibendum
1423,Full manufacturer's warranty,365,84.86,imperdiet nullam orci pede venenatis non sodales sed tincidunt eu felis fusce posuere felis sed
1424,Additional reseller's warranty,125,70.32,ut massa volutpat convallis morbi odio odio elementum eu interdum eu tincidunt in leo maecenas pulvinar lobortis est
1425,Full manufacturer's warranty,548,89.51,luctus ultricies eu nibh quisque id justo sit amet sapien dignissim
1426,Manufacturer's special warranty,183,98.98,vivamus in felis eu sapien cursus vestibulum proin eu mi nulla ac enim in tempor turpis
1427,Standard Manufacturer's,183,61,urna pretium nisl ut volutpat sapien arcu sed augue aliquam erat volutpat in congue etiam
1428,Standard Manufacturer's,125,85.1,pede justo lacinia eget tincidunt eget tempus vel pede morbi porttitor
1429,Standard Manufacturer's,548,80.02,felis fusce posuere felis sed lacus morbi sem mauris laoreet ut rhoncus aliquet
1430,Standard Manufacturer's,365,85.38,cubilia curae mauris viverra diam vitae quam suspendisse potenti nullam porttitor lacus at turpis donec posuere metus vitae ipsum aliquam
1431,Full manufacturer's warranty,125,87.49,tincidunt nulla mollis molestie lorem quisque ut erat curabitur gravida nisi at nibh in
1432,Standard Manufacturer's,365,90.89,ac enim in tempor turpis nec euismod scelerisque quam turpis adipiscing lorem vitae mattis
1433,Full manufacturer's warranty,183,75.56,at lorem integer tincidunt ante vel ipsum praesent blandit lacinia erat vestibulum sed magna at nunc
1434,Standard Manufacturer's,548,81.72,magnis dis parturient montes nascetur ridiculus mus etiam vel augue vestibulum rutrum
1435,Standard Manufacturer's,93,72.04,morbi ut odio cras mi pede malesuada in imperdiet et commodo vulputate justo in blandit ultrices
1436,Standard Manufacturer's,548,84.42,gravida sem praesent id massa id nisl venenatis lacinia aenean sit amet justo morbi ut odio cras mi pede
1437,Additional reseller's warranty,125,65.35,interdum venenatis turpis enim blandit mi in porttitor pede justo eu massa donec dapibus duis at velit eu
1438,Additional reseller's warranty,93,90.81,iaculis congue vivamus metus arcu adipiscing molestie hendrerit at vulputate vitae nisl aenean lectus pellentesque eget nunc
1439,Full manufacturer's warranty,365,97.93,vestibulum ante ipsum primis in faucibus orci luctus et ultrices
1440,Manufacturer's special warranty,548,92.17,sodales scelerisque mauris sit amet eros suspendisse accumsan tortor quis turpis sed ante
1441,Full manufacturer's warranty,93,80.39,vestibulum aliquet ultrices erat tortor sollicitudin mi sit amet lobortis sapien sapien non mi
1442,Standard Manufacturer's,548,64.5,tellus in sagittis dui vel nisl duis ac nibh fusce lacus purus
1443,Manufacturer's special warranty,548,60.61,phasellus id sapien in sapien iaculis congue vivamus metus arcu
1444,Additional reseller's warranty,125,68.49,vestibulum velit id pretium iaculis diam erat fermentum justo nec condimentum neque sapien placerat ante nulla justo aliquam
1445,Additional reseller's warranty,365,81,in tempus sit amet sem fusce consequat nulla nisl nunc nisl
1446,Standard Manufacturer's,365,82.61,potenti in eleifend quam a odio in hac habitasse platea
1447,Manufacturer's special warranty,125,67.33,interdum in ante vestibulum ante ipsum primis in faucibus orci luctus et ultrices
1448,Standard Manufacturer's,125,64.61,risus auctor sed tristique in tempus sit amet sem fusce consequat nulla nisl nunc nisl
1449,Full manufacturer's warranty,125,73.07,ultrices libero non mattis pulvinar nulla pede ullamcorper augue a suscipit nulla elit ac nulla sed vel enim sit
1450,Full manufacturer's warranty,365,81.35,quam suspendisse potenti nullam porttitor lacus at turpis donec posuere metus vitae ipsum aliquam non mauris morbi non
1451,Manufacturer's special warranty,183,98.2,suspendisse potenti in eleifend quam a odio in hac habitasse platea dictumst maecenas ut massa
1452,Full manufacturer's warranty,183,61.51,mauris non ligula pellentesque ultrices phasellus id sapien in sapien iaculis congue vivamus metus arcu
1453,Manufacturer's special warranty,93,97.27,in hac habitasse platea dictumst etiam faucibus cursus urna ut tellus nulla ut
1454,Additional reseller's warranty,93,89.03,quam pharetra magna ac consequat metus sapien ut nunc vestibulum ante ipsum primis in faucibus orci luctus
1455,Full manufacturer's warranty,365,88.7,massa donec dapibus duis at velit eu est congue elementum in hac habitasse platea dictumst morbi vestibulum velit
1456,Manufacturer's special warranty,93,84.18,hac habitasse platea dictumst morbi vestibulum velit id pretium iaculis diam
1457,Additional reseller's warranty,365,61.39,convallis nulla neque libero convallis eget eleifend luctus ultricies eu nibh quisque id justo sit amet
1458,Standard Manufacturer's,125,96.72,rutrum nulla nunc purus phasellus in felis donec semper sapien a libero nam dui proin leo odio porttitor id
1459,Manufacturer's special warranty,125,74.2,volutpat sapien arcu sed augue aliquam erat volutpat in congue etiam justo etiam
1460,Full manufacturer's warranty,93,75.19,vestibulum aliquet ultrices erat tortor sollicitudin mi sit amet lobortis sapien sapien
1461,Full manufacturer's warranty,183,69.85,nibh in hac habitasse platea dictumst aliquam augue quam sollicitudin vitae consectetuer eget rutrum at
1462,Additional reseller's warranty,365,91.52,id consequat in consequat ut nulla sed accumsan felis ut at dolor
1463,Full manufacturer's warranty,93,67.7,magna vulputate luctus cum sociis natoque penatibus et magnis dis parturient montes nascetur ridiculus mus vivamus vestibulum sagittis
1464,Full manufacturer's warranty,183,75.21,arcu sed augue aliquam erat volutpat in congue etiam justo etiam pretium iaculis justo in hac habitasse
1465,Full manufacturer's warranty,183,66.94,luctus cum sociis natoque penatibus et magnis dis parturient montes nascetur ridiculus mus vivamus vestibulum sagittis sapien cum
1466,Standard Manufacturer's,183,98.14,erat volutpat in congue etiam justo etiam pretium iaculis justo in hac habitasse
1467,Additional reseller's warranty,125,92.34,metus arcu adipiscing molestie hendrerit at vulputate vitae nisl aenean lectus pellentesque eget
1468,Full manufacturer's warranty,548,75.32,vestibulum eget vulputate ut ultrices vel augue vestibulum ante ipsum primis in faucibus
1469,Full manufacturer's warranty,93,95.01,bibendum felis sed interdum venenatis turpis enim blandit mi in porttitor pede justo eu massa
1470,Standard Manufacturer's,183,81.62,in eleifend quam a odio in hac habitasse platea dictumst maecenas ut
1471,Manufacturer's special warranty,548,86.26,sollicitudin vitae consectetuer eget rutrum at lorem integer tincidunt ante
1472,Full manufacturer's warranty,93,86.6,turpis nec euismod scelerisque quam turpis adipiscing lorem vitae mattis nibh
1473,Full manufacturer's warranty,93,76.28,vestibulum sed magna at nunc commodo placerat praesent blandit nam nulla integer pede justo lacinia eget tincidunt eget tempus
1474,Additional reseller's warranty,93,91.33,mauris non ligula pellentesque ultrices phasellus id sapien in sapien iaculis
1475,Additional reseller's warranty,125,79,in imperdiet et commodo vulputate justo in blandit ultrices enim lorem ipsum dolor sit amet consectetuer adipiscing elit proin
1476,Manufacturer's special warranty,365,64.96,ac nulla sed vel enim sit amet nunc viverra dapibus
1477,Manufacturer's special warranty,125,66.9,diam cras pellentesque volutpat dui maecenas tristique est et tempus semper est quam pharetra magna ac
1478,Manufacturer's special warranty,125,72.86,lectus aliquam sit amet diam in magna bibendum imperdiet nullam orci pede venenatis non sodales sed tincidunt eu
1479,Manufacturer's special warranty,93,73.12,quisque arcu libero rutrum ac lobortis vel dapibus at diam nam tristique tortor eu pede
1480,Manufacturer's special warranty,183,94.62,odio donec vitae nisi nam ultrices libero non mattis pulvinar nulla pede ullamcorper augue a suscipit nulla elit ac
1481,Additional reseller's warranty,125,73.2,nisi volutpat eleifend donec ut dolor morbi vel lectus in quam fringilla rhoncus mauris enim leo rhoncus sed
1482,Additional reseller's warranty,93,77.26,arcu adipiscing molestie hendrerit at vulputate vitae nisl aenean lectus pellentesque eget nunc donec quis orci
1483,Additional reseller's warranty,93,89.95,lacus at turpis donec posuere metus vitae ipsum aliquam non mauris morbi non lectus aliquam sit amet diam in magna
1484,Additional reseller's warranty,365,79.15,odio porttitor id consequat in consequat ut nulla sed accumsan felis ut at dolor quis
1485,Standard Manufacturer's,548,77.11,odio justo sollicitudin ut suscipit a feugiat et eros vestibulum ac est lacinia nisi venenatis tristique
1486,Full manufacturer's warranty,183,79.28,sollicitudin vitae consectetuer eget rutrum at lorem integer tincidunt ante vel ipsum praesent blandit lacinia erat vestibulum sed
1487,Additional reseller's warranty,183,99.52,volutpat eleifend donec ut dolor morbi vel lectus in quam fringilla rhoncus mauris enim leo rhoncus sed
1488,Additional reseller's warranty,548,67.58,et ultrices posuere cubilia curae duis faucibus accumsan odio curabitur
1489,Full manufacturer's warranty,183,82.65,et ultrices posuere cubilia curae mauris viverra diam vitae quam suspendisse potenti nullam porttitor lacus at
1490,Manufacturer's special warranty,548,92.42,tristique fusce congue diam id ornare imperdiet sapien urna pretium nisl ut volutpat sapien arcu
1491,Manufacturer's special warranty,93,79.73,turpis integer aliquet massa id lobortis convallis tortor risus dapibus augue vel accumsan tellus nisi eu orci mauris lacinia
1492,Additional reseller's warranty,125,81.5,quam pede lobortis ligula sit amet eleifend pede libero quis orci nullam molestie nibh in lectus pellentesque at nulla
1493,Standard Manufacturer's,365,66.07,erat nulla tempus vivamus in felis eu sapien cursus vestibulum
1494,Standard Manufacturer's,365,96.95,cursus vestibulum proin eu mi nulla ac enim in tempor
1495,Manufacturer's special warranty,548,60,lobortis est phasellus sit amet erat nulla tempus vivamus in felis eu sapien cursus vestibulum proin eu
1496,Additional reseller's warranty,183,69.14,hac habitasse platea dictumst aliquam augue quam sollicitudin vitae consectetuer eget rutrum at lorem integer tincidunt
1497,Manufacturer's special warranty,548,92.71,sem praesent id massa id nisl venenatis lacinia aenean sit amet justo morbi ut
1498,Additional reseller's warranty,93,75.52,iaculis diam erat fermentum justo nec condimentum neque sapien placerat
1499,Additional reseller's warranty,93,96.13,volutpat erat quisque erat eros viverra eget congue eget semper rutrum nulla nunc purus phasellus in
1500,Additional reseller's warranty,93,70.7,velit id pretium iaculis diam erat fermentum justo nec condimentum neque sapien placerat
1501,Standard Manufacturer's,125,60.15,pharetra magna ac consequat metus sapien ut nunc vestibulum ante ipsum primis in
1502,Standard Manufacturer's,183,96.41,quam nec dui luctus rutrum nulla tellus in sagittis dui vel nisl duis
1503,Additional reseller's warranty,548,98.18,vel enim sit amet nunc viverra dapibus nulla suscipit ligula in lacus curabitur at ipsum ac tellus semper interdum mauris
1504,Standard Manufacturer's,183,85.03,ac neque duis bibendum morbi non quam nec dui luctus
1505,Standard Manufacturer's,365,78.07,felis eu sapien cursus vestibulum proin eu mi nulla ac enim in tempor
1506,Manufacturer's special warranty,183,84.41,vulputate elementum nullam varius nulla facilisi cras non velit nec nisi vulputate nonummy maecenas tincidunt lacus at velit vivamus
1507,Full manufacturer's warranty,183,88.03,justo sit amet sapien dignissim vestibulum vestibulum ante ipsum primis in faucibus orci luctus et ultrices posuere
1508,Full manufacturer's warranty,548,75.05,duis bibendum morbi non quam nec dui luctus rutrum nulla
1509,Full manufacturer's warranty,93,70.34,et ultrices posuere cubilia curae duis faucibus accumsan odio curabitur
1510,Standard Manufacturer's,183,69.44,pede justo lacinia eget tincidunt eget tempus vel pede morbi porttitor lorem id
1511,Additional reseller's warranty,365,78.73,neque libero convallis eget eleifend luctus ultricies eu nibh quisque id justo sit amet sapien dignissim vestibulum
1512,Standard Manufacturer's,365,76.88,mattis odio donec vitae nisi nam ultrices libero non mattis pulvinar nulla
1513,Additional reseller's warranty,548,87.43,posuere cubilia curae duis faucibus accumsan odio curabitur convallis duis
1514,Manufacturer's special warranty,365,60.05,commodo placerat praesent blandit nam nulla integer pede justo lacinia eget tincidunt eget tempus vel pede morbi porttitor
1515,Manufacturer's special warranty,93,86.9,ac enim in tempor turpis nec euismod scelerisque quam turpis adipiscing lorem vitae
1516,Manufacturer's special warranty,365,82.8,donec ut dolor morbi vel lectus in quam fringilla rhoncus mauris enim leo rhoncus sed vestibulum sit amet cursus
1517,Additional reseller's warranty,183,80.17,rhoncus sed vestibulum sit amet cursus id turpis integer aliquet massa id lobortis convallis tortor risus dapibus augue
1518,Manufacturer's special warranty,365,83.87,cursus urna ut tellus nulla ut erat id mauris vulputate elementum nullam
1519,Additional reseller's warranty,365,98.81,turpis enim blandit mi in porttitor pede justo eu massa donec
1520,Full manufacturer's warranty,125,96.01,sed tristique in tempus sit amet sem fusce consequat nulla nisl nunc
1521,Manufacturer's special warranty,365,66.71,pede justo lacinia eget tincidunt eget tempus vel pede morbi porttitor
1522,Standard Manufacturer's,548,88.26,ut mauris eget massa tempor convallis nulla neque libero convallis eget eleifend luctus ultricies eu nibh quisque id
1523,Manufacturer's special warranty,125,76.22,est risus auctor sed tristique in tempus sit amet sem fusce consequat nulla nisl nunc
1524,Full manufacturer's warranty,548,97.14,libero nam dui proin leo odio porttitor id consequat in consequat ut nulla sed
1525,Manufacturer's special warranty,548,76.59,mauris laoreet ut rhoncus aliquet pulvinar sed nisl nunc rhoncus
1526,Manufacturer's special warranty,365,62.82,ante ipsum primis in faucibus orci luctus et ultrices posuere
1527,Full manufacturer's warranty,125,64.2,in felis donec semper sapien a libero nam dui proin leo odio porttitor
1528,Full manufacturer's warranty,93,72.59,quis tortor id nulla ultrices aliquet maecenas leo odio condimentum id luctus nec molestie sed justo pellentesque
1529,Additional reseller's warranty,365,63.85,in sagittis dui vel nisl duis ac nibh fusce lacus purus aliquet at feugiat non pretium quis lectus
1530,Manufacturer's special warranty,548,83.35,cras non velit nec nisi vulputate nonummy maecenas tincidunt lacus at velit vivamus vel nulla eget eros elementum
1531,Standard Manufacturer's,93,97.85,rhoncus dui vel sem sed sagittis nam congue risus semper porta volutpat quam pede lobortis ligula sit amet eleifend pede
1532,Full manufacturer's warranty,125,82.6,mauris lacinia sapien quis libero nullam sit amet turpis elementum ligula vehicula consequat
1533,Standard Manufacturer's,548,67.02,in tempor turpis nec euismod scelerisque quam turpis adipiscing lorem vitae
1534,Standard Manufacturer's,125,69.34,ut erat id mauris vulputate elementum nullam varius nulla facilisi cras non velit nec nisi vulputate nonummy
1535,Standard Manufacturer's,365,78.9,vulputate vitae nisl aenean lectus pellentesque eget nunc donec quis orci eget orci vehicula condimentum curabitur in libero
1536,Standard Manufacturer's,183,81.14,auctor gravida sem praesent id massa id nisl venenatis lacinia aenean
1537,Manufacturer's special warranty,183,67.58,vivamus tortor duis mattis egestas metus aenean fermentum donec ut mauris eget massa tempor convallis nulla neque libero convallis
1538,Additional reseller's warranty,365,84.83,potenti in eleifend quam a odio in hac habitasse platea dictumst maecenas ut massa quis augue luctus tincidunt
1539,Standard Manufacturer's,365,82.9,vel lectus in quam fringilla rhoncus mauris enim leo rhoncus sed vestibulum
1540,Full manufacturer's warranty,93,73.25,accumsan felis ut at dolor quis odio consequat varius integer ac leo pellentesque ultrices mattis odio donec vitae
1541,Manufacturer's special warranty,548,92.35,cubilia curae duis faucibus accumsan odio curabitur convallis duis consequat
1542,Additional reseller's warranty,548,60.03,tincidunt nulla mollis molestie lorem quisque ut erat curabitur gravida nisi at nibh in hac habitasse platea dictumst
1543,Manufacturer's special warranty,183,92.78,sem duis aliquam convallis nunc proin at turpis a pede posuere nonummy integer non velit
1544,Additional reseller's warranty,365,86.31,vel est donec odio justo sollicitudin ut suscipit a feugiat et eros vestibulum ac est lacinia
1545,Additional reseller's warranty,365,73,pulvinar sed nisl nunc rhoncus dui vel sem sed sagittis nam congue risus semper porta volutpat quam pede lobortis
1546,Manufacturer's special warranty,93,79.63,eget semper rutrum nulla nunc purus phasellus in felis donec semper sapien a libero nam dui proin leo odio
1547,Manufacturer's special warranty,548,91.49,nulla dapibus dolor vel est donec odio justo sollicitudin ut suscipit a feugiat et eros vestibulum ac est
1548,Standard Manufacturer's,125,61.79,erat quisque erat eros viverra eget congue eget semper rutrum nulla
1549,Manufacturer's special warranty,548,86.82,sed accumsan felis ut at dolor quis odio consequat varius
1550,Additional reseller's warranty,93,94.91,suspendisse potenti in eleifend quam a odio in hac habitasse platea dictumst maecenas ut massa quis augue
1551,Manufacturer's special warranty,365,80.98,fusce lacus purus aliquet at feugiat non pretium quis lectus suspendisse potenti in eleifend quam a odio in hac
1552,Manufacturer's special warranty,125,77.25,ullamcorper augue a suscipit nulla elit ac nulla sed vel
1553,Full manufacturer's warranty,183,88.62,orci nullam molestie nibh in lectus pellentesque at nulla suspendisse potenti cras in purus
1554,Manufacturer's special warranty,183,80.3,nulla suscipit ligula in lacus curabitur at ipsum ac tellus semper interdum mauris ullamcorper purus sit
1555,Standard Manufacturer's,125,80.31,ante nulla justo aliquam quis turpis eget elit sodales scelerisque mauris sit amet eros suspendisse accumsan tortor
1556,Standard Manufacturer's,93,60.15,nisi eu orci mauris lacinia sapien quis libero nullam sit amet turpis elementum ligula vehicula consequat morbi a
