GarantyID,NameGaranty,Duration,PriceGaranty,DescriptionGaranty
1184,Additional reseller's warranty,183,96.57,hac habitasse platea dictumst aliquam augue quam sollicitudin vitae consectetuer eget rutrum at
1185,Manufacturer's special warranty,183,90.07,sed interdum venenatis turpis enim blandit mi in porttitor pede justo eu massa donec dapibus duis
1186,Manufacturer's special warranty,125,60.21,luctus et ultrices posuere cubilia curae mauris viverra diam vitae quam suspendisse potenti nullam porttitor lacus at turpis donec
1187,Full manufacturer's warranty,548,95.05,neque vestibulum eget vulputate ut ultrices vel augue vestibulum ante ipsum primis in faucibus
1188,Manufacturer's special warranty,183,85.41,ac neque duis bibendum morbi non quam nec dui luctus rutrum nulla tellus in sagittis dui vel nisl duis ac
1189,Standard Manufacturer's,183,63.45,ac consequat metus sapien ut nunc vestibulum ante ipsum primis in faucibus orci luctus et ultrices posuere cubilia curae
1190,Manufacturer's special warranty,365,77.86,morbi non quam nec dui luctus rutrum nulla tellus in sagittis dui vel
1191,Standard Manufacturer's,365,89.03,commodo placerat praesent blandit nam nulla integer pede justo lacinia eget tincidunt
1192,Additional reseller's warranty,548,99.13,lacus curabitur at ipsum ac tellus semper interdum mauris ullamcorper purus sit amet
1193,Standard Manufacturer's,183,98.65,sem fusce consequat nulla nisl nunc nisl duis bibendum felis sed interdum venenatis turpis enim blandit mi in porttitor
1194,Standard Manufacturer's,365,72.89,varius integer ac leo pellentesque ultrices mattis odio donec vitae nisi nam
1195,Manufacturer's special warranty,365,82.19,neque vestibulum eget vulputate ut ultrices vel augue vestibulum ante ipsum primis in faucibus orci luctus et
1196,Standard Manufacturer's,125,83.55,nunc rhoncus dui vel sem sed sagittis nam congue risus semper porta volutpat quam pede lobortis
1197,Additional reseller's warranty,183,63.55,magna vestibulum aliquet ultrices erat tortor sollicitudin mi sit amet lobortis
1198,Full manufacturer's warranty,93,66.41,lorem vitae mattis nibh ligula nec sem duis aliquam convallis nunc proin
1199,Additional reseller's warranty,183,82.16,ut erat id mauris vulputate elementum nullam varius nulla facilisi cras non
1200,Manufacturer's special warranty,365,81.99,nulla elit ac nulla sed vel enim sit amet nunc viverra dapibus nulla suscipit ligula
1201,Full manufacturer's warranty,183,62.77,massa tempor convallis nulla neque libero convallis eget eleifend luctus ultricies eu nibh quisque id justo sit
1202,Standard Manufacturer's,125,64.41,sed tristique in tempus sit amet sem fusce consequat nulla nisl nunc nisl duis bibendum
1203,Additional reseller's warranty,93,83.6,in sapien iaculis congue vivamus metus arcu adipiscing molestie hendrerit
1204,Standard Manufacturer's,125,63.88,faucibus cursus urna ut tellus nulla ut erat id mauris vulputate elementum
1205,Full manufacturer's warranty,125,65.1,quisque porta volutpat erat quisque erat eros viverra eget congue eget semper rutrum nulla nunc purus
1206,Manufacturer's special warranty,365,97.9,ligula nec sem duis aliquam convallis nunc proin at turpis a pede posuere nonummy integer non velit donec diam
1207,Additional reseller's warranty,93,65.73,mattis pulvinar nulla pede ullamcorper augue a suscipit nulla elit
1208,Full manufacturer's warranty,548,78.64,quis tortor id nulla ultrices aliquet maecenas leo odio condimentum id luctus nec molestie sed justo pellentesque viverra pede ac
1209,Standard Manufacturer's,93,62.95,donec odio justo sollicitudin ut suscipit a feugiat et eros
1210,Manufacturer's special warranty,125,90.8,phasellus in felis donec semper sapien a libero nam dui proin leo odio porttitor id consequat in consequat
1211,Standard Manufacturer's,125,97.66,suscipit nulla elit ac nulla sed vel enim sit amet
1212,Full manufacturer's warranty,548,74.95,in imperdiet et commodo vulputate justo in blandit ultrices enim lorem ipsum dolor sit amet
1213,Manufacturer's special warranty,548,83.84,sit amet eleifend pede libero quis orci nullam molestie nibh in
1214,Additional reseller's warranty,183,85.16,non velit donec diam neque vestibulum eget vulputate ut ultrices
1215,Manufacturer's special warranty,93,73.06,ipsum primis in faucibus orci luctus et ultrices posuere cubilia curae donec pharetra magna vestibulum
1216,Full manufacturer's warranty,548,98.24,luctus et ultrices posuere cubilia curae donec pharetra magna vestibulum aliquet ultrices erat tortor sollicitudin mi
1217,Standard Manufacturer's,548,90.98,varius ut blandit non interdum in ante vestibulum ante ipsum primis in
1218,Additional reseller's warranty,125,63.3,luctus rutrum nulla tellus in sagittis dui vel nisl duis ac nibh fusce lacus purus aliquet at feugiat non pretium
1219,Manufacturer's special warranty,548,87.07,non lectus aliquam sit amet diam in magna bibendum imperdiet nullam orci pede venenatis non sodales
1220,Manufacturer's special warranty,365,93.17,orci luctus et ultrices posuere cubilia curae donec pharetra magna vestibulum
1221,Additional reseller's warranty,125,90.04,ultricies eu nibh quisque id justo sit amet sapien dignissim vestibulum vestibulum ante
1222,Manufacturer's special warranty,548,72.95,dis parturient montes nascetur ridiculus mus vivamus vestibulum sagittis sapien cum sociis natoque penatibus et magnis dis parturient
1223,Manufacturer's special warranty,93,76.55,augue aliquam erat volutpat in congue etiam justo etiam pretium iaculis justo in
1224,Standard Manufacturer's,93,67.24,in sagittis dui vel nisl duis ac nibh fusce lacus purus aliquet at feugiat non
1225,Manufacturer's special warranty,548,71.31,auctor gravida sem praesent id massa id nisl venenatis lacinia aenean sit amet justo morbi ut odio cras mi pede
1226,Standard Manufacturer's,125,69.28,maecenas tincidunt lacus at velit vivamus vel nulla eget eros elementum
1227,Additional reseller's warranty,125,85.25,nec nisi vulputate nonummy maecenas tincidunt lacus at velit vivamus vel nulla
1228,Full manufacturer's warranty,548,69.57,rutrum at lorem integer tincidunt ante vel ipsum praesent blandit lacinia erat
1229,Manufacturer's special warranty,93,68.88,nulla justo aliquam quis turpis eget elit sodales scelerisque mauris sit amet eros suspendisse accumsan tortor quis
1230,Standard Manufacturer's,125,64.37,quam pharetra magna ac consequat metus sapien ut nunc vestibulum ante ipsum primis in faucibus orci
1231,Full manufacturer's warranty,183,93.89,justo maecenas rhoncus aliquam lacus morbi quis tortor id nulla ultrices aliquet maecenas leo
1232,Standard Manufacturer's,365,87.55,risus praesent lectus vestibulum quam sapien varius ut blandit non interdum in ante vestibulum
1233,Manufacturer's special warranty,365,73.21,praesent blandit nam nulla integer pede justo lacinia eget tincidunt
1234,Full manufacturer's warranty,125,73.06,habitasse platea dictumst morbi vestibulum velit id pretium iaculis diam erat fermentum justo nec condimentum neque sapien placerat
1235,Manufacturer's special warranty,125,66.77,fusce lacus purus aliquet at feugiat non pretium quis lectus suspendisse potenti in eleifend quam a odio in hac habitasse
1236,Manufacturer's special warranty,183,97.86,erat quisque erat eros viverra eget congue eget semper rutrum nulla nunc purus phasellus in felis donec semper sapien a
1237,Standard Manufacturer's,365,96.83,ut odio cras mi pede malesuada in imperdiet et commodo vulputate justo in blandit
1238,Standard Manufacturer's,125,67.59,luctus ultricies eu nibh quisque id justo sit amet sapien dignissim vestibulum vestibulum ante ipsum primis in
1239,Full manufacturer's warranty,125,86.25,potenti cras in purus eu magna vulputate luctus cum sociis
1240,Additional reseller's warranty,125,78.96,cras in purus eu magna vulputate luctus cum sociis natoque penatibus
1241,Standard Manufacturer's,548,68.88,luctus cum sociis natoque penatibus et magnis dis parturient montes nascetur ridiculus mus vivamus vestibulum sagittis sapien cum sociis natoque
1242,Standard Manufacturer's,548,88.4,fringilla rhoncus mauris enim leo rhoncus sed vestibulum sit amet cursus id turpis integer aliquet massa id
1243,Full manufacturer's warranty,365,84.28,quisque erat eros viverra eget congue eget semper rutrum nulla nunc purus
1244,Additional reseller's warranty,183,91.08,ante ipsum primis in faucibus orci luctus et ultrices posuere cubilia curae mauris
1245,Additional reseller's warranty,548,72.94,fermentum donec ut mauris eget massa tempor convallis nulla neque libero convallis eget eleifend luctus ultricies eu nibh
1246,Standard Manufacturer's,365,66.22,orci pede venenatis non sodales sed tincidunt eu felis fusce
1247,Standard Manufacturer's,548,97.29,neque sapien placerat ante nulla justo aliquam quis turpis eget
1248,Additional reseller's warranty,125,71.28,nibh quisque id justo sit amet sapien dignissim vestibulum vestibulum ante ipsum
1249,Standard Manufacturer's,183,78.17,nisl venenatis lacinia aenean sit amet justo morbi ut odio cras
1250,Standard Manufacturer's,548,83.31,sem fusce consequat nulla nisl nunc nisl duis bibendum felis sed interdum
1251,Manufacturer's special warranty,125,67.01,hac habitasse platea dictumst aliquam augue quam sollicitudin vitae consectetuer eget rutrum at
1252,Standard Manufacturer's,548,69.22,faucibus orci luctus et ultrices posuere cubilia curae duis faucibus accumsan odio curabitur
1253,Additional reseller's warranty,125,75.69,sed tristique in tempus sit amet sem fusce consequat nulla nisl nunc nisl duis
1254,Standard Manufacturer's,365,80.92,velit donec diam neque vestibulum eget vulputate ut ultrices vel augue vestibulum ante
1255,Full manufacturer's warranty,365,64.39,nunc nisl duis bibendum felis sed interdum venenatis turpis enim blandit mi in porttitor pede justo eu
1256,Standard Manufacturer's,183,60.83,ut nunc vestibulum ante ipsum primis in faucibus orci luctus et
1257,Full manufacturer's warranty,93,74.28,a libero nam dui proin leo odio porttitor id consequat in consequat ut nulla sed accumsan felis ut
1258,Full manufacturer's warranty,125,98.02,suspendisse potenti in eleifend quam a odio in hac habitasse platea dictumst maecenas ut massa quis
1259,Standard Manufacturer's,125,89.79,diam id ornare imperdiet sapien urna pretium nisl ut volutpat sapien arcu
1260,Manufacturer's special warranty,183,81.68,congue risus semper porta volutpat quam pede lobortis ligula sit amet eleifend pede libero quis orci nullam molestie nibh
1261,Standard Manufacturer's,365,78.46,in leo maecenas pulvinar lobortis est phasellus sit amet erat nulla tempus vivamus in felis eu sapien cursus vestibulum
1262,Standard Manufacturer's,365,72.98,et ultrices posuere cubilia curae donec pharetra magna vestibulum aliquet ultrices erat tortor sollicitudin mi sit amet lobortis sapien
1263,Manufacturer's special warranty,548,76.59,vestibulum vestibulum ante ipsum primis in faucibus orci luctus et ultrices posuere cubilia curae nulla dapibus dolor vel est
1264,Full manufacturer's warranty,125,71.88,nisi nam ultrices libero non mattis pulvinar nulla pede ullamcorper augue a suscipit nulla
1265,Full manufacturer's warranty,125,79.41,mauris viverra diam vitae quam suspendisse potenti nullam porttitor lacus at turpis
1266,Full manufacturer's warranty,365,84.74,sit amet erat nulla tempus vivamus in felis eu sapien cursus vestibulum proin eu mi nulla ac enim
1267,Additional reseller's warranty,548,70.51,amet justo morbi ut odio cras mi pede malesuada in imperdiet et commodo vulputate justo in
1268,Manufacturer's special warranty,548,65.2,turpis eget elit sodales scelerisque mauris sit amet eros suspendisse accumsan tortor quis turpis sed ante
1269,Full manufacturer's warranty,548,77.06,posuere felis sed lacus morbi sem mauris laoreet ut rhoncus aliquet pulvinar sed nisl
1270,Additional reseller's warranty,183,95.58,consequat ut nulla sed accumsan felis ut at dolor quis odio consequat varius integer ac leo
1271,Additional reseller's warranty,93,78.07,id justo sit amet sapien dignissim vestibulum vestibulum ante ipsum primis in faucibus
1272,Full manufacturer's warranty,93,97.91,sapien a libero nam dui proin leo odio porttitor id consequat in consequat ut nulla sed accumsan felis ut at
1273,Standard Manufacturer's,365,71.5,nec dui luctus rutrum nulla tellus in sagittis dui vel nisl
1274,Additional reseller's warranty,365,87.52,libero quis orci nullam molestie nibh in lectus pellentesque at nulla suspendisse potenti cras in purus eu magna vulputate luctus
1275,Standard Manufacturer's,183,66.91,morbi ut odio cras mi pede malesuada in imperdiet et commodo vulputate justo in blandit ultrices
1276,Additional reseller's warranty,183,67.04,sed magna at nunc commodo placerat praesent blandit nam nulla
1277,Additional reseller's warranty,93,72.64,etiam pretium iaculis justo in hac habitasse platea dictumst etiam faucibus cursus
1278,Additional reseller's warranty,93,61.81,aliquet ultrices erat tortor sollicitudin mi sit amet lobortis sapien sapien non mi integer ac neque
1279,Standard Manufacturer's,365,84.65,nisl venenatis lacinia aenean sit amet justo morbi ut odio cras mi pede malesuada in imperdiet et commodo vulputate
1280,Standard Manufacturer's,125,94.95,praesent id massa id nisl venenatis lacinia aenean sit amet justo morbi ut odio cras mi pede
1281,Standard Manufacturer's,93,96.21,vitae nisi nam ultrices libero non mattis pulvinar nulla pede ullamcorper augue a suscipit nulla elit
1282,Manufacturer's special warranty,183,92.17,integer aliquet massa id lobortis convallis tortor risus dapibus augue vel
1283,Standard Manufacturer's,365,73.44,ligula suspendisse ornare consequat lectus in est risus auctor sed tristique in tempus sit amet sem fusce
1284,Standard Manufacturer's,548,83.6,in consequat ut nulla sed accumsan felis ut at dolor quis
1285,Standard Manufacturer's,365,75.66,blandit mi in porttitor pede justo eu massa donec dapibus duis at velit eu est congue
1286,Additional reseller's warranty,125,82.29,venenatis tristique fusce congue diam id ornare imperdiet sapien urna pretium nisl ut volutpat sapien arcu
1287,Additional reseller's warranty,365,69.37,justo pellentesque viverra pede ac diam cras pellentesque volutpat dui
1288,Manufacturer's special warranty,93,87.82,pede justo eu massa donec dapibus duis at velit eu est congue elementum in hac habitasse platea dictumst
1289,Additional reseller's warranty,365,74.12,orci eget orci vehicula condimentum curabitur in libero ut massa volutpat
1290,Full manufacturer's warranty,183,70.66,maecenas rhoncus aliquam lacus morbi quis tortor id nulla ultrices aliquet maecenas leo
1291,Standard Manufacturer's,548,62.27,magna at nunc commodo placerat praesent blandit nam nulla integer pede justo lacinia eget
1292,Full manufacturer's warranty,365,70.61,velit id pretium iaculis diam erat fermentum justo nec condimentum neque sapien placerat ante nulla justo aliquam quis
1293,Manufacturer's special warranty,548,83.38,ultrices mattis odio donec vitae nisi nam ultrices libero non
1294,Additional reseller's warranty,183,93.4,curae donec pharetra magna vestibulum aliquet ultrices erat tortor sollicitudin mi sit amet lobortis sapien sapien non mi
1295,Manufacturer's special warranty,365,60.18,dapibus dolor vel est donec odio justo sollicitudin ut suscipit a feugiat et eros vestibulum ac
1296,Full manufacturer's warranty,365,92.02,tempus semper est quam pharetra magna ac consequat metus sapien ut
1297,Standard Manufacturer's,548,70.49,adipiscing elit proin interdum mauris non ligula pellentesque ultrices phasellus id sapien in
1298,Additional reseller's warranty,365,75.47,quis libero nullam sit amet turpis elementum ligula vehicula consequat morbi a ipsum integer a nibh in quis justo
1299,Standard Manufacturer's,548,84.31,vel pede morbi porttitor lorem id ligula suspendisse ornare consequat lectus in est risus
1300,Additional reseller's warranty,125,78.51,iaculis congue vivamus metus arcu adipiscing molestie hendrerit at vulputate vitae nisl aenean lectus pellentesque eget
1301,Additional reseller's warranty,548,87.38,mauris morbi non lectus aliquam sit amet diam in magna bibendum imperdiet nullam
1302,Standard Manufacturer's,548,78.31,ultrices posuere cubilia curae nulla dapibus dolor vel est donec odio justo sollicitudin ut suscipit
1303,Additional reseller's warranty,93,63.98,eu nibh quisque id justo sit amet sapien dignissim vestibulum
1304,Manufacturer's special warranty,365,71.51,nisi nam ultrices libero non mattis pulvinar nulla pede ullamcorper augue a suscipit nulla elit ac nulla sed
1305,Manufacturer's special warranty,183,62.99,neque sapien placerat ante nulla justo aliquam quis turpis eget elit sodales scelerisque
1306,Manufacturer's special warranty,548,63.83,cubilia curae mauris viverra diam vitae quam suspendisse potenti nullam porttitor lacus at turpis donec posuere metus vitae
1307,Additional reseller's warranty,548,72.52,eget tincidunt eget tempus vel pede morbi porttitor lorem id ligula suspendisse ornare consequat lectus
1308,Standard Manufacturer's,183,99.79,tincidunt in leo maecenas pulvinar lobortis est phasellus sit amet erat nulla tempus vivamus in felis eu sapien cursus vestibulum
1309,Manufacturer's special warranty,548,88.03,nullam porttitor lacus at turpis donec posuere metus vitae ipsum aliquam
1310,Manufacturer's special warranty,183,74.81,diam in magna bibendum imperdiet nullam orci pede venenatis non sodales sed tincidunt eu felis fusce posuere felis sed lacus
1311,Additional reseller's warranty,183,92.96,nulla sed vel enim sit amet nunc viverra dapibus nulla suscipit ligula in
1312,Standard Manufacturer's,183,94.33,eget eleifend luctus ultricies eu nibh quisque id justo sit amet sapien dignissim vestibulum vestibulum ante ipsum primis in
1313,Full manufacturer's warranty,125,86.96,in hac habitasse platea dictumst aliquam augue quam sollicitudin vitae consectetuer
1314,Manufacturer's special warranty,548,76.28,ante nulla justo aliquam quis turpis eget elit sodales scelerisque mauris sit amet eros suspendisse accumsan tortor quis turpis
1315,Standard Manufacturer's,183,85.99,ac diam cras pellentesque volutpat dui maecenas tristique est et tempus semper
1316,Standard Manufacturer's,93,68.08,penatibus et magnis dis parturient montes nascetur ridiculus mus vivamus vestibulum sagittis sapien cum sociis natoque penatibus
1317,Full manufacturer's warranty,365,80.2,sagittis nam congue risus semper porta volutpat quam pede lobortis ligula sit amet eleifend pede libero quis orci nullam molestie
1318,Standard Manufacturer's,365,99.15,donec ut mauris eget massa tempor convallis nulla neque libero convallis eget eleifend
1319,Standard Manufacturer's,125,76.6,vel augue vestibulum ante ipsum primis in faucibus orci luctus
1320,Manufacturer's special warranty,548,80.17,praesent blandit nam nulla integer pede justo lacinia eget tincidunt eget tempus
1321,Standard Manufacturer's,183,93.78,luctus rutrum nulla tellus in sagittis dui vel nisl duis ac nibh fusce lacus purus aliquet at feugiat non pretium
1322,Additional reseller's warranty,365,75.96,mus vivamus vestibulum sagittis sapien cum sociis natoque penatibus et magnis dis parturient montes nascetur ridiculus
1323,Manufacturer's special warranty,548,90.81,erat curabitur gravida nisi at nibh in hac habitasse platea dictumst aliquam augue quam sollicitudin vitae consectetuer eget rutrum at
1324,Additional reseller's warranty,125,67.03,quisque erat eros viverra eget congue eget semper rutrum nulla nunc purus phasellus in felis donec semper
1325,Standard Manufacturer's,548,62.44,nascetur ridiculus mus vivamus vestibulum sagittis sapien cum sociis natoque penatibus et magnis dis parturient montes nascetur ridiculus mus etiam
1326,Full manufacturer's warranty,548,81.16,cubilia curae donec pharetra magna vestibulum aliquet ultrices erat tortor sollicitudin mi sit amet lobortis sapien
1327,Standard Manufacturer's,548,75.61,pede justo lacinia eget tincidunt eget tempus vel pede morbi porttitor lorem id ligula suspendisse ornare
1328,Manufacturer's special warranty,183,78.43,quis tortor id nulla ultrices aliquet maecenas leo odio condimentum id luctus nec molestie sed
1329,Additional reseller's warranty,548,94.03,quam suspendisse potenti nullam porttitor lacus at turpis donec posuere metus vitae ipsum aliquam
1330,Additional reseller's warranty,183,81.65,accumsan odio curabitur convallis duis consequat dui nec nisi volutpat eleifend donec
1331,Additional reseller's warranty,365,69.56,ipsum dolor sit amet consectetuer adipiscing elit proin risus praesent lectus vestibulum quam
1332,Full manufacturer's warranty,93,88.79,aliquet ultrices erat tortor sollicitudin mi sit amet lobortis sapien sapien non mi integer
1333,Standard Manufacturer's,548,60.42,neque libero convallis eget eleifend luctus ultricies eu nibh quisque id justo sit amet sapien dignissim
1334,Manufacturer's special warranty,548,71.34,aenean lectus pellentesque eget nunc donec quis orci eget orci vehicula condimentum curabitur in
1335,Additional reseller's warranty,548,91.18,viverra pede ac diam cras pellentesque volutpat dui maecenas tristique est et
1336,Standard Manufacturer's,93,62.69,vestibulum sagittis sapien cum sociis natoque penatibus et magnis dis parturient montes
1337,Manufacturer's special warranty,548,95.79,consectetuer eget rutrum at lorem integer tincidunt ante vel ipsum praesent blandit lacinia erat
1338,Manufacturer's special warranty,93,95.01,velit donec diam neque vestibulum eget vulputate ut ultrices vel augue vestibulum ante ipsum primis in faucibus orci luctus
1339,Full manufacturer's warranty,93,77.96,fusce lacus purus aliquet at feugiat non pretium quis lectus suspendisse potenti in eleifend quam a odio in hac
1340,Full manufacturer's warranty,365,89.35,ornare consequat lectus in est risus auctor sed tristique in tempus sit amet sem fusce
1341,Full manufacturer's warranty,183,88.36,faucibus orci luctus et ultrices posuere cubilia curae nulla dapibus
1342,Standard Manufacturer's,125,86.15,pede ac diam cras pellentesque volutpat dui maecenas tristique est et tempus semper est quam pharetra
1343,Additional reseller's warranty,548,94.02,ipsum praesent blandit lacinia erat vestibulum sed magna at nunc commodo placerat praesent blandit nam nulla integer pede
1344,Full manufacturer's warranty,125,68.9,ornare imperdiet sapien urna pretium nisl ut volutpat sapien arcu sed augue
1345,Standard Manufacturer's,365,99.67,augue a suscipit nulla elit ac nulla sed vel enim sit amet nunc viverra dapibus nulla
1346,Standard Manufacturer's,93,82.59,nec nisi vulputate nonummy maecenas tincidunt lacus at velit vivamus vel nulla eget eros elementum pellentesque quisque porta volutpat
1347,Manufacturer's special warranty,548,90.98,nunc purus phasellus in felis donec semper sapien a libero nam dui proin leo odio porttitor id
1348,Full manufacturer's warranty,125,64.09,pellentesque volutpat dui maecenas tristique est et tempus semper est quam pharetra magna ac consequat metus sapien ut nunc
1349,Full manufacturer's warranty,125,87.28,auctor sed tristique in tempus sit amet sem fusce consequat nulla nisl nunc nisl duis bibendum felis sed interdum venenatis
1350,Standard Manufacturer's,125,89.96,natoque penatibus et magnis dis parturient montes nascetur ridiculus mus vivamus vestibulum sagittis sapien cum sociis natoque penatibus
1351,Standard Manufacturer's,365,97.48,porttitor lacus at turpis donec posuere metus vitae ipsum aliquam non mauris
1352,Full manufacturer's warranty,183,71.89,nibh fusce lacus purus aliquet at feugiat non pretium quis lectus suspendisse potenti
1353,Full manufacturer's warranty,365,90.35,id ligula suspendisse ornare consequat lectus in est risus auctor sed tristique in tempus sit amet sem fusce
1354,Manufacturer's special warranty,548,88.7,pellentesque ultrices mattis odio donec vitae nisi nam ultrices libero
1355,Full manufacturer's warranty,365,93.66,quisque erat eros viverra eget congue eget semper rutrum nulla nunc purus
1356,Full manufacturer's warranty,93,81.1,ultrices erat tortor sollicitudin mi sit amet lobortis sapien sapien non mi integer ac neque
1357,Full manufacturer's warranty,183,93.85,tellus nulla ut erat id mauris vulputate elementum nullam varius nulla facilisi cras non velit nec nisi
1358,Standard Manufacturer's,183,61.63,ut nunc vestibulum ante ipsum primis in faucibus orci luctus et ultrices posuere
1359,Standard Manufacturer's,365,88.47,auctor gravida sem praesent id massa id nisl venenatis lacinia aenean
1360,Additional reseller's warranty,93,90.21,felis donec semper sapien a libero nam dui proin leo odio porttitor id consequat
1361,Manufacturer's special warranty,125,85.23,lacinia eget tincidunt eget tempus vel pede morbi porttitor lorem
1362,Manufacturer's special warranty,183,75.11,sit amet turpis elementum ligula vehicula consequat morbi a ipsum integer a nibh in quis justo maecenas
1363,Additional reseller's warranty,365,78.73,erat eros viverra eget congue eget semper rutrum nulla nunc purus
1364,Additional reseller's warranty,125,67.21,diam vitae quam suspendisse potenti nullam porttitor lacus at turpis donec posuere metus vitae
1365,Full manufacturer's warranty,125,62.45,quam suspendisse potenti nullam porttitor lacus at turpis donec posuere metus vitae ipsum aliquam non mauris morbi non lectus
1366,Standard Manufacturer's,548,79.54,nullam molestie nibh in lectus pellentesque at nulla suspendisse potenti cras in purus eu magna vulputate luctus cum sociis natoque
1367,Full manufacturer's warranty,93,61.54,maecenas pulvinar lobortis est phasellus sit amet erat nulla tempus vivamus in felis eu sapien cursus vestibulum proin
1368,Full manufacturer's warranty,548,73.43,in blandit ultrices enim lorem ipsum dolor sit amet consectetuer adipiscing elit proin interdum mauris non ligula pellentesque
1369,Additional reseller's warranty,548,80.04,duis aliquam convallis nunc proin at turpis a pede posuere
